,date,information,related
187,2023-05-03,"Headline: 10 Dividend Aristocrats For The Ultimate High-Yield SWAN Portfolio, source:SeekingAlpha, summary: 2023 recession is likely to be mild, but debt ceiling crisis means a 15% to 30% market correction is likely coming soon. Find out my 10 dividend aristocrat picks., Headline: Automatic Data Processing, Inc. (NASDAQ:ADP) Q3 2023 Earnings Call Transcript, source:Yahoo, summary: Automatic Data Processing, Inc. (NASDAQ:ADP) Q3 2023 Earnings Call Transcript April 26, 2023 Automatic Data Processing, Inc. beats earnings expectations. Reported EPS is $2.52, expectations were $2.45. Operator: Good morning. My name is Michelle and I will be your conference operator. At this time, I would like to welcome everyone to ADP’s Third Quarter Fiscal […], Headline: ADP National Employment Report: Private Sector Employment Increased by 296,000 Jobs in April; Annual Pay was Up 6.7%, source:Yahoo, summary: Private sector employment increased by 296,000 jobs in April and annual pay was up 6.7 percent year-over-year, according to the April ADP® National Employment Report™ produced by the ADP Research Institute® in collaboration with the Stanford Digital Economy Lab (""Stanford Lab"")., Headline: ADP® Celebrates Technology Innovation and Strategic Partners at 5th Annual ADP Marketplace Partner Summit, source:Yahoo, summary: ADP, a leading global technology company providing human capital management (HCM) solutions, today announced winners of several awards at the fifth annual ADP Marketplace Partner Summit, held May 1-3 in West Palm Beach, Florida. The event shared best practices, visions, client and sales insights, technology roadmaps and more to help advance the ADP Marketplace partner ecosystem., Headline: Flexspring Wins Top International Partner at the 2023 ADP Marketplace Partner Summit, source:Yahoo, summary: Flexspring, an ADP Marketplace Platinum Partner, has been recognized as the Top International Partner at the 2023 ADP Marketplace Partner Summit. Focusing on HR data integration, Flexspring provides custom-tailored and turnkey data connectors for ADP® and other software partners that can help HR departments save time and money., Headline: Automatic Data Processing Inc. stock falls Wednesday, still outperforms market, source:MarketWatch, summary: Shares of Automatic Data Processing Inc. slipped 0.26% to $215.98 Wednesday, on what proved to be an all-around grim trading session for the stock market,..., Headline: G-P Wins 2023 ADP Marketplace Sales Choice Award, source:Yahoo, summary: G-P (Globalization Partners), the pioneer and recognized leader of the global employment industry, today announced it has won the 2023 ADP Marketplace Sales Choice Award. G-P was selected as the winner by the ADP sales team, recognizing G-P Meridian Suite™ as the solution that resonates most with ADP clients and prospects that have a need for hiring global employees.",ADP
188,2023-05-04,"Headline: See Which Of The Latest 13F Filers Holds Automatic Data Processing, source:Preferred Stock Channel, summary: No summary, Headline: Automatic Data Processing Inc. stock underperforms Thursday when compared to competitors, source:MarketWatch, summary: Shares of Automatic Data Processing Inc. shed 1.00% to $213.81 Thursday, on what proved to be an all-around grim trading session for the stock market, with...",ADP
189,2023-05-05,"Headline: Dividend Growth Stock Watchlist - May 2023, source:SeekingAlpha, summary: There are 20 stocks on my dividend growth watchlist for May 2023. Click here to learn more about these stocks., Headline: My Dividend Growth Portfolio April Update - Dividend ETFs Are Looking Appealing, source:SeekingAlpha, summary: There are a lot of ok bargains available, but not a lot of great deals. This may be a time to consider ETFs to capture the broad value. Click here to read more., Headline: Automatic Data Processing Inc. stock rises Friday, still underperforms market, source:MarketWatch, summary: Shares of Automatic Data Processing Inc. inched 0.78% higher to $215.48 Friday, on what proved to be an all-around great trading session for the stock...",ADP
190,2023-05-06,"Headline: 5 Conservative And Cheap Dividend Stocks To Invest In - May 2023, source:Seeking Alpha, summary: No summary",ADP
191,2023-05-08,"Headline: NAWBO® and ADP Survey Showcases Opportunities to Help America's Underserved Populations, source:Yahoo, summary: Today, the National Association of Women Business Owners (NAWBO) and ADP released the results of a survey of women business owners. Nearly 92% of women-owned businesses are microbusinesses, businesses with fewer than 25 employees. While the businesses may be small, they provide the lion's share of the family income, with 63% of the business owners providing 50-100% of the household income. By giving these businesses the resources to grow, we will see an opportunity to increase wealth in our most, Headline: Automatic Data Processing Inc. stock underperforms Monday when compared to competitors, source:MarketWatch, summary: Shares of Automatic Data Processing Inc. slipped 0.56% to $214.27 Monday, on what proved to be an all-around mixed trading session for the stock market, with...",ADP
192,2023-05-09,"Headline: PayPal Holdings: Attractive On Any Signs Of Weakness, source:SeekingAlpha, summary: PayPal had a really solid quarter, but shares of the business moved lower after-hours because of weak near-term guidance. See why PYPL stock is a Buy., Headline: Automatic Data Processing Inc. stock falls Tuesday, still outperforms market, source:MarketWatch, summary: Shares of Automatic Data Processing Inc. sank 0.28% to $213.66 Tuesday, on what proved to be an all-around grim trading session for the stock market, with...",ADP
193,2023-05-10,"Headline: Dividend Growth 50: Adieu, And Thanks For The Lessons Learned, source:SeekingAlpha, summary: After 8 1/2 years, I've dropped the curtain on the real-money DG50 project. Read more to see 3 of my biggest lessons while managing the portfolio., Headline: Workday: Strong Competitive Advantage And Strong Reputation, source:SeekingAlpha, summary: Workday is still in its growing phase with strong revenues but not yet profitable. Check out why I'm neutral on WDAY stock., Headline: Automatic Data Processing Inc. stock underperforms Wednesday when compared to competitors despite daily gains, source:MarketWatch, summary: Shares of Automatic Data Processing Inc. inched 0.63% higher to $215.01 Wednesday, on what proved to be an all-around mixed trading session for the stock...",ADP
194,2023-05-11,"Headline: Automatic Data Processing a Top Socially Responsible Dividend Stock With 2.3% Yield (ADP), source:ETF Channel, summary: No summary, Headline: Automatic Data Processing Inc. stock falls Thursday, underperforms market, source:MarketWatch, summary: Shares of Automatic Data Processing Inc. slid 2.42% to $209.81 Thursday, on what proved to be an all-around rough trading session for the stock market, with...",ADP
195,2023-05-12,"Headline: Automatic Data Processing Inc. stock outperforms market on strong trading day, source:MarketWatch, summary: Shares of Automatic Data Processing Inc. rallied 1.40% to $212.74 Friday, on what proved to be an all-around poor trading session for the stock market, with...",ADP
196,2023-05-14,"Headline: Our Top 10 Dividend Growth Stocks - May 2023, source:SeekingAlpha, summary: This article focuses on DGI stocks that are likely to provide high rate of dividend growth rather than a high current yield. Read more to see the May 2023 review.",ADP
197,2023-05-15,"Headline: Automatic Data Processing Inc. stock outperforms competitors on strong trading day, source:MarketWatch, summary: Shares of Automatic Data Processing Inc. inched 0.78% higher to $214.39 Monday, on what proved to be an all-around great trading session for the stock...",ADP
198,2023-05-16,"Headline: Automatic Data Processing Inc. stock underperforms Tuesday when compared to competitors, source:MarketWatch, summary: Shares of Automatic Data Processing Inc. slid 0.96% to $212.34 Tuesday, on what proved to be an all-around poor trading session for the stock market, with...",ADP
199,2023-05-17,"Headline: 13 Blue-Chips For The Ultimate High-Yield Buffett-Style Dividend Aristocrat Portfolio, source:Seeking Alpha, summary: No summary, Headline: 11 Blue-Chips For The Ultimate High-Yield Buffett-Style Dividend Aristocrat Portfolio, source:SeekingAlpha, summary: The stock market will likely suffer a 22% to 40% correction this year. Here are 11 of the widest moat, Buffett-style dividend aristocrats for smart investors., Headline: 10 Dividend Growth Stocks For May 2022, source:SeekingAlpha, summary: Welcome to another edition of my monthly series presenting 10 high-quality picks in Dividend Radar. Click here to find out my ten picks., Headline: Automatic Data Processing Inc. stock rises Wednesday, still underperforms market, source:MarketWatch, summary: Shares of Automatic Data Processing Inc. inched 0.76% higher to $213.96 Wednesday, on what proved to be an all-around favorable trading session for the stock..., Headline: Selecting Dividend Aristocrats Using SCHD Methodology - May Update, source:SeekingAlpha, summary: I propose leveraging the stock selection criteria from SCHD's underlying index to build a portfolio with a subset of Dividend Aristocrats. Learn more here., Headline: So long, Great Resignation: ���The Big Stay` is the new workplace trend, this economist says, source:MarketWatch, summary: No summary",ADP
200,2023-05-18,"Headline: So long, Great Resignation: 'The Big Stay' is the new workplace trend, this economist says, source:MarketWatch, summary: Some data suggest workers are hunkering down and less likely to quit their jobs these days, Headline: Automatic Data Processing Inc. stock rises Thursday, still underperforms market, source:MarketWatch, summary: Shares of Automatic Data Processing Inc. inched 0.69% higher to $215.43 Thursday, on what proved to be an all-around great trading session for the stock..., Headline: ADP to Present at Upcoming Investor Conferences, source:Yahoo, summary: ADP (Nasdaq: ADP), a leading global technology company providing human capital management (HCM) solutions, today announced that members of its management team will present at the following conferences:",ADP
201,2023-05-19,"Headline: 3 Dividend-Paying Tech Stocks to Buy in May, source:Yahoo, summary: Technology stocks get a reputation as high-flying, high-risk bold investments, but that's not always true.  Plenty of technology companies with dependable, steady business models pump out cash that gets funneled to shareholders as dividends.  Long-term dividend investors should diversify their portfolios to reflect as many industries as possible, including sprinkling in some tech names., Headline: Automatic Data Processing Inc. stock rises Friday, outperforms market, source:MarketWatch, summary: Shares of Automatic Data Processing Inc. inched 0.35% higher to $216.18 Friday, on what proved to be an all-around grim trading session for the stock market,...",ADP
202,2023-05-20,"Headline: So long, Great Resignation: ‘The Big Stay’ is the new workplace trend, this economist says, source:MarketWatch, summary: No summary",ADP
203,2023-05-22,"Headline: Automatic Data Processing, Inc. (ADP) Presents at 51st Annual J.P. Morgan Global Technology, Media and Communications Conference (Transcript), source:SeekingAlpha, summary: Automatic Data Processing, Inc. (NASDAQ:NASDAQ:ADP) 51st Annual J.P., Headline: Automatic Data Processing Inc. stock outperforms competitors on strong trading day, source:MarketWatch, summary: Shares of Automatic Data Processing Inc. inched 0.16% higher to $216.53 Monday, on what proved to be an all-around mixed trading session for the stock...",ADP
204,2023-05-23,"Headline: Automatic Data Processing Inc. stock outperforms market despite losses on the day, source:MarketWatch, summary: No summary",ADP
205,2023-05-24,"Headline: 10 A-Rated Dividend Aristocrats For The Ultimate High-Yield SWAN Portfolio, source:SeekingAlpha, summary: The debt ceiling crisis is down to the wire. We're possibly already out of time to prevent default but don't know it. Click for our strategy for these times., Headline: Automatic Data Processing: Solid Company But Overvalued Right Now, source:SeekingAlpha, summary: Automatic Data Processing was trading noticeably expensively in recent years, with an average ten-year PE of 29. Click here to read my analysis of ADP stock., Headline: Automatic Data Processing Inc. stock underperforms Thursday when compared to competitors, source:MarketWatch, summary: No summary",ADP
206,2023-05-26,"Headline: Automatic Data Processing: Impeccable Fundamentals With Solid Returns, source:SeekingAlpha, summary: Automatic Data Processing maintains a solid FY 2023 with its steady revenue growth and margin expansion. See why we believe ADP stock is a buy., Headline: Automatic Data Processing Inc. stock rises Friday, still underperforms market, source:MarketWatch, summary: Shares of Automatic Data Processing Inc. inched 0.99% higher to $212.48 Friday, on what proved to be an all-around favorable trading session for the stock...",ADP
207,2023-05-29,"Headline: Noteworthy Tuesday Option Activity: ADP, NEE, CSCO, source:Stock Options Channel, summary: No summary",ADP
208,2023-05-30,"Headline: Tracking Terry Smith's Fundsmith 13F Portfolio - Q1 2023 Update, source:SeekingAlpha, summary: Fundsmith's 13F portfolio value increased by 6% to $23.17B in Q1 2023. Read more to see the portfolio's full Q1 2023 update., Headline: Automatic Data Processing Inc. stock falls Tuesday, underperforms market, source:MarketWatch, summary: Shares of Automatic Data Processing Inc. slipped 1.11% to $210.12 Tuesday, on what proved to be an all-around mixed trading session for the stock market,...",ADP
209,2023-05-31,"Headline: ADP Canada Happiness@Work Index: Canadian Workers Feel Happier in May, source:Yahoo, summary: The ADP Canada monthly Happiness@Work Index (""Index"") for May 2023 reveals Gen Zs are bouncing back from their lowest score to date in April. Those located in Alberta, on the contrary, are showing the steepest month-over-month decrease in their Work Happiness Scores., Headline: Automatic Data Processing, Inc. (ADP) Presents at TD Cowen 51st Annual TMT Conference (Transcript), source:SeekingAlpha, summary: Automatic Data Processing, Inc. (NASDAQ:NASDAQ:ADP) TD Cowen 51st Annual TMT Conference May 31, 2023 8:30 AM ETCompany ParticipantsJoe DeSilva - President of Global SalesConference Call..., Headline: My Best Dividend Aristocrats For June 2023, source:SeekingAlpha, summary: Three strategies for identifying winning aristocrats include undervalued stocks, fastest expected growth, and a blend of the two. Learn more about them here., Headline: Automatic Data Processing Inc. stock outperforms market despite losses on the day, source:MarketWatch, summary: Shares of Automatic Data Processing Inc. shed 0.54% to $208.99 Wednesday, on what proved to be an all-around dismal trading session for the stock market,...",ADP
210,2023-06-01,"Headline: Booming ADP Employment, Stable Unemployment Claims Set Stage For Friday's Key May Jobs Report, source:Benzinga, summary: No summary, Headline: ADP National Employment Report: Private Sector Employment Increased by 278,000 Jobs in May; Annual Pay was Up 6.5%, source:Yahoo, summary: Private sector employment increased by 278,000 jobs in May and annual pay was up 6.5 percent year-over-year, according to the May ADP® National Employment Report™ produced by the ADP Research Institute® in collaboration with the Stanford Digital Economy Lab (""Stanford Lab"")., Headline: Automatic Data Processing Inc. stock outperforms competitors on strong trading day, source:MarketWatch, summary: Shares of Automatic Data Processing Inc. rallied 1.35% to $211.81 Thursday, on what proved to be an all-around great trading session for the stock market,..., Headline: The U.S. labor market is strong. Job hopping for a big bump in pay, however, just got a lot trickier., source:MarketWatch, summary: No summary",ADP
211,2023-06-02,"Headline: ADP initiated with a Neutral at UBS, source:Thefly.com, summary: No summary, Headline: Caterpillar leads weekly gains in large-cap industrials, source:Seeking Alpha, summary: No summary, Headline: What 5 Analyst Ratings Have To Say About Automatic Data Processing, source:Benzinga, summary: No summary, Headline: Gold Bull Peter Schiff Not Impressed About Perceived Safety In Treasuries — 'You Don't Understand The Real Problem', source:Benzinga, summary: No summary, Headline: UBS Initiates Coverage of Automatic Data Processing (ADP) with Neutral Recommendation, source:Fintel, summary: nan, Headline: S&P 500 Dividend Aristocrats List: Sorted By Hedge Fund Popularity, source:Yahoo, summary: In this article, we will discuss the best dividend aristocrat stocks sorted by hedge fund popularity. You can skip our detailed analysis of dividend aristocrats and their past performance, and go directly to read S&P 500 Dividend Aristocrats List: Top 10 Among Hedge Funds. Dividend aristocrats are companies in the S&P 500 that have a […], Headline: Automatic Data Processing Inc. stock outperforms market on strong trading day, source:MarketWatch, summary: Shares of Automatic Data Processing Inc. advanced 2.22% to $216.52 Friday, on what proved to be an all-around great trading session for the stock market,...",ADP
212,2023-06-03,"Headline: How To Build Wealth: Buy Low And Sell High Consistently, source:SeekingAlpha, summary: The strategy discussed is about buying or selling small quantities of shares when certain thresholds are met. Click here to read more about that strategy., Headline: Dividend Champion, Contender, And Challenger Highlights: Week Of June 4, source:SeekingAlpha, summary: A weekly summary of dividend activity for Dividend Champions, Contenders, and Challengers. Companies which changed their dividends. Click here to read the complete list.",ADP
213,2023-06-05,"Headline: As Couche-Tard Continues to Trim the Fat, Investors Should See It as Good News, source:Fintel, summary: nan, Headline: Monday’s Top Analyst Upgrades and Downgrades: Apple, Dell, Dollar General, Macy’s, SentinelOne, Warner Music, Xcel Energy and More, source:247WallSt, summary: No summary, Headline: Here's How Much You Would Have Made Owning Automatic Data Processing Stock In The Last 20 Years, source:Benzinga, summary: No summary, Headline: Automatic Data Processing Inc. stock outperforms market despite losses on the day, source:MarketWatch, summary: Shares of Automatic Data Processing Inc. dropped 0.13% to $216.24 Monday, on what proved to be an all-around rough trading session for the stock market, with..., Headline: 10 Technology Dividend Stocks Billionaires Are Loading Up On, source:Yahoo, summary: In this article, we discuss 10 technology dividend stocks billionaires are loading up on. You can skip our detailed analysis of the tech sector and dividend stocks, and go directly to read 5 Technology Dividend Stocks Billionaires Are Loading Up On. The tech sector is on a winning spree this year after recording one of […]",ADP
214,2023-06-06,"Headline: Ex-Dividend Reminder: Automatic Data Processing, NetEase and Rogers Communications, source:Dividend Channel, summary: No summary, Headline: Automatic Data Processing Inc. stock rises Tuesday, still underperforms market, source:MarketWatch, summary: Shares of Automatic Data Processing Inc. inched 0.23% higher to $216.74 Tuesday, on what proved to be an all-around great trading session for the stock...",ADP
215,2023-06-07,"Headline: Automatic Data Processing Inc. stock falls Wednesday, still outperforms market, source:MarketWatch, summary: Shares of Automatic Data Processing Inc. sank 0.12% to $216.47 Wednesday, on what proved to be an all-around mixed trading session for the stock market, with...",ADP
216,2023-06-08,"Headline: Automatic Data Processing, Inc. (ADP) Baird's 2023 Global Consumer, Technology and Services Conference (Transcript), source:SeekingAlpha, summary: Automatic Data Processing, Inc. (NASDAQ:NASDAQ:ADP) Bairdâs 2023 Global Consumer, Technology and Services Conference Call June 8, 2023 8:30 AM ETCompany ParticipantsDon McGuire - Chief..., Headline: Automatic Data Processing Inc. stock underperforms Thursday when compared to competitors, source:MarketWatch, summary: Shares of Automatic Data Processing Inc. slid 0.01% to $215.19 Thursday, on what proved to be an all-around favorable trading session for the stock market,...",ADP
217,2023-06-09,"Headline: BlackRock Helps Build Over $2 Billion in Savings for Everyday Americans through Philanthropic Emergency Savings Initiative, source:Business Wire, summary: No summary, Headline: Automatic Data Processing Inc. stock rises Friday, still underperforms market, source:MarketWatch, summary: Shares of Automatic Data Processing Inc. inched 0.01% higher to $215.22 Friday, on what proved to be an all-around positive trading session for the stock..., Headline: 4 Factor Dividend Growth Portfolio - Passively Outpacing The Market, source:SeekingAlpha, summary: The 4-factor dividend growth portfolio is a strategy that leverages the stock selection process of SCHD, with a few minor twists. Click for my exclusive picks.",ADP
218,2023-06-10,"Headline: 5 Relatively Safe And Cheap Dividend Stocks To Invest In - June 2023, source:SeekingAlpha, summary: We go over our filtering process to select just five conservative DGI stocks from more than 7,500 companies that are traded on U.S. exchanges. Read more here.",ADP
219,2023-06-13,"Headline: Nicholas Ward's Dividend Growth Portfolio: April And May Review, source:SeekingAlpha, summary: My passive income stream increased by 25.59% YoY in April 2023 and 40.02% YoY in May 2023, with a YTD growth of 29.99%. See the full April & May update here., Headline: Automatic Data Processing Inc. stock outperforms competitors on strong trading day, source:MarketWatch, summary: Shares of Automatic Data Processing Inc. inched 0.98% higher to $220.49 Tuesday, on what proved to be an all-around positive trading session for the stock...",ADP
220,2023-06-14,"Headline: Automatic Data Processing Inc. stock underperforms Wednesday when compared to competitors, source:MarketWatch, summary: Shares of Automatic Data Processing Inc. slipped 2.00% to $216.09 Wednesday, on what proved to be an all-around mixed trading session for the stock market,...",ADP
221,2023-06-15,"Headline: DBS Remains a Hold on Automatic Data Processing (ADP), source:TipRanks, summary: No summary, Headline: Automatic Data Processing Inc. stock outperforms market on strong trading day, source:MarketWatch, summary: Shares of Automatic Data Processing Inc. rallied 2.26% to $220.97 Thursday, on what proved to be an all-around positive trading session for the stock market,...",ADP
222,2023-06-16,"Headline: Zacks Industry Outlook Highlights Automatic Data Processing, Paychex and Genpact, source:Yahoo, summary: Automatic Data Processing, Paychex and Genpact are part of the Zacks Industry Outlook article., Headline: Automatic Data Processing Inc. stock outperforms competitors on strong trading day, source:MarketWatch, summary: Shares of Automatic Data Processing Inc. inched 0.16% higher to $221.32 Friday, on what proved to be an all-around poor trading session for the stock market,...",ADP
223,2023-06-19,"Headline: Automatic Data Processing Is Now Undervalued, source:Yahoo, summary: A look at why investors should take advantage of the year-to-date decline",ADP
224,2023-06-20,"Headline: Canadian Workplace Gender Pay Gap May Be Slowly Closing: ADP Survey, source:Yahoo, summary: A new survey by ADP Canada, conducted with Maru Public Opinion, shows that the gender pay gap in Canada may be slowly closing, but working Canadians who self-identify as women still report, on average, earning 21 per cent less than workers who self-identify as men, a 3 percentage points decrease from 20211., Headline: Automatic Data Processing Inc. stock falls Tuesday, still outperforms market, source:MarketWatch, summary: Shares of Automatic Data Processing Inc. sank 0.47% to $220.28 Tuesday, on what proved to be an all-around dismal trading session for the stock market, with..., Headline: Commit To Purchase Automatic Data Processing At $165, Earn 3.1% Using Options, source:Stock Options Channel, summary: No summary",ADP
225,2023-06-21,"Headline: ADP long-term outlook remains positive, says Baird, source:Thefly.com, summary: No summary, Headline: Paycor Is Poised For Success In The HCM Market, source:SeekingAlpha, summary: Paycor offers a comprehensive platform encompassing payroll, workforce management, talent management, and other HCM applications. See why PYCR is a buy., Headline: Automatic Data Processing: A Profitable and Growing Business, source:Yahoo, summary: A robust business model that has a wide economic moat and delivers high profits and growth, Headline: Automatic Data Processing Inc. stock rises Wednesday, outperforms market, source:MarketWatch, summary: Shares of Automatic Data Processing Inc. inched 0.13% higher to $220.56 Wednesday, on what proved to be an all-around rough trading session for the stock..., Headline: P/E Ratio Insights for Automatic Data Processing, source:Benzinga, summary: No summary, Headline: What Does Automatic Data Processing's Debt Look Like?, source:Benzinga, summary: No summary",ADP
