,date,information,related
156,2023-03-28,"Headline: Selecting Dividend Aristocrats Using SCHD Methodology - Mounting A Comeback, source:SeekingAlpha, summary: I propose leveraging the stock selection criteria from the underlying index of SCHD to build a portfolio with a subset of Dividend Aristocrats. Read more here.",ADP
157,2023-03-29,"Headline: ADP Canada Happiness@Work Index Provides New Monthly Satisfaction Measure for the Canadian Workforce, source:Yahoo, summary: TORONTO, March 29, 2023--The ADP Canada Happiness@Work Index (""Index""), is a new monthly measure that examines the happiness of Canadians in the workplace, including employees and self-employed individuals. Conducted in collaboration with Maru Public Opinion, the Index explores workplace satisfaction across Canada, expressed as a score out of 10, and tracks positive or negative changes over time., Headline: 15 Biggest SaaS Companies in the World, source:Yahoo, summary: In this article, we discuss the 15 biggest SaaS companies in the world. To skip the detailed analysis of the SaaS market, go directly to the 5 Biggest SaaS Companies in the World. SaaS refers to a software delivery and licensing method in which software is accessed online via a subscription rather than being bought and […], Headline: The AMR Craton Index: Introduction To Holdings And Backtesting Data, source:SeekingAlpha, summary: This portfolio uses historical performance and qualitative business traits to determine low-risk assets. Read more here., Headline: Automatic Data Processing Inc. stock outperforms market on strong trading day, source:MarketWatch, summary: Shares of Automatic Data Processing Inc. rose 2.69% to $219.90 Wednesday, on what proved to be an all-around positive trading session for the stock market,..., Headline: 14 Best Affordable Tech Stocks to Buy Now, source:Yahoo, summary: In this article, we take a look at 14 best affordable tech stocks to buy now. If you want to see more best affordable tech stocks to buy now, go directly to 5 Best Affordable Tech Stocks to Buy Now. If a stock is priced at $100 per share or even $200 a share, more […]",ADP
158,2023-03-30,"Headline: 7 Growth Stocks That Pay Generous Dividends, source:Yahoo, summary: When it comes to dividend-paying growth stocks, it can be difficult to find names that are both high-growth and high-yield. This makes sense, given that companies with high dividend yields are typically paying out a large portion of their earnings as a dividend, leaving little capital to fund growth. That said, there are quite a few stocks that, while not exactly “high-yield,” have annual yields above that of the S&P 500 (1.69%), plus offer the opportunity for growth. Hitting this “sweet spot,”, Headline: My Best Dividend Aristocrats For April 2023, source:SeekingAlpha, summary: NOBL gave up a big chunk of its January gains in February, finishing the month down 2.36%. March sees the ETF tumble some more as its down 1.88% through 3/29. Read more here., Headline: Automatic Data Processing Inc. stock falls Thursday, underperforms market, source:MarketWatch, summary: Shares of Automatic Data Processing Inc. slipped 0.19% to $219.49 Thursday, on what proved to be an all-around positive trading session for the stock market,...",ADP
159,2023-03-31,"Headline: General Electric leads Q1 gains among big-cap industrials with 46% jump, source:Seeking Alpha, summary: No summary, Headline: ADP price target lowered to $235 from $260 at Citi, source:Thefly.com, summary: No summary, Headline: Automatic Data Processing Inc. stock rises Friday, still underperforms market, source:MarketWatch, summary: Shares of Automatic Data Processing Inc. rallied 1.43% to $222.63 Friday, on what proved to be an all-around favorable trading session for the stock market,..., Headline: Compounders And Dividends: March 2023 Portfolio Update, source:SeekingAlpha, summary: My year over year dividend income was up 59.8%, while the quarter over quarter dividend income was down 0.55%. Click here to read my recent update and analysis.",ADP
160,2023-04-03,"Headline: ADP downgraded to Underperform from Neutral at BofA, source:Thefly.com, summary: No summary, Headline: Tesla, Micron and WWE fall premarket; McDonald's, Li Auto rise, source:Yahoo, summary: By Peter Nurse, Headline: B of A Securities Downgrades Automatic Data Processing (ADP), source:Fintel, summary: nan, Headline: Street Wrap: Today`s Top 15 Upgrades, Downgrades, Initiations, source:Thefly.com, summary: No summary, Headline: Stocks making the biggest moves midday: Tesla, Marathon Oil, WWE, UnitedHealth and more, source:CNBC, summary: These are the stocks posting the largest moves midday., Headline: Automatic Data Processing Inc. stock falls Monday, underperforms market, source:MarketWatch, summary: Shares of Automatic Data Processing Inc. slipped 2.61% to $216.81 Monday, on what proved to be an all-around great trading session for the stock market, with...",ADP
161,2023-04-04,"Headline: Automatic Data Processing Inc. stock underperforms Tuesday when compared to competitors, source:MarketWatch, summary: Shares of Automatic Data Processing Inc. slipped 1.28% to $214.04 Tuesday, on what proved to be an all-around grim trading session for the stock market, with...",ADP
162,2023-04-05,"Headline: ADP National Employment Report: Private Sector Employment Increased by 145,000 Jobs in March; Annual Pay was Up 6.9%, source:Yahoo, summary: Private sector employment increased by 145,000 jobs in March and annual pay was up 6.9 percent year-over-year, according to the March ADP® National Employment Report™ produced by the ADP Research Institute® in collaboration with the Stanford Digital Economy Lab (""Stanford Lab"")., Headline: Automatic Data Processing Inc. stock falls Wednesday, underperforms market, source:MarketWatch, summary: Shares of Automatic Data Processing Inc. slid 0.41% to $213.17 Wednesday, on what proved to be an all-around mixed trading session for the stock market, with...",ADP
163,2023-04-06,"Headline: Deere`s 11% weekly loss is biggest among large-cap industrials, source:Seeking Alpha, summary: No summary, Headline: Nicholas Ward`s Dividend Growth Portfolio: Special Fixed Income Edition, source:Seeking Alpha, summary: No summary, Headline: Buy/Sell: Wall Street`s top 10 stock calls this week, source:Thefly.com, summary: No summary, Headline: Automatic Data Processing Inc. stock outperforms competitors on strong trading day, source:MarketWatch, summary: Shares of Automatic Data Processing Inc. rallied 1.38% to $216.11 Thursday, on what proved to be an all-around favorable trading session for the stock..., Headline: Nicholas Ward's Dividend Growth Portfolio: Special Fixed Income Edition, source:SeekingAlpha, summary: My passive income stream grew by 22.63% in February and by 46.87% in March. Read more as I review my February and March results in this piece., Headline: Robert Olstein`s Olstein Funds 2022 Semi-Annual Shareholder Letter, source:GuruFocus, summary: No summary",ADP
164,2023-04-07,"Headline: The 3 Best Dividend Stocks to Buy for April, source:Yahoo, summary: Investing in dividend stocks is vital to many long-term investors. Dividends are a discretionary distribution of profits paid to investors, usually by publicly-traded companies. One reason to buy dividend stocks in April is that many firms will pay dividends during the month. That is true of the shares listed below. Dividends are, as mentioned above, discretionary. But realistically, once a company initiates a dividend policy, it will likely continue to do so. Further, those dividend-bearing com",ADP
165,2023-04-08,"Headline: 5 Relatively Safe And Cheap Dividend Stocks To Invest In - April 2023, source:SeekingAlpha, summary: This article is part of our monthly series where we highlight five companies that are large-cap, relatively safe and dividend-paying. Read more here., Headline: Grab These 5 Top-Notch Stocks With Market-Beating Yields On Sale, source:TalkMarkets, summary: No summary",ADP
166,2023-04-09,"Headline: My Dividend Growth Portfolio March Update: Still Accumulating Cash, source:SeekingAlpha, summary: Income growth is projected at 7.9% for the year, up from last month. This was primarily due to including an estimated return on cash. Click here for a detailed analysis., Headline: Automatic Data Processing Inc. stock outperforms competitors despite losses on the day, source:MarketWatch, summary: No summary",ADP
167,2023-04-10,"Headline: Tracking Terry Smith`s Fundsmith 13F Portfolio - Q4 2022 Update, source:Seeking Alpha, summary: No summary, Headline: Tracking Terry Smith's Fundsmith 13F Portfolio - Q4 2022 Update, source:SeekingAlpha, summary: nan, Headline: Automatic Data Processing Lacks Upside Energy, source:Yahoo, summary: The charts of the cloud-based human resources and payroll company point to a stock that likely is heading lower., Headline: ADP: High-Quality Company Enjoying Low Unemployment, source:Yahoo, summary: The large payroll service provider is a beneficiary of higher interest rates and high employment, Headline: Automatic Data Processing Inc. stock outperforms competitors on strong trading day, source:MarketWatch, summary: No summary",ADP
168,2023-04-11,"Headline: Automatic Data Processing: A Dividend Growth Stock, source:Yahoo, summary: The business services company offers a modest but growing dividend with the prospect of capital gains, Headline: Automatic Data Processing declares $1.25 dividend, source:Seeking Alpha, summary: No summary, Headline: Automatic Data Processing Inc. stock rises Wednesday, outperforms market, source:MarketWatch, summary: No summary",ADP
169,2023-04-12,"Headline: Automatic Data Processing: An Excellent Company At A Lower Price, source:SeekingAlpha, summary: Automatic Data Processing has become a global leader in human capital management and offers excellent customer service. See why I rate ADP stock a hold., Headline: ADP Declares Regular Quarterly Dividend, source:Yahoo, summary: The board of directors of Automatic Data Processing, Inc. (Nasdaq: ADP) has declared a regular quarterly dividend of $1.25 per share payable July 1, 2023 to shareholders of record on June 9, 2023.",ADP
170,2023-04-13,"Headline: Automatic Data Processing Inc. stock rises Thursday, still underperforms market, source:MarketWatch, summary: Shares of Automatic Data Processing Inc. inched 0.76% higher to $217.25 Thursday, on what proved to be an all-around great trading session for the stock...",ADP
171,2023-04-14,"Headline: 2 Dividend Stocks That Will Pay You for Life, source:Yahoo, summary: These companies have raised their dividends annually for a combined total of nearly 100 consecutive years., Headline: Automatic Data Processing Inc. stock falls Friday, underperforms market, source:MarketWatch, summary: Shares of Automatic Data Processing Inc. shed 0.71% to $215.70 Friday, on what proved to be an all-around poor trading session for the stock market, with the..., Headline: Automatic Data Processing (ADP) Declares $1.25 Dividend, source:Fintel, summary: nan",ADP
172,2023-04-15,"Headline: Our Top 10 Dividend Growth Stocks - April 2023, source:SeekingAlpha, summary: nan",ADP
173,2023-04-16,"Headline: 11 Best Tech Stocks to Buy On the Dip, source:Yahoo, summary: In this article, we will take a look at the top 11 best tech stocks to buy on the dip. To see more such companies, go directly to 5 Best Tech Stocks to Buy On the Dip. Tech stocks have showed remarkable resilience in 2023 in the face of rising interest rates and an uncertain […]",ADP
174,2023-04-17,"Headline: Automatic Data Processing Inc. stock outperforms market on strong trading day, source:MarketWatch, summary: Shares of Automatic Data Processing Inc. rose 1.14% to $218.16 Monday, on what proved to be an all-around favorable trading session for the stock market,...",ADP
175,2023-04-18,"Headline: Will Insperity Feel Labor Market Crumble In 2023?, source:SeekingAlpha, summary: nan, Headline: Automatic Data Processing Inc. stock underperforms Tuesday when compared to competitors, source:MarketWatch, summary: Shares of Automatic Data Processing Inc. slipped 0.39% to $217.32 Tuesday, on what proved to be an all-around mixed trading session for the stock market,...",ADP
176,2023-04-19,"Headline: ADP Research Institute® Global Study Uncovers A Renewed Desire for Career Progression within an Evolving Workplace Environment in ""People at Work 2023: A Global Workforce View"", source:Yahoo, summary: As the world of work continues to adjust to the pandemic's lingering effects on the global labor market, workers reveal they want, and need, more from their employer in the latest ""People at Work 2023: A Global Workforce View"" study from ADP Research Institute (ADPRI). The annual global study identifies and explores employees' attitudes toward the current world of work, what they expect from the workplace of the future, and points to the initiatives and best practices employers are developing to, Headline: Here’s Why Madison Sustainable Equity Fund Sold Automatic Data Processing (ADP), source:Yahoo, summary: Madison Investments, an investment advisor, released its “Madison Sustainable Equity Fund” first quarter 2023 investor letter. A copy of the same can be downloaded here. In the first quarter, the fund’s performance lagged behind the S&P 500 Index, which returned 7.5% in the quarter, with a very narrow market. Both Sector Allocation and Stock Selection affected […], Headline: 4-Factor Dividend Growth Portfolio - Sour Month, source:SeekingAlpha, summary: nan, Headline: Automatic Data Processing Inc. stock falls Wednesday, underperforms market, source:MarketWatch, summary: Shares of Automatic Data Processing Inc. sank 0.13% to $217.04 Wednesday, on what proved to be an all-around dismal trading session for the stock market,...",ADP
177,2023-04-20,"Headline: Automatic Data Processing`s Resilience And Digital Transformation, source:Seeking Alpha, summary: No summary, Headline: Automatic Data Processing's Resilience And Digital Transformation, source:SeekingAlpha, summary: nan, Headline: Americans are expecting a 6.7% wage hike this year: ADP report, source:MarketWatch, summary: Workers may be worried about layoffs, but they also can put stock in the fact they received an average 6.5% salary increase in 2022, according to ADP., Headline: Automatic Data Processing Inc. stock falls Thursday, underperforms market, source:MarketWatch, summary: Shares of Automatic Data Processing Inc. slipped 0.65% to $215.62 Thursday, on what proved to be an all-around grim trading session for the stock market,..., Headline: Automatic Data Processing Inc. stock underperforms Friday when compared to competitors, source:MarketWatch, summary: No summary",ADP
178,2023-04-21,"Headline: How big a pay hike are you expecting this year? Americans say they anticipate a 6.7% raise., source:MarketWatch, summary: No summary, Headline: Earnings Week Ahead: Amazon, Meta Platforms, Alphabet, Coca-Cola, Boeing, and more, source:Seeking Alpha, summary: No summary, Headline: What Awaits Automatic Data Processing (ADP) in Q3 Earnings?, source:Yahoo, summary: Automatic Data Processing's (ADP) revenues and earnings are likely to have increased in the third quarter of fiscal 2023., Headline: Top 15 Cloud Computing Companies in the World, source:Yahoo, summary: In this piece, we will take a look at the top 15 cloud computing companies in the world. For more companies head on over to Top 5 Cloud Computing Companies in the World. The growth of technology has created new markets and changed the manner in which people live their lives and businesses run their […]",ADP
179,2023-04-23,"Headline: 7 Tech Stocks to Buy Now and Hold Forever, source:Yahoo, summary: After a disastrous year to forget, some of the best tech stocks to buy have kicked off a comeback year. Better, these beaten-down stocks make for great long-term, core portfolio positions — each a high-quality tech company, with deep economic moats. In fact, with strong track records of steady, consistent growth, over time they are poised to continue appreciating in value at a more-than-satisfactory clip. In some cases, these blue-chip tech names also provide investors with dividends. These prov, Headline: Automatic Data Processing Inc. stock underperforms Monday when compared to competitors despite daily gains, source:MarketWatch, summary: No summary",ADP
180,2023-04-24,"Headline: 15 Best Dividend Stocks To Buy and Hold, source:Yahoo, summary: In this article, we discuss 15 best dividend stocks to buy and hold. You can skip our detailed analysis of dividend stocks and their performance over the years, and go directly to read 5 Best Dividend Stocks To Buy and Hold. Growth stocks were all the rage in the mid-20th century because they offered more […], Headline: Selecting Dividend Aristocrats Using SCHD Methodology - Winning In April, source:SeekingAlpha, summary: nan",ADP
181,2023-04-25,"Headline: Notable earnings before Wednesday`s open, source:Seeking Alpha, summary: No summary, Headline: Automatic Data Processing Q3 2023 Earnings Preview, source:Seeking Alpha, summary: No summary, Headline: 25 Biggest Cloud Providers by Revenue, source:Yahoo, summary: In this piece, we will take a look at the 25 largest cloud providers by revenue. For more companies, head on over to 5 Biggest Cloud Providers by Revenue. The boom in the Internet and the rise of computing have provided firms with a variety of new mediums to do business. While traditional businesses were […], Headline: Automatic Data Processing Inc. stock underperforms Tuesday when compared to competitors, source:MarketWatch, summary: Shares of Automatic Data Processing Inc. slipped 1.75% to $211.69 Tuesday, on what proved to be an all-around poor trading session for the stock market, with..., Headline: 15 Best Large-Cap Dividend Growth Stocks To Buy Now, source:Yahoo, summary: In this article, we discuss 15 best large-cap dividend growth stocks to buy now. You can skip our detailed analysis of dividend stocks and their performance in the past, and go directly to read 5 Best Large-Cap Dividend Growth Stocks To Buy Now. The performance of large-cap stocks remained strong over the years. According to […], Headline: GLOBAL BRIEFING: Alphabet revenue up; Microsoft gets boost from cloud, source:Alliance News, summary: No summary",ADP
182,2023-04-26,"Headline: ADP reports Q3 EPS $2.52, consensus $2.45, source:Thefly.com, summary: No summary, Headline: ADP narrows FY23 EPS growth view to up 16%-17% from 15%-17%, source:Thefly.com, summary: No summary, Headline: Automatic Data Processing Non-GAAP EPS of $2.52 beats by $0.08, revenue of $4.9B beats by $20M, source:Seeking Alpha, summary: No summary, Headline: ADP: Fiscal Q3 Earnings Snapshot, source:Associated Press, The, summary: No summary, Headline: ADP stock drops toward a 10-month low after human resources outsourcing company lifts profit growth outlook but keeps revenue growth view intact, source:MarketWatch, summary: Automatic Data Processing Inc. reported Wednesday fiscal third-quarter earnings that topped expectations, and nudged up its full-year profit outlook while..., Headline: Mizuho Securities Keeps Their Buy Rating on Automatic Data Processing (ADP), source:TipRanks, summary: No summary, Headline: ADP backs yearly revenue guidance after third-quarter climb, source:Alliance News, summary: No summary, Headline: ADP Reports Third Quarter Fiscal 2023 Results, source:Yahoo, summary: ADP (Nasdaq: ADP), a leading global technology company providing human capital management (HCM) solutions, today announced its third quarter fiscal 2023 financial results along with its revised fiscal 2023 outlook through an earnings release available on the company's website at investors.adp.com/events-and-presentations. This earnings release will also be furnished to the Securities and Exchange Commission (SEC) on a Current Report on Form 8-K and available at sec.gov., Headline: Automatic Data Processing slightly increases FY2023 earnings guidance after Q3 beat, source:Seeking Alpha, summary: No summary, Headline: Automatic Data Processing, Inc. (ADP) Q3 2023 Earnings Call Transcript, source:SeekingAlpha, summary: Automatic Data Processing, Inc. (NASDAQ:NASDAQ:ADP) Q3 2023 Earnings Conference Call April 26, 2023 8:30 AM ETCompany ParticipantsDanny Hussain - Vice President, Investor RelationsMaria..., Headline: Automatic Data Processing, Inc. 2023 Q1 - Results - Earnings Call Presentation, source:SeekingAlpha, summary: The following slide deck was published by Automatic Data Processing, Inc., Headline: My Best Dividend Aristocrats For May 2023, source:SeekingAlpha, summary: NOBL saw a comeback in March finishing the month up 0.99%, the ETF is up 1.79% after Q1 2023. Click here to read what investors need to know., Headline: ADP Canada Happiness@Work Index Shows Gen Z Feeling Less Happy in April, source:Yahoo, summary: The ADP Canada Happiness@Work Index (""Index""), is a monthly measure that examines the happiness of Canadians in the workplace, including employees and self-employed individuals., Headline: Automatic Data Processing Inc. stock falls Wednesday, underperforms market, source:MarketWatch, summary: Shares of Automatic Data Processing Inc. slipped 0.41% to $210.83 Wednesday, on what proved to be an all-around dismal trading session for the stock market,..., Headline: Automatic Data Processing (ADP) Q3 Earnings Beat, Up Y/Y, source:Yahoo, summary: Automatic Data Processing's (ADP) revenues and earnings grow year over year., Headline: ADP Q1 Highlights: Beats Expectations, Raises FY23 EPS Outlook, source:Yahoo, summary: Automatic Data Processing, Inc (NASDAQ: ADP) reported third-quarter FY23 revenue growth of 10% year-on-year to $4.93 billion, beating the consensus of $4.88 billion. Employer services revenue rose 11% Y/Y to $3.34 billion, and PEO services revenue grew 5% Y/Y to $1.59 billion. Non-GAAP EPS of $2.52 beat the consensus of $2.45. Adjusted EBIT margin expanded by 110 bps to 27.8%. ADP held $1.83 billion in cash and equivalents. CEO Maria Black said, ""Our innovative HCM solutions continue to meet and",ADP
183,2023-04-27,"Headline: Analysts Conflicted on These Technology Names: Automatic Data Processing (ADP), Wolfspeed (WOLF) and KLA (KLAC), source:TipRanks, summary: No summary, Headline: Q3 2023 Automatic Data Processing Inc Earnings Call, source:Yahoo, summary: Q3 2023 Automatic Data Processing Inc Earnings Call, Headline: ADP price target lowered to $235 from $249 at Baird, source:Thefly.com, summary: No summary, Headline: New Buy Rating for Automatic Data Processing (ADP), the Technology Giant, source:TipRanks, summary: No summary, Headline: Get Ready To Back Up The Truck On 10 Coiled-Spring Dividend Aristocrats, source:SeekingAlpha, summary: The mildest recession in history is expected within a few months. Check out the ten fastest-growing aristocrats that are reasonably priced today., Headline: ADP price target lowered to $213 from $234 at Deutsche Bank, source:Thefly.com, summary: No summary, Headline: Deutsche Bank Maintains Automatic Data Processing (ADP) Hold Recommendation, source:Fintel, summary: nan, Headline: Morgan Stanley Maintains Automatic Data Processing (ADP) Equal-Weight Recommendation, source:Fintel, summary: nan, Headline: Baird Maintains Automatic Data Processing (ADP) Neutral Recommendation, source:Fintel, summary: nan",ADP
184,2023-04-28,"Headline: Deere`s 8.4% decline in April is biggest among large-cap industrials, source:Seeking Alpha, summary: No summary, Headline: Automatic Data Processing Inc. stock outperforms competitors on strong trading day, source:MarketWatch, summary: Shares of Automatic Data Processing Inc. rallied 1.78% to $220.00 Friday, on what proved to be an all-around great trading session for the stock market, with...",ADP
185,2023-05-01,"Headline: ADP price target lowered to $275 from $278 at Barclays, source:Thefly.com, summary: No summary, Headline: Barclays Reaffirms Their Buy Rating on Automatic Data Processing (ADP), source:TipRanks, summary: No summary, Headline: ADP price target lowered to $255 from $275 at Mizuho, source:Thefly.com, summary: No summary, Headline: Automatic Data Processing Inc. stock outperforms competitors on strong trading day, source:MarketWatch, summary: Shares of Automatic Data Processing Inc. inched 0.51% higher to $221.12 Monday, on what proved to be an all-around dismal trading session for the stock..., Headline: Compounders And Dividends: April 2023 Portfolio Update, source:SeekingAlpha, summary: Dividend income grew 23.7% year over year, reflecting consistent and robust purchases over the previous year. Click here for a detailed analysis.",ADP
186,2023-05-02,"Headline: Automatic Data Processing Inc. stock falls Tuesday, underperforms market, source:MarketWatch, summary: Shares of Automatic Data Processing Inc. shed 2.07% to $216.54 Tuesday, on what proved to be an all-around rough trading session for the stock market, with...",ADP
