,date,information,related
0,2022-07-04,"Headline: 7 Dividend Stocks to Buy in July 2022, source:InvestorPlace, summary: Dividend stocks are only becoming more attractive as income becomes increasingly paramount. These seven equities pair dividends with safety.",ADP
1,2022-07-19,"Headline: 10 Best Dividend Stocks of All Time, source:InvestorPlace, summary: The best dividend stocks of all time aren't those with the best yields, but those with the most sustainable payouts and widest moats",ADP
2,2022-09-23,"Headline: Automatic Data Processing : 2022 Letter to Shareholders, source:Finnhub, summary: 2022 Letters to Shareholders ADP and the ADP logo are registered trademarks of ADP, Inc. All other... | September 23, 2022, Headline: Automatic Data Processing Inc. stock outperforms market despite losses on the day, source:MarketWatch, summary: Shares of Automatic Data Processing Inc. sank 0.08% to $230.28 Friday, on what proved to be an all-around poor trading session for the stock market, with the..., Headline: How Long Can S&P 500 Earnings Hold Up?, source:SeekingAlpha, summary: The S&P 500 has fallen 8.5%â9% the last two weeks. So far this year â in 2022 â rising interest rates have caused nothing more than P/E compression for the S&P 500.",ADP
3,2022-09-24,"Headline: Is It Time To Consider Buying Automatic Data Processing, Inc. (NASDAQ:ADP)?, source:Yahoo, summary: Today we're going to take a look at the well-established Automatic Data Processing, Inc. ( NASDAQ:ADP ). The company's...",ADP
4,2022-09-26,"Headline: Automatic Data Processing: A Better Opportunity Will Likely Present Itself, source:SeekingAlpha, summary: Automatic Data Processing is a Dividend Champion and currently yields 1.81%. Read more to see its dividend safety and why I'm waiting on the sidelines for now., Headline: Compounders And Dividends: A Portfolio, source:SeekingAlpha, summary: I have a strong focus on filling my portfolio with a large quantity of high-quality companies. Click here to read more., Headline: Automatic Data Processing Inc. stock outperforms competitors despite losses on the day, source:MarketWatch, summary: Shares of Automatic Data Processing Inc. dropped 0.71% to $228.64 Monday, on what proved to be an all-around dismal trading session for the stock market,...",ADP
5,2022-09-27,"Headline: Automatic Data Processing Inc. stock falls Tuesday, underperforms market, source:MarketWatch, summary: Shares of Automatic Data Processing Inc. slumped 0.45% to $227.62 Tuesday, on what proved to be an all-around dismal trading session for the stock market,...",ADP
6,2022-09-28,"Headline: Automatic Data Processing : ADP Adds Tax Credit Planning to Help Small Businesses Start Employee Retirement Plans, source:Finnhub, summary: ADP Adds Tax Credit Planning to Help Small Businesses Start Employee Retirement Plans Download PDF September 28, 2022 New... | September 28, 2022, Headline: Zacks.com featured highlights include W.W. Grainger, Carlisle, CDW and Automatic Data Processing, source:Yahoo, summary: W.W. Grainger, Carlisle, CDW and Automatic Data Processing are part of Zacks Screen of the Week article., Headline: Calculating The Fair Value Of Automatic Data Processing, Inc. (NASDAQ:ADP), source:Yahoo, summary: Today we will run through one way of estimating the intrinsic value of Automatic Data Processing, Inc. ( NASDAQ:ADP..., Headline: Automatic Data Processing Inc. stock rises Wednesday, still underperforms market, source:MarketWatch, summary: Shares of Automatic Data Processing Inc. rose 1.90% to $231.95 Wednesday, on what proved to be an all-around favorable trading session for the stock market,...",ADP
7,2022-09-29,"Headline: Paychex Q1 2023 Results: Great Performance But Still Not A Great Prospect, source:SeekingAlpha, summary: Paychex reported Q1 revenue and earnings yesterday that beat expectations. Read more to see why I think PAYX stock isn't a great prospect yet., Headline: ADP November 11th Options Begin Trading, source:Stock Options Channel, summary: Staff article entitled ADP November 11th Options Begin Trading, about stock options, from Stock Options Channel., Headline: Automatic Data Processing Inc. stock outperforms market despite losses on the day, source:MarketWatch, summary: Shares of Automatic Data Processing Inc. slid 1.81% to $227.75 Thursday, on what proved to be an all-around poor trading session for the stock market, with..., Headline: Charles River (CRAI) Rides on Global Presence & Diversification, source:Yahoo, summary: Charles River (CRAI) is currently benefiting from its diversified business as well as shareholder-friendly steps., Headline: Tight Job Market And Falling Stocks May Be A Perfect Storm For This Outsourcing Stock, source:Yahoo, summary: ADP, a leader in the Big Cap 20, builds base a base within a tight job market and a downturn in the stock market.",ADP
8,2022-09-30,"Headline: 7 Top Tech Stocks to Buy Heading Into Q4 2022, source:Yahoo, summary: If you love tech stocks, this hasn’t been your year. But that doesn’t mean you shouldn’t be looking at the top tech stocks to buy for the fourth quarter. Yeah, the sector is taking a beating, and that’s best reflected in some of the major exchange traded funds that hold tech stocks. The Technology Select Sector SPDR Fund (NYSEARCA:XLK) is down 28% so far this year. The Invesco QQQ ETF (NASDAQ:QQQ) suffered a similar fate, down 29%. And the much-vaunted ARK Innovation ETF (NYSEARCA:ARKK) dropped",ADP
9,2022-10-02,"Headline: A Look At The Intrinsic Value Of Automatic Data Processing, Inc. (NASDAQ:ADP), source:Yahoo, summary: How far off is Automatic Data Processing, Inc. ( NASDAQ:ADP ) from its intrinsic value? Using the most recent financial...",ADP
10,2022-10-04,"Headline: Top 5 3rd Quarter Trades of Bo - GuruFocus.com, source:GuruFocus, summary: GuruFocus Article or News written by insider and the topic is about: , Headline: Compounders And Dividends: September 2022 Portfolio Update, source:SeekingAlpha, summary: My portfolio continues to grow its monthly dividends. I will continue to be fully invested into equities in the market. Read more here., Headline: Automatic Data Processing Inc. stock rises Tuesday, still underperforms market, source:MarketWatch, summary: Shares of Automatic Data Processing Inc. rose 1.88% to $236.62 Tuesday, on what proved to be an all-around great trading session for the stock market, with..., Headline: Automatic Data Processing (ADP) Gains But Lags Market: What You Should Know, source:Yahoo, summary: Automatic Data Processing (ADP) closed at $236.62 in the latest trading session, marking a +1.88% move from the prior day.",ADP
11,2022-10-05,"Headline: Hiring Among U.S. Employers Accelerated in September, source:Finnhub, summary: By Maria Martinez Private-sector job growth in the U.S. gained pace in September, beating forecasts and showing the resilience of the labor market despite slowing economic growth and... | October 5, 2022, Headline: ADP National Employment Report: Private Sector Employment Increased by 208,000 Jobs in September; Annual Pay was Up 7.8%, source:Yahoo, summary: Private sector employment increased by 208,000 jobs in September and annual pay was up 7.8% year-over-year, according to the September ADP® National Employment Report™ produced by the ADP Research Institute® in collaboration with the Stanford Digital Economy Lab (""Stanford Lab"")., Headline: U.S. businesses add 208,000 jobs in September: ADP, source:Yahoo, summary: Yahoo Finance Live anchors break down the September ADP jobs report., Headline: Companies no longer fighting ‘tooth and nail’ for workers: ADP chief economist, source:Yahoo, summary: ADP Chief Economist Nela Richardson joins Yahoo Finance Live to discuss the ADP private payrolls jobs report, the uptick in labor force participation, wage gains, and the outlook for the labor market and the economy., Headline: Automatic Data Processing Inc. stock outperforms market on strong trading day, source:MarketWatch, summary: Shares of Automatic Data Processing Inc. advanced 1.03% to $239.05 Wednesday, on what proved to be an all-around dismal trading session for the stock market,..., Headline: First National Bank of Mount D - GuruFocus.com, source:GuruFocus, summary: GuruFocus Article or News written by insider and the topic is about: ",ADP
12,2022-10-06,"Headline: Interesting ADP Put And Call Options For November 25th, source:Stock Options Channel, summary: Staff article entitled Interesting ADP Put And Call Options For November 25th, about stock options, from Stock Options Channel., Headline: A Look At The Intrinsic Value Of Automatic Data Processing, Inc. (NASDAQ:ADP), source:Yahoo, summary: How far off is Automatic Data Processing, Inc. ( NASDAQ:ADP ) from its intrinsic value? Using the most recent financial..., Headline: Automatic Data Processing Inc. stock falls Thursday, underperforms market, source:MarketWatch, summary: Shares of Automatic Data Processing Inc. slid 1.74% to $234.89 Thursday, on what proved to be an all-around grim trading session for the stock market, with..., Headline: Here's Why Investors Should Retain Maximus (MMS) Stock Now, source:Yahoo, summary: Solid track record of dividend payments boosts Maximus (MMS)., Headline: Here's Why Investors Should Retain Trane Technologies (TT) Now, source:Yahoo, summary: Focus on growth objectives and pro-investor steps boost Trane Technologies (TT).",ADP
13,2022-10-07,"Headline: Top 5 3rd Quarter Trades of Co - GuruFocus.com, source:GuruFocus, summary: GuruFocus Article or News written by insider and the topic is about: , Headline: Automatic Data Processing Inc. stock outperforms competitors despite losses on the day, source:MarketWatch, summary: Shares of Automatic Data Processing Inc. shed 3.31% to $227.12 Friday, on what proved to be an all-around rough trading session for the stock market, with..., Headline: Here's Why Investors Should Retain Xerox (XRX) Stock Now, source:Yahoo, summary: Ongoing investments and recurring revenues boost Xerox (XRX).",ADP
14,2022-10-08,"Headline: 5 Relatively Safe And Cheap Dividend Stocks To Invest In - October 2022, source:SeekingAlpha, summary: This article is part of our monthly series where we scan the entire universe of ~7,500 stocks that are listed on U.S. exchanges. See our 5 picks for Oct. 2022., Headline: Polen Capital: “ADP Continues to Deliver Steady Business Performance”, source:Yahoo, summary: Polen Capital, an investment management firm, published its “Polen Global Growth Fund” second quarter 2022 investor letter – a copy of which can be downloaded here. During the second quarter of 2022, the Global Growth Composite Portfolio (the “Portfolio”) was down -18.08% and -18.34% gross and net of fees, respectively, versus a decline of -15.65% […]",ADP
15,2022-10-09,"Headline: 10 Dividend Growth Stocks For October 2022, source:TalkMarkets, summary: nan",ADP
16,2022-10-10,"Headline: Zacks Industry Outlook Highlights Automatic Data Processing, Paychex and Genpact, source:Yahoo, summary: Automatic Data Processing, Paychex and Genpact have been highlighted in this Industry Outlook article., Headline: Estimating The Fair Value Of Automatic Data Processing, Inc. (NASDAQ:ADP), source:Yahoo, summary: Today we'll do a simple run through of a valuation method used to estimate the attractiveness of Automatic Data..., Headline: Automatic Data Processing Inc. stock rises Monday, outperforms market, source:MarketWatch, summary: Shares of Automatic Data Processing Inc. inched 0.69% higher to $228.69 Monday, on what proved to be an all-around poor trading session for the stock market,...",ADP
17,2022-10-11,"Headline: Automatic Data Processing Inc. stock falls Tuesday, underperforms market, source:MarketWatch, summary: Shares of Automatic Data Processing Inc. shed 1.06% to $226.27 Tuesday, on what proved to be an all-around mixed trading session for the stock market, with..., Headline: Nicholas Ward's Dividend Growth Portfolio: August/September 2022 Update, source:SeekingAlpha, summary: During August, my passive income was up by 2.90% y/y. During September, my passive income was up by 41.14% y/y. Click to see my trades during these two months.",ADP
18,2022-10-12,"Headline: Drawing the line at work: One-third of working Canadians report feeling that they can't prioritize their personal life - ADP survey, source:Yahoo, summary: A new survey by ADP Canada, conducted with Maru Public Opinion, reveals that while many working Canadians report feeling engaged and satisfied in the workplace, they also have trouble setting boundaries between work and personal life., Headline: Automatic Data Processing Inc. stock falls Wednesday, underperforms market, source:MarketWatch, summary: Shares of Automatic Data Processing Inc. slid 0.95% to $224.11 Wednesday, on what proved to be an all-around dismal trading session for the stock market,..., Headline: ADP Makes Notable Cross Below Critical Moving Average, source:Dividend Channel, summary: dividend channel,ADP,",ADP
19,2022-10-13,"Headline: Automatic Data Processing Inc. stock rises Thursday, still underperforms market, source:MarketWatch, summary: Shares of Automatic Data Processing Inc. rose 2.58% to $229.90 Thursday, on what proved to be an all-around positive trading session for the stock market,...",ADP
20,2022-10-14,"Headline: Top 5 3rd Quarter Trades of He - GuruFocus.com, source:GuruFocus, summary: GuruFocus Article or News written by insider and the topic is about: , Headline: Here's Why Automatic Data Processing (NASDAQ:ADP) Has Caught The Eye Of Investors, source:Yahoo, summary: For beginners, it can seem like a good idea (and an exciting prospect) to buy a company that tells a good story to..., Headline: Automatic Data Processing Inc. stock outperforms competitors despite losses on the day, source:MarketWatch, summary: Shares of Automatic Data Processing Inc. shed 1.74% to $225.91 Friday, on what proved to be an all-around dismal trading session for the stock market, with...",ADP
21,2022-10-17,"Headline: Automatic Data Processing Inc. stock outperforms market on strong trading day, source:MarketWatch, summary: Shares of Automatic Data Processing Inc. rallied 3.17% to $233.08 Monday, on what proved to be an all-around great trading session for the stock market, with...",ADP
22,2022-10-18,"Headline: Calculating The Fair Value Of Automatic Data Processing, Inc. (NASDAQ:ADP), source:Yahoo, summary: Today we will run through one way of estimating the intrinsic value of Automatic Data Processing, Inc. ( NASDAQ:ADP..., Headline: Automatic Data Processing Inc. stock rises Tuesday, still underperforms market, source:MarketWatch, summary: Shares of Automatic Data Processing Inc. inched 0.83% higher to $235.02 Tuesday, on what proved to be an all-around positive trading session for the stock...",ADP
23,2022-10-19,"Headline: Top 5 3rd Quarter Trades of CO - GuruFocus.com, source:GuruFocus, summary: GuruFocus Article or News written by insider and the topic is about: , Headline: See Which Of The Latest 13F Filers Holds Automatic Data Processing, source:Preferred Stock Channel, summary: Staff article entitled See Which Of The Latest 13F Filers Holds Automatic Data Processing, about stock options, from Holdings Channel., Headline: ADP Launches Voice of the Employee Survey Solution to Help Improve Employee Workplace Experience, source:Yahoo, summary: Built on the deep expertise and data of ADP Research Institute, ADP has launched Voice of the Employee, a survey solution to help employers collect employee feedback and sentiment throughout the entire employee lifecycle – and make more informed decisions based on those insights., Headline: Automatic Data Processing Inc. stock underperforms Wednesday when compared to competitors, source:MarketWatch, summary: Shares of Automatic Data Processing Inc. shed 0.76% to $233.24 Wednesday, on what proved to be an all-around dismal trading session for the stock market,..., Headline: Paychex Or ADP? Picking A Payroll Stalwart, source:SeekingAlpha, summary: Both ADP and Paychex are expensive at current prices, but great defensive investments and likely to outperform the S&P 500 in bear markets. Click here to read more.",ADP
24,2022-10-20,"Headline: Automatic Data Processing Inc. stock falls Thursday, underperforms market, source:MarketWatch, summary: Shares of Automatic Data Processing Inc. shed 1.61% to $229.48 Thursday, on what proved to be an all-around rough trading session for the stock market, with..., Headline: What Awaits Automatic Data Processing (ADP) in Q1 Earnings?, source:Yahoo, summary: Automatic Data Processing's (ADP) first-quarter fiscal 2023 earnings and revenues are likely to have surged from the year-ago fiscal quarter's respective reported figures.",ADP
25,2022-10-21,"Headline: Automatic Data Processing Inc. stock rises Friday, still underperforms market, source:MarketWatch, summary: Shares of Automatic Data Processing Inc. rose 1.42% to $232.74 Friday, on what proved to be an all-around great trading session for the stock market, with..., Headline: Automatic Data Processing (ADP) Gains But Lags Market: What You Should Know, source:Yahoo, summary: Automatic Data Processing (ADP) closed the most recent trading day at $232.74, moving +1.42% from the previous trading session.",ADP
26,2022-10-22,"Headline: Compounders And Dividends: My Top 10 And Portfolio Positioning, source:SeekingAlpha, summary: My portfolio is dynamic and changing as I grow older and as the market moves. Check out the top positions in my portfolio., Headline: A Look At The Fair Value Of Automatic Data Processing, Inc. (NASDAQ:ADP), source:Yahoo, summary: How far off is Automatic Data Processing, Inc. ( NASDAQ:ADP ) from its intrinsic value? Using the most recent financial...",ADP
27,2022-10-24,"Headline: Do You Think Automatic Data Processing (ADP) is an Attractive Long-Term Investment?, source:Yahoo, summary: Polen Capital, an investment management company, released its “Polen Global Growth Strategy” third-quarter 2022 investor letter. A copy of the same can be downloaded here. The fund was down -8.63% in the third quarter compared to a -6.82% decline for the MSCI ACW Index. In addition, please check the fund’s top five holdings to know its […]",ADP
28,2022-10-25,"Headline: Notable companies reporting before tomorrow's open, source:Thefly.com, summary: Notable companies reporti... TMO, BMY, ADP, BA, GD, BSX, KHC, APH, HLT, FTV, STX, HOG, WING, NYCB, Headline: Dividend Champions To Buy, Sell, And Hold, Part 2, source:SeekingAlpha, summary: Dividend Champions are a great list of stocks to study for investment options. Read more about them here., Headline: Automatic Data Processing Inc. stock rises Tuesday, still underperforms market, source:MarketWatch, summary: Shares of Automatic Data Processing Inc. inched 0.36% higher to $237.76 Tuesday, on what proved to be an all-around great trading session for the stock...",ADP
29,2022-10-26,"Headline: Automatic Data Processing (ADP): New Buy Recommendation for This Technology Giant, source:TipRanks, summary: Mizuho Securities analyst Dan Dolev maintained a Buy rating on Automatic Data Processing (ADP &#8211; Research Report) today and set a price target of $257.00. The ..., Headline: ADP reports Q1 adjusted EPS $1.86, consensus $1.79, source:Thefly.com, summary: Reports Q1 revenue $4.22B... ADP, Headline: ADP  sees FY23 adjusted EPS growth 15%-17%, consensus $8.03, source:Thefly.com, summary: Sees FY23 revenue growth ... ADP, Headline: ADP President Maria Black to succeed CEO Carlos Rodriguez, effective Jan. 1, source:Thefly.com, summary: ADP announced that its bo... ADP, Headline: ADP: Fiscal Q1 Earnings Snapshot, source:Associated Press, The, summary: No summary, Headline: ADP Names President Black to Succeed Rodriguez as CEO >ADP, source:MarketWatch, summary: By Colin Kellaher Automatic Data Processing Inc. on Wednesday said it has designated President Maria Black to succeed Carlos Rodriguez as chief executive,..., Headline: Fly Intel: Pre-market Movers, source:Thefly.com, summary: Seagate drops following Q3 earnings and headcount reduction announcement BMY, ADP, KHC, HLT, HOG, WM, NYCB, TMO, BSX, STX, WING, GOOG, MSFT, V, GOOGL, Headline: ADP Reports First Quarter Fiscal 2023 Results, source:Yahoo, summary: ADP (Nasdaq: ADP), a leading global technology company providing human capital management (HCM) solutions, today announced its first quarter fiscal 2023 financial results along with its revised fiscal 2023 outlook through an earnings release available on the company's website at investors.adp.com/events-and-presentations. This earnings release will also be furnished to the Securities and Exchange Commission (SEC) on a Current Report on Form 8-K and available at sec.gov., Headline: ADP President Maria Black to succeed CEO Carlos Rodriguez, Effective January 1, 2023, source:Yahoo, summary: ADP, a leading global technology company providing human capital management (HCM) solutions, announced today that its board of directors has appointed Maria Black to succeed Carlos Rodriguez as the company's chief executive officer, effective January 1, 2023. Ms. Black is currently ADP's president. In connection with her new role as president and CEO, Ms. Black will also serve as a director on the company's board., Headline: Automatic Data Processing, Inc. (ADP) Q1 2023 Earnings Call Transcript, source:SeekingAlpha, summary: Automatic Data Processing, Inc. (NASDAQ:NASDAQ:ADP) Q1 2023 Earnings Conference Call October 26, 2022 8:30 AM ET Company Participants Danyal Hussain - Vice President, Investor Relations..., Headline: Automatic Data Processing Registers 10% Revenue Growth In Q1 Backed By New Business Bookings, source:Yahoo, summary: Automatic Data Processing, Inc (NASDAQ: ADP) reported first-quarter FY23 revenue growth of 10% year-on-year to $4.22 billion, beating the consensus of $4.16 billion. Employer services revenue rose 9% Y/Y to $2.79 billion, and PEO services revenue grew 13% Y/Y to $1.43 billion. Non-GAAP EPS of $1.86 beat the consensus of $1.80. The adjusted EBIT margin expanded 30 bps to 24.1%. ADP held $5.58 billion in cash and equivalents. ""Our first quarter revenue growth and margin performance exceeded our ex, Headline: Automatic Data Processing, Inc. (NASDAQ:ADP) Not Lagging Market On Growth Or Pricing, source:Yahoo, summary: With a price-to-earnings (or ""P/E"") ratio of 33.5x Automatic Data Processing, Inc. ( NASDAQ:ADP ) may be sending very..., Headline: Automatic Data Processing Promotes Its President Maria Black To CEO Role; Carlos Rodriguez Became Executive Chair, source:Yahoo, summary: Automatic Data Processing, Inc (NASDAQ: ADP) appointed Maria Black to succeed Carlos Rodriguez as the CEO, effective January 1, 2023. Black has been ADP's President since January 2022. Prior to that, she was president of the worldwide sales and marketing of ADP since February 2020. Black will also serve as a director on the company's board. Rodriguez has been the CEO and a member of ADP's board of directors since November 2011. Rodriguez will serve as executive chair of the board. John P. Jones,, Headline: Automatic Data Processing Inc. stock underperforms Wednesday when compared to competitors, source:MarketWatch, summary: Shares of Automatic Data Processing Inc. slid 1.10% to $235.14 Wednesday, on what proved to be an all-around mixed trading session for the stock market, with..., Headline: 10 Latest Earnings to Watch, source:Yahoo, summary: In this article, we will take a look at the 10 latest earnings to watch. If you want to see some other much-awaited earnings reports, go directly to 5 Latest Earnings to Watch. U.S. stock futures tied to S&P 500 and Dow Jones Industrial Average rose in the mid-day trading session on Wednesday. However, tech-heavy Nasdaq […]",ADP
30,2022-10-27,"Headline: HERITAGE INVESTORS MANAGEMENT  - GuruFocus.com, source:GuruFocus, summary: GuruFocus Article or News written by insider and the topic is about: , Headline: Analysts Offer Insights on Technology Companies: Automatic Data Processing (ADP), Boeing (BA) and Silicon Laboratories (SLAB), source:TipRanks, summary: Analysts have been eager to weigh in on the Technology sector with new ratings on Automatic Data Processing (<span class='tr-stock-ticker' style='color:blue; font-w..., Headline: Recruit Holdings: Underrated HR Leader, source:SeekingAlpha, summary: Recruit is an interesting HR investment alternative compared to legacy vendors such as ADP, Workday, and SAP. See why I recommend a buy for the stock., Headline: Automatic Data Processing Inc. stock outperforms market despite losses on the day, source:MarketWatch, summary: Shares of Automatic Data Processing Inc. slid 0.07% to $234.97 Thursday, on what proved to be an all-around mixed trading session for the stock market, with...",ADP
31,2022-10-28,"Headline: Automatic Data Processing Inc. stock outperforms market on strong trading day, source:MarketWatch, summary: Shares of Automatic Data Processing Inc. rallied 3.26% to $242.64 Friday, on what proved to be an all-around positive trading session for the stock market,...",ADP
32,2022-10-30,"Headline: Analysts Offer Insights on Technology Companies: ServiceNow (NOW), General Dynamics (GD) and Automatic Data Processing (ADP), source:TipRanks, summary: Analysts have been eager to weigh in on the Technology sector with new ratings on ServiceNow (<a ..., Headline: What Is Automatic Data Processing, Inc.'s (NASDAQ:ADP) Share Price Doing?, source:Yahoo, summary: Let's talk about the popular Automatic Data Processing, Inc. ( NASDAQ:ADP ). The company's shares saw a decent share...",ADP
