,date,information,related
72,2022-12-15,"Headline: With 81% institutional ownership, Automatic Data Processing, Inc. (NASDAQ:ADP) is a favorite amongst the big guns, source:Yahoo, summary: To get a sense of who is truly in control of Automatic Data Processing, Inc. ( NASDAQ:ADP ), it is important to..., Headline: 12 Best Dividend Stocks That Outperformed in 2022, source:Yahoo, summary: In this article, we will take a look at 12 best dividend stocks that outperformed in 2022. If you want to see more best dividend stocks that outperformed in 2022, go directly to 5 Best Dividend Stocks That Outperformed in 2022. Dividend stocks are stocks of companies that pay dividends. Although not always the case, […], Headline: Automatic Data Processing Inc. stock falls Thursday, underperforms market, source:MarketWatch, summary: Shares of Automatic Data Processing Inc. slid 4.34% to $248.79 Thursday, on what proved to be an all-around poor trading session for the stock market, with...",ADP
73,2022-12-16,"Headline: Automatic Data Processing Inc. stock underperforms Friday when compared to competitors, source:MarketWatch, summary: Shares of Automatic Data Processing Inc. slipped 0.70% to $247.05 Friday, on what proved to be an all-around dismal trading session for the stock market,...",ADP
74,2022-12-19,"Headline: ADP to Announce Second Quarter Fiscal 2023 Financial Results on January 25, 2023, source:Yahoo, summary: ADP (Nasdaq: ADP), a leading global provider of Human Capital Management (HCM) solutions, is scheduled to release its financial results for the second fiscal quarter ending December 31, 2022 before the opening of the Nasdaq on Wednesday, January 25, 2023., Headline: Automatic Data Processing's (NASDAQ:ADP) five-year total shareholder returns outpace the underlying earnings growth, source:Yahoo, summary: When you buy a stock there is always a possibility that it could drop 100%. But on the bright side, you can make far..., Headline: Automatic Data Processing Inc. stock falls Monday, still outperforms market, source:MarketWatch, summary: Shares of Automatic Data Processing Inc. slumped 0.81% to $245.06 Monday, on what proved to be an all-around grim trading session for the stock market, with...",ADP
75,2022-12-20,"Headline: By Crushing The Market In Year 8, The Dividend Growth 50 Plays Catch-Up, source:SeekingAlpha, summary: Filled with high-quality, dividend-growing stocks, the DG50 easily beat the S&P 500 Index over the last year. Read more here., Headline: Automatic Data Processing Inc. stock underperforms Tuesday when compared to competitors, source:MarketWatch, summary: Shares of Automatic Data Processing Inc. slumped 0.47% to $243.91 Tuesday, on what proved to be an all-around favorable trading session for the stock market,..., Headline: 15 Best NASDAQ Stocks to Buy Now, source:Yahoo, summary: In this article, we take a look at 15 best NASDAQ stocks to buy now. If you want to see more best NASDAQ stocks to buy, go directly to 5 Best NASDAQ Stocks to Buy Now. The Nasdaq Composite or simply the NASDAQ index is a market weighted index of more than 3,000 stocks listed […]",ADP
76,2022-12-21,"Headline: Nicholas Ward`s Dividend Growth Portfolio: November 2022 Update, source:Seeking Alpha, summary: No summary, Headline: Automatic Data Processing Inc. stock rises Wednesday, still underperforms market, source:MarketWatch, summary: Shares of Automatic Data Processing Inc. advanced 1.28% to $247.04 Wednesday, on what proved to be an all-around favorable trading session for the stock..., Headline: Nicholas Ward's Dividend Growth Portfolio: November 2022 Update, source:SeekingAlpha, summary: My passive income was up by 12.03% during November and my dividends are up by 21.15% year to date. Read more to see an update on my portfolio for Nov 2022.",ADP
77,2022-12-22,"Headline: Automatic Data Processing Inc. stock falls Thursday, underperforms market, source:MarketWatch, summary: Shares of Automatic Data Processing Inc. shed 3.19% to $239.16 Thursday, on what proved to be an all-around rough trading session for the stock market, with...",ADP
78,2022-12-23,"Headline: A Look At The Intrinsic Value Of Automatic Data Processing, Inc. (NASDAQ:ADP), source:Yahoo, summary: How far off is Automatic Data Processing, Inc. ( NASDAQ:ADP ) from its intrinsic value? Using the most recent financial..., Headline: Automatic Data Processing Inc. stock outperforms competitors on strong trading day, source:MarketWatch, summary: Shares of Automatic Data Processing Inc. inched 0.74% higher to $240.94 Friday, on what proved to be an all-around great trading session for the stock..., Headline: Automatic Data Processing: Why This Dividend Growth Stock Is Near The Top Of My Watch List, source:SeekingAlpha, summary: ADP benefits from high client switching costs and a scale-based cost advantage. The company had strong results last quarter. Click here to read more.",ADP
79,2022-12-24,"Headline: How To Build Wealth: Buy Low And Sell High Consistently, source:SeekingAlpha, summary: What if we could buy low and sell high on a consistent basis? We discuss a systematic and rather conservative strategy to buy low and sell high. Click for more.",ADP
80,2022-12-26,"Headline: My Best Dividend Aristocrats For January 2023, source:SeekingAlpha, summary: I present 3 strategies that can theoretically beat the dividend aristocrat index in the long term. Click here to know my picks for Jan 2023.",ADP
81,2022-12-27,"Headline: A Look At The Fair Value Of Automatic Data Processing, Inc. (NASDAQ:ADP), source:Yahoo, summary: In this article we are going to estimate the intrinsic value of Automatic Data Processing, Inc. ( NASDAQ:ADP ) by..., Headline: Automatic Data Processing Inc. stock rises Tuesday, outperforms market, source:MarketWatch, summary: Shares of Automatic Data Processing Inc. inched 0.04% higher to $241.03 Tuesday, on what proved to be an all-around mixed trading session for the stock...",ADP
82,2022-12-28,"Headline: Automatic Data Processing Inc. stock underperforms Wednesday when compared to competitors, source:MarketWatch, summary: Shares of Automatic Data Processing Inc. slid 1.32% to $237.85 Wednesday, on what proved to be an all-around rough trading session for the stock market, with..., Headline: Compounders And Dividends: 2023 Portfolio Goals, source:SeekingAlpha, summary: I look at my updated top 10 holdings and highlight some Compounder names I'm looking to add in 2023. Click here to learn more about these stocks., Headline: Automatic Data Processing Inc. stock rises Thursday, still underperforms market, source:MarketWatch, summary: No summary",ADP
83,2022-12-29,"Headline: Selecting Dividend Aristocrats Using SCHD`s Methodology - Initial Results, source:Seeking Alpha, summary: No summary, Headline: Selecting Dividend Aristocrats Using SCHD's Methodology - Initial Results, source:SeekingAlpha, summary: Leveraging stock selection criteria from the underlying index of SCHD. Find out how my two portfolios built using this process performed in December., Headline: 11 Best Stocks to Buy for Deflation, source:Yahoo, summary: In this article, we discuss the 11 best stocks to buy for deflation. If you want to see more stocks in this selection, click 5 Best Stocks To Buy For Deflation. The swift economic rebound from the Covid shock unleashed the biggest inflationary wave we have witnessed since the early 1980s, according to The New […], Headline: Automatic Data Processing Inc. stock falls Friday, underperforms market, source:MarketWatch, summary: No summary",ADP
84,2022-12-31,"Headline: Automatic Data Processing, Inc. (NASDAQ:ADP) is largely controlled by institutional shareholders who own 81% of the company, source:Yahoo, summary: Every investor in Automatic Data Processing, Inc. ( NASDAQ:ADP ) should be aware of the most powerful shareholder..., Headline: Tracking Terry Smith`s Fundsmith 13F Portfolio - Q3 2022 Update, source:Seeking Alpha, summary: No summary, Headline: Tracking Terry Smith's Fundsmith 13F Portfolio - Q3 2022 Update, source:SeekingAlpha, summary: Fundsmithâs 13F portfolio value decreased from $23.45B to $21.07B this quarter. Click here to read an update on the portfolio.",ADP
85,2023-01-01,"Headline: 2023 Dividend Growth Portfolio Review And Look Ahead, source:Seeking Alpha, summary: No summary, Headline: My Dividend Growth Portfolio - Final 2022 Recap, source:SeekingAlpha, summary: 2022 was another fantastic year for dividend growth, with my income increasing by over 13%. Find out every sale made in the year and the replacement purchases.",ADP
86,2023-01-03,"Headline: Dividend Growth 50: Income In Year 8 Was Truly Great, source:SeekingAlpha, summary: This real-money portfolio wrapped up its eighth year with its best income-growing showing ever. Check out this year's update on Dividend Growth 50 stocks., Headline: Employee Experience Propels Workplace Transformation in 2023, source:Yahoo, summary: Innovation at work is gaining greater momentum, as employee experience emerges as a defining priority of employers in 2023. Work's transformation over the past few years has been marked by speed and urgency, which remain consistent variables influencing the road ahead. Shifts in the labor market and global economy have demanded a level of adaptability that's now become table stakes for employers. Employee expectations have shifted too – permanently – as workers rethink their priorities. This hei, Headline: Macro Risks Await Insperity In 2023, source:SeekingAlpha, summary: Insperity is a healthy company with good growth, but here's why NSP is a hold in the near term., Headline: Automatic Data Processing Inc. stock underperforms Tuesday when compared to competitors, source:MarketWatch, summary: Shares of Automatic Data Processing Inc. slumped 0.50% to $237.66 Tuesday, on what proved to be an all-around grim trading session for the stock market, with...",ADP
87,2023-01-04,"Headline: Compounders And Dividends: December 2022 Portfolio Update, source:Seeking Alpha, summary: No summary, Headline: Automatic Data Processing Inc. stock rises Wednesday, still underperforms market, source:MarketWatch, summary: Shares of Automatic Data Processing Inc. inched 0.47% higher to $238.78 Wednesday, on what proved to be an all-around great trading session for the stock..., Headline: Automatic Data Processing Inc. stock underperforms Thursday when compared to competitors, source:MarketWatch, summary: No summary, Headline: First National Bank of Mount Dora, Trust Investment Services Goes on Buying Spree in 4th Quarter, source:GuruFocus, summary: No summary",ADP
88,2023-01-05,"Headline: ADP price target raised to $225 from $220 at Wolfe Research, source:Thefly.com, summary: No summary, Headline: February 24th Options Now Available For Automatic Data Processing, source:Stock Options Channel, summary: No summary, Headline: ADP National Employment Report: Private Sector Employment Increased by 235,000 Jobs in December; Annual Pay was Up 7.3%, source:Yahoo, summary: Private sector employment increased by 235,000 jobs in December and annual pay was up 7.3 percent year-over-year, according to the December ADP® National Employment Report™ produced by the ADP Research Institute® in collaboration with the Stanford Digital Economy Lab (""Stanford Lab"")., Headline: U.S. adds 235,000 private sector jobs in December: ADP, source:Yahoo, summary: Yahoo Finance Live’s Julie Hyman discusses how stock futures are performing following ADP jobs data.",ADP
89,2023-01-06,"Headline: The Fed`s Inflation Fight Could Make ADP A Highly Attractive Buy In 2023, source:Seeking Alpha, summary: No summary, Headline: The Fed's Inflation Fight Could Make ADP A Highly Attractive Buy In 2023, source:SeekingAlpha, summary: Automatic Data Processing is a fast-growing co. dependent on the labor market and HR systems. Read why I'm looking to add ADP to my portfolio at $200 per share., Headline: Automatic Data Processing Inc. stock outperforms market on strong trading day, source:MarketWatch, summary: Shares of Automatic Data Processing Inc. rose 2.80% to $240.16 Friday, on what proved to be an all-around favorable trading session for the stock market,...",ADP
90,2023-01-07,"Headline: 5 Relatively Safe And Cheap Dividend Stocks To Invest In - January 2023, source:SeekingAlpha, summary: This article is part of our monthly series where we highlight five companies that are large-cap, relatively safe, dividend-paying, and are offering large discounts to their historical norms., Headline: Do Automatic Data Processing's (NASDAQ:ADP) Earnings Warrant Your Attention?, source:Yahoo, summary: The excitement of investing in a company that can reverse its fortunes is a big draw for some speculators, so even...",ADP
91,2023-01-09,"Headline: Automatic Data Processing Inc. stock underperforms Monday when compared to competitors, source:MarketWatch, summary: Shares of Automatic Data Processing Inc. slumped 0.27% to $239.51 Monday, on what proved to be an all-around rough trading session for the stock market, with...",ADP
92,2023-01-10,"Headline: Beat the Dow Jones With This Unstoppable Dividend Stock, source:Yahoo, summary: This under-the-radar stock has grown its dividend every year for decades, and its returns crushed the market., Headline: Automatic Data Processing Inc. stock rises Tuesday, still underperforms market, source:MarketWatch, summary: Shares of Automatic Data Processing Inc. inched 0.53% higher to $240.78 Tuesday, on what proved to be an all-around favorable trading session for the stock...",ADP
93,2023-01-11,"Headline: 4 Factor Dividend Growth Portfolio - December 2022 Results, source:SeekingAlpha, summary: The 4 factor dividend growth portfolio was launched on November 1st, 2022 and is thus far off to a great start. Click to see how our strategy is going so far., Headline: Automatic Data Processing Inc. stock rises Wednesday, outperforms market, source:MarketWatch, summary: Shares of Automatic Data Processing Inc. rallied 1.77% to $245.05 Wednesday, on what proved to be an all-around great trading session for the stock market,..., Headline: ADP Declares Regular Quarterly Dividend, source:Yahoo, summary: The board of directors of Automatic Data Processing, Inc. (Nasdaq: ADP) has declared a regular quarterly dividend of $1.25 per share payable April 1, 2023 to shareholders of record on March 10, 2023.",ADP
94,2023-01-12,"Headline: Automatic Data Processing Inc. stock underperforms Thursday when compared to competitors, source:MarketWatch, summary: Shares of Automatic Data Processing Inc. dropped 0.32% to $244.26 Thursday, on what proved to be an all-around great trading session for the stock market,...",ADP
95,2023-01-17,"Headline: Automatic Data Processing Inc. stock falls Tuesday, underperforms market, source:MarketWatch, summary: Shares of Automatic Data Processing Inc. slid 3.50% to $236.78 Tuesday, on what proved to be an all-around dismal trading session for the stock market, with..., Headline: PayPal: Strongest Free Cash Flow Play In Digital Money Space, source:SeekingAlpha, summary: PayPal is sitting at a record-low valuation since separating from eBay and becoming a publicly-traded enterprise in 2015. See why I rate PYPL shares a Buy.",ADP
96,2023-01-18,"Headline: Automatic Data Processing Inc. stock outperforms competitors despite losses on the day, source:MarketWatch, summary: Shares of Automatic Data Processing Inc. shed 1.07% to $234.25 Wednesday, on what proved to be an all-around grim trading session for the stock market, with..., Headline: Nicholas Ward's Dividend Growth Portfolio: December/Full Year 2022 Review, source:SeekingAlpha, summary: My passive income was up by 46.50% on a year-over-year basis during December. For the full-year in 2022, my passive income rose by 23.73%. Click to read more.",ADP
97,2023-01-19,"Headline: Automatic Data Processing Inc. stock outperforms market despite losses on the day, source:MarketWatch, summary: Shares of Automatic Data Processing Inc. slid 0.40% to $233.32 Thursday, on what proved to be an all-around dismal trading session for the stock market, with...",ADP
98,2023-01-20,"Headline: What Awaits for Automatic Data Processing (ADP) in Q2 Earnings?, source:Yahoo, summary: Automatic Data Processing (ADP) second-quarter fiscal 2023 earnings and revenues are likely to have surged year over year.",ADP
99,2023-01-21,"Headline: 15 Stocks That Have Increased Their Dividends for Over 25 Years, source:Yahoo, summary: In this article, we take a look at 15 stocks that have increased their dividends for over 25 years. If you want to see more stocks that have increased their dividends for over 25 years, go directly to 5 Stocks That Have Increased Their Dividends for Over 25 Years. In addition to buybacks, dividends are […]",ADP
100,2023-01-23,"Headline: Selecting Dividend Aristocrats Using SCHD Methodology - Slow And Steady, source:SeekingAlpha, summary: I propose leveraging the stock selection criteria from the underlying index of SCHD to build a portfolio with a subset of Dividend Aristocrats.",ADP
101,2023-01-24,"Headline: Paychex: Moderating Growth Is Not A Good Catalyst In Today's Bearish Market, source:SeekingAlpha, summary: Paychex continues to be competitive in the market and in fact, it continues to grow its top line and customer base. Click here for my analysis of PAYX stock.",ADP
102,2023-01-25,"Headline: ADP 2Q Earnings Up 17% on New Bookings, source:MarketWatch, summary: By Rob Curran Payroll-services company Automatic Data Processing said its fiscal second-quarter earnings rose 17% and reiterated its projections for fiscal..., Headline: Automatic Data Processing, Inc. 2023 Q2 - Results - Earnings Call Presentation, source:SeekingAlpha, summary: The following slide deck was published by Automatic Data Processing, Inc., Headline: Automatic Data Processing, Inc. (ADP) Q2 2023 Earnings Call Transcript, source:SeekingAlpha, summary: Automatic Data Processing, Inc. (NASDAQ:NASDAQ:ADP) Q2 2023 Earnings Conference Call January 25, 2023 8:30 AM ETCompany ParticipantsDanyal Hussain - VP, IRMaria Black - President, CEO &..., Headline: ADP Reports Second Quarter Fiscal 2023 Results, source:Yahoo, summary: ADP (Nasdaq: ADP), a leading global technology company providing human capital management (HCM) solutions, today announced its second quarter fiscal 2023 financial results along with its revised fiscal 2023 outlook through an earnings release available on the company's website at investors.adp.com/events-and-presentations. This earnings release will also be furnished to the Securities and Exchange Commission (SEC) on a Current Report on Form 8-K and available at sec.gov., Headline: ADP Clocks 9% Revenue Growth In Q2 Backed By New Bookings, Client Retention, source:Yahoo, summary: Automatic Data Processing, Inc (NASDAQ: ADP) reported second-quarter FY23 revenue growth of 9% year-on-year to $4.39 billion, beating the consensus of $4.38 billion. Employer services revenue rose 8% Y/Y to $2.89 billion, and PEO services revenue grew 11% Y/Y to $1.50 billion. Non-GAAP EPS of $1.96 beat the consensus of $1.93. Adjusted EBIT margin expanded by 120 bps to 24.3%. ADP held $1.35 billion in cash and equivalents. ""With strong results in new business bookings, client revenue retention,, Headline: NEW YORK MARKET CLOSE: Stocks edge down after mixed earnings, source:Alliance News, summary: No summary, Headline: Automatic Data Processing Inc. stock underperforms Thursday when compared to competitors, source:MarketWatch, summary: No summary",ADP
103,2023-01-26,"Headline: ADP price target lowered to $275 from $285 at Mizuho, source:Thefly.com, summary: No summary, Headline: Robert W. Baird Sticks to Its Hold Rating for Automatic Data Processing (ADP), source:TipRanks, summary: No summary, Headline: March 10th Options Now Available For Automatic Data Processing (ADP), source:Stock Options Channel, summary: No summary, Headline: Analysts Have Conflicting Sentiments on These Technology Companies: ASML Holding (ASML), Automatic Data Processing (ADP) and Meta Platforms (META), source:TipRanks, summary: No summary, Headline: Analysts Conflicted on These Technology Names: ASML Holding (ASML), Automatic Data Processing (ADP) and Meta Platforms (META), source:TipRanks, summary: No summary, Headline: Suncoast Equity Management Buys 3, Sells 2 in 4th Quarter, source:GuruFocus, summary: No summary, Headline: Automatic Data Processing Inc. stock falls Friday, underperforms market, source:MarketWatch, summary: No summary",ADP
104,2023-01-27,"Headline: Automatic Data Processing Second Quarter 2023 Earnings: In Line With Expectations, source:Yahoo, summary: Automatic Data Processing ( NASDAQ:ADP ) Second Quarter 2023 Results Key Financial Results Revenue: US$4.39b (up 9.1..., Headline: Automatic Data Processing Enters Oversold Territory, source:Dividend Channel, summary: No summary, Headline: Automatic Data Processing: Automating Solutions, Sustaining Growth But A Bit Overpriced, source:SeekingAlpha, summary: Automatic Data Processing released its Q2 earnings recently. Click here to read about ADP's growth catalysts, financials and valuation.",ADP
105,2023-01-28,"Headline: Wall Street Breakfast: What Moved Markets, source:SeekingAlpha, summary: Listen on the go! A daily podcast of Wall Street Breakfast will be available by 8:00 a.m. on Seeking Alpha, iTunes, Stitcher and Spotify., Headline: The 4% DGI Core Portfolio: 2022 Year-End Review, source:SeekingAlpha, summary: We present the 2022 year-end review of our eight-year-old Passive DGI-Core Portfolio. Click to see how our portfolio performed in 2022., Headline: M&A boosts Evoqua to top industrial gainer of week, JetBlue, railroad stock among losers, source:Seeking Alpha, summary: No summary, Headline: My Best Dividend Aristocrats For February 2023, source:Seeking Alpha, summary: No summary, Headline: What CEOs Are Saying: ‘The Consumer Is Under Pressure’, source:Yahoo, summary: Here’s what leaders from Nasdaq, Microsoft, Tesla and elsewhere said about the economy, inflation and other topics this week.",ADP
106,2023-01-29,"Headline: ADP price target lowered to $278 from $280 at Barclays, source:Thefly.com, summary: No summary, Headline: Automatic Data Processing Inc. stock rises Monday, outperforms market, source:MarketWatch, summary: No summary",ADP
107,2023-01-30,"Headline: 3 Industry-Leading Stocks to Buy Before the Bear Market Is Over, source:Yahoo, summary: Bear markets like the one the Nasdaq Composite and the S&P 500 have been in since March and June of 2022, respectively, make for a harsh investing environment.  Its scale is phenomenal, with nearly 1 million clients worldwide., Headline: Automatic Data Processing Inc. stock outperforms market on strong trading day, source:MarketWatch, summary: No summary",ADP
108,2023-01-31,"Headline: Automatic Data Processing Inc. stock rises Wednesday, still underperforms market, source:MarketWatch, summary: No summary",ADP
109,2023-02-01,"Headline: Clearstead Trust, LLC`s Top 5 Buys of the 4th Quarter, source:GuruFocus, summary: No summary, Headline: ADP National Employment Report: Private Sector Employment Increased by 106,000 Jobs in January; Annual Pay was Up 7.3%, source:Yahoo, summary: Private sector employment increased by 106,000 jobs in January and annual pay was up 7.3 percent year-over-year, according to the January ADP® National Employment Report™ produced by the ADP Research Institute® in collaboration with the Stanford Digital Economy Lab (""Stanford Lab"")., Headline: ADP Named One of the ""World's Most Admired Companies"" for 17th Straight Year, source:Yahoo, summary: ADP, a leading global technology company providing human capital management (HCM) solutions, has been named by FORTUNE® magazine as one of the ""World's Most Admired Companies"" in 2023. This marks ADP's 17th consecutive year earning recognition on the distinguished list, which highlights companies with consistently strong performance and reputations as the world continues to change., Headline: Automatic Data Processing Inc. stock rises Thursday, still underperforms market, source:MarketWatch, summary: No summary",ADP
110,2023-02-02,"Headline: Five Strong Buy Stocks That Are Good FIts Now For Conservative Institutional-Quality Portfolios, source:TalkMarkets, summary: No summary, Headline: Investing $10,000 In These 3 Dividend Growth No-Brainers, source:Seeking Alpha, summary: No summary, Headline: See Which Of The Latest 13F Filers Holds Automatic Data Processing, source:Preferred Stock Channel, summary: No summary, Headline: Compounders And Dividends: January 2023 Portfolio Update, source:SeekingAlpha, summary: My January 2023 income is multiples higher than my January 2022 dividend income. Read more to see an update on my portfolio., Headline: Automatic Data Processing Inc. stock falls Friday, underperforms market, source:MarketWatch, summary: No summary",ADP
111,2023-02-04,"Headline: 5 Relatively Safe And Cheap Dividend Stocks To Invest In - February 2023, source:SeekingAlpha, summary: This is part of our monthly series where we highlight 5 companies that are large-cap, relatively safe, dividend-paying, and offer discounts. Click here for more.",ADP
112,2023-02-05,"Headline: Automatic Data Processing Inc. stock outperforms competitors despite losses on the day, source:MarketWatch, summary: No summary",ADP
113,2023-02-06,"Headline: Automatic Data Processing: Buy The Drop On This DGI Giant, source:Seeking Alpha, summary: No summary, Headline: Automatic Data Processing Inc. stock outperforms competitors on strong trading day, source:MarketWatch, summary: No summary",ADP
