,date,information,related
0,2022-09-23,"Headline: Align Technology Inc. stock outperforms market on strong trading day, source:MarketWatch, summary: Shares of Align Technology Inc. rallied 2.06% to $222.43 Friday, on what proved to be an all-around rough trading session for the stock market, with the S&P...",ALGN
1,2022-09-26,"Headline: Align Technology call volume above normal and directionally bullish, source:Thefly.com, summary: Bullish option flow detec... ALGN, Headline: Got $2,000? Invest In These 2 Perpetually Growing Stocks, source:Yahoo, summary: It's great to own evergreen stocks that keep growing even when the economy is a mess and when consumer preferences are shifting rapidly.  In that vein, let's dive into a pair of very different healthcare companies that have the right mixture of resilience and dynamism to be profitable investments in the economic environment of today, as well as the one we might have tomorrow.  It's a pretty safe bet that people will always want to feel more confident about their appearance, and that's why Align Technology (NASDAQ: ALGN) with its Invisalign tooth straighteners is set up to grow for years and years., Headline: Align Technology Inc. stock falls Monday, underperforms market, source:MarketWatch, summary: Shares of Align Technology Inc. shed 1.25% to $219.64 Monday, on what proved to be an all-around grim trading session for the stock market, with the S&P 500...",ALGN
2,2022-09-27,"Headline: Align Technology Inc. stock falls Tuesday, underperforms market, source:MarketWatch, summary: Shares of Align Technology Inc. shed 2.47% to $214.22 Tuesday, on what proved to be an all-around dismal trading session for the stock market, with the S&P...",ALGN
3,2022-09-28,"Headline: Align Technology's Next Generation Invisalign Virtual Care AI-assisted Remote Monitoring Solution Automates and Streamlines Practice Workflows, source:Finnhub, summary: Automation – AI-assisted Automatic Assessment and Automated Notifications enable doctors to prioritize treatment tracking exceptions to address treatment progress including patient compliance,... | September 28, 2022, Headline: Align Technology Inc. stock underperforms Wednesday when compared to competitors, source:MarketWatch, summary: Shares of Align Technology Inc. slumped 0.99% to $212.10 Wednesday, on what proved to be an all-around favorable trading session for the stock market, with..., Headline: Align Technology’s Next Generation Invisalign Virtual Care AI-assisted Remote Monitoring Solution Automates and Streamlines Practice Workflows, source:Yahoo, summary: TEMPE, Ariz., September 28, 2022--Align Technology, Inc. (""Align"") (Nasdaq: ALGN), a leading global medical device company that designs, manufactures, and sells the Invisalign system of clear aligners, iTero intraoral scanners, and exocad CAD/CAM software for digital orthodontics and restorative dentistry, today introduced Invisalign Virtual Care AI, its next generation remote monitoring solution with new artificial intelligence-assisted capabilities that streamline workflows for doctors and the",ALGN
4,2022-09-29,"Headline: ALIGN TECHNOLOGY'S NEXT GENERATION INVISALIGN VIRTUAL CARE AI-ASSISTED REMOTE MONITORING SOLUTION AUTOMATES AND STREAMLINES PRACTICE WORKFLOWS, source:Finnhub, summary: TEMPE - Align Technology, Inc. , a leading global medical device company that designs, manufactures, and sells the Invisalign system of clear aligners, iTero intraoral scanners, and exocad CAD/CAM... | September 29, 2022, Headline: ALGN November 11th Options Begin Trading, source:Stock Options Channel, summary: Staff article entitled ALGN November 11th Options Begin Trading, about stock options, from Stock Options Channel., Headline: Implied Volatility Surging for Align Technology (ALGN) Stock Options, source:Yahoo, summary: Investors need to pay close attention to Align Technology (ALGN) stock based on the movements in the options market lately., Headline: Align Technology Inc. stock falls Thursday, still outperforms market, source:MarketWatch, summary: Shares of Align Technology Inc. shed 0.51% to $211.01 Thursday, on what proved to be an all-around dismal trading session for the stock market, with the S&P...",ALGN
5,2022-10-03,"Headline: Align Technology to Announce Third Quarter 2022 Results on October 26, 2022, source:Yahoo, summary: TEMPE, Ariz., October 03, 2022--Align Technology, Inc. (Nasdaq: ALGN) a leading global medical device company that designs, manufactures, and sells the Invisalign® system of clear aligners, iTero™ intraoral scanners, and exocad™ CAD/CAM software for digital orthodontics and restorative dentistry, today announced that it will report third quarter 2022 financial results on Wednesday, October 26, 2022, after the close of market. Financial results will be released at 4:00 p.m. ET (1:00 p.m. PT) and, Headline: Final Trades: Align Technology, Uber, Cheniere & more, source:CNBC, summary: The ""Halftime Report"" traders give their top picks to watch for the second half., Headline: Align Technology Introduces Latest iTero-exocad Connector™ Software Release That Enables Advanced Visualization for Doctors and Labs, With Seamless Integration of iTero™ Intraoral Camera and NIRI Images Within exocad™ Software, source:Yahoo, summary: TEMPE, Ariz. & PALMA DE MALLORCA, Spain, October 03, 2022--Align Technology, Inc. (""Align"") (Nasdaq: ALGN), a leading global medical device company that designs, manufactures, and sells the Invisalign® system of clear aligners, iTero™ intraoral scanners, and exocad™ CAD/CAM software for digital orthodontics and restorative dentistry, today introduced the latest release of the iTero-exocad Connector,™ which integrates iTero intraoral camera and NIRI images within exocad DentalCAD 3.1 Rijeka softw",ALGN
6,2022-10-04,"Headline: Align Technology Introduces Latest iTero-exocad Connector Software Release That Enables Advanced Visualization for Doctors and Labs, With Seamless Integration of iTero Intraoral Camera and NIRI Images Within exocad Software, source:Finnhub, summary: TEMPE - Align Technology, Inc. , a leading global medical device company that designs, manufactures, and sells the Invisalign system of clear aligners, iTero intraoral scanners, and exocad CAD/CAM... | October 4, 2022",ALGN
7,2022-10-06,"Headline: 2 No-Brainer Buys in This Bear Market, source:Yahoo, summary: A couple of stocks that are down more than 15% this year and can bounce back -- and look to be no-brainer buys right now -- are Align Technology (NASDAQ: ALGN) and Visa (NYSE: V).  Align Technology is a medical device company that makes clear aligners under the popular Invisalign brand.  The price of Invisalign can vary but generally, it's usually a bit more expensive than regular braces, sometimes coming in at a few thousand dollars more.",ALGN
8,2022-10-08,"Headline: Polen Capital on Align Technology (ALGN): “We Remain Confident in the Long-Term Growth Opportunity”, source:Yahoo, summary: Polen Capital, an investment management firm, published its “Polen Global Growth Fund” second quarter 2022 investor letter – a copy of which can be downloaded here. During the second quarter of 2022, the Global Growth Composite Portfolio (the “Portfolio”) was down -18.08% and -18.34% gross and net of fees, respectively, versus a decline of -15.65% […]",ALGN
9,2022-10-09,"Headline: Have $2,000? 2 Trusty Stocks to Buy Now, source:Yahoo, summary: If you have extra money to invest in the stock market right now, these two mainstays are worth considering.",ALGN
10,2022-10-13,"Headline: ALGN December 2nd Options Begin Trading, source:Stock Options Channel, summary: Staff article entitled ALGN December 2nd Options Begin Trading, about stock options, from Stock Options Channel., Headline: Align Technology Inc. stock rises Thursday, still underperforms market, source:MarketWatch, summary: Shares of Align Technology Inc. rallied 2.05% to $212.31 Thursday, on what proved to be an all-around positive trading session for the stock market, with the...",ALGN
11,2022-10-14,"Headline: Align Technology Inc. stock falls Friday, underperforms market, source:MarketWatch, summary: Shares of Align Technology Inc. shed 5.03% to $201.63 Friday, on what proved to be an all-around dismal trading session for the stock market, with the S&P...",ALGN
12,2022-10-17,"Headline: Align Technology Inc. stock outperforms market on strong trading day, source:MarketWatch, summary: Shares of Align Technology Inc. rallied 4.87% to $211.44 Monday, on what proved to be an all-around positive trading session for the stock market, with the...",ALGN
13,2022-10-18,"Headline: Align Technology (ALGN) to Post Q3 Earnings: What's in Store?, source:Yahoo, summary: Align Technology's (ALGN) Invisalign First for kids is gaining market share rapidly across all regions., Headline: Align Technology Inc. stock falls Tuesday, underperforms market, source:MarketWatch, summary: Shares of Align Technology Inc. shed 0.68% to $210.00 Tuesday, on what proved to be an all-around favorable trading session for the stock market, with the...",ALGN
14,2022-10-19,"Headline: Analysts Estimate Align Technology (ALGN) to Report a Decline in Earnings: What to Look Out for, source:Yahoo, summary: Align Technology (ALGN) doesn't possess the right combination of the two key ingredients for a likely earnings beat in its upcoming report. Get prepared with the key expectations., Headline: Align Technology Inc. stock falls Wednesday, underperforms market, source:MarketWatch, summary: Shares of Align Technology Inc. slipped 2.39% to $204.98 Wednesday, on what proved to be an all-around poor trading session for the stock market, with the...",ALGN
15,2022-10-20,"Headline: West Pharmaceutical Services (WST) Earnings Expected to Grow: What to Know Ahead of Next Week's Release, source:Yahoo, summary: West Pharmaceutical (WST) doesn't possess the right combination of the two key ingredients for a likely earnings beat in its upcoming report. Get prepared with the key expectations., Headline: Align Technology Inc. stock outperforms competitors despite losses on the day, source:MarketWatch, summary: Shares of Align Technology Inc. slid 3.27% to $198.28 Thursday, on what proved to be an all-around grim trading session for the stock market, with the S&P...",ALGN
16,2022-10-24,"Headline: Optimizing Portfolio Construction With Bayesian Analysis, source:SeekingAlpha, summary: With the aid of powerful statistical methods, portfolios can be constructed that produce market-beating returns while minimizing the probability of loss.",ALGN
17,2022-10-25,"Headline: GLOBAL BRIEFING: Sunak faces first PM questions to unite Tory party, source:Alliance News, summary: No summary",ALGN
18,2022-10-26,"Headline: Align Technology, Inc. (NASDAQ:ALGN) Shares Could Be 48% Below Their Intrinsic Value Estimate, source:Yahoo, summary: In this article we are going to estimate the intrinsic value of Align Technology, Inc. ( NASDAQ:ALGN ) by estimating..., Headline: Align Technology: Q3 Earnings Snapshot, source:Associated Press, The, summary: No summary, Headline: Align Technology 3Q Profit Declines on Macroeconomic Uncertainty, Foreign Exchange Rates, source:MarketWatch, summary: By Denny Jacob Align Technology Inc. said lower profit and revenue in the latest quarter reflected ongoing macroeconomic uncertainty, weaker consumer..., Headline: Align Technology Shares Sink 12% on 3Q Results, source:MarketWatch, summary: By Denny Jacob Align Technology Inc. shares sank 12% to $195.53 in after-hours trading Wednesday after profit in the latest quarter declined by more than..., Headline: Align Technology Inc. stock rises Wednesday, outperforms market, source:MarketWatch, summary: Shares of Align Technology Inc. advanced 1.68% to $221.64 Wednesday, on what proved to be an all-around mixed trading session for the stock market, with the..., Headline: Invisalign maker sees more than $3 billion in market cap start to disappear after earnings, revenue sink, source:MarketWatch, summary: Align Technology Inc. shares dove nearly 20% in after-hours trading Wednesday, after the maker of Invisalign teeth straighteners reported that profit fell..., Headline: Stocks making the biggest moves after hours: Meta Platforms, ServiceNow, Align Technology and more, source:CNBC, summary: See which stocks are posting big moves after the bell., Headline: Align Technology Announces Third Quarter 2022 Financial Results, source:Yahoo, summary: TEMPE, Ariz.., October 26, 2022--Align Technology, Inc. (Nasdaq: ALGN), a leading global medical device company that designs, manufactures, and sells the Invisalign® system of clear aligners, iTero™ intraoral scanners, and exocad™ CAD/CAM software for digital orthodontics and restorative dentistry, today reported financial results for the third quarter of fiscal 2022 (""Q3'22""). Q3'22 total revenues were $890.3 million, down 8.2% sequentially and down 12.4% year-over-year. Q3'22 Clear Aligner rev, Headline: Stocks moving in after hours: Meta, Ford, ServiceNow, Align Technology, source:Yahoo, summary: Shares of Meta, Ford, ServiceNow, and Align Technology are all making significant moves in after-hours trading., Headline: Align Technology (ALGN) Misses Q3 Earnings and Revenue Estimates, source:Yahoo, summary: Align Technology (ALGN) delivered earnings and revenue surprises of -38.46% and 8.11%, respectively, for the quarter ended September 2022. Do the numbers hold clues to what lies ahead for the stock?, Headline: Align Technology, Inc. (ALGN) Q3 2022 Earnings Call Transcript, source:SeekingAlpha, summary: Align Technology, Inc. (NASDAQ:NASDAQ:ALGN) Q3 2022 Results Conference Call October 26, 2022 4:30 PM ET Company Participants Shirley Stacy - VP of Corporate Communications and IR Joe Hogan..., Headline: Thursday Sector Laggards: Healthcare, Technology & Communications, source:Market News Video, summary: nan, Headline: Align Technology (ALGN) Q3 2022 Earnings Call Transcript, source:Yahoo, summary: ALGN earnings call for the period ending September 30, 2022., Headline: What You Missed On Wall Street On Thursday, source:Thefly.com, summary: Five top five lists with the news and calls moving stocks, powered by The Fly. META, MCD, MRK, CS, AIMC, RRX, NOW, STX, VFC, PDD, TWTR, AMZN, TSLA, PSX, PFE, GOOG, GOOGL, USER, OII, PTEN, SHOP, FORM, ALGN, WOLF, F, CAT, HON, MA, MO",ALGN
19,2022-10-27,"Headline: Shares of Invisalign Maker Tumble, source:Yahoo, summary: [Shareholders of Meta Platforms](https://www.wsj.com/livecoverage/stock-market-news-today-10-27-2022-us-economy-gdp-q3/card/meta-platforms-stock-sinks-in-off-hours-trading-after-earnings-G6yJDMMV01JcVkkwzl1b) aren't the only ones having a tough day. Align Technology shareholders are feeling similar pain. The maker of Invisalign teeth aligners, which [did hefty business](https://www.wsj.com/articles/adults-race-to-straighten-their-teeth-bracing-for-pandemics-end-11620227175) during the pandemic,, Headline: Align Technology price target lowered to $260 from $310 at Baird, source:Thefly.com, summary: Baird analyst Jeff Johnso... ALGN, Headline: Today’s Biggest Pre-Market Stock Movers: 10 Top Gainers and Losers on Thursday, source:InvestorPlace, summary: It's time for another dive into the biggest pre-market stock movers as we check out the latest stock news for Thursday morning!, Headline: Align Technology price target lowered to $265 from $325 at Stifel, source:Thefly.com, summary: Stifel analyst Jonathan B... ALGN, Headline: Analysts Offer Insights on Healthcare Companies: Align Tech (ALGN), Thermo Fisher (TMO) and IQVIA Holdings (IQV), source:TipRanks, summary: There&#8217;s a lot to be optimistic about in the Healthcare sector as 3 analysts just weighed in on Align Tech (<span class='tr-stock-ticker' style='color:blue; fo..., Headline: Stocks making the biggest moves premarket: Meta, Ford, Honeywell, Caterpillar & more, source:CNBC, summary: A slew of stocks were moving in the premarket on the back of earnings, including Meta Platforms. , Headline: Dow Adds 365 Points; Nasdaq Continues To Crumble, source:TalkMarkets, summary: The latest gross domestic product (GDP) report is boosting sentiment slightly on Wall Street this afternoon., Headline: Stocks making the biggest moves midday: Meta Platforms, ServiceNow, Teladoc, Credit Suisse & more, source:CNBC, summary: Thursday's biggest movers include Meta Platforms, McDonald's, Sleep Number & more., Headline: Are Investors Giving Up on These 2 Nasdaq Growth Stocks?, source:Yahoo, summary: The biggest declines among Nasdaq stocks came from Meta Platforms (NASDAQ: META) and Align Technology (NASDAQ: ALGN).  There are a lot of differences between social media and orthodontics, but the thing the two companies have in common is that they soared during the bull market in growth stocks in 2021 and have seen massive declines since then., Headline: Midday Movers: Meta Platforms, McDonald's, Align Technology and More, source:Yahoo, summary: By Liz Moyer, Headline: Why Invisalign maker Align stock is plunging today, source:Yahoo, summary: Yahoo Finance Live anchors discuss Align earnings and the company's stock performance since the pandemic., Headline: Align Technology (ALGN) Q3 Earnings Lag Estimates, Margins Drop, source:Yahoo, summary: The volatility surrounding inflationary pressure, weaker consumer confidence and the lingering impacts of COVID-19 shutdowns continue to pose challenges for Align Technology (ALGN)., Headline: Meta, Wolfspeed fall; Caterpillar, Southwest rise, source:Associated Press, The, summary: No summary, Headline: Align Technology Inc. stock underperforms Thursday when compared to competitors, source:MarketWatch, summary: Shares of Align Technology Inc. plunged 18.10% to $181.53 Thursday, on what proved to be an all-around mixed trading session for the stock market, with the..., Headline: Align Technology Shares Plummet on Third Profit Miss. This Analyst Sees an Opportunity., source:Yahoo, summary: William Blair's Brandon Vazques stuck with his Outperform rating on the company's stock on Thursday., Headline: Why Align Technology Stock Got Hammered Today, source:Yahoo, summary: Shares of dental company Align Technology (NASDAQ: ALGN) got hammered on Thursday after reporting financial results for the third quarter of 2022.  Align Technology makes money from its clear Invisalign retainers and with its iTero technology., Headline: Analysts are Revising Prices Targets of These 10 Stocks After Earnings, source:Yahoo, summary: In this article, we will take a look at the 10 stocks that received updated price targets from analysts after their recent earnings. If you want to see some more companies on the list, go directly to Analysts are Revising Prices Targets of These 5 Stocks After Earnings. The Dow Jones Industrial Average and S&P […], Headline: Invisalign Maker’s Earnings Miss Clobbers S&P’s Worst Stock, source:Yahoo, summary: (Bloomberg) -- Align Technology Inc. was already one of the worst performing stocks in the S&P 500 this year before a dismal earnings report knocked more than $3 billion off its market value. Now it’s the worst.Most Read from BloombergTwitter CEO Among Top Executives Departing as Musk Takes OverTesla Engineers Visit Twitter Office to Review Code for MuskMark Zuckerberg’s Wealth Wipeout Hits $100 Billion as Meta Misses AgainMasked Poll Watchers Are Showing Up at Voting Sites With Handguns and Kev",ALGN
20,2022-10-28,"Headline: Align Technology Inc. stock rises Friday, outperforms market, source:MarketWatch, summary: Shares of Align Technology Inc. rose 3.91% to $188.62 Friday, on what proved to be an all-around favorable trading session for the stock market, with the S&P...",ALGN
21,2022-10-29,"Headline: Why Align Technology Dropped As Much As 13.7% This Week, source:Yahoo, summary: Shares of Align Technology (NASDAQ: ALGN) dropped by as much as 13.7% this week, according to data from S&P Global Market Intelligence.  The maker of the Invisalign teeth-straightener product posted a revenue decline and disappointing earnings for the third quarter, leading investors to sell the stock.  Align Technology reported its financials for the three months ending in September on Oct. 26.",ALGN
22,2022-10-31,"Headline: Align Technology announces $200M accelerated share repurchase agreement, source:Thefly.com, summary: In a regulatory filing, A... ALGN, GS, Headline: Invisalign maker Align Technology enters $200 million accelerated stock repurchase program, source:Yahoo, summary: Invisalign maker Align Technology Inc. announced Monday that it has entered into a $200 million accelerated stock repurchase (ASR) program with Goldman Sachs & Co. LLC. The medical device company's stock, which fell 1.4% in premarket trading, has plunged 71.3% this year, to make it the S 500's worst year-to-date performer, while the SP 500 has lost 18.2%. The ASR, which is part of the $1 billion repurchase program announced in May 2021, represents 1.4% of Align's market capitalization of $14.73, Headline: Video: Monday`s ETF Movers: QVML, URA, source:Market News Video, summary: In trading on Monday, the Invesco S&P 500 QVM Multi-factor ETF is outperforming other ETFs, up about 2.8% on the day - Components of that ETF showing particular strength include shares of Align Technology, up about 6.2% and shares of Davita, up about 4.5% on the day - ALGN,DVA,FUU.CA,CCO.CA,URA,QVML., Headline: Stocks making the biggest moves midday: Wynn Resorts, TuSimple, Newell Brands, First Solar and more, source:CNBC, summary: These are the stocks posting the largest moves in midday trading. , Headline: Align Technology Announces $200 Million Accelerated Stock Repurchase Agreement Under Its $1 Billion Repurchase Program, source:Yahoo, summary: TEMPE, Ariz., October 31, 2022--Align Technology, Inc. (""Align"") (Nasdaq: ALGN), a leading global medical device company that designs, manufactures, and sells the Invisalign® system of clear aligners, iTero™ intraoral scanners, and exocad™ CAD/CAM software for digital orthodontics and restorative dentistry, today announced that it has entered into a new accelerated stock repurchase agreement (""ASR"") with Goldman Sachs & Co. LLC, to repurchase $200 million of Align's common stock under Align’s $1, Headline: Midday Movers: Wynn Resorts, Align Technology, Newell Brands and More, source:Yahoo, summary: By Liz Moyer, Headline: 2 Nasdaq Stocks Picking Themselves Off the Mat Monday, source:Yahoo, summary: The stock market wasn't able to bring its positive momentum into the new week, and the Nasdaq Composite (NASDAQINDEX: ^IXIC) found itself as the big loser on the day.  As of 11 a.m. ET, the Nasdaq was down more than 1.5%, which was worse than the smaller losses most of its benchmark peers posted.  Wynn Resorts (NASDAQ: WYNN) has attracted the notice of a well-known investor in the entertainment industry, while Align Technology (NASDAQ: ALGN) expressed its own confidence in its longer-term prospects., Headline: NEW YORK MARKET CLOSE: Stocks struggle but dollar up ahead of Fed, source:Alliance News, summary: No summary, Headline: Align Technology Inc. stock outperforms competitors on strong trading day, source:MarketWatch, summary: Shares of Align Technology Inc. rallied 3.01% to $194.30 Monday, on what proved to be an all-around poor trading session for the stock market, with the S&P..., Headline: Analysts Are Bullish on These Healthcare Stocks: Align Tech (ALGN), Alnylam Pharma (ALNY), source:TipRanks, summary: There&#8217;s a lot to be optimistic about in the Healthcare sector as 3 analysts just weighed in on Align Tech (<span class='tr-stock-ticker' style='color:blue; fo...",ALGN
23,2022-11-01,"Headline: Align Technology Inc. stock falls Tuesday, underperforms market, source:MarketWatch, summary: Shares of Align Technology Inc. slipped 0.64% to $193.06 Tuesday, on what proved to be an all-around rough trading session for the stock market, with the S&P...",ALGN
24,2022-11-02,"Headline: Align Technology Inc. stock falls Wednesday, underperforms market, source:MarketWatch, summary: Shares of Align Technology Inc. slipped 7.24% to $179.08 Wednesday, on what proved to be an all-around poor trading session for the stock market, with the...",ALGN
25,2022-11-03,"Headline: Align Technology and Desktop Metal Announce Strategic Collaboration to Make iTero Element™ Flex the Preferred Restorative Intraoral Scanner for Desktop Labs’ Customers Serving General Dentists, source:Yahoo, summary: TEMPE, Ariz. & BOSTON, November 03, 2022--Align Technology, Inc. (""Align"") (Nasdaq: ALGN) a leading global medical device company that designs, manufactures, and sells the Invisalign® system of clear aligners, iTero™ intraoral scanners, and exocad™ CAD/CAM software for digital orthodontics and restorative dentistry, and Desktop Metal, Inc. (NYSE: DM), a global leader in additive manufacturing technologies for mass production, today announced a strategic collaboration to supply iTero Element™ Fle",ALGN
26,2022-11-04,"Headline: Align Technology Inc. stock outperforms market on strong trading day, source:MarketWatch, summary: Shares of Align Technology Inc. rose 2.90% to $180.93 Friday, on what proved to be an all-around positive trading session for the stock market, with the S&P...",ALGN
