,date,information,related
90,2023-02-01,"Headline: The most overbought and oversold S&P 500 stocks to start February, source:Seeking Alpha, summary: No summary, Headline: Align Technology options imply 9.2% move in share price post-earnings, source:Thefly.com, summary: No summary, Headline: Notable companies reporting after market close, source:Thefly.com, summary: No summary, Headline: Align Technology Shares Jump 16% on 4Q Results, $1B Stock Buyback Program, source:MarketWatch, summary: By Denny Jacob Align Technology Inc. shares jumped 16% to $328 in after-hours trading Wednesday following better-than-expected results in the latest quarter..., Headline: Stocks to Watch: Meta, Tenax, Align Technology, ProSomnus, source:MarketWatch, summary: Sabela Ojea Meta Platforms Inc. on Wednesday beat revenue expectations for its latest quarter and reported improving conditions that point to signs of..., Headline: Align Technology, Inc. 2022 Q1 - Results - Earnings Call Presentation, source:SeekingAlpha, summary: The following slide deck was published by Align Technology, Inc., Headline: Align Technology, Inc. (ALGN) Q4 2022 Earnings Call Transcript, source:SeekingAlpha, summary: Align Technology, Inc. (NASDAQ:NASDAQ:ALGN) Q4 2022 Earnings Conference Call February 1, 2023 4:30 PM ETCompany ParticipantsShirley Stacy - VP, Corporate Communications & IRJoseph Hogan..., Headline: Align Technology Announces Fourth Quarter and Fiscal 2022 Financial Results, source:Yahoo, summary: TEMPE, Ariz., February 01, 2023--Align Technology, Inc. (Nasdaq: ALGN), a leading global medical device company that designs, manufactures, and sells the Invisalign® system of clear aligners, iTero™ intraoral scanners, and exocad™ CAD/CAM software for digital orthodontics and restorative dentistry, today reported financial results for the fourth quarter (""Q4'22"") and year ended December 31, 2022 (""2022""). Q4'22 total revenues were $901.5 million, up 1.3% sequentially and down 12.6% year-over-yea, Headline: Stocks moving in after hours: Meta, Align, E.L.F. Beauty, source:Yahoo, summary: Yahoo Finance Live's Seana Smith looks at several stocks trending in the after-hours trading session., Headline: Align Technologies stock surges more than 10% after earnings beat, source:Yahoo, summary: Align Technology Inc.   (ALGN)  shares rallied in the extended session Wednesday after the maker of Invisalign braces reported results that topped Wall Street estimates.  The company reported net income of $41.7 million, or 54 cents a share, compared with $191 million, or $2.40 a share, from the year-ago period., Headline: Stocks moving in after-hours: Meta, ELF, Align, source:Yahoo, summary: Stocks moving in after-hours: Meta, Elf, Align, Headline: Align Technology (ALGN) Q4 Earnings and Revenues Surpass Estimates, source:Yahoo, summary: Align Technology (ALGN) delivered earnings and revenue surprises of 13.82% and 1.38%, respectively, for the quarter ended December 2022. Do the numbers hold clues to what lies ahead for the stock?, Headline: Align Technology (ALGN) Q4 2022 Earnings Call Transcript, source:Yahoo, summary: Image source: The Motley Fool.  Align Technology (NASDAQ: ALGN)Q4 2022 Earnings CallFeb 01, 2023, 4:30 p.m. ETContents:  Prepared Remarks Questions and Answers Call Participants  Prepared Remarks:  OperatorGreetings, welcome to the Align fourth quarter and 2022 earnings call., Headline: Align Tech`s stock surges 30% to lead S&P 500 as Invisalign sales resume growth, source:MarketWatch, summary: No summary, Headline: What You Missed On Wall Street On Thursday, source:Thefly.com, summary: No summary, Headline: Align Technology price target raised to $360 from $255 at Piper Sandler, source:Thefly.com, summary: No summary, Headline: Align Technology Inc. stock rises Thursday, outperforms market, source:MarketWatch, summary: No summary",ALGN
91,2023-02-02,"Headline: Hot Stocks: ALGN, GWW surge on earnings; HBI, SIRI drop, source:Seeking Alpha, summary: No summary, Headline: Analysts Offer Insights on Healthcare Companies: Align Tech (ALGN) and Hologic (HOLX), source:TipRanks, summary: No summary, Headline: Align Technology price target raised to $335 from $260 at Baird, source:Thefly.com, summary: No summary, Headline: Align Technology upgraded to Neutral from Sell at Goldman Sachs, source:Thefly.com, summary: No summary, Headline: Goldman ups Align Technology to Neutral on more confidence in near-term demand, source:Thefly.com, summary: No summary, Headline: ALGN Crosses Above Average Analyst Target, source:ETF Channel, summary: No summary, Headline: Align Technology price target raised to $375 from $265 at Stifel, source:Thefly.com, summary: No summary, Headline: Analysts Have Conflicting Sentiments on These Healthcare Companies: Align Tech (ALGN), Boston Scientific (BSX) and Evelo Biosciences (EVLO), source:TipRanks, summary: No summary, Headline: Stocks making the biggest moves premarket: Meta, Align Technology, FedEx, Honeywell and more, source:CNBC, summary: These are the stocks posting the largest moves in premarket trading. , Headline: Fly Intel: Pre-market Movers, source:Thefly.com, summary: No summary, Headline: Align Technology price target raised to $375 from $230 at Evercore ISI, source:Thefly.com, summary: No summary, Headline: Align upgraded at Goldman as other Street firms boost price targets on quarterly results, source:Seeking Alpha, summary: No summary, Headline: Early notable gainers among liquid option names on February 2nd, source:Thefly.com, summary: No summary, Headline: Tenax, Innovative top healthcare gainers; OncoSec, Vera among losers, source:Seeking Alpha, summary: No summary, Headline: Street Wrap: Today`s Top 15 Upgrades, Downgrades, Initiations, source:Thefly.com, summary: No summary, Headline: Align Technology Shares Rally Amid 4Q Beat, Bullish Analyst Views >ALGN, source:MarketWatch, summary: By Colin Kellaher Shares of Align Technology Inc. jumped more than 20% in early trading Thursday after a strong quarterly report from the maker of the..., Headline: Align hits nine-month high propelling rivals after Q4 beat, source:Seeking Alpha, summary: No summary, Headline: What You Missed On Wall Street This Morning, source:Thefly.com, summary: No summary, Headline: All Eyes On Big Tech Earnings As Nasdaq Extends Gains, source:TalkMarkets, summary: No summary, Headline: VINO and EDBL among mid-day movers, source:Seeking Alpha, summary: No summary, Headline: Stocks making the biggest moves midday: Meta, Align Technology, Coinbase, Eli Lilly and more , source:CNBC, summary: These are the stocks posting the largest moves in midday trading. , Headline: Align Technology (ALGN) Q4 Earnings Top Estimates, Margins Drop, source:Yahoo, summary: Align Technology's (ALGN) lower scanner volume and ASPs are partially offset by higher services revenues from the larger installed base of scanners and increased non-system revenues., Headline: Dental Stocks Rally After Align Technology 4Q Beat, source:MarketWatch, summary: By Kathryn Hardison Shares of dental care and products companies rallied on Thursday following a fourth-quarter beat by Align Technology Inc. Align, the..., Headline: Midday movers: Meta Platforms, Align Technology, UnitedHealth Group and more, source:Yahoo, summary: By Liz Moyer, Headline: US STOCKS-Nasdaq futures jump nearly 2% on Meta surge, Fed relief, source:Reuters, summary: Nasdaq futures jumped on Thursday as Meta Platforms surged on rigorous cost controls, while a dovish message from Federal Reserve Chair Jerome Powell boosted bets of a softer landing for the U.S. economy., Headline: Align Tech’s stock surges 30% to lead S&P 500 as Invisalign sales resume growth, source:MarketWatch, summary: Align Technologies Inc.'s stock rallied Thursday, making one of the worst stocks of 2022 among the best of 2023 so far., Headline: Company News for Feb 2, 2023, source:Yahoo, summary: Companies in The News Are: ALGN, TMO, ATKR, WRK., Headline: Why Meta and Align Are Sending the Nasdaq Soaring Thursday, source:Yahoo, summary: Wall Street heard exactly what it wanted to hear from the Federal Reserve, and that sparked a new rally in the stock market that looked poised to continue on Thursday morning.  After having taken the brunt of the bear market hit in 2022, the Nasdaq Composite (NASDAQINDEX: ^IXIC) jumped at the opening bell, up 2.3% as of 9:41 a.m. ET.  A pair of stocks contributed the most to the Nasdaq's rally., Headline: Invisalign Maker's Stock Surges After Earnings, source:Yahoo, summary: It’s all smiles for Align Technology shareholders. Align, which makes the Invisalign orthodontic treatment, said Wednesday it booked fourth-quarter sales of $901.5 million and earned $1.73 per share on an adjusted basis. Both sales and profit topped analyst forecasts. Align shares were up 25% Thursday morning, on pace for the largest gain within the S 500. Align stock has risen more than 66% so far this year after enduring a brutal 2022. Despite this year’s rally, shares are still down about 30%, Headline: US STOCKS-Nasdaq jumps more than 2% on Meta surge, Fed relief, source:Reuters, summary: The Nasdaq rose more than 2% on Thursday to hit a near five-month intra-day high as Meta Platforms surged on rigorous cost controls, while a dovish message from Federal Reserve Chair Jerome Powell boosted bets of a softer landing for the U.S. economy., Headline: Meta Platforms, Allegiant rise; Qorvo, Canada Goose fall, source:Associated Press, The, summary: No summary, Headline: NEW YORK MARKET CLOSE: Stocks mixed after central bank decisions, source:Alliance News, summary: No summary, Headline: Align Technology Stock Soars Higher After Earnings, source:Yahoo, summary: Back on July 27 I reviewed the charts and indicators of Align Technology  , writing that ""I have no knowledge of what ALGN is going to announce to shareholders this evening, but its charts have been showing improvement since early May. Aggressive traders could probe the long side of ALGN ahead of the numbers only if they can afford to risk down to $225.""  The daily On-Balance-Volume (OBV) line has moved higher in the past two months as traders have become more aggressive buyers.  The weekly OBV line shows a strong advance over the past three months., Headline: US STOCKS-Nasdaq soars more than 3% on Meta boost, Fed relief, source:Reuters, summary: The Nasdaq rose to a near five-month intraday high as Meta Platforms surged on rigorous cost controls, while a dovish message from Federal Reserve Chair Jerome Powell boosted appetite for risky assets., Headline: Align Technology, Inc. (NASDAQ:ALGN) Q4 2022 Earnings Call Transcript, source:Yahoo, summary: Align Technology, Inc. (NASDAQ:ALGN) Q4 2022 Earnings Call Transcript February 1, 2023 Operator: Greetings, welcome to the Align Fourth Quarter and 2022 Earnings Call. . Please note, this conference is being recorded. I will now turn the conference over to your host, Shirley Stacy, with Align Technology. You may begin. Shirley Stacy: Thank you. Good […], Headline: Invisalign Maker Align Tech Catapults 27% On Its 'Rosy Vision' For 2023, source:Yahoo, summary: Align Technology painted a ""rosy vision"" for 2023, an analyst said Thursday as ALGN stock launched to its highest point since April., Headline: These Stocks Are Moving the Most Today: Meta, Align, Coinbase, Harley, Okta, and More, source:Yahoo, summary: Shares of Meta Platforms surged after fourth-quarter revenue at the Facebook parent tops analysts' expectations. Align Technology, the maker of clear teeth aligners, beat earnings and revenue expectations., Headline: Why Align Technology Stock Soared Today, source:Yahoo, summary: Shares of Align Technology (NASDAQ: ALGN) jumped 27% on Thursday after the orthodontics leader's profits surpassed investors' expectations in its fourth-quarter earnings announcement Wednesday.  After declining for several quarters, Align's revenue inched up 1.3% sequentially to $901.5 million in the fourth quarter.  Meanwhile, the medical device company's imaging systems and services sales grew by 7.8%, to $169.9 million., Headline: Align Technology Inc. stock falls Friday, underperforms market, source:MarketWatch, summary: No summary",ALGN
92,2023-02-03,"Headline: Aurora Investment Counsel Buys 3, Sells 2 in 4th Quarter, source:GuruFocus, summary: No summary",ALGN
93,2023-02-04,"Headline: Wall Street Breakfast: What Moved Markets, source:SeekingAlpha, summary: Listen on the go! A daily podcast of Wall Street Breakfast will be available this morning on Seeking Alpha, iTunes, Stitcher and Spotify., Headline: Align Technology Full Year 2022 Earnings: EPS Misses Expectations, source:Yahoo, summary: Align Technology ( NASDAQ:ALGN ) Full Year 2022 Results Key Financial Results Revenue: US$3.73b (down 5.5% from FY...",ALGN
94,2023-02-05,"Headline: Is Align Technology a Buy After Exceeding Expectations?, source:Yahoo, summary: The stock shot up around 26% after reporting fourth-quarter results that were much better than expected., Headline: Five Best And Worst Performing Healthcare Stocks In January 2023, source:TalkMarkets, summary: No summary, Headline: Align Technology Inc. stock outperforms market despite losses on the day, source:MarketWatch, summary: No summary",ALGN
95,2023-02-06,"Headline: Align Technologyin New Accelerated Buyback Agreement with Citibank for $250M of Its Stock Under $1B Stock-Repurchase Program>ALGN, source:MarketWatch, summary: By Colin Kellaher Align Technology Inc. on Monday said it plans to buy back $250 million in stock under an accelerated repurchase agreement with Citibank..., Headline: Align Technology signs USD250 million share repurchase agreement, source:Alliance News, summary: No summary, Headline: Align Technology announces $250M accelerated share buybacks, source:Seeking Alpha, summary: No summary, Headline: Align Technology announces $250M ASR, share purchase from executives, source:Thefly.com, summary: No summary, Headline: Early notable gainers among liquid option names on February 6th, source:Thefly.com, summary: No summary, Headline: Align Technology in $250 million accelerated share repurchase agreement with Citibank, source:Yahoo, summary: MARKET PULSE Medical device company Align Technology Inc. (ALGN) said Monday it has entered a $250 million accelerated share repurchase agreement with Citibank N.A. under the $1.0 billion stock buyback program announced on May 13, 2021., Headline: Stocks making the biggest moves midday: Dell, On Semiconductor, PayPal, Catalent & more, source:CNBC, summary: These are the stocks posting the biggest moves during midday trading., Headline: Align Technology Announces $250 Million Accelerated Stock Repurchase Agreement, source:Yahoo, summary: TEMPE, Ariz., February 06, 2023--Align Technology, Inc. (""Align"") (Nasdaq: ALGN), a leading global medical device company that designs, manufactures, and sells the Invisalign® system of clear aligners, iTero™ intraoral scanners, and exocad™ CAD/CAM software for digital orthodontics and restorative dentistry, today announced that it has entered into a new accelerated stock repurchase agreement (""ASR"") with Citibank, N.A. (""Citi""), to repurchase $250 million of Align's common stock under Align’s $, Headline: Align Technology Shareholders Are All Smiles Now, source:Yahoo, summary: There is perhaps no better example than Align Technology (NASDAQ: ALGN).  It rocketed higher after an earnings report last week that left Wall Street thinking growth is getting back on track after it boomed -- and then collapsed -- through the pandemic., Headline: Hedge funds caught in bigger squeeze than 2021 meme stock frenzy - Goldman Sachs note, source:Reuters, summary: Hedge funds betting against stocks globally abandoned those trades last week at the fastest pace since 2015, surpassing the speed of their exodus from the meme stock frenzy two years ago, according to a Goldman Sachs research note., Headline: Align Technology Inc. stock rises Tuesday, still underperforms market, source:MarketWatch, summary: No summary",ALGN
96,2023-02-07,"Headline: Analysts Are Upgrading These 10 Stocks, source:Yahoo, summary: In this article, we will discuss the 10 stocks recently upgraded by analysts. If you want to see more such stocks on the list, you can directly visit Analysts Are Upgrading These 5 Stocks. ON Semiconductor Corporation (NASDAQ:ON) and Pinterest, Inc. (NYSE:PINS) were among the notable stocks that posted their fourth-quarter results on Monday. While […], Headline: Align Technology Inc. stock falls Wednesday, underperforms market, source:MarketWatch, summary: No summary",ALGN
97,2023-02-08,"Headline: Jim Cramer says he’s intrigued by these 10 top-performing S&P 500 stocks, source:CNBC, summary: Jim Cramer said that he's intrigued by current winners like Tesla, Meta Platforms and Nvidia., Headline: Align Technology Appoints Karim Boussebaa, EVP and MD of iTero Scanner and Services Business—Yuval Shaked to Leave Align End of 2023, source:Yahoo, summary: TEMPE, Ariz. & ZURICH, Switzerland & TEL AVIV, Israel, February 08, 2023--Align Technology, Inc. (Nasdaq: ALGN), a leading global medical device company that designs, manufactures, and sells the Invisalign® system of clear aligners, iTero™ intraoral scanners, and exocad™ CAD/CAM software for digital orthodontics and restorative dentistry, today announced that after nearly six years with Align, Yuval Shaked, executive vice president and managing director of iTero scanner and services, has decided, Headline: Align Technology Inc. stock falls Thursday, underperforms market, source:MarketWatch, summary: No summary",ALGN
98,2023-02-09,"Headline: Align Technology Inc. stock falls Friday, underperforms market, source:MarketWatch, summary: No summary",ALGN
99,2023-02-10,"Headline: Tesla, NVIDIA make the list of Wall Street`s top performing large-cap names so far in 2023, source:Seeking Alpha, summary: No summary",ALGN
100,2023-02-12,"Headline: President Joseph Hogan Just Bought 1.6% More Shares In Align Technology, Inc. (NASDAQ:ALGN), source:Yahoo, summary: Align Technology, Inc. ( NASDAQ:ALGN ) shareholders (or potential shareholders) will be happy to see that the...",ALGN
101,2023-02-13,"Headline: Early notable gainers among liquid option names on February 13th, source:Thefly.com, summary: No summary, Headline: Align Technology Inc. stock rises Monday, outperforms market, source:MarketWatch, summary: Shares of Align Technology Inc. rallied 2.99% to $325.26 Monday, on what proved to be an all-around great trading session for the stock market, with the S&P...",ALGN
102,2023-02-14,"Headline: Barbara Oil Co. Goes on Buying Spree in 4th Quarter, source:GuruFocus, summary: No summary, Headline: Edgewood Management Now Owns 4.40% of Align Technology (ALGN), source:Fintel, summary: nan, Headline: Align Technology Inc. stock rises Tuesday, outperforms market, source:MarketWatch, summary: Shares of Align Technology Inc. rallied 1.92% to $331.52 Tuesday, on what proved to be an all-around dismal trading session for the stock market, with the...",ALGN
103,2023-02-15,"Headline: Align Technology Inc. stock rises Wednesday, outperforms market, source:MarketWatch, summary: Shares of Align Technology Inc. rose 2.07% to $338.39 Wednesday, on what proved to be an all-around positive trading session for the stock market, with the...",ALGN
104,2023-02-16,"Headline: Dentsply Sirona: The Rebuilding Begins, source:SeekingAlpha, summary: Dentsply Sirona manufactures and sells various dental products and technologies for professional dental market worldwide. Read my analysis of XRAY stock., Headline: Align Technology Inc. stock falls Thursday, underperforms market, source:MarketWatch, summary: Shares of Align Technology Inc. shed 3.61% to $326.17 Thursday, on what proved to be an all-around poor trading session for the stock market, with the S&P..., Headline: COO vs. ALGN: Which Stock Is the Better Value Option?, source:Yahoo, summary: COO vs. ALGN: Which Stock Is the Better Value Option?",ALGN
105,2023-02-17,"Headline: Align Technology put volume heavy and directionally bearish, source:Thefly.com, summary: No summary, Headline: Align Technology Inc. stock falls Friday, underperforms market, source:MarketWatch, summary: Shares of Align Technology Inc. slid 2.90% to $316.71 Friday, on what proved to be an all-around mixed trading session for the stock market, with the Dow...",ALGN
106,2023-02-20,"Headline: Align Technology Inc. stock falls Tuesday, underperforms market, source:MarketWatch, summary: No summary",ALGN
107,2023-02-21,"Headline: Align Technology Inc. stock falls Wednesday, underperforms market, source:MarketWatch, summary: No summary",ALGN
108,2023-02-23,"Headline: Align Technology Inc. stock rises Thursday, outperforms market, source:MarketWatch, summary: Shares of Align Technology Inc. inched 0.91% higher to $305.46 Thursday, on what proved to be an all-around favorable trading session for the stock market,...",ALGN
109,2023-02-24,"Headline: Align Technology Inc. stock rises Friday, outperforms market, source:MarketWatch, summary: Shares of Align Technology Inc. inched 0.27% higher to $306.28 Friday, on what proved to be an all-around dismal trading session for the stock market, with..., Headline: Pharmas, medtechs dominate list of innovation leaders thanks to patents, source:Seeking Alpha, summary: No summary",ALGN
110,2023-02-26,"Headline: Has Align Technology, Inc.'s (NASDAQ:ALGN) Impressive Stock Performance Got Anything to Do With Its Fundamentals?, source:Yahoo, summary: Most readers would already be aware that Align Technology's (NASDAQ:ALGN) stock increased significantly by 61% over the...",ALGN
111,2023-02-27,"Headline: Align Technology Inc. stock falls Monday, underperforms market, source:MarketWatch, summary: Shares of Align Technology Inc. slid 0.54% to $304.64 Monday, on what proved to be an all-around great trading session for the stock market, with the S&P 500..., Headline: The 20 worst U.S. stocks in February: the biggest loser dropped 35%, source:MarketWatch, summary: No summary",ALGN
112,2023-02-28,"Headline: Here's Why You Should Hold on to Align Technology (ALGN) Now, source:Yahoo, summary: Investors are optimistic about Align Technology (ALGN) on the growing market adoption of the iTero Element 5D Plus imaging system., Headline: Align Technology Inc. stock rises Tuesday, outperforms market, source:MarketWatch, summary: Shares of Align Technology Inc. rose 1.60% to $309.50 Tuesday, on what proved to be an all-around grim trading session for the stock market, with the S&P 500...",ALGN
113,2023-03-01,"Headline: 15 Best Short-Term Stocks To Buy Now, source:Yahoo, summary: In this article, we will be taking a look at the 15 best short-term stocks to buy now. To skip our detailed analysis of current stock market dynamics, you can go directly to see the 5 Best Short-Term Stocks To Buy Now. When you’re looking for stocks to invest in for the short-term, typically, it […], Headline: Align Technology Inc. stock falls Wednesday, still outperforms market, source:MarketWatch, summary: Shares of Align Technology Inc. slumped 0.31% to $308.53 Wednesday, on what proved to be an all-around mixed trading session for the stock market, with the...",ALGN
114,2023-03-02,"Headline: ALGN April 14th Options Begin Trading, source:Stock Options Channel, summary: No summary, Headline: Align Technology Takes Over #94 Spot From Analog Devices, source:ETF Channel, summary: No summary, Headline: Video: S&P 500 Analyst Moves: ALGN, source:Market News Video, summary: No summary, Headline: Align Technology Inc. stock rises Thursday, outperforms market, source:MarketWatch, summary: Shares of Align Technology Inc. advanced 1.52% to $313.21 Thursday, on what proved to be an all-around favorable trading session for the stock market, with...",ALGN
115,2023-03-03,"Headline: Noteworthy Friday Option Activity: ALGN, PYPL, FDX, source:Stock Options Channel, summary: No summary, Headline: Why Is Align Technology (ALGN) Down 13% Since Last Earnings Report?, source:Yahoo, summary: Align Technology (ALGN) reported earnings 30 days ago. What's next for the stock? We take a look at earnings estimates for some clues., Headline: Align Technology Inc. stock rises Friday, outperforms market, source:MarketWatch, summary: Shares of Align Technology Inc. rose 6.82% to $334.56 Friday, on what proved to be an all-around positive trading session for the stock market, with the S&P...",ALGN
116,2023-03-06,"Headline: Align Technology: Valuation Not `Aligned` To Current Growth Prospects, source:Seeking Alpha, summary: No summary, Headline: ALGN Crosses Above Average Analyst Target, source:ETF Channel, summary: No summary, Headline: Align Technology: Valuation Not 'Aligned' To Current Growth Prospects, source:SeekingAlpha, summary: Align Technology's shares have doubled off their November 2022 low. Click here to see why ALGN stock is an avoid now., Headline: Early notable gainers among liquid option names on March 6th, source:Thefly.com, summary: No summary, Headline: 5 Stocks That Powered Nasdaq ETF Last Week, source:Yahoo, summary: The tech-heavy Nasdaq Composite Index outperformed last week, gaining 2.6%, while the S&P 500 and the Dow Jones were up 1.9% and 1.7%, respectively., Headline: Align Technology Inc. stock rises Monday, outperforms market, source:MarketWatch, summary: Shares of Align Technology Inc. inched 0.37% higher to $335.80 Monday, on what proved to be an all-around great trading session for the stock market, with..., Headline: BDX or ALGN: Which Is the Better Value Stock Right Now?, source:Yahoo, summary: BDX vs. ALGN: Which Stock Is the Better Value Option?",ALGN
