,date,information,related
74,2022-12-14,"Headline: Cardiff Oncology: Staying The Course, source:SeekingAlpha, summary: Cardiff Oncology's stock is down in recent months due to some strategic changes. Read more to see a full investment analysis of CRDF stock., Headline: BMO Capital Reaffirms Their Hold Rating on Amgen (AMGN), source:TipRanks, summary: No summary, Headline: Finding 20 Dividend Growth Stocks In A Bad Market, source:TalkMarkets, summary: No summary, Headline: Horizon Jumps 15% on $26 Billion Acquisition Deal, source:GuruFocus, summary: No summary, Headline: Fresenius Kabi becomes latest drugmaker to win approval of biosimilar of AbbVie`s Humira, source:Seeking Alpha, summary: No summary, Headline: 15 Biggest Diet/Weight Loss Companies in the World, source:Yahoo, summary: In this article, we will be taking a look at the 15 biggest diet/weight loss companies in the world. To skip our detailed analysis of these companies, you can go directly to see the 5 Biggest Diet/Weight Loss Companies in the World. Over the years, there has been a growth in popularity when it comes to […], Headline: 12 Best Blue Chip Stocks That Outperformed in 2022, source:Yahoo, summary: In this article, we will take a look at 12 best blue chip stocks that outperformed in 2022. If you want to see more best blue chip stocks that outperformed in 2022, go directly to 5 Best Blue Chip Stocks That Outperformed in 2022. 2022 has been a challenging year for the markets as the […], Headline: Biotech Stock Roundup: HZNP Surges on AMGN Offer, TRDA Gains on VRTX Deal & More, source:Yahoo, summary: Acquisitions news from HZNP and AMGN form the key highlights from the biotech sector during the past week., Headline: Best Dogs of the Dow Stocks Ranked By Hedge Fund Sentiment, source:Yahoo, summary: In this article, we discuss 10 best Dogs of the Dow stocks ranked by hedge fund sentiment. You can skip our detailed analysis of the Dogs’ performance over the years, and go directly to read 5 Best Dogs of the Dow Stocks Ranked By Hedge Fund Sentiment. ‘Dogs of the Dow’ is an investment strategy […], Headline: GILD vs. AMGN: Two Splendid Dividend Stocks, but One Looks Better, source:TipRanks, summary: No summary, Headline: Amgen Inc. stock falls Thursday, still outperforms market, source:MarketWatch, summary: No summary",AMGN
75,2022-12-15,"Headline: 20 Dividend Growth Stocks For Faster Growth And Profit, source:TalkMarkets, summary: No summary, Headline: The total return for Amgen (NASDAQ:AMGN) investors has risen faster than earnings growth over the last five years, source:Yahoo, summary: Generally speaking the aim of active stock picking is to find companies that provide returns that are superior to the..., Headline: 5 Stocks to Watch on Dividend Hikes Before 2022 Wraps Up, source:Yahoo, summary: Investors may keep a tab on LW, NUE, PWRr, TTC, and AMGN which have lately hiked their dividend payments to reward investors., Headline: Amgen Inc. (AMGN) Is a Trending Stock: Facts to Know Before Betting on It, source:Yahoo, summary: No summary, Headline: Primecap Odyssey Funds` 2022 Annual Shareholder Letter, source:GuruFocus, summary: No summary, Headline: Amgen Inc. stock rises Friday, outperforms market, source:MarketWatch, summary: No summary, Headline: Gilead: Downgrade To Hold, source:SeekingAlpha, summary: Gilead's return profile has weakened substantially given the valuation risks and fundamental uncertainties. Read why GILD is a Hold.",AMGN
76,2022-12-16,"Headline: Powell Cancels the Santa Rally. Here’s Hoping 2023 Is Better., source:MarketWatch, summary: Despite retail sales falling in November a record season is still forecast, Donald Trump moves into digital trading cards, Covid-19 cases are rising, and..., Headline: Amgen's (NASDAQ:AMGN) Dividend Will Be Increased To $2.13, source:Yahoo, summary: Amgen Inc. ( NASDAQ:AMGN ) will increase its dividend from last year's comparable payment on the 8th of March to $2.13..., Headline: 2 Best Biotech Stocks to Buy Right Now, source:Yahoo, summary: The global population is growing with each passing year.  The pharmaceutical industry has been at the forefront, with the launch of game-changing medicines and vaccines in recent decades.  With the global population expected to rise from around 8 billion now to 9.7 billion by 2050, rising demand for medical treatments is practically built into the business model of big pharma., Headline: Why Atlanta Tops the Hottest 2023 Real Estate Markets, source:MarketWatch, summary: Georgia’s capital leads four other Southern cities in an analysis by the National Association of Realtors. NAR forecasts that the top markets should grow 5%,..., Headline: Deal Making Will Rebound in 2023, source:Yahoo, summary: Economic conditions won’t be ideal next year, but executives will have more confidence in making acquisitions.",AMGN
77,2022-12-17,"Headline: Wall Street Breakfast: What Moved Markets, source:SeekingAlpha, summary: Listen on the go! A daily podcast of Wall Street Breakfast will be available this morning on Seeking Alpha, iTunes, Stitcher and Spotify., Headline: Amid Recession Fears, Consider The Low-Risk NPP Strategy, source:SeekingAlpha, summary: The market is going through a period of extraordinary uncertainty. It makes the task of investing and conserving capital hugely challenging. Read more here.",AMGN
78,2022-12-18,"Headline: IBBQ: Healthcare Dashboard For December, source:SeekingAlpha, summary: The pharmaceuticals/biotechnology subsector has good value and quality scores. Click here to read more about IBBQ ETF., Headline: Dividend Champion, Contender, And Challenger Highlights: Week Of December 18, source:SeekingAlpha, summary: Click here to know which companies changed their dividends, companies with upcoming ex-dividend dates and those with upcoming pay dates., Headline: Viridian Therapeutics initiated at buy at Needham on lead asset for thyroid eye disease, source:Seeking Alpha, summary: No summary",AMGN
79,2022-12-19,"Headline: Building A $100,000 Market-Crushing Dividend Portfolio, source:SeekingAlpha, summary: In this article, I start by explaining the theoretical background behind the success of dividend (growth) investing. Read more here., Headline: Amgen Is Making A Smart Move With Horizon Therapeutics, source:SeekingAlpha, summary: Amgen is making a major acquisition of Horizon Therapeutics, one that it can comfortably afford. Click here for more on AMGN acquiring HZNP., Headline: Amgen Inc. stock underperforms Monday when compared to competitors, source:MarketWatch, summary: Shares of Amgen Inc. sank 0.64% to $265.70 Monday, on what proved to be an all-around dismal trading session for the stock market, with the S&P 500 Index..., Headline: Amgen (AMGN) Stock Moves -0.64%: What You Should Know, source:Yahoo, summary: In the latest trading session, Amgen (AMGN) closed at $265.70, marking a -0.64% move from the previous day.",AMGN
80,2022-12-20,"Headline: Arrowhead receives $25M milestone payment from Amgen for heart disease treatment, source:Seeking Alpha, summary: No summary, Headline: Possible bearish signals as Amgen Inc. (NASDAQ:AMGN) insiders disposed of US$5.2m worth of stock, source:Yahoo, summary: In the last year, many Amgen Inc. ( NASDAQ:AMGN ) insiders sold a substantial stake in the company which may have..., Headline: Amgen Inc. stock underperforms Tuesday when compared to competitors, source:MarketWatch, summary: Shares of Amgen Inc. dropped 0.36% to $264.75 Tuesday, on what proved to be an all-around great trading session for the stock market, with the S&P 500 Index..., Headline: Q4 Earnings Season Update and Analyst Reports for Broadcom, UPS & Amgen, source:Yahoo, summary: Today's Research Daily features update on the Q4 earnings season and new research reports on Broadcom (AVGO), UPS (UPS), Amgen (AMGN) and 16 other stocks.",AMGN
81,2022-12-21,"Headline: Nicholas Ward`s Dividend Growth Portfolio: November 2022 Update, source:Seeking Alpha, summary: No summary, Headline: XBI: Attractive Value In Diversified Biotech Growth, source:SeekingAlpha, summary: Valuations on biotechnology stocks have moderated substantially since the pandemic peak in 2021. Click to read my analysis of the SPDR S&P Biotech ETF (XBI)., Headline: The Zacks Analyst Blog Highlights Broadcom, United Parcel Service, Amgen, America Movil and Manulife Financial, source:Yahoo, summary: Broadcom, United Parcel Service, Amgen, America Movil and Manulife Financial are part of the Zacks top Analyst Blog., Headline: Dow Jones Rallies After Economic Data; Nike Surges 15% On Earnings; Tesla Hits New Low, source:Yahoo, summary: The Dow Jones rallied 375 points Wednesday after consumer and housing data, as Nike stock surged 15% on strong earnings results., Headline: Amgen Inc. stock rises Wednesday, still underperforms market, source:MarketWatch, summary: Shares of Amgen Inc. inched 0.57% higher to $266.26 Wednesday, on what proved to be an all-around favorable trading session for the stock market, with the..., Headline: Nicholas Ward's Dividend Growth Portfolio: November 2022 Update, source:SeekingAlpha, summary: My passive income was up by 12.03% during November and my dividends are up by 21.15% year to date. Read more to see an update on my portfolio for Nov 2022.",AMGN
82,2022-12-22,"Headline: 2 No-Brainer Biotech Stocks to Buy Right Now, source:Yahoo, summary: Vertex Therapeutics (NASDAQ: VRTX) and Amgen (NASDAQ: AMGN) have swum against the tide all year, with their shares rising as the S&P 500 has struggled.  While Vertex's pipeline is about to extend well beyond cystic fibrosis (CF), Amgen's combination of emerging drugs, plus the accretive nature of its deal to buy Horizon Therapeutics, could reward investors in the long run., Headline: Dow Jones Dives After GDP, Jobless Data; CarMax Plunges On 'Vehicle Affordability Issues', source:Yahoo, summary: The Dow Jones dived more than 400 points Thursday after first-time jobless claims and GDP. CarMax plunged on ""vehicle affordability issues."", Headline: Amgen Inc. stock underperforms Thursday when compared to competitors, source:MarketWatch, summary: Shares of Amgen Inc. sank 0.38% to $265.26 Thursday, on what proved to be an all-around dismal trading session for the stock market, with the S&P 500 Index..., Headline: Amgen inks USD4 billion loan agreements for Horizon acquisition, source:Alliance News, summary: No summary",AMGN
83,2022-12-23,"Headline: LegoChem Biosciences, Amgen in Licensing Agreement, source:MarketWatch, summary: By Chris Wack LegoChem Biosciences Inc. said Friday that it has entered into a research collaboration and license agreement with Amgen Inc. Under the deal,..., Headline: Amgen in $4B term loan credit agreement to finance Horizon Therapeutics acquisition, source:Seeking Alpha, summary: No summary, Headline: Dow Jones Falls On Inflation Data; Tesla Stock Hits New Low Amid Elon Musk Comments, source:Yahoo, summary: The Dow Jones Industrial Average dropped Friday on key inflation data. Tesla stock hit a new low amid Elon Musk's comments on not selling shares., Headline: Amgen Inc. stock underperforms Friday when compared to competitors, source:MarketWatch, summary: Shares of Amgen Inc. slumped 0.51% to $263.92 Friday, on what proved to be an all-around favorable trading session for the stock market, with the S&P 500...",AMGN
84,2022-12-24,"Headline: How To Build Wealth: Buy Low And Sell High Consistently, source:SeekingAlpha, summary: What if we could buy low and sell high on a consistent basis? We discuss a systematic and rather conservative strategy to buy low and sell high. Click for more., Headline: HQH: 50 Big-Yield Healthcare Stocks, These 3 Worth Considering, source:SeekingAlpha, summary: We share data on over 50 big-yield healthcare investments, including individual stocks, REITs, closed-end funds (CEFs) and bonds. Learn about our 3 top picks here., Headline: An Intrinsic Calculation For Amgen Inc. (NASDAQ:AMGN) Suggests It's 37% Undervalued, source:Yahoo, summary: Does the December share price for Amgen Inc. ( NASDAQ:AMGN ) reflect what it's really worth? Today, we will estimate..., Headline: The Top 4 Dow Stock Winners of 2022, source:Yahoo, summary: The Dow Jones Industrial Average experienced volatility this year, facing multiple headwinds. Even so, a few stocks listed in the index performed well. Here's a look at four of them., Headline: 2 Market-Beating Stocks to Buy in 2023 and Hold Forever, source:Yahoo, summary: For these companies' shareholders, it may be tempting to take profits right now. But both stocks can keep growing for a while.",AMGN
85,2022-12-25,"Headline: Goldman Sachs highlights key healthcare themes for 2023, source:Seeking Alpha, summary: No summary, Headline: One Company Dominates Wall Street on Oil Frenzy, source:Yahoo, summary: The Dow Jones Industrial Average experienced volatility this year, facing multiple headwinds. Even so, a few stocks listed in the index performed well. Here's a look at four of them.",AMGN
86,2022-12-26,"Headline: Amgen Inc. stock outperforms market despite losses on the day, source:MarketWatch, summary: No summary",AMGN
87,2022-12-27,"Headline: Amgen in licensing deal with LegoChem for antibody drug conjugates, source:Seeking Alpha, summary: No summary, Headline: Dow Jones Falls After Housing Data As Apple Hits New Low; Tesla Plunges On Reduced Production Schedule In China, source:Yahoo, summary: The Dow Jones Industrial Average turned lower after economic data. Tesla dived on a report that the EV giant will run a reduced production schedule at its Shanghai plant in January., Headline: Jefferies' Michael Yee still likes Amgen in the biotech sector, source:CNBC, summary: Michael Yee, Jefferies biotech analyst, joins 'Closing Bell' to discuss biotech, which is on pace for its worst year since 2016., Headline: Amgen (AMGN) Stock Moves -0.2%: What You Should Know, source:Yahoo, summary: Amgen (AMGN) closed the most recent trading day at $263.39, moving -0.2% from the previous trading session., Headline: Dow 30 Stocks List: Ranked By 2022 Hedge Fund Bullishness Index, source:Yahoo, summary: In this article, we discuss the Dow 30 stocks and their rank according to the 2022 hedge fund bullishness index. The Dow Jones Industrial Average, sometimes known as Dow Jones or just the Dow, is an indicator of 30 renowned American firms that are traded on NYSE and NASDAQ. One of the first and most […], Headline: Amgen Inc. stock falls Wednesday, still outperforms market, source:MarketWatch, summary: No summary",AMGN
88,2022-12-28,"Headline: Race is on to develop new generation of weight-loss drugs, source:Yahoo, summary: Surging demand and tight supply for a new class of obesity drugs has sparked a race among several of the world’s largest pharmaceutical companies to develop rival medications for a market projected to be worth $50bn in annual revenues by the end of the decade.  Eli Lilly, Amgen, Pfizer and Regeneron are among the companies aiming to compete with market leader Novo Nordisk in a category which analysts say is rapidly becoming a healthcare priority and could produce several blockbuster obesity treatments this decade.  Mounjaro, a similar medication already marketed by Lilly for treating diabetes but which is expected to get a green light from regulators next year for obesity, is also scarce at least in part because of off-label use by patients with obesity., Headline: The $100,000 Market-Crushing HIGH-Yield Portfolio, source:SeekingAlpha, summary: In this article, I discuss my $100,000 high-yield model portfolio, which comes with both a high yield and high dividend growth., Headline: Amgen Inc. (NASDAQ:AMGN) is a favorite amongst institutional investors who own 82%, source:Yahoo, summary: To get a sense of who is truly in control of Amgen Inc. ( NASDAQ:AMGN ), it is important to understand the ownership..., Headline: Dow Jones Rises After Weak Housing Data; Tesla Stock Hits New Low Amid Historic Plunge, source:Yahoo, summary: The Dow Jones rose Wednesday after key economic data. Tesla stock hit a new low, threatening to add to December's historic plunge., Headline: The Battles Brewing That Could Stoke Already Red-Hot Eli Lilly Stock, source:Yahoo, summary: Investors are closely watching two Eli Lilly battles that will unfold in 2023 as LLY stock continues a fevered streak, tacking on new highs., Headline: 3 Top Performing Blue-Chips of 2022, source:Yahoo, summary: Many investors have flocked to blue-chip stocks in 2022 to shield themselves from volatility. Can the strength of these three stocks spill into 2023?",AMGN
89,2022-12-29,"Headline: 2 Superstar High-Yield Blue-Chip Buys, source:SeekingAlpha, summary: Dividend growth blue-chips are the best-performing asset class in history. See two stocks that one will want to own in 2023 and beyond., Headline: Zacks Investment Ideas feature highlights: Caterpillar, Chevron and Amgen, source:Yahoo, summary: Caterpillar, Chevron and Amgen have been highlighted in this Investment Ideas article., Headline: Amgen Inc. (AMGN) is Attracting Investor Attention: Here is What You Should Know, source:Yahoo, summary: No summary, Headline: 2 Unstoppable Dividend Growth Stocks to Buy in 2023 and Beyond, source:Yahoo, summary: The beauty of investing for dividend income is that when it's done right, the strategy can provide investors with streams of inflation-topping growth in passive income.  Amgen's (NASDAQ: AMGN) medicines reach millions of patients throughout the world each year, which positions it as one of the largest pharmaceutical companies on the planet.  As you would expect from a big pharma company, its portfolio offering is diversified across a number of therapeutic areas, such as oncology, bone health, and inflammation, to name just a few., Headline: Dow Jones Rallies 300 Points After Jobless Claims; Tesla Stock Surges On Reiterated Buy Rating, source:Yahoo, summary: The Dow Jones rallied Thursday after first-time jobless claims. Tesla stock raced higher on a reiterated overweight rating., Headline: Amgen Inc. stock rises Thursday, still underperforms market, source:MarketWatch, summary: Shares of Amgen Inc. inched 0.67% higher to $263.16 Thursday, on what proved to be an all-around favorable trading session for the stock market, with the S&P..., Headline: Amgen (AMGN) Gains But Lags Market: What You Should Know, source:Yahoo, summary: Amgen (AMGN) closed at $263.16 in the latest trading session, marking a +0.67% move from the prior day.",AMGN
90,2022-12-30,"Headline: Drugmakers Spent Freely in 2022 to Protect Revenue, source:Yahoo, summary: Pfizer, Amgen and Bristol-Myers Squibb bought makers of proven drugs ahead of potential rising competition from generics., Headline: Dow Jones Beats S&P 500 in 2022: 5 Hot Stocks, source:Yahoo, summary: The Dow Jones fared as the best of the indexes and five stocks -- Chevron (CVX), Merck (MRK), Travelers (TRV), Amgen (AMGN), and Caterpillar (CAT) -- gained in double-digits in 2022., Headline: Dow Jones Falls 275 Points In Final Trading Day; Tesla Stock Set To End 2022 With Record Loss, source:Yahoo, summary: The Dow Jones fell 275 points Friday in the final session of 2022. Tesla stock is set to finish with its worst yearly performance on record., Headline: Amgen Inc. stock outperforms competitors despite losses on the day, source:MarketWatch, summary: Shares of Amgen Inc. slipped 0.20% to $262.64 Friday, on what proved to be an all-around rough trading session for the stock market, with the S&P 500 Index...",AMGN
91,2022-12-31,"Headline: 5 biggest deals of 2022: Musk's Twitter buyout, Microsoft-Activision, source:Yahoo, summary: As we head into 2023, here's a look back at a year that saw dealmaking slow into year-end amid rising interest rates by central banks, with three of the top five deals fraught with regulatory hurdles and controversy. Here are the five biggest merger deals of the year, as covered first on InvestingPro+.",AMGN
92,2023-01-01,"Headline: Amgen Inc. (NASDAQ:AMGN) is largely controlled by institutional shareholders who own 82% of the company, source:Yahoo, summary: If you want to know who really controls Amgen Inc. ( NASDAQ:AMGN ), then you'll have to look at the makeup of its share..., Headline: 2023 Dividend Growth Portfolio Review And Look Ahead, source:Seeking Alpha, summary: No summary, Headline: The Dow Stock Dogs Performed In 2022, source:SeekingAlpha, summary: Very few investment categories generated a positive return in 2022. One area within equities that outperformed the broader market was stocks that had dividends associated with them.",AMGN
93,2023-01-02,"Headline: BlackRock, Kimberly-Clark Among 13 Companies To Start 2023 With Annual Dividend Increases, source:SeekingAlpha, summary: January will bring double-digit boosts from several companies. Click here to see which companies will announce dividend increases in 2023., Headline: Dow`s nearly 100-point drop led by losses in shares of Chevron, Apple, source:MarketWatch, summary: No summary",AMGN
94,2023-01-03,"Headline: Why The Dogs Of The Dow Strategy Will Likely Succeed In 2023, source:SeekingAlpha, summary: The Dogs of the Dow is a strategy of buying the 10 highest yielding stocks in the Dow (or a subset thereof). Read more to see our recommendations., Headline: Researchers` reanalysis questions mortality data in FOURIER trial, source:Thefly.com, summary: No summary, Headline: Research raises `valid questions` about Amgen`s Repatha, says Barclays, source:Thefly.com, summary: No summary, Headline: Amgen`s Repatha under fire over cardiovascular outcomes data in key trial, source:Seeking Alpha, summary: No summary, Headline: Amgen Becomes Oversold, source:Dividend Channel, summary: No summary, Headline: Amgen's (NASDAQ:AMGN) Upcoming Dividend Will Be Larger Than Last Year's, source:Yahoo, summary: Amgen Inc. ( NASDAQ:AMGN ) has announced that it will be increasing its dividend from last year's comparable payment on..., Headline: Amgen Inc. stock falls Tuesday, still outperforms market, source:MarketWatch, summary: Shares of Amgen Inc. sank 0.38% to $261.65 Tuesday, on what proved to be an all-around rough trading session for the stock market, with the S&P 500 Index..., Headline: Buy 4 January Dogs Of The Dow, Watch 4 More, source:SeekingAlpha, summary: More than half this collection is too pricey and reveals only skinny dividends. Here are 4 January Dogs of the Dow you should buy., Headline: My 26-Stock $349k Portfolio Gets A Nice Petrobras Present To End A Very Difficult 2022, source:SeekingAlpha, summary: My portfolio, built specifically for my retirement, gets a nice end of the year Petrobras dividend to help ease market pain. Learn more about my portfolio here.",AMGN
95,2023-01-04,"Headline: Amgen Inc. stock outperforms market on strong trading day, source:MarketWatch, summary: Shares of Amgen Inc. rallied 1.05% to $264.39 Wednesday, on what proved to be an all-around great trading session for the stock market, with the S&P 500..., Headline: AMGEN TO PRESENT AT THE 41ST ANNUAL J.P. MORGAN HEALTHCARE CONFERENCE, source:Yahoo, summary: Amgen (NASDAQ:AMGN) will present at the 2023 J.P. Morgan Healthcare Conference at 6:45 p.m. ET on Monday, January 9, 2023. Robert A. Bradway, chairman and chief executive officer at Amgen will present at the conference. The webcast will be broadcast over the internet simultaneously and will be available to members of the news media, investors and the general public., Headline: Amgen (AMGN) Outpaces Stock Market Gains: What You Should Know, source:Yahoo, summary: Amgen (AMGN) closed at $264.39 in the latest trading session, marking a +1.05% move from the prior day., Headline: Amgen Inc. stock rises Thursday, outperforms market, source:MarketWatch, summary: No summary",AMGN
96,2023-01-05,"Headline: AMGN Crosses Above Average Analyst Target, source:ETF Channel, summary: No summary, Headline: Investors’ Best Friend in 2022: The Dogs of the Dow, source:Yahoo, summary: The 10 stocks with the highest dividend yields of the Dow components at the beginning of last year rose 2.2%., Headline: Healthcare Stocks Had a Strong 2022. It Isn’t Too Late to Buy., source:Yahoo, summary: Profits in the sector tend to be stable even if hard times hurt earnings elsewhere, so the current high inflation and rising rates, represent a chance for the shares to shine., Headline: Tracking Baker Brothers Portfolio - Q3 2022 Update, source:SeekingAlpha, summary: Baker Brothers' 13F portfolio value decreased from $17.63B to $15.27B this quarter. Find out the ongoing analysis of the changes made to the portfolio on a quarterly basis., Headline: The Dow`s Biggest Dividends: Here Are 2023`s Dogs., source:The Online Investor, summary: No summary",AMGN
