,date,information,related
0,2022-09-23,"Headline: Solicitor general recommends Supreme Court shouldn't review Amgen patent case, source:Thefly.com, summary: The U.S. solicitor genera... AMGN, Headline: Amgen (NASDAQ:AMGN) shareholders have earned a 7.3% CAGR over the last five years, source:Yahoo, summary: If you buy and hold a stock for many years, you'd hope to be making a profit. But more than that, you probably want to..., Headline: Amgen Inc. stock underperforms Friday when compared to competitors, source:MarketWatch, summary: Shares of Amgen Inc. shed 0.34% to $226.97 Friday, on what proved to be an all-around rough trading session for the stock market, with the S&P 500 Index..., Headline: Don't Fight The Fed: 2 Blue Chip Dividend Buys And 1 Strong Sell, source:SeekingAlpha, summary: Fed took the most hawkish stance yet, as Powell takes a page out of Volcker's book. Find out couple of high-quality dividend names to pick up ahead of any turbulence.",AMGN
1,2022-09-24,"Headline: The Near-Perfect Portfolio: Sleep Well During Turbulent Times, source:SeekingAlpha, summary: The principles of NPP revolve around sustainable income, lower drawdowns, capital preservation, and reasonable growth over the long. Read more here.",AMGN
2,2022-09-26,"Headline: MDA Breakout Stocks Week 39 - September 2022: Short-Term Picks To Give You An Edge, source:SeekingAlpha, summary: Two new Breakout Stocks for Week 39 with better than 10% short-term upside potential and a Dow 30 Pick. Average cumulative returns now down to +108.7% YTD., Headline: 10 Best Biotech Stocks Under $10, source:Yahoo, summary: In this article, we will look at the 10 best biotech stocks under $10. If you want to explore similar biotech stocks with promising prospects that you can get for under $10, you can also take a look at 5 Best Biotech Stocks Under $10. The Global Biotech Industry According to an industry analysis report […], Headline: Dow Jones ETF Avoids Bear Market: 4 Stocks in Green, source:Yahoo, summary: Both the S&P 500 and the tech-heavy Nasdaq Index are in bear market while the Dow Jones in the only of the three main indexes not to have bear market status.",AMGN
3,2022-09-27,"Headline: The 7 Best Stocks to Buy to Tap Into a Hidden Bull Market, source:InvestorPlace, summary: Despite the ongoing worries on Wall Street, these are the best stocks to buy to play the hidden bull market., Headline: Wall Street Breakfast: Dollar Vs. Stocks, source:SeekingAlpha, summary: Listen on the go! A daily podcast of Wall Street Breakfast will be available by 8:00 a.m. on Seeking Alpha, iTunes, Stitcher and Spotify. Dollar vs. Stocks The U.S., Headline: Warning! A Housing Market Crash Will Tank These 3 Stocks., source:InvestorPlace, summary: Don't be complacent about a potential black-swan event. A housing market crash would send these three stocks plunging., Headline: Amgen Inc. (NASDAQ:AMGN) insiders sold US$4.9m worth of stock suggesting impending weakness., source:Yahoo, summary: Many Amgen Inc. ( NASDAQ:AMGN ) insiders ditched their stock over the past year, which may be of interest to the..., Headline: Amgen (AMGN) Dips More Than Broader Markets: What You Should Know, source:Yahoo, summary: In the latest trading session, Amgen (AMGN) closed at $225.99, marking a -0.39% move from the previous day.",AMGN
4,2022-09-28,"Headline: Cantor Fitzgerald healthcare analysts to hold KOL luncheon panel, source:Thefly.com, summary: In conjunction with Canto... AZN, AMGN, MRTX, GILD, IMAB, NVS, SURF, PFE, ALXO, RHHBY, MRK, Headline: 3 Biotech Stocks to Buy and Hold for the Next 10 Years, source:Yahoo, summary: Several biotech stocks have outperformed the struggling market this year.  This list includes Vertex Pharmaceuticals (NASDAQ: VRTX), Exelixis (NASDAQ: EXEL), and Amgen (NASDAQ: AMGN).  Let's consider why these three biotechs are solid buys for the next decade., Headline: Amgen management to meet virtually with Oppenheimer, source:Thefly.com, summary: Virtual Meeting to be hel... AMGN",AMGN
5,2022-09-29,"Headline: November 11th Options Now Available For Amgen, source:Stock Options Channel, summary: Staff article entitled November 11th Options Now Available For Amgen , about stock options, from Stock Options Channel.",AMGN
6,2022-10-01,"Headline: How To Aim For A Million Dollar Portfolio And Retire At 62, source:SeekingAlpha, summary: Click here to read more about several strategies and model portfolios that can help you retire with a one million dollar portfolio., Headline: Amgen Inc. (NASDAQ:AMGN) Looks Just Right, source:Yahoo, summary: With a price-to-earnings (or ""P/E"") ratio of 18.3x Amgen Inc. ( NASDAQ:AMGN ) may be sending bearish signals at the..., Headline: Bristol-Myers Squibb: A Gem In A Period Of Macroeconomic Uncertainties, source:SeekingAlpha, summary: The company's medicines received over 10 regulatory approvals in Europe, Japan, and the US in the first half of 2022. Read more to see our price target on BMY.",AMGN
7,2022-10-02,"Headline: IGA: Value-Oriented Portfolio Leading To Outperformance, source:SeekingAlpha, summary: IGA has been performing relatively well during the challenging 2022 market. See why I believe the CEF is a worthwhile candidate for adding to one's portfolio.",AMGN
8,2022-10-03,"Headline: Can AbbVie's (ABBV) New Drugs Make up for Lost Humira Sales?, source:Yahoo, summary: AbbVie's (ABBV) new drugs, Skyrizi and Rinvoq, are faring well, bolstered by approval in new indications. They are expected to drive revenues once Humira loses U.S. exclusivity in 2023., Headline: Could This Biosimilar Drug Candidate Be a Hit for Novartis?, source:Yahoo, summary: On Sept. 19, Novartis (NYSE: NVS) shared positive news with investors regarding the clinical trial results for its biosimilar drug candidate to Amgen's (NASDAQ: AMGN) osteoporosis medicine Prolia.  With Prolia set to lose exclusivity in the U.S. in 2025, Novartis could be close to booking some revenue from its biosimilar drug.  Let's go over the outcome of the clinical trial and the U.S. osteoporosis market to figure this out., Headline: My 27-Stock $334k Retirement Portfolio's September Disaster Saved Somewhat By Dividends, source:SeekingAlpha, summary: My portfolio, built specifically for my retirement ~20+ years from now, had a crushing September, along with the rest of the market, in spite of amazing Petrobras dividends.",AMGN
9,2022-10-04,"Headline: Amgen (AMGN) Gains But Lags Market: What You Should Know, source:Yahoo, summary: Amgen (AMGN) closed at $233.02 in the latest trading session, marking a +1.12% move from the prior day.",AMGN
10,2022-10-05,"Headline: Amgen (NASDAQ:AMGN) jumps 3.1% this week, though earnings growth is still tracking behind five-year shareholder returns, source:Yahoo, summary: When you buy and hold a stock for the long term, you definitely want it to provide a positive return. Furthermore..., Headline: Buy 4 October Dogs Of The Dow And Watch 4 More, source:SeekingAlpha, summary: The Dow adds a stock if the company has an excellent reputation, demonstrates sustained growth, and is of interest to a large number of investors. Read more here., Headline: Amgen Inc. stock outperforms competitors on strong trading day, source:MarketWatch, summary: Shares of Amgen Inc. inched 0.34% higher to $233.82 Wednesday, on what proved to be an all-around dismal trading session for the stock market, with the S&P...",AMGN
11,2022-10-06,"Headline: Amgen opens new R&D site in San Francisco's Oyster Point, source:Thefly.com, summary: Amgen announced the openi... AMGN, Headline: Birch Capital Management, LLC  - GuruFocus.com, source:GuruFocus, summary: GuruFocus Article or News written by insider and the topic is about: , Headline: High Yield Stock Watchlist - October 2022, source:SeekingAlpha, summary: There are 24 stocks on my high yield watchlist for October 2022, and 2 stocks are down more significantly and now may be a good time to buy. Click here to know the stocks., Headline: AMGEN OPENS NEW STATE-OF-THE-ART RESEARCH AND DEVELOPMENT LABORATORY SITE IN SAN FRANCISCO BAY AREA, source:Yahoo, summary: (Oct. 6, 2022) – Amgen (NASDAQ:AMGN) today announced the opening of a new research and development site in San Francisco's Oyster Point, continuing the company's nearly two-decade presence in the region. The new site will constitute the company's second largest research and development facility, which focuses on discovering therapeutics for patients living with cancer, inflammatory disease and cardiometabolic disorders., Headline: Top 20 Drug Companies in the World in 2022, source:Yahoo, summary: In this article, we will be taking a look at the top 20 drug companies in the world in 2022. To skip our detailed analysis, you can go directly to see the top 5 drug companies in the world in 2022. While major pharmaceutical companies have always been derided for considering profits over the well-being […], Headline: Amgen Inc. stock outperforms competitors despite losses on the day, source:MarketWatch, summary: Shares of Amgen Inc. slid 1.23% to $230.94 Thursday, on what proved to be an all-around rough trading session for the stock market, with the S&P 500 Index..., Headline: Amgen's short, big move designed to execute at corner of tech and biotech, source:Yahoo, summary: Amgen Inc. Chairman and CEO Bob Bradway acknowledges the company's move to a new R&D site in South San Francisco isn't a big deal — at least as far as geography — but as far as culture, recruitment, retention and the chance to deliver scientifically, it's huge.  Amgen officially opened its new research-and-development and office building Thursday in BioMed Realty's Gateway of Pacific complex., Headline: Buy Illumina Stock. The Biotech Is Lowering the Cost of Gene Sequencing., source:MarketWatch, summary: Illumina CEO Francis deSouza told analysts that the company can cut sequencing’s cost without crimping its 60%-plus gross margins.",AMGN
12,2022-10-07,"Headline: Amgen Inc. stock outperforms market despite losses on the day, source:MarketWatch, summary: Shares of Amgen Inc. sank 0.83% to $229.03 Friday, on what proved to be an all-around dismal trading session for the stock market, with the S&P 500 Index..., Headline: U.S. buys radiation sickness drug as part of long-standing program, source:Reuters, summary: The U.S. government this week bought $290 million in supplies of a drug designed to treat blood cell injuries following radiological and nuclear emergencies as part of what it said were long-standing efforts to prepare for potential health impacts from threats to national...",AMGN
13,2022-10-08,"Headline: Wall Street Breakfast: What Moved Markets, source:SeekingAlpha, summary: Listen on the go! A daily podcast of Wall Street Breakfast will be available this morning on Seeking Alpha, iTunes, Stitcher and Spotify., Headline: 2 Healthcare Stocks That Could Help Make You a Fortune, source:Yahoo, summary: Contrary to popular belief, the simple approach to many things in life is often the most effective.  An investing quote from Motley Fool contributor Brian Feroldi that I believe is highly underrated goes as follows: ""Good investing is 99% patience and 1% action.""  The pharmaceutical giant Amgen (NASDAQ: AMGN) and medical devices maker Stryker (NYSE: SYK) are two healthcare stocks that appear poised to create wealth for shareholders who are patient and measured enough to let them.",AMGN
14,2022-10-09,"Headline: 7 Value Stocks That Are Too Cheap to Ignore, source:InvestorPlace, summary: With market and economic forces eschewing growth-focused companies, now may be the time to consider cheap value stocks to buy., Headline: Insiders at Amgen Inc. (NASDAQ:AMGN) sold US$4.9m worth of stock, possibly indicating weakness in the future, source:Yahoo, summary: The fact that multiple Amgen Inc. ( NASDAQ:AMGN ) insiders offloaded a considerable amount of shares over the past year...",AMGN
15,2022-10-10,"Headline: Is Amgen (AMGN) a Great Long-Term Bet?, source:Yahoo, summary: Aristotle Capital Management, LLC, an investment management company, released its “Aristotle Global Equity Fund” second quarter 2022 investor letter. A copy of the same can be downloaded here. In the second quarter, the fund returned -13.17% at NAV compared to a -15.66% return for the MSCI ACWI Index and -16.19% return for the MSCI World […], Headline: Amgen Inc. stock outperforms competitors on strong trading day, source:MarketWatch, summary: Shares of Amgen Inc. rose 1.36% to $232.15 Monday, on what proved to be an all-around poor trading session for the stock market, with the S&P 500 Index..., Headline: S&P 500 rebounds from earlier losses, tries to snap 4-day losing streak, source:CNBC, summary: Market participants are anticipating key inflation data this week, as well as the release of major bank earnings. , Headline: Amgen (AMGN) Gains As Market Dips: What You Should Know, source:Yahoo, summary: Amgen (AMGN) closed at $232.15 in the latest trading session, marking a +1.36% move from the prior day., Headline: What You Missed On Wall Street On Tuesday, source:Thefly.com, summary: Five top five lists with the news and calls moving stocks, powered by The Fly. JOBY, DAL, OFIX, SPNE, UBER, LYFT, FORG, FXJ, HZON, META, LULU, AMGN, ZM, RBLX, KLAC, VWAGY, AMZN, LLY, DICE, HL, WBA, SPWR, ANGI, LEG, ZYXI, AAL, NEPH, AZZ",AMGN
16,2022-10-11,"Headline: Amgen upgraded to Overweight from Equal Weight at Morgan Stanley, source:Thefly.com, summary: Morgan Stanley analyst Ma... AMGN, Headline: Top 5 3rd Quarter Trades of CH - GuruFocus.com, source:GuruFocus, summary: GuruFocus Article or News written by insider and the topic is about: , Headline: Neumora Therapeutics announces $112M Series B Financing, source:Thefly.com, summary: Neumora Therapeutics anno... AMGN, Headline: Biotech Stocks Well-Positioned For Fourth Quarter, source:SeekingAlpha, summary: Biotechs benefit if a slowdown pushes the longer-term yields lower. Check out why are biotechs relatively well-positioned now., Headline: Early notable gainers among liquid option names on October 11th, source:Thefly.com, summary: Notable gainers among liq... AMGN, ULTA, AAP, AAL, MO, Headline: Wall Street Analysts Are Bullish on Top Healthcare Picks, source:TipRanks, summary: There&#8217;s a lot to be optimistic about in the Healthcare sector as 3 analysts just weighed in on Amgen (<span class='tr-stock-ticker' style='color:blue; font-we..., Headline: Amgen-partnered neuroscience startup rakes in another $112M, source:Yahoo, summary: A year after emerging from stealth with what would ultimately be the fifth-largest fundraise among local life sciences companies in 2021, Neumora Therapeutics has raised another $112 million to propel its neuropsychiatric drugs forward., Headline: Bullish Two Hundred Day Moving Average Cross - AMGN, source:Dividend Channel, summary: dividend channel,AMGN,, Headline: Dow's 50-point jump led by gains for Amgen, Walgreens Boots stocks, source:MarketWatch, summary: Buoyed by positive growth for shares of Amgen and Walgreens Boots, the Dow Jones Industrial Average is climbing Tuesday morning. Shares of Amgen and..., Headline: What You Missed On Wall Street This Morning, source:Thefly.com, summary: Five top five lists with the news and calls moving stocks, powered by The Fly. META, LULU, JOBY, DAL, OFIX, SPNE, UBER, LYFT, FORG, FXJ, HZON, AMGN, ZM, RBLX, NSANY, TOSYY, VWAGY, KLAC, DICE, HL, WBA, SPWR, NOG, LEG, ZYXI, AAL, NEPH, AZZ, DASH, Headline: Amgen, Walgreens Boots share gains contribute to Dow's 284-point jump, source:MarketWatch, summary: Shares of Amgen and Walgreens Boots are trading higher Tuesday morning, propelling the Dow Jones Industrial Average into positive territory. The Dow was most..., Headline: Stocks making the biggest moves midday: Amgen, Uber, Lyft, Zscaler and more, source:CNBC, summary: These are the stocks posting the largest moves in midday trading. , Headline: Street Wrap: Today's Top 15 Upgrades, Downgrades, Initiations, source:Thefly.com, summary: Lululemon Athletica upgrade, Meta Platforms downgrade and Texas Instruments initiation among today's top calls on Wall Street LULU, NKE, ELF, NOW, ABC, SGEN, AMGN, META, QRVO, SWKS, ZM, FFIV, SPWR, TXN, SNOW, BA, SPLK, DT, DDOG, RBLX, Headline: Noteworthy Tuesday Option Activity: AMGN, ULTA, LIN, source:Stock Options Channel, summary: Staff article entitled Noteworthy Tuesday Option Activity: AMGN, ULTA, LIN, about stock options, from Stock Options Channel., Headline: Dow's 387-point rally led by gains for shares of Amgen, Walgreens Boots, source:MarketWatch, summary: The Dow Jones Industrial Average is rallying Tuesday afternoon with shares of Amgen and Walgreens Boots seeing positive gains for the price-weighted average...., Headline: 12 Best Ethical Stocks To Buy Now, source:Yahoo, summary: In this article, we will take a look at 12 best ethical stocks to buy now. If you want to see some more of the best ethical stocks to buy, go directly to 5 Best Ethical Stocks To Buy Now. Sometimes investing is more than about just making money. Investing can also be used to […], Headline: US STOCKS-Wall St set for muted open as economic worries curb risk appetite, source:Yahoo, summary: The three main indexes have been on a loss-making streak in the past few sessions as recent data continues to point to more policy tightening by the U.S. Federal Reserve that could tip the economy into a recession.  Most rate-sensitive growth stocks such as Microsoft Corp , Twitter Inc, Amazon.com, Apple Inc , and Tesla Inc were down between 0.1% and 0.2% in premarket trading.  With recent economic indicators signaling persistent inflation going forward, money markets are pricing in a 92% chance of another 75-basis-point hike at the Fed's meeting in November., Headline: US STOCKS SNAPSHOT-Wall St opens lower on earnings anxiety , source:Reuters, summary: U.S. stock indexes opened lower on Tuesday as investors awaited the earnings season to assess the impact of rising interest rates and inflation on corporate profit, while a rise in shares of drugmaker Amgen limited declines on the Dow., Headline: Amgen stock surges, provides nearly 80-point support to the Dow after Morgan Stanley turns bullish, source:Yahoo, summary: MARKET PULSE Shares of Amgen Inc. (AMGN) leapt 5.2% in morning trading Tuesday, enough to pace the Dow Jones Industrial Average’s (DJIA) gainers, after Morgan Stanley turned bullish on the biotechnology company., Headline: Amgen, Walgreens Boots share gains contribute to Dow's 300-point rally, source:MarketWatch, summary: The Dow Jones Industrial Average is rallying Tuesday afternoon with shares of Amgen and Walgreens Boots leading the way for the blue-chip average. Shares of..., Headline: US STOCKS-Wall St falls on worries of lower third-quarter corporate profit; Amgen jumps, source:Yahoo, summary: U.S. stocks fell on Tuesday in the run-up to third-quarter results from companies as profit expectations drop amid rising interest rates and stubborn inflation, while gains in drugmaker Amgen limited declines on the Dow.  Microsoft Corp, Twitter Inc, Amazon.com , Apple Inc, and Tesla Inc were down between 1% and 3.5%., Headline: Amgen Inc. stock rises Tuesday, outperforms market, source:MarketWatch, summary: Shares of Amgen Inc. rose 5.72% to $245.44 Tuesday, on what proved to be an all-around mixed trading session for the stock market, with the Dow Jones..., Headline: US STOCKS-S&P 500, Nasdaq fall on fears of profit hit from inflation, rate hikes, source:Yahoo, summary: The S&P 500 and the Nasdaq fell on Tuesday in the run-up to a key inflation reading and the start of third-quarter results from companies amid falling profit expectations, while gains in drugmaker Amgen helped boost the Dow.  With recent jobs and inflation data suggesting more big interest rate hikes by the Federal Reserve, Wall Street's main indexes have been clocking losses in the past few sessions on fears of the economy slipping into a recession., Headline: Health Care Up Slightly As Amgen Rallies -- Health Care Roundup, source:MarketWatch, summary: Health-care companies rose slightly, as traders bet the sector was better positioned than most for rising inflation and interest rates. Amgen shares rallied..., Headline: Top Research Reports for Chevron, Amgen & HSBC, source:Yahoo, summary: Today's Research Daily features new research reports on 12 major stocks, including Chevron Corporation (CVX), Amgen Inc. (AMGN) and HSBC Holdings plc (HSBC)., Headline: Why Amgen Is Up More Than 6% Today, source:Yahoo, summary: An upgrade highlights one of the more philosophical reasons you want to bet on this biopharma name right now., Headline: US STOCKS-Dow, S&P 500 rise after recent losses; investors prepare for inflation, earnings data, source:Yahoo, summary: The Dow and S&P 500 were higher in late afternoon trading Tuesday as investors snapped up some beaten-down shares, but volatility was high ahead of U.S. inflation data and the start of third-quarter earnings later this week.  The Nasdaq was lower, extending recent declines., Headline: Amgen Stock Takes Off as Morgan Stanley Flags Room for Gains, source:Yahoo, summary: Analyst Matthew Harrison upgraded shares of the biotechnology company to Overweight from Equal Weight., Headline: Best Stocks To Buy Right Now? 3 Dow Jones Stocks To Watch, source:StockMarket, summary: 3 Dow Jones Stocks to watch in the stock market in October 2022., Headline: Amgen, The Big Name You Need To Know Going Up Against Novo, Lilly In Obesity Treatments, source:Yahoo, summary: Amgen stock surged Tuesday on a reportedly bullish call for its experimental obesity treatment — a potential rival to Novo and Lilly., Headline: US STOCKS-S&P 500, Nasdaq end lower; BoE comments add to market jitters late, source:Yahoo, summary: The S&P 500 and Nasdaq ended lower on Tuesday, with indications from the Bank of England that it would support the country's bond market for just three more days adding to market jitters late in the session.  Trading was volatile, with investors cautious ahead of key U.S. inflation data and the start of third-quarter earnings later this week., Headline: Nasdaq Falls Into Bear Market After Volatile Day, source:Yahoo, summary: U.S. stock indexes turned lower in the final hour of trading after remarks from Bank of England Gov. Andrew Bailey., Headline: Nicholas Ward's Dividend Growth Portfolio: August/September 2022 Update, source:SeekingAlpha, summary: During August, my passive income was up by 2.90% y/y. During September, my passive income was up by 41.14% y/y. Click to see my trades during these two months.",AMGN
