,date,information,related
0,2022-09-22,"Headline: AstraZeneca Gets EU Approval for Ultomiris Drug, source:MarketWatch, summary: By Sabela Ojea AstraZeneca PLC said Friday that its Ultomiris drug has been approved in the European Union for the treatment of adults with the rare disease..., Headline: LONDON BRIEFING: Smiths annual revenue rises; Made.com up for sale, source:Alliance News, summary: No summary, Headline: TOP NEWS: AstraZeneca's Ultomiris approved in EU for myasthenia gravis, source:Alliance News, summary: No summary",AZN
1,2022-09-23,"Headline: Ionis Pharmaceuticals announces AstraZeneca decision to not advance ION449 trial, source:Thefly.com, summary: Ionis Pharmaceuticals (IO... IONS, AZN, Headline: AstraZeneca's Ultomiris approved in Europe in gMG treatment, source:Thefly.com, summary: The company states: ""... AZN, Headline: VGK: Deutsche Bank Sees Brutal EU Economic Contraction In 2023, Yet It May Still Be Overly Optimistic, source:SeekingAlpha, summary: Deutsche Bank expects EU economy to contract 2.2%. Read more to see why EU as a whole will underperform and VGK ETF's significant headwinds., Headline: AstraZeneca Pulls Plug On Ionis Pharma-Partnered Cholesterol Med, source:Yahoo, summary: Ionis Pharmaceuticals Inc (NASDAQ: IONS) announced topline data from the Phase 2b SOLANO study of ION449 (AZD8233) for hypercholesterolemia (high cholesterol levels). Ionis said that although the candidate met the primary endpoint, its partners at AstraZeneca Plc (NASDAQ: AZN) have decided not to move it into Phase III studies because the ""results did not achieve pre-specified efficacy criteria."" The trial showed that 60mg of ION449 (AZD8233) administered monthly achieved a statistically signifi, Headline: Ionis Pharmaceuticals Nosedives After AstraZeneca Drops High Cholesterol Drug Test, source:Yahoo, summary: Ionis stock tumbled Friday after partner AstraZeneca decided against sending their high cholesterol treatment into Phase 3 testing., Headline: Pharma Stock Roundup: EU Nod to AZN & RHHBY Drugs, FDA Updates for LLY & MRK, source:Yahoo, summary: Roche's (RHHBY) eye drug, Vabysmo and AstraZeneca's (AZN) asthma drug Tezspire get approval in Europe. The FDA approves expanded use of Lilly's (LLY) cancer drug, Retevmo., Headline: AstraZeneca PLC ADR underperforms Friday when compared to competitors, source:MarketWatch, summary: The AstraZeneca PLC ADR shed 3.07% to $54.58 Friday, on what proved to be an all-around rough trading session for the stock market, with the NASDAQ Composite..., Headline: ADRs End Lower, Alibaba and AstraZeneca Trade Actively, source:MarketWatch, summary: By Denny Jacob International stocks trading in New York closed lower on Friday. The S&P/BNY Mellon index of American depositary receipts dropped 3.4% to..., Headline: Ionis' (IONS) Hypercholesterolemia Drug Not to Enter Phase III, source:Yahoo, summary: Ionis (IONS) posts data from the phase IIb SOLANO study on ION449 for treating hypercholesterolemia. Though the study met the primary endpoint, ION449 will not advance into phase III development.",AZN
2,2022-09-24,"Headline: 3 Medical Stocks Displaying Remarkable Relative Strength In 2022, source:TalkMarkets, summary: 3 medical stocks that displayed a substantial amount of relative strength year-to-date.",AZN
3,2022-09-25,"Headline: GSK Appoints Julie Brown as New CFO, source:MarketWatch, summary: By Ian Walker GSK PLC said Monday that it has appointed Julie Brown as its new chief financial officer, replacing Iain Mackay, from May 2023. The..., Headline: LONDON BRIEFING: Unilever CEO to step down; RPS backs new takeover bid, source:Alliance News, summary: No summary, Headline: TOP NEWS: GSK names Burberry's Julie Brown as new CFO from May, source:Alliance News, summary: No summary",AZN
4,2022-09-26,"Headline: 10 Best Diabetes Stocks To Buy Now, source:Yahoo, summary: In this article, we discuss the 10 best diabetes stocks to buy now. If you want to read about some more diabetes stocks, go directly to 5 Best Diabetes Stocks To Buy Now. The diabetes market has grown in the past few years as organizations and individuals in the private and public domains make significant […], Headline: AstraZeneca's (AZN) Ultomiris Gets EC Nod for New Indication, source:Yahoo, summary: AstraZeneca's (AZN) Ultomiris becomes the first and only long-acting C5 inhibitor to be approved for gMG in Europe.",AZN
5,2022-09-27,"Headline: TOP NEWS: AstraZeneca's Tezspire and Koselugo approved in Japan, source:Alliance News, summary: No summary, Headline: 7 Vaccine Stocks to Sell ASAP Now That the 'Pandemic's Over', source:InvestorPlace, summary: Investors have seven widely-followed vaccine stocks to sell now, after the world decided the pandemic is over., Headline: AstraZeneca's Tezspire approved in Japan for severe asthma treatment, source:Thefly.com, summary: The company states: ""... AZN, Headline: AstraZeneca's Koselugo approved in Japand for pediatric plexiform neurofibromas, source:Thefly.com, summary: The company states: ""... AZN, Headline: Wall Street Breakfast: Dollar Vs. Stocks, source:SeekingAlpha, summary: Listen on the go! A daily podcast of Wall Street Breakfast will be available by 8:00 a.m. on Seeking Alpha, iTunes, Stitcher and Spotify. Dollar vs. Stocks The U.S., Headline: Adding $100 to These 7 Stocks Would Be a Genius Move Right Now, source:Yahoo, summary: You don't need a mountain of cash to build wealth on Wall Street -- especially with deals like these., Headline: 7 Vaccine Stocks to Sell ASAP Now That the ‘Pandemic’s Over’, source:Yahoo, summary: As people acclimatize to the new normal, it’s time to look at some vaccine stocks to sell. Instead of relying primarily on vaccines and antiviral drugs, the government let people manage infections. Once infected with the less fatal strain, Omicron, people would isolate themselves for a few days and then return to work. By shifting away from its reliance on drug companies, investors must recognize there are vaccine stocks that it’s time to sell. The government cut orders for vaccines and antivira, Headline: Japan Approves AstraZeneca's Two Treatments For Asthma, Rare Form Of Cancer, source:Yahoo, summary: Japan's health agency has approved AstraZeneca Plc's (NASDAQ: AZN) Koselugo (selumetinib) for pediatric patients with plexiform neurofibromas (PNs) in neurofibromatosis type 1 (NF1) with clinical symptoms and which cannot be entirely removed by surgery without the risk of substantial morbidity. The approval is based on positive results from the SPRINT Stratum 1 Phase 2 trial that showed Koselugo reduced the size of inoperable tumors in children. The SPRINT Stratum 1 Phase 2 trial showed Koselugo",AZN
6,2022-09-28,"Headline: 7 Large-Cap Stocks With Sustained Dividend Growth Potential, source:InvestorPlace, summary: Large-cap stocks with dividend growth potential have robust cash flows and are likely to increase their dividends in the coming years., Headline: Covid vaccination linked to slight increase in menstrual cycle, NIH study confirms, source:CNBC, summary: A change in menstrual cycle length of eight days or less is considered within the normal range of variation, according to NIH., Headline: Cantor Fitzgerald healthcare analysts to hold KOL luncheon panel, source:Thefly.com, summary: In conjunction with Canto... AZN, AMGN, MRTX, GILD, IMAB, NVS, SURF, PFE, ALXO, RHHBY, MRK, Headline: PhaseBio Might Have To Return Global Rights To Its Lead Program, source:Yahoo, summary: PhaseBio Pharmaceuticals Inc (NASDAQ: PHAS) received a notice that its partner SFJ Pharmaceuticals Group elected to transfer bentracimab rights to SFJ as PhaseBio failed to remedy its Going Concern Condition. Formerly known as PB2452, bentracimab reverses the effects of AstraZeneca Plc's (NASDAQ: AZN) blood thinner Brilinta (ticagrelor) In January 2020, PhaseBio announced a financing and co-development partnership with SFJ Pharmaceuticals. PhaseBio retains exclusive worldwide commercial rights., Headline: AZN vs. LLY: Which Stock Is the Better Value Option?, source:Yahoo, summary: AZN vs. LLY: Which Stock Is the Better Value Option?, Headline: Apellis Pharmaceuticals: Trying To Develop A Blockbuster Franchise, source:SeekingAlpha, summary: APLS' flagship product was rolled out last year, is pursuing other indications, and could eventually achieve blockbuster status. Read more on the stock here.",AZN
7,2022-09-29,"Headline: LONDON BROKER RATINGS: GSK raised to 'outperform'; RBC cuts THG, source:Alliance News, summary: No summary, Headline: GLOBAL BROKER RATINGS: Nordisk and GSK raised; BofA cuts Apple, source:Alliance News, summary: No summary",AZN
8,2022-09-30,"Headline: 5 Dividend Growth Stocks to Beat Market Volatility, source:Yahoo, summary: Coca-Cola (KO), General Dynamics (GD), AstraZeneca (AZN), Boise Cascade (BCC), and Insperity (NSP) that offer dividend growth could be compelling picks amid market volatility.",AZN
9,2022-10-02,"Headline: Investors shouldn't have to choose between 'growth' and 'safety' – this stock offers both, source:Yahoo, summary: Investing in shares is a tough task at the best of times. The stock market’s continual ebb and flow between joy and despair means that investors can frequently find themselves on the wrong side of consensus views for extended periods.",AZN
10,2022-10-03,"Headline: Large Cap Biopharmaceuticals: Core Holdings For Your Portfolio , source:TalkMarkets, summary: Now that some clarity is apparent for drug pricing legislation you should have a few large-cap biopharmaceutical stocks in your portfolio., Headline: Alexion, AstraZeneca Rare Disease to acquire LogicBio Therapeutics for $2.07 p/s, source:Thefly.com, summary: LogicBio Therapeutics (LO... LOGC, AZN, Headline: Alexion, AstraZeneca Rare Disease to acquire LogicBio for $2.07 per share, source:Thefly.com, summary: Alexion (ALXN), AstraZene... ALXN, AZN, LOGC, Headline: nan, source:TipRanks, summary: nan, Headline: AstraZeneca to Buy LogicBio Therapeutics for $68 Million >LOGC, source:MarketWatch, summary: By Colin Kellaher LogicBio Therapeutics Inc. on Monday said it agreed to be acquired by AstraZeneca PLC for about $68 million in a deal supporting the..., Headline: Fly Intel: Pre-market Movers, source:Thefly.com, summary: Myovant Sciences soars following acquisition proposal from Sumitovant Biopharma LOGC, MYOV, VSAT, BOX, WFC, APRN, CS, TSLA, DOCU, AZN, Headline: Zacks.com featured highlights include Coca-Cola, General Dynamics, AstraZeneca, Boise Cascade and Insperity, source:Yahoo, summary: Coca-Cola, General Dynamics, AstraZeneca, Boise Cascade and Insperity have been highlighted in this Screen of The Week article., Headline: Why Is LogicBio (LOGC) Stock Up 600% Today?, source:InvestorPlace, summary: LogicBio (LOGC) stock is seeing massive gains on Monday following news that AstraZeneca (AZN) subsidiary Alexion is acquiring the company., Headline: LogicBio Therapeutics Shares Soar on Takeover by AstraZeneca >LOGC, source:MarketWatch, summary: By Colin Kellaher Shares of LogicBio Therapeutics Inc. skyrocketed Monday after the genetic-medicine company agreed to be acquired by Anglo-Swedish pharma..., Headline: Alexion, AstraZeneca Rare Disease to Acquire LogicBio® Therapeutics to Accelerate Growth in Genomic Medicine, source:Yahoo, summary: WILMINGTON, Del., October 03, 2022--Alexion, AstraZeneca Rare Disease, today announced that it has entered a definitive agreement to acquire Lexington, Mass.-based LogicBio® Therapeutics, Inc. (NASDAQ: LOGC), a pioneering genomic medicine company. The proposed acquisition aims to rapidly accelerate Alexion’s growth in genomic medicines through LogicBio’s unique technology, experienced rare disease R&D team, and expertise in pre-clinical development., Headline: Why Are LogicBio Therapeutics Shares Skyrocketing Today?, source:Yahoo, summary: AstraZeneca Plc's (NASDAQ: AZN) subsidiary, Alexion, has agreed to acquire LogicBio Therapeutics Inc (NASDAQ: LOGC) for $2.07 per share. Both boards have unanimously approved the transaction. Alexion plans to close the deal in four to six weeks, subject to the tender of at least a majority of the outstanding shares of LogicBio common stock. It plans to retain LogicBio employees at their current location. Also Read: LogicBio Therapeutics Shares Skyrocket As FDA Lifts Clinical Hold On Its Pediatri, Headline: LogicBio's stock skyrockets after buyout bid for a 667% premium, source:Yahoo, summary: Shares of LogicBio Therapeutics Inc. skyrocketed more than seven-fold (up 643%) in morning trading, to bounce off the previous session's record low, after the genetic medicine company announced an agreement to be acquired by AstraZeneca PLC's Alexion, AstraZeneca Rare Disease in a deal that values LogicBio at about $68.23 million. The stock had closed Friday at a record low of 27 cents, representing a market capitalization for LogicBio of about $8.9 million. Under terms of the buyout deal, Alexi, Headline: ADRs End Higher, ABB and AstraZeneca Trade Actively, source:MarketWatch, summary: By Denny Jacob International stocks trading in New York closed higher Monday. The S&P/BNY Mellon index of American depositary receipts edged up 2.6% to..., Headline: AstraZeneca acquires local startup at 660% premium, source:Yahoo, summary: AstraZeneca Rare Disease, the local division formed when the British pharma giant acquired Alexion Pharmaceuticals Inc. last year, has scooped up a struggling local biotech at a significant premium.  AstraZeneca plc (Nasdaq: AZN) is buying LogicBio Therapeutics Inc. (Nasdaq: LOGC) for $2.07 per share, a 660% premium that values the total acquisition at $68 million.  Lexington-based LogicBio has been struggling since February, when the U.S. Food and Drug Administration ordered a halt to an early-stage trial testing a drug in pediatric patients with methylmalonic acidemia, a disorder in which the body cannot break down certain proteins and fats., Headline: Astrazeneca (AZN) Gains But Lags Market: What You Should Know, source:Yahoo, summary: Astrazeneca (AZN) closed at $55.55 in the latest trading session, marking a +1.29% move from the prior day.",AZN
11,2022-10-04,"Headline: FDA approves Roche breast cancer detection test eligible for ENHERTU, source:Thefly.com, summary: Roche (RHHBY) ""annou... RHHBY, AZN, DSNKY",AZN
12,2022-10-05,"Headline: FOCUS-Fresenius taps pre-dialysis kidney care as drugs promise treatment change, source:Yahoo, summary: The world’s largest dialysis company is seeking out kidney disease patients long before they need the most acute form of care as it plans for growth of new drugs that attack the condition’s causes early on.  For decades, Germany's Fresenius Medical Care (FMC) has been the biggest player in the $50 billion U.S. market providing dialysis and related machines that help filter out blood toxins for people whose kidneys have failed to function.  The company’s 17.6 billion euros ($17.6 billion) in annual revenue has been sustained for decades by high rates of obesity and diabetes, which contribute to kidney damage., Headline: Biotech Alert: Searches spiking for these stocks today, source:Thefly.com, summary: Stay ahead of biotech stocks seeing a surge in interest from retail and financial professional investors with this exclusive recap from The Fly LOGC, CALA, MYOV, ACOR, CDXC, AZN, Headline: 10 Healthcare Stocks to Watch in Light of Biden’s ‘60 Minutes’ Interview, source:Yahoo, summary: In this article, we will be taking a look at the 10 healthcare stocks to watch in light of Biden’s 60 Minutes interview. To skip our detailed analysis of these stocks and Biden’s insights, you can go directly to see the 5 Healthcare Stocks to Watch in Light of Biden’s 60 Minutes Interview. On September […]",AZN
13,2022-10-06,"Headline: GSK: Some Upside Likely, source:SeekingAlpha, summary: GSK's price might have underwhelmed recently, but it's picking up now. Read more to know why GSK stock looks like a buy to me., Headline: FTSE 100 to pay £81.5bn to investors in dividend bonanza, source:Yahoo, summary: FTSE 100 set for record cash returns to investors but dividend forecasts stall., Headline: AZN November 25th Options Begin Trading, source:Stock Options Channel, summary: Staff article entitled AZN November 25th Options Begin Trading, about stock options, from Stock Options Channel., Headline: Top 20 Drug Companies in the World in 2022, source:Yahoo, summary: In this article, we will be taking a look at the top 20 drug companies in the world in 2022. To skip our detailed analysis, you can go directly to see the top 5 drug companies in the world in 2022. While major pharmaceutical companies have always been derided for considering profits over the well-being […], Headline: HONEYWELL BEGINS PRODUCTION OF NEAR-ZERO GLOBAL-WARMING-POTENTIAL MEDICAL PROPELLANT, source:Yahoo, summary: Honeywell (Nasdaq: HON) today announced the opening of a plant in Baton Rouge, La., that is the company's first large-scale manufacturing site for Solstice® Air (HFO-1234ze(E) cGMP), a near-zero global-warming-potential (GWP) medical propellant for use in respiratory inhalers.",AZN
14,2022-10-07,"Headline: Home - The Fly, source:Thefly.com, summary: The Fly is a leading digital publisher of real-time financial news. The Fly team scours all sources of company news and delivers short-form stories consisting of only market moving content., Headline: Omicron BA.4.6 subvariant makes up nearly 14% of COVID variants in U.S. - CDC, source:Yahoo, summary: The U.S. Centers for Disease Control and Prevention (CDC) on Friday estimated that by Oct. 8 nearly 14% of the circulating coronavirus variants in the United States were of the BA.4.6 subvariant of Omicron.  The subvariant has been slowly increasing in prevalence across the U.S., even as the BA.5 subvariant of Omicron remains the dominant strain with 79.2% of the cases.  The BA.4.6 subvariant has been found to be better at evading COVID-19 antibody therapies, with the U.S. Food and Drug Administration in early October warning healthcare providers that AstraZeneca's Evusheld had the risk of being ineffective against some variants it cannot neutralize., Headline: Here’s Why AstraZeneca PLC (AZN) Benefited in the Second Quarter, source:Yahoo, summary: Carillon Tower Advisers, an investment management company, released its “Carillon Eagle Growth & Income Fund” second quarter 2022 investor letter. A copy of the same can be downloaded here. Since 2015, for the first time, the market witnessed two consecutive quarterly losses. During the second quarter, the S&P 500 Index continued its decline, trading at -16.1%. […]",AZN
15,2022-10-09,"Headline: Have $2,000? 2 Market Crash-Ready Stocks to Buy, source:Yahoo, summary: Specifically, there are a pair of pharmaceutical companies whose roster of in-demand medicines makes their prospects better than most in the face of market turbulence of any kind, so let's analyze each and see why they could be a smart pickup for some downside protection.  Pfizer (NYSE: PFE) is a company that needs no introduction, especially not after its rapid development and commercialization of Comirnaty, its coronavirus vaccine.  Furthermore, Pfizer has a veritable cornucopia of other medicines that people rely on, too.",AZN
16,2022-10-10,"Headline: Strong Dollar Means Buy Abroad - Assessing Foreign Assets, source:SeekingAlpha, summary: Investors are flocking to USD, and most foreign currencies are now weak. Click here to know about the ways that a strong USD influences foreign assets., Headline: Apellis' (APLS) Empaveli Aids Growth, Stiff Competition a Woe, source:Yahoo, summary: Apellis' (APLS) lead drug, Empaveli, is approved for treating paroxysmal nocturnal hemoglobinuria. The drug's label expansion studies hold promise. Stiff competition remains an overhang., Headline: AstraZeneca's COVID vaccine suffers a setback in nasal spray trial, source:Yahoo, summary: Attempts by Oxford University researchers and AstraZeneca Plc  to create a nasal-spray version of their jointly developed COVID-19 shot suffered a setback on Tuesday as initial testing on humans did not yield the desired protection.  An antibody response in the respiratory mucous membranes was seen in only a minority of participants in the trial, which was in the first of usually three phases of clinical testing, the University of Oxford said in a statement on Tuesday.  Also, the immune response measured in the blood was weaker than that from a shot-in-the-arm vaccination., Headline: Nasal version of Oxford/AstraZeneca Covid vaccine fails in trial, source:Yahoo, summary: A nasal version of the Oxford/AstraZeneca Covid-19 vaccine has failed in an early-stage trial, dealing a blow to hopes for a more effective way to prevent transmission of the virus.  Oxford university said on Tuesday a nasal formulation of the vaccine elicited mucosal antibody responses in a “minority of participants” and systemic immune responses were weaker compared with intramuscular vaccination.  The setback highlights the complexity of designing a nasal formulation against coronavirus, which spreads through tiny particles in the air., Headline: AstraZeneca call volume above normal and directionally bullish, source:Thefly.com, summary: Bullish option flow detec... AZN",AZN
17,2022-10-11,"Headline: AstraZeneca price target lowered to 11,800 GBp from 12,000 GBp at Guggenheim, source:Thefly.com, summary: Guggenheim analyst Seamus... AZN, Headline: Illumina launches strategic research collaboration with AstraZeneca, source:Thefly.com, summary: Illumina (ILMN) announced... ILMN, AZN, Headline: AstraZeneca Looks to Cancer, RSV Drugs for Growth as Covid-Vaccine Demand Wanes, source:Yahoo, summary: The British drugmaker is reducing production of its Covid-19 vaccine and betting on new therapies for other conditions., Headline: AstraZeneca-Oxford University Partnered Nasal COVID-19 Vaccine Flunks Human Trial, source:Yahoo, summary: AstraZeneca Plc (NASDAQ: AZN) and Oxford University scientists said that the initial testing of its nasal COVID-19 vaccine did not yield the desired protection. The AstraZeneca-funded phase 1 trial tested the efficacy of the Oxford vaccine when delivered through a simple device that sprays droplets up the nose. In a statement, the University of Oxford said that an antibody response in the respiratory mucous membranes was seen in only a minority of participants in the trial. While the trial raise, Headline: Oxford/AstraZeneca COVID vaccine nasal spray fails in trial, source:Yahoo, summary: The nasal version of the Oxford/AstraZeneca COVID vaccine failed to elicit an antibody response in an early trial and the company is shelving its development, Headline: GSK to Hire Top AstraZeneca Dealmaker After Agreement Reached, source:Yahoo, summary: (Bloomberg) -- GSK Plc is free to hire a top dealmaker from AstraZeneca Plc after reaching an agreement with its rival, which had sued to block the sharing of sensitive information.Most Read from BloombergHere’s How Weird Things Are Getting in the Housing MarketThis Is What 7% Mortgages Will Do to the Housing MarketIt’s Official: The Fed’s in the RedThe Most Powerful Buyers in Treasuries Are All Bailing at OnceScreening Procedure Fails to Prevent Colon Cancer Deaths in Large StudyChris Sheldon w, Headline: Illumina Inks AI Pact With AstraZeneca To Accelerate Drug Target Discovery, source:Yahoo, summary: Illumina Inc (NASDAQ: ILMN) entered a strategic research collaboration with AstraZeneca plc (NASDAQ: AZN) on drug target discovery. Financial and other details of the partnership were not disclosed. Under the terms of the agreement, the firms will join forces on artificial intelligence-based genome interpretation and genomic analysis and evaluate whether a combined framework can increase the yield of and confidence in target discovery. AstraZeneca's Center for Genomics Research will use the comb, Headline: Illumina collaborates with AstraZeneca on AI-focused research, source:Alliance News, summary: No summary",AZN
