,date,information,related
221,2023-06-07,"Headline: Zentalis price target raised to $50 from $45 at Stifel, source:Thefly.com, summary: No summary, Headline: AstraZeneca falls Wednesday, underperforms market, source:MarketWatch, summary: AstraZeneca PLC shares inched down 0.66% to £117.54 Wednesday, on what proved to be an all-around dismal trading session for the stock market, with the FTSE..., Headline: AstraZeneca PLC ADR falls Wednesday, still outperforms market, source:MarketWatch, summary: The AstraZeneca PLC ADR slid 0.12% to $73.31 Wednesday, on what proved to be an all-around mixed trading session for the stock market, with the Dow Jones..., Headline: Iberdrola plans to invest EUR4.00 billion in digitalisation by 2030, source:Alliance News, summary: No summary, Headline: FDA panel back approval of AstraZeneca, Sanofi RSV drug, Bloomberg says, source:Thefly.com, summary: No summary",AZN
222,2023-06-08,"Headline: AstraZeneca/Sanofi's RSV drug recommended by FDA AdCom, source:Thefly.com, summary: No summary, Headline: AstraZeneca, Sanofi win FDA advisory committee backing for RSV therapy nirsevimab, source:Seeking Alpha, summary: No summary, Headline: Unusually active option classes on open June 8th, source:Thefly.com, summary: No summary, Headline: AZN July 28th Options Begin Trading, source:Stock Options Channel, summary: No summary, Headline: AstraZeneca falls Thursday, still outperforms market, source:MarketWatch, summary: Shares of AstraZeneca PLC inched down 0.03% to £117.50 Thursday, on what proved to be an all-around dismal trading session for the stock market, with the..., Headline: Top Healthcare Stocks for June 2023, source:Yahoo, summary: Top healthcare stocks include Theravance Biopharma for best value, Dr Reddy's Laboratories for fastest growth, and Viking Therapeutics for most momentum., Headline: FDA advisors recommend AstraZeneca, Sanofi antibody to protect babies from RSV, source:CNBC, summary: If the Food and Drug Administration approves nirsevimab, it will be the first medical intervention available in the U.S. that can protect infants from RSV. , Headline: FDA advisers vote in favor of AstraZeneca, Sanofi antibody for infant RSV protection, source:MarketWatch, summary: Advisers to the U.S. Food and Drug Administration voted unanimously Thursday to recommend a monoclonal antibody developed by Sanofi and AstraZeneca to..., Headline: AstraZeneca PLC ADR outperforms market on strong trading day, source:MarketWatch, summary: The AstraZeneca PLC ADR rose 1.28% to $74.25 Thursday, on what proved to be an all-around positive trading session for the stock market, with the NASDAQ..., Headline: UPDATE 3-US FDA panel backs Sanofi-AstraZeneca's preventive RSV therapy, source:Yahoo, summary: The U.S. Food and Drug Administration advisers on Thursday backed the use of Sanofi and partner AstraZeneca's experimental antibody to prevent respiratory syncytial virus (RSV) infections in infants.  The advisers voted unanimously in favor of using the antibody, nirsevimab, in newborns and infants to prevent infections in their first RSV season.  In a separate 19-2 vote, the panel backed the therapy's use in children aged up to two years who are vulnerable to severe illness through their second RSV season., Headline: AstraZeneca hails RSV drug nirsevimab recommendation by FDA committee, source:Alliance News, summary: No summary, Headline: AstraZeneca Reaches Agreement With Quell Therapeutics for Treg Cell Therapies, source:MarketWatch, summary: By Anthony O. Goriainoff AstraZeneca said Friday that it has reached an agreement to develop, manufacture and commercialize engineered T-regulatory, or Treg,..., Headline: AstraZeneca Says Nirsevimab Recommended for RSV Prevention in Infants by FDA Body, source:MarketWatch, summary: By Joe Hoppe AstraZeneca said Friday that its nirsevimab antibody has been recommended for the prevention of respiratory syncytial virus, a lower respiratory..., Headline: LONDON BRIEFING: Network International agrees to GBP2.2 billion buyout, source:Alliance News, summary: No summary",AZN
223,2023-06-09,"Headline: TOP NEWS: AstraZeneca hails deal with Quell; positive danicopan data, source:Alliance News, summary: No summary, Headline: US FDA committee recommends Sanofi's RSV disease treatment in infants, source:Alliance News, summary: No summary, Headline: AstraZeneca reports danicopan met primary endpoint in Phase 3 ALPHA trial, source:Thefly.com, summary: No summary, Headline: AstraZeneca announces Treg cell therapy agreement with Quell Therapeutics, source:Thefly.com, summary: No summary, Headline: UK cell therapy start-up agrees AstraZeneca partnership worth up to $2bn, source:Yahoo, summary: One of the most promising UK biotech start-ups, Quell Therapeutics, has signed a research collaboration and licensing deal with AstraZeneca to develop treatments for two autoimmune diseases.  The pharma giant will pay Quell $85mn upfront and up to $2bn more if it meets various development and commercialisation milestones over the next few years.  The technology developed by Quell allows the manipulation of a patient’s immune response by genetically engineering “regulatory T-cells” or Tregs., Headline: AstraZeneca in pact with Quell Therapeutics for Treg cell therapies, source:Seeking Alpha, summary: No summary, Headline: AstraZeneca (NASDAQ:AZN), Sanofi RSV Antibody Wins FDA Advisors’ Nod, source:TipRanks, summary: No summary, Headline: AstraZeneca outperforms market despite losses on the day, source:MarketWatch, summary: AstraZeneca PLC shares inched down 0.32% to £117.12 Friday, on what proved to be an all-around poor trading session for the stock market, with the FTSE 100..., Headline: Unanimous Support for AstraZeneca and Sanofi's Nirsevimab: Next Generation RSV Treatment on the Horizon, source:Yahoo, summary: The FDA's Antimicrobial Drugs Advisory Committee has voted unanimously 21 to 0 that AstraZeneca plc (NASDAQ: AZN) and Sanofi SA's (NASDAQ: SNY) nirsevimab has a favorable benefit-risk profile to prevent respiratory syncytial virus (RSV) lower respiratory tract disease (LRTD) in newborns and infants born during or entering their first RSV season. The committee also voted 19 to 2 in support of nirsevimab's favorable benefit-risk profile for children up to 24 months of age who remain vulnerable to, Headline: AstraZeneca Inks Over $2B Agreement For Cell Therapies Targeting Diabetes, source:Yahoo, summary: AstraZeneca plc (NASDAQ: AZN) has entered into a collaboration, exclusive option, and license agreement with Quell Therapeutics to develop multiple engineered T-regulator (Treg) cell therapies for Type 1 Diabetes (T1D) and Inflammatory Bowel Disease (IBD) indications. Under the terms of the agreement, Quell’s proprietary toolbox of Treg cell engineering modules, including its Foxp3 Phenotype Lock, will be leveraged to develop autologous multi-modular Treg cell therapy candidates for major autoim, Headline: AstraZeneca's Add On Treatment With Standard Care Improves Hemoglobin Levels In Rare Blood Disorder, source:Yahoo, summary: AstraZeneca Plc (NASDAQ: AZN) released data from the Phase 3 ALPHA trial of danicopan as an add-on to the standard of care for paroxysmal nocturnal hemoglobinuria (PNH). The data showed that danicopan as an add-on to the standard of care C5 inhibitor therapy Ultomiris (ravulizumab) or Soliris (eculizumab) demonstrated a statistically significant and clinically meaningful increase in hemoglobin levels and maintained disease control in PNH patients, compared to placebo plus established C5 inhibito, Headline: Netflix Gains Subs From Password Sharing Crackdown, Mark Zuckerberg Discusses AI at Latest Employee Met, Privacy Breach Risk in Nvidia's AI Technology Stirs Concern: Today's Top Stories, source:Yahoo, summary: Financial Times Privacy Breach Risk in Nvidia's AI Technology Stirs Concern Among Researchers Researchers found that an Nvidia Corp (NASDAQ: NVDA) artificial intelligence software feature is susceptible to manipulation leading to the compromise of private information. Robust Intelligence analysts found that the ""NeMo Framework,"" which allows developers to work with a range of large language models, could easily break through so-called safety guardrails. After using the Nvidia system on their own, Headline: AstraZeneca PLC ADR underperforms Friday when compared to competitors, source:MarketWatch, summary: The AstraZeneca PLC ADR shed 0.26% to $74.06 Friday, on what proved to be an all-around great trading session for the stock market, with the NASDAQ Composite..., Headline: New Data Show Roche's Self-Administered Blood Disorder Candidate Achieves Disease Control, source:Yahoo, summary: Roche Group Holdings AG's (OTC: RHHBY) data from the global phase 3 COMMODORE 1 and 2 studies evaluating crovalimab compared to eculizumab, a current standard of care in paroxysmal nocturnal hemoglobinuria (PNH), were presented at the European Hematology Association Hybrid Congress. In the COMMODORE 2 study, 79.3% of participants randomized to be treated with crovalimab achieved hemolysis control from week five to week 25 compared with 79.0% with AstraZeneca Plc's (NASDAQ: AZN) Soliris (eculizum, Headline: FDA Panel Endorses AstraZeneca (AZN), Sanofi's RSV Antibody, source:Yahoo, summary: The FDA's AMDAC unanimously recommends AstraZeneca (AZN)/Sanofi's (SNY) nirsevimab as full immunization against RSV disease for all infants.",AZN
224,2023-06-10,"Headline: AI Meets Biotech: Transforming the Drug Development Process, source:InvestorPlace, summary: No summary",AZN
225,2023-06-11,"Headline: Macro Muddle Coming Up As Market Exceeds Expectations, Small Caps Gain Ground, source:TalkMarkets, summary: No summary, Headline: AstraZeneca breast cancer drug capivasertib gets priority review in US, source:Alliance News, summary: No summary",AZN
226,2023-06-12,"Headline: AstraZeneca's capivasertib-Faslodex combination granted Priority Review in U.S., source:Thefly.com, summary: No summary, Headline: AstraZeneca announces FDA acceptance, priority review for capivasertib NDA, source:Thefly.com, summary: No summary, Headline: AstraZeneca (AZN) Receives a Buy from Bank of America Securities, source:TipRanks, summary: No summary, Headline: Capivasertib in combination with FASLODEX® (fulvestrant) granted Priority Review in the US for patients with advanced HR-positive breast cancer, source:Yahoo, summary: WILMINGTON, Del., June 12, 2023--AstraZeneca’s New Drug Application (NDA) for capivasertib in combination with FASLODEX® (fulvestrant) has been accepted and granted Priority Review in the US for the treatment of adult patients with hormone receptor (HR)-positive, human epidermal growth factor receptor 2 (HER2)-negative locally advanced or metastatic breast cancer following recurrence or progression on or after an endocrine-based regimen., Headline: AstraZeneca rises Monday, outperforms market, source:MarketWatch, summary: Shares of AstraZeneca PLC advanced 1.01% to £118.30 Monday, on what proved to be an all-around favorable trading session for the stock market, with the FTSE..., Headline: AstraZeneca (AZN) & Quell to Co-Develop Autoimmune Cell Therapies, source:Yahoo, summary: AstraZeneca (AZN) enters into a collaboration agreement with Quell Therapeutics to co-develop novel cell therapy options in major autoimmune indications for an upfront payment of $85 million., Headline: AstraZeneca PLC ADR underperforms Monday when compared to competitors, source:MarketWatch, summary: The AstraZeneca PLC ADR dropped 0.28% to $73.85 Monday, on what proved to be an all-around positive trading session for the stock market, with the NASDAQ..., Headline: Astrazeneca (AZN) Stock Sinks As Market Gains: What You Should Know, source:Yahoo, summary: Astrazeneca (AZN) closed the most recent trading day at $73.85, moving -0.28% from the previous trading session., Headline: AstraZeneca's Soliris Treatment Approved in China for Adults With gMG, source:MarketWatch, summary: By Joe Hoppe AstraZeneca said Tuesday that its Soliris disease treatment has been approved in China for adults with refractory generalized myasthenia gravis,..., Headline: AstraZeneca wins approval in China for Soliris in myasthenia gravis, source:Alliance News, summary: No summary",AZN
227,2023-06-13,"Headline: Pharma chiefs warn red tape and NHS levy risk Britain missing out on billions, source:Yahoo, summary: Britain risks missing out on billions of pounds of pharmaceutical investment because bosses are struggling with red tape and a sky-high NHS levy, an industry group has warned., Headline: AstraZeneca reports Soliris approved in China for adults with refractory gMG, source:Thefly.com, summary: No summary, Headline: AstraZeneca announces partnership with Vanguard Renewables, source:Thefly.com, summary: No summary, Headline: Unusually active option classes on open June 13th, source:Thefly.com, summary: No summary, Headline: AstraZeneca to decarbonize its U.S. footprint by turning cow manure into renewable natural gas, source:MarketWatch, summary: In a first for the pharma sector, AstraZeneca will tap renewable natural gas for its U.S. manufacturing sites by the end of 2026., Headline: Top 20 Most Profitable Pharmaceutical Companies In The World, source:Yahoo, summary: In this article, we will be covering the top 20 most profitable pharmaceutical companies in the world. If you wish to see the top ones, head straight to the Top 5 Most Profitable Pharmaceutical Companies In The World. Undoubtedly, the pharmaceutical industry stands as one of the most financially rewarding and essential sectors worldwide, leading […], Headline: AstraZeneca announces innovative partnership with Vanguard Renewables to decarbonize its United States sites, source:Yahoo, summary: WILMINGTON, Del., June 13, 2023--In a first-of-its-kind collaboration, AstraZeneca is partnering with Vanguard Renewables to deliver renewable natural gas to all its U.S. sites., Headline: AstraZeneca turns to cows to cut U.S. carbon footprint, source:Yahoo, summary: Drugmaker AstraZeneca is switching to biogas produced from cow manure and food waste in the United States, it said on Tuesday, in a deal to cut its carbon emissions there.  The Anglo-Swedish drugmaker said the long-term agreement with Massachusetts-based Vanguard Renewables would enable it to transition to biogas from natural gas and cut its emissions across its U.S. research and manufacturing sites.  ""Doing the right thing costs a little bit more, but it is not punitive,"" said Pascal Soriot, chief executive of AstraZeneca, which makes 26 medicines in the U.S., Headline: AstraZeneca falls Tuesday, underperforms market, source:MarketWatch, summary: Shares of AstraZeneca PLC inched down 0.76% to £117.40 Tuesday, on what proved to be an all-around positive trading session for the stock market, with the..., Headline: AstraZeneca (AZN) Breast Cancer Combo Drug Gets Priority Review, source:Yahoo, summary: The FDA grants priority review status to AstraZeneca's (AZN) capivasertib/Faslodex combination for the treatment of adult patients with HR-positive, HER2-negative locally advanced breast cancer., Headline: AstraZeneca PLC ADR rises Tuesday, still underperforms market, source:MarketWatch, summary: The AstraZeneca PLC ADR inched 0.38% higher to $74.13 Tuesday, on what proved to be an all-around great trading session for the stock market, with the NASDAQ..., Headline: Astrazeneca (AZN) Gains But Lags Market: What You Should Know, source:Yahoo, summary: Astrazeneca (AZN) closed the most recent trading day at $74.13, moving +0.38% from the previous trading session., Headline: Investor Opportunities Ahead of Clinical Updates, Says Analyst Initiating Coverage on Ambrx Biopharma with 'Buy' Rating, source:Benzinga, summary: No summary, Headline: AstraZeneca put volume heavy and directionally bearish, source:Thefly.com, summary: No summary",AZN
228,2023-06-14,"Headline: AstraZeneca falls Wednesday, underperforms market, source:MarketWatch, summary: Shares of AstraZeneca PLC shed 1.96% to £115.10 Wednesday, on what proved to be an all-around positive trading session for the stock market, with the FTSE..., Headline: U.K. stocks continue winning streak, climb for third session, source:DowJones, summary: U.K. stocks finished higher Wednesday, with the FTSE 100 Index increasing 0.10% at 7,602.74. Among FTSE 100 constituents, medical equipment/supplies company..., Headline: AstraZeneca PLC ADR falls Wednesday, underperforms market, source:MarketWatch, summary: The AstraZeneca PLC ADR slipped 1.83% to $72.77 Wednesday, on what proved to be an all-around mixed trading session for the stock market, with the NASDAQ...",AZN
229,2023-06-15,"Headline: AstraZeneca rises Thursday, outperforms market, source:MarketWatch, summary: AstraZeneca PLC shares rose 1.53% to £116.86 Thursday, on what proved to be an all-around great trading session for the stock market, with the FTSE 100 Index..., Headline: LONDON MARKET CLOSE: Europe mixed after ECB hike and hawkish Fed, source:Alliance News, summary: No summary, Headline: AstraZeneca PLC ADR rises Thursday, outperforms market, source:MarketWatch, summary: The AstraZeneca PLC ADR rose 2.54% to $74.62 Thursday, on what proved to be an all-around favorable trading session for the stock market, with the NASDAQ..., Headline: FDA panel recommends updated COVID-19 vaccines targeting XBB.1.5 subvariant, source:Thefly.com, summary: No summary",AZN
230,2023-06-16,"Headline: Unusually active option classes on open June 16th, source:Thefly.com, summary: No summary, Headline: AstraZeneca rises Friday, outperforms market, source:MarketWatch, summary: AstraZeneca PLC shares inched up 0.87% to £117.88 Friday, on what proved to be an all-around favorable trading session for the stock market, with the FTSE..., Headline: 2 Best Biotech Stocks to Buy Right Now, source:Yahoo, summary: When done right, investing in pharmaceutical companies can be a lucrative endeavor.  This is because as long as there are diseases and infections, medicines and vaccines will always remain in high demand.  Dating back to Astra's founding in 1913 in Sweden, AstraZeneca (NASDAQ: AZN) has more than a century of corporate history., Headline: AstraZeneca PLC ADR outperforms competitors on strong trading day, source:MarketWatch, summary: The AstraZeneca PLC ADR inched 0.80% higher to $75.22 Friday, on what proved to be an all-around poor trading session for the stock market, with the NASDAQ..., Headline: Biologic drugs will lead European pharmas to surpass US counterparts in sales, source:Seeking Alpha, summary: No summary",AZN
231,2023-06-18,"Headline: Week In Review: Cullgen Signs $1.9 Billion Protein Degrader Deal With Astellas, source:SeekingAlpha, summary: San Diego-Shanghai company Cullgen will collaborate with Japan's Astellas Pharma to discover multiple innovative protein degraders in a deal worth up to $1.9 billion. Read more here..., Headline: How HS2 haunts ambitious plans for Britain’s golden triangle, source:Yahoo, summary: The rivalry between Oxford and Cambridge stretches back centuries, with each university town famously dismissing their opposite as “the other place”., Headline: AstraZeneca drafts plan to spin off China business amid tensions, source:Yahoo, summary: Anglo-Swedish drugmaker views listing a separate unit in Hong Kong as potential shelter from global strife, Headline: AstraZeneca planning China business spin off -FT, source:Yahoo, summary: The company would seek to be a patriotic company in China that ""loves the Communist Party"", its China president said in May. Last year, the country accounted for 13% of AstraZeneca's total sales, and the company is China's biggest drugmaker.  The spin off could protect AstraZeneca from tensions between China and other global powers, while the company retained control of the business, the FT's report said.  AstraZeneca said it did not comment on ""rumours or speculations around future strategy or M&A."", Headline: LONDON MARKET EARLY CALL: Stocks to fall but pound rises ahead of BoE, source:Alliance News, summary: No summary, Headline: PRESS: AstraZeneca drafts plan to spin-off in China - FT, source:Alliance News, summary: No summary, Headline: Why is AstraZeneca (NASDAQ:AZN) Mulling Spin-Off of China Business?, source:TipRanks, summary: No summary, Headline: AZN Stock: China Business Spin-Off in the Works; Politics at Play, source:TipRanks, summary: No summary, Headline: LONDON BRIEFING: Severn Trent deal sized up by CMA; Coca-Cola HBC buys, source:Alliance News, summary: No summary, Headline: AstraZeneca weighs China unit spinoff amid geopolitical risks - report, source:Seeking Alpha, summary: No summary",AZN
232,2023-06-19,"Headline: AstraZeneca could spin off China business, source:Yahoo, summary: AstraZeneca is protecting itself from US-China tensions.  Plus, corporate America has poured a lot of money into diversity plans over the past three years, but now it’s pulling back.  US secretary of state Antony Blinken is wrapping up a trip to China., Headline: LONDON MARKET OPEN: Stocks falter amid weaker outlook for China, source:Alliance News, summary: No summary, Headline: AstraZeneca could break out and separately list China business, FT reports, source:Thefly.com, summary: No summary, Headline: AstraZeneca falls Monday, underperforms market, source:MarketWatch, summary: AstraZeneca PLC shares shed 1.20% to £116.46 Monday, on what proved to be an all-around grim trading session for the stock market, with the FTSE 100 Index..., Headline: AstraZeneca/China: break-up deal would reflect necessity not choice, source:Yahoo, summary: China is known for its prowess in gymnastics.  As tensions heighten between the US and China, AstraZeneca may offer its own twist by carving out its Chinese business.  Chief executive Pascal Soriot has pushed AstraZeneca harder and faster into China than any other big foreign drugmaker., Headline: AstraZeneca plots to sell AI drug unit to the Chinese, source:Yahoo, summary: AstraZeneca’s pioneering artificial intelligence (AI) research centre could fall into foreign ownership under reported plans for the drugs giant to spin off and separately list its Chinese division.",AZN
233,2023-06-20,"Headline: Drugmakers aim to strike down Medicare drug-price negotiations at Supreme Court , source:CNBC, summary: The lawsuits are the opening salvo in a historic and potentially decisive battle over Medicare's efforts to bring rising drug prices under control. , Headline: AstraZeneca: What's Next? (Rating Downgrade), source:SeekingAlpha, summary: AstraZeneca is considering spinning off its China operations and listing a separate division in Hong Kong or Shanghai. Read why we're neutral on AZN stock., Headline: AstraZeneca outperforms market despite losses on the day, source:MarketWatch, summary: Shares of AstraZeneca PLC inched down 0.09% to £116.36 Tuesday, on what proved to be an all-around rough trading session for the stock market, with the FTSE..., Headline: AstraZeneca call volume above normal and directionally bullish, source:Thefly.com, summary: No summary, Headline: AstraZeneca Mulls China Business Unit Spin-Off Amid Geopolitical Tensions, source:Yahoo, summary: European drugmaker AstraZeneca plc (NASDAQ: AZN) is reportedly drafting a plan to spin off its China business, and listing a separate unit in Hong Kong is considered an option amid mounting geopolitical tensions. Last month, during an event held in Wuxi to commemorate its 30th year in China, AstraZeneca's China president, Wang Lei, said the company will seek to be a patriotic company in China that ""loves the Communist Party."" In 2022, China accounted for 13% of the company's overall sales. The s, Headline: Spotify to Launch New Expensive Subscription Plan, Chinese Vendors Bypass US Embargo to Supply Nvidia AI Chips, Eddie Wu To Succeed Daniel Zhang As Alibaba's CEO: Today's Top Stories, source:Yahoo, summary: Bloomberg Spotify to Launch New Expensive Subscription Plan, 'Supremium,' Amid Competition with Apple and Amazon Spotify Technology S.A. (NYSE: SPOT) is eying a more expensive subscription option likely to include high-fidelity audio to drive more revenue and appease investors. Dubbed ""Supremium,"" the new tier will be Spotify's most expensive plan and likely offer a HiFi feature it first announced it was working on in 2021. To augment its current ""Premium"" tier, Spotify will offer subscribers ex, Headline: AstraZeneca (AZN) May Reportedly Spin-Off its Chinese Business, source:Yahoo, summary: AstraZeneca (AZN) reportedly plans to spin-off its China business and list it separately in Hong Kong to protect itself from rising tensions between the United States and China., Headline: AstraZeneca PLC ADR falls Tuesday, underperforms market, source:MarketWatch, summary: The AstraZeneca PLC ADR slid 1.69% to $73.95 Tuesday, on what proved to be an all-around poor trading session for the stock market, with the NASDAQ Composite..., Headline: Astrazeneca (AZN) Dips More Than Broader Markets: What You Should Know, source:Yahoo, summary: In the latest trading session, Astrazeneca (AZN) closed at $73.95, marking a -1.69% move from the previous day.",AZN
