,date,information,related
160,2023-04-01,"Headline: Pieris Pharmaceuticals, Inc. (NASDAQ:PIRS) Q4 2022 Earnings Call Transcript, source:Yahoo, summary: Pieris Pharmaceuticals, Inc. (NASDAQ:PIRS) Q4 2022 Earnings Call Transcript March 29, 2023 Operator: Hello and welcome to the Pieris Pharmaceuticals, Inc. Year-End 2022 Conference Call and Webcast. . A question-and-answer session will follow the formal presentation. As a reminder, this conference is being recorded. It is now my pleasure to turn the call over to […]",AZN
161,2023-04-02,"Headline: AstraZeneca's Ultomiris Recommended for Marketing Authorization in EU, source:MarketWatch, summary: By Michael Susin AstraZeneca PLC said Monday that its treatment for patients with neuromyelitis optica spectrum disorder has been recommended for marketing..., Headline: Harbor Capital Appreciation Fund Buys AstraZeneca, Ups Nvidia Holding, source:GuruFocus, summary: No summary, Headline: TOP NEWS: AstraZeneca's ultomiris recommended for EU approval, source:Alliance News, summary: No summary",AZN
162,2023-04-03,"Headline: AstraZeneca says Ultomiris recommended for approval in EU for NMOSD, source:Thefly.com, summary: No summary, Headline: Arvinas appoints Page as SVP, Global Head of Oncology Strategy, Program Leader, source:Thefly.com, summary: No summary, Headline: AstraZeneca (AZN) Ultomiris Gets CHMP Nod for New Rare Disease, source:Yahoo, summary: CHMP recommends AstraZeneca's (AZN) Ultomiris for the treatment of patients with neuromyelitis optica spectrum disorder who are anti-aquaporin-4 antibody positive., Headline: AstraZeneca PLC ADR rises Monday, outperforms market, source:MarketWatch, summary: The AstraZeneca PLC ADR inched 0.72% higher to $69.91 Monday, on what proved to be an all-around mixed trading session for the stock market, with the Dow...",AZN
163,2023-04-04,"Headline: AstraZeneca PLC ADR underperforms Tuesday when compared to competitors despite daily gains, source:MarketWatch, summary: The AstraZeneca PLC ADR inched 0.49% higher to $70.25 Tuesday, on what proved to be an all-around rough trading session for the stock market, with the NASDAQ..., Headline: Astrazeneca (AZN) Gains As Market Dips: What You Should Know, source:Yahoo, summary: Astrazeneca (AZN) closed the most recent trading day at $70.25, moving +0.49% from the previous trading session., Headline: AstraZeneca's Lynparza, Imfinzi Ovarian Cancer Treatment Met Primary Endpoint in Phase 3 Trial, source:MarketWatch, summary: By Joe Hoppe AstraZeneca PLC said Wednesday that its Lynparza and Imfinzi combination met its endpoint in the treatment of patients with advanced ovarian..., Headline: What You Missed On Wall Street On Wednesday, source:Thefly.com, summary: No summary, Headline: AstraZeneca Imfinzi, Lynparza combo improves progression-free survival in ovarian cancer trial, source:Seeking Alpha, summary: No summary",AZN
164,2023-04-05,"Headline: AstraZeneca receives positive interim trial results for Imfinzi drug, source:Alliance News, summary: No summary, Headline: AstraZeneca says Lynparza/Imfinzi combo met endpoint in ovarian cancer study, source:Thefly.com, summary: No summary, Headline: UPDATE 1-AstraZeneca says drug combo meets goal in late-stage ovarian cancer trial, source:Yahoo, summary: AstraZeneca on Wednesday said a combination of its cancer drugs Imfinzi and Lynparza met the main goal in a late-stage trial in patients with advanced ovarian cancer.  Lynparza, jointly developed with U.S.-based Merck & Co , was approved last year by the U.S. Food and Drug Administration as a treatment for early-stage breast cancer with certain mutations., Headline: RPT-UPDATE 1-AstraZeneca says drug combo meets goal in late-stage ovarian cancer trial, source:Yahoo, summary: AstraZeneca on Wednesday said a combination of its cancer drugs Imfinzi and Lynparza met the main goal in a late-stage trial in patients with advanced ovarian cancer.  Lynparza, jointly developed with U.S.-based Merck & Co , was approved last year by the U.S. Food and Drug Administration as a treatment for early-stage breast cancer with certain mutations., Headline: Drug giant AstraZeneca teams up with Hong Kong Science Park to drive biotech, medical research growth, source:Yahoo, summary: AstraZeneca, one of the world's leading pharmaceutical companies, has signed a second collaboration agreement with Hong Kong Science and Technology Parks (HKSTP) as the city moves to position itself as a trailblazer in life science innovation. Along with the wider Greater Bay Area, Hong Kong aims to attract the best health talent and drive growth in the fields of medical research, drug development, and clinical trials. The collaboration will involve AstraZeneca and HKSTP supporting and providing, Headline: What You Missed On Wall Street This Morning, source:Thefly.com, summary: No summary, Headline: LONDON MARKET CLOSE: Risk-off mood prevails but FTSE 100 outperforms, source:Alliance News, summary: No summary, Headline: U.K. stocks climb Wednesday, source:MarketWatch, summary: U.K. stocks climbed Wednesday, as the FTSE 100 Index finished up 0.37% at 7,662.94. Of the FTSE 100 constituents, general mining company Polymetal..., Headline: AstraZeneca' Cancer Drug Combo Meets Goal In Late-Stage Ovarian Cancer Study, source:Yahoo, summary: AstraZeneca Plc (NASDAQ: AZN) announced topline data from a planned interim analysis of the DUO-O Phase 3 trial of a combination of Lynparza (olaparib), Imfinzi (durvalumab), chemotherapy, and bevacizumab. The combo therapy improved progression-free survival in newly diagnosed patients with advanced ovarian cancer without certain mutations. Also Read: AstraZeneca's Immunotherapy Imfinzi Shows Improvement In Survival Chances In Lung Cancer Patients. In an additional arm, Imfinzi, chemotherapy plu, Headline: UK court orders GSK to pay AstraZeneca royalties on total sales of Zejula, source:Yahoo, summary: A UK court on Wednesday ordered GSK's Tesaro to pay rival AstraZeneca royalties on total sales of ovarian cancer drug Zejula, in a win for the Anglo-Swedish drugmaker.  Tesaro had argued the royalty was payable only on sales that are for uses claimed or covered by the licensed patents, after AstraZeneca filed a UK lawsuit against GSK in 2021, asking for a bigger share of sales from Zejula.  In October 2012, Tesaro entered into license agreements with AstraZeneca, giving it exclusive rights to certain methods of treating patients with Zejula, developed by Tesaro with help from technology licensed from AstraZeneca., Headline: AstraZeneca's (AZN) Drug Combo Meets Ovarian Cancer Study Goal, source:Yahoo, summary: Interim data from a late-stage study shows that AstraZeneca's (AZN) cancer drugs, Lynparza and Imfinzi improved progression-free survival in certain patients with advanced ovarian cancer., Headline: AstraZeneca PLC ADR rises Wednesday, outperforms market, source:MarketWatch, summary: The AstraZeneca PLC ADR rallied 2.56% to $72.05 Wednesday, on what proved to be an all-around mixed trading session for the stock market, with the Dow Jones..., Headline: IN THE KNOW: AstraZeneca needs competitor data for context - Shore, source:Alliance News, summary: No summary, Headline: Top Analyst Reports for Mastercard, AstraZeneca & Philip Morris, source:Yahoo, summary: Today's Research Daily features new research reports on 16 major stocks, including Mastercard Incorporated (MA), AstraZeneca PLC (AZN) and Philip Morris International Inc. (PM)., Headline: Medical Behemoth AstraZeneca Flirts With Breakout On Fresh Hope In Ovarian Cancer, source:Yahoo, summary: AstraZeneca said Wednesday a combination of its drugs Lynparza and Imfinzi met the goal of a key study, leading AZN stock to surge., Headline: Unusual Call Option Trade in AstraZeneca (AZN)  Worth $1,645.00K, source:Fintel, summary: nan, Headline: WHO chief expects COVID emergency to end this year, source:Seeking Alpha, summary: No summary, Headline: GSK unit ordered to pay AstraZeneca royalties on Zejula sales, Reuters says, source:Thefly.com, summary: No summary, Headline: TOP NEWS: AstraZeneca's cancer drug Lynparza approved by NHS England, source:Alliance News, summary: No summary, Headline: LONDON MARKET OPEN: European stocks edge higher in cautious trade, source:Alliance News, summary: No summary, Headline: GSK ordered by UK court to pay more royalties to AstraZeneca on Zejula sales - report, source:Seeking Alpha, summary: No summary",AZN
165,2023-04-06,"Headline: 7 Very Undervalued Penny Stocks to Buy in April 2023, source:InvestorPlace, summary: No summary, Headline: Analysts Are Bullish on Top Healthcare Stocks: AstraZeneca (AZN), Sanofi (SNY), source:TipRanks, summary: No summary, Headline: Pfizer posts 82% efficacy for maternal RSV vaccine in full data release, source:Seeking Alpha, summary: No summary, Headline: The Zacks Analyst Blog Highlights Mastercard, AstraZeneca, Philip Morris, TJX and Citigroup, source:Yahoo, summary: Mastercard, AstraZeneca, Philip Morris, TJX and Citigroup are included in this Analyst Blog., Headline: FDA forces pre-term birth drug off the market after 12 years, source:Seeking Alpha, summary: No summary, Headline: LONDON MARKET CLOSE: Stocks end shortened week on positive note, source:Alliance News, summary: No summary, Headline: Pharma Stock Roundup: J&J's $8.9B Offer for Talc Litigation Settlement & Other Updates, source:Yahoo, summary: J&J (JNJ) offers a $8.9 billion settlement to resolve its talc lawsuits. FDA approves Merck's (MRK) Keytruda plus Seagen's Padcev for a bladder cancer indication., Headline: AstraZeneca PLC ADR rises Thursday, still underperforms market, source:MarketWatch, summary: The AstraZeneca PLC ADR inched 0.40% higher to $72.34 Thursday, on what proved to be an all-around favorable trading session for the stock market, with the..., Headline: McDonald's, U.K. Pharma Giant Hit New Highs, source:Yahoo, summary: Dow Jones component McDonald's hit new highs Wednesday while U.K. pharma giant AstraZeneca scored a breakout. In addition, MCD stock broke out from a 281.77 buy point, according to MarketSmith. Shares formed a 97-day consolidation and powered higher last month, up nine days in a row before pulling back this week., Headline: Catalyst Watch: Eyes on inflation data, big bank earnings, source:Seeking Alpha, summary: No summary",AZN
166,2023-04-07,"Headline: Estimating The Fair Value Of AstraZeneca PLC (LON:AZN), source:Yahoo, summary: Key Insights Using the 2 Stage Free Cash Flow to Equity, AstraZeneca fair value estimate is UK£139 AstraZeneca's UK£117..., Headline: 2 Top Biotech Stocks to Buy Right Now, source:Yahoo, summary: Pharmaceutical companies can be great long-term investments.  Because of the major industry risk that comes with patent expirations, investors need to be sure that they are picking pharmaceutical companies with strong product pipelines.  Here are two big pharma stocks with robust product portfolios and pipelines for long-term income investors to consider for their portfolios., Headline: Steven Cohen Loads Up on Esperion Therapeutics as Shares Slide, source:GuruFocus, summary: No summary",AZN
167,2023-04-10,"Headline: GSK Vs. Bristol-Myers Squibb: Who`s More Underrated By Mr. Market, source:Seeking Alpha, summary: No summary, Headline: GSK Vs. Bristol-Myers Squibb: Who's More Underrated By Mr. Market, source:SeekingAlpha, summary: GSK's dividend yield is 3.58%, slightly higher than Bristol-Myers Squibb's 3.22%. BMY's EBITDA margin was 43.7% for 2022, 11.4% more than GSK. Read more here., Headline: U.S. launches $5B program to speed up development of next-gen COVID vaccines, source:Seeking Alpha, summary: No summary, Headline: The Zacks Analyst Blog Highlights J&J, AstraZeneca, Merck, Seagen and Pfizer, source:Yahoo, summary: J&J, AstraZeneca, Merck, Seagen and Pfizer are part of the Zacks Top Analyst Blog., Headline: AstraZeneca PLC ADR underperforms Monday when compared to competitors, source:MarketWatch, summary: The AstraZeneca PLC ADR slid 0.37% to $72.07 Monday, on what proved to be an all-around mixed trading session for the stock market, with the Dow Jones..., Headline: Astrazeneca (AZN) Stock Sinks As Market Gains: What You Should Know, source:Yahoo, summary: Astrazeneca (AZN) closed at $72.07 in the latest trading session, marking a -0.37% move from the prior day., Headline: Sanofi Gets Full Commercial Control on Virus Medication From AstraZeneca in U.S., source:MarketWatch, summary: By Cecilia Butini Sanofi SA and AstraZeneca PLC said Monday that Sanofi would retain full commercial control on an antibody treatment for respiratory..., Headline: LONDON BRIEFING: Harbour Energy, BP to team up on carbon capture, source:Alliance News, summary: No summary, Headline: AstraZeneca upgraded to Overweight from Equal Weight at Morgan Stanley, source:Thefly.com, summary: No summary, Headline: Sanofi to get commercial control of RSV therapy nirsevimab in US, AstraZeneca to record $0.7B gain, source:Seeking Alpha, summary: No summary, Headline: TOP NEWS: Sanofi wins US drug control from AstraZeneca in Sobi deal, source:Alliance News, summary: No summary",AZN
168,2023-04-11,"Headline: LONDON BROKER RATINGS: Redburn likes Shell; Barclays raises Persimmon, source:Alliance News, summary: No summary, Headline: AstraZeneca updates arrangements with Sobi, Sanofi for nirsevimab in U.S., source:Thefly.com, summary: No summary, Headline: AstraZeneca price target lowered to 11,900 GBp from 12,700 GBp at Guggenheim, source:Thefly.com, summary: No summary, Headline: Street Wrap: Today`s Top 15 Upgrades, Downgrades, Initiations, source:Thefly.com, summary: No summary, Headline: AstraZeneca reinforces commitment to advancing science for patients with chronic kidney disease and hyperkalemia at NKF Spring Clinical Meeting 2023, source:Yahoo, summary: WILMINGTON, Del., April 11, 2023--AstraZeneca will showcase five real-world evidence (RWE) studies from its industry-leading Cardiovascular, Renal and Metabolism (CVRM) portfolio, reinforcing its commitment to advancing science in chronic kidney disease (CKD) and hyperkalemia (HK), at the National Kidney Foundation (NKF) Spring Clinical Meeting April 11-15, 2023., Headline: 12 Best Covid Treatment Stocks to Buy Today, source:Yahoo, summary: In this piece, we will take a look at the 12 best covid treatment stocks to buy today. For more stocks, head on over to 5 Best Covid Treatment Stocks to Buy Today. If there’s one thing that can be said for sure, it’s that the coronavirus pandemic has changed the world. The deadly disease, […], Headline: AstraZeneca (AZN), Sanofi Simply RSV Antibody Agreement Terms, source:Yahoo, summary: AstraZeneca (AZN) and Sanofi (SNY) revise the contractual terms of the agreement for Beyfortus. Sanofi will have full commercial control of Beyfortus in the United States., Headline: Fusion Pharmaceuticals receives IND clearance for Alpha therapy FPI-2068, source:Thefly.com, summary: No summary",AZN
169,2023-04-12,"Headline: AstraZeneca COVID shot production is expected to resume in India, source:Seeking Alpha, summary: No summary, Headline: These 2 Medical Stocks Could Beat Earnings: Why They Should Be on Your Radar, source:Yahoo, summary: Finding stocks expected to beat quarterly earnings estimates becomes an easier task with our Zacks Earnings ESP., Headline: AstraZeneca PLC ADR outperforms competitors on strong trading day, source:MarketWatch, summary: The AstraZeneca PLC ADR rallied 2.19% to $73.76 Wednesday, on what proved to be an all-around grim trading session for the stock market, with the NASDAQ..., Headline: Fusion Pharma Shares Edge Up 4.3% on FDA Clearance of FPI-2068, source:MarketWatch, summary: By Denny Jacob Fusion Pharmaceuticals Inc. shares edged up 4.3% to $4.35 in aftermarket trading Wednesday after it said the U.S. Food and Drug Administration..., Headline: Fusion Pharmaceuticals Announces IND Clearance for FPI-2068, a Jointly Developed Novel Targeted Alpha Therapy, source:Yahoo, summary: Fusion Pharmaceuticals Inc. (Nasdaq: FUSN), a clinical-stage oncology company focused on developing next-generation radiopharmaceuticals as precision medicines, today announced the clearance of investigational new drug (IND) applications for [225Ac]-FPI-2068 (FPI-2068) and corresponding imaging analogue [111In]-FPI-2107 (FPI-2107) to the U.S. Food and Drug Administration (FDA). Fusion is jointly developing FPI-2068 with AstraZeneca (LSE/STO/Nasdaq: AZN) under the companies' multi-asset collabora, Headline: SK Bioscience Rallies After Clinical Trials of Covid-19 Vaccine Booster, source:MarketWatch, summary: By Kwanwoo Jun SK Bioscience Co Ltd.'s shares rallied Thursday after the global phase 3 clinical trials confirmed the efficacy and safety of its Covid-19...",AZN
170,2023-04-13,"Headline: AstraZeneca price target raised to $85 from $75 at Argus, source:Thefly.com, summary: No summary, Headline: AZN June 2nd Options Begin Trading, source:Stock Options Channel, summary: No summary, Headline: Fusion (FUSN) to Begin Clinical Study on Targeted Alpha Therapy, source:Yahoo, summary: Fusion (FUSN) surges after investigational new drug application clearance by the FDA for its targeted alpha therapy FPI-2068, co-developed with AstraZeneca., Headline: AstraZeneca Stock Sees Relative Strength Rating Rise To 85, source:Yahoo, summary: AstraZeneca  now clears that threshold, with a jump from 80 to 85 Thursday.  When looking for the best stocks to buy and watch, be sure to pay attention to relative price strength.  AstraZeneca ADR is still within a buy range after breaking past a 72.22 buy point in a flat base., Headline: AstraZeneca PLC ADR rises Thursday, still underperforms market, source:MarketWatch, summary: The AstraZeneca PLC ADR rallied 1.37% to $74.77 Thursday, on what proved to be an all-around favorable trading session for the stock market, with the NASDAQ..., Headline: TOP NEWS: AstraZeneca Covid antibody neutralises variants of concern, source:Alliance News, summary: No summary",AZN
171,2023-04-14,"Headline: Ghana 1st in world to approve new malaria vaccine by Oxford, source:Seeking Alpha, summary: No summary, Headline: 3 Best Stocks to Buy Now, 4/14/2023, According to Top Analysts, source:TipRanks, summary: No summary, Headline: New analysis of Phase II data at AACR assesses ImaginAb's investigational CD8 ImmunoPET technology's ability to predict response in immunotherapy, source:Yahoo, summary: ImaginAb Inc., a global biotechnology company developing 89Zr crefmirlimab berdoxam (CD8 ImmunoPET™) imaging agent and radiopharmaceutical therapies (RPT) announces a poster presentation at AACR 2023 (# 3577 / 2 Poster PET, MRI, and CT Imaging April 18, 2023) of an independent analysis undertaken by AstraZeneca (LSE/STO/Nasdaq: AZN), on data from ImaginAb's IAB-CD8-201 'iCorrelate' Phase II study. The analysis shows baseline and early on-treatment CD8 ImmunoPET/CT may be able to distinguish resp, Headline: IXJ: Healthcare Dashboard For April, source:SeekingAlpha, summary: Pharmaceuticals/biotechnology is the only subsector with good value and quality scores. Learn why IXJ ETF is a global alternative to XLV., Headline: AstraZeneca PLC ADR falls Friday, underperforms market, source:MarketWatch, summary: The AstraZeneca PLC ADR shed 1.22% to $73.86 Friday, on what proved to be an all-around dismal trading session for the stock market, with the NASDAQ..., Headline: FTC Alerts Nearly 700 Companies About Potential Penalties for Misleading Claims, source:Yahoo, summary: Marketers will likely review their practices to avoid risking penalties that could stretch into the hundreds of millions of dollars",AZN
172,2023-04-15,"Headline: AstraZeneca presents results from AEGEAN Phase III trial, source:Thefly.com, summary: No summary",AZN
173,2023-04-16,"Headline: IMFINZI-based treatment before and after surgery reduced the risk of disease recurrence, progression events or death by 32% in resectable non-small cell lung cancer in the AEGEAN Phase III trial, source:Yahoo, summary: WILMINGTON, Del., April 16, 2023--Positive results from the AEGEAN Phase III trial showed that treatment with AstraZeneca’s IMFINZI® (durvalumab) in combination with neoadjuvant chemotherapy before surgery and as adjuvant monotherapy after surgery led to a statistically significant and clinically meaningful improvement in event-free survival (EFS) versus neoadjuvant chemotherapy alone followed by surgery for patients with resectable early-stage (IIA-IIIB) non-small cell lung cancer (NSCLC)., Headline: AstraZeneca reports positive results for lung cancer drug combination, source:Alliance News, summary: No summary, Headline: LONDON BRIEFING: Possible offers for Network International, John Wood, source:Alliance News, summary: No summary, Headline: GRAIL, AstraZeneca present new data on methylation assay, source:Thefly.com, summary: No summary",AZN
174,2023-04-17,"Headline: Pfizer Vs. AstraZeneca: Which Is Better For Long-Term Investors?, source:SeekingAlpha, summary: nan, Headline: Astrazeneca (AZN) is a Top Dividend Stock Right Now: Should You Buy?, source:Yahoo, summary: Dividends are one of the best benefits to being a shareholder, but finding a great dividend stock is no easy task. Does Astrazeneca (AZN) have what it takes? Let's find out., Headline: GRAIL Presents New Data Demonstrating That Methylation Assay Detects Residual Hematologic Cancer After Treatment at American Association for Cancer Research (AACR) Annual Meeting 2023, source:Business Wire, summary: No summary, Headline: AstraZeneca PLC ADR outperforms competitors despite losses on the day, source:MarketWatch, summary: The AstraZeneca PLC ADR slid 0.31% to $73.63 Monday, on what proved to be an all-around positive trading session for the stock market, with the NASDAQ..., Headline: Shanghai Cellular Biopharmaceutical Group presents first data from Phase I trial evaluating a novel CAR-T in advanced liver cancer at AACR Annual Meeting, source:Yahoo, summary: Shanghai Cellular Biopharmaceutical Group Ltd. (the Company, or Shanghai Cellular Bio), a company engaged in the drug development of immunotherapies for cancer and stem cell therapies for degenerative diseases, today presented data from the First-in-Human (FIH) Phase I trial evaluating C-CAR031 at the 2023 American Association for Cancer Research (AACR) Annual Meeting., Headline: Astrazeneca (AZN) Stock Sinks As Market Gains: What You Should Know, source:Yahoo, summary: In the latest trading session, Astrazeneca (AZN) closed at $73.63, marking a -0.31% move from the previous day.",AZN
175,2023-04-18,"Headline: Analysts Offer Insights on Healthcare Companies: AstraZeneca (AZN), Relay Therapeutics (RLAY) and 23andMe Holding (ME), source:TipRanks, summary: No summary, Headline: AstraZeneca confident new COVID antibody protects against known variants, source:Yahoo, summary: AstraZeneca is confident that its new version of COVID-19 antibody treatment could protect immunocompromised patients against all known virus variants, its vaccines head said.  Laboratory studies show the antibody, called AZD3152, neutralizes all known variants of COVID-19 and AstraZeneca has support from regulators to make the treatment available by the end of this year, Iskra Reic said in an interview on Tuesday.  AstraZeneca plans, pending more positive data and regulatory approval, to make the antibody available by the end of 2023., Headline: AstraZeneca PLC ADR rises Tuesday, outperforms market, source:MarketWatch, summary: The AstraZeneca PLC ADR advanced 1.89% to $75.02 Tuesday, on what proved to be an all-around grim trading session for the stock market, with the NASDAQ..., Headline: Why AstraZeneca Shares Are Trading Higher Today?, source:Yahoo, summary: AstraZeneca plc's (NASDAQ: AZN) vaccine head highlighted the confidence that the company's new COVID-19 antibody treatment could protect immunocompromised patients against all known virus variants. Laboratory studies show that the antibody, dubbed AZD3152, neutralizes all known variants of COVID-19. AstraZeneca has support from regulators to make the treatment available by the end of this year, Reuters reported citing Iskra Reic's interview. Depending on additional encouraging data and regulator",AZN
176,2023-04-19,"Headline: Citigroup, Ryanair Bemoan Lingering Brexit Woes: New Economy, source:Yahoo, summary: (Bloomberg) -- The new Brexit Deal for Northern Ireland between the UK and the European Union represents progress but isn’t enough to fully eliminate disruption caused by Britain’s exit from the bloc, business leaders said at the Bloomberg New Economy Gateway Europe event near Dublin.Most Read from BloombergWorthless Degrees Are Creating an Unemployable Generation in IndiaAirline Blunder Sells $10,000 Asia-US Business Class Tickets for $300India Passes China as World’s Most Populous Nation, UN S, Headline: Could This Rare-Disease Drug Candidate Become a Blockbuster?, source:Yahoo, summary: This drug candidate could be a great treatment option for patients with a potentially deadly disease., Headline: AstraZeneca PLC ADR underperforms Wednesday when compared to competitors, source:MarketWatch, summary: The AstraZeneca PLC ADR dropped 0.24% to $74.84 Wednesday, on what proved to be an all-around mixed trading session for the stock market, with the NASDAQ..., Headline: Astrazeneca (AZN) Dips More Than Broader Markets: What You Should Know, source:Yahoo, summary: In the latest trading session, Astrazeneca (AZN) closed at $74.84, marking a -0.24% move from the previous day.",AZN
