,date,information,related
73,2022-12-16,"Headline: HealthBeacon appoints new interim CFO, permanent CFO process ongoing, source:Alliance News, summary: No summary, Headline: AstraZeneca`s Imjudo combo gets EMA panel nod to treat liver, lung cancers in EU, source:Seeking Alpha, summary: No summary, Headline: Guardant Health (GH) Stock Sinks on Disappointing Blood Test Results, source:InvestorPlace, summary: No summary, Headline: AstraZeneca`s cancer, heart drugs gets EMA panel nod for expanded use in EU, source:Seeking Alpha, summary: No summary, Headline: Prenetics Acquires ACT Genomics, Creating a Leader in Comprehensive Cancer Genetics and Precision Oncology, source:Yahoo, summary: Acquisition to bring germline and somatic testing, cell-free DNA-based (liquid biopsy), and tissue-genomic profiling onto a single platformCancer genomics testing is now standard practice for cancer care and has shown to be highly successful such as Foundation One (acquired by Roche), Grail (acquired by Illumina), Exact Sciences, Guardant Health and moreExpects ACT to contribute US$25-30 million in revenues in 2023Positions Prenetics solidly within the US$80+ billion global precision oncology ma, Headline: AstraZeneca falls Friday, underperforms market, source:MarketWatch, summary: Shares of AstraZeneca PLC slid 1.80% to £111.56 Friday, on what proved to be an all-around poor trading session for the stock market, with the FTSE 100 Index..., Headline: AstraZeneca PLC ADR underperforms Friday when compared to competitors, source:MarketWatch, summary: The AstraZeneca PLC ADR slipped 2.58% to $67.94 Friday, on what proved to be an all-around grim trading session for the stock market, with the NASDAQ..., Headline: FDA Delays Decision on AstraZeneca (AZN), Merck's Lynparza sNDA, source:Yahoo, summary: The FDA extends the review period of AstraZeneca (AZN)/Merck's filing seeking label expansion for Lynparza's indication in prostate cancer. The FDA intends to use this time to review the submission.",AZN
74,2022-12-18,"Headline: IBBQ: Healthcare Dashboard For December, source:SeekingAlpha, summary: The pharmaceuticals/biotechnology subsector has good value and quality scores. Click here to read more about IBBQ ETF., Headline: AstraZeneca (AZN) Gets a Buy from SVB Securities, source:TipRanks, summary: No summary, Headline: AstraZeneca`s Imfinzi plus Imjudo recommended for approval in the EU, source:MarketWatch, summary: No summary, Headline: ENHERTU® Approved in the EU for Patients with Previously Treated HER2 Positive Advanced Gastric Cancer, source:Business Wire, summary: No summary, Headline: ENHERTU® Recommended for Approval in the EU by CHMP for Patients with HER2 Low Metastatic Breast Cancer, source:Business Wire, summary: No summary, Headline: AstraZeneca`s Forxiga gets EU approval recommendation for symptomatic chronic heart failure, source:MarketWatch, summary: No summary, Headline: AstraZeneca`s Enhertu wins EU approval for advanced gastric cancer, source:Seeking Alpha, summary: No summary, Headline: LONDON BRIEFING: Stocks called up, but prospect of Santa rally fades, source:Alliance News, summary: No summary, Headline: LONDON MARKET OPEN: Stocks higher as China begins shaky reopening, source:Alliance News, summary: No summary, Headline: AstraZeneca, Daiichi Sankyo announce Enhertu recommended for approval in the EU, source:Thefly.com, summary: No summary, Headline: TOP NEWS: AstraZeneca receives host of EU approvals or recommendations, source:Alliance News, summary: No summary",AZN
75,2022-12-19,"Headline: AstraZeneca slips after Imfinzi falls short in cancer trial, source:Yahoo, summary: By Geoffrey Smith, Headline: AstraZeneca reports Forxiga recommended for extend indication in EU by CHMP, source:Thefly.com, summary: No summary, Headline: AstraZeneca reports Enhertu approved in EU for previously treated gastric cancer, source:Thefly.com, summary: No summary, Headline: AstraZeneca says Imfinzi plus Imjudo recommended for approval in EU by CHMP, source:Thefly.com, summary: No summary, Headline: AstraZeneca says PEARL trial didn`t achieve statistical significance on endpoint, source:Thefly.com, summary: No summary, Headline: AstraZeneca’s Imfinzi plus Imjudo recommended for approval in the EU, source:Yahoo, summary: The Anglo-Swedish pharma giant said the Committee for Medicinal Products for Human Use of the European Medicines Agency based its opinion on results from the Himalaya Phase 3 trial, and results from the Poseidon Phase 3 trial., Headline: AstraZeneca’s Forxiga gets EU approval recommendation for symptomatic chronic heart failure, source:Yahoo, summary: The recommendation covers heart failure with reduced ejection fraction--a measure of the amount of blood the heart's left ventricle pumps with each heartbeat., Headline: AstraZeneca Drug Imfinzi Fails As Monotherapy In Metastatic Lung Cancer Setting, source:Yahoo, summary: AstraZeneca Plc (NASDAQ: AZN) announced topline data from the PEARL Phase 3 trial of Imfinzi (durvalumab) monotherapy versus platinum-based chemotherapy (investigator's choice) as a 1st-line treatment in patients with Stage IV (metastatic) non-small cell lung cancer (NSCLC). The study did not achieve statistical significance for the primary endpoints of improving overall survival (OS) versus platinum-based chemotherapy as a monotherapy treatment for metastatic NSCLC whose tumor cells express hig, Headline: AstraZeneca falls Monday, underperforms market, source:MarketWatch, summary: AstraZeneca PLC shares inched down 0.43% to £111.08 Monday, on what proved to be an all-around positive trading session for the stock market, with the FTSE..., Headline: AstraZeneca - Daiichi Sankyo's Enhertu Wins European Approval For Gastric Cancer, CHMP Backs Other Cancer Drugs, source:Yahoo, summary: The European Commission has approved AstraZeneca Plc (NASDAQ: AZN) - Daiichi Sankyo’s (OTC: DSKYF) (OTC: DSNKY) Enhertu (trastuzumab deruxtecan) for advanced HER2-positive gastric or gastroesophageal junction (GEJ) adenocarcinoma. The approval covers patients who have received a prior trastuzumab-based regimen. Concurrently, the Committee for Medicinal Products (CHMP) for Human Use (CHMP) of the European Medicines Agency has backed the approval for Enhertu for unresectable or metastatic HER2-low, Headline: AstraZeneca PLC ADR falls Monday, still outperforms market, source:MarketWatch, summary: The AstraZeneca PLC ADR shed 0.69% to $67.47 Monday, on what proved to be an all-around dismal trading session for the stock market, with the NASDAQ..., Headline: ADRs End Mixed; AstraZeneca, atai Life Sciences Trade Actively, source:MarketWatch, summary: By Denny Jacob International stocks trading in New York closed mixed on Monday. The S&P/BNY Mellon index of American depositary receipts ticked down 0.1% to..., Headline: Astrazeneca (AZN) Stock Moves -0.69%: What You Should Know, source:Yahoo, summary: Astrazeneca (AZN) closed the most recent trading day at $67.47, moving -0.69% from the previous trading session.",AZN
76,2022-12-20,"Headline: AstraZeneca, G42 Healthcare enter strategic partnership agreement, source:Thefly.com, summary: No summary, Headline: FTSE 100 lower as Bank of Japan's surprise move sparks fear, source:Yahoo, summary: Bank of Japan unexpectedly tweaks its ultra loose monetary policy., Headline: AstraZeneca rises Tuesday, outperforms market, source:MarketWatch, summary: AstraZeneca PLC shares inched up 0.16% to £111.26 Tuesday, on what proved to be an all-around favorable trading session for the stock market, with the FTSE..., Headline: AstraZeneca (AZN) Gets EU Nod & CHMP Opinions for Some Drugs, source:Yahoo, summary: The CHMP recommends approvals for expanded use of AstraZeneca's (AZN) Enhertu in breast cancer, Imfinzi plus Imjudo in lung and liver cancers and Forxiga in heart failure., Headline: Could AstraZeneca's Asthma Drug Candidate Generate Billions?, source:Yahoo, summary: AstraZeneca's new asthma rescue treatment could soon be approved in the United States for adults., Headline: AstraZeneca PLC ADR rises Tuesday, outperforms market, source:MarketWatch, summary: The AstraZeneca PLC ADR inched 0.37% higher to $67.72 Tuesday, on what proved to be an all-around favorable trading session for the stock market, with the..., Headline: LONDON BRIEFING: UK public sector borrowing shoots up in November, source:Alliance News, summary: No summary, Headline: AstraZeneca, Merck`s Lynparza gets approval in EU for expanded use in prostate cancer, source:Seeking Alpha, summary: No summary, Headline: AstraZeneca Imfinzi combo for biliary tract cancer gets approval in EU, source:Seeking Alpha, summary: No summary, Headline: LONDON MARKET OPEN: European markets make gains in early trade, source:Alliance News, summary: No summary, Headline: AstraZeneca wins two new approvals in EU for cancer drugs, source:Alliance News, summary: No summary",AZN
77,2022-12-21,"Headline: AstraZeneca`s Imfinzi+chemotherapy approved in E.U. in BTC patients, source:Thefly.com, summary: No summary, Headline: Merck, AstraZeneca: LYNPARZA/abiraterone and prednisone combo approved in EU, source:Thefly.com, summary: No summary, Headline: AstraZeneca`s Lynparza approved in E.U. as first line treatment in mCRPC, source:Thefly.com, summary: No summary, Headline: Madrigal: Next Steps After `Wow` Data In NASH, source:Seeking Alpha, summary: No summary, Headline: Madrigal: Next Steps After 'Wow' Data In NASH, source:SeekingAlpha, summary: On Monday, Madrigal Pharmaceuticals announced a best-case dataset from its phase 3 trial in NASH. Click here to read why I think his opens up a Huge market for MDGL., Headline: AstraZeneca rises Wednesday, still underperforms market, source:MarketWatch, summary: AstraZeneca PLC shares advanced 1.06% to £112.44 Wednesday, on what proved to be an all-around great trading session for the stock market, with the FTSE 100..., Headline: Europe Approves AstraZeneca's Two Combo Therapies For Prostate, Bile Duct Cancer Settings, source:Yahoo, summary: The European Commission has approved AstraZeneca Plc (NASDAQ: AZN) and Merck & Co Inc's (NYSE: MRK) Lynparza (olaparib) plus abiraterone and prednisone or prednisolone for metastatic castration-resistant prostate cancer (mCRPC) for patients for whom chemotherapy is not clinically indicated. The approval was based on results from the PROpel Phase III trial. In the trial, Lynparza combo therapy reduced the risk of disease progression or death by 34% versus abiraterone and prednisone or prednisolon, Headline: AstraZeneca (AZN) Gets EU Nod to Expanded Use of 2 Cancer Drugs, source:Yahoo, summary: The European Commission approves AstraZeneca's (AZN) two key cancer drugs Lynparza and Imfinzi for expanded use., Headline: AstraZeneca PLC ADR rises Wednesday, still underperforms market, source:MarketWatch, summary: The AstraZeneca PLC ADR inched 0.27% higher to $67.90 Wednesday, on what proved to be an all-around favorable trading session for the stock market, with the..., Headline: ADRs End Higher, AstraZeneca and Carnival Trade Actively, source:MarketWatch, summary: By Denny Jacob International stocks trading in New York closed higher on Wednesday. The S&P/BNY Mellon index of American depositary receipts ticked up 1.5%...",AZN
78,2022-12-22,"Headline: Analysts` Opinions Are Mixed on These Healthcare Stocks: AstraZeneca (AZN) and ContraFect (CFRX), source:TipRanks, summary: No summary, Headline: AstraZeneca rises Thursday, outperforms market, source:MarketWatch, summary: AstraZeneca PLC shares inched up 0.55% to £113.06 Thursday, on what proved to be an all-around grim trading session for the stock market, with the FTSE 100..., Headline: The Top Healthcare Stocks to Buy With $100, source:Yahoo, summary: AstraZeneca (NASDAQ: AZN) and Bristol Myers Squibb (NYSE: BMY) are two pharmaceutical stocks that investors can buy with less than a $100 bill.  AstraZeneca's $219 billion market capitalization makes it the eighth-largest pharmaceutical company in the world and the third-biggest international-based drugmaker.  Perhaps unsurprisingly, the $44.6 billion in revenue that analysts expect the company to generate in 2022 is well-diversified., Headline: Astrazeneca (AZN) is a Top-Ranked Growth Stock: Should You Buy?, source:Yahoo, summary: Wondering how to pick strong, market-beating stocks for your investment portfolio? Look no further than the Zacks Style Scores., Headline: AstraZeneca PLC ADR rises Thursday, outperforms market, source:MarketWatch, summary: The AstraZeneca PLC ADR inched 0.27% higher to $68.08 Thursday, on what proved to be an all-around poor trading session for the stock market, with the NASDAQ..., Headline: Top Research Reports for Novo Nordisk, AstraZeneca & Accenture, source:Yahoo, summary: Today's Research Daily features new research reports on 16 major stocks, including Novo Nordisk A/S (NVO), AstraZeneca PLC (AZN) and Accenture plc (ACN).",AZN
79,2022-12-23,"Headline: VEU: An Ex-U.S. Fully Diversified Passive ETF With A Low But Decent Yield, source:SeekingAlpha, summary: VEU is a good option for investors seeking geographical and sectoral diversification. Read why the fund has a higher chance of successfully generating strong returns in the long run., Headline: The Zacks Analyst Blog Highlights Novo Nordisk, AstraZeneca, Accenture, Chubb and Roper Technologies, source:Yahoo, summary: Novo Nordisk, AstraZeneca, Accenture, Chubb and Roper Technologies are part of the Zacks top Analyst Blog., Headline: AstraZeneca PLC ADR falls Friday, underperforms market, source:MarketWatch, summary: The AstraZeneca PLC ADR sank 0.15% to $67.98 Friday, on what proved to be an all-around great trading session for the stock market, with the NASDAQ Composite...",AZN
80,2022-12-24,"Headline: HQH: 50 Big-Yield Healthcare Stocks, These 3 Worth Considering, source:SeekingAlpha, summary: We share data on over 50 big-yield healthcare investments, including individual stocks, REITs, closed-end funds (CEFs) and bonds. Learn about our 3 top picks here.",AZN
81,2022-12-26,"Headline: Got $1,000? 5 Sensational Stocks to Buy to Start 2023 With a Bang, source:Yahoo, summary: The ageless Dow Jones Industrial Average, broad-based S&P 500, and growth-dependent Nasdaq Composite, have tumbled as much as 22%, 28%, and 38%, respectively, from their all-time highs.  For those of you keeping score at home, it means all three indexes are, or were at one point, in a bear market.  Since every bear market throughout history has eventually been recouped (and then some) by a bull market rally, the 2022 bear market represents the ideal time for long-term investors to pounce., Headline: Novavax COVID-19 shot lags in effectiveness in first study of its kind, source:Seeking Alpha, summary: No summary",AZN
82,2022-12-27,"Headline: AstraZeneca PLC (LON:AZN) is a favorite amongst institutional investors who own 88%, source:Yahoo, summary: A look at the shareholders of AstraZeneca PLC ( LON:AZN ) can tell us which group is most powerful. We can see that..., Headline: AstraZeneca PLC ADR falls Tuesday, still outperforms market, source:MarketWatch, summary: The AstraZeneca PLC ADR shed 0.07% to $67.93 Tuesday, on what proved to be an all-around mixed trading session for the stock market, with the Dow Jones..., Headline: LONDON BRIEFING: UK strikes continue; AstraZeneca wins Japan approvals, source:Alliance News, summary: No summary, Headline: TOP NEWS: AstraZeneca wins approvals for cancer treatments in Japan, source:Alliance News, summary: No summary, Headline: AstraZeneca`s Imjudo/Imfinzi combo gets approval in Japan for liver, lung cancers, source:Seeking Alpha, summary: No summary, Headline: Japan approves AstraZeneca`s blood cancer drug Calquence, source:Seeking Alpha, summary: No summary, Headline: AstraZeneca announces Imfinzi, Imjudo approved in Japan to treat three cancers, source:Thefly.com, summary: No summary, Headline: AstraZeneca announces Calquence approved in Japan to treat CLL, source:Thefly.com, summary: No summary",AZN
83,2022-12-28,"Headline: LONDON MARKET MIDDAY: FTSE 100 rises with positive 2022 in sight, source:Alliance News, summary: No summary, Headline: AstraZeneca rises Wednesday, still underperforms market, source:MarketWatch, summary: AstraZeneca PLC shares inched up 0.11% to £112.50 Wednesday, on what proved to be an all-around great trading session for the stock market, with the FTSE 100..., Headline: ADRs End Mostly Lower, AstraZeneca and ABB Trade Actively, source:MarketWatch, summary: By Denny Jacob International stocks trading in New York closed mostly lower on Wednesday. The S&P/BNY Mellon index of American depositary receipts ticked..., Headline: AstraZeneca PLC ADR outperforms market despite losses on the day, source:MarketWatch, summary: The AstraZeneca PLC ADR dropped 0.54% to $67.56 Wednesday, on what proved to be an all-around grim trading session for the stock market, with the NASDAQ..., Headline: AstraZeneca: Our 2023 Growth Pick, source:SeekingAlpha, summary: AstraZeneca's stock price performance is almost flat since our buy rating target released in May. Click here to read our latest analysis of AZN stock.",AZN
84,2022-12-29,"Headline: Novartis: Competitors Take Note, Iptacopan Is Coming, source:SeekingAlpha, summary: Novartis recently reported positive results from two phase 3 trials of iptacopan in PNH patients. Read why iptacopan should become a decent growth product for NVS stock., Headline: February 2023 Options Now Available For AstraZeneca (AZN), source:Stock Options Channel, summary: No summary, Headline: AstraZeneca rises Thursday, outperforms market, source:MarketWatch, summary: AstraZeneca PLC shares inched up 0.87% to £113.48 Thursday, on what proved to be an all-around favorable trading session for the stock market, with the FTSE..., Headline: AstraZeneca PLC (NASDAQ:AZN) Q3 2022 Earnings Call Transcript, source:Yahoo, summary: AstraZeneca PLC (NASDAQ:AZN) Q3 2022 Earnings Call Transcript November 10, 2022 AstraZeneca PLC beats earnings expectations. Reported EPS is $0.84, expectations were $0.72. Operator: Good morning to those joining from the U.K. and the U.S., good afternoon to those in Central Europe, and good evening to those listening in Asia. Welcome, ladies and gentlemen, to […], Headline: AstraZeneca's (AZN) Imfinzi+Imjudo Gets Japan Nod for 2 Cancers, source:Yahoo, summary: The Japanese Ministry of Health approves AstraZeneca's (AZN) Imfinzi plus Imjudo for treating advanced liver cancer and lung cancer., Headline: AstraZeneca PLC ADR rises Thursday, still underperforms market, source:MarketWatch, summary: The AstraZeneca PLC ADR inched 0.80% higher to $68.10 Thursday, on what proved to be an all-around positive trading session for the stock market, with the..., Headline: GSK on hunt for attractive biotechs ‘hiding in plain sight’, source:Yahoo, summary: GSK’s chief commercial officer is looking to acquire or partner with biotechs “hiding in plain sight”, as the UK drugmaker focuses on replenishing its drug pipeline.  Luke Miels said the company was hoping to avoid “getting into a bidding war” by identifying under-appreciated targets worth $1bn-$2.5bn, such as its acquisition of Sierra Oncology earlier this year.  Earlier this month, Amgen bought Horizon Therapeutics for $28bn.",AZN
85,2022-12-30,"Headline: Diabetes rates in children set to skyrocket by 2060 - study, source:Seeking Alpha, summary: No summary, Headline: Pharma Stock Roundup: FDA Gives Nod to RHHBY's Lunsumio, Accepts PFE Vaccine BLA, source:Yahoo, summary: FDA approves Roche's (RHHBY) Lunsumio for follicular lymphoma and accepts Pfizer's (PFE) BLA for the pentavalent meningococcal vaccine candidate., Headline: AstraZeneca PLC ADR falls Friday, underperforms market, source:MarketWatch, summary: The AstraZeneca PLC ADR slid 0.44% to $67.80 Friday, on what proved to be an all-around rough trading session for the stock market, with the NASDAQ Composite..., Headline: Exclusive-Drugmakers to raise prices on at least 350 drugs in U.S. in January, source:Yahoo, summary: Drugmakers including Pfizer Inc, GlaxoSmithKline PLC, Bristol Myers Squibb, AstraZeneca PLC and Sanofi SA plan to raise prices in the United States on more than 350 unique drugs in early January, according to data analyzed by healthcare research firm 3 Axis Advisors.  The increases are expected to come as the pharmaceutical industry prepares for the Biden Administration's Inflation Reduction Act (IRA), which allows the government's Medicare health program to negotiate prices directly for some drugs starting in 2026.",AZN
86,2022-12-31,"Headline: Align, Invitae among healthcare stocks SA contributors correctly said to avoid in 2022, source:Seeking Alpha, summary: No summary, Headline: Jim Simons Stock Portfolio: 10 Biggest Healthcare Stocks, source:Yahoo, summary: In this article we take a look at Jim Simons Stock Portfolio: 10 Biggest Healthcare Stocks. Click to skip ahead and see Jim Simons Stock Portfolio: 5 Biggest Healthcare Stocks. Gilead Sciences, Inc. (NASDAQ:GILD), Novo Nordisk A/S (NYSE:NVO), and Molina Healthcare, Inc. (NYSE:MOH) are three of the healthcare companies that Jim Simons’ quant fund has identified as […]",AZN
87,2023-01-02,"Headline: AstraZeneca price target raised to 13,500 GBp from 12,500 GBp at JPMorgan, source:Thefly.com, summary: No summary, Headline: LONDON BROKER RATINGS: Citigroup cuts Wizz Air; Redburn likes CRH, source:Alliance News, summary: No summary",AZN
88,2023-01-03,"Headline: 4D Molecular Therapeutics: Another Gene Therapy Player With A Differentiated Profile, source:SeekingAlpha, summary: FDMT is an undercovered gene therapy developer. It claims certain competitive differences for its vector delivery platform. Read more on FDMT stock here., Headline: Valneva Touts Additional Positive Heterologous Booster Data From COVID-19 Vaccine Study, source:Yahoo, summary: Valneva SE (NASDAQ: VALN) reported further heterologous booster data from an exploratory, small clinical study for its inactivated COVID-19 vaccine, VLA2001. The data show that a booster dose of VLA2001 was well tolerated in previously vaccinated participants with either Pfizer Inc (NYSE: PFE) and BioNTech SE (NASDAQ: BNTX) or Moderna Inc (NASDAQ: MRNA) shots. The data confirm the favorable safety profile of VLA2001 seen across all studies, including in homologous or heterologous booster setting, Headline: AstraZeneca rises Tuesday, outperforms market, source:MarketWatch, summary: Shares of AstraZeneca PLC advanced 2.82% to £115.34 Tuesday, on what proved to be an all-around positive trading session for the stock market, with the FTSE..., Headline: DocuSign and Ford Motor have been highlighted as Zacks Bull and Bear of the Day, source:Yahoo, summary: DocuSign and Ford Motor have been highlighted as Zacks Bull and Bear of the Day., Headline: 3 Top Healthcare Stocks Defying the Bear Market, source:Yahoo, summary: Let's take a closer look at these three healthcare stocks defying the current bear market.  Shares for TransMedics Group rose 222% in 2022.  The price jump was due in part to the company's financial performance and partly to its extended moat as the only organ transplant system approved by the Food and Drug Administration (FDA) to transport multiple organs., Headline: AstraZeneca PLC ADR outperforms market on strong trading day, source:MarketWatch, summary: The AstraZeneca PLC ADR rose 2.26% to $69.33 Tuesday, on what proved to be an all-around poor trading session for the stock market, with the NASDAQ Composite..., Headline: IBD 50 Stocks To Watch: Pharmaceutical Leader AstraZeneca Retakes Latest Buy Point, source:Yahoo, summary: Among the top stocks to watch, pharmaceutical leader AstraZeneca is retaking its latest buy point despite Tuesday's stock market weakness., Headline: ENHERTU® Type II Variation Application Validated by EMA for the Treatment of HER2 Mutant Metastatic Non-Small Cell Lung Cancer, source:Business Wire, summary: No summary, Headline: On This Day: Pelosi is 1st woman elected speaker of the House, source:United Press International, summary: No summary",AZN
89,2023-01-04,"Headline: Kymera Therapeutics appoints Chiniara as CLO, Corporate Secretary, source:Thefly.com, summary: No summary, Headline: Stocks making the biggest moves premarket: General Electric, Salesforce, Alibaba and more, source:CNBC, summary: These are the stocks posting the largest moves in early morning trading. , Headline: EMA validates change to Daiichi Sankyo`s application for lung cancer drug Enhertu, source:Seeking Alpha, summary: No summary, Headline: AstraZeneca rises Wednesday, outperforms market, source:MarketWatch, summary: AstraZeneca PLC shares inched up 0.59% to £116.02 Wednesday, on what proved to be an all-around positive trading session for the stock market, with the FTSE..., Headline: AstraZeneca PLC ADR rises Wednesday, still underperforms market, source:MarketWatch, summary: The AstraZeneca PLC ADR inched 0.25% higher to $69.50 Wednesday, on what proved to be an all-around favorable trading session for the stock market, with the..., Headline: AstraZeneca Stock Scores Relative Strength Rating Upgrade, source:Yahoo, summary: AstraZeneca ADR shows improving price performance, earning an upgrade to its IBD Relative Strength Rating., Headline: Genomic Vision Announces Successful Beta Testing of FiberSmart®, source:Business Wire, summary: No summary, Headline: TOP NEWS: AstraZeneca's and Sanofi's nirsevimab approved for US review, source:Alliance News, summary: No summary, Headline: AstraZeneca PLC ADR rises Thursday, outperforms market, source:MarketWatch, summary: No summary, Headline: LONDON BROKER RATINGS: Bank of America cuts Pearson to 'underperform', source:Alliance News, summary: No summary, Headline: AstraZeneca initiated with an Outperform at BMO Capital, source:Thefly.com, summary: No summary",AZN
