,date,information,related
154,2023-04-21,"Headline: Analysts Conflicted on These Technology Names: Cadence Design (CDNS), Lockheed Martin (LMT) and Mobileye Global, Inc. Class A (MBLY), source:TipRanks, summary: No summary, Headline: 49ers and Cadence Team Up on Multi-Year Technology Partnership Focused on Sustainability, source:Yahoo, summary: Cadence Design Systems:",CDNS
155,2023-04-22,"Headline: 3 Stocks To Consider With Earnings Approaching, source:TalkMarkets, summary: No summary",CDNS
156,2023-04-23,"Headline: Notable earnings after Monday`s close, source:Seeking Alpha, summary: No summary, Headline: Cadence Design Systems Q1 2023 Earnings Preview, source:Seeking Alpha, summary: No summary, Headline: Stocks Poised to Fall, source:MarketWatch, summary: The Bureau of Economic Analysis will release its preliminary estimate of first-quarter gross-domestic-product growth on Thursday,, Headline: GLOBAL BRIEFING: FTSE called flat; UK house price growth slows, source:Alliance News, summary: No summary, Headline: Notable companies reporting after market close, source:Thefly.com, summary: No summary, Headline: Cadence Design options imply 2.8% move in share price post-earnings, source:Thefly.com, summary: No summary, Headline: Cadence Design sees Q2 EPS $1.15-$1.19, consensus $1.25, source:Thefly.com, summary: No summary, Headline: Cadence Design reports Q1 EPS $1.29, consensus $1.25, source:Thefly.com, summary: No summary, Headline: Cadence Design raises FY23 EPS view to $4.96-$5.04, consensus $4.98, source:Thefly.com, summary: No summary, Headline: Cadence Design Systems Non-GAAP EPS of $1.29 beats by $0.04, revenue of $1.02B beats by $10M, source:Seeking Alpha, summary: No summary, Headline: Cadence Design falls 4% to $204 after Q1 results, below-consensus Q2 guidance, source:Thefly.com, summary: No summary, Headline: Cadence Design Systems Inc. stock outperforms competitors despite losses on the day, source:MarketWatch, summary: No summary",CDNS
157,2023-04-24,"Headline: Stock futures slip as tech heavyweight earnings loom, source:MarketWatch, summary: No summary, Headline: Fly Intel: After-Hours Movers, source:Thefly.com, summary: No summary, Headline: Cadence Accelerates Hyperscale SoC Design with Next-Generation 112G Extended Long-Reach SerDes IP on TSMC’s N4P Process, source:Yahoo, summary: SAN JOSE, Calif., April 24, 2023--Cadence unveiled its 112G-ELR SerDes IP on TSMC’s N4P process for hyperscale computing, AI/ML, networking and 5G infrastructure applications., Headline: Cadence Tapes Out 16G UCIe Advanced Package IP on TSMC’s N3E Process Technology, source:Yahoo, summary: SAN JOSE, Calif., April 24, 2023--Cadence taped out 16G UCIe advanced package IP on TSMC’s 3nm process technology, providing an open standard for chiplet die-to-die communication., Headline: Cadence: Q1 Earnings Snapshot, source:Associated Press, The, summary: No summary, Headline: Cadence Design Systems lifts yearly outlook after first-quarter growth, source:Alliance News, summary: No summary, Headline: Cadence Design Systems 1Q Revenue Rises 13%, source:MarketWatch, summary: By Bob Henderson Cadence Design Systems Inc. on Monday reported a 13% increase in first-quarter revenue, at the top of its guidance range forecast in..., Headline: Stocks making the biggest moves after hours: First Republic, Whirlpool and more, source:CNBC, summary: These are some of the stocks posting the largest moves in extended hours trading., Headline: Cadence Design Systems stock falls 5% on short-term outlook, source:MarketWatch, summary: Cadence Design Systems Inc. shares fell in the extended session Monday after the software company topped Street expectations for the past quarter but isn’t..., Headline: Stocks to Watch: First Republic Bank, Cadence Design Systems, Aaron's, Whirlpool, source:MarketWatch, summary: By Sabela Ojea First Republic Bank said Monday that its customers withdrew more than $100 billion in deposits after the failure of a pair of misized banks..., Headline: Cadence Reports First Quarter 2023 Financial Results, source:Yahoo, summary: SAN JOSE, Calif., April 24, 2023--Cadence Reports First Quarter 2023 Financial Results, Headline: Cadence Design Systems Beats First-Quarter Views But Gives Weak Guidance, source:Yahoo, summary: Cadence Design Systems beat Wall Street's targets for the first quarter but disappointed with its outlook for the current period., Headline: Cadence Design Systems, Inc. (CDNS) Q1 2023 Earnings Call Transcript, source:SeekingAlpha, summary: nan, Headline: Cadence Design Systems (CDNS) Beats Q1 Earnings and Revenue Estimates, source:Yahoo, summary: Cadence (CDNS) delivered earnings and revenue surprises of 3.20% and 1.59%, respectively, for the quarter ended March 2023. Do the numbers hold clues to what lies ahead for the stock?, Headline: Cadence (CADE) Surpasses Q1 Earnings Estimates, source:Yahoo, summary: Cadence (CADE) delivered earnings and revenue surprises of 3.03% and 6.09%, respectively, for the quarter ended March 2023. Do the numbers hold clues to what lies ahead for the stock?, Headline: Cadence (CADE) Q1 Earnings: Taking a Look at Key Metrics Versus Estimates, source:Yahoo, summary: Although the revenue and EPS for Cadence (CADE) give a sense of how its business performed in the quarter ended March 2023, it might be worth considering how some key metrics compare with Wall Street estimates and the year-ago numbers., Headline: Cadence Design Systems Inc. stock falls Tuesday, underperforms market, source:MarketWatch, summary: No summary",CDNS
158,2023-04-25,"Headline: Cadence Design price target raised to $235 from $225 at KeyBanc, source:Thefly.com, summary: No summary, Headline: Cadence Design (CDNS) Receives a Buy from Bank of America Securities, source:TipRanks, summary: No summary, Headline: Cadence Design price target raised to $223 from $215 at Baird, source:Thefly.com, summary: No summary, Headline: Cadence Design price target raised to $240 from $225 at BofA, source:Thefly.com, summary: No summary, Headline: First Republic stock tanks, UPS shares weaken, Spotify shares advance, and more stocks on the move, source:MarketWatch, summary: These stocks were making some of the most notable moves Tuesday amid a wave of earnings reports., Headline: These Stocks Are Moving the Most Today: First Republic, UPS, PepsiCo, GM, GE, Microsoft, Alphabet, and More, source:Yahoo, summary: Shares of First Republic tumble after deposits at the regional lender sank in the first quarter, United Parcel Service trims its revenue outlook, and earnings reports from Microsoft and Alphabet are coming after Wall Street closes Tuesday., Headline: Cadence (CDNS) Q1 Earnings & Revenues Top Estimates, Up Y/Y, source:Yahoo, summary: Cadence's (CDNS) first-quarter performance gains on the back of higher demand for its products across all segments., Headline: Q1 2023 Cadence Design Systems Inc Earnings Call, source:Yahoo, summary: Q1 2023 Cadence Design Systems Inc Earnings Call, Headline: Video: Nasdaq 100 Movers: CDNS, FISV, source:Market News Video, summary: No summary, Headline: Cadence Design Earnings: Stock Drops 5.5% on Lighter-Than-Expected Q2 Guidance, source:Yahoo, summary: In Monday's after-hours trading, shares of the provider of design solutions for the electronics industry declined following the release of the first-quarter report., Headline: Stocks making the biggest moves midday: First Republic Bank, PepsiCo, Fiserv and more , source:CNBC, summary: These are the stocks posting the largest moves in midday trading. , Headline: Cadence and TSMC Collaborate on N16 79GHz mmWave Design Reference Flow to Accelerate Radar, 5G and Wireless Innovation, source:Yahoo, summary: SAN JOSE, Calif., April 25, 2023--Cadence has collaborated with TSMC to optimize the Cadence Virtuoso platform for the 79GHz mmWave design reference flow on TSMC’s N16 process., Headline: Cadence Custom Design Migration Flow Accelerates Adoption of TSMC N3E and N2 Process Technologies, source:Yahoo, summary: SAN JOSE, Calif., April 25, 2023--Cadence announced a node-to-node design migration flow based on the Cadence Virtuoso Design Platform that is compatible with TSMC advanced nodes., Headline: Baird Maintains Cadence Design Systems (CDNS) Outperform Recommendation, source:Fintel, summary: nan, Headline: B of A Securities Maintains Cadence Design Systems (CDNS) Buy Recommendation, source:Fintel, summary: nan, Headline: Keybanc Maintains Cadence Design Systems (CDNS) Overweight Recommendation, source:Fintel, summary: nan, Headline: Cadence Design Systems Stock Tanks On Weak Guidance, source:Yahoo, summary: Cadence Design Systems beat Wall Street's targets for the first quarter but disappointed with its outlook for the current period., Headline: 7 Growth Stocks With Huge Return Potential for Long-Term Investors, source:Yahoo, summary: Sooner or later, investors will stop fearing the “phantom recession,” i.e. the recession that really doesn’t exist except in many economists’ imaginations. At that point, many growth stocks should come soaring back. The latest evidence supporting my “phantom recession” theory came last week, when S&P reported that the U.S. private sector Purchasing Managers’ Index for April came in at 53.5 in April, up from 52.8 in March. Moreover, the nation’s Services PMI rose to 53.7, well above analysts’ ave, Headline: Cadence Design Systems Inc. stock falls Wednesday, still outperforms market, source:MarketWatch, summary: No summary",CDNS
159,2023-04-26,"Headline: Cadence Design price target raised to $230 from $222 at Deutsche Bank, source:Thefly.com, summary: No summary, Headline: Are Computer and Technology Stocks Lagging  Cadence Design Systems (CDNS) This Year?, source:Yahoo, summary: Here is how Cadence Design Systems (CDNS) and Spark Networks, Inc. (LOV) have performed compared to their sector so far this year., Headline: Cadence Collaborates with GUC on AI, HPC and Networking in Advanced Packaging Technologies, source:Yahoo, summary: SAN JOSE, Calif., April 26, 2023--The Cadence 112G-LR SerDes is silicon proven in Global Unichip Corp's AI/HPC/networking platform, demonstrating excellent performance and robustness., Headline: Cadence Digital and Custom/Analog Design Flows Certified for TSMC’s Latest N3E and N2 Process Technologies, source:Yahoo, summary: SAN JOSE, Calif., April 26, 2023--Cadence announced its digital and custom/analog flows have been certified to support TSMC’s new DRM for the foundry’s advanced N3E and N2 nodes., Headline: Cadence Delivers New Design Flows Based on the Integrity 3D-IC Platform in Support of TSMC 3Dblox™ Standard, source:Yahoo, summary: SAN JOSE, Calif., April 26, 2023--Cadence announced new design flows based on its Integrity 3D-IC platform that supports TSMC's 3Dblox™ standard for 3D front-end design partitioning., Headline: Cadence and Vidya & Child Partner for Education, source:Yahoo, summary: Cadence Design Systems:, Headline: Deutsche Bank Maintains Cadence Design Systems (CDNS) Buy Recommendation, source:Fintel, summary: nan",CDNS
160,2023-04-27,"Headline: Cadence Design (CDNS): New Buy Recommendation for This Technology Giant, source:TipRanks, summary: No summary, Headline: Should You Invest in Cadence (CDNS) Based on Bullish Wall Street Views?, source:Yahoo, summary: Based on the average brokerage recommendation (ABR), Cadence (CDNS) should be added to one's portfolio. Wall Street analysts' overly optimistic recommendations cast doubt on the effectiveness of this highly sought-after metric. So, is the stock worth buying?, Headline: Cadence Design Systems, Inc. (NASDAQ:CDNS) Q1 2023 Earnings Call Transcript, source:Yahoo, summary: Cadence Design Systems, Inc. (NASDAQ:CDNS) Q1 2023 Earnings Call Transcript April 24, 2023 Operator: Good afternoon. My name is Emma, and I will be your conference operator today. At this time, I would like to welcome everyone to the Cadence First Quarter 2023 Earnings Conference Call. All lines have been placed on mute to prevent […]",CDNS
161,2023-04-28,"Headline: Analysts Are Increasing Price Targets of These 10 Stocks, source:Yahoo, summary: In this article, we will discuss the 10 stocks whose price targets were recently raised by analysts. If you want to see more such stocks on the list, go directly to Analysts Are Increasing Price Targets of These 5 Stocks. Especially technology stocks have been performing particularly well over the last few days. The gains were […], Headline: Cadence Design Systems Inc. stock rises Friday, still underperforms market, source:MarketWatch, summary: Shares of Cadence Design Systems Inc. inched 0.76% higher to $209.45 Friday, on what proved to be an all-around positive trading session for the stock..., Headline: Synopsys: Robust Semi Exposure To Deal Calmly With Recession Fears, source:SeekingAlpha, summary: Synopsys is supported by strong tailwinds such as China's rising Chip Industry, EV and AI-driven solutions adoption. See why SNPS is my top idea for a recession.",CDNS
162,2023-04-30,"Headline: Cadence Bank (NYSE:CADE) Is Increasing Its Dividend To $0.235, source:Yahoo, summary: Cadence Bank ( NYSE:CADE ) has announced that it will be increasing its dividend from last year's comparable payment on...",CDNS
163,2023-05-01,"Headline: Are You a Growth Investor? This 1 Stock Could Be the Perfect Pick, source:Yahoo, summary: Wondering how to pick strong, market-beating stocks for your investment portfolio? Look no further than the Zacks Style Scores., Headline: Cadence Design Systems Inc. stock rises Monday, outperforms market, source:MarketWatch, summary: Shares of Cadence Design Systems Inc. inched 0.57% higher to $210.65 Monday, on what proved to be an all-around grim trading session for the stock market,...",CDNS
164,2023-05-02,"Headline: Cadence Bank (NYSE:CADE) Q1 2023 Earnings Call Transcript, source:Yahoo, summary: Cadence Bank (NYSE:CADE) Q1 2023 Earnings Call Transcript April 25, 2023 Cadence Bank misses on earnings expectations. Reported EPS is $0.4 EPS, expectations were $0.66. Operator: Good morning, and welcome to the Cadence Bank First Quarter 2023 Conference Call. All participants will be in a listen-only mode for the duration of the call. I would […], Headline: Cadence Design Is an AI Software Powerhouse, but Is It Worth Its Premium Valuation?, source:Yahoo, summary: With big tech shifting toward in-house chip design, Cadence stands to benefit from these growing tailwinds., Headline: Cadence Design Systems Inc. stock outperforms market despite losses on the day, source:MarketWatch, summary: Shares of Cadence Design Systems Inc. sank 0.80% to $208.97 Tuesday, on what proved to be an all-around grim trading session for the stock market, with the...",CDNS
165,2023-05-03,"Headline: Cadence Leverages IBM Cloud HPC to Accelerate Electronic Chip and System Design Software Development, source:Yahoo, summary: Today, IBM (IBM: NYSE) announced Cadence Design Systems, Inc. (Nasdaq: CDNS), is leveraging high-performance computing (HPC) with IBM Cloud HPC to help develop its chip and system design software faster. With more than 30 years of computational software experience, Cadence helps companies deliver innovative electronic products, including chips, boards and systems for dynamic market applications such as hyperscale computing, 5G communications, automotive, mobile, aerospace, consumer, industrial a, Headline: Cadence Design Systems Inc. stock falls Wednesday, underperforms market, source:MarketWatch, summary: Shares of Cadence Design Systems Inc. shed 0.73% to $207.45 Wednesday, on what proved to be an all-around poor trading session for the stock market, with the...",CDNS
166,2023-05-04,"Headline: AI Is Helping With Semiconductor Design, and This Little-Known Software Stock Is Poised to Benefit, source:Yahoo, summary: Artificial intelligence (AI) -- a computing system that attempts to imitate the way the human mind processes information and solves problems -- has been around for decades.  Companies across all industries see the potential to supercharge their performance if they put these new computing systems to work and are investing in new projects accordingly.  Behind every AI system is a powerful semiconductor, so chip stocks have rightly attracted a lot of attention in recent months., Headline: Top Robotics Stocks for Q2 2023, source:Yahoo, summary: While robots in the past were used mostly in industrial applications, robotics are now being employed for security, health care, aerospace, food and beverage uses, and education.  Amid these advances, market research analysts have forecast the robotics market will expand to $214.7 billion by 2030, growing at a compound annual growth rate (CAGR) of almost 23%.  With such an increasing investment opportunity, robot and automation stocks, as represented by the ROBO Global Robotics and Automation Index ETF (ROBO), an exchange-traded fund (ETF), have outperformed the broader market., Headline: Cadence Design Systems Inc. stock falls Thursday, underperforms market, source:MarketWatch, summary: Shares of Cadence Design Systems Inc. slid 1.17% to $205.03 Thursday, on what proved to be an all-around dismal trading session for the stock market, with...",CDNS
167,2023-05-05,"Headline: Cadence Design Systems Inc. stock rises Friday, still underperforms market, source:MarketWatch, summary: Shares of Cadence Design Systems Inc. inched 0.10% higher to $205.24 Friday, on what proved to be an all-around favorable trading session for the stock..., Headline: Cadence Honors The Next Generation of Innovation: Women in Technology Scholarship Awards, source:Yahoo, summary: Cadence Design Systems",CDNS
168,2023-05-08,"Headline: Cadence Design Systems Inc. stock underperforms Monday when compared to competitors despite daily gains, source:MarketWatch, summary: Shares of Cadence Design Systems Inc. inched 0.16% higher to $205.56 Monday, on what proved to be an all-around mixed trading session for the stock market,...",CDNS
169,2023-05-09,"Headline: Cadence Design Systems Inc. stock falls Tuesday, underperforms market, source:MarketWatch, summary: Shares of Cadence Design Systems Inc. sank 0.74% to $204.03 Tuesday, on what proved to be an all-around poor trading session for the stock market, with the...",CDNS
170,2023-05-10,"Headline: Cadence Design Systems Inc. stock rises Wednesday, still underperforms market, source:MarketWatch, summary: Shares of Cadence Design Systems Inc. inched 0.08% higher to $204.19 Wednesday, on what proved to be an all-around mixed trading session for the stock..., Headline: Cadence Design names Mary Louise Krakauer as Board Chair, source:Thefly.com, summary: No summary, Headline: Cadence Design Systems appoints Mary Louise Krakauer as board chair, source:Seeking Alpha, summary: No summary",CDNS
171,2023-05-11,"Headline: Cadence Design Systems Appoints Board Member Krakauer as Chair, source:MarketWatch, summary: By Denny Jacob Cadence Design Systems on Thursday said board member Mary Louise Krakauer assumed the role of chair of the board. The company, which focuses..., Headline: Cadence Design Systems Inc. stock underperforms Thursday when compared to competitors, source:MarketWatch, summary: Shares of Cadence Design Systems Inc. shed 1.34% to $201.46 Thursday, on what proved to be an all-around rough trading session for the stock market, with the..., Headline: Cadence Appoints Mary Louise Krakauer as Chair of the Board, source:Yahoo, summary: SAN JOSE, Calif., May 11, 2023--Cadence announced that current Cadence board member, Mary Louise (ML) Krakauer, has assumed the role of chair of the board, effective May 4, 2023., Headline: Cadence’s John Wall to Present at Needham Conference, source:Yahoo, summary: SAN JOSE, Calif., May 11, 2023--Cadence’s John Wall to Present at Needham Conference",CDNS
172,2023-05-12,"Headline: Top Indian CEOs, source:Yahoo, summary: Some of the top Indian CEOs are heading major corporations in the financial services and tech sectors. Learn who they are and how they’re leading the charge in their respective industries., Headline: Cadence Design Systems Inc. stock outperforms market despite losses on the day, source:MarketWatch, summary: Shares of Cadence Design Systems Inc. sank 0.15% to $201.16 Friday, on what proved to be an all-around grim trading session for the stock market, with the..., Headline: NBXG: Deep Discount On An Interesting Tech Fund, source:SeekingAlpha, summary: NBXG focuses with a heavy emphasis on tech-related investments that are related to connectivity, making it a fairly interesting tech play. See more here.",CDNS
173,2023-05-15,"Headline: Cadence Design Systems Inc. stock rises Monday, outperforms market, source:MarketWatch, summary: Shares of Cadence Design Systems Inc. inched 0.57% higher to $202.31 Monday, on what proved to be an all-around great trading session for the stock market,...",CDNS
174,2023-05-16,"Headline: Cadence Design Systems Inc. stock rises Tuesday, outperforms market, source:MarketWatch, summary: Shares of Cadence Design Systems Inc. inched 0.07% higher to $202.46 Tuesday, on what proved to be an all-around poor trading session for the stock market,..., Headline: Learnings From Earnings: Macro Crosscurrents Make Growth Elusive, source:SeekingAlpha, summary: Markets are being shaped by disparate trends from falling energy prices to rising interest rates.",CDNS
175,2023-05-17,"Headline: WTAI: This Tiny AI ETF Could be a Hidden Gem, source:TipRanks, summary: No summary, Headline: Cadence Design Systems Inc. stock rises Wednesday, still underperforms market, source:MarketWatch, summary: Shares of Cadence Design Systems Inc. inched 0.83% higher to $204.15 Wednesday, on what proved to be an all-around favorable trading session for the stock..., Headline: Synopsys jumps 8% as Baird sees it at `beginning of decade of impact`, source:Seeking Alpha, summary: No summary, Headline: Cadence Design Systems Inc. stock outperforms market on strong trading day, source:MarketWatch, summary: No summary",CDNS
176,2023-05-18,"Headline: Cadence Design Systems: Valuation Is Still Too High, source:SeekingAlpha, summary: Cadence Design Systems currently trades at a high valuation with a forward PE ratio of 38x. Click here to read my analysis of CDNS stock., Headline: Cadence Design Systems, IBD Stock Of The Day, Rebounds From Short Pullback, source:Yahoo, summary: Cadence Design Systems is the IBD Stock Of The Day as the maker of electronic design automation software bounces back from a post-earnings report swoon., Headline: Dow Jones Futures: S&P 500 Hits 2023 High As Nvidia, Netflix, Palantir Soar. But Don't Do This., source:Yahoo, summary: The S&P 500 hit a 2023 high Thursday, led by techs such as Netflix and Nvidia. Beware FOMO and don't chase extended stocks.",CDNS
177,2023-05-19,"Headline: Cadence Bank's (NYSE:CADE) Upcoming Dividend Will Be Larger Than Last Year's, source:Yahoo, summary: The board of Cadence Bank ( NYSE:CADE ) has announced that it will be paying its dividend of $0.235 on the 3rd of July..., Headline: Cadence Design Systems Inc. stock outperforms market despite losses on the day, source:MarketWatch, summary: Shares of Cadence Design Systems Inc. shed 0.06% to $216.71 Friday, on what proved to be an all-around dismal trading session for the stock market, with the...",CDNS
178,2023-05-20,"Headline: MercadoLibre Leads 5 Stocks Near Buy Points From This Classic Bullish Pattern, source:Yahoo, summary: MercadoLibre is one of several stocks setting up just above or below buy points from a flat base, a classic bullish pattern.",CDNS
179,2023-05-22,"Headline: Betting On AI? The 12 Stocks That Should Be On Your Radar, source:Benzinga, summary: No summary, Headline: Cadence Design Systems Inc. stock underperforms Monday when compared to competitors, source:MarketWatch, summary: Shares of Cadence Design Systems Inc. shed 2.34% to $211.63 Monday, on what proved to be an all-around mixed trading session for the stock market, with the..., Headline: Dow Jones Aerospace Giant Boeing Eyes Latest Buy Point. 3 Others To Buy And Watch., source:Yahoo, summary: Dow Jones aerospace and defense giant Boeing, along with ASML, Cadence and DraftKings, are in or near buy zones in today's stock market.",CDNS
180,2023-05-23,"Headline: Dow Jones Futures Fall After Biden-McCarthy Meeting; Lowe's Slides On Earnings, source:Yahoo, summary: Dow Jones futures fell Tuesday after President Biden and House Speaker Kevin McCarthy failed to reach a deal at their debt ceiling meeting., Headline: Dow Jones Falls 150 Points After Biden-McCarthy Meeting; Lowe's Rallies On Earnings, source:Yahoo, summary: The Dow Jones fell Tuesday after President Biden and House Speaker Kevin McCarthy failed to reach a deal at their debt ceiling meeting., Headline: Meet the 2022 Latinx Students in Technology Scholarship Recipients, source:Yahoo, summary: Cadence is thrilled to congratulate the recipients of the Latinx Students in Technology program by showcasing their outstanding achievements and inspirational stories with this fifth and final installment of the Diversity in Technology Scholarship blog series: https://www.3blmedia.com/news/campaign/cadence-diversity-technology-scholarships, Headline: Cadence Design Systems Inc. stock falls Tuesday, underperforms market, source:MarketWatch, summary: Shares of Cadence Design Systems Inc. slid 2.77% to $205.76 Tuesday, on what proved to be an all-around grim trading session for the stock market, with the...",CDNS
