,date,information,related
181,2023-05-24,"Headline: Cadence Design CEO: We have a leadership position in package design software, source:Thefly.com, summary: No summary, Headline: Dow Jones Falls 225 Points Ahead Of Fed Minutes; Kohl's Soars 15% On Surprise Profit, source:Yahoo, summary: The Dow Jones Industrial Average fell 225 points Wednesday ahead of the Fed minutes from the latest policy meeting. Retailer Kohl's soared 15% on a surprise profit., Headline: Cadence (CDNS) Up 0.9% Since Last Earnings Report: Can It Continue?, source:Yahoo, summary: Cadence (CDNS) reported earnings 30 days ago. What's next for the stock? We take a look at earnings estimates for some clues., Headline: Cadence Design Systems Inc. stock falls Wednesday, underperforms market, source:MarketWatch, summary: Shares of Cadence Design Systems Inc. shed 1.02% to $203.67 Wednesday, on what proved to be an all-around rough trading session for the stock market, with..., Headline: Cadence’s Anirudh Devgan to Present at Bernstein Conference, source:Yahoo, summary: SAN JOSE, Calif., May 24, 2023--Cadence’s Anirudh Devgan to Present at Bernstein Conference, Headline: Noteworthy Thursday Option Activity: CDNS, KLAC, TH, source:Stock Options Channel, summary: No summary",CDNS
182,2023-05-25,"Headline: Cadence Design Systems Inc. stock rises Thursday, outperforms market, source:MarketWatch, summary: Shares of Cadence Design Systems Inc. surged 10.22% to $224.49 Thursday, on what proved to be an all-around mixed trading session for the stock market, with..., Headline: Cadence Investing in Innovation - Student Design Teams, source:Yahoo, summary: Student teams working together to tackle technical challenges and find innovative solutions are the future of the electronics industry. That's why the Cadence Academic Network is committed to providing the tools and training needed to accelerate these teams to the finish line.",CDNS
183,2023-05-26,"Headline: Friday Premarket Newsmakers: Marvell Picks Up Where Nvidia Left Off; Gap Beats but Issues Remain, source:247WallSt, summary: No summary, Headline: Stocks facing most buy and sell pressure into Russell rebalancing, source:Seeking Alpha, summary: No summary, Headline: Cadence Design Systems Reaches Analyst Target Price, source:ETF Channel, summary: No summary, Headline: Cadence Design Systems Inc. stock outperforms competitors on strong trading day, source:MarketWatch, summary: Shares of Cadence Design Systems Inc. advanced 1.71% to $228.33 Friday, on what proved to be an all-around positive trading session for the stock market,..., Headline: Cadence Design Systems Has the Right Tempo for Further Upside, source:Yahoo, summary: Shares of engineering and software company Cadence Design Systems  have surged in the past couple of weeks.  In the daily bar chart of CDNS, below, I see that the shares have been in an uptrend from January after a low in early November.  The On-Balance-Volume (OBV) line made a low in early November and a rising OBV line means that buyers of a stock are being more aggressive than sellers.",CDNS
184,2023-05-28,"Headline: Cadence Collaborates with Arm to Accelerate Mobile Device Silicon Success with New Arm Total Compute Solutions, source:Yahoo, summary: SAN JOSE, Calif., May 29, 2023--Cadence collaborated with Arm to provide customers with a faster path to tapeout with Cadence digital and verification tools and the new Arm TCS23., Headline: Cadence expands collaboration with Arm with the success of mobile device silicon, source:Seeking Alpha, summary: No summary",CDNS
185,2023-05-29,"Headline: Cadence Design expands collaboration with Arm, source:Thefly.com, summary: No summary, Headline: Tuesday Talk: Money Time For McCarthy, source:TalkMarkets, summary: No summary",CDNS
186,2023-05-30,"Headline: Looking At Cadence Design Sys's Recent Unusual Options Activity, source:Benzinga, summary: No summary, Headline: Cadence (CDNS) Expands Strategic Partnership With Arm, source:Yahoo, summary: Cadence (CDNS) collaborates with Arm to help users enhance verification throughput and improve productivity., Headline: Cadence Design Systems Inc. stock rises Tuesday, outperforms market, source:MarketWatch, summary: Shares of Cadence Design Systems Inc. advanced 2.81% to $234.75 Tuesday, on what proved to be an all-around mixed trading session for the stock market, with..., Headline: Cadence’s John Wall to Present at BofA Securities Conference, source:Yahoo, summary: SAN JOSE, Calif., May 30, 2023--Cadence’s John Wall to Present at BofA Securities Conference",CDNS
187,2023-05-31,"Headline: Cadence Design Systems Inc. stock falls Wednesday, underperforms market, source:MarketWatch, summary: Shares of Cadence Design Systems Inc. slipped 1.64% to $230.91 Wednesday, on what proved to be an all-around grim trading session for the stock market, with..., Headline: UTA Is Bringing Hypersonic Travel with Fidelity Pointwise, source:Yahoo, summary: The Aerodynamic Research Center at the University of Texas at Arlington (UTA) is bringing hypersonic travel to the United States., Headline: Cadence Design Systems (CDNS) Dips More Than Broader Markets: What You Should Know, source:Yahoo, summary: Cadence Design Systems (CDNS) closed at $230.91 in the latest trading session, marking a -1.64% move from the prior day.",CDNS
188,2023-06-01,"Headline: Cadence Design Systems Inc. stock rises Thursday, still underperforms market, source:MarketWatch, summary: Shares of Cadence Design Systems Inc. inched 0.64% higher to $232.39 Thursday, on what proved to be an all-around favorable trading session for the stock...",CDNS
189,2023-06-02,"Headline: Cadence Design Systems Inc. stock falls Friday, underperforms market, source:MarketWatch, summary: Shares of Cadence Design Systems Inc. slipped 1.16% to $229.69 Friday, on what proved to be an all-around great trading session for the stock market, with...",CDNS
190,2023-06-04,"Headline: $1000 Invested In This Stock 10 Years Ago Would Be Worth $15,000 Today, source:Benzinga, summary: No summary",CDNS
191,2023-06-05,"Headline: Wells Fargo Keeps Their Buy Rating on Cadence Design (CDNS), source:TipRanks, summary: No summary, Headline: Wells Fargo Maintains Cadence Design Systems (CDNS) Overweight Recommendation, source:Fintel, summary: nan, Headline: Cadence Design Systems Inc. stock underperforms Monday when compared to competitors despite daily gains, source:MarketWatch, summary: Shares of Cadence Design Systems Inc. advanced 1.15% to $232.33 Monday, on what proved to be an all-around grim trading session for the stock market, with...",CDNS
192,2023-06-06,"Headline: First Week of CDNS August 18th Options Trading, source:Stock Options Channel, summary: No summary, Headline: Cadence Design Systems Inc. stock outperforms competitors despite losses on the day, source:MarketWatch, summary: Shares of Cadence Design Systems Inc. shed 1.53% to $228.78 Tuesday, on what proved to be an all-around favorable trading session for the stock market, with..., Headline: Cadence’s John Wall to Present at Nasdaq Investor Conference, source:Yahoo, summary: SAN JOSE, Calif., June 06, 2023--Cadence’s John Wall to Present at Nasdaq Investor Conference, Headline: Cadence Design Systems (CDNS) Stock Sinks As Market Gains: What You Should Know, source:Yahoo, summary: Cadence Design Systems (CDNS) closed the most recent trading day at $228.78, moving -1.53% from the previous trading session.",CDNS
193,2023-06-07,"Headline: DEI@Cadence: Celebrating My First Month as an Intern at Cadence in Cork, Ireland, source:Accesswire, summary: No summary, Headline: Cadence Design Systems Inc. stock falls Wednesday, underperforms market, source:MarketWatch, summary: Shares of Cadence Design Systems Inc. shed 2.76% to $222.47 Wednesday, on what proved to be an all-around mixed trading session for the stock market, with...",CDNS
194,2023-06-08,"Headline: Early notable gainers among liquid option names on June 8th, source:Thefly.com, summary: No summary, Headline: Cadence Design Systems Inc. stock rises Thursday, outperforms market, source:MarketWatch, summary: Shares of Cadence Design Systems Inc. rose 2.52% to $228.08 Thursday, on what proved to be an all-around great trading session for the stock market, with the..., Headline: DEI@Cadence: Asian American and Pacific Islander (AAPI) Heritage Month Spotlights, source:Yahoo, summary: Cadence Design Systems",CDNS
195,2023-06-09,"Headline: Wall Street Analysts See Cadence (CDNS) as a Buy: Should You Invest?, source:Yahoo, summary: According to the average brokerage recommendation (ABR), one should invest in Cadence (CDNS). It is debatable whether this highly sought-after metric is effective because Wall Street analysts' recommendations tend to be overly optimistic. Would it be worth investing in the stock?, Headline: Cadence Design Systems Inc. stock outperforms market on strong trading day, source:MarketWatch, summary: Shares of Cadence Design Systems Inc. inched 0.53% higher to $229.30 Friday, on what proved to be an all-around great trading session for the stock market,...",CDNS
196,2023-06-10,"Headline: Informatica's Cloud-Native Product Portfolio Driving Innovation In Data Integration, source:SeekingAlpha, summary: Informatica has positioned itself well in the market and capitalized on the growing trend of cloud adoption. Click here to read why INFA stock is a Buy.",CDNS
197,2023-06-12,"Headline: Cadence Design Systems Inc. stock outperforms market on strong trading day, source:MarketWatch, summary: Shares of Cadence Design Systems Inc. rose 1.71% to $233.22 Monday, on what proved to be an all-around great trading session for the stock market, with the..., Headline: Cadence Design Systems (CDNS) Outpaces Stock Market Gains: What You Should Know, source:Yahoo, summary: In the latest trading session, Cadence Design Systems (CDNS) closed at $233.22, marking a +1.71% move from the previous day.",CDNS
198,2023-06-13,"Headline: Cadence Design, Samsung Foundry enter multi-year agreement, source:Thefly.com, summary: No summary, Headline: Cadence Design enters $200M accelerated share repurchase agreement, source:Thefly.com, summary: No summary, Headline: Cadence Design stock climbs into record territory after $200 million accelerated buyback agreement, source:MarketWatch, summary: Shares of Cadence Design Systems Inc. climbed 2.3% into record territory in premarket trading Tueday, after the electronic systems design company announced a..., Headline: Cadence to buy back $200M stock under ASR agreement, source:Seeking Alpha, summary: No summary, Headline: IN BRIEF: Cadence Design to buy back USD200 million of its shares, source:Alliance News, summary: No summary, Headline: Cadence (CDNS) Gains 45% YTD: Will the Uptrend Continue?, source:Yahoo, summary: Cadence's (CDNS) performance is gaining from robust customer demand amid increasing design activity., Headline: Cadence Announces $200 Million Accelerated Share Repurchase Agreement, source:Yahoo, summary: SAN JOSE, Calif., June 13, 2023--Cadence entered into an ASR agreement with HSBC Bank USA, National Association to repurchase an aggregate of $200 million of Cadence common stock., Headline: Cadence Design Systems Inc. stock rises Tuesday, outperforms market, source:MarketWatch, summary: Shares of Cadence Design Systems Inc. rallied 2.48% to $239.00 Tuesday, on what proved to be an all-around great trading session for the stock market, with..., Headline: Cadence and Samsung Foundry Enter Multi-Year Agreement to Expand Design IP Portfolio, source:Yahoo, summary: SAN JOSE, Calif., June 13, 2023--Cadence and Samsung Foundry have signed a multi-year agreement to expand the availability of Cadence’s design IP portfolio.",CDNS
199,2023-06-14,"Headline: Cadence Inks Long-Term Pact With Samsung Foundry To Expand Design IP Portfolio, source:Benzinga, summary: No summary, Headline: Cadence (CDNS) & Samsung Foundry Expand Design IP Partnership, source:Yahoo, summary: Cadence (CDNS) collaborates with Samsung Foundry to help mutual customers with access to a wide-ranging design IP portfolio on SF5A technology., Headline: Cadence Design Systems Inc. stock falls Wednesday, underperforms market, source:MarketWatch, summary: Shares of Cadence Design Systems Inc. slipped 1.23% to $236.06 Wednesday, on what proved to be an all-around mixed trading session for the stock market, with..., Headline: Cadence Design Systems: Valuation Is Too High, source:SeekingAlpha, summary: Cadence Design Systems is a high-quality business that demonstrated a solid ability to capture favorable secular trends. Read more on CDNS stock here., Headline: Cadence Design Systems (CDNS) Stock Sinks As Market Gains: What You Should Know, source:Yahoo, summary: In the latest trading session, Cadence Design Systems (CDNS) closed at $236.06, marking a -1.23% move from the previous day.",CDNS
200,2023-06-15,"Headline: My Cadence Volunteering Experience With WiTU Uganda: Challenges and Positive Outcomes, source:Yahoo, summary: Cadence Design Systems, Headline: Cadence Design Systems Inc. stock rises Thursday, still underperforms market, source:MarketWatch, summary: Shares of Cadence Design Systems Inc. inched 0.72% higher to $237.77 Thursday, on what proved to be an all-around great trading session for the stock market,..., Headline: 2 Under-the-Radar AI ETFs to Watch, source:TipRanks, summary: No summary",CDNS
201,2023-06-16,"Headline: Cadence Design Systems Inc. stock outperforms competitors despite losses on the day, source:MarketWatch, summary: Shares of Cadence Design Systems Inc. dropped 0.81% to $235.84 Friday, on what proved to be an all-around dismal trading session for the stock market, with...",CDNS
202,2023-06-17,"Headline: Nvidia has talked up AI the most lately, but other highly chatty players may surprise you, source:MarketWatch, summary: It's perhaps unsurprising which S&P 500 component was the most vocal about AI this earnings season, but other AI chatterboxes are likely more shocking.",CDNS
203,2023-06-20,"Headline: Cadence Design Systems Inc. stock falls Tuesday, underperforms market, source:MarketWatch, summary: Shares of Cadence Design Systems Inc. slid 1.40% to $232.53 Tuesday, on what proved to be an all-around poor trading session for the stock market, with the..., Headline: Cadence Design Systems (CDNS) Dips More Than Broader Markets: What You Should Know, source:Yahoo, summary: Cadence Design Systems (CDNS) closed the most recent trading day at $232.53, moving -1.4% from the previous trading session.",CDNS
204,2023-06-21,"Headline: Cadence Design exec sells $3.08M in common stock, source:Thefly.com, summary: No summary, Headline: DB GlobalChip Deploys Cadence’s Spectre FX and AMS Designer, Accelerating IP Verification by 2X, source:Yahoo, summary: SAN JOSE, Calif., June 21, 2023--Cadence announced that DB GlobalChip deployed the Spectre FX Simulator integrated with Spectre AMS Designer, to verify its analog and mixed-signal IP., Headline: Cadence Design Systems Inc. stock falls Wednesday, underperforms market, source:MarketWatch, summary: Shares of Cadence Design Systems Inc. shed 1.94% to $228.01 Wednesday, on what proved to be an all-around dismal trading session for the stock market, with..., Headline: Check Out What Whales Are Doing With CDNS, source:Benzinga, summary: No summary",CDNS
205,2023-06-22,"Headline: Cadence's (CDNS) Simulation Solutions Used by DB GlobalChip, source:Yahoo, summary: Cadence (CDNS) solutions are being leveraged by DB GlobalChip to meet the demanding design requirements for analog and mixed-signal IPs., Headline: Cadence Design Systems Inc. stock falls Thursday, underperforms market, source:MarketWatch, summary: Shares of Cadence Design Systems Inc. slumped 0.44% to $227.00 Thursday, on what proved to be an all-around mixed trading session for the stock market, with...",CDNS
206,2023-06-23,"Headline: Cadence Design Systems Inc. stock underperforms Friday when compared to competitors, source:MarketWatch, summary: Shares of Cadence Design Systems Inc. slumped 0.74% to $225.32 Friday, on what proved to be an all-around dismal trading session for the stock market, with...",CDNS
207,2023-06-26,"Headline: Is Cadence Design Systems (CDNS) Stock Outpacing Its Computer and Technology Peers This Year?, source:Yahoo, summary: Here is how Cadence Design Systems (CDNS) and MicroStrategy (MSTR) have performed compared to their sector so far this year., Headline: Cadence (CDNS) Upgraded to Buy: What Does It Mean for the Stock?, source:Yahoo, summary: Cadence (CDNS) has been upgraded to a Zacks Rank #2 (Buy), reflecting growing optimism about the company's earnings prospects. This might drive the stock higher in the near term., Headline: Cadence Design Systems Inc. stock falls Monday, underperforms market, source:MarketWatch, summary: Shares of Cadence Design Systems Inc. slid 1.03% to $223.01 Monday, on what proved to be an all-around poor trading session for the stock market, with the..., Headline: Cadence Design Systems (CDNS) Dips More Than Broader Markets: What You Should Know, source:Yahoo, summary: In the latest trading session, Cadence Design Systems (CDNS) closed at $223.01, marking a -1.03% move from the previous day.",CDNS
208,2023-06-27,"Headline: Cadence's Dance With AI: A Ballet Of Tech Innovation And Market Domination, source:SeekingAlpha, summary: Cadence Design Systems is a key player in computational software and AI. Read why I think CDNS stock is an attractive proposition for long-term investors., Headline: Cadence AI-Based Virtuoso Studio Certified for Samsung Foundry PDKs for Mature and Advanced Nodes, source:Yahoo, summary: SAN JOSE, Calif., June 27, 2023--Cadence announced that the AI-based Virtuoso Studio design tools and solutions have been certified by Samsung Foundry., Headline: Cadence Expands Collaboration with Samsung Foundry, Providing Differentiated Reference Flows Based on the Integrity 3D-IC Platform, source:Yahoo, summary: SAN JOSE, Calif., June 27, 2023--Cadence expanded its collaboration with Samsung Foundry to accelerate 3D-IC design development for next-generation applications., Headline: Cadence Design Systems Inc. stock outperforms market on strong trading day, source:MarketWatch, summary: Shares of Cadence Design Systems Inc. advanced 2.60% to $228.80 Tuesday, on what proved to be an all-around positive trading session for the stock market,...",CDNS
209,2023-06-28,"Headline: CDNS Crosses Above Average Analyst Target, source:ETF Channel, summary: No summary, Headline: Cadence Digital and Custom/Analog Design Flows Certified for Samsung Foundry's SF2 and SF3 Process Technologies, source:Finnhub, summary: Highlights:



Ongoing collaboration lets customers leverage the latest Cadence and Samsung technologies to deliver innovative mobile, automotive, AI and hyperscale designs



Engineers can design ICs with PDKs based on certified SF2 and SF3 flows



Cadence digital full flow enables optimal PPA results for advanced nodes



Cadence custom/analog tools, including AI-based Virtuoso Studio, optimized for latest nodes , Headline: Cadence Delivers Certified, Innovative Backside Implementation Flow to Support Samsung Foundry SF2 Technology, source:Yahoo, summary: SAN JOSE, Calif., June 28, 2023--Cadence announced that it has delivered a complete, certified backside implementation flow to support Samsung Foundry’s SF2 process node., Headline: Cadence Digital and Custom/Analog Design Flows Certified for Samsung Foundry’s SF2 and SF3 Process Technologies, source:Yahoo, summary: SAN JOSE, Calif., June 28, 2023--Cadence announced that its digital and custom/analog flows achieved certification for Samsung Foundry’s SF2 and SF3 process technologies., Headline: Samsung Foundry Certifies Cadence Virtuoso Studio Flow to Automate Analog IP Migration on Advanced Process Technologies, source:Yahoo, summary: SAN JOSE, Calif., June 28, 2023--Cadence today announced the availability of a certified node-to-node design migration flow based on the new generative AI-powered Virtuoso Studio., Headline: Cadence Design Systems Inc. stock underperforms Wednesday when compared to competitors despite daily gains, source:MarketWatch, summary: Shares of Cadence Design Systems Inc. inched 0.24% higher to $229.36 Wednesday, on what proved to be an all-around dismal trading session for the stock..., Headline: A Look Into Cadence Design Sys Inc's Price Over Earnings, source:Benzinga, summary: No summary",CDNS
210,2023-06-29,"Headline: Cadence Digital and Custom, Analog Design Flows Certified for Samsung Foundry's SF2 and SF3 Process Technologies, source:Finnhub, summary: SAN JOSE - Cadence Design Systems, Inc. (Nasdaq: CDNS) today announced that its digital and custom/analog flows achieved certification for Samsung Foundry's SF2 and SF3 process technologies.
The two companies also worked together to create new process de..., Headline: Peering Into Cadence Design Sys's Recent Short Interest, source:Benzinga, summary: No summary, Headline: Cadence Design Systems Inc. stock underperforms Thursday when compared to competitors, source:MarketWatch, summary: Shares of Cadence Design Systems Inc. slumped 0.36% to $228.54 Thursday, on what proved to be an all-around great trading session for the stock market, with...",CDNS
211,2023-06-30,"Headline: Cadence Design Systems Inc. stock outperforms market on strong trading day, source:MarketWatch, summary: Shares of Cadence Design Systems Inc. rallied 2.62% to $234.52 Friday, on what proved to be an all-around great trading session for the stock market, with..., Headline: 3 Highly-Ranked Stocks to Buy in July for the Second Half of 2023, source:Yahoo, summary: Looking at 3 highly-ranked stocks from three different areas of the economy that investors might want to buy in July for long-term growth beyond the second half of 2023.",CDNS
212,2023-07-03,"Headline: Goldman Sachs Reveals Winning Portfolio: 'Rule of 10' Unlocks S&P 500's Future Top Performers, source:Benzinga, summary: No summary, Headline: Cadence Design Systems (CDNS) Outpaces Stock Market Gains: What You Should Know, source:Yahoo, summary: Cadence Design Systems (CDNS) closed at $235.40 in the latest trading session, marking a +0.38% move from the prior day.",CDNS
213,2023-07-05,"Headline: The Zacks Analyst Blog Highlights Meta Platforms, NVIDIA, Palo Alto Networks, Cadence Design Systems and Synopsys, source:Yahoo, summary: Meta Platforms, NVIDIA, Palo Alto Networks, Cadence Design Systems and Synopsys are part of the Zacks top Analyst Blog., Headline: Just 8 S&P 500 Stocks Make These Goldman 'Rule Of 10' Screens, source:Yahoo, summary: ServiceNow and Chipotle Mexican Grill are among just eight S&P 500 stocks that meet Goldman Sachs' Rule Of 10 screens for sales and net income., Headline: Cadence Design Systems Inc. stock underperforms Wednesday when compared to competitors, source:MarketWatch, summary: Shares of Cadence Design Systems Inc. slipped 1.22% to $232.52 Wednesday, on what proved to be an all-around dismal trading session for the stock market,...",CDNS
214,2023-07-06,"Headline: Cadence Design (CDNS): New Buy Recommendation for This Technology Giant, source:TipRanks, summary: No summary, Headline: Insider Sell: Sr. Vice President Paul Cunningham Sells 1000 Shares of Cadence Design Systems Inc, source:GuruFocus, summary: No summary, Headline: Cadence Design Systems Inc. stock falls Thursday, underperforms market, source:MarketWatch, summary: Shares of Cadence Design Systems Inc. slid 1.05% to $230.07 Thursday, on what proved to be an all-around grim trading session for the stock market, with the..., Headline: Growth Investors Shouldn't Ignore These 3 Stocks, source:Yahoo, summary: Investors have their preferences within the market and for understandable reasons. While some reap a steady income stream, others are rewarded with explosive growth., Headline: $1000 Invested In This Stock 15 Years Ago Would Be Worth $23,000 Today, source:Benzinga, summary: No summary",CDNS
215,2023-07-07,"Headline: Cadence Design Systems Inc. stock underperforms Friday when compared to competitors, source:MarketWatch, summary: Shares of Cadence Design Systems Inc. slid 1.38% to $226.89 Friday, on what proved to be an all-around grim trading session for the stock market, with the..., Headline: Cadence Announces Second Quarter 2023 Financial Results Webcast, source:Yahoo, summary: SAN JOSE, Calif., July 07, 2023--Cadence Design Systems, Inc. (Nasdaq: CDNS) will hold its second quarter 2023 financial results webcast on Monday, July 24, 2023.",CDNS
216,2023-07-10,"Headline: Cadence Design Systems Inc. stock underperforms Monday when compared to competitors despite daily gains, source:MarketWatch, summary: Shares of Cadence Design Systems Inc. advanced 3.32% to $234.42 Monday, on what proved to be an all-around great trading session for the stock market, with...",CDNS
217,2023-07-11,"Headline: Cadence (CDNS) Stock Soars 46% YTD: Will the Uptrend Last?, source:Yahoo, summary: Cadence (CDNS) witnesses the strong demand for its diversified portfolio across all segments., Headline: Cadence Digital, Custom/Analog Design Flows Certified and Design IP Available for Intel 16 FinFET Process, source:Yahoo, summary: SAN JOSE, Calif., July 11, 2023--Cadence digital and custom/analog flows are certified on the Intel 16 FinFET process technology, and its design IP supports this node from IFS., Headline: Cadence Design Systems Inc. stock underperforms Tuesday when compared to competitors, source:MarketWatch, summary: Shares of Cadence Design Systems Inc. shed 1.09% to $231.87 Tuesday, on what proved to be an all-around positive trading session for the stock market, with..., Headline: Cadence Design Systems (CDNS) Stock Sinks As Market Gains: What You Should Know, source:Yahoo, summary: Cadence Design Systems (CDNS) closed at $231.87 in the latest trading session, marking a -1.09% move from the prior day.",CDNS
