,date,information,related
0,2021-07-27,"Headline: 3 Reasons Why Growth Investors Shouldn't Overlook GN STORE NORD (GNNDY), source:Yahoo, summary: GN STORE NORD (GNNDY) possesses solid growth attributes, which could help it handily outperform the market.",CDNS
1,2022-09-23,"Headline: Zacks Industry Outlook Highlights Synopsys, Cadence Design Systems and DecisionPoint Systems, source:Yahoo, summary: Synopsys, Cadence Design Systems and DecisionPoint Systems have been highlighted in this Industry Outlook article., Headline: Snap Up These 4 Top-Ranked Liquid Stocks for Impressive Gains, source:Yahoo, summary: Here are four top-ranked liquid stocks, Cadence (CDNS), Cavco (CVCO), Lattice Semiconductor (LSCC) and Pure Storage (PSTG), which investors can add to their portfolio for returns., Headline: Cadence Design Systems Inc. stock outperforms market despite losses on the day, source:MarketWatch, summary: Shares of Cadence Design Systems Inc. slumped 0.83% to $160.97 Friday, on what proved to be an all-around rough trading session for the stock market, with..., Headline: Cadence Design Systems (CDNS) Stock Moves -0.83%: What You Should Know, source:Yahoo, summary: Cadence Design Systems (CDNS) closed at $160.97 in the latest trading session, marking a -0.83% move from the prior day.",CDNS
2,2022-09-26,"Headline: Zacks.com featured highlights include Cavco Industries, Cadence Design Systems, Pure Storage and Lattice Semiconductor, source:Yahoo, summary: Cavco Industries, Cadence Design Systems, Pure Storage and Lattice Semiconductor have been highlighted in this Screen of The Week article.",CDNS
3,2022-09-27,"Headline: Bull of the Day: Cadence Design Systems (CDNS), source:Yahoo, summary: As bear market mauls Semis and NVDA, the King of Chip Design has sustainable orders going out years, Headline: Cadence Design Systems and Synaptics have been highlighted as Zacks Bull and Bear of the Day, source:Yahoo, summary: Cadence Design Systems and Synaptics are part of Zacks Bull and Bear of the Day article.",CDNS
4,2022-09-28,"Headline: Home - The Fly, source:Thefly.com, summary: The Fly is a leading digital publisher of real-time financial news. The Fly team scours all sources of company news and delivers short-form stories consisting of only market moving content., Headline: Back To The Future: Review Of Our Semis Work, source:SeekingAlpha, summary: We end the July quarter having written about 20 of our favorite semiconductor names, and this article studies how our ratings played out. Click to read more.",CDNS
5,2022-09-29,"Headline: Cadence Design initiated with a Buy at Deutsche Bank, source:Thefly.com, summary: Deutsche Bank analyst Gia... CDNS, Headline: How to Find Strong Computer and Technology Stocks Slated for Positive Earnings Surprises, source:Yahoo, summary: Finding stocks expected to beat quarterly earnings estimates becomes an easier task with our Zacks Earnings ESP., Headline: Why These Chip Design Stocks Just Got Fresh Buy Ratings, source:Yahoo, summary: Cadence Design Systems and Synopsys should benefit from continued strong demand for their chip design tools for years to come, an analyst says., Headline: Cadence Design Systems (CDNS) Stock Moves -1.37%: What You Should Know, source:Yahoo, summary: Cadence Design Systems (CDNS) closed the most recent trading day at $164.69, moving -1.37% from the previous trading session.",CDNS
6,2022-09-30,"Headline: Cadence Design Systems Takes Over #160 Spot From Hess, source:ETF Channel, summary: Staff article entitled Cadence Design Systems Takes Over #160 Spot From Hess , about ETFs, from ETF Channel., Headline: Video: S&P 500 Analyst Moves: CDNS, source:Market News Video, summary: The latest tally of analyst opinions from the major brokerage houses shows that among the components of the S&P 500 index, Cadence Design Systems is now the #160 analyst pick, moving up by 29 spots - This rank is formed by averaging the analyst opinions for each component from each broker, and then ranking the 500 components by those average opinion values - CDNS., Headline: A Renewed Career Through the Cadence Returnship Program, source:Yahoo, summary: Cadence Design Systems",CDNS
7,2022-10-03,"Headline: Samsung Foundry Certifies Cadence Voltus-XFi Custom Power Integrity Solution for 5LPE Process Technology, source:Yahoo, summary: SAN JOSE, Calif., October 03, 2022--The Cadence Voltus-XFi Custom Power Integrity solution is optimized and certified for use with Samsung Foundry’s advanced 5LPE process technology., Headline: Cadence and Samsung Foundry Collaborate to Certify RFIC Design Reference Flow on 8nm Process Technology, source:Yahoo, summary: SAN JOSE, Calif., October 03, 2022--Samsung Foundry has certified an 8nm RFIC design reference flow to develop 5G RFICs for use with sub-6GHz to millimeter wave (mmWave) applications.",CDNS
8,2022-10-05,"Headline: Vertex Among 25 Market Leaders On The IBD Breakout Stocks Index, source:Yahoo, summary: As the market shows signs of a rebound, Vertex, Enphase and Shockwave Medical are among 25 stocks to watch., Headline: Why Cadence (CDNS) Could Beat Earnings Estimates Again, source:Yahoo, summary: Cadence (CDNS) has an impressive earnings surprise history and currently possesses the right combination of the two key ingredients for a likely beat in its next quarterly report., Headline: Cadence Design Systems (CDNS) Dips More Than Broader Markets: What You Should Know, source:Yahoo, summary: In the latest trading session, Cadence Design Systems (CDNS) closed at $169.70, marking a -0.95% move from the previous day.",CDNS
9,2022-10-06,"Headline: CDNS Makes Notable Cross Below Critical Moving Average, source:Market News Video, summary: In trading on Friday, shares of Cadence Design Systems Inc (CDNS) crossed below their 200 day moving average of $160.31, changing hands as low as $158.00 per share - Cadence Design Systems Inc shares are currently trading down about 5.6% on the day. - CDNS.",CDNS
10,2022-10-07,"Headline: Cadence Announces Third Quarter 2022 Financial Results Webcast, source:Yahoo, summary: SAN JOSE, Calif., October 07, 2022--Cadence Design Systems, Inc. (Nasdaq: CDNS) will hold its third quarter 2022 financial results webcast on Monday, October 24, 2022.",CDNS
11,2022-10-08,"Headline: Cadence Design Systems (NASDAQ:CDNS) Is Very Good At Capital Allocation, source:Yahoo, summary: What trends should we look for it we want to identify stocks that can multiply in value over the long term? Typically...",CDNS
12,2022-10-10,"Headline: Cadence Design announces collaboration with Google Cloud, source:Thefly.com, summary: Cadence Design Systems (C... CDNS, GOOGL, GOOG",CDNS
13,2022-10-11,"Headline: New Cadence Certus Delivers Up to 10X Faster Concurrent Full-Chip Optimization and Signoff, source:Yahoo, summary: SAN JOSE, Calif., October 11, 2022--Cadence announced the new Cadence Certus Closure Solution to address growing chip-level design size and complexity challenges., Headline: Cadence and Google Cloud Collaborate to Advance the Electronic System and Semiconductor Design Ecosystem, source:Yahoo, summary: SAN JOSE, Calif., October 11, 2022--Cadence announced a Google Cloud collaboration, accelerating system & semiconductor design with cloud-ready tools certified for use with Google Cloud.",CDNS
14,2022-10-12,"Headline: Cadence (CDNS) Announces Collaboration With Google Cloud, source:Yahoo, summary: Cadence Design Systems (CDNS) collaborates with Google Cloud to improve design and verification throughput., Headline: Cadence Design Systems Inc. stock outperforms market despite losses on the day, source:MarketWatch, summary: Shares of Cadence Design Systems Inc. slumped 0.05% to $147.97 Wednesday, on what proved to be an all-around rough trading session for the stock market, with..., Headline: Cadence Design Systems (CDNS) Stock Moves -0.05%: What You Should Know, source:Yahoo, summary: In the latest trading session, Cadence Design Systems (CDNS) closed at $147.97, marking a -0.05% move from the previous day.",CDNS
15,2022-10-13,"Headline: Interesting CDNS Put And Call Options For May 2023, source:Stock Options Channel, summary: Staff article entitled Interesting CDNS Put And Call Options For May 2023, about stock options, from Stock Options Channel., Headline: Worried About the China Chip Ban? Give These 2 Top Chip Stocks a Look, source:Yahoo, summary: China is an integral part of the semiconductor industry, but these two companies have minimal exposure to that country., Headline: The past five years for Cadence Bank (NYSE:CADE) investors has not been profitable, source:Yahoo, summary: While not a mind-blowing move, it is good to see that the Cadence Bank ( NYSE:CADE ) share price has gained 17% in the..., Headline: Fortune and Great Place to Work® Name Cadence One of the World’s Best Workplaces™ in 2022, source:Yahoo, summary: SAN JOSE, Calif., October 13, 2022--Cadence announced that Fortune magazine and Great Place to Work have honored the company, ranking it #19 on the 2022 World’s Best Workplaces™ list., Headline: Cadence Design Systems Inc. stock rises Thursday, still underperforms market, source:MarketWatch, summary: Shares of Cadence Design Systems Inc. rallied 1.74% to $150.55 Thursday, on what proved to be an all-around favorable trading session for the stock market,..., Headline: Cadence Design Systems (CDNS) Gains But Lags Market: What You Should Know, source:Yahoo, summary: Cadence Design Systems (CDNS) closed the most recent trading day at $150.55, moving +1.74% from the previous trading session.",CDNS
16,2022-10-14,"Headline: SNPS or CDNS: Which Is the Better Value Stock Right Now?, source:Yahoo, summary: SNPS vs. CDNS: Which Stock Is the Better Value Option?, Headline: Cadence Design Systems Inc. stock falls Friday, still outperforms market, source:MarketWatch, summary: Shares of Cadence Design Systems Inc. slid 2.06% to $147.45 Friday, on what proved to be an all-around rough trading session for the stock market, with the..., Headline: Don't Buy Cadence Opportunities Fund Limited (ASX:CDO) For Its Next Dividend Without Doing These Checks, source:Yahoo, summary: Some investors rely on dividends for growing their wealth, and if you're one of those dividend sleuths, you might be...",CDNS
17,2022-10-17,"Headline: Cadence Design expands collaboration with Samsung Foundry on 3D-IC design, source:Thefly.com, summary: Cadence Design Systems &q... CDNS, Headline: Cadence Design Systems Inc. stock underperforms Monday when compared to competitors despite daily gains, source:MarketWatch, summary: Shares of Cadence Design Systems Inc. rallied 4.49% to $154.07 Monday, on what proved to be an all-around favorable trading session for the stock market,..., Headline: Cadence Expands Collaboration with Samsung Foundry to Advance 3D-IC Design, source:Yahoo, summary: SAN JOSE, Calif., October 18, 2022--Cadence announced that it has expanded its collaboration with Samsung Foundry to accelerate 3D-IC design.",CDNS
18,2022-10-18,"Headline: Cadence (CDNS) Announces Collaboration With Samsung Foundry, source:Yahoo, summary: Cadence (CDNS) collaborates with Samsung Foundry to help mutual customers improve overall productivity., Headline: Cadence Design Systems Inc. stock rises Tuesday, still underperforms market, source:MarketWatch, summary: Shares of Cadence Design Systems Inc. inched 0.97% higher to $155.56 Tuesday, on what proved to be an all-around great trading session for the stock market,...",CDNS
19,2022-10-19,"Headline: Cadence Design Systems Inc. stock falls Wednesday, underperforms market, source:MarketWatch, summary: Shares of Cadence Design Systems Inc. slipped 1.18% to $153.72 Wednesday, on what proved to be an all-around grim trading session for the stock market, with..., Headline: Cadence Design Systems (CDNS) Dips More Than Broader Markets: What You Should Know, source:Yahoo, summary: Cadence Design Systems (CDNS) closed the most recent trading day at $153.72, moving -1.18% from the previous trading session.",CDNS
20,2022-10-20,"Headline: Fortune and Great Place To Work US Name Cadence One of the World's Best Workplaces in 2022!, source:Yahoo, summary: Cadence Design Systems, Headline: Here's What to Expect Ahead of Cadence's (CDNS) Q3 Earnings, source:Yahoo, summary: Cadence's (CDNS) Q3 performance is likely to have benefited from acquisitions and its diversified product portfolio., Headline: Cadence Design Systems Inc. stock outperforms market despite losses on the day, source:MarketWatch, summary: Shares of Cadence Design Systems Inc. sank 0.44% to $153.05 Thursday, on what proved to be an all-around rough trading session for the stock market, with the..., Headline: Cadence Design Systems (CDNS) Stock Moves -0.44%: What You Should Know, source:Yahoo, summary: In the latest trading session, Cadence Design Systems (CDNS) closed at $153.05, marking a -0.44% move from the previous day.",CDNS
21,2022-10-21,"Headline: Interesting CDNS Put And Call Options For December 16th, source:Stock Options Channel, summary: Staff article entitled Interesting CDNS Put And Call Options For December 16th, about stock options, from Stock Options Channel., Headline: Cadence Design Systems Inc. stock outperforms market on strong trading day, source:MarketWatch, summary: Shares of Cadence Design Systems Inc. rallied 3.46% to $158.34 Friday, on what proved to be an all-around favorable trading session for the stock market,...",CDNS
22,2022-10-23,"Headline: With EPS Growth And More, Cadence Design Systems (NASDAQ:CDNS) Makes An Interesting Case, source:Yahoo, summary: For beginners, it can seem like a good idea (and an exciting prospect) to buy a company that tells a good story to..., Headline: Stocks Are Poised to Rise on Monday, source:MarketWatch, summary: More than a third of the S&P 500 reports earnings this week, including tech heavyweights Alphabet, Apple, Amazon, Meta Platforms, and Microsoft., Headline: GLOBAL BRIEFING: Xi Jinping secures third term as China leader, source:Alliance News, summary: No summary, Headline: Cadence Design options imply 5.1% move in share price post-earnings, source:Thefly.com, summary: Pre-earnings options volu... CDNS, Headline: Cadence Design reports Q3 adjusted EPS $1.06, consensus 97c, source:Thefly.com, summary: Reports Q3 revenue $903M,... CDNS, Headline: Cadence Design sees Q4 adjusted EPS 89c-93c, consensus 89c, source:Thefly.com, summary: Sees Q4 revenue $870M-$89... CDNS, Headline: Cadence Design raises FY22 adjusted EPS view to $4.20-$4.24 from $4.06-$4.12, source:Thefly.com, summary: Consensus $4.12. Raises F... CDNS",CDNS
23,2022-10-24,"Headline: Cadence Design price target lowered to $175 from $185 at Rosenblatt, source:Thefly.com, summary: Rosenblatt analyst Blair ... CDNS, Headline: Cadence Design Systems: Not A Buy Ahead Of Q3 Earnings (Technical Analysis), source:SeekingAlpha, summary: Cadence Design Systems posted a 52-week high of $194.96 last August, now trading at less than $159. See why I think CDNS stock is not a Buy ahead of Q3 results., Headline: Cadence Joins Intel Foundry Services USMAG Alliance to Accelerate Chip Design Development, source:Yahoo, summary: SAN JOSE, Calif., October 24, 2022--Cadence joined the Intel Foundry Services U.S. Military, Aerospace and Government Alliance to support domestic SoC design development and delivery., Headline: Cadence Design's 3Q Profit, Revenue Exceed Expectations, source:MarketWatch, summary: By Denny Jacob Cadence Design Systems Inc. recorded profit and revenue in the latest quarter that exceeded analysts' expectations. The company, which focuses..., Headline: Cadence Design Raises FY22 Outlook, Guides for 4Q, source:MarketWatch, summary: By Denny Jacob Cadence Design Systems Inc. raised its full-year outlook following third quarter results that exceeded analysts' expectations. The company,..., Headline: Cadence: Q3 Earnings Snapshot, source:Associated Press, The, summary: No summary, Headline: IN BRIEF: Cadence Design Systems quarterly revenue and income surge, source:Alliance News, summary: No summary, Headline: Cadence Reports Third Quarter 2022 Financial Results, source:Yahoo, summary: SAN JOSE, Calif., October 24, 2022--Cadence Reports Third Quarter 2022 Financial Results, Headline: Cadence Design Systems, Inc. (CDNS) Q3 2022 Earnings Call Transcript, source:SeekingAlpha, summary: Cadence Design Systems, Inc. (NASDAQ:NASDAQ:CDNS) Q3 2022 Results Conference Call October 24, 2022 05:00 PM ET Company Participants Richard Gu - VP, IR Anirudh Devgan - President and CEO..., Headline: Stocks moving in after hours: Twitter, Discover Financial, Qualtrics, Cadence Design, source:Yahoo, summary: Yahoo Finance Live anchor Seana Smith looks at which tickers are making moves in after-hours trading., Headline: Cadence Design Systems (CDNS) Q3 Earnings and Revenues Top Estimates, source:Yahoo, summary: Cadence (CDNS) delivered earnings and revenue surprises of 9.28% and 3.76%, respectively, for the quarter ended September 2022. Do the numbers hold clues to what lies ahead for the stock?",CDNS
24,2022-10-25,"Headline: Cadence Design price target lowered to $198 from $204 at Baird, source:Thefly.com, summary: Baird analyst Joe Vruwink... CDNS, Headline: Cadence Design Q3 beat driven by emulation strength, says Needham, source:Thefly.com, summary: Needham analyst Charles S... CDNS, Headline: Company News for Oct 25, 2022, source:Yahoo, summary: Companies in The News Are: MSFT, CDNS, TSLA, BOH, Headline: Cadence (CDNS) Q3 Earnings & Revenues Top Estimates, Up Y/Y, source:Yahoo, summary: Cadence (CDNS) third-quarter performance benefits from the continued momentum across all business segments., Headline: Cadence Digital and Custom/Analog Design Flows Achieve Certification for TSMC’s Latest N4P and N3E Processes, source:Yahoo, summary: SAN JOSE, Calif., October 25, 2022--TSMC certified Cadence® digital and custom/analog design flows for the latest TSMC N4P and N3E processes, supporting the DRM and FINFLEX technology., Headline: Cadence Design Systems Inc. stock underperforms Tuesday when compared to competitors, source:MarketWatch, summary: Shares of Cadence Design Systems Inc. slid 5.55% to $151.32 Tuesday, on what proved to be an all-around favorable trading session for the stock market, with..., Headline: Cadence Analysts See It Scoring Driven By Autos, Autonomous Driving, 5G, AI/ML Despite China Restrictions, source:Yahoo, summary: Needham analyst Charles Shi maintained a Buy on Cadence Design Systems, Inc (NASDAQ: CDNS) with a $200 price target. Cadence reported a stronger-than-expected 3Q22, partly due to strength in emulation and prototyping hardware sales, and guided 4Q22 above his estimate despite a sequential slowdown into the year-end. Consistent with his view, the company sees a limited impact from China export restrictions in FY22 and beyond. Cadence also received its largest-ever IP contract from a U.S. marquee s, Headline: Cadence Design Systems Faces Tough Crowd On Wall Street, source:Yahoo, summary: Cadence Design Systems topped Wall Street’s targets for the September quarter but provided mixed guidance for the current period.",CDNS
25,2022-10-26,"Headline: Why This 1 Growth Stock Could Be a Great Addition to Your Portfolio, source:Yahoo, summary: Whether you're a value, growth, or momentum investor, finding strong stocks becomes easier with the Zacks Style Scores, a top feature of the Zacks Premium research service., Headline: Cadence Design Systems Inc. stock falls Wednesday, underperforms market, source:MarketWatch, summary: Shares of Cadence Design Systems Inc. slid 1.50% to $149.05 Wednesday, on what proved to be an all-around mixed trading session for the stock market, with..., Headline: Cadence’s New Flow Automates Custom/Analog Design Migration on TSMC Advanced Technologies, source:Yahoo, summary: SAN JOSE, Calif., October 26, 2022--Cadence collaborated with TSMC on a design migration flow built on the Virtuoso design platform for custom/analog IC blocks., Headline: Cadence Integrity 3D-IC Platform Certified for TSMC 3DFabric Offerings, source:Yahoo, summary: SAN JOSE, Calif., October 26, 2022--The Cadence Integrity 3D-IC platform achieved certification for and met all reference design flow criteria for TSMC’s 3DFabric offerings., Headline: Cadence Bank reports record quarterly adjusted earnings for Q3, BancorpSouth integration updates, source:Yahoo, summary: Cadence Bank closed its merger with BancorpSouth Bank nearly a year ago and completed its integration earlier this month., Headline: Cadence Accelerates RF Design with Delivery of New TSMC N16 mmWave Reference Flow, source:Yahoo, summary: SAN JOSE, Calif., October 26, 2022--Cadence announced that its RFIC solutions support TSMC’s N16RF Design Reference Flow to help accelerate mobile, 5G and automotive applications.",CDNS
26,2022-10-27,"Headline: Pick These 4 Stocks With Excellent Interest Coverage Ratio, source:Yahoo, summary: A company that is capable of generating earnings well above its interest expense can withstand financial hardship. Companies such as Heritage-Crystal (HCCI), Cadence (CDNS), McKesson (MCK) and Schlumberger (SLB) are capable of meeting financial obligations., Headline: Cadence Design Systems Inc. stock outperforms competitors despite losses on the day, source:MarketWatch, summary: Shares of Cadence Design Systems Inc. shed 0.32% to $148.58 Thursday, on what proved to be an all-around mixed trading session for the stock market, with the..., Headline: Cadence Bank to expand financial institutions group, hires new leader, source:Yahoo, summary: Newly hired Cadence executive Brad Durham said his personal goal is to increase balances of the financial institutions group as much as 100% over five years.",CDNS
27,2022-10-28,"Headline: Cadence Design Systems Inc. stock rises Friday, still underperforms market, source:MarketWatch, summary: Shares of Cadence Design Systems Inc. advanced 1.95% to $151.48 Friday, on what proved to be an all-around favorable trading session for the stock market,...",CDNS
28,2022-10-29,"Headline: VOT: Vanguard Explores The Middle Ground, source:SeekingAlpha, summary: Research shows mid-cap space offers higher risk-reward opportunity as compared to the small- and large-cap sectors. See whether you should buy VOT.",CDNS
29,2022-10-30,"Headline: New Chip Designs Are Booming, and This Stock Stands to Benefit, source:Yahoo, summary: The latest worry comes from new U.S. export curbs on sales to China, adding to jittery nerves over a big slump next year -- especially if a recession strikes.  Despite the pessimism in 2022, massive amounts of money were spent this year on new chip design research.  Cadence Design Systems (NASDAQ: CDNS) offers a good example of this dichotomy.",CDNS
30,2022-10-31,"Headline: Needham Sticks to Their Buy Rating for Cadence Design (CDNS), source:TipRanks, summary: Needham analyst Charles Shi maintained a Buy rating on Cadence Design (CDNS &#8211; Research Report) today and set a price target of $200.00. The company&#8217;s sh...",CDNS
31,2022-11-01,"Headline: Cadence Design Systems Inc. stock falls Tuesday, still outperforms market, source:MarketWatch, summary: Shares of Cadence Design Systems Inc. slid 0.30% to $150.93 Tuesday, on what proved to be an all-around poor trading session for the stock market, with the..., Headline: Top 5 3rd Quarter Trades of Se - GuruFocus.com, source:GuruFocus, summary: GuruFocus Article or News written by insider and the topic is about: ",CDNS
32,2022-11-03,"Headline: Cadence Design Systems: Software Niche For The Strong Semiconductor Industry, source:SeekingAlpha, summary: Cadence has a strong portfolio breadth of EDA software solutions. Check here to see the growth catalysts, R&D strategy and key risks for CDNS., Headline: Cadence Design Systems Inc. stock outperforms competitors despite losses on the day, source:MarketWatch, summary: Shares of Cadence Design Systems Inc. slid 1.54% to $142.86 Thursday, on what proved to be an all-around rough trading session for the stock market, with the...",CDNS
33,2022-11-04,"Headline: Cadence Design Systems Inc. stock underperforms Friday when compared to competitors, source:MarketWatch, summary: Shares of Cadence Design Systems Inc. slid 0.31% to $142.41 Friday, on what proved to be an all-around favorable trading session for the stock market, with...",CDNS
34,2022-11-06,"Headline: Is Weakness In Cadence Design Systems, Inc. (NASDAQ:CDNS) Stock A Sign That The Market Could be Wrong Given Its Strong Financial Prospects?, source:Yahoo, summary: It is hard to get excited after looking at Cadence Design Systems' (NASDAQ:CDNS) recent performance, when its stock has...",CDNS
35,2022-11-07,"Headline: Credo Technology Group: Leading Technology And Proven Product Enable Market Share Gains, source:SeekingAlpha, summary: Credo Technology Group has a leading technology and a proven product, which enable it to continue gaining market share. Click here to find out why I recommend buying CRDO., Headline: Cadence Design Systems Inc. stock outperforms competitors on strong trading day, source:MarketWatch, summary: Shares of Cadence Design Systems Inc. rose 2.52% to $146.00 Monday, on what proved to be an all-around favorable trading session for the stock market, with...",CDNS
36,2022-11-08,"Headline: Cadence Design Systems Inc. stock outperforms market on strong trading day, source:MarketWatch, summary: Shares of Cadence Design Systems Inc. advanced 2.12% to $149.10 Tuesday, on what proved to be an all-around great trading session for the stock market, with...",CDNS
