,date,information,related
84,2023-01-20,"Headline: Bullish on Intel in 2023? Buy This Top Chip Stock Instead, source:Yahoo, summary: As iconic a company as Intel (NASDAQ: INTC) is, the bear market and recent severe downturn in consumer spending on electronics (like PCs and laptops) have done a number on ""chipzilla.""  Revenue is in decline, which has dropped Intel to third place in largest chip companies by sales (the top spot is now held by Samsung, and Taiwan Semiconductor Manufacturing (NYSE: TSM) is in a close second place).  There's hope Intel can make a comeback, especially as it retools its data center offerings and chips for consumer electronics., Headline: Cadence Design Systems' (NASDAQ:CDNS) investors will be pleased with their splendid 275% return over the last five years, source:Yahoo, summary: The worst result, after buying shares in a company (assuming no leverage), would be if you lose all the money you put...",CDNS
85,2023-01-23,"Headline: Cadence (CADE) Reports Next Week: Wall Street Expects Earnings Growth, source:Yahoo, summary: Cadence (CADE) doesn't possess the right combination of the two key ingredients for a likely earnings beat in its upcoming report. Get prepared with the key expectations., Headline: Cadence India’s Flagship CSR Initiative, the Cadence Scholarship Program, Recognized, source:Yahoo, summary: Cadence Design Systems (NASDAQ:CDNS)",CDNS
86,2023-01-25,"Headline: Cadence Quantus FS Solution, a 3D Field Solver, Achieves Certification for Samsung Foundry’s SF4, SF3E and SF3 Process Technologies, source:Yahoo, summary: SAN JOSE, Calif., January 25, 2023--Cadence announced that Samsung Foundry has certified the Cadence Quantus™ FS solution for its SF4, SF3E and SF3 process technologies.",CDNS
87,2023-01-26,"Headline: From Heated Seats to Wearable Heart Monitors; CDNS Eyes $215 Billion Opportunity And Nears Buy Point, source:Yahoo, summary: Growth stock Cadence nears a buy point as it eyes $215 billion opportunity benefiting from Apple, Tesla and chip industry's transition to system-on-a-chip designs.",CDNS
88,2023-01-27,"Headline: Chip Stocks Are Expanding Into Software Markets -- Is This a Bad Move?, source:Yahoo, summary: These two semiconductor investors are back to discuss how semiconductor companies continue to invest in software development.",CDNS
89,2023-01-29,"Headline: Cadence Bank (NYSE:CADE) Is Increasing Its Dividend To $0.235, source:Yahoo, summary: Cadence Bank ( NYSE:CADE ) will increase its dividend on the 3rd of April to $0.235, which is 6.8% higher than last...",CDNS
90,2023-01-30,"Headline: Cadence (CADE) Q4 Earnings Beat Estimates, source:Yahoo, summary: Cadence (CADE) delivered earnings and revenue surprises of 4% and 1.73%, respectively, for the quarter ended December 2022. Do the numbers hold clues to what lies ahead for the stock?",CDNS
91,2023-02-01,"Headline: UMC and Cadence Collaborate on 3D-IC Hybrid Bonding Reference Flow, source:Yahoo, summary: HSINCHU, Taiwan & SAN JOSE, Calif., February 01, 2023--United Microelectronics Corporation (NYSE: UMC; TWSE: 2303) (""UMC""), a leading global semiconductor foundry, and Cadence Design Systems, Inc. (Nasdaq: CDNS) today announced that the Cadence® 3D-IC reference flow, featuring the Integrity™ 3D-IC Platform, has been certified for UMC’s chip stacking technologies, enabling faster time to market., Headline: Cadence Bank (NYSE:CADE) Q4 2022 Earnings Call Transcript, source:Yahoo, summary: Cadence Bank (NYSE:CADE) Q4 2022 Earnings Call Transcript January 31, 2023 Operator: Good morning, and welcome to the Cadence Bank Fourth Quarter 2022 Webcast and Conference Call. All participants will be in listen-only mode. Please note, this event is being recorded. I would now like to turn the conference over to Will Fisackerly, Director of […], Headline: Cadence Bank sees loan growth, net interest margin improvement in earnings report, source:Yahoo, summary: Despite missing analysts' expectations for revenue and earnings per share, Cadence Bank reported improvements in other areas to close out 2022.",CDNS
92,2023-02-03,"Headline: 12 Biggest Industrial Software Companies in the World, source:Yahoo, summary: In this article, we will take a look at the 12 biggest industrial software companies in the world. If you want to explore similar companies, you can also take a look at 5 Biggest Industrial Software Companies in the World. The industrial software industry is a rapidly growing field, driven by the need to stay ahead of […], Headline: When Should You Buy Cadence Design Systems, Inc. (NASDAQ:CDNS)?, source:Yahoo, summary: Today we're going to take a look at the well-established Cadence Design Systems, Inc. ( NASDAQ:CDNS ). The company's...",CDNS
93,2023-02-05,"Headline: Semiconductor EDA Face-off: Cadence vs. Synopsys, source:TalkMarkets, summary: No summary",CDNS
94,2023-02-06,"Headline: Global company events calendar - next 7 days, source:Alliance News, summary: No summary, Headline: Cadence Design Systems (CDNS) Reports Next Week: Wall Street Expects Earnings Growth, source:Yahoo, summary: Cadence (CDNS) doesn't possess the right combination of the two key ingredients for a likely earnings beat in its upcoming report. Get prepared with the key expectations., Headline: Cadence Design Systems Inc. stock rises Tuesday, outperforms market, source:MarketWatch, summary: No summary",CDNS
95,2023-02-07,"Headline: Cadence Design Systems Inc. stock falls Wednesday, underperforms market, source:MarketWatch, summary: No summary",CDNS
96,2023-02-08,"Headline: Cadence Design Systems Inc. stock outperforms competitors on strong trading day, source:MarketWatch, summary: No summary",CDNS
97,2023-02-09,"Headline: Catalyst watch: Inflation Reads, Roblox and DoorDash in the spotlight, source:Seeking Alpha, summary: No summary, Headline: Cadence Design Systems Inc. stock underperforms Friday when compared to competitors, source:MarketWatch, summary: No summary",CDNS
98,2023-02-10,"Headline: Here's What to Expect Ahead of Cadence's (CDNS) Q4 Earnings, source:Yahoo, summary: Cadence's (CDNS) Q4 performance is likely to have benefited from acquisitions and its diversified product portfolio. However, global macroeconomic weakness is likely to have acted as a headwind., Headline: Stacked Moving Averages Offered A Setup In CDNS Stock, source:Yahoo, summary: The rally that started 2023 shifted focus back to growth and technology stocks.  CDNS stock was among our early swing trading buys and the moving averages tightening up together put this on our radar.  When viewing moving averages, you'd like to see the shorter-term moving averages above the longer-term lines.",CDNS
99,2023-02-11,"Headline: Notable earnings after Monday`s close, source:Seeking Alpha, summary: No summary, Headline: Cadence Design Systems Q4 2022 Earnings Preview, source:Seeking Alpha, summary: No summary",CDNS
100,2023-02-12,"Headline: Stocks Poised for Lower Open on Monday, source:MarketWatch, summary: The Bureau of Labor Statistics releases the January consumer price index on Tuesday, and about 60 S&P 500 companies report earnings this week., Headline: GLOBAL BRIEFING: US shoots down fourth flying object near Canada, source:Alliance News, summary: No summary, Headline: Cadence Design options imply 4.3% move in share price post-earnings, source:Thefly.com, summary: No summary, Headline: Cadence Design reports Q4 EPS 96c, consensus 92c, source:Thefly.com, summary: No summary, Headline: Cadence Design sees Q1 EPS $1.23-$1.27, consensus $1.10, source:Thefly.com, summary: No summary, Headline: Cadence Design guides initial FY23 EPS $4.90-$5.00, consensus $4.70, source:Thefly.com, summary: No summary, Headline: Cadence Design Systems Non-GAAP EPS of $0.96 beats by $0.04, revenue of $899.88M beats by $15.65M, source:Seeking Alpha, summary: No summary",CDNS
101,2023-02-13,"Headline: Fly Intel: After-Hours Movers, source:Thefly.com, summary: No summary, Headline: Cadence Design (CDNS): New Buy Recommendation for This Technology Giant, source:TipRanks, summary: No summary, Headline: Notable companies reporting after market close, source:Thefly.com, summary: No summary, Headline: Cadence Design Systems 4Q Profit, Revenue Beat Expectations, source:MarketWatch, summary: By Denny Jacob Cadence Design Systems Inc. on Monday posted better-than-expected profit and revenue in the latest quarter. The company, which focuses on..., Headline: Cadence Design Systems Issues 1Q, FY23 Outlook Above Analysts' Estimates, source:MarketWatch, summary: By Denny Jacob Cadence Design Systems Inc. on Monday issued guidance for the current quarter and fiscal 2023 above analysts' estimates following..., Headline: Cadence Design Systems Inc. stock rises Monday, still underperforms market, source:MarketWatch, summary: Shares of Cadence Design Systems Inc. advanced 1.03% to $185.70 Monday, on what proved to be an all-around positive trading session for the stock market,..., Headline: Stocks making the biggest moves after hours: Avis, Palantir, Cadence Design and more, source:CNBC, summary: These are the stocks posting the largest moves in post-bell trading. , Headline: Cadence posts sharp rise in annual revenue, guides for 2023 growth, source:Alliance News, summary: No summary, Headline: Dow futures little changed ahead of CPI data, source:Yahoo, summary: By Oliver Gray, Headline: Cadence Reports Fourth Quarter and Fiscal Year 2022 Financial Results, source:Yahoo, summary: SAN JOSE, Calif., February 13, 2023--Cadence Reports Fourth Quarter and Fiscal Year 2022 Financial Results, Headline: Cadence Design Systems, Inc. (CDNS) Q4 2022 Earnings Call Transcript, source:SeekingAlpha, summary: Cadence Design Systems, Inc. (NASDAQ:NASDAQ:CDNS) Q4 2022 Earnings Conference Call February 13, 2023 5:00 PM ETCompany ParticipantsRichard Gu - Vice President, Investor RelationsAnirudh..., Headline: Cadence: Q4 Earnings Snapshot, source:Yahoo, summary: SAN JOSE, Calif. (AP) — Cadence Design Systems Inc. (CDNS) on Monday reported fourth-quarter net income of $240.4 million.  The San Jose, California-based company said it had profit of 88 cents per share.  The results beat Wall Street expectations., Headline: Cadence Design Systems (CDNS) Beats Q4 Earnings and Revenue Estimates, source:Yahoo, summary: Cadence (CDNS) delivered earnings and revenue surprises of 5.49% and 2.20%, respectively, for the quarter ended December 2022. Do the numbers hold clues to what lies ahead for the stock?, Headline: GLOBAL BRIEFING: Flat open likely ahead of US inflation data, source:Alliance News, summary: No summary, Headline: What You Missed On Wall Street On Tuesday, source:Thefly.com, summary: No summary, Headline: Analysts Offer Insights on Technology Companies: Cadence Design (CDNS), Teradata (TDC) and Arista Networks (ANET), source:TipRanks, summary: No summary",CDNS
102,2023-02-14,"Headline: Cadence Design price target raised to $225 from $215 at KeyBanc, source:Thefly.com, summary: No summary, Headline: Cadence Design price target raised to $225 from $205 at BofA, source:Thefly.com, summary: No summary, Headline: Cadence Design price target raised to $215 from $206 at Baird, source:Thefly.com, summary: No summary, Headline: New Buy Rating for Cadence Design (CDNS), the Technology Giant, source:TipRanks, summary: No summary, Headline: Cadence Design price target raised to $200 from $175 at Rosenblatt, source:Thefly.com, summary: No summary, Headline: Cadence Design Systems executive chair to step aside at next AGM, source:Alliance News, summary: No summary, Headline: Cadence Design price target raised to $215 from $205 at Wells Fargo, source:Thefly.com, summary: No summary, Headline: Stocks making the biggest moves premarket: Palantir, Coca-Cola, Marriott and more, source:CNBC, summary: Earnings reports and analyst calls are moving stocks, including Occidental Petroleum. , Headline: Cadence Design price target raised to $235 from $200 at Needham, source:Thefly.com, summary: No summary, Headline: Early notable gainers among liquid option names on February 14th, source:Thefly.com, summary: No summary, Headline: What You Missed On Wall Street This Morning, source:Thefly.com, summary: No summary, Headline: Cadence Design Systems stock surges ~6% after Q4 results beat estimates, source:Seeking Alpha, summary: No summary, Headline: Hot Stocks: QSR, CLF fall on earnings news; CDNS, BTU rise, source:Seeking Alpha, summary: No summary, Headline: Stocks making the biggest moves midday: Palantir, Nvidia, Avis Budget and more, source:CNBC, summary: Here are the companies making headlines in midday trading Tuesday., Headline: Dow Jones Rallies 376 Points Into Key CPI Inflation Report; 5 Big Earnings Movers, source:Yahoo, summary: Dow futures were little changed after the Dow Jones Industrial Average surged Monday ahead of Tuesday's key CPI inflation report., Headline: Cadence (CDNS) Q4 Earnings & Revenues Top Estimates, Up Y/Y, source:Yahoo, summary: Cadence's (CDNS) fourth-quarter performance benefits from continued strength across all segments., Headline: Almost any chip designed in the world is done so with Cadence software, says CEO Anirudh Devgan, source:CNBC, summary: Anirudh Devgan, CEO of Cadence Design Systems, joins 'Closing Bell' to discuss his company's strong 4th quarter and full year guidance, which helped drive the stock 6 percent higher today., Headline: Avis, Zoetis rise; First Solar, Restaurant Brands fall, source:Associated Press, The, summary: No summary, Headline: Cadence Analyst Sees Meaningful Upside In Stock As EDA Customers Increase R&D Spend, source:Yahoo, summary: Needham analyst Charles Shi maintained Cadence Design Systems Inc (NASDAQ: CDNS) with a Buy and raised the price target from $200 to $235. Cadence beat the Street's 4Q22 estimate, and management guided 2023 revenue to be up 12-14%, well above the consensus estimate of ~10%. System Analysis continued to post robust growth, up 37.6% Y/Y in 4Q, marking its fourth quarter of Y/Y growth acceleration. Verification also posted solid growth of 28%, mainly driven by hardware, in which the Company noted d, Headline: Cadence Design Systems, Inc. (NASDAQ:CDNS) Q4 2022 Earnings Call Transcript, source:Yahoo, summary: Cadence Design Systems, Inc. (NASDAQ:CDNS) Q4 2022 Earnings Call Transcript February 13, 2023 Operator: Good afternoon. My name is Julianne, and I will be your conference operator today. At this time, I would like to welcome everyone to the Cadence Fourth Quarter and Fiscal Year 2022 Earnings Conference Call. Thank you. I will now turn […], Headline: Cadence Design Systems Stock Rises On Bullish Guidance, source:Yahoo, summary: Cadence Design Systems beat expectations for the fourth quarter and guided higher for the current quarter and full year., Headline: Markets Rally From CPI-Related Dip to End Mixed, source:Yahoo, summary: U.S. stock markets recovered from early losses to end mixed on Feb. 14 as consumer price index (CPI) data showed an uptick in inflation in January., Headline: Cadence Design Systems: Multiple Is Too High, source:SeekingAlpha, summary: Cadence Design Systems reported strong 4Q22 results with a 16% y/y increase in revenues driven by growth in all segments. Read why CDNS stock is a Hold now., Headline: Cadence Design price target raised to $222 from $200 at Deutsche Bank, source:Thefly.com, summary: No summary",CDNS
103,2023-02-15,"Headline: Cadence Design Systems Reaches Analyst Target Price, source:ETF Channel, summary: No summary, Headline: Cadence Design Systems Full Year 2022 Earnings: EPS Beats Expectations, source:Yahoo, summary: Cadence Design Systems ( NASDAQ:CDNS ) Full Year 2022 Results Key Financial Results Revenue: US$3.56b (up 19% from FY..., Headline: Dow Jones Futures Fall After Market Rally Shrugs Off Hot Inflation, Tesla Races; Airbnb Flies On Earnings, source:Yahoo, summary: The market rally held up despite hot inflation data. Boeing led new buys while Tesla ran higher. Airbnb soared late on earnings., Headline: Cadence Design Systems Inc. stock outperforms market on strong trading day, source:MarketWatch, summary: Shares of Cadence Design Systems Inc. advanced 1.59% to $202.26 Wednesday, on what proved to be an all-around positive trading session for the stock market,..., Headline: Meet the Cadence Black Students in Technology Scholarship Recipients, source:Yahoo, summary: Cadence Design Systems:",CDNS
104,2023-02-16,"Headline: Synopsys price target raised to $410 from $400 at Wells Fargo, source:Thefly.com, summary: No summary, Headline: Cadence Delivers 13 New VIP and Expands System VIP Portfolio to Accelerate Automotive, Hyperscale Data Center and Mobile SoC Verification, source:Yahoo, summary: SAN JOSE, Calif., February 16, 2023--Cadence announced the availability of 13 new VIP solutions that enable engineers to quickly and effectively verify their designs., Headline: Cadence Design Systems Inc. stock underperforms Thursday when compared to competitors, source:MarketWatch, summary: Shares of Cadence Design Systems Inc. shed 3.78% to $194.62 Thursday, on what proved to be an all-around dismal trading session for the stock market, with...",CDNS
105,2023-02-17,"Headline: This 1 Semiconductor Stock Could Be A Best Buy Now for the AI Arms Race, source:Yahoo, summary: Big tech escalated the artificial intelligence (AI) arms race at the start of 2023.  Microsoft invested in ChatGPT owner OpenAI, Alphabet's Google publicized a countermeasure with the soft launch of Bard, and Meta Platforms said it's revamping its data centers to favor more efficient computing use as it rolls out new AI of its own across its social media apps.  Behind all of this fancy new AI is an advanced kind of semiconductor system meant to be housed in a remote data center with its computation delivered to users via the internet., Headline: 4 Surefire Stocks to Buy in the Next Bear Market, source:Yahoo, summary: While these four companies boast incredible operations, their nosebleed valuations may look much more enticing should the market turn sour again., Headline: Cadence Design Systems Inc. stock falls Friday, still outperforms market, source:MarketWatch, summary: Shares of Cadence Design Systems Inc. slumped 0.09% to $194.44 Friday, on what proved to be an all-around mixed trading session for the stock market, with..., Headline: Cadence (CDNS) is an Incredible Growth Stock: 3 Reasons Why, source:Yahoo, summary: Cadence (CDNS) is well positioned to outperform the market, as it exhibits above-average growth in financials.",CDNS
106,2023-02-20,"Headline: Cadence (CDNS) Unveils 13 New Verification IP Offerings, source:Yahoo, summary: Cadence (CDNS) announces the launch of 13 new VIPs which supports multiple application areas, including hyperscale data centers, automotive, and consumer and mobile., Headline: Has Cadence Design Systems (CDNS) Outpaced Other Computer and Technology Stocks This Year?, source:Yahoo, summary: Here is how Cadence Design Systems (CDNS) and Analog Devices (ADI) have performed compared to their sector so far this year.",CDNS
107,2023-02-21,"Headline: Here's Why Investors Should Consider Buying Cadence (CDNS), source:Yahoo, summary: Cadence's (CDNS) performance benefits from the growing demand across all business segments., Headline: Zacks.com featured highlights include Crocs, Arista Networks, Caterpillar and Cadence Design Systems, source:Yahoo, summary: Crocs, Arista Networks, Caterpillar and Cadence Design Systems are part of the Zacks Screen of the Week article., Headline: Cadence Design Systems Inc. stock outperforms competitors despite losses on the day, source:MarketWatch, summary: Shares of Cadence Design Systems Inc. sank 0.92% to $192.65 Tuesday, on what proved to be an all-around poor trading session for the stock market, with the...",CDNS
108,2023-02-22,"Headline: Cadence Design Systems Inc. stock underperforms Wednesday when compared to competitors despite daily gains, source:MarketWatch, summary: Shares of Cadence Design Systems Inc. inched 0.70% higher to $193.99 Wednesday, on what proved to be an all-around rough trading session for the stock..., Headline: What Makes Cadence Design Systems (CDNS) a Strong Momentum Stock: Buy Now?, source:Yahoo, summary: Does Cadence Design Systems (CDNS) have what it takes to be a top stock pick for momentum investors? Let's find out.",CDNS
109,2023-02-23,"Headline: Cadence Design (CDNS): New Buy Recommendation for This Technology Giant, source:TipRanks, summary: No summary, Headline: Cadence Design Systems Inc. stock outperforms competitors on strong trading day, source:MarketWatch, summary: Shares of Cadence Design Systems Inc. rose 1.36% to $196.62 Thursday, on what proved to be an all-around great trading session for the stock market, with the...",CDNS
110,2023-02-24,"Headline: Top 5 S&P 500 Stocks With Double-Digit Returns Year to Date, source:Yahoo, summary: We have narrowed our search to five S&P 500 stocks with year-to-date returns of more than 10%. These are: CDNA, MCHP, ANET, LVS and GWW., Headline: Cadence Design Systems Inc. stock falls Friday, underperforms market, source:MarketWatch, summary: Shares of Cadence Design Systems Inc. slid 1.46% to $193.74 Friday, on what proved to be an all-around rough trading session for the stock market, with the...",CDNS
111,2023-02-25,"Headline: We Ran A Stock Scan For Earnings Growth And Cadence Bank (NYSE:CADE) Passed With Ease, source:Yahoo, summary: For beginners, it can seem like a good idea (and an exciting prospect) to buy a company that tells a good story to...",CDNS
112,2023-02-26,"Headline: 3 Powerhouse Stocks to Buy in March That Are Ready for Bull Runs, source:Yahoo, summary: The U.S. stock market enjoyed a strong rally in January.  Persistent inflation may result in the Federal Reserve increasing interest rates further than previously expected -- which creates less favorable conditions for stocks.  Here's why The Trade Desk (NASDAQ: TTD), Shopify (NYSE: SHOP), and Cadence Design Systems (NASDAQ: CDNS) could prove to be attractive picks in March.",CDNS
113,2023-02-27,"Headline: The Zacks Analyst Blog Highlights Cadence Design Systems, W.W. Grainger, Las Vegas Sands, Microchip Technology and Arista Networks, source:Yahoo, summary: Cadence Design Systems, W.W. Grainger, Las Vegas Sands, Microchip Technology and Arista Networks are included in this Analyst Blog., Headline: Cadence Design Systems Inc. stock underperforms Monday when compared to competitors, source:MarketWatch, summary: Shares of Cadence Design Systems Inc. slid 0.29% to $193.18 Monday, on what proved to be an all-around great trading session for the stock market, with the...",CDNS
114,2023-02-28,"Headline: Cadence Design (CDNS) Receives a Rating Update from a Top Analyst, source:TipRanks, summary: No summary, Headline: Cadence Design Systems Inc. stock falls Tuesday, still outperforms market, source:MarketWatch, summary: Shares of Cadence Design Systems Inc. slid 0.12% to $192.94 Tuesday, on what proved to be an all-around grim trading session for the stock market, with the..., Headline: Cadence’s Anirudh Devgan to Present at Morgan Stanley Conference, source:Yahoo, summary: SAN JOSE, Calif., February 28, 2023--Cadence’s Anirudh Devgan to Present at Morgan Stanley Conference",CDNS
115,2023-03-01,"Headline: With 87% ownership, Cadence Design Systems, Inc. (NASDAQ:CDNS) boasts of strong institutional backing, source:Yahoo, summary: Key Insights Significantly high institutional ownership implies Cadence Design Systems' stock price is sensitive to..., Headline: Cadence Design Systems Inc. stock falls Wednesday, underperforms market, source:MarketWatch, summary: Shares of Cadence Design Systems Inc. dropped 0.78% to $191.43 Wednesday, on what proved to be an all-around mixed trading session for the stock market, with..., Headline: Cadence Design Chairman sells $5.82M in common stock, source:Thefly.com, summary: No summary",CDNS
116,2023-03-02,"Headline: Cadence Design Systems Inc. stock rises Thursday, still underperforms market, source:MarketWatch, summary: Shares of Cadence Design Systems Inc. inched 0.63% higher to $192.64 Thursday, on what proved to be an all-around favorable trading session for the stock...",CDNS
117,2023-03-03,"Headline: Grade My Trade: SQ, NEE, GXO & CDNS, source:CNBC, summary: CNBC's 'Halftime Report' investment committee, Shannon Saccocia, Steve Weiss and Rob Sechan, weigh in on NextEra, GXO and Cadence Designs., Headline: Cadence Design Systems Inc. stock underperforms Friday when compared to competitors despite daily gains, source:MarketWatch, summary: Shares of Cadence Design Systems Inc. advanced 2.00% to $196.50 Friday, on what proved to be an all-around favorable trading session for the stock market,...",CDNS
118,2023-03-06,"Headline: Cadence Design Systems Inc. stock outperforms market on strong trading day, source:MarketWatch, summary: Shares of Cadence Design Systems Inc. inched 0.46% higher to $197.40 Monday, on what proved to be an all-around favorable trading session for the stock...",CDNS
119,2023-03-07,"Headline: Here's How Much a $1000 Investment in Cadence Design Systems Made 10 Years Ago Would Be Worth Today, source:Yahoo, summary: Why investing for the long run, especially if you buy certain popular stocks, could reap huge rewards., Headline: Cadence to Invest $50 Million to Support Racial Equity, source:Yahoo, summary: SAN JOSE, Calif., March 07, 2023--Cadence is making a $50 million USD purpose-driven investment in an impact investment program managed by RBC GAM to address racial wealth inequities., Headline: Cadence Design Systems Inc. stock falls Tuesday, still outperforms market, source:MarketWatch, summary: Shares of Cadence Design Systems Inc. slipped 1.04% to $195.35 Tuesday, on what proved to be an all-around dismal trading session for the stock market, with...",CDNS
