,date,information,related
120,2023-03-01,"Headline: What Does Charter Communications, Inc.'s (NASDAQ:CHTR) Share Price Indicate?, source:Yahoo, summary: Let's talk about the popular Charter Communications, Inc. ( NASDAQ:CHTR ). The company's shares saw a significant share..., Headline: Charter to Participate in Morgan Stanley Technology, Media & Telecom Conference, source:Yahoo, summary: Charter Communications, Inc. (NASDAQ: CHTR) (along with its subsidiaries, ""Charter"") today announced that Christopher Winfrey, President and Chief Executive Officer, will participate in the Morgan Stanley Technology, Media & Telecom Conference in San Francisco, California on Wednesday, March 8, 2023. Mr. Winfrey's remarks are scheduled to begin at 9:50 a.m. PT (12:50 p.m. ET)., Headline: Charter Communications Inc. Cl A stock outperforms competitors despite losses on the day, source:MarketWatch, summary: Shares of Charter Communications Inc. Cl A slipped 1.38% to $362.54 Wednesday, on what proved to be an all-around mixed trading session for the stock market,..., Headline: Compounders And Dividends: February 2023 Portfolio Update, source:SeekingAlpha, summary: Quarter-over-quarter dividend growth clocked in at 42.7% for February 2023. See why I exited all my REIT positions and added four new positions to my portfolio.",CHTR
121,2023-03-02,"Headline: Millions of low-income families could soon face steeper broadband internet bills, source:CNBC, summary: Low-income households that have relied on a federal broadband subsidy for the past two years could see their internet bills rise if the program is not renewed. , Headline: Charter Communications Inc. Cl A stock rises Thursday, still underperforms market, source:MarketWatch, summary: Shares of Charter Communications Inc. Cl A inched 0.15% higher to $363.09 Thursday, on what proved to be an all-around favorable trading session for the...",CHTR
122,2023-03-03,"Headline: Charter Communications Inc. Cl A stock outperforms competitors on strong trading day, source:MarketWatch, summary: Shares of Charter Communications Inc. Cl A advanced 1.90% to $369.98 Friday, on what proved to be an all-around favorable trading session for the stock..., Headline: Comcast: Still Cheap After Good Cable Growth In Q4 Results, source:SeekingAlpha, summary: Despite gaining 9% since our last update in November, Comcast stock still has a P/E of just 9.9x and a Dividend Yield of 3.1%. Read more here.",CHTR
123,2023-03-05,"Headline: The past year for Charter Communications (NASDAQ:CHTR) investors has not been profitable, source:Yahoo, summary: The simplest way to benefit from a rising market is to buy an index fund. While individual stocks can be big winners...",CHTR
124,2023-03-06,"Headline: The Decline Of Charter Communications, source:SeekingAlpha, summary: Charter Communications' future is murky given its capital position. Check out why I'm bearish on CHTR stock., Headline: Altice USA: Why It Will Not Be Acquired By Comcast, source:SeekingAlpha, summary: Altice USA stock has risen 9.7% since rumors of takeover interest from Comcast. Read why a deal between ATUS and CMCSA will not happen., Headline: Charter Communications Inc. Cl A stock outperforms competitors despite losses on the day, source:MarketWatch, summary: Shares of Charter Communications Inc. Cl A shed 0.24% to $369.11 Monday, on what proved to be an all-around favorable trading session for the stock market,...",CHTR
125,2023-03-07,"Headline: S&P 500 Futures Rise in Premarket Trading; Rivian Automotive, Nutanix Lag, source:MarketWatch, summary: With U.S. stock markets set to open in two hours, (DKS) was up 4.5% in pre-market trading, and (DISH) was up 3.6%. (PR), (CTSH), and (CHTR) were all posting..., Headline: Model Transition Positions Applied Optoelectronics For Long-Term Growth, source:SeekingAlpha, summary: Applied Optoelectronics' transceiver business has continued to underperform. Can a divestiture turn around the company's fortunes? Read more here., Headline: Charter Communications Inc. Cl A stock falls Tuesday, underperforms market, source:MarketWatch, summary: Shares of Charter Communications Inc. Cl A shed 3.05% to $357.85 Tuesday, on what proved to be an all-around poor trading session for the stock market, with..., Headline: AT&T maintains guidance, says cost targets `well in hand`, source:Seeking Alpha, summary: No summary",CHTR
126,2023-03-08,"Headline: Charter Communications Inc. Cl A stock falls Wednesday, underperforms market, source:MarketWatch, summary: Shares of Charter Communications Inc. Cl A slipped 1.11% to $353.87 Wednesday, on what proved to be an all-around mixed trading session for the stock market,...",CHTR
127,2023-03-09,"Headline: T-Mobile Doesn't See Cable's Competition in the Wireless Game As a Major Threat, source:Yahoo, summary: The company's CFO thinks cable will take an even greater share of net additions in the first quarter this year., Headline: Charter Communications Inc. Cl A stock outperforms competitors despite losses on the day, source:MarketWatch, summary: Shares of Charter Communications Inc. Cl A shed 3.07% to $343.01 Thursday, on what proved to be an all-around rough trading session for the stock market,...",CHTR
128,2023-03-10,"Headline: AT&T: Solid Position In The Industry, Lower Debt, But No Comfortable Margin Of Safety, source:SeekingAlpha, summary: We believe that AT&T's mid-band coverage scale-up can incentivize customers to upgrade to premium plans, which will drive ARPU. Read more T stock here., Headline: A Closer Look At Charter Communications, Inc.'s (NASDAQ:CHTR) Impressive ROE, source:Yahoo, summary: While some investors are already well versed in financial metrics (hat tip), this article is for those who would like..., Headline: Charter Communications Inc. Cl A stock underperforms Friday when compared to competitors, source:MarketWatch, summary: Shares of Charter Communications Inc. Cl A slid 3.94% to $329.49 Friday, on what proved to be an all-around rough trading session for the stock market, with...",CHTR
129,2023-03-12,"Headline: Noteworthy Monday Option Activity: CHTR, HUM, TFC, source:Stock Options Channel, summary: No summary",CHTR
130,2023-03-13,"Headline: SPECTRUM BUSINESS® OFFERS SMB CUSTOMERS FREE UNLIMITED SPECTRUM MOBILE™ FOR ONE YEAR, source:Yahoo, summary: Count small business owners among those now eligible to take advantage of Charter Communications' offer of one free line of Unlimited Spectrum Mobile service for a year. Charter, which launched the free mobile line promotion for residential customers as part of its industry-leading Spectrum One rollout last fall, is now making it available to new and existing Spectrum Business customers*, the company announced today., Headline: Charter Communications Inc. Cl A stock rises Monday, outperforms market, source:MarketWatch, summary: Shares of Charter Communications Inc. Cl A rallied 1.75% to $335.26 Monday, on what proved to be an all-around dismal trading session for the stock market,...",CHTR
131,2023-03-14,"Headline: Is Charter Communications, Inc. (NASDAQ:CHTR) Trading At A 31% Discount?, source:Yahoo, summary: Key Insights Charter Communications' estimated fair value is US$483 based on 2 Stage Free Cash Flow to Equity Current..., Headline: Charter Communications Inc. Cl A stock rises Tuesday, still underperforms market, source:MarketWatch, summary: Shares of Charter Communications Inc. Cl A inched 0.26% higher to $336.14 Tuesday, on what proved to be an all-around favorable trading session for the stock...",CHTR
132,2023-03-15,"Headline: Charter Communications Inc. Cl A stock underperforms Wednesday when compared to competitors despite daily gains, source:MarketWatch, summary: Shares of Charter Communications Inc. Cl A rose 1.73% to $341.94 Wednesday, on what proved to be an all-around dismal trading session for the stock market,...",CHTR
133,2023-03-16,"Headline: Charter Communications Inc. Cl A stock rises Thursday, still underperforms market, source:MarketWatch, summary: Shares of Charter Communications Inc. Cl A rose 1.32% to $346.45 Thursday, on what proved to be an all-around favorable trading session for the stock market,...",CHTR
134,2023-03-17,"Headline: Charter Communications Inc. Cl A stock outperforms market on strong trading day, source:MarketWatch, summary: Shares of Charter Communications Inc. Cl A rose 1.03% to $350.01 Friday, on what proved to be an all-around dismal trading session for the stock market, with...",CHTR
135,2023-03-19,"Headline: Television usage dips in February - but streaming keeps taking up TV time, source:Seeking Alpha, summary: No summary, Headline: Charter Communications (NASDAQ:CHTR) Is Doing The Right Things To Multiply Its Share Price, source:Yahoo, summary: To find a multi-bagger stock, what are the underlying trends we should look for in a business? Firstly, we'd want to..., Headline: Harmonic, Charter announce partnership, source:Thefly.com, summary: No summary, Headline: Harmonic jumps 8% to $14.20 after technology partnership with Charter, source:Thefly.com, summary: No summary",CHTR
136,2023-03-20,"Headline: Charter Communications Inc. Cl A stock falls Monday, underperforms market, source:MarketWatch, summary: Shares of Charter Communications Inc. Cl A sank 0.36% to $348.75 Monday, on what proved to be an all-around positive trading session for the stock market,..., Headline: Harmonic Shares Rise Nearly 8% on Network Partnership With Charter, source:MarketWatch, summary: By Stephen Nakrosis Shares of Harmonic Inc. gained in Monday's after-hours market, following news the company was chosen by Charter Communications Inc. as a..., Headline: CHARTER COMMUNICATIONS' GENERAL COUNSEL ANNOUNCES RETIREMENT, source:Yahoo, summary: Charter Communications, Inc. (NASDAQ: CHTR) today announced that Rick Dykhouse plans to retire as Executive Vice President, General Counsel and Corporate Secretary after 17 years with Charter. Mr. Dykhouse will continue to serve as Charter's General Counsel through the Company's search for his successor. Following that appointment, Mr. Dykhouse will remain as Executive Counsel to support the transition reporting to Chris Winfrey, President and Chief Executive Officer.",CHTR
137,2023-03-21,"Headline: What You Missed On Wall Street On Tuesday, source:Thefly.com, summary: No summary, Headline: Harmonic win worth $350M-plus over three years, says Jefferies, source:Thefly.com, summary: No summary, Headline: Harmonic price target raised to $23 from $20 at Northland, source:Thefly.com, summary: No summary, Headline: Charter Communications Inc. Cl A stock rises Tuesday, still underperforms market, source:MarketWatch, summary: Shares of Charter Communications Inc. Cl A rallied 1.02% to $352.29 Tuesday, on what proved to be an all-around positive trading session for the stock..., Headline: Harmonic Snags Charter Cable TV Contract, Shares Jump, source:Yahoo, summary: Harmonic stock jumped on a new contract to supply cable TV network equipment to Charter Communications. Analysts speculated on the deal's size.",CHTR
138,2023-03-22,"Headline: Appleseed Fund 2022 Annual Letter, source:SeekingAlpha, summary: Global economic growth has slowed to recessionary (or near recessionary) levels and just as 2008 and 2020 have become important years of market history, so too will 2022., Headline: Harmonic (HLIT) Soars 9.8%: Is Further Upside Left in the Stock?, source:Yahoo, summary: Harmonic (HLIT) witnessed a jump in share price last session on above-average trading volume. The latest trend in earnings estimate revisions for the stock doesn't suggest further strength down the road., Headline: Charter Communications Inc. Cl A stock outperforms competitors despite losses on the day, source:MarketWatch, summary: Shares of Charter Communications Inc. Cl A slid 2.97% to $341.83 Wednesday, on what proved to be an all-around rough trading session for the stock market,...",CHTR
139,2023-03-23,"Headline: Charter Communications Inc. Cl A stock rises Thursday, still underperforms market, source:MarketWatch, summary: Shares of Charter Communications Inc. Cl A inched 0.10% higher to $342.17 Thursday, on what proved to be an all-around favorable trading session for the..., Headline: T-Mobile and Verizon Are Pushing ‘Fixed Wireless’ Internet. What It Means for the Stocks., source:MarketWatch, summary: The telecoms companies are using the technology to offer increasingly popular bundles of mobile and home broadband.",CHTR
140,2023-03-24,"Headline: Charter Communications Inc. Cl A stock rises Friday, still underperforms market, source:MarketWatch, summary: Shares of Charter Communications Inc. Cl A inched 0.52% higher to $343.95 Friday, on what proved to be an all-around great trading session for the stock...",CHTR
141,2023-03-28,"Headline: Tracking William Nygren`s Harris Associates Portfolio - Q4 2022 Update, source:Seeking Alpha, summary: No summary, Headline: Tracking William Nygren's Harris Associates Portfolio - Q4 2022 Update, source:SeekingAlpha, summary: Harris Associatesâ 13F portfolio value decreased from $59.68B to $49.11B this quarter. Click here for a complete analysis., Headline: Charter Communications Inc. Cl A stock outperforms competitors despite losses on the day, source:MarketWatch, summary: Shares of Charter Communications Inc. Cl A shed 0.81% to $345.54 Tuesday, on what proved to be an all-around rough trading session for the stock market, with..., Headline: ADVANCED WIFI NOW AVAILABLE FOR SPECTRUM BUSINESS® CUSTOMERS NATIONWIDE, source:Yahoo, summary: Charter Communications, Inc. today announced the availability of Advanced WiFi for Spectrum Business customers across its 41-state service area. Powered by Charter's latest WiFi technology, Advanced WiFi offers small and medium-sized businesses a connectivity solution with speed, security and coverage enhancements.",CHTR
142,2023-03-29,"Headline: Analysts Have Conflicting Sentiments on These Services Companies: Charter Communications (CHTR), Liberty Media Liberty Formula One (FWONA) and McDonald`s (MCD), source:TipRanks, summary: No summary, Headline: Cell Tower REITs: 5G`s Killer App, source:Seeking Alpha, summary: No summary, Headline: Cell Tower REITs: 5G's Killer App, source:SeekingAlpha, summary: 5G has found its killer app. Fixed Wireless Access - home broadband provided by carriers through cellular networks - is for real. Read more here., Headline: IN BRIEF: Menhaden Resource Efficiency NAV declines in 2022, source:Alliance News, summary: No summary, Headline: Charter (CHTR) Expands WiFi for Spectrum Business Customers, source:Yahoo, summary: Charter (CHTR) announces advanced WiFi for Spectrum Business customers., Headline: Charter Communications Inc. Cl A stock rises Wednesday, still underperforms market, source:MarketWatch, summary: Shares of Charter Communications Inc. Cl A advanced 1.21% to $349.71 Wednesday, on what proved to be an all-around positive trading session for the stock..., Headline: CFRA Upgrades Charter Communications (CHTR), source:Fintel, summary: nan",CHTR
143,2023-03-30,"Headline: 15 Cheap Beginner Stocks to Buy, source:Yahoo, summary: In this article, we will take a look at 15 cheap stocks to buy now for beginners. If you want to explore similar stocks, you can also take a look at 5 Cheap Beginner Stocks to Buy. Morgan Stanley’s Big Bear: “It’s Just A Much Less Predictable World” On March 27 Morgan Stanley’s chief U.S. […], Headline: Charter Communications Inc. Cl A stock underperforms Thursday when compared to competitors, source:MarketWatch, summary: Shares of Charter Communications Inc. Cl A dropped 0.19% to $349.05 Thursday, on what proved to be an all-around favorable trading session for the stock...",CHTR
144,2023-03-31,"Headline: Charter price target raised to $460 from $440 at RBC Capital, source:Thefly.com, summary: No summary, Headline: Charter Communications, Inc. (NASDAQ:CHTR) insiders sold US$14m worth of stock suggesting impending weakness., source:Yahoo, summary: The fact that multiple Charter Communications, Inc. ( NASDAQ:CHTR ) insiders offloaded a considerable amount of shares..., Headline: Charter Communications Inc. Cl A stock rises Friday, outperforms market, source:MarketWatch, summary: Shares of Charter Communications Inc. Cl A rose 2.45% to $357.61 Friday, on what proved to be an all-around great trading session for the stock market, with..., Headline: Compounders And Dividends: March 2023 Portfolio Update, source:SeekingAlpha, summary: My year over year dividend income was up 59.8%, while the quarter over quarter dividend income was down 0.55%. Click here to read my recent update and analysis.",CHTR
145,2023-04-03,"Headline: Charter Communications Inc. Cl A stock falls Monday, underperforms market, source:MarketWatch, summary: Shares of Charter Communications Inc. Cl A dropped 0.39% to $356.21 Monday, on what proved to be an all-around great trading session for the stock market,..., Headline: Noteworthy Tuesday Option Activity: CHTR, NSTG, ABBV, source:Stock Options Channel, summary: No summary",CHTR
146,2023-04-04,"Headline: Charter downgraded to Sector Weight from Overweight at KeyBanc, source:Thefly.com, summary: No summary, Headline: Telecom Competition Is ‘Destructive.’ Why Comcast Is Rated as a Winner., source:MarketWatch, summary: KeyBanc raised its rating and price target on the company while downgrading cable broadband rival Charter Communications., Headline: KeyBanc`s cable look cuts Charter, boosts Comcast and WideOpenWest, source:Seeking Alpha, summary: No summary, Headline: Street Wrap: Today`s Top 15 Upgrades, Downgrades, Initiations, source:Thefly.com, summary: No summary, Headline: Why Comcast`s stock stands out in the cable sector, according to one analyst, source:MarketWatch, summary: No summary, Headline: Why Comcast’s stock stands out in the cable sector, according to one analyst, source:MarketWatch, summary: Comcast Corp. looks like a better cable play than Charter Communications Inc., according to a KeyBanc analyst., Headline: Charter Communications (NASDAQ:CHTR) shareholders have endured a 37% loss from investing in the stock a year ago, source:Yahoo, summary: Investors can approximate the average market return by buying an index fund. Active investors aim to buy stocks that..., Headline: Charter Communications Inc. Cl A stock falls Tuesday, underperforms market, source:MarketWatch, summary: Shares of Charter Communications Inc. Cl A slid 2.27% to $348.12 Tuesday, on what proved to be an all-around poor trading session for the stock market, with..., Headline: Keybanc Downgrades Charter Communications (CHTR), source:Fintel, summary: nan",CHTR
147,2023-04-05,"Headline: Charter to Hold Webcast to Discuss First Quarter 2023 Financial and Operating Results, source:Yahoo, summary: Charter Communications, Inc. (NASDAQ: CHTR) (the ""Company"" or ""Charter"") will host a webcast on Friday, April 28, 2023 at 8:30 a.m. Eastern Time (ET) to discuss financial and operating results for the quarter ended March 31, 2023. A press release reporting such results will be issued at 7:00 a.m. ET that day., Headline: Charter Communications Inc. Cl A stock outperforms competitors on strong trading day, source:MarketWatch, summary: Shares of Charter Communications Inc. Cl A rose 1.44% to $353.12 Wednesday, on what proved to be an all-around mixed trading session for the stock market,..., Headline: The 3 Most Undervalued Warren Buffett Stocks to Buy in April 2023, source:Yahoo, summary: It’s a great time to be looking at undervalued Warren Buffett stocks. With inflation, geopolitical crises, and a potential recession all causing economic uncertainty, investors are seeking safe investments with a strong margin of safety. And few investors have proven more capable of finding these sorts of investments than Warren Buffett. His holding company, Berkshire Hathaway (NYSE:BRK-A) (NYSE:BRK-B), has generated one of the most impressive track records in financial history. And Buffett is p",CHTR
148,2023-04-06,"Headline: May 26th Options Now Available For Charter Communications (CHTR), source:Stock Options Channel, summary: No summary, Headline: Charter Communications Inc. Cl A stock outperforms competitors despite losses on the day, source:MarketWatch, summary: Shares of Charter Communications Inc. Cl A slipped 0.81% to $350.27 Thursday, on what proved to be an all-around great trading session for the stock market,..., Headline: Altice: A Gameplan To Buyout Of Public Shareholders, source:SeekingAlpha, summary: Altice stock is down over 90% from 2021 peak and its market cap is already a tiny sliver of the capital structure. Click here to read why ATUS stock is a Strong Buy.",CHTR
149,2023-04-09,"Headline: Boasting A 47% Return On Equity, Is Charter Communications, Inc. (NASDAQ:CHTR) A Top Quality Stock?, source:Yahoo, summary: While some investors are already well versed in financial metrics (hat tip), this article is for those who would like...",CHTR
150,2023-04-10,"Headline: Charter Communications (CHTR) Gets a Hold from Citigroup, source:TipRanks, summary: No summary, Headline: Charter Communications Inc. Cl A stock outperforms competitors on strong trading day, source:MarketWatch, summary: Shares of Charter Communications Inc. Cl A rallied 1.03% to $353.89 Monday, on what proved to be an all-around positive trading session for the stock market,...",CHTR
151,2023-04-11,"Headline: Charter Communications Inc. Cl A stock rises Tuesday, outperforms market, source:MarketWatch, summary: Shares of Charter Communications Inc. Cl A rose 1.31% to $358.52 Tuesday, on what proved to be an all-around mixed trading session for the stock market, with...",CHTR
152,2023-04-12,"Headline: Charter Communications Inc. Cl A stock falls Wednesday, underperforms market, source:MarketWatch, summary: Shares of Charter Communications Inc. Cl A slipped 4.25% to $343.28 Wednesday, on what proved to be an all-around grim trading session for the stock market,..., Headline: 12 Best Warren Buffett Stocks To Buy According to Hedge Funds, source:Yahoo, summary: In this piece, we will take a look at the 12 best Warren Buffett stocks to buy according to hedge funds. For more stocks, head on over to 5 Best Warren Buffett Stocks To Buy According to Hedge Funds. For newcomers, and sometimes seasoned professionals too, investing often feels like a daunting task. Choosing the […]",CHTR
153,2023-04-13,"Headline: Is There Now An Opportunity In Charter Communications, Inc. (NASDAQ:CHTR)?, source:Yahoo, summary: Today we're going to take a look at the well-established Charter Communications, Inc. ( NASDAQ:CHTR ). The company's..., Headline: Modern Hire's Client Charter Communications, Inc. Named Winner of the SIOP and SHRM 2023 HRM Impact Award, source:Yahoo, summary: Modern Hire, the enterprise hiring platform that uses advanced selection science to reduce bias and predict candidate fit, today announced that its client Charter Communications, Inc., which operates under the Spectrum brand, has won the 2023 Human Resource Management (HRM) Impact Award for its work with Modern Hire in establishing a state-of-the-science staffing process for Spectrum Store Specialists.",CHTR
154,2023-04-14,"Headline: Charter Communications Inc. Cl A stock outperforms competitors despite losses on the day, source:MarketWatch, summary: Shares of Charter Communications Inc. Cl A slipped 1.76% to $341.50 Friday, on what proved to be an all-around rough trading session for the stock market,...",CHTR
155,2023-04-16,"Headline: 7 Stocks to Sell in April Before They Crash and Burn, source:Yahoo, summary: The markets may be showing solid signs of improvement, but there are still many stocks to sell. In fact, in this environment of elevated interest rates, stocks with unrealistically high valuations are likely to come back to earth sooner rather than later. So, here are seven stocks to sell in April that are very likely to suffer that fate. CRWD CrowdStrike $135.77 CLX Clorox $158.23 MULN Mullen Automotive $0.10 RHI Robert Half International $75.32 CHTR Charter Communications $341.50 KSS Kohl’s $2",CHTR
156,2023-04-17,"Headline: Charter Communications Inc. Cl A stock underperforms Tuesday when compared to competitors, source:MarketWatch, summary: No summary",CHTR
157,2023-04-18,"Headline: Charter Communications Inc. Cl A stock outperforms competitors on strong trading day, source:MarketWatch, summary: No summary",CHTR
158,2023-04-19,"Headline: Returns On Capital Are Showing Encouraging Signs At Charter Communications (NASDAQ:CHTR), source:Yahoo, summary: What trends should we look for it we want to identify stocks that can multiply in value over the long term? In a..., Headline: AT&T posts worst drop in years as analysts weigh another hard cash-flow road ahead, source:Seeking Alpha, summary: No summary, Headline: Charter Communications Inc. Cl A stock underperforms Thursday when compared to competitors, source:MarketWatch, summary: No summary",CHTR
