,date,information,related
191,2023-05-30,"Headline: Charter Communications Inc. Cl A stock rises Tuesday, outperforms market, source:MarketWatch, summary: Shares of Charter Communications Inc. Cl A inched 0.94% higher to $333.34 Tuesday, on what proved to be an all-around mixed trading session for the stock..., Headline: Warren Buffett and Goldman Sachs Have One Thing in Common: They Both Like These 3 Stocks, source:Yahoo, summary: Some people’s exploits in their chosen profession transcend beyond the industry they operate in – making them household names. It’s pretty safe to claim that even those not interested in the investing world are familiar with Warren Buffett. Buffett embodies the term ‘legendary investor’ probably more than any other and considering his decades of almost unrivalled stock picking success, it’s a thoroughly deserved epithet. For those looking to emulate a fraction of Buffett’s success, get ahead of",CHTR
192,2023-05-31,"Headline: MLB will broadcast San Diego Padres games after Diamond Sports stops payments, source:CNBC, summary: Bally Sports San Diego, owned by the bankrupt Diamond Sports, will no longer air Padres games beginning Wednesday., Headline: Charter Communications Inc. Cl A stock underperforms Wednesday when compared to competitors, source:MarketWatch, summary: Shares of Charter Communications Inc. Cl A slipped 2.16% to $326.15 Wednesday, on what proved to be an all-around poor trading session for the stock market,..., Headline: SPECTRUM PARTNERS WITH OVATION TV TO SUPPORT DULUTH ART INSTITUTE WITH $10,000 STAND FOR THE ARTS AWARD, source:Yahoo, summary: Spectrum is proud to announce the Duluth Art Institute is the recipient of $10,000 through the 2022-2023 Stand For The Arts Awards in partnership with Ovation TV that recognizes local arts, cultural and educational organizations and programs.",CHTR
193,2023-06-01,"Headline: Reddit will charge hefty fees to the many third-party apps that access its data, source:CNBC, summary: According to one developer, Reddit will charge $12,000 for 50 million API requests, a high price relative to many peers., Headline: Charter Communications Inc. Cl A stock rises Thursday, still underperforms market, source:MarketWatch, summary: Shares of Charter Communications Inc. Cl A inched 0.57% higher to $328.02 Thursday, on what proved to be an all-around positive trading session for the stock...",CHTR
194,2023-06-02,"Headline: Charter Communications Inc. Cl A stock rises Friday, still underperforms market, source:MarketWatch, summary: Shares of Charter Communications Inc. Cl A inched 0.40% higher to $329.32 Friday, on what proved to be an all-around favorable trading session for the stock...",CHTR
195,2023-06-04,"Headline: Charter Communications Inc. Cl A stock rises Monday, outperforms market, source:MarketWatch, summary: No summary",CHTR
196,2023-06-05,"Headline: Nokia selected by Charter to support 5G connectivity, source:Thefly.com, summary: No summary, Headline: Check Out What Whales Are Doing With CHTR, source:Benzinga, summary: No summary, Headline: Are Investors Undervaluing Charter Communications, Inc. (NASDAQ:CHTR) By 28%?, source:Yahoo, summary: Key Insights Charter Communications' estimated fair value is US$459 based on 2 Stage Free Cash Flow to Equity Charter..., Headline: Charter Communications Inc. Cl A stock falls Tuesday, underperforms market, source:MarketWatch, summary: No summary",CHTR
197,2023-06-06,"Headline: Comcast: Walking The Plank, source:SeekingAlpha, summary: Comcast's revenue is better mixed than it used to be; 76% of EBITDA comes from Cable Communications. Find out why CMCSA stock is a Hold., Headline: Nokia (NOK) Solutions to Power Charter's Network Connectivity, source:Yahoo, summary: Charter Communications has selected Nokia's (NOK) industry leading AirScale portfolio to provide fast, reliable and targeted 5G connectivity to Spectrum Mobile customers.",CHTR
198,2023-06-07,"Headline: Charter Communications Inc. Cl A stock rises Wednesday, outperforms market, source:MarketWatch, summary: Shares of Charter Communications Inc. Cl A rose 2.34% to $336.71 Wednesday, on what proved to be an all-around mixed trading session for the stock market,...",CHTR
199,2023-06-08,"Headline: 6 cities where women earn more, source:MarketWatch, summary: No summary, Headline: July 28th Options Now Available For Charter Communications (CHTR), source:Stock Options Channel, summary: No summary, Headline: Charter Communications Inc. Cl A stock underperforms Thursday when compared to competitors, source:MarketWatch, summary: Shares of Charter Communications Inc. Cl A slumped 0.16% to $336.18 Thursday, on what proved to be an all-around positive trading session for the stock...",CHTR
200,2023-06-09,"Headline: The U.S. Wireless Market Looks Broken: Avoid Verizon (And AT&T And T-Mobile), source:SeekingAlpha, summary: Cable's entrance to the wireless space is a big threat to US wireless. Verizonâs (VZ) new pricing strategy will lead to further price competition. Click to read., Headline: Corning Stock Rallies After  Morgan Stanley Upgrade. What’s Behind the Brighter Outlook., source:MarketWatch, summary: Morgan Stanley turned bullish on the specialty glass maker, as it anticipates better times ahead., Headline: A Closer Look At Charter Communications, Inc.'s (NASDAQ:CHTR) Impressive ROE, source:Yahoo, summary: Many investors are still learning about the various metrics that can be useful when analysing a stock. This article is..., Headline: Charter Communications Inc. Cl A stock underperforms Friday when compared to competitors, source:MarketWatch, summary: Shares of Charter Communications Inc. Cl A slid 2.29% to $328.48 Friday, on what proved to be an all-around positive trading session for the stock market,...",CHTR
201,2023-06-10,"Headline: Best oversold stocks and worst crowded shorts from Citi's quant team, source:Seeking Alpha, summary: No summary",CHTR
202,2023-06-12,"Headline: Reddit API charges spark community outrage, dayslong blackout, source:CNBC, summary: Hundreds of Reddit's largest communities have gone dark to protest proposed changes to how the company bills third-party developers beginning Monday., Headline: Charter Communications Inc. Cl A stock rises Monday, outperforms market, source:MarketWatch, summary: Shares of Charter Communications Inc. Cl A advanced 2.08% to $335.30 Monday, on what proved to be an all-around positive trading session for the stock...",CHTR
203,2023-06-13,"Headline: 10 Communication Services Stocks Whale Activity In Today's Session, source:Benzinga, summary: No summary, Headline: Charter Communications Inc. Cl A stock underperforms Tuesday when compared to competitors, source:MarketWatch, summary: Shares of Charter Communications Inc. Cl A slipped 0.01% to $335.27 Tuesday, on what proved to be an all-around positive trading session for the stock..., Headline: Charter put volume heavy and directionally bearish, source:Thefly.com, summary: No summary",CHTR
204,2023-06-14,"Headline: CHARTER AWARDS $400,000 TO THE THIRD CLASS OF SPECTRUM SCHOLARS, source:Yahoo, summary: Today, Charter Communications, Inc. announced it has awarded $400,000 in scholarships to the 2023 class of Spectrum Scholars, the company's annual college scholarship program for underrepresented students with financial need. Each of the 20 students in this year's class will receive a $20,000 scholarship, be assigned a Charter mentor and have the opportunity to pursue an internship at one of the company's corporate offices in Stamford, Charlotte, St. Louis or Denver., Headline: Charter Communications Inc. Cl A stock underperforms Wednesday when compared to competitors, source:MarketWatch, summary: Shares of Charter Communications Inc. Cl A shed 0.01% to $335.25 Wednesday, on what proved to be an all-around mixed trading session for the stock market,...",CHTR
205,2023-06-15,"Headline: Charter Communications Inc. Cl A stock rises Thursday, outperforms market, source:MarketWatch, summary: Shares of Charter Communications Inc. Cl A advanced 2.27% to $342.85 Thursday, on what proved to be an all-around great trading session for the stock market,...",CHTR
206,2023-06-16,"Headline: Comcast: My Personal Impressions From Super Nintendo World, source:SeekingAlpha, summary: Comcast may have a Star Wars-type franchise burgeoning going forward. Click here to see why CMCSA stock is a Buy., Headline: Charter Communications Inc. Cl A stock outperforms competitors despite losses on the day, source:MarketWatch, summary: Shares of Charter Communications Inc. Cl A slid 0.47% to $341.24 Friday, on what proved to be an all-around dismal trading session for the stock market, with...",CHTR
207,2023-06-20,"Headline: T-Mobile (NASDAQ:TMUS) Stock: Wall Street Sees Solid Growth Potential, source:TipRanks, summary: No summary, Headline: Biden administration pushes for upfront, all-in pricing for cable and satellite TV, source:MarketWatch, summary: The Biden administration on Tuesday rolled out a fresh effort to limit so-called junk fees, as the Federal Communications Commission proposed a new rule that..., Headline: Charter Communications Inc. Cl A stock falls Tuesday, underperforms market, source:MarketWatch, summary: Shares of Charter Communications Inc. Cl A slipped 2.75% to $331.86 Tuesday, on what proved to be an all-around poor trading session for the stock market,...",CHTR
208,2023-06-21,"Headline: 5 Stocks Warren Buffett, Wallace Weitz Agree On, source:GuruFocus, summary: No summary, Headline: AAPL, BKNG, DASH Lead Fintel’s Top 10 Big Shorts List For June, source:Fintel, summary: nan, Headline: Charter Communications Inc. Cl A stock outperforms competitors despite losses on the day, source:MarketWatch, summary: Shares of Charter Communications Inc. Cl A dropped 0.93% to $328.78 Wednesday, on what proved to be an all-around poor trading session for the stock market,..., Headline: SPECTRUM TO SPONSOR THE BALD BROTHERS TOUR FEATURING KEVONSTAGE AND TONY BAKER, source:Yahoo, summary: Spectrum today announced its sponsorship of the upcoming Bald Brothers Tour starring renowned comedians Tony Baker and Kevin ""KevOnStage"" Fredericks. The 10-city run kicks off on Friday, August 4 in Philadelphia, with stops in New York, Washington, D.C., Charlotte, Atlanta, Cleveland, Chicago, New Orleans and Phoenix before wrapping up in Dallas on Sunday, September 3. Additionally, Spectrum has partnered with the duo to produce ""The One,"" a tongue-in-cheek music video about the Company's indust",CHTR
209,2023-06-22,"Headline: 10 Communication Services Stocks Whale Activity In Today's Session, source:Benzinga, summary: No summary, Headline: SPECTRUM BUSINESS® INTRODUCES 'LET'S GET STARTED' INITIATIVE, INCLUDING A FREE DIGITAL HUB FOR ASPIRING BUSINESS OWNERS, source:Yahoo, summary: Charter Communications, Inc. today announced the launch of ""Let's Get Started"" – a new initiative from Spectrum Business to help people interested in launching their own business build successful ventures. The program features a digital hub at Spectrum.com/GetStarted with free resources, how-to articles and guidance for starting a small business. Additionally, entrepreneurs can use the portal to access more than 10,000 SCORE mentors at no cost through the Company's partnership with the nonprofit, Headline: Charter Communications Inc. Cl A stock underperforms Thursday when compared to competitors, source:MarketWatch, summary: Shares of Charter Communications Inc. Cl A shed 0.87% to $325.91 Thursday, on what proved to be an all-around mixed trading session for the stock market,...",CHTR
210,2023-06-23,"Headline: Which companies are true LGBTQ+ allies? Figuring it out can be tricky for consumers — but here's how., source:MarketWatch, summary: Some companies say they support LGBTQ+ people, then donate to lawmakers working to roll back LGBTQ+ rights., Headline: Charter (CHTR) Launches New Program to Support Entrepreneurs, source:Yahoo, summary: Charter (CHTR) launches Let's Get Started, a new program from Spectrum Business, to guide aspiring entrepreneurs start a small business., Headline: Charter Communications Inc. Cl A stock outperforms market on strong trading day, source:MarketWatch, summary: Shares of Charter Communications Inc. Cl A inched 0.11% higher to $326.28 Friday, on what proved to be an all-around dismal trading session for the stock...",CHTR
211,2023-06-25,"Headline: TV usage drops again in May, but streaming keeps rolling, source:Seeking Alpha, summary: No summary",CHTR
212,2023-06-26,"Headline: What Does Charter Communications' Debt Look Like?, source:Benzinga, summary: No summary, Headline: Verizon: The Bull Is About To Strike, source:SeekingAlpha, summary: Verizon's low valuations, high dividend yield and continued investments in 5G, make it a good stock to own. Click here to read an analysis on VZ stock now., Headline: Charter Communications Inc. Cl A stock outperforms market on strong trading day, source:MarketWatch, summary: Shares of Charter Communications Inc. Cl A rose 3.25% to $336.88 Monday, on what proved to be an all-around rough trading session for the stock market, with..., Headline: Bullish Two Hundred Day Moving Average Cross - CHTR, source:Market News Video, summary: No summary",CHTR
213,2023-06-27,"Headline: Tracking William Nygren's Harris Associates Portfolio - Q1 2023 Update, source:SeekingAlpha, summary: Harris Associates' 13F portfolio value increased from $52.56B to $55.60B in Q1 2023. Click here for a detailed review., Headline: Charter Communications: Net Adds Should Pick Up, Valuation Is Attractive, source:SeekingAlpha, summary: Charter Communications' internet net adds have been under pressure due to fixed wireless access competition. Click here to read an analysis on CHTR stock., Headline: Do Options Traders Know Something About Charter Communications (CHTR) Stock We Don't?, source:Yahoo, summary: Investors need to pay close attention to Charter Communications (CHTR) stock based on the movements in the options market lately., Headline: Charter Communications Inc. Cl A stock rises Tuesday, outperforms market, source:MarketWatch, summary: Shares of Charter Communications Inc. Cl A rose 5.03% to $353.84 Tuesday, on what proved to be an all-around positive trading session for the stock market,..., Headline: Comcast (CMCSA) Plans to Bring Xfinity 10G Network in Duvall, source:Yahoo, summary: Comcast (CMCSA) announces its plans to bring high-speed Internet services to homes and businesses of Duvall, thereby expanding its footprint.",CHTR
214,2023-06-28,"Headline: Charter Communications Inc. Cl A stock rises Wednesday, outperforms market, source:MarketWatch, summary: Shares of Charter Communications Inc. Cl A advanced 1.57% to $359.39 Wednesday, on what proved to be an all-around poor trading session for the stock market,...",CHTR
215,2023-06-29,"Headline: Weitz Partners III Opportunity Fund Q1 2023 Commentary, source:SeekingAlpha, summary: The Partners III Opportunity Fund's Institutional Class returned +3.06% in the first quarter of 2023 compared to +7.18% for the Russell 3000., Headline: Looking At Charter Communications's Recent Unusual Options Activity, source:Benzinga, summary: No summary, Headline: Charter Communications Inc. Cl A stock outperforms competitors on strong trading day, source:MarketWatch, summary: Shares of Charter Communications Inc. Cl A inched 0.92% higher to $362.68 Thursday, on what proved to be an all-around great trading session for the stock...",CHTR
216,2023-06-30,"Headline: Charter Communications Inc. Cl A stock underperforms Friday when compared to competitors despite daily gains, source:MarketWatch, summary: Shares of Charter Communications Inc. Cl A advanced 1.29% to $367.37 Friday, on what proved to be an all-around great trading session for the stock market,..., Headline: SPECTRUM PARTNERS WITH OVATION TV TO SUPPORT PARK PLAYHOUSE/PLAYHOUSE STAGE COMPANY WITH $10,000 STAND FOR THE ARTS AWARD, source:Yahoo, summary: At Park Playhouse/Playhouse Stage Company's 35th anniversary gala, Spectrum presented a $10,000 award as part of the Stand for the Arts Awards initiative in partnership with Ovation TV. The initiative aims to recognize local arts, cultural, and educational organizations in the community. Since its inception in 2017, Ovation TV and Spectrum have awarded a total of $600,000 in 60 awards, providing support towards arts education., Headline: The Chart Master thinks this communication stock could be a 2023 winner, source:CNBC, summary: Carter Worth, Worth Charting, joins 'Fast Money' to talk the markets for the second half of the year and his predicted stock winners., Headline: Why Charter Communications Stock Was Soaring This Week, source:Yahoo, summary: This might be a key catalyst for the market to realize the value in Charter's discounted stock price.",CHTR
217,2023-07-01,"Headline: Wall Street Breakfast: What Moved Markets, source:SeekingAlpha, summary: Listen on the go! A daily podcast of Wall Street Breakfast will be available this morning on Seeking Alpha, iTunes, Stitcher and Spotify.",CHTR
218,2023-07-02,"Headline: The 7 Most Undervalued Buffett Stocks to Buy Now: June 2023, source:Yahoo, summary: Plenty of investors are interested in the stocks that legendary investor Warren Buffett has selected for the Berkshire Hathaway (NYSE:BRK-A, NYSE:BRK-B) equity portfolio. However, instead of buying every single stock in this category, you may want to focus mainly on the undervalued Buffett stocks instead. Alongside the scores of “wonderful companies at a fair price” style investments held by Buffett’s firm, such as its large stakes in American Express (NYSE:AXP), Apple (NASDAQ:AAPL) and Coca-Col",CHTR
219,2023-07-03,"Headline: Charter stock on track to dial up longest winning streak in 22 months, source:MarketWatch, summary: Shares of Charter Communications Inc. were ahead 0.6% in Monday morning action, putting the stock on track to rise for its seventh session in a row. A..., Headline: The 3 Best Stocks to Invest in Before Biden’s Broadband Plan Takes Off, source:Yahoo, summary: As part of the Infrastructure Investment and Jobs Act, President Joe Biden has kicked off more than $42 billion to accelerate high-speed internet access, thus boding well for so-called Biden broadband stocks. According to CNBC, the effort aims to provide the aforementioned access to every American household by 2030. To be sure, the Biden Administration has courted fierce criticism, even among Democrats. However, it’s difficult to deny the White House’s policy impact on stocks. Following a tumult",CHTR
220,2023-07-05,"Headline: Cable One added to Q3 2023 Tactical Ideas List at Wells Fargo, source:Thefly.com, summary: No summary, Headline: Charter to Hold Webcast to Discuss Second Quarter 2023 Financial and Operating Results, source:Yahoo, summary: Charter Communications, Inc. (NASDAQ: CHTR) (the ""Company"" or ""Charter"") will host a webcast on Friday, July 28, 2023 at 8:30 a.m. Eastern Time (ET) to discuss financial and operating results for the quarter ended June 30, 2023. A press release reporting such results will be issued at 7:00 a.m. ET that day., Headline: Charter Communications Inc. Cl A stock outperforms market despite losses on the day, source:MarketWatch, summary: Shares of Charter Communications Inc. Cl A slid 0.15% to $367.65 Wednesday, on what proved to be an all-around dismal trading session for the stock market,...",CHTR
221,2023-07-06,"Headline: Charter Communications Inc. Cl A stock outperforms market on strong trading day, source:MarketWatch, summary: Shares of Charter Communications Inc. Cl A advanced 1.12% to $371.77 Thursday, on what proved to be an all-around rough trading session for the stock market,...",CHTR
222,2023-07-07,"Headline: 10 Communication Services Stocks With Whale Alerts In Today's Session, source:Benzinga, summary: No summary, Headline: Charter Communications Inc. Cl A stock outperforms competitors on strong trading day, source:MarketWatch, summary: Shares of Charter Communications Inc. Cl A inched 0.05% higher to $371.94 Friday, on what proved to be an all-around grim trading session for the stock..., Headline: Charter filings indicate buybacks slowing, says Citi, source:Thefly.com, summary: No summary",CHTR
223,2023-07-08,"Headline: Charter Communications (CHTR) Receives a Hold from Citi, source:TipRanks, summary: No summary",CHTR
224,2023-07-10,"Headline: Charter Communications Inc. Cl A stock rises Monday, still underperforms market, source:MarketWatch, summary: Shares of Charter Communications Inc. Cl A inched 0.16% higher to $372.54 Monday, on what proved to be an all-around favorable trading session for the stock..., Headline: Charter will offer a cheaper, sports-lite cable TV option to reflect changing landscape, source:CNBC, summary: Charter Communications said it's revamping its cable TV model, allowing customers to opt into a cheaper, sports-lite package. ",CHTR
225,2023-07-11,"Headline: Charter Communications Introduces New Cable TV Packages to Compete with Streaming Services, Focuses on Sports Networks, source:Benzinga, summary: No summary, Headline: Amazon Analysts Estimate Deeper Discounts On Prime Day, Meta Platforms Threads App Can Generate Annual Sales Of $8B In 2 years, Uber's CFO Departs: Today's Top Stories, source:Benzinga, summary: No summary, Headline: Charter Communications Inc. Cl A stock outperforms market on strong trading day, source:MarketWatch, summary: Shares of Charter Communications Inc. Cl A rallied 2.06% to $380.23 Tuesday, on what proved to be an all-around positive trading session for the stock...",CHTR
226,2023-07-12,"Headline: Charter Communications Inc. Cl A stock rises Wednesday, still underperforms market, source:MarketWatch, summary: Shares of Charter Communications Inc. Cl A inched 0.65% higher to $382.72 Wednesday, on what proved to be an all-around great trading session for the stock..., Headline: Charter Communications Unusual Options Activity, source:Benzinga, summary: No summary",CHTR
227,2023-07-13,"Headline: September 1st Options Now Available For Charter Communications (CHTR), source:Stock Options Channel, summary: No summary, Headline: Charter Communications Inc. Cl A stock rises Thursday, still underperforms market, source:MarketWatch, summary: Shares of Charter Communications Inc. Cl A inched 0.24% higher to $383.62 Thursday, on what proved to be an all-around great trading session for the stock...",CHTR
228,2023-07-14,"Headline: Charter Communications Inc. Cl A stock underperforms Friday when compared to competitors, source:MarketWatch, summary: Shares of Charter Communications Inc. Cl A slid 2.12% to $375.47 Friday, on what proved to be an all-around mixed trading session for the stock market, with..., Headline: Frontier Communications Stock Will Get a Big Boost From High-Speed Internet, source:MarketWatch, summary: Three years after a bankruptcy filing, Frontier Communications plans to connect 10 million locations to its fiberoptic network., Headline: Buy Frontier Communications Stock. High-Speed Internet Will Boost Shares. , source:MarketWatch, summary: Three years after a bankruptcy filing, Frontier Communications plans to connect 10 million locations to its fiberoptic network.",CHTR
229,2023-07-15,"Headline: Are Investors Undervaluing Charter Communications, Inc. (NASDAQ:CHTR) By 34%?, source:Yahoo, summary: Key Insights Using the 2 Stage Free Cash Flow to Equity, Charter Communications fair value estimate is US$567 Charter...",CHTR
230,2023-07-16,"Headline: Charter Communications Inc. Cl A stock falls Monday, underperforms market, source:MarketWatch, summary: No summary",CHTR
231,2023-07-17,"Headline: Charter Communications Inc. Cl A stock underperforms Tuesday when compared to competitors despite daily gains, source:MarketWatch, summary: No summary",CHTR
232,2023-07-18,"Headline: Calix, Harmonic remain Jefferies' favorite broadband plays, source:Thefly.com, summary: No summary, Headline: CHTR October 20th Options Begin Trading, source:Stock Options Channel, summary: No summary, Headline: Notable Wednesday Option Activity: CHTR, CMA, MOS, source:Stock Options Channel, summary: No summary, Headline: Charter Communications Inc. Cl A stock outperforms market on strong trading day, source:MarketWatch, summary: No summary",CHTR
233,2023-07-19,"Headline: A Closer Look At Charter Communications, Inc.'s (NASDAQ:CHTR) Impressive ROE, source:Yahoo, summary: Many investors are still learning about the various metrics that can be useful when analysing a stock. This article is..., Headline: Charter Communications Inc. Cl A stock rises Thursday, outperforms market, source:MarketWatch, summary: No summary",CHTR
234,2023-07-20,"Headline: Earnings week ahead: Microsoft, Google, Meta, Boeing, Coca-Cola and more, source:Seeking Alpha, summary: No summary, Headline: Charter Communications Inc. Cl A stock outperforms competitors despite losses on the day, source:MarketWatch, summary: No summary",CHTR
235,2023-07-21,"Headline: SiriusXM Stock Drops After Surge. What’s to Blame., source:MarketWatch, summary: Stock in the satellite radio operator soared 42% Thursday as a result of a short squeeze., Headline: Analysts Estimate Charter Communications (CHTR) to Report a Decline in Earnings: What to Look Out for, source:Yahoo, summary: Charter (CHTR) doesn't possess the right combination of the two key ingredients for a likely earnings beat in its upcoming report. Get prepared with the key expectations.",CHTR
236,2023-07-23,"Headline: Charter Communications Inc. Cl A stock rises Monday, outperforms market, source:MarketWatch, summary: No summary",CHTR
