,date,information,related
61,2022-12-14,"Headline: U.S. stocks snap 2-day winning streak after Fed hikes interest rates by 50 basis points, signals peak rates might not be far away, source:MarketWatch, summary: Stocks finish lower on Wednesday after the Federal Reserve fires off a 50 basis point rate increase and signals that rates could eclipse 5% next year., Headline: S&P, Nasdaq, Dow futures drift as markets await the Fed decision, source:Seeking Alpha, summary: No summary, Headline: Charter price target lowered to $541 from $551 at Credit Suisse, source:Thefly.com, summary: No summary, Headline: Hot Stocks: RNA surges on clinical data; CHTR falls on spending plan; AAP sets 52-week low, source:Seeking Alpha, summary: No summary, Headline: Charter price target lowered to $460 from $480 at RBC Capital, source:Thefly.com, summary: No summary, Headline: Charter price target lowered to $649 from $670 at Cowen, source:Thefly.com, summary: No summary, Headline: Charter Communications, iQIYI, QuantumScape among premarket losers` pack, source:Seeking Alpha, summary: No summary, Headline: Premarket Movers: Charter Communications, Delta Air, Datadog, source:MarketWatch, summary: With U.S. stock markets set to open in two hours, (DAL) was up 4.7% in pre-market trading, and (DDOG) was up 4.4%. (PLUG), (HESM), and (CNQ) were all posting..., Headline: Fly Intel: Pre-market Movers, source:Thefly.com, summary: No summary, Headline: Charter Communications Tanks on Massive CapEx Plans, source:TipRanks, summary: No summary, Headline: S&P, Nasdaq, and Dow trade cautiously as markets await the Fed decision, source:Seeking Alpha, summary: No summary, Headline: S&P, Nasdaq, and Dow tick higher as markets await the Fed decision, source:Seeking Alpha, summary: No summary, Headline: Charter sinks after detailing spending plans to update network, source:Thefly.com, summary: No summary, Headline: Video: S&P 500 Movers: CHTR, ANSS, source:Market News Video, summary: No summary, Headline: Video: Nasdaq 100 Movers: CHTR, DOCU, source:Market News Video, summary: No summary, Headline: Charter dips 12% as analysts react to expensive network upgrade strategy, source:Seeking Alpha, summary: No summary, Headline: What You Missed On Wall Street This Morning, source:Thefly.com, summary: No summary, Headline: High-speed internet upgrade spending sinking this cable stock, source:Thefly.com, summary: No summary, Headline: Charter Stock Slumps on Plans to Boost Network Capital Spending, source:MarketWatch, summary: The cable company is going to step up its spending to boost network speeds as competition picks up., Headline: Charter Earmarks $5.5B On Internet Speed Upgrade: Report, source:Yahoo, summary: Leading U.S. cable TV provider Charter Communications, Inc (NASDAQ: CHTR) looks to spend $5.5 billion on its network to introduce higher-speed broadband connections. The overhaul will likely cost about $100 per home passed and will be over by the end of 2024, CEO Chris Winfrey said at an investor event, Bloomberg reports. Cable, phone, and satellite companies contested for $100 billion in federal funds to expand broadband service to poorer and more rural parts of the country. Also Read: Wireless, Headline: Stocks making the biggest moves midday: SoFi Technologies, Charter Communications, Delta and more, source:CNBC, summary: These are the stocks posting the largest moves midday., Headline: Midday movers: Delta Air Lines, Aspen Group, Charter Communications and more, source:Yahoo, summary: By Liz Moyer, Headline: Charter Falls Most Since 2020 as Spending Alarms Wall Street, source:Yahoo, summary: (Bloomberg) -- Charter Communications Inc. stock saw its biggest percentage drop in more than two years after announcing a large-scale broadband expansion plan that will cost far more than analysts anticipated.Most Read from BloombergApple to Allow Outside App Stores in Overhaul Spurred by EU LawsMusk Loses World’s Richest Title to Arnault With Tesla UnwindingWho Is Bernard Arnault, the World’s Richest Person?Tesla Stock Has Never Been This Cheap — And It Could Still Drop FurtherElon Musk Is Rui, Headline: Delta, Kymera rise; Charter, ABM Industries fall, source:Associated Press, The, summary: No summary, Headline: Charter Stock Dives On Higher Capital Spending While Supplier Harmonic Gains, source:Yahoo, summary: Shares in Charter Communications tumbled on its plans to hike capital spending while network equipment supplier Harmonic jumped on the news., Headline: Charter Communications Inc. Cl A stock falls Wednesday, underperforms market, source:MarketWatch, summary: Shares of Charter Communications Inc. Cl A tumbled 16.38% to $328.34 Wednesday, on what proved to be an all-around rough trading session for the stock..., Headline: Why Harmonic Stock Is Skyrocketing Today, source:Yahoo, summary: News from a key customer has Harmonic shares soaring, and the stock is now up roughly 24% year to date., Headline: Charter: Market Is Wrong To Panic After Investor Day, source:SeekingAlpha, summary: The Charter Communications, Inc. news was a one-off increase in capital expenditures during 2023-25; investors are wrong to panic. Click here for more on CHTR., Headline: Charter's Network Upgrade Impressive, While Capex Likely To Hurt FCF & Buybacks, Analysts Say, source:Yahoo, summary: RBC Capital analyst Kutgun Maral reiterated Outperform on Charter Communications, Inc (NASDAQ: CHTR) and reduced the price target from $480 to $460. Charter's investor meeting provided an attractive outlook for its network evolution, footprint expansion, converged go-to-market strategy, and efforts around improving the customer experience. The target cost to upgrade the network and penetration of early rural builds impressed the analyst. However, the impact on broadband subscriber growth and ARP, Headline: Why Charter Communications Is Plummeting 14% Today, source:Yahoo, summary: Steady telecom stocks don't often make moves as big as these, but Charter's investor day presentation left investors worried about its high spending., Headline: Charter stock heads for worst day on record as spending plans spook Wall Street, source:Yahoo, summary: Charter Communications Inc. has big spending plans, and that has some investors heading for the hills, Headline: Charter Communications stock dives after reports of increasing capital spending, source:Yahoo, summary: Yahoo Finance Live examines shares of Charter Communications following recent headlines of its capital spending push.",CHTR
62,2022-12-15,"Headline: Wall Street Breakfast December 15: Musk Sells More Tesla Stock (Podcast), source:SeekingAlpha, summary: Musk sells nearly $3.6B more in Tesla stock. Citigroup to exit consumer banking business in China. Microsoft sets new investment in $3B silicon battery startup., Headline: Charter Communications: Investor Day Capex Angst Might Present Buying Opportunity, source:SeekingAlpha, summary: Charter Communications fell by 16.38% yesterday after investor day which set out a $10.65B capex plan. See why CHTR is a hold for current long-term investors., Headline: Liberty Broadband: Charter`s Capex Plan Opens Up Risks And Possibilities, source:Seeking Alpha, summary: No summary, Headline: Liberty Broadband: Charter's Capex Plan Opens Up Risks And Possibilities, source:SeekingAlpha, summary: Liberty Broadband has a 26% stake in Charter Communications. Click here to know how Charter's Investor Day impacted Liberty stock., Headline: Why Is Charter Communications (CHTR) Stock Trending Today?, source:InvestorPlace, summary: No summary, Headline: Will Broadband Stocks Keep Leading the Nasdaq Lower?, source:Yahoo, summary: The Nasdaq Composite (NASDAQINDEX: ^IXIC) lost its upward momentum on Wednesday afternoon, as the latest announcement from the Federal Reserve on interest rates took the wind out of the stock index's sails.  One area of the market that notably weighed on the Nasdaq's performance was the broadband industry.  Given the announcement that Charter Communications (NASDAQ: CHTR) made regarding its business prospects, the question investors are asking is whether the broadband industry will see its future performance suffer as it strives to keep up with the pace of innovation in entertainment and communications., Headline: Charter Communications Inc. Cl A stock falls Thursday, underperforms market, source:MarketWatch, summary: Shares of Charter Communications Inc. Cl A slid 4.54% to $313.43 Thursday, on what proved to be an all-around poor trading session for the stock market, with...",CHTR
63,2022-12-16,"Headline: Verizon, AT&T, Comcast, and T-Mobile: A Peek at 2023 for Telecom, source:MarketWatch, summary: T-Mobile stock stands out for earnings and cash-flow growth. Verizon and AT&T are cheap stocks, but have big investment years ahead of them., Headline: Charter Communications Inc. Cl A stock underperforms Friday when compared to competitors, source:MarketWatch, summary: Shares of Charter Communications Inc. Cl A slipped 2.70% to $304.96 Friday, on what proved to be an all-around poor trading session for the stock market,...",CHTR
64,2022-12-17,"Headline: Wall Street Breakfast: What Moved Markets, source:SeekingAlpha, summary: Listen on the go! A daily podcast of Wall Street Breakfast will be available this morning on Seeking Alpha, iTunes, Stitcher and Spotify., Headline: Streaming ramps up its share of TV usage in November, source:Seeking Alpha, summary: No summary",CHTR
65,2022-12-21,"Headline: Charter Communications Inc. Cl A stock outperforms competitors on strong trading day, source:MarketWatch, summary: Shares of Charter Communications Inc. Cl A rallied 3.90% to $321.34 Wednesday, on what proved to be an all-around great trading session for the stock market,..., Headline: Charter Communications Is Investing for Growth, source:Yahoo, summary: The cable operator plans on investing heavily for higher connectivity speeds, Headline: Charter Communications gets mild lift following Wells Fargo upgrade, source:Seeking Alpha, summary: No summary",CHTR
66,2022-12-22,"Headline: Charter Communications a new short idea at Hedgeye, source:Seeking Alpha, summary: No summary, Headline: Interesting CHTR Put And Call Options For February 2023, source:Stock Options Channel, summary: No summary, Headline: Noteworthy Thursday Option Activity: CHTR, AAPL, ENPH, source:Stock Options Channel, summary: No summary, Headline: What You Missed On Wall Street On Friday, source:Thefly.com, summary: No summary",CHTR
67,2022-12-23,"Headline: Charter upgraded to Equal Weight from Underweight at Wells Fargo, source:Thefly.com, summary: No summary, Headline: Street Wrap: Today`s Top Upgrades, Downgrades, Initiations, source:Thefly.com, summary: No summary, Headline: What You Missed On Wall Street This Morning, source:Thefly.com, summary: No summary, Headline: Final Trades: KLA Corp., Charter & more, source:CNBC, summary: The ""Halftime Report"" traders give their top picks to watch for the second half., Headline: Charter Communications Inc. Cl A stock outperforms competitors on strong trading day, source:MarketWatch, summary: Shares of Charter Communications Inc. Cl A rose 3.10% to $333.92 Friday, on what proved to be an all-around great trading session for the stock market, with...",CHTR
68,2022-12-24,"Headline: Wall Street Breakfast: What Moved Markets, source:SeekingAlpha, summary: Listen on the go! A daily podcast of Wall Street Breakfast will be available this morning on Seeking Alpha, iTunes, Stitcher and Spotify.",CHTR
69,2022-12-26,"Headline: Should You Be Excited About Charter Communications, Inc.'s (NASDAQ:CHTR) 51% Return On Equity?, source:Yahoo, summary: Many investors are still learning about the various metrics that can be useful when analysing a stock. This article is..., Headline: Comcast: Wireless Is A Major Threat And A Key Opportunity, source:SeekingAlpha, summary: Comcast is currently largely maintaining its current approach to broadband pricing and strategy. Read more to see why I rate CMCSA stock a hold.",CHTR
70,2022-12-27,"Headline: Charter's (CHTR) Slow Internet Customer Growth Impacts Prospects, source:Yahoo, summary: Charter Communications (CHTR) is expanding operations in the rural area to boost prospects and fend off competition., Headline: Charter Communications Inc. Cl A stock falls Tuesday, still outperforms market, source:MarketWatch, summary: Shares of Charter Communications Inc. Cl A sank 0.34% to $332.79 Tuesday, on what proved to be an all-around mixed trading session for the stock market, with..., Headline: 11 Best Streaming Stocks To Buy Now, source:Yahoo, summary: In this article, we will discuss the 11 Best Streaming Stocks To Buy Now. You can skip our industry analysis and go directly to the 5 Best Streaming Stocks To Buy Now. Almost every three decades, Hollywood undergoes a complete transformation. The shift from silent movies to talkies in the 1920s, the boom of broadcast […]",CHTR
71,2022-12-28,"Headline: Tracking William Nygren`s Harris Associates Portfolio - Q3 2022 Update, source:Seeking Alpha, summary: No summary, Headline: Charter Communications Inc. Cl A stock outperforms market despite losses on the day, source:MarketWatch, summary: Shares of Charter Communications Inc. Cl A dropped 0.14% to $332.34 Wednesday, on what proved to be an all-around grim trading session for the stock market,..., Headline: Tracking William Nygren's Harris Associates Portfolio - Q3 2022 Update, source:SeekingAlpha, summary: Harris Associatesâ 13F portfolio value decreased from $62.85B to $59.68B this quarter. Click to read an update on the portfolio's trades for Q3 2022., Headline: Noteworthy Thursday Option Activity: CHTR, WDAY, GT, source:Stock Options Channel, summary: No summary, Headline: Compounders And Dividends: 2023 Portfolio Goals, source:SeekingAlpha, summary: I look at my updated top 10 holdings and highlight some Compounder names I'm looking to add in 2023. Click here to learn more about these stocks.",CHTR
72,2022-12-29,"Headline: 2022 was tough for media stocks like Netflix and Disney, and 2023 doesn't look good, either, source:CNBC, summary: Netflix, Disney, Paramount and others lost billions in market value in 2022 as streaming subscriber growth slowed and the ad market tightened. , Headline: Tesla is not alone: 18 (and a half) other big stocks are headed for their worst year on record, source:MarketWatch, summary: No summary, Headline: Charter Communications Inc. Cl A stock underperforms Thursday when compared to competitors despite daily gains, source:MarketWatch, summary: Shares of Charter Communications Inc. Cl A rallied 1.99% to $338.94 Thursday, on what proved to be an all-around great trading session for the stock market,..., Headline: Tesla is not alone: 20 (and a half) other big stocks had their worst year on record, source:MarketWatch, summary: In the worst year for stocks since the Great Recession, several big names are headed for their worst year on record with just one trading day left in 2022., Headline: Tesla is not alone: 18 (and a half) other big stocks are headed for their worst year on record, source:Yahoo, summary: In the worst year for stocks since the Great Recession, several big names are headed for their worst year on record with just one trading day left in 2022.",CHTR
73,2022-12-30,"Headline: Charter Communications Inc. Cl A stock underperforms Friday when compared to competitors despite daily gains, source:MarketWatch, summary: Shares of Charter Communications Inc. Cl A inched 0.05% higher to $339.10 Friday, on what proved to be an all-around poor trading session for the stock..., Headline: Tesla is not alone: 20 (and a half) other big stocks had their worst year on record, source:Yahoo, summary: In the worst year for stocks since the Great Recession, several big names are headed for their worst year on record with just one trading day left in 2022.",CHTR
74,2022-12-31,"Headline: Snap, Sea, Roblox led decliners in Communications stocks` rough 2022, source:Seeking Alpha, summary: No summary",CHTR
75,2023-01-01,"Headline: 3 Top Bounce-Back Stocks for 2023, source:Yahoo, summary: Many stocks deserved their big declines in 2022, but even high-quality stocks sold off in the downturn. Buy them., Headline: Cable Stocks Are Tough to Own (Again) for a Whole New Reason, source:Yahoo, summary: The cord-cutting movement has certainly proven frustrating for cable television companies.  There's been some solace in the fact, however, that growth of cable companies' broadband businesses has offset this sweeping attrition of their cable TV customers.",CHTR
76,2023-01-03,"Headline: Charter Communications Inc. Cl A stock outperforms competitors on strong trading day, source:MarketWatch, summary: Shares of Charter Communications Inc. Cl A inched 0.73% higher to $341.58 Tuesday, on what proved to be an all-around rough trading session for the stock...",CHTR
77,2023-01-04,"Headline: Compounders And Dividends: December 2022 Portfolio Update, source:Seeking Alpha, summary: No summary, Headline: Bullish insiders at Charter Communications, Inc. (NASDAQ:CHTR) loaded up on US$12m of stock earlier this year, source:Yahoo, summary: Multiple insiders secured a larger position in Charter Communications, Inc. ( NASDAQ:CHTR ) shares over the last 12..., Headline: Charter Communications Inc. Cl A stock outperforms market on strong trading day, source:MarketWatch, summary: Shares of Charter Communications Inc. Cl A advanced 3.64% to $354.00 Wednesday, on what proved to be an all-around positive trading session for the stock..., Headline: Charter to Hold Webcast to Discuss Fourth Quarter and Full Year 2022 Financial and Operating Results, source:Yahoo, summary: Charter Communications, Inc. (NASDAQ: CHTR) (the ""Company"" or ""Charter"") will host a webcast on Friday, January 27, 2023 at 8:30 a.m. Eastern Time (ET) to discuss financial and operating results for the quarter and year ended December 31, 2022. A press release reporting such results will be issued at 7:00 a.m. ET that day., Headline: nan, source:CNBC, summary: Cox Communications plans to announce the national launch of Cox Mobile for its customers at the Consumer Electronics Show on Thursday. ",CHTR
78,2023-01-05,"Headline: Xumo Enterprise Unveils Expanded Suite of Solutions for Building, Managing and Monetizing Fast Channels and Services, source:Yahoo, summary: PHILADELPHIA, January 05, 2023--XUMO ENTERPRISE UNVEILS EXPANDED SUITE OF SOLUTIONS FOR BUILDING, MANAGING AND MONETIZING FAST CHANNELS AND SERVICES, Headline: Xumo Expands Smart TV Portfolio With Element Line of 4K Ultra HD TVs In 2023, source:Yahoo, summary: PHILADELPHIA & WINSBORO, S.C., January 05, 2023--XUMO EXPANDS SMART TV PORTFOLIO WITH ELEMENT LINE OF 4K ULTRA HD TVS IN 2023",CHTR
79,2023-01-06,"Headline: Charter Communications Inc. Cl A stock rises Friday, still underperforms market, source:MarketWatch, summary: Shares of Charter Communications Inc. Cl A rose 1.74% to $367.73 Friday, on what proved to be an all-around great trading session for the stock market, with...",CHTR
80,2023-01-08,"Headline: Is There An Opportunity With Charter Communications, Inc.'s (NASDAQ:CHTR) 34% Undervaluation?, source:Yahoo, summary: Today we will run through one way of estimating the intrinsic value of Charter Communications, Inc. ( NASDAQ:CHTR ) by...",CHTR
81,2023-01-09,"Headline: Charter Communications Inc. Cl A stock falls Monday, underperforms market, source:MarketWatch, summary: Shares of Charter Communications Inc. Cl A dropped 0.15% to $367.18 Monday, on what proved to be an all-around dismal trading session for the stock market,...",CHTR
82,2023-01-10,"Headline: Is Liberty Broadband Corporation (LBRDA) Trading at a Discount?, source:Yahoo, summary: Oakmark Funds, an investment management company, released its “Oakmark Select Fund” fourth quarter 2022 investor letter. A copy of the same can be downloaded here. The fund returned 4.7% in the fourth quarter compared to a 7.6% return for the S&P 500 Index. For the full year 2022, the fund returned -22.7% compared to the -18.1% […], Headline: Are Options Traders Betting on a Big Move in Charter Communications (CHTR) Stock?, source:Yahoo, summary: Investors need to pay close attention to Charter Communications (CHTR) stock based on the movements in the options market lately., Headline: Charter Communications Inc. Cl A stock underperforms Tuesday when compared to competitors despite daily gains, source:MarketWatch, summary: Shares of Charter Communications Inc. Cl A rallied 2.03% to $374.64 Tuesday, on what proved to be an all-around great trading session for the stock market,...",CHTR
83,2023-01-11,"Headline: Charter Communications Inc. Cl A stock rises Wednesday, still underperforms market, source:MarketWatch, summary: Shares of Charter Communications Inc. Cl A advanced 1.01% to $378.43 Wednesday, on what proved to be an all-around great trading session for the stock..., Headline: Oakmark Select Fund: Fourth Quarter 2022 Commentary, source:SeekingAlpha, summary: The Oakmark Select Fund generated a 4.7% return in the fourth quarter 2022. Click here to read the full fund letter., Headline: Oakmark Equity And Income Fund: Fourth Quarter 2022 Commentary, source:SeekingAlpha, summary: The Equity and Income Fund increased 7.2% in Q4 vs. a 6.4% increase for the Lipper Balanced Fund Index. Click here to read the full fund letter.",CHTR
84,2023-01-12,"Headline: The Return Trends At Charter Communications (NASDAQ:CHTR) Look Promising, source:Yahoo, summary: If you're looking for a multi-bagger, there's a few things to keep an eye out for. Typically, we'll want to notice a..., Headline: Charter Communications Inc. Cl A stock rises Thursday, outperforms market, source:MarketWatch, summary: Shares of Charter Communications Inc. Cl A rose 1.86% to $385.47 Thursday, on what proved to be an all-around favorable trading session for the stock market,...",CHTR
85,2023-01-17,"Headline: Charter Communications Inc. Cl A stock outperforms market despite losses on the day, source:MarketWatch, summary: Shares of Charter Communications Inc. Cl A sank 0.03% to $388.35 Tuesday, on what proved to be an all-around dismal trading session for the stock market,...",CHTR
86,2023-01-20,"Headline: Earnings Preview: Charter Communications (CHTR) Q4 Earnings Expected to Decline, source:Yahoo, summary: Charter (CHTR) doesn't possess the right combination of the two key ingredients for a likely earnings beat in its upcoming report. Get prepared with the key expectations., Headline: Warner Bros. Discovery: Loser In The Profit Stakes, Better Alternatives Exist, source:SeekingAlpha, summary: Warner Bros. Discovery, Inc. lags behind its competitors in the race for profitability and has a high debt load. Click here for our analysis of WBD.",CHTR
87,2023-01-21,"Headline: ClearBridge Large Cap Value Strategy Q4 2022 Portfolio Manager Commentary, source:SeekingAlpha, summary: The ClearBridge Large Cap Value Strategy outperformed its Russell 1000 Value Index benchmark during Q4 2022. Click here to read the full fund letter.  ",CHTR
88,2023-01-22,"Headline: Tesla, AT&T, Visa, Chevron, Microsoft, and More Stocks to Watch This Week, source:MarketWatch, summary: Earnings releases will include Microsoft, Johnson & Johnson, General Electric, Verizon, Lockheed Martin, Tesla, AT&T, Boeing, Comcast, Intel, Visa, and Chevron.",CHTR
89,2023-01-23,"Headline: Charter Communications: Playing A Long-Term Game, But The Stock Has Limited Upside, source:SeekingAlpha, summary: Charter's shares plunged after intense competition and rising CapEx concerned investors. While CHTR stock has bottomed up, read why we rate it a Hold.",CHTR
90,2023-01-24,"Headline: What Does Charter Communications, Inc.'s (NASDAQ:CHTR) Share Price Indicate?, source:Yahoo, summary: Today we're going to take a look at the well-established Charter Communications, Inc. ( NASDAQ:CHTR ). The company's..., Headline: Charter (CHTR) to Report Q4 Earnings: What's in the Offing?, source:Yahoo, summary: Charter' (CHTR) fourth-quarter 2022 earnings are expected to have been affected by sluggish growth in the Internet subscriber base.",CHTR
91,2023-01-26,"Headline: Comcast beats expectations even as broadband growth slows, Peacock racks up losses, source:CNBC, summary: Comcast reported fourth quarter earnings before the bell, beating analyst expectations. , Headline: Comcast: Peacock Flocks And Broadband Broadsides, Creating A Mixed Earnings Report, source:SeekingAlpha, summary: Comcast's earnings report had a lot of surprises in it compared to expectations - but only some of them were good. Read more on CMCSA's earnings card here., Headline: Charter Communications: The Path of Least Resistance Is Higher, source:Yahoo, summary: Charter Communications is a leading broadband connectivity company and cable operator which is reporting quarterly earnings on Friday. Let's check out the ""speed"" of the charts and indicators. In the daily bar chart of CHTR, below, I see that the shares made lows in October and December.",CHTR
