,date,information,related
0,2020-08-06,"Headline: 10 Biggest Telecommunications Companies, source:Yahoo, summary: With AT&T leading the pack, these are the 10 biggest telecommunications companies by 12-month trailing revenue.",CHTR
1,2022-06-28,"Headline: Are You a Value Investor? This 1 Stock Could Be the Perfect Pick, source:Yahoo, summary: The Zacks Style Scores offers investors a way to easily find top-rated stocks based on their investing style. Here's why you should take advantage.",CHTR
2,2022-09-23,"Headline: Charter Communications Inc. Cl A stock underperforms Friday when compared to competitors, source:MarketWatch, summary: Shares of Charter Communications Inc. Cl A shed 3.68% to $321.66 Friday, on what proved to be an all-around dismal trading session for the stock market, with..., Headline: Junk-Bond Yields Top 8%. It Could Be a Good Time to Buy. , source:MarketWatch, summary: True, a recession could be coming. But the underlying math of low defaults, solid companies with cleaned-up balance sheets, and higher yields creates an...",CHTR
3,2022-09-26,"Headline: Video: Nasdaq 100 Movers: CHTR, DOCU, source:Market News Video, summary: In early trading on Monday, shares of DocuSign (DOCU) topped the list of the day's best performing components of the Nasdaq 100 index, trading up 3.8% - Year to date, DocuSign has lost about 64.3% of its value - CHTR,DOCU., Headline: Charter Communications announces president, CEO, source:Finnhub, summary: Chris Winfrey will serve as president and CEO of Charter Communications Inc. beginning Dec. 1, according to a press release. Rutledge previously served as COO for the company.Outgoing CEO Tom... | September 26, 2022, Headline: Charter Communications : Statement of Changes in Beneficial Ownership - Form 4, source:Finnhub, summary: Ownership Submission FORM 4 Check this box if no longer... | September 26, 2022",CHTR
4,2022-09-27,"Headline: Charter price target lowered to $551 from $676 at Credit Suisse, source:Thefly.com, summary: Credit Suisse analyst Dou... CHTR, CMCSA, CMCSK, Headline: Analysts Conflicted on These Services Names: Charter Communications (CHTR) and ARAMARK Holdings (ARMK), source:TipRanks, summary: Companies in the  Services sector have received a lot of coverage today as analysts  weigh in on Charter Communications (<span class='tr-stock-ticker' style='color:..., Headline: 12 Best Communication Stocks To Invest In, source:Yahoo, summary: In this article, we discuss 12 best communication stocks to invest in. If you want to read about some more communication stocks, go directly to 5 Best Communication Stocks To Invest In. The communications sector has been boosted by a macro environment of rising rates and soaring inflation since it is generally one of the […]",CHTR
5,2022-09-29,"Headline: Charter upgraded to Peer Perform from Underperform at Wolfe Research, source:Thefly.com, summary: Wolfe Research analyst Pe... CHTR, Headline: Wolfe upgrades Charter to Peer Perform, ups Cable sector rating to Market Weight, source:Thefly.com, summary: Wolfe Research analyst Pe... CHTR, Headline: What You Missed On Wall Street On Thursday, source:Thefly.com, summary: Five top five lists with the news and calls moving stocks, powered by The Fly. GM, F, HMC, NSANY, TM, TSLA, DDAIF, VWAGY, STLA, AAPL, WMB, BBBY, INTU, COIN, FSLR, CHTR, SUNL, WIX, WBD, CRM, MGM, META, SFTBY, NEOG, RAD, AMPS, NAT, OLPX, MTN, KMX, VMC, ATER, ALGT, Headline: Street Wrap: Today's Top 15 Upgrades, Downgrades, Initiations, source:Thefly.com, summary: Apple upgrade and downgrade, and Coinbase initiation among today's top calls on Wall Street AAPL, CHTR, KHC, WIX, FSLR, SUNL, OLPX, MLKN, COIN, KTRA, SNPS, RIOT, JKS, Headline: What You Missed On Wall Street This Morning, source:Thefly.com, summary: Five top five lists with the news and calls moving stocks, powered by The Fly. AAPL, WMB, BBBY, INTU, MTN, COIN, FSLR, CHTR, SUNL, WIX, WBD, CRM, SWBI, BP, MGM, NEOG, RAD, AMPS, NAT, OLPX, KMX, VMC, ALGT, ATER",CHTR
6,2022-09-30,"Headline: 10 Best Telecom Stocks to Buy Right Now, source:Yahoo, summary: In this article, we discuss 10 best telecom stocks to buy right now. If you want to read about some more telecom stocks to buy right now, go directly to 5 Best Telecom Stocks to Buy Right Now. Although cable broadband providers continue to control over 66% of the market share in the telecommunications business, […], Headline: Charter to Hold Webcast to Discuss Third Quarter 2022 Financial and Operating Results, source:Yahoo, summary: Charter Communications, Inc. (NASDAQ: CHTR) (the ""Company"" or ""Charter"") will host a webcast on Friday, October 28, 2022 at 8:30 a.m. Eastern Time (ET) to discuss financial and operating results for the quarter ended September 30, 2022. A press release reporting such results will be issued at 7:00 a.m. ET that day., Headline: AT&T, Verizon and Comcast stocks just had their worst quarter in two decades, source:Yahoo, summary: Some of the biggest telecommunications stocks just posted their steepest quarterly declines in two decades amid pressures new and old on the cable and wireless industries.",CHTR
7,2022-10-03,"Headline: BetterInvesting™ Magazine Update on Copart Inc. and Charter Communications Inc., source:Yahoo, summary: The Editorial Advisory and Securities Review Committee of BetterInvesting Magazine today announced Copart Inc. (NASDAQ: CPRT) as its ""Stock to Study"" and Charter Communications Inc. (NASDAQ: CHTR) as its ""Undervalued Stock"" in the December 2022 issue for investors' informational and educational use., Headline: Adeia initiated with an Overweight at Stephens, source:Thefly.com, summary: Stephens analyst Nicholas... ADEA, ROKU, VZIO, CMCSA, CHTR",CHTR
8,2022-10-04,"Headline: Oakmark Funds Commentary: Seek - GuruFocus.com, source:GuruFocus, summary: GuruFocus Article or News written by Sydnee Gatewood and the topic is about: By Jack Wildermuth, CFA, Headline: Charter's (CHTR) Spectrum News Beats Peers for Daily Views, source:Yahoo, summary: Charter Communications (CHTR) Spectrum news averaged 2.2 million daily views across its local linear and digital platforms outpacing its peers., Headline: Compounders And Dividends: September 2022 Portfolio Update, source:SeekingAlpha, summary: My portfolio continues to grow its monthly dividends. I will continue to be fully invested into equities in the market. Read more here., Headline: Charter Communications Inc. Cl A stock rises Tuesday, still underperforms market, source:MarketWatch, summary: Shares of Charter Communications Inc. Cl A rose 2.58% to $328.54 Tuesday, on what proved to be an all-around great trading session for the stock market, with...",CHTR
9,2022-10-05,"Headline: Street Wrap: Today's Top 15 Upgrades, Downgrades, Initiations, source:Thefly.com, summary: Walmart upgrade, Twitter downgrade and Airbnb initiation among today's top calls on Wall Street WMT, F, SIMO, MXL, CHD, SCHW, TWTR, NKE, GS, POSH, LUMN, ABNB, ADEA, CMCSA, CMCSK, ROKU, CHTR, VZIO, HRZN, SCM, ZI, Headline: Charter Communications Inc. Cl A stock rises Wednesday, outperforms market, source:MarketWatch, summary: Shares of Charter Communications Inc. Cl A inched 0.23% higher to $329.28 Wednesday, on what proved to be an all-around dismal trading session for the stock..., Headline: Is Charter Communications (CHTR) a Worthy Investment?, source:Yahoo, summary: IP Capital Partners, an investment management firm, published its second quarter 2022 investor letter – a copy of the Spanish document can be downloaded here. Following its philosophy and rationality as always, the fund consciously kept away from these niche markets. As the fear has spread, however, even the stocks of good companies have suffered […], Headline: Tracking William Nygren's Harris Associates Portfolio - Q2 2022 Update, source:SeekingAlpha, summary: Harris Associates' 13F portfolio value decreased from $75.90B to $62.85B this quarter. Read more to see about Harris Associates' holdings and trades for Q2 2022.",CHTR
10,2022-10-06,"Headline: CHARTER AWARDS $1.1 MILLION IN SPECTRUM DIGITAL EDUCATION GRANTS TO 47 ORGANIZATIONS TO ADVANCE BROADBAND TRAINING AND TECHNOLOGY, source:Yahoo, summary: Charter Communications, Inc. today announced the award of $1.1 million in Spectrum Digital Education grants to 47 nonprofits working to enhance digital education, training and technology in local communities. The latest round of grants increases Charter's overall investment in the six-year-old program to $8 million. Organizations were selected on the basis of their efforts to educate community members on the benefits of broadband in financially underserved rural and urban areas within the compan, Headline: Charter Communications Inc. Cl A stock falls Thursday, underperforms market, source:MarketWatch, summary: Shares of Charter Communications Inc. Cl A shed 1.62% to $323.95 Thursday, on what proved to be an all-around dismal trading session for the stock market,..., Headline: Charter: Unfairly Punished In September Market Correction, source:SeekingAlpha, summary: Charter shares lost 24% during the September correction, we believe unfairly, and rebounded 9% in the first three days of October. Learn why we reiterate our Buy rating on CHTR., Headline: Top 5 3rd Quarter Trades of AR - GuruFocus.com, source:GuruFocus, summary: GuruFocus Article or News written by insider and the topic is about: ",CHTR
11,2022-10-07,"Headline: Charter Communications Inc. Cl A stock falls Friday, underperforms market, source:MarketWatch, summary: Shares of Charter Communications Inc. Cl A slid 3.53% to $312.53 Friday, on what proved to be an all-around dismal trading session for the stock market, with...",CHTR
12,2022-10-09,"Headline: 3 Stocks That Could Soar When Inflation Abates and Interest Rates Moderate, source:Yahoo, summary: High inflation and the U.S. Federal Reserve's interest rate hikes in response to it have slowed economic growth.  Three Fool.com contributors think Etsy (NASDAQ: ETSY), Rackspace Technology (NASDAQ: RXT), and Charter Communications (NASDAQ: CHTR) could all benefit if inflation ebbs and interest rates settle.",CHTR
13,2022-10-10,"Headline: Charter Communications Inc. Cl A stock outperforms market on strong trading day, source:MarketWatch, summary: Shares of Charter Communications Inc. Cl A advanced 1.85% to $318.30 Monday, on what proved to be an all-around rough trading session for the stock market,...",CHTR
14,2022-10-11,"Headline: Top 5 3rd Quarter Trades of Wa - GuruFocus.com, source:GuruFocus, summary: GuruFocus Article or News written by insider and the topic is about: , Headline: Charter Communications Inc. Cl A stock underperforms Tuesday when compared to competitors, source:MarketWatch, summary: Shares of Charter Communications Inc. Cl A slipped 3.10% to $308.44 Tuesday, on what proved to be an all-around mixed trading session for the stock market,..., Headline: Jim Cramer goes over the best and worst Q3 performers in the S&P 500, source:CNBC, summary: Cramer said he wouldn't touch this stock with a 10-foot pole., Headline: Charter put volume heavy and directionally bearish, source:Thefly.com, summary: Bearish flow noted in Cha... CHTR",CHTR
15,2022-10-12,"Headline: Here’s Why Charter Communications (CHTR) Detracted in the Third Quarter, source:Yahoo, summary: Oakmark Funds, an investment management company, released its “Oakmark Fund” third quarter 2022 investor letter. A copy of the same can be downloaded here. In the third quarter, the fund returned -1.9%, outperforming the S&P 500 Index, which returned -4.9%. For the fiscal year ended September 30, 2022, the fund declined -17.7% compared to a decline […], Headline: Charter Communications Inc. Cl A stock outperforms competitors despite losses on the day, source:MarketWatch, summary: Shares of Charter Communications Inc. Cl A sank 0.69% to $306.31 Wednesday, on what proved to be an all-around dismal trading session for the stock market,..., Headline: Jim Cramer says to avoid stocks in the ‘house of pain’ Nasdaq 100 index, source:CNBC, summary: Cramer acknowledged that there are a few stocks in the index that he believes are still great, but maintained that the index is ultimately filled with ""woe."", Headline: September 2023 Options Now Available For Charter Communications, source:Stock Options Channel, summary: Staff article entitled September 2023 Options Now Available For Charter Communications, about stock options, from Stock Options Channel.",CHTR
16,2022-10-13,"Headline: Charter price target lowered to $350 from $475 at Citi, source:Thefly.com, summary: Citi analyst Michael Roll... CHTR, Headline: Charter price target lowered to $420 from $550 at Morgan Stanley, source:Thefly.com, summary: Morgan Stanley analyst Be... CHTR, Headline: Cell Tower REITs: 5G's Killer App, source:SeekingAlpha, summary: Cell Tower REITs have been slammed harder than any property sector over the past 3 months due to threats from satellite networks. See how to play the space., Headline: David Herro and Bill Nygren's  - GuruFocus.com, source:GuruFocus, summary: GuruFocus Article or News written by Sydnee Gatewood and the topic is about: Discussion of markets and holdings, Headline: Timber Creek Capital Managemen - GuruFocus.com, source:GuruFocus, summary: GuruFocus Article or News written by insider and the topic is about: , Headline: Herro and Nygren Comment on Ch - GuruFocus.com, source:GuruFocus, summary: GuruFocus Article or News written by Sydnee Gatewood and the topic is about: Guru stock highlight, Headline: Comcast Stock Is Rallying. Citi Says Cable Sector Could Improve Value After Q3., source:MarketWatch, summary: Citi analyst Michael Rollins upgraded both Comcast and rival Altice to Buy from Neutral. Comcast could unlock value by selling its stake in Hulu to Disney,..., Headline: Comcast stock rises toward best day in 20 months as Citi sees 'silver lining' in beaten-down cable names, source:MarketWatch, summary: Comcast Corp. shares were headed for their best daily performance in more than 20 months Thursday after an analyst said he saw a ""silver lining"" for maligned..., Headline: Why Charter (CHTR) is Poised to Beat Earnings Estimates Again, source:Yahoo, summary: Charter (CHTR) has an impressive earnings surprise history and currently possesses the right combination of the two key ingredients for a likely beat in its next quarterly report., Headline: Charter Communications Inc. Cl A stock outperforms competitors on strong trading day, source:MarketWatch, summary: Shares of Charter Communications Inc. Cl A advanced 6.41% to $325.94 Thursday, on what proved to be an all-around favorable trading session for the stock..., Headline: Comcast stock rises toward best day in 20 months as Citi sees ‘silver lining’ in beaten-down cable names, source:Yahoo, summary: Comcast Corp. shares were headed for their best daily performance in more than 20 months Thursday after an analyst said he saw a ""silver lining"" for maligned cable stocks.",CHTR
17,2022-10-14,"Headline: Charter Communications Inc. Cl A stock falls Friday, still outperforms market, source:MarketWatch, summary: Shares of Charter Communications Inc. Cl A shed 0.81% to $323.31 Friday, on what proved to be an all-around rough trading session for the stock market, with..., Headline: Factors Likely to Decide Snap-on's (SNA) Fate in Q3 Earnings, source:Yahoo, summary: Despite supply-chain and inflation woes, Snap-on's (SNA) Q3 performance will likely reflect gains from its RCI process and cost-reduction initiatives. Its value-creation model also bodes well.",CHTR
18,2022-10-17,"Headline: Charter Communications Inc. Cl A stock rises Monday, still underperforms market, source:MarketWatch, summary: Shares of Charter Communications Inc. Cl A rose 2.59% to $331.69 Monday, on what proved to be an all-around positive trading session for the stock market,...",CHTR
19,2022-10-18,"Headline: Charter price target lowered to $475 from $550 at Deutsche Bank, source:Thefly.com, summary: Deutsche Bank analyst Bry... CHTR, Headline: The 7 Worst Performing Warren Buffett Stocks of 2022, source:InvestorPlace, summary: While the Oracle might be the greatest investor of all time, these Warren Buffett stock picks have fallen a lot this year., Headline: Charter Communications Inc. Cl A stock falls Tuesday, underperforms market, source:MarketWatch, summary: Shares of Charter Communications Inc. Cl A slumped 0.85% to $328.87 Tuesday, on what proved to be an all-around great trading session for the stock market,...",CHTR
20,2022-10-19,"Headline: Charter Communications Inc. Cl A stock outperforms competitors despite losses on the day, source:MarketWatch, summary: Shares of Charter Communications Inc. Cl A slid 1.28% to $324.65 Wednesday, on what proved to be an all-around dismal trading session for the stock market,...",CHTR
21,2022-10-20,"Headline: Cogeco Communications downgraded to Hold from Buy at Canaccord, source:Thefly.com, summary: Canaccord analyst Aravind... CGEAF, CMCSA, CHTR, Headline: Baskin Financial Services Inc. - GuruFocus.com, source:GuruFocus, summary: GuruFocus Article or News written by insider and the topic is about: , Headline: Charter Communications Inc. Cl A stock underperforms Thursday when compared to competitors despite daily gains, source:MarketWatch, summary: Shares of Charter Communications Inc. Cl A rallied 1.07% to $328.12 Thursday, on what proved to be an all-around grim trading session for the stock market,...",CHTR
22,2022-10-21,"Headline: Charter Communications (CHTR) Reports Next Week: Wall Street Expects Earnings Growth, source:Yahoo, summary: Charter (CHTR) doesn't possess the right combination of the two key ingredients for a likely earnings beat in its upcoming report. Get prepared with the key expectations., Headline: Charter Communications Inc. Cl A stock rises Friday, still underperforms market, source:MarketWatch, summary: Shares of Charter Communications Inc. Cl A inched 0.69% higher to $330.40 Friday, on what proved to be an all-around positive trading session for the stock...",CHTR
23,2022-10-23,"Headline: Patrick Brennan's Brennan Asse - GuruFocus.com, source:GuruFocus, summary: GuruFocus Article or News written by Sydnee Gatewood and the topic is about: Discussion of markets and holdings",CHTR
24,2022-10-25,"Headline: Alphyn Capital Management Q3 2022 Letter To Investors, source:SeekingAlpha, summary: Alphyn Capital returned -10.95% net in Q3 2022 vs -4.88% for the S&P500. Click here to read the full fund letter., Headline: Charter Communications, Inc. (NASDAQ:CHTR) insiders sold US$62m worth of stock suggesting impending weakness., source:Yahoo, summary: The fact that multiple Charter Communications, Inc. ( NASDAQ:CHTR ) insiders offloaded a considerable amount of shares..., Headline: What's in Store for Charter Communications' (CHTR) Q3 Earnings?, source:Yahoo, summary: Charter Communications (CHTR) third-quarter 2022 earnings are expected to have been affected by declining internet subscribers and increasing competition in the video streaming space., Headline: Alphyn Capital - Liberty Broadband: Plenty Of Room For Growth, source:SeekingAlpha, summary: I wish I had cut the position in Liberty Broadband more aggressively last quarter. Why do I think there is plenty of room for growth for LBRDK stock? Find out.",CHTR
25,2022-10-26,"Headline: Charter Communications (CHTR) is a Top-Ranked Growth Stock: Should You Buy?, source:Yahoo, summary: The Zacks Style Scores offers investors a way to easily find top-rated stocks based on their investing style. Here's why you should take advantage., Headline: 7 Telecom Stocks to Sell Pronto Before a Painful Downturn, source:Yahoo, summary: Telecom stocks have taken a hit over the past few years. Most companies in the space have been struggling under the weight of their massive debt loads as they upgrade their infrastructure to support 5G. With the stock market expected to drop even further from current levels, it’s probably the right time to reassess your portfolios and consider these telecom stocks to sell. Granted, telecom stocks can be highly appealing to long-term investors. All thanks to attractive valuations and steady divid",CHTR
26,2022-10-27,"Headline: Comcast tops expectations as it squeezes out a small gain in broadband subscribers, source:CNBC, summary: Comcast added 14,000 new broadband customers, a slight rebound from the previous quarter, when it didn't add any broadband subscribers for the first time ever., Headline: Notable companies reporting before tomorrow's open, source:Thefly.com, summary: Notable companies reporti... XOM, CVX, ABBV, CL, CHTR, NWL, BLMN, Headline: Charter Communications Inc. Cl A stock outperforms competitors on strong trading day, source:MarketWatch, summary: Shares of Charter Communications Inc. Cl A rallied 3.01% to $355.26 Thursday, on what proved to be an all-around mixed trading session for the stock market,..., Headline: Stocks open higher, on track for 2nd weekly gain in a row, source:Associated Press, The, summary: No summary, Headline: Pivotal Research Sticks to Their Buy Rating for Charter Communications (CHTR), source:TipRanks, summary: Pivotal Research analyst Jeffrey Wlodarczak reiterated a Buy rating on Charter Communications (CHTR &#8211; Research Report) today and set a price target of $475.00..., Headline: Wallace Weitz's Hickory Fund 3 - GuruFocus.com, source:GuruFocus, summary: GuruFocus Article or News written by Sydnee Gatewood and the topic is about: Discussion of markets and holdings, Headline: Wally Weitz Comments on Charte - GuruFocus.com, source:GuruFocus, summary: GuruFocus Article or News written by Sydnee Gatewood and the topic is about: Guru stock highlight",CHTR
27,2022-10-28,"Headline: Charter reports Q3 EPS $7.38, consensus $8.23, source:Thefly.com, summary: Reports Q3 revenue $13.55... CHTR, Headline: Charter reports Q3 net cash flows from operating activities $3.8B, source:Thefly.com, summary: Compared to $4.3B in the ... CHTR, Headline: Charter: Q3 Earnings Snapshot, source:Associated Press, The, summary: No summary, Headline: Charter Communications revenue rises as mobile lines growth quickens, source:Alliance News, summary: No summary, Headline: Charter Communications, Inc. 2022 Q3 - Results - Earnings Call Presentation, source:SeekingAlpha, summary: The following slide deck was published by Charter Communications, Inc., Headline: Charter Communications, Inc. (CHTR) Q3 2022 Earnings Call Transcript, source:SeekingAlpha, summary: Charter Communications, Inc. (NASDAQ:NASDAQ:CHTR) Q3 2022 Earnings Conference Call October 28, 2022 08:30 AM ET Company Participants Stefan Anninger - Head of Investor Relations Tom..., Headline: Charter Announces Third Quarter 2022 Results, source:Yahoo, summary: Charter Communications, Inc. (along with its subsidiaries, the ""Company"" or ""Charter"") today reported financial and operating results for the three and nine months ended September 30, 2022., Headline: Charter shows growth in internet subscribers, but earnings miss, source:Yahoo, summary: Charter Communications Inc. saw an increase in its count of residential internet customers during the latest quarter, but the cable giant fell short of expectations on earnings. The company recorded third-quarter net income of $1.19 billion, or $7.38 a share, compared with $1.22 billion, or $6.69 a share, in the year-earlier period. Analysts tracked by FactSet were expecting $8.21 in earnings per share. Charter also posted adjusted earnings before interest, taxes, depreciation, and amortization, Headline: Stocks making the biggest moves midday: Apple, Amazon, Intel and more, source:CNBC, summary: These are the stocks posting the largest moves in midday trading. , Headline: Charter Communications Grows Revenue By 3% In Q3; Misses Consensus, source:Yahoo, summary: Charter Communications, Inc (NASDAQ: CHTR) reported third-quarter FY22 revenue growth of 3.1% year-on-year to $13.55 billion, missing the consensus of $13.68 billion. Revenue growth of 0.7% in Residential, 40.2% in Mobile, and 22.9% in Advertising sales drove the top-line performance. Charter added 61,000 residential Internet customers compared to 243,000 last year. Residential video customers decreased by 211,000 versus 133,000 decline in the prior year, partly driven by downgrades following an, Headline: Charter Communications Inc. Cl A stock underperforms Friday when compared to competitors despite daily gains, source:MarketWatch, summary: Shares of Charter Communications Inc. Cl A rose 3.65% to $368.24 Friday, on what proved to be an all-around positive trading session for the stock market,..., Headline: Charter (CHTR) Q3 Earnings Lag, Internet User Base Up Y/Y, source:Yahoo, summary: Charter's (CHTR) third-quarter 2022 results reflect continued growth in residential, mobile and advertising revenues., Headline: ClearBridge Large Cap Value Strategy Q3 2022 Portfolio Manager Commentary, source:SeekingAlpha, summary: The ClearBridge Large Cap Value Strategy outperformed its Russell 1000 Value Index benchmark during the third quarter. Click here to read the full fund letter.",CHTR
28,2022-10-29,"Headline: Despite delivering investors losses of 45% over the past 1 year, Charter Communications (NASDAQ:CHTR) has been growing its earnings, source:Yahoo, summary: Charter Communications, Inc. ( NASDAQ:CHTR ) shareholders should be happy to see the share price up 15% in the last..., Headline: 15 Biggest Cell Phone Companies in the World, source:Yahoo, summary: In this article, we will be taking a look at the 15 biggest cell phone companies in the world. To skip our detailed analysis, you can go directly to see the 5 biggest cell phone companies in the world. To say that the cellphone and telecommunications industry has evolved significantly over the last few decades, and […]",CHTR
