,date,information,related
86,2022-12-20,"Headline: Investors Should Be Encouraged By Cisco Systems' (NASDAQ:CSCO) Returns On Capital, source:Yahoo, summary: There are a few key trends to look for if we want to identify the next multi-bagger. In a perfect world, we'd like to..., Headline: Cisco Networking Academy Announces Golden Bridge Award Winners While Celebrating 25 Years of Impact, source:Yahoo, summary: Cisco Systems Inc.:, Headline: Cisco Systems Inc. stock falls Tuesday, underperforms market, source:MarketWatch, summary: Shares of Cisco Systems Inc. slumped 0.06% to $47.37 Tuesday, on what proved to be an all-around great trading session for the stock market, with the S&P 500..., Headline: 7 Stocks to Buy on Weakness for Big Gains, source:Yahoo, summary: The U.S. stock market has been spooked by actions of the Federal Reserve. However, as Barron’s pointed out, “Despite the most rapid tightening of financial conditions in a generation, and the turmoil in financial markets, the U.S. economy is entering 2023 in decent shape.” With the labor market and America’s dominant services sector still both strong, there’s little reason to believe the economy won’t keep growing meaningfully if the Fed tightens 1.3 percentage points more next year. And, I cont",CSCO
87,2022-12-21,"Headline: Citi reveals top telecom equipment stock picks for 2023, source:Thefly.com, summary: No summary, Headline: Nicholas Ward`s Dividend Growth Portfolio: November 2022 Update, source:Seeking Alpha, summary: No summary, Headline: Top 10 Dividend Growth Stocks for 2023 ��� and How to Choose Them, source:TipRanks, summary: No summary, Headline: Top 10 Dividend Growth Stocks and How to Choose Them, source:TipRanks, summary: No summary, Headline: Cisco Systems Inc. stock rises Wednesday, still underperforms market, source:MarketWatch, summary: Shares of Cisco Systems Inc. inched 0.61% higher to $47.66 Wednesday, on what proved to be an all-around positive trading session for the stock market, with..., Headline: Nicholas Ward's Dividend Growth Portfolio: November 2022 Update, source:SeekingAlpha, summary: My passive income was up by 12.03% during November and my dividends are up by 21.15% year to date. Read more to see an update on my portfolio for Nov 2022.",CSCO
88,2022-12-22,"Headline: Splunk Is A Rare Tech Growth Opportunity For 2023, source:SeekingAlpha, summary: Splunk's strong customer retention and balance sheet improvement align with cloud sector growth. Click here to find out what makes SPLK stock a Buy., Headline: HPE interest in Nutanix said to wane, end talks  - report, source:Seeking Alpha, summary: No summary, Headline: Cisco Systems Inc. stock outperforms market despite losses on the day, source:MarketWatch, summary: Shares of Cisco Systems Inc. slipped 0.71% to $47.32 Thursday, on what proved to be an all-around grim trading session for the stock market, with the S&P 500..., Headline: Cisco Systems (CSCO) Stock Moves -0.71%: What You Should Know, source:Yahoo, summary: Cisco Systems (CSCO) closed at $47.32 in the latest trading session, marking a -0.71% move from the prior day.",CSCO
89,2022-12-23,"Headline: CSCO, UAL and PAYX are among after hour mover, source:Seeking Alpha, summary: No summary, Headline: Nutanix drops after report HPE interest in acquisition wanes, talks end, source:Seeking Alpha, summary: No summary, Headline: Nutanix drops 10% after report HPE interest in acquisition wanes, talks end (update), source:Seeking Alpha, summary: No summary, Headline: 20 Biggest Companies that Sponsor H1B Visas, source:Yahoo, summary: In this piece, we will take a look at the 20 biggest companies that sponsor H1B visas. For more companies, head on over to 5 Biggest Companies that Sponsor H1B Visas. The United States of America is the world’s largest economy and among the most popular nations in the world. It is home to one […], Headline: Cisco Systems Inc. stock rises Friday, still underperforms market, source:MarketWatch, summary: Shares of Cisco Systems Inc. inched 0.34% higher to $47.48 Friday, on what proved to be an all-around favorable trading session for the stock market, with...",CSCO
90,2022-12-24,"Headline: Cisco Systems (NASDAQ:CSCO) Is Investing Its Capital With Increasing Efficiency, source:Yahoo, summary: What are the early trends we should look for to identify a stock that could multiply in value over the long term...",CSCO
91,2022-12-26,"Headline: Cisco Systems: Surprisingly Resilient, source:SeekingAlpha, summary: Cisco Systems hiked the 2023 guidance following its first quarter results. Click here for a full analysis of CSCO stock.",CSCO
92,2022-12-27,"Headline: Why Cisco Systems is a Top 25 Dividend Giant (CSCO), source:ETF Channel, summary: No summary, Headline: Changes at Disney, a Stitch Fix deal among The Information`s 2023 predictions, source:Thefly.com, summary: No summary, Headline: Super Micro Computer: Super Financials And Undervalued, source:SeekingAlpha, summary: Super Micro Computer is a leading supplier of servers, rack storage solutions to data centers and the enterprise. Click here to read my analysis of SMCI stock., Headline: Cisco Systems Inc. stock outperforms market on strong trading day, source:MarketWatch, summary: Shares of Cisco Systems Inc. inched 0.11% higher to $47.53 Tuesday, on what proved to be an all-around mixed trading session for the stock market, with the..., Headline: Dow 30 Stocks List: Ranked By 2022 Hedge Fund Bullishness Index, source:Yahoo, summary: In this article, we discuss the Dow 30 stocks and their rank according to the 2022 hedge fund bullishness index. The Dow Jones Industrial Average, sometimes known as Dow Jones or just the Dow, is an indicator of 30 renowned American firms that are traded on NYSE and NASDAQ. One of the first and most […], Headline: Cisco Systems, Inc. (NASDAQ:CSCO) Q1 2023 Earnings Call Transcript, source:Yahoo, summary: Cisco Systems, Inc. (NASDAQ:CSCO) Q1 2023 Earnings Call Transcript November 16, 2022 Cisco Systems, Inc. beats earnings expectations. Reported EPS is $0.86, expectations were $0.84. Operator: Welcome to Cisco’s First Quarter Fiscal Year 2023 Financial Results Conference Call. At the request of Cisco, today’s conference is being recorded. If you have any objections, you may […]",CSCO
93,2022-12-28,"Headline: Cisco: A Cash Flow Machine With Upside Potential, source:SeekingAlpha, summary: Cisco is a strong dividend growth stock offering attractive risk/reward for income and growth investors. See why we believe CSCO is a buy., Headline: Is There An Opportunity With Cisco Systems, Inc.'s (NASDAQ:CSCO) 29% Undervaluation?, source:Yahoo, summary: In this article we are going to estimate the intrinsic value of Cisco Systems, Inc. ( NASDAQ:CSCO ) by taking the..., Headline: Here is What to Know Beyond Why Cisco Systems, Inc. (CSCO) is a Trending Stock, source:Yahoo, summary: No summary, Headline: The Future of Artificial Intelligence: 10 Companies, 10 Predictions, source:Yahoo, summary: In this article, we discuss the future of artificial intelligence, including 10 predictions about 10 companies. The future of artificial intelligence (AI) is a topic of much speculation and debate. Some experts believe that AI has the potential to revolutionize many aspects of society and industry, while others are more cautious about its potential impact. […], Headline: Cisco Systems Inc. stock outperforms market despite losses on the day, source:MarketWatch, summary: Shares of Cisco Systems Inc. sank 0.97% to $47.07 Wednesday, on what proved to be an all-around dismal trading session for the stock market, with the S&P 500..., Headline: Cisco Systems (CSCO) Stock Moves -0.97%: What You Should Know, source:Yahoo, summary: Cisco Systems (CSCO) closed the most recent trading day at $47.07, moving -0.97% from the previous trading session., Headline: CES Is Back. Can It Be the Boost the Tech Sector Needs?, source:MarketWatch, summary: CES’ organizers are targeting about 100,000 attendees in Las Vegas this coming week. That’s down from 171,000 in 2020, just before Covid-19., Headline: 3 Undervalued Tech Stocks With Dividends to Buy Now to Retire Rich, source:InvestorPlace, summary: No summary",CSCO
94,2022-12-29,"Headline: CSCO February 2023 Options Begin Trading, source:Stock Options Channel, summary: No summary, Headline: Cisco Systems Inc. stock rises Thursday, still underperforms market, source:MarketWatch, summary: Shares of Cisco Systems Inc. inched 0.91% higher to $47.50 Thursday, on what proved to be an all-around positive trading session for the stock market, with...",CSCO
95,2022-12-30,"Headline: Cisco And Intel: Avoid One Of These High-Yield Blue-Chips, source:SeekingAlpha, summary: Intel has run into endless problems as its moat has deteriorated. In contrast, Cisco is firing on all cylinders. Read why I rate INTC a Hold & CSCO a Buy., Headline: Will Fortinet`s Big Returns Come Back?, source:GuruFocus, summary: No summary, Headline: Nasdaq closes out its first four-quarter slump since dot-com crash, source:CNBC, summary: The Nasdaq wrapped up its worst year since 2008 and is mired in a slump that's drawing many comparisons to the dot-com crash more than two decades ago. , Headline: Cisco Systems Inc. stock outperforms market on strong trading day, source:MarketWatch, summary: Shares of Cisco Systems Inc. inched 0.29% higher to $47.64 Friday, on what proved to be an all-around dismal trading session for the stock market, with the..., Headline: CES organizers aim for attendance to more than double as ‘major companies want the physical connection’, source:Yahoo, summary: 'Tech is facing a couple of tough years, but history has shown that it eventually rebounds, and companies need to be ready for when it does,' says tech analyst Tim Bajarin., Headline: Recession Likely; What And When To Buy (Part 2), source:SeekingAlpha, summary: Stock market is already experiencing a bear market since the beginning of this year. Read more to see why I think a recession is likely in 2023.",CSCO
96,2022-12-31,"Headline: 3 Dividend-Paying Tech Stocks to Buy in January, source:Yahoo, summary: The tech sector's meltdown in 2022 -- which was mainly driven by inflation, rising interest rates, and other nerve-wracking macro headwinds -- highlighted the value of consistent profits, reasonable valuations, and reliable dividends during uncertain times.  Many speculative tech stocks that lacked those strengths quickly surrendered their pandemic-era gains., Headline: Dividend Champion, Contender, And Challenger Highlights: Week Of January 1, source:SeekingAlpha, summary: A weekly summary of dividend activity for Dividend Champions, Contenders, and Challengers. Check out the companies which changed their dividends.",CSCO
97,2023-01-01,"Headline: Cisco Systems, Inc. (NASDAQ:CSCO) is favoured by institutional owners who hold 74% of the company, source:Yahoo, summary: A look at the shareholders of Cisco Systems, Inc. ( NASDAQ:CSCO ) can tell us which group is most powerful. And the..., Headline: The Dow Stock Dogs Performed In 2022, source:SeekingAlpha, summary: Very few investment categories generated a positive return in 2022. One area within equities that outperformed the broader market was stocks that had dividends associated with them.",CSCO
98,2023-01-02,"Headline: Indy Autonomous Challenge Announces Premier Sponsors Ahead of CES 2023 Head-to-Head Autonomous Racing Competition, source:Business Wire, summary: No summary, Headline: Noteworthy Tuesday Option Activity: CSCO, LUV, RIVN, source:Stock Options Channel, summary: No summary",CSCO
99,2023-01-03,"Headline: 5 New Year`s Resolutions for Investors, source:InvestorPlace, summary: No summary, Headline: SCHD Could Be The Best Equity Dividend ETF For 2023, source:SeekingAlpha, summary: SCHD has outperformed the market over the previous 5 years and offers a dividend yield that is double traditional index funds. Find out why I'm bullish on the ETF., Headline: Ex-Dividend Reminder: Cisco Systems, NetApp and Helios Technologies, source:Dividend Channel, summary: No summary, Headline: Are You a Growth Investor? This 1 Stock Could Be the Perfect Pick, source:Yahoo, summary: Whether you're a value, growth, or momentum investor, finding strong stocks becomes easier with the Zacks Style Scores, a top feature of the Zacks Premium research service., Headline: Cisco Systems Inc. stock outperforms market on strong trading day, source:MarketWatch, summary: Shares of Cisco Systems Inc. inched 0.63% higher to $47.94 Tuesday, on what proved to be an all-around dismal trading session for the stock market, with the..., Headline: Jim Cramer predicts these 10 Dow stocks will perform well in 2023, source:CNBC, summary: Cramer gave his predictions for which stocks in the Dow Jones Industrial Average will perform well in 2023., Headline: Buy 4 January Dogs Of The Dow, Watch 4 More, source:SeekingAlpha, summary: More than half this collection is too pricey and reveals only skinny dividends. Here are 4 January Dogs of the Dow you should buy.",CSCO
100,2023-01-04,"Headline: Cisco Networking Academy: Innovating To Make Education Accessible and Equitable for All, source:Yahoo, summary: Cisco Systems Inc. On December third we acknowledge International Day of Persons with Disabilities and reflect on Cisco Networking Academy's commitment to create an inclusive future for all, including people living with disabilities., Headline: Student Freedom Initiative Announces Cisco’s Deployment of Wireless 5G Service at Claflin University, source:Yahoo, summary: ORANGEBURG, S.C., January 04, 2023--Today, Student Freedom Initiative (""SFI"") and Cisco announced wireless 5G internet service deployment at Claflin University., Headline: Juniper Networks Is Great, But We Like Cisco Better, source:SeekingAlpha, summary: Juniper Networks is seeing robust growth driven by key segments. See why I rate JNPR stock as a Hold and CSCO stock as a Buy at present., Headline: Cisco Systems (CSCO) Stock Sinks As Market Gains: What You Should Know, source:Yahoo, summary: In the latest trading session, Cisco Systems (CSCO) closed at $47.55, marking a -0.81% move from the previous day., Headline: Tech Companies Keep Slashing Jobs in Uncertain 2023 Economy, source:Yahoo, summary: (Bloomberg) -- Layoffs that began in 2022 are accelerating across some technology companies. Most Read from BloombergShopify Tells Employees to Just Say No to MeetingsChina’s Foreign Minister Says ‘Deeply Impressed’ With AmericansFed Affirms Inflation Resolve, Pushes Back Against Rate-Cut BetsBattered by Covid, China Hits Pause on Giant Chip Spending Aimed at Rivaling USThe tech industry is slashing jobs at a pace nearing the early days of the Covid-19 pandemic. In November, the most recent mont",CSCO
101,2023-01-05,"Headline: My Dividend Stock Portfolio: New December Record - 96 Holdings With 24 Buys, 6 Sales, source:SeekingAlpha, summary: Inflation and (expected) actions by the Fed continue to dominate market movements. Learn more about the holdings for December in my dividend income portfolio., Headline: Why Cisco Systems, Inc. (NASDAQ:CSCO) Could Be Worth Watching, source:Yahoo, summary: Today we're going to take a look at the well-established Cisco Systems, Inc. ( NASDAQ:CSCO ). The company's stock led..., Headline: Cisco layoffs begin with hundreds of job cuts in California and more expected, source:MarketWatch, summary: Cisco Systems Inc. has begun previously announced layoffs, cutting nearly 700 jobs in Silicon Valley last month, according to filings with the state of..., Headline: Cisco Systems Inc. stock outperforms competitors despite losses on the day, source:MarketWatch, summary: Shares of Cisco Systems Inc. slipped 1.41% to $46.88 Thursday, on what proved to be an all-around rough trading session for the stock market, with the S&P..., Headline: The Dow`s Biggest Dividends: Here Are 2023`s Dogs., source:The Online Investor, summary: No summary",CSCO
102,2023-01-06,"Headline: Cisco Systems Inc. stock rises Friday, outperforms market, source:MarketWatch, summary: Shares of Cisco Systems Inc. rose 3.07% to $48.32 Friday, on what proved to be an all-around great trading session for the stock market, with the S&P 500...",CSCO
103,2023-01-07,"Headline: Wall Street Breakfast: What Moved Markets, source:SeekingAlpha, summary: Listen on the go! A daily podcast of Wall Street Breakfast will be available this morning on Seeking Alpha, iTunes, Stitcher and Spotify.",CSCO
104,2023-01-09,"Headline: Are Strong Financial Prospects The Force That Is Driving The Momentum In Cisco Systems, Inc.'s NASDAQ:CSCO) Stock?, source:Yahoo, summary: Cisco Systems (NASDAQ:CSCO) has had a great run on the share market with its stock up by a significant 22% over the..., Headline: Cisco Systems Inc. stock outperforms market on strong trading day, source:MarketWatch, summary: Shares of Cisco Systems Inc. inched 0.54% higher to $48.58 Monday, on what proved to be an all-around grim trading session for the stock market, with the S&P...",CSCO
105,2023-01-10,"Headline: Here's how Bay Area tech giants ranked as new U.S. patents hit a 4-year low, source:Yahoo, summary: Intel Corp. and Apple Inc. are the only companies headquartered in the Bay Area that cracked the top 10 for new patents., Headline: Cisco Systems Inc. stock rises Tuesday, still underperforms market, source:MarketWatch, summary: Shares of Cisco Systems Inc. inched 0.47% higher to $48.81 Tuesday, on what proved to be an all-around great trading session for the stock market, with the..., Headline: 7 Dividend-Paying Stocks Trading at a Discount, source:Yahoo, summary: Investors are rethinking their portfolio strategies after a rough 2022. That includes a reassessment of risk tolerance. Many people are moving to more conservative holdings, understandably shaken by the magnitude and velocity of declines in growth securities in 2022. This has created some unintended consequences to be aware of. Many safe haven companies in sectors such as consumer staples and utilities have run up significantly. The rush into safe dividend stocks has made valuations much less ap",CSCO
106,2023-01-11,"Headline: Oracle’s Cloud Portfolio Seen as a Silver Lining. Why the Stock Is a Buy., source:MarketWatch, summary: Analysts at Mizuho and Piper Sandler think the software giant is undervalued., Headline: People Behind CSR at Cisco: Empowering Learners Through Technology and Education, source:Yahoo, summary: Cisco Systems Inc., Headline: 4 Factor Dividend Growth Portfolio - December 2022 Results, source:SeekingAlpha, summary: The 4 factor dividend growth portfolio was launched on November 1st, 2022 and is thus far off to a great start. Click to see how our strategy is going so far., Headline: Cisco Systems Inc. stock rises Wednesday, still underperforms market, source:MarketWatch, summary: Shares of Cisco Systems Inc. inched 0.82% higher to $49.21 Wednesday, on what proved to be an all-around great trading session for the stock market, with the..., Headline: 7 Stocks to Buy for the $100,000 Portfolio, source:Yahoo, summary: Investors who want to build a portfolio’s value over time will seek quality companies. Those stocks to buy have thriving businesses with proven returns on their investments. They are not speculations that report incredible revenue growth but lose more money as they get bigger. Stable companies have a positive cash flow. They either retain their earnings and invest back in the business or distribute earnings through dividends. The beauty of such companies is they thrive regardless of the economic, Headline: Cisco Systems (CSCO) Gains But Lags Market: What You Should Know, source:Yahoo, summary: Cisco Systems (CSCO) closed at $49.21 in the latest trading session, marking a +0.82% move from the prior day.",CSCO
107,2023-01-12,"Headline: Cisco Systems Inc. stock underperforms Thursday when compared to competitors, source:MarketWatch, summary: Shares of Cisco Systems Inc. dropped 0.43% to $49.00 Thursday, on what proved to be an all-around great trading session for the stock market, with the S&P..., Headline: VSDA: Dividend Growth ETF Beating Its Peers, source:SeekingAlpha, summary: VSDA is better balanced than the S&P 500 between cyclical and defensive sectors. Find out why the ETF has outperformed its main competitors and has excellent dividend growth rate.",CSCO
108,2023-01-13,"Headline: Investors Heavily Search Cisco Systems, Inc. (CSCO): Here is What You Need to Know, source:Yahoo, summary: No summary, Headline: Cisco Systems Inc. stock falls Friday, underperforms market, source:MarketWatch, summary: Shares of Cisco Systems Inc. slipped 0.24% to $48.88 Friday, on what proved to be an all-around positive trading session for the stock market, with the S&P...",CSCO
109,2023-01-14,"Headline: I'll Avoid These Sectors In 2023, source:SeekingAlpha, summary: I wrote an article about which sectors I intend to focus on for this year, with a number of examples. Find out which sectors I'll avoid in 2023.",CSCO
110,2023-01-15,"Headline: Here's Why Cisco Systems (NASDAQ:CSCO) Can Manage Its Debt Responsibly, source:Yahoo, summary: The external fund manager backed by Berkshire Hathaway's Charlie Munger, Li Lu, makes no bones about it when he says..., Headline: 25 Biggest California Companies and Stocks, source:Yahoo, summary: In this article, we will be taking a look at the 25 biggest California companies and stocks. To skip our detailed analysis, you can go directly to see the 5 Biggest California Companies and Stocks. California is not just the most populous state in the U.S. with over 39 million residents, but it is also […]",CSCO
111,2023-01-16,"Headline: 3 Troubled Tech Stocks to Buy For The Long Haul, source:Yahoo, summary: Tech stocks to buy can be a profitable way to grow your wealth, especially in 2023. When considering tech stocks to buy and hold, it is important to research the company’s overall financial health before investing. Some tech stocks have seen significant gains over the last few years. This makes them an attractive choice for long-term investors. Additionally, tech companies often offer innovative new tech products that fuel their growth. Although tech stocks can be risky investments, the potentia",CSCO
112,2023-01-17,"Headline: Cisco Systems Inc. stock underperforms Tuesday when compared to competitors, source:MarketWatch, summary: Shares of Cisco Systems Inc. slipped 1.64% to $48.08 Tuesday, on what proved to be an all-around dismal trading session for the stock market, with the S&P..., Headline: 2023 'is the year AI crosses the chasm,' but for one reason, John Chambers says, source:MarketWatch, summary: ""This year is going to be tough,"" Chambers told MarketWatch. ""However, I believe strongly that downturns are when the next generation of leaders can emerge."", Headline: My Dividend Growth Portfolio - Q4 2022 Summary, source:SeekingAlpha, summary: In 2015, I started publishing updates regarding my dividend growth portfolio, and I keep doing so every quarter. Here's my Q4 2022 update.",CSCO
113,2023-01-18,"Headline: Finding Purpose in Improving Supply Chain Worker Well-Being, source:Yahoo, summary: Cisco Systems Inc., Headline: Nicholas Ward's Dividend Growth Portfolio: December/Full Year 2022 Review, source:SeekingAlpha, summary: My passive income was up by 46.50% on a year-over-year basis during December. For the full-year in 2022, my passive income rose by 23.73%. Click to read more., Headline: Cisco Systems Inc. stock falls Wednesday, underperforms market, source:MarketWatch, summary: Shares of Cisco Systems Inc. slipped 2.45% to $46.90 Wednesday, on what proved to be an all-around dismal trading session for the stock market, with the S&P..., Headline: Cisco’s CEO at Davos says most executives are ‘very optimistic’ about the economy’s future—despite Americans’ recession fears, source:Yahoo, summary: While some Davos attendees warned of a looming recession, Cisco's CEO isn't worried. And Carlyle Group's co-founder argued that it might even be a good time to invest in stocks., Headline: Gov. Brian Kemp hints that Cisco CEO Chuck Robbins has moved back to Georgia, source:Yahoo, summary: Gov. Brian Kemp hinted at a move on CNBC’s “Squawk Box,” saying that CEO Chuck Robbins showed him his Georgia driver’s license.",CSCO
114,2023-01-19,"Headline: The one-year underlying earnings growth at Cisco Systems (NASDAQ:CSCO) is promising, but the shareholders are still in the red over that time, source:Yahoo, summary: The simplest way to benefit from a rising market is to buy an index fund. But if you buy individual stocks, you can do..., Headline: Davos 2023: Cisco CEO details why he’s ‘optimistic’ about U.S.-China relations, source:Yahoo, summary: Cisco CEO Chuck Robbins joins Yahoo Finance Live anchors Julie Hyman and Brian Sozzi at the 2023 World Economic Forum in Davos, Switzerland, to discuss geopolitical issues, inflation, the possibility of a recession, the cyber space, M&A deal-making, and the economic impact on expenses., Headline: Cisco Systems Inc. stock falls Thursday, underperforms market, source:MarketWatch, summary: Shares of Cisco Systems Inc. slumped 0.94% to $46.46 Thursday, on what proved to be an all-around rough trading session for the stock market, with the S&P..., Headline: Davos 2023: 5 top tech executives address mounting layoffs, source:Yahoo, summary: Top executives at the World Economic Forum in Davos, Switzerland address the growing number of tech companies cutting jobs. You can see their full interviews here. Key Video Takeaways 00:00: Enrique Lores, HP CEO 00:13: Chuck Robbins, Cisco CEO 00:20: Antonio Neri, HPE CEO 00:26: Gina Mastantuono, ServiceNow CFO 00:35: Matthew Prince, Cloudflare CEO",CSCO
