,date,information,related
0,2022-06-23,"Headline: Looking for Stocks with Positive Earnings Momentum? Check Out These 2 Finance Names, source:Yahoo, summary: The Zacks Earnings ESP is a great way to find potential earnings surprises. Why investors should take advantage now.",CSCO
1,2022-08-05,"Headline: 7 Cheap Blue-Chip Stocks to Buy Before They Rebound, source:Yahoo, summary: Trying to find a good bargain seems tough these days, but there are certainly opportunities for savvy investors. Looking for cheap blue-chip stocks to buy before they rebound is a smart strategy right now. As anyone that has been grocery shopping, to the gas pump or out for a night on the town can attest, the world has gotten a great deal more expensive in 2022 due to price hikes inexorably linked to Covid-19 and the Russia-Ukraine war. But that’s just on Main Street. Within the financial market",CSCO
2,2022-09-22,"Headline: Cisco Systems Becomes Oversold, source:Dividend Channel, summary: dividend channel,CSCO,",CSCO
3,2022-09-23,"Headline: Dow in danger of breaking below June low, as all Dow stocks trading premarket are falling, source:MarketWatch, summary: The Dow Jones Industrial Average undefined is in danger of a fourth-straight selloff Friday, and is on track to break below the June closing low, as all of..., Headline: More Than Two Million Women Rock-IT, source:Yahoo, summary: Cisco Systems Inc. In the 25 years since it was founded, inclusiveness has been at the core of Cisco Networking Academy. Networking Academy's global reach is amazing, with students in 190 countries and nearly 12 thousand academies offering over 30 courses in up to 27 languages. But making the program available is only half the challenge: making the demand inclusive is another matter. This is why, in 2014, we introduced the Women Rock-IT initiative., Headline: Apple: The Last Shoe To Drop In This Developing Bear Market, source:SeekingAlpha, summary: After turning bullish on Apple shares in May 2016, I turned bearish in December 2021. Read why Apple shares could see significant downside in a range of scenarios., Headline: Cisco Systems Inc. stock falls Friday, still outperforms market, source:MarketWatch, summary: Shares of Cisco Systems Inc. slipped 1.19% to $40.66 Friday, on what proved to be an all-around dismal trading session for the stock market, with the S&P 500..., Headline: F5 Could More Than Double As Solid Demand Trends Continue & Supply Constrains Start To Ease, Needham Says, source:Yahoo, summary: Needham analyst Alex Henderson reiterated a Buy and $303 price target on F5, Inc (NASDAQ: FFIV). F5 was careful not to update conditions post its last earnings call, but he sensed that demand was vital for Security and Systems. Supply remains a significant constraint and has not improved materially, but it seems there was improvement at the margin. F5 highlights solid redesign progress, which should start to help in the FY1Q/CY4Q quarter and ramp across FY23. Also Read: AI 'Transformed' This Net",CSCO
4,2022-09-25,"Headline: Institutional owners may take dramatic actions as Cisco Systems, Inc.'s (NASDAQ:CSCO) recent 6.1% drop adds to one-year losses, source:Yahoo, summary: If you want to know who really controls Cisco Systems, Inc. ( NASDAQ:CSCO ), then you'll have to look at the makeup of..., Headline: Tracking Jeremy Grantham's GMO Capital Portfolio - Q2 2022 Update, source:SeekingAlpha, summary: Jeremy Granthamâs 13F portfolio value decreased from $20.73B to $18.46B this quarter. Click to read more about GMO Capital's holdings and trades for Q2 2022.",CSCO
5,2022-09-26,"Headline: Cisco ACI Best Practices: Upgrade your Fabric with Confidence, source:Finnhub, summary: Firmware Update Analysis feature is one of those useful capabilities of Nexus Dashboard Insights specifically designed to address and care about the many operational details in your environment and... | September 26, 2022, Headline: Arista Networks: A Leader In The Making, source:SeekingAlpha, summary: Arista Networks is constantly gaining market share against legacy players thanks to the secular growth story of cloud computing. Read why ANET has very high margins and revenue growth., Headline: 10 Quality Stocks to Buy with Shares Down Over 30% YTD, source:Yahoo, summary: In this article, we will take a look at the 10 Quality Stocks to Buy with Shares Down Over 30% YTD. To skip our analysis of the iShares MSCI USA Quality Factor ETF, its performance, and weighting of the components, you can go directly to see the 5 Quality Stocks to Buy with Shares Down […]",CSCO
6,2022-09-27,"Headline: Accedian and Cisco Provide Unparalleled Network Performance Monitoring and Analytics for Zain Kuwait, source:Yahoo, summary: Accedian and Cisco today announced that they are helping Zain Kuwait automate its network with increased network visibility and service assurance to deliver superior B2B customer experiences., Headline: Working Trees: How a startup helps farmers get paid for carbon stored in their trees, source:Finnhub, summary: Now that the Cisco Global Problem Solver Challenge 2022 winners have been officially announced, you'll want to learn more about each winning team and the story behind each innovation.... | September 27, 2022, Headline: 22 dividend stocks screened for quality and safety, source:MarketWatch, summary: These stocks have both high dividend yields and good prospects for earnings and sales., Headline: Cisco Enterprise Agreement: New and Improved!, source:Finnhub, summary: It has been over two years since I last wrote about Cisco's Enterprise Agreements . It's time for a refresher of Cisco's lead software buying motion! What has... | September 27, 2022, Headline: PowerWells: How a Startup Is Solving the Dual Problem of Energy Poverty and Electronic Waste, source:Yahoo, summary: Cisco Systems Inc.:, Headline: The Fallacy Of Inflation Protection Through Dividend Yields - Altria And Houlihan Lokey In Focus, source:SeekingAlpha, summary: The article will demonstrate the fallacy of inflation protection through dividend yields using the example of Altria and Houlihan Lokey. Read more here.",CSCO
7,2022-09-28,"Headline: 7 Tech Sleeper Stocks to Buy Before Wall Street Wakes Up, source:InvestorPlace, summary: Sleeper tech stocks are ones that don't make headlines every day, but have potential to grow. Here are seven good ones for your portfolio., Headline: Adobe’s Figma deal brings new users to open-source challenger Penpot, which just raised $8 million, source:CNBC, summary: Penpot, a 2-year-old open-source project, is getting new deployments after larger rival Figma agreed to be bought by software giant Adobe. , Headline: 12 Biggest Computer Hardware Companies in the World, source:Yahoo, summary: In this article, we discuss the 12 biggest computer hardware companies in the world. If you want to skip our comprehensive analysis of these stocks, go directly to 5 Biggest Computer Hardware Companies in the World. According to the Computer Hardware Global Market Report 2022, the global market for computer hardware is expected to grow […], Headline: Stocks And Sectors With The Biggest Declines, source:SeekingAlpha, summary: The average stock in the Russell 3000 was down 41.7% from its 52-week high as of the close on Monday. Across the entire Russell 3000, weâve seen more than $13 trillion in market cap erased.",CSCO
8,2022-09-29,"Headline: Katchi: How sustainable fishing helps both fishers and the ocean, source:Finnhub, summary: Now that the Cisco Global Problem Solver Challenge 2022 winners have been officially announced, you'll want to learn more about each winning team and the story behind each innovation.... | September 29, 2022, Headline: Google promises Greece 20K jobs with cloud expansion, source:Associated Press, The, summary: No summary, Headline: Cisco : Join us for the WebexOne Partner Exclusive, source:Finnhub, summary: Monthly Update from Webex Partner Marketing What an amazing time this is to be a Cisco Partner growing a Collaboration practice! If I have not met you yet,my name... | September 29, 2022, Headline: Cisco Systems, Inc.'s (NASDAQ:CSCO) Popularity With Investors Is Under Threat From Overpricing, source:Yahoo, summary: There wouldn't be many who think Cisco Systems, Inc.'s ( NASDAQ:CSCO ) price-to-earnings (or ""P/E"") ratio of 14.4x is..., Headline: Cisco Systems (CSCO) Stock Moves -1.86%: What You Should Know, source:Yahoo, summary: Cisco Systems (CSCO) closed at $40.57 in the latest trading session, marking a -1.86% move from the prior day., Headline: Apple’s Tech Supply Chain Shows Difficulty of Dumping China, source:Yahoo, summary: (Bloomberg) -- Most Read from BloombergMacKenzie Scott Files for Divorce From Science Teacher HusbandMeta to Cut Headcount for First Time, Slash Budgets Across TeamsTop Apple Executive Is Leaving After Making Crude Remarks in TikTok VideoStocks Plummet to 22-Month Low as Fed Hawks Circle: Markets WrapTrump Refuses to Delay Florida Deposition in Phone-Fraud Case Despite HurricaneAmerican companies have had a growing list of reasons to downgrade their ties with China in recent years. Former Presid",CSCO
9,2022-09-30,"Headline: Cisco Systems Inc. Elliott Wave Technical Analysis September 30 2022 , source:TalkMarkets, summary: We could be forming wave (iv) and I would expect it to be sideways as wave (ii) was a sharp correction., Headline: 4 High-Yield Stocks for Divide - GuruFocus.com, source:GuruFocus, summary: GuruFocus Article or News written by Alberto Abaterusso and the topic is about: These stocks are yielding more than the S&P 500, Headline: Cisco Systems (NASDAQ:CSCO) Could Be A Buy For Its Upcoming Dividend, source:Yahoo, summary: Cisco Systems, Inc. ( NASDAQ:CSCO ) is about to trade ex-dividend in the next three days. Typically, the ex-dividend..., Headline: The Path to Sustainability Travels Through the Cloud, source:Yahoo, summary: Cisco Systems Inc., Headline: Cisco : UCS X-Series answers IT's demands for a more sustainable data center, source:Finnhub, summary: The popularity and utility of data centers are indisputable, especially as demand for applications, data, and cloud services continues to grow. There are more than seven million data... | September 30, 2022",CSCO
10,2022-10-01,"Headline: Dividend Champion, Contender, And Challenger Highlights: Week Of October 2, source:SeekingAlpha, summary: Weekly summary of dividend activity for Dividend Champions, Contenders, Challengers. Click here to see companies with upcoming ex-dividend dates and upcoming pay dates.",CSCO
11,2022-10-02,"Headline: IGA: Value-Oriented Portfolio Leading To Outperformance, source:SeekingAlpha, summary: IGA has been performing relatively well during the challenging 2022 market. See why I believe the CEF is a worthwhile candidate for adding to one's portfolio., Headline: The Medium Term Outlook for Ci - GuruFocus.com, source:GuruFocus, summary: GuruFocus Article or News written by Muslim Farooque and the topic is about: Cisco is becoming a subscription-based tech company, but very slowly, Headline: Cisco: Thesis Intact Despite Poor Execution, source:SeekingAlpha, summary: Cisco stock has underperformed the overall market. Click here to see why I consider CSCO stock a buy at the current prices despite some headwinds.",CSCO
12,2022-10-03,"Headline: Cisco : Demonstrating Trust and Transparency in Mergers and Acquisitions, source:Finnhub, summary: Jason Button is a director at Cisco and leads the company's Security and Trust Mergers and Acquisitions team. He was formerly the director of IT at Duo Security, a company Cisco... | October 3, 2022, Headline: Cisco vs. IBM: Which is the Better High-Yield Tech Dinosaur?, source:TipRanks, summary: Tech stocks have been obliterated this year, with speculative and unprofitable innovators leading the downward charge. The shockwaves have been felt across the sect..., Headline: Current Report: Cisco Systems, source:TalkMarkets, summary: Cisco’s price per share was $41.30 at today’s market close.  Cisco’s share price fell by $13.84 or about 25% in the past year.",CSCO
13,2022-10-04,"Headline: BURNS J W & CO INC/NY Buys 3,  - GuruFocus.com, source:GuruFocus, summary: GuruFocus Article or News written by insider and the topic is about: , Headline: Cisco Systems, Inc.'s (NASDAQ:CSCO) Fundamentals Look Pretty Strong: Could The Market Be Wrong About The Stock?, source:Yahoo, summary: It is hard to get excited after looking at Cisco Systems' (NASDAQ:CSCO) recent performance, when its stock has declined..., Headline: PARK NATIONAL CORP /OH/ Buys 4 - GuruFocus.com, source:GuruFocus, summary: GuruFocus Article or News written by insider and the topic is about: , Headline: Beamlink: How a Cellular Mesh Networking Solution Connects People During Natural Disasters, source:Yahoo, summary: Cisco Systems Inc.:, Headline: CISCO SYSTEMS, INC. : Entry into a Material Definitive Agreement, Termination of a Material Definitive Agreement, Financial Statements and Exhibits (form 8-K), source:Finnhub, summary: Item 1.01. Entry into a Material Definitive Agreement.On September 29, 2022, Cisco Systems, Inc. entered into a CommercialPaper Issuing and Paying Agent Agreement , by and betweenCisco and... | October 4, 2022, Headline: Cramer's lightning round: Cisco is going to snap back big, source:CNBC, summary: ""Mad Money"" host Jim Cramer rings the lightning round bell, which means he's giving his answers to callers' stock questions at rapid speed.",CSCO
14,2022-10-05,"Headline: 5 Sleep Well At Night High-Yield Blue Chips Perfect For This Crazy Market, source:SeekingAlpha, summary: Market's around the world have gone crazy, including UK bonds trading with 5X more volatility than Bitcoin. Read to find the most dependable high-yield, world-class blue chips., Headline: Buy 4 October Dogs Of The Dow And Watch 4 More, source:SeekingAlpha, summary: The Dow adds a stock if the company has an excellent reputation, demonstrates sustained growth, and is of interest to a large number of investors. Read more here., Headline: Investors Heavily Search Cisco Systems, Inc. (CSCO): Here is What You Need to Know, source:Yahoo, summary: No summary, Headline: Palo Alto (PANW) Gains From Higher Cyber Safety Demand, Tie Ups, source:Yahoo, summary: Palo Alto (PANW) continues to gain from the spurring demand for its cyber safety solutions and back-to-back strategic collaboration wins., Headline: Noteworthy Thursday Option Activity: CSCO, IMXI, CARS, source:Stock Options Channel, summary: Staff article entitled Noteworthy Thursday Option Activity: CSCO, IMXI, CARS, about stock options, from Stock Options Channel.",CSCO
15,2022-10-06,"Headline: Cisco Is A Steal, But So Are These 2 Better Dividend Aristocrat Bargains, source:SeekingAlpha, summary: A 5th bear market rally has likely started, and history is clear, selling now is almost certainly a big mistake. Check out these Ultra SWANs for this bear market., Headline: CSCO November 25th Options Begin Trading, source:Stock Options Channel, summary: Staff article entitled CSCO November 25th Options Begin Trading, about stock options, from Stock Options Channel., Headline: Are Retail Investors Done? Biggest Liquidation Since 2020 As Retail Is Now 'Selling The Rally', source:TalkMarkets, summary: according to JPMorgan's Peng Cheng, retail traders have now capitulated, not only selling stocks for the second week in a row, but in a stark reversal from their momentum-chasing ways, retail investors sold both the Monday and Tuesday rallies., Headline: Cash-Rich Cisco Is A Buy, source:SeekingAlpha, summary: Cisco generates significant cash flow and has a net cash position allowing the company to invest in R&D and return cash to shareholders. Click here to read more., Headline: Salveo Innovations: How an mHealth Application Gives Patients a Greater Sense of Self-Agency, source:Yahoo, summary: Now that the Cisco Global Problem Solver Challenge 2022 winners have been officially announced, you'll want to learn more about each winning team and the story behind each innovation. The Cisco Global Problem Solver Challenge is an online competition that awards cash prizes to early-stage tech entrepreneurs solving the world's toughest problems., Headline: 300th Episode: Buffett's 2008 Lessons, source:Yahoo, summary: Scared of the sell-off? Investors were scared in 2008 too. Here's what Buffett said to do., Headline: Cisco Systems (CSCO) Dips More Than Broader Markets: What You Should Know, source:Yahoo, summary: In the latest trading session, Cisco Systems (CSCO) closed at $41.52, marking a -1.12% move from the previous day.",CSCO
16,2022-10-07,"Headline: Zacks Value Trader Highlights: ExxonMobil, Pfizer, Union Pacific, Cisco and PNC Financial, source:Yahoo, summary: ExxonMobil, Pfizer, Union Pacific, Cisco and PNC Financial are part of the Zacks Value Trader blog., Headline: Verizon: An Undervalued Teleco - GuruFocus.com, source:GuruFocus, summary: GuruFocus Article or News written by Ben Alaimo and the topic is about: The company is poised to be a leader in 5G, Headline: Top 13 High Dividend Stocks to Buy According to Hedge Funds, source:Yahoo, summary: In this article, we discuss top 13 high-dividend stocks to buy according to hedge funds. You can skip our detailed analysis of dividend stocks and their returns, and go directly to read Top 5 High Dividend Stocks to Buy According to Hedge Funds. Dividend stocks are gaining popularity among investors as these stocks can potentially […], Headline: Cisco Systems, Inc. stock performance and analyst projections, source:Yahoo, summary: Cisco Systems, Inc. stock is trending on the Yahoo Finance Platform. Here is a visualization of $CSCO performance over time, how that performance compares to the wider industry, and analyst projections for the current quarter.Check out the ticker page here.",CSCO
17,2022-10-08,"Headline: Cisco Systems, Inc.'s (NASDAQ:CSCO) Business Is Trailing The Market But Its Shares Aren't, source:Yahoo, summary: With a median price-to-earnings (or ""P/E"") ratio of close to 14x in the United States, you could be forgiven for...",CSCO
18,2022-10-09,"Headline: 10 Dividend Growth Stocks For October 2022, source:TalkMarkets, summary: nan",CSCO
19,2022-10-10,"Headline: Five9 shares plunge more than 20% after CEO announces resignation , source:CNBC, summary: Shares of cloud software provider Five9 fell 22% Monday after CEO Rowan Trollope said he's stepping down to take the helm of a pre-IPO company., Headline: RingCentral added to ‘zombie’ stocks list by equity research firm New Constructs, source:MarketWatch, summary: RingCentral Inc. is a “cash incinerator” at risk of declining to $0 per share, according to New Constructs., Headline: Why I Have A Hold Rating On Oracle, source:SeekingAlpha, summary: Financials are historically growing at below industry average rates; continual stock buyback programs. Click here to read my analysis of why ORCL is a hold., Headline: Wide-Moat Stocks On Sale - The October 2022 Heat Map, source:SeekingAlpha, summary: Our 3-step process focuses on wide-moat stocks. Read more as we share the heat map of the most investable candidates that may be worth your time.",CSCO
20,2022-10-11,"Headline: DnB Asset Management AS Buys 1 - GuruFocus.com, source:GuruFocus, summary: GuruFocus Article or News written by insider and the topic is about: , Headline: Consumers want more transparency on how businesses handle their data, new Cisco survey shows, source:Yahoo, summary: Cisco published its 2022 Consumer Privacy Survey*, an annual global review of consumers' perceptions and behaviors on data privacy. This year's survey highlights the critical need for further transparency as consumers say their top priority is for organizations to be more transparent on how they use their personal data. The survey also showed that while, in theory, consumers are supportive of AI (with 54 percent willing to share their anonymized data to improve AI products), many (65 percent) ha, Headline: How Cisco Data Scientists Helped CommonLit Innovate Teacher Feedback for Better Learning, source:Yahoo, summary: Cisco Systems Inc., Headline: Nicholas Ward's Dividend Growth Portfolio: August/September 2022 Update, source:SeekingAlpha, summary: During August, my passive income was up by 2.90% y/y. During September, my passive income was up by 41.14% y/y. Click to see my trades during these two months.",CSCO
21,2022-10-12,"Headline: Cisco, Microsoft announce partnership for meeting room devices, source:Thefly.com, summary: Cisco (CSCO) and Microsof... CSCO, MSFT, Headline: Vodafone Turkey, Cisco and Qwilt to Bring the Future of Content Delivery to 25 Million Subscribers Nationwide, source:Business Wire, summary: No summary, Headline: New partnership brings Microsoft Teams to Cisco meeting room devices, source:Yahoo, summary: Cisco and Microsoft Corp. Wednesday announced at Microsoft's annual Ignite conference a new partnership that will provide customers with more choice. In the first half of 2023, Cisco and Microsoft will soon offer the ability to run Microsoft Teams natively on Cisco Room and Desk devices Certified for Microsoft Teams, with the option of Teams as the default experience. Cisco will become a partner in the Certified for Microsoft Teams program for the first time., Headline: Cisco partners with Microsoft to add Teams to its meeting devices, source:Reuters, summary: Networking firm Cisco Systems Inc. will add Microsoft Corp.'s Teams messaging app to its meeting devices, the two firms said on Wednesday, offering users an alternative to its own Webex video conferencing app., Headline: Should You Think About Buying Cisco Systems, Inc. (NASDAQ:CSCO) Now?, source:Yahoo, summary: Today we're going to take a look at the well-established Cisco Systems, Inc. ( NASDAQ:CSCO ). The company's stock..., Headline: Microsoft Unveils App To Help Hybrid Workforce Decide When to Go Into the Office, source:Yahoo, summary: (Bloomberg) -- Microsoft Corp. will introduce an app to help employees and managers in a hybrid workplace decide what’s the right time to go into the office. Most Read from BloombergIntel Is Planning Thousands of Job Cuts in Face of PC SlumpHere’s How Weird Things Are Getting in the Housing MarketPutin Says All Infrastructure at Risk After Nord Stream HitAlex Jones Must Pay $965 Million for His Sandy Hook LiesUS Core Inflation Seen Returning to 40-Year High as Rents RiseThe new Microsoft Places, Headline: Cisco Systems Inc. stock underperforms Wednesday when compared to competitors, source:MarketWatch, summary: Shares of Cisco Systems Inc. shed 0.78% to $39.27 Wednesday, on what proved to be an all-around dismal trading session for the stock market, with the S&P 500..., Headline: Cisco Systems (CSCO) Dips More Than Broader Markets: What You Should Know, source:Yahoo, summary: Cisco Systems (CSCO) closed at $39.27 in the latest trading session, marking a -0.78% move from the prior day., Headline: Interesting CSCO Put And Call Options For December 2nd, source:Stock Options Channel, summary: Staff article entitled Interesting CSCO Put And Call Options For December 2nd, about stock options, from Stock Options Channel.",CSCO
22,2022-10-13,"Headline: Top 5 3rd Quarter Trades of NA - GuruFocus.com, source:GuruFocus, summary: GuruFocus Article or News written by insider and the topic is about: , Headline: SCHD: Buy Here And Ride Through The Coming Recession (Technical Analysis), source:SeekingAlpha, summary: The Schwab ETF is a high-quality ETF that invests in dividend-paying companies across the growth and value sphere. Read a full investment analysis here., Headline: 12 Best IoT Stocks to Buy Now, source:Yahoo, summary: In this article, we discuss the 12 best Internet-of-Things (IoT) stocks to buy now. If you want to read about some more IoT stocks, go directly to 5 Best IoT Stocks to Buy Now. The Internet-of-Things (IoT) industry has advanced by leaps and bounds in the past few years, emerging from niche corners of the […], Headline: Unergy: How a Platform Allows Anyone To Invest in and Consume Clean Energy, source:Yahoo, summary: Cisco Systems Inc.:, Headline: Microsoft (MSFT) Brings Apple iCloud Integration to Windows, source:Yahoo, summary: Microsoft (MSFT) reveals that Apple Music and Apple TV are coming to the Microsoft Store soon. Also, iCloud Photos integration will be available on the Windows 11 Photos app., Headline: Cisco Systems Inc. stock rises Thursday, outperforms market, source:MarketWatch, summary: Shares of Cisco Systems Inc. rallied 3.41% to $40.61 Thursday, on what proved to be an all-around favorable trading session for the stock market, with the...",CSCO
