,date,information,related
188,2023-04-05,"Headline: Is Cisco Systems, Inc. (NASDAQ:CSCO) Trading At A 29% Discount?, source:Yahoo, summary: Key Insights The projected fair value for Cisco Systems is US$73.09 based on 2 Stage Free Cash Flow to Equity Current..., Headline: Dow Jones Reverses After ADP Jobs Data; C3.ai Continues To Plunge After Short-Seller Letter, source:Yahoo, summary: The Dow Jones reversed higher Wednesday morning after ADP's jobs data. AI stock C3.ai plunged another 12% after Tuesday's short-seller letter., Headline: Trickle Up: Leveraging Technology To Build Economic Opportunity and Drive Inclusion for Women in Extreme Poverty, source:Yahoo, summary: Cisco Systems Inc., Headline: Fair Isaac (FICO) Increases Potential With 12 Patent Grants, source:Yahoo, summary: Fair Isaac (FICO) announces the grant of 12 new patents leading to innovations in data analytics and AI, reflecting on a strong product portfolio and expanding clientele., Headline: Cisco Systems Inc. stock remains steady Wednesday, still outperforms market, source:MarketWatch, summary: Shares of Cisco Systems Inc. were unchanged Wednesday, on what proved to be an all-around mixed trading session for the stock market, with the Dow Jones..., Headline: 3 Dream Retirement Stocks You Don’t Want to Miss Out On, source:Yahoo, summary: There is never a bad time to check out the best retirement stocks to buy. It is because you can always start thinking about your retirement regardless of age or career stage. Furthermore, exploring stocks for retirement investment can provide an excellent opportunity to analyze some of the most successful companies. Investing for the long term can seem intimidating in today’s fast-paced world. Recent events, such as the pandemic, supply chain, inflation crisis, war in Ukraine, and bank collapses",CSCO
189,2023-04-06,"Headline: Nicholas Ward`s Dividend Growth Portfolio: Special Fixed Income Edition, source:Seeking Alpha, summary: No summary, Headline: My Dividend Growth Portfolio - Q1 2023 Summary, source:Seeking Alpha, summary: No summary, Headline: Cisco Systems, Inc. (CSCO) is Attracting Investor Attention: Here is What You Should Know, source:Yahoo, summary: No summary, Headline: Dow Jones Falls After Surprise Jump In Jobless Claims; Costco Slides On Sales Drop, source:Yahoo, summary: The Dow Jones fell Thursday after a surprise jump in first-time jobless claims. Costco slid after reporting a monthly same-stores sales drop,, Headline: Cisco Systems Inc. stock underperforms Thursday when compared to competitors, source:MarketWatch, summary: Shares of Cisco Systems Inc. slipped 1.06% to $51.27 Thursday, on what proved to be an all-around positive trading session for the stock market, with the S&P..., Headline: Nicholas Ward's Dividend Growth Portfolio: Special Fixed Income Edition, source:SeekingAlpha, summary: My passive income stream grew by 22.63% in February and by 46.87% in March. Read more as I review my February and March results in this piece.",CSCO
190,2023-04-07,"Headline: 10 Blue-Chip Tech Stocks For Growing Dividends, source:TalkMarkets, summary: No summary, Headline: Magic Formula Dividend Portfolio For April, source:SeekingAlpha, summary: The following is a dividend portfolio strategy for large caps that score the highest amongst Joel Greenblatt's Magic Formula screener. Read more about the list here., Headline: Can artificial intelligence reverse the tech downturn? Startups are hiring for the next big thing., source:MarketWatch, summary: No summary",CSCO
191,2023-04-09,"Headline: April MDA Breakout Stocks/ETFs Week 15 - 2023: High-Frequency Gainers To Give You An Edge, source:SeekingAlpha, summary: Two new Breakout Stocks for Week 15 with better than 10% short-term upside, ETF updates and a Dow 30 Picks. Average cumulative returns for 2023 are +48.5% YTD., Headline: Cisco Systems, Inc. (NASDAQ:CSCO) is largely controlled by institutional shareholders who own 75% of the company, source:Yahoo, summary: Key Insights Significantly high institutional ownership implies Cisco Systems' stock price is sensitive to their...",CSCO
192,2023-04-10,"Headline: Cisco engineers` discrimination case dismissed, but caste bias suit continues, source:MarketWatch, summary: No summary, Headline: Dow Jones Falls On March Jobs Report; Tesla Skids On Price Cuts; Apple Sells Off As PC Shipments Drop 40% In Q1, source:Yahoo, summary: The Dow Jones dropped after the March jobs report. Tesla stock skidded on more price cuts, while Apple PC shipments dropped 40% in Q1., Headline: Cisco Systems Inc. stock outperforms competitors on strong trading day, source:MarketWatch, summary: Shares of Cisco Systems Inc. inched 0.12% higher to $51.33 Monday, on what proved to be an all-around positive trading session for the stock market, with the..., Headline: Cisco engineers' discrimination case dismissed, but caste bias suit continues, source:MarketWatch, summary: The California Civil Rights Department has voluntarily dismissed its case alleging caste discrimination against two Cisco engineers, while still keeping..., Headline: Cisco still faces caste bias suit; engineers' case dismissed, source:Yahoo, summary: The California Civil Rights Department has voluntarily dismissed its case alleging caste discrimination against two Cisco engineers, while still keeping alive its litigation against the Silicon Valley tech giant.  The two Cisco supervisors, Sundar Iyer and Ramana Kompella, were accused in the department’s lawsuit of discriminating and harassing an employee on the basis of caste – a division of people based on birth or descent.  The employee belonged to the Dalit community, a group that is at the bottom rung of the caste system which took root and evolved in India and elsewhere in the subcontinent.",CSCO
193,2023-04-11,"Headline: How Cisco Employees Are Involved With Community Impact, source:Yahoo, summary: Cisco Systems Inc., Headline: Dow Jones Rises As Bitcoin Jumps Above $30,000; 7 Top Stocks To Buy And Watch, source:Yahoo, summary: The Dow Jones rose Tuesday, as the price of Bitcoin surged, topping $30,000 for the first time since June 2022., Headline: Cisco Systems Inc. stock outperforms competitors despite losses on the day, source:MarketWatch, summary: Shares of Cisco Systems Inc. slipped 1.38% to $50.62 Tuesday, on what proved to be an all-around mixed trading session for the stock market, with the S&P 500..., Headline: CPI Looming: 3 Low-Beta Stocks to Combat Volatility, source:Yahoo, summary: With CPI looming, investors may want to visit low-beta stocks as a shield against volatility. As we all know by now, CPI days have become quite a market-moving event.",CSCO
194,2023-04-12,"Headline: My Dividend Stock Portfolio: New All-Time Dividend Record - 99 Holdings With 25 Buys, source:SeekingAlpha, summary: My dividend income in March amounted to a record $950. This represents growth of 61% Y/Y and 40% sequentially. Click here for a detailed analysis., Headline: TD Cowen cybersecurity analyst to hold an analyst/industry conference call, source:Thefly.com, summary: No summary, Headline: Dow Jones Rallies 150 Points On Cool CPI Inflation Data; Fed Minutes Later, source:Yahoo, summary: The Dow Jones Industrial Average rallied 150 points Wednesday morning on cool inflation data, with the release of the Consumer Price Index., Headline: 4 Generative AI Tech Stocks to Buy as ChatGPT Gains Momentum, source:Yahoo, summary: Here we present four tech giants, CRM, BIDU, CSCO and ADBE, which are set to compete with Microsoft-backed ChatGPT, as generative AI gains prominence., Headline: Fortinet: Poised For Sustainable Growth Amid Expanding Network Security Market, source:SeekingAlpha, summary: Fortinet's unique ASIC chip technology and expansion into new use cases give it a competitive edge in the network security market. See why I rate FTNT a buy., Headline: Cisco Systems Inc. stock underperforms Wednesday when compared to competitors, source:MarketWatch, summary: Shares of Cisco Systems Inc. slid 1.01% to $50.11 Wednesday, on what proved to be an all-around rough trading session for the stock market, with the S&P 500...",CSCO
195,2023-04-13,"Headline: Cisco`s Sustainability 101: Greenhouse Gas Emissions, Global Warming, and Climate Change, source:Accesswire, summary: No summary, Headline: Zoom Video: An Unattractive Risk-Reward Profile, source:SeekingAlpha, summary: nan, Headline: Interesting CSCO Put And Call Options For June 2nd, source:Stock Options Channel, summary: No summary, Headline: The Zacks Analyst Blog Highlights Salesforce, Cisco Systems, Baidu and Adobe, source:Yahoo, summary: Salesforce, Cisco Systems, Baidu and Adobe are part of the Zacks top Analyst Blog., Headline: Cisco’s Sustainability 101: Greenhouse Gas Emissions, Global Warming, and Climate Change, source:Yahoo, summary: Cisco Systems Inc., Headline: Ukraine’s prime minister urges U.S. companies to join $411 billion reconstruction effort, source:MarketWatch, summary: Ukraine’s economy has declined by a third since Russia's invasion on Feb. 24, 2022. Prime Minister Denys Shmyhal is calling for ‘a new Marshall Plan’ to aid..., Headline: Cisco Systems, Inc.'s (NASDAQ:CSCO) stock dropped 3.3% this week, offering solace to those who sold earlier in the year, source:Yahoo, summary: Despite the fact that Cisco Systems, Inc.'s (NASDAQ:CSCO) value has dropped 3.3% in the last week insiders who sold..., Headline: Dow Jones Reverses Lower After Jobless Claims, Inflation Data; Delta Slides On Earnings, source:Yahoo, summary: The Dow Jones turned lower Thursday after first-time jobless claims and more key inflation data. Delta Air Lines sold off on weak earnings., Headline: Cisco Systems Inc. stock outperforms market on strong trading day, source:MarketWatch, summary: Shares of Cisco Systems Inc. advanced 1.38% to $50.80 Thursday, on what proved to be an all-around favorable trading session for the stock market, with the..., Headline: ���Dangerous times`: These aerospace and defense, cybersecurity ETFs are on ���verge of breakouts`, source:MarketWatch, summary: No summary",CSCO
196,2023-04-14,"Headline: See Which Of The Latest 13F Filers Holds Cisco Systems, source:Preferred Stock Channel, summary: No summary, Headline: Cisco Systems Inc. stock falls Friday, underperforms market, source:MarketWatch, summary: Shares of Cisco Systems Inc. slumped 0.51% to $50.54 Friday, on what proved to be an all-around grim trading session for the stock market, with the S&P 500..., Headline: Seeking Income? 3 Tech Stocks Worth Considering, source:Yahoo, summary: For those who don't mind a little extra risk on the table and still seek paydays, dividend-paying technology stocks could be worthy considerations.",CSCO
197,2023-04-16,"Headline: Better Buy For Retiring With Dividends: VYM Or SCHD?, source:SeekingAlpha, summary: VYM and SCHD provide an all-in-one solution by offering attractive and growing dividend income streams. Check out which is the better buy at the moment.",CSCO
198,2023-04-17,"Headline: HP Enterprise price target raised to $17 from $16 at BofA, source:Thefly.com, summary: No summary, Headline: Zoom stock slips as Citi opens up downside catalyst watch, source:Seeking Alpha, summary: No summary, Headline: Cisco and Credit Suisse to Host a Tech Talk on Cisco's Security Business, source:Yahoo, summary: Cisco and Credit Suisse will host a webcast with Jeetu Patel, Executive Vice President and General Manager of Cisco's Security and Collaboration businesses, to discuss Cisco's security strategy and our products' unique features and capabilities. Interested parties can find more information on Cisco's Investor Relations website at https://investor.cisco.com/., Headline: Dow Jones Rises Amid Economic Data; State Street Crashes 18% On Earnings Miss, source:Yahoo, summary: The Dow Jones rose Monday, with Q1 earnings season set to heat up this week. State Street crashed 18% on an earnings miss., Headline: Cisco Systems Inc. stock falls Monday, underperforms market, source:MarketWatch, summary: Shares of Cisco Systems Inc. shed 0.51% to $50.28 Monday, on what proved to be an all-around great trading session for the stock market, with the S&P 500..., Headline: Analyzing Patent Intellectual Property In High Technology Companies, source:SeekingAlpha, summary: nan, Headline: Zoom Stock Slides as Analyst Warns of Weakening Demand, source:Yahoo, summary: Citi analyst Tyler Radke set a ""negative catalyst watch"" on the shares, maintaining a rating of Sell on the videoconferencing company., Headline: Dow Jones Futures: Netflix, Tesla Earnings On Deck; What To Do Now In Today's Stock Market, source:Yahoo, summary: Dow Jones futures were lower late. Netflix earnings are due and Tesla earnings are on deck, as first-quarter earnings season heats up.",CSCO
199,2023-04-18,"Headline: Dow Jones Falls As Goldman Sachs Slides On Earnings; Nvidia Jumps On Buy Rating, source:Yahoo, summary: The Dow Jones fell modestly Tuesday, as Goldman Sachs dived on weak sales results. Nvidia stock jumped on an analyst buy rating., Headline: Ericsson Stock Falls After Earnings as 5G Spending Slows, source:MarketWatch, summary: First-quarter sales were about flat from a year ago when adjusting for acquisitions and foreign exchange., Headline: Cisco Systems Inc. stock rises Tuesday, still underperforms market, source:MarketWatch, summary: Shares of Cisco Systems Inc. inched 0.06% higher to $50.31 Tuesday, on what proved to be an all-around mixed trading session for the stock market, with the..., Headline: Unusual Put Option Trade in Cisco Systems (CSCO)  Worth $400.00K, source:Fintel, summary: nan, Headline: Noteworthy Wednesday Option Activity: CSCO, LH, NUE, source:Stock Options Channel, summary: No summary, Headline: Cisco, UnitedHealth share losses lead Dow`s 138-point fall, source:MarketWatch, summary: No summary",CSCO
200,2023-04-19,"Headline: Cisco: Sharing Career Opportunities and Advice with the Women of Bennett College, source:Yahoo, summary: Bennett College was founded in 1873 in the basement of St. Matthews Methodist Episcopal Church in Greensboro, NC., Headline: Cisco, Walt Disney share losses contribute to Dow`s 150-point fall, source:MarketWatch, summary: No summary, Headline: Cisco, Walt Disney share losses contribute to Dow's 150-point fall, source:MarketWatch, summary: Shares of Cisco and Walt Disney are retreating Wednesday morning, sending the Dow Jones Industrial Average into negative territory. Shares of Cisco and Walt..., Headline: Video: Dow Movers: CSCO, TRV, source:Market News Video, summary: No summary, Headline: Cisco Systems, Inc.'s (NASDAQ:CSCO) Stock Has Shown A Decent Performance: Have Financials A Role To Play?, source:Yahoo, summary: Cisco Systems' (NASDAQ:CSCO) stock is up by 7.3% over the past three months. As most would know, long-term fundamentals..., Headline: 4-Factor Dividend Growth Portfolio - Sour Month, source:SeekingAlpha, summary: nan, Headline: Cisco Systems stock falls 4% on high trading activity, source:Seeking Alpha, summary: No summary, Headline: Dow drops 50 points on losses in shares of Cisco, UnitedHealth, source:MarketWatch, summary: Dragged down by losses for shares of Cisco and UnitedHealth, the Dow Jones Industrial Average is falling Wednesday afternoon. The Dow was most recently..., Headline: Dow Jones Falls: Netflix Slides On Q1 Results, Tesla Skids On Pre-Earnings Price Cuts, source:Yahoo, summary: The Dow Jones fell Wednesday morning, as Netflix dropped on weak subscriber growth. Tesla skidded on more price cuts ahead of earnings., Headline: Cisco, UnitedHealth share losses lead Dow's 138-point fall, source:MarketWatch, summary: Shares of Cisco and UnitedHealth are trading lower Wednesday afternoon, sending the Dow Jones Industrial Average into negative territory. Shares of Cisco and..., Headline: Cisco Systems Inc. stock underperforms Wednesday when compared to competitors, source:MarketWatch, summary: Shares of Cisco Systems Inc. shed 4.51% to $48.04 Wednesday, on what proved to be an all-around dismal trading session for the stock market, with the S&P 500..., Headline: RSI Alert: Cisco Systems Now Oversold, source:Dividend Channel, summary: No summary, Headline: CSCO Makes Notable Cross Below Critical Moving Average, source:Dividend Channel, summary: No summary, Headline: Cisco Systems Vs. Dell Technologies which Computer Stock is the Better Buy, source:Yahoo, summary: With sentiment continuing to grow toward the broader technology sector, this poses the question of if it's time to buy either of these historic tech companies., Headline: Market ""Fear Gauge"" Snaps Losing Streak As Earnings Disappoint, source:TalkMarkets, summary: No summary",CSCO
201,2023-04-20,"Headline: As IT budgets tighten, cybersecurity companies see growing demand, source:Seeking Alpha, summary: No summary, Headline: 2 Magic Formula Technology Stocks to Watch, source:GuruFocus, summary: No summary, Headline: SentinelOne fits criteria for strategic interest, says TD Cowen, source:Thefly.com, summary: No summary, Headline: DIVB: Shareholder Yield Is A Good Idea, But Cambria Did It Better, source:SeekingAlpha, summary: nan, Headline: Tesla Tarnished, Elon's 'Autonomy', Beige Book Plot Thickens, Cisco Plunges, source:Yahoo, summary: Another long, slow, dull trading session, the umpteenth in a row, had come to its conclusion up and down Wall Street.  Wall Street has, or at least had a champion.  The stock had opened weakly on Wednesday morning, but had strengthened into the afternoon, selling off again though... just ahead of that closing bell., Headline: Here is What to Know Beyond Why Cisco Systems, Inc. (CSCO) is a Trending Stock, source:Yahoo, summary: No summary, Headline: Dow falls nearly 150 points on losses for Verizon, Cisco shares, source:MarketWatch, summary: Behind negative returns for shares of Verizon and Cisco, the Dow Jones Industrial Average is trading down Thursday afternoon. Shares of Verizon and Cisco are..., Headline: Can Cisco-Rival Arista Grow Into A Top Artificial Intelligence Stock?, source:Yahoo, summary: Arista Networks stock has gained 1,360% since it went public in 2014. Now investors wonder whether generative AI will drive new growth., Headline: Cisco Systems Inc. stock underperforms Thursday when compared to competitors, source:MarketWatch, summary: Shares of Cisco Systems Inc. slipped 3.04% to $46.58 Thursday, on what proved to be an all-around poor trading session for the stock market, with the S&P 500..., Headline: Catalyst watch: Earnings blitz, Mobileye lockup expiration and the new one-day VIX debut, source:Seeking Alpha, summary: No summary",CSCO
202,2023-04-21,"Headline: Cisco Is A Solid Addition To Your Dividend Growth Portfolio, source:SeekingAlpha, summary: nan, Headline: Is Zoom A Buy Amid Race To Add Artificial Intelligence To Workplace Collaboration?, source:Yahoo, summary: The pandemic-driven growth of Zoom Video is long over. Corporate clients could boost Zoom stock but Microsoft looms., Headline: Top 10 Technology Stocks to Buy in 2023 According to Ray Dalio, source:Yahoo, summary: In this article, we discuss the top 10 technology stocks to buy in 2023, according to Ray Dalio. If you want to skip our detailed analysis of Dalio’s investment philosophy and portfolio construction, go directly to the Top 5 Technology Stocks to Buy in 2023, According to Ray Dalio. Billionaire Ray Dalio argued in a recent interview […], Headline: Cisco Systems (CSCO) Outpaces Stock Market Gains: What You Should Know, source:Yahoo, summary: Cisco Systems (CSCO) closed at $47.03 in the latest trading session, marking a +0.97% move from the prior day.",CSCO
203,2023-04-22,"Headline: Cisco: Unlikely To Reverse Trajectory In The Near Term, source:Seeking Alpha, summary: No summary, Headline: Dividend Champion, Contender, And Challenger Highlights: Week Of April 23, source:SeekingAlpha, summary: nan",CSCO
204,2023-04-23,"Headline: Cisco Systems Inc. stock outperforms market on strong trading day, source:MarketWatch, summary: No summary",CSCO
205,2023-04-24,"Headline: The 7 Best 5G Stocks to Buy for the Next Decade, source:InvestorPlace, summary: No summary, Headline: Is Now An Opportune Moment To Examine Cisco Systems, Inc. (NASDAQ:CSCO)?, source:Yahoo, summary: Let's talk about the popular Cisco Systems, Inc. ( NASDAQ:CSCO ). The company's shares saw significant share price..., Headline: Cisco Unveils New Solution to Rapidly Detect Advanced Cyber Threats and Automate Response, source:Yahoo, summary: RSA CONFERENCE 2023 -- Cisco (NASDAQ: CSCO), the leader in enterprise networking and security, unveiled the latest progress towards its vision of the Cisco Security Cloud, a unified, AI-driven, cross-domain security platform. Cisco's new XDR solution and the release of advanced features for Duo MFA will help organizations better protect the integrity of their entire IT ecosystem., Headline: Cisco Sees AI Software Making Phishing Attacks Harder to Resist, source:Yahoo, summary: (Bloomberg) -- Cisco Systems Inc. warned that artificial intelligence software such as OpenAI’s ChatGPT will make phishing attempts much harder to detect, requiring companies to adopt new defenses. Most Read from BloombergTucker Carlson Leaves Fox News in Shakeup After SettlementClarence Thomas’s Billionaire Friend Did Have Business Before the Supreme CourtFox Fired ‘Uncontrollable’ Host Tucker Carlson, Who Badmouthed BossesTucker Carlson’s Fox News Exit Erases $507 Million in ValueCNN Anchor Do, Headline: The 7 Best 5G Stocks to Buy for the Next Decade, source:Yahoo, summary: As we march forward toward a hyperconnected future, the importance of 5G stocks is becoming increasingly evident. 5G, the fifth generation of cellular network technology, will likely revolutionize communication, offering stronger speeds, more reliable connections, and a myriad of opportunities for innovation. Moreover, with over 250 global commercial 5G network deployments already and robust momentum in mid-band and high-band spectrum auctions, the 5G future is full of promise. For those interes",CSCO
206,2023-04-25,"Headline: What National Volunteer Month Means to Cisco Habitat Champions, source:Yahoo, summary: Cisco Systems Inc., Headline: Cisco joins the AI wave ��� to protect against misuse of the technology, source:MarketWatch, summary: No summary, Headline: Cisco joins the AI wave — to protect against misuse of the technology, source:MarketWatch, summary: Cisco execs caution that OpenAI’s ChatGPT will make phishing attempts in particular harder to detect., Headline: Cisco Looks To Mint ChatGPT Driven Sophisticated Hacks With Latest Offering, source:Yahoo, summary: Cisco Systems, Inc (NASDAQ: CSCO) warned against artificial intelligence software like OpenAI's ChatGPT making phishing attempts much harder to detect. At the 2023 RSA Conference, Cisco launched a unified, AI-driven, cross-domain security platform. Cisco's new XDR solution and the advanced features for Duo MFA will help organizations better protect the integrity of their entire IT ecosystem. Phishing accounts for about 80% of illicit access into computer systems, where hackers send emails or tex, Headline: Cisco Systems Inc. stock falls Tuesday, still outperforms market, source:MarketWatch, summary: Shares of Cisco Systems Inc. dropped 0.63% to $47.09 Tuesday, on what proved to be an all-around poor trading session for the stock market, with the S&P 500...",CSCO
207,2023-04-26,"Headline: Concerned Shareholders of Cano Health Issue Open Letter Regarding the Board’s Entrenchment Maneuvers and Latest Governance Failures, source:Business Wire, summary: No summary, Headline: MMAT Stock Alert: Meta Materials Appoints New CFO, COO, source:InvestorPlace, summary: No summary, Headline: Cisco Systems Inc. stock falls Wednesday, underperforms market, source:MarketWatch, summary: Shares of Cisco Systems Inc. shed 1.17% to $46.54 Wednesday, on what proved to be an all-around dismal trading session for the stock market, with the S&P 500..., Headline: Cisco Is Cheap But Fraught With Risks, source:SeekingAlpha, summary: Cisco's growth initiatives include acquisitions and the successful Catalyst 9k product line. See why we maintain a neutral stance on CSCO stock.",CSCO
208,2023-04-27,"Headline: See How Cisco Systems Ranks Among Analysts` Top Dow 30 Picks, source:ETF Channel, summary: No summary, Headline: Video: Dow Analyst Moves: CSCO, source:Market News Video, summary: No summary, Headline: Akvo: The Next Generation of Data Collection for Sustainable Development, source:Yahoo, summary: Cisco Systems Inc., Headline: Tech is Back: 3 ETFs to Invest in the Sector, source:TipRanks, summary: No summary, Headline: Tech is Back. 3 ETFs to Invest in the Sector, source:TipRanks, summary: No summary, Headline: These 2 Computer and Technology Stocks Could Beat Earnings: Why They Should Be on Your Radar, source:Yahoo, summary: Finding stocks expected to beat quarterly earnings estimates becomes an easier task with our Zacks Earnings ESP., Headline: Cisco, Caterpillar and More Fortress Stocks to Buy in a Messy Market, source:Yahoo, summary: A few stocks, mainly in tech, are responsible for most of the market's gain this year as investors rush into companies with deep so-called competitive moats., Headline: Cisco Systems (CSCO) Gains But Lags Market: What You Should Know, source:Yahoo, summary: Cisco Systems (CSCO) closed the most recent trading day at $46.56, moving +0.04% from the previous trading session., Headline: DA Davidson DEN group to hold an analyst/industry conference call, source:Thefly.com, summary: No summary",CSCO
