,date,information,related
268,2023-07-03,"Headline: It's All About Liquidity - David Trainer, source:SeekingAlpha, summary: David Trainer discusses sectors, stocks and investing strategies. For near-term, it's really all about liquidity., Headline: Not A Market For The Dogs Of The Dow, source:SeekingAlpha, summary: With the first half of 2023 coming to a close this past Friday, the equity markets rewarded investors with strong performance., Headline: Ex-Dividend Reminder: Cisco Systems, AECOM and ABM Industries, source:Dividend Channel, summary: No summary, Headline: Cisco Systems Stock (NASDAQ:CSCO): Still Attractive after Recent Rally, source:TipRanks, summary: No summary, Headline: Cisco Systems Stock (NASDAQ:CSCO): Still Attractive Despite Recent Rally, source:TipRanks, summary: No summary, Headline: July MDA Breakout Stocks Week 27 - 2023: High-Frequency Gainers To Give You An Edge, source:SeekingAlpha, summary: Two new sample Breakout Stocks for Week 27 with better than 10% short-term upside and a Dow 30 Picks. Click here to see our take on exclusive top picks., Headline: 10 Stocks Jumping On The Generative AI Wagon, source:Yahoo, summary: In this article, we will be taking a look at 10 stocks jumping on the generative AI wagon. To skip our detailed analysis of the developments taking place within the AI sector, you can go directly to read about the 5 Stocks Jumping On The Generative AI Wagon. The markets have been overwhelmingly influenced by […], Headline: The 3 Best Stocks to Invest in Before Biden’s Broadband Plan Takes Off, source:Yahoo, summary: As part of the Infrastructure Investment and Jobs Act, President Joe Biden has kicked off more than $42 billion to accelerate high-speed internet access, thus boding well for so-called Biden broadband stocks. According to CNBC, the effort aims to provide the aforementioned access to every American household by 2030. To be sure, the Biden Administration has courted fierce criticism, even among Democrats. However, it’s difficult to deny the White House’s policy impact on stocks. Following a tumult",CSCO
269,2023-07-04,"Headline: P/E Ratio Insights for Cisco Systems, source:Benzinga, summary: No summary, Headline: Cisco Leverages Generative AI Capabilities Across Its Portfolio, source:TalkMarkets, summary: No summary, Headline: 3 Top Cybersecurity Stocks to Buy in July, source:Yahoo, summary: Last month I discussed why Fortinet, Palo Alto Networks, and CrowdStrike were all great long-term plays on that secular trend.  Today I'll add three more promising cybersecurity stocks to that list: Cisco (NASDAQ: CSCO), Zscaler (NASDAQ: ZS), and Cloudflare (NYSE: NET).  Many investors forget that Cisco, the world's largest networking hardware company, also owns a massive cybersecurity business., Headline: Cisco Systems (NASDAQ:CSCO) Is Very Good At Capital Allocation, source:Yahoo, summary: There are a few key trends to look for if we want to identify the next multi-bagger. Ideally, a business will show two..., Headline: 3 Cheap Tech Stocks to Buy Before They Bounce Back, source:Yahoo, summary: Many tech stocks have been doing well in 2023. The Invesco QQQ Trust Series 1 (NASDAQ:QQQ) is up roughly 40% year-to-date (YTD). This benchmark contains the top tech companies, but not every company in the index is up 40% YTD. Top winners like Nvidia (NASDAQ:NVDA) have outsized presence in the index and played more of a role in the YTD gains. However, some of the undervalued tech stocks that didn’t contribute to the increase, or even dragged down the QQQ, still look promising. Some investors zig",CSCO
270,2023-07-05,"Headline: Occidental Petroleum, AT&T, Cisco: Unloved stocks to watch, source:Yahoo, summary: Tech stocks like Nvidia and Apple fueled the market throughout the first half of the year, but what about some of the stocks that didn't receive as much recognition? Yahoo Finance Executive Editor Brian Sozzi joins the Live show to discuss three unloved stocks to watch as we continue into the second half of 2023, including Occidental Petroleum, AT&T, and Cisco Systems., Headline: Cisco Systems Inc. stock rises Wednesday, outperforms market, source:MarketWatch, summary: Shares of Cisco Systems Inc. inched 0.16% higher to $51.51 Wednesday, on what proved to be an all-around rough trading session for the stock market, with the..., Headline: 15 Most Profitable Toll Roads In The World, source:Yahoo, summary: This detailed article will discuss the 15 most profitable toll roads in the world and their fares. In it, you’ll also get to see how the pandemic impacted the world’s major road networks and their revenues. If you want to skip the details, read 5 Most Profitable Toll Roads In The World. The most profitable […], Headline: The 7 Best Cybersecurity Stocks to Buy in July, source:Yahoo, summary: While most everyone appreciates the conveniences that digitalization and its underlying connectivity foster, investors should nevertheless consider the best cybersecurity stocks to buy. Although people should think the best of each other, that’s just not reality. Crimes happen and increasingly, they occur in the digital space. Therefore, investing in cybersecurity makes much logical sense. Further, the backdrop of nefarious activity on the internet makes a cynically excellent case for July cyber, Headline: Needham security/networking analysts hold analyst/industry conference call, source:Thefly.com, summary: No summary",CSCO
271,2023-07-06,"Headline: Palm Valley Capital Fund Q2 2023 Commentary, source:SeekingAlpha, summary: For Q2 2023, the Palm Valley Capital Fund gained 1.62%. Click here to read the full fund letter., Headline: 12 Best Major Stocks to Buy Now, source:Yahoo, summary: In this piece, we will take a look at the 12 best major stocks to buy now. If you want to skip our analysis of the market that sees how major and mega cap stocks have dominated this year, head on over to 5 Best Major Stocks to Buy Now. 2023 has been the year […], Headline: Cisco Systems (CSCO) Stock Moves -0.78%: What You Should Know, source:Yahoo, summary: Cisco Systems (CSCO) closed at $51.11 in the latest trading session, marking a -0.78% move from the prior day.",CSCO
272,2023-07-07,"Headline: Broadcom to invest in EU-backed chip program in Spain, source:Seeking Alpha, summary: No summary, Headline: VONV: Attractive Valuation, Average Performance, source:SeekingAlpha, summary: Vanguard Russell 1000 Value Index Fund ETF favors stocks with low price-to-book, low sales growth, low projected earnings growth. Click for more on VONV ETF., Headline: Cyara Strengthens Partner Program with Appointment of Bryan Mobley as VP of Global Channels and Alliances, source:Finnhub, summary: Cyara, the creator and leader of the Customer Experience  Assurance category, today announced the appointment of Bryan Mobley as the Vice President of Global Channels and Alliances.
In this strategic..., Headline: 25 Best Work from Home Jobs for 2023, source:Yahoo, summary: In this article, we will look at the 25 best work-from-home jobs for 2023. We will also discuss the key companies offering incredible opportunities to work from the comfort of one’s home while also exploring the future of remote work in 2023. If you want to skip our detailed analysis, head straight to 5 Best […], Headline: 3 High-Yield Tech Stocks to Buy in July, source:Yahoo, summary: Passive income from dividends can be a powerful tool for investors working toward financial independence.  It might seem counterintuitive to look at the technology sector when you're talking about dividend stocks, but some very fundamentally sound tech stocks can offer generous dividend yields at today's prices.  Here are three names you can consider adding to any long-term dividend portfolio this month., Headline: The 3 Most Undervalued Tech Stocks to Buy Now, source:Yahoo, summary: The Nasdaq index is up 30% on the year. However, there are still bargains to be found among the wide-ranging world of tech stocks. Some of the biggest and most well-known names in tech have underperformed. Some have badly trailed the market in recent months, and are currently trading at undervalued levels. Accordingly, while many stocks associated with artificial intelligence have skyrocketed, shares of companies in less-desirable industries haven’t performed as well. Companies involved in wirel, Headline: 14 Best NASDAQ Dividend Stocks To Buy, source:Yahoo, summary: In this article, we discuss 14 best NASDAQ dividend stocks to buy. You can skip our detailed analysis of dividend stocks and their returns over the years, and go directly to read 5 Best NASDAQ Dividend Stocks To Buy. NASDAQ is commonly associated with technology and growth-oriented companies that usually don’t pay dividends but there […], Headline: Cisco Systems Inc. stock outperforms market despite losses on the day, source:MarketWatch, summary: Shares of Cisco Systems Inc. shed 0.23% to $50.99 Friday, on what proved to be an all-around dismal trading session for the stock market, with the S&P 500..., Headline: Buy 3 July Dogs Of The Dow, Watch 6, source:SeekingAlpha, summary: Analyst 1-year targets showed 10 highest-yield Dow stocks producing 1.62% LESS gain from $5k invested in the lowest-priced 5. Click for our exclusive stock lists.",CSCO
273,2023-07-08,"Headline: Invest In These 6 Cybersecurity Stocks To Protect Your Finances, source:TalkMarkets, summary: No summary",CSCO
274,2023-07-09,"Headline: July MDA Breakout Stocks Week 28 - 2023: High-Frequency Gainers To Give You An Edge, source:SeekingAlpha, summary: Two new sample Breakout Stocks for Week 28 with better than 10% short-term upside and two Dow 30 Picks. Check out the full weekly update., Headline: Estimating The Intrinsic Value Of Cisco Systems, Inc. (NASDAQ:CSCO), source:Yahoo, summary: Key Insights The projected fair value for Cisco Systems is US$63.31 based on 2 Stage Free Cash Flow to Equity With..., Headline: The 7 Best Value Stocks to Buy in July, source:Yahoo, summary: All of the value stocks listed below are well-known, large-cap companies that provide conservative and defensive exposure to any portfolio. These companies also possess reasonable upside, driven by a number of growth catalysts. Indeed, I’m a believer that each company could reasonably surge higher, given the quality of these key catalysts. Fortunately, each of these companies are relatively low-risk, given their size and dominant market positions. That means they aren’t likely to suffer extreme, Headline: 4 Factor Dividend Growth Portfolio - Cruising Towards A 20% Return, source:SeekingAlpha, summary: The 4-factor dividend growth portfolio is a strategy that leverages the stock selection process of SCHD, with a few minor twists. Learn more about the strategy.",CSCO
275,2023-07-10,"Headline: Cisco Systems a Top Socially Responsible Dividend Stock With 3.1% Yield (CSCO), source:ETF Channel, summary: No summary, Headline: VOOV: A Good Value ETF Despite Methodological Shortcomings, source:SeekingAlpha, summary: Vanguard S&P 500 Value ETF selects large-cap stocks based on book value-to-price, earnings-to-price, and sales-to-price ratios. Click here for more on VOOV ETF., Headline: Cisco Systems Inc. stock rises Monday, outperforms market, source:MarketWatch, summary: Shares of Cisco Systems Inc. inched 0.80% higher to $51.40 Monday, on what proved to be an all-around favorable trading session for the stock market, with..., Headline: 5 Cheap Cybersecurity Stocks to Buy Before They Bounce Back, source:Yahoo, summary: Savvy investors are eyeing cheap yet promising cybersecurity stocks, capitalizing on the growing market trend while contributing to the resilience of our digital infrastructure. The demand for online protection is surging in the wake of the Russian invasion of Ukraine. This exponential increase underscores the pressing necessity for improved digital security measures. As a result, the cybersecurity sector is witnessing substantial growth, making it an opportune time to explore this arena. Recogn, Headline: Cisco Systems: Buy For The Dividend, Hold For The Network AI Upside, source:SeekingAlpha, summary: Cisco's AI potential is underrated. Cisco's cash on hand and free cash flow have grown substantially over the last year., Headline: DA Davidson cybersecurity analyst to hold an analyst/industry conference call, source:Thefly.com, summary: No summary",CSCO
276,2023-07-11,"Headline: Wells Fargo highlights Nasdaq 100 rebalance trade opportunities, source:Seeking Alpha, summary: No summary, Headline: Cisco stumbles on BofA downgrade, firm fears consensus is 'too high', source:Seeking Alpha, summary: No summary, Headline: Cisco Systems (CSCO) Shares Cross 3% Yield Mark, source:Dividend Channel, summary: No summary, Headline: Why did Palo Alto Networks stock drop today? Blame Microsoft, source:Seeking Alpha, summary: No summary",CSCO
277,2023-07-12,"Headline: These Stocks Are Moving the Most Today: Domino’s, Recursion, Lucid, Carvana, and More Stock Market Movers, source:MarketWatch, summary: Domino's agrees to sell pizza on Uber apps, Recursion Pharmaceuticals soars after it receives a $50 million investment from Nvidia, and Lucid delivers..., Headline: Cisco downgraded to Neutral from Buy at BofA, source:Thefly.com, summary: No summary, Headline: BofA downgrades Cisco to Neutral, says consensus seems too high, source:Thefly.com, summary: No summary, Headline: Cisco slips as BofA downgrades on fears that consensus is 'too high', source:Seeking Alpha, summary: No summary, Headline: Will Other Major ETFs Decrease Their Holdings Of Top Stocks As QQQ Is Doing?, source:SeekingAlpha, summary: The Nasdaq 100 index, tracked by QQQ, is set to undergo a special rebalance due to its top holdings becoming overweight. See why QQQ ETF is a Hold., Headline: ClearBridge All Cap Value Strategy Q2 2023 Portfolio Manager Commentary, source:SeekingAlpha, summary: The ClearBridge All Cap Value Strategy outperformed its Russell 3000 Value Index during the second quarter of 2023. Click here to read the full fund letter., Headline: See Which Of The Latest 13F Filers Holds Cisco Systems, source:Preferred Stock Channel, summary: No summary, Headline: Benzinga's Top Ratings Upgrades, Downgrades For July 12, 2023, source:Benzinga, summary: No summary, Headline: Domino’s and DraftKings’ stocks surge, Cisco shares fall, and more stocks on the move, source:MarketWatch, summary: No summary, Headline: Cisco stock drops after BofA downgrade warns of disappointment risk, source:MarketWatch, summary: Shares of Cisco Systems Inc. were declining 0.9% in Wednesday morning trading after BofA Global Research analyst Tal Liani lowered his rating on the..., Headline: B of A Securities Downgrades Cisco Systems (CSCO), source:Fintel, summary: nan, Headline: Cisco Systems Downgraded To Neutral: B Of A Analyst Expresses Concern Over High Street Estimates, source:Benzinga, summary: No summary, Headline: Cisco Stock Is Sliding. Street Revenue Forecasts May Be Too High, Says Analyst., source:Yahoo, summary: BofA analyst Tal Liani downgraded shares of networking giant Cisco to Neutral from Buy, but kept a $56 price target., Headline: 3-Stock Lunch: DKNG, TJX & CSCO, source:CNBC, summary: Jay Woods, Freedom Capital Markets, joins ‘Power Lunch’ to discuss three stocks: DraftKings, TJX Companies and Cisco., Headline: Cisco Systems Inc. stock falls Wednesday, underperforms market, source:MarketWatch, summary: Shares of Cisco Systems Inc. shed 2.65% to $50.74 Wednesday, on what proved to be an all-around great trading session for the stock market, with the S&P 500..., Headline: Check Out What Whales Are Doing With CSCO, source:Benzinga, summary: No summary",CSCO
278,2023-07-13,"Headline: 5 big analyst cuts: Coinbase gets another downgrade, Carvana cut at JPMorgan, source:Yahoo, summary: Here is your Pro Recap of the biggest analyst cuts you may have missed since yesterday: downgrades at Coinbase Global, Carvana, Cisco, Silk Road Medical, and WW Grainger.  Barclays downgraded  Coinbase Global  (NASDAQ:COIN) to Underweight from Equalweight with a price target of $70.00 (from $61.00)., Headline: Wall Street Breakfast Podcast: Palo Alto Under Pressure From Microsoft, source:SeekingAlpha, summary: Why did Palo Alto Networks stock drop? Blame Microsoft. Medalist to suspend dividends for at least the next six months. Elon Musk unveils xAI to 'understand reality'., Headline: Mom, You Must Buy SCHD, It's The 'Ultimate SWAN', source:SeekingAlpha, summary: Today I wanted to highlight Schwab U.S. Dividend Equity ETF. I think my mom will really like SCHD, click for my full SCHD review., Headline: 3 REITs to Weather-Proof Your Portfolio in Any Market Condition, source:InvestorPlace, summary: No summary, Headline: Needham security/networking analysts hold analyst/industry conference call, source:Thefly.com, summary: No summary, Headline: Palo Alto Networks: Microsoft Putting The Heat On Cybersecurity Players, source:SeekingAlpha, summary: Microsoft is increasingly becoming a major player in the cybersecurity market, putting pressure on smaller, less profitable companies in the sector. Read more here., Headline: See How Cisco Systems Ranks Among Analysts' Top Dow 30 Picks, source:ETF Channel, summary: No summary, Headline: Video: Dow Analyst Moves: CSCO, source:Market News Video, summary: No summary, Headline: Cisco: Cheap For A Reason, Declining Market Share, source:SeekingAlpha, summary: Cisco Systems, the biggest communication equipment company, is undervalued and represents a potential opportunity for true value investors. Read more on CSCO., Headline: Cisco Systems Inc. stock outperforms market on strong trading day, source:MarketWatch, summary: Shares of Cisco Systems Inc. rose 1.56% to $51.53 Thursday, on what proved to be an all-around great trading session for the stock market, with the S&P 500..., Headline: Cisco Systems (CSCO) Outpaces Stock Market Gains: What You Should Know, source:Yahoo, summary: In the latest trading session, Cisco Systems (CSCO) closed at $51.53, marking a +1.56% move from the previous day., Headline: Cisco Systems Unusual Options Activity For July 14, source:Benzinga, summary: No summary, Headline: My Dividend Growth Portfolio - Q2 2023 Summary, source:SeekingAlpha, summary: In 2015, I started publishing updates regarding my dividend growth portfolio, and I keep doing so every quarter. Read here for a summary of Q2 of 2023., Headline: Nicholas Ward's Dividend Growth Portfolio: June 2023 Review, source:SeekingAlpha, summary: The significant dividend growth is attributed to rapid rise in interest rates over past 12-18 months, with cash position now yielding nearly 5%. Read more here.",CSCO
279,2023-07-14,"Headline: Cisco Survey Reveals : As Consumers Shift Towards A 'Smarter' Digital Life, Reliability, Security and Sustainability Emerge as Key Needs, source:Finnhub, summary: News Summary:
Consumer expectations will reshape the needs and economics of the internet. Today, more than 60% of consumers in EMEA1 expect to connect cars, appliances, energy and water to the..., Headline: Video: Dow Movers: CSCO, UNH, source:Market News Video, summary: No summary, Headline: Distillate Capital Q2 2023 Letter To Investors, source:SeekingAlpha, summary: A strong rally moved market levels markedly higher in Q2, leaving any angst of Q1's focus on banking turmoil behind. Click here to read the full fund letter., Headline: Cisco Survey Reveals: As Consumers Shift Towards A 'Smarter' Digital Life, Reliability, Security and Sustainability Emerge as Key Needs, source:Yahoo, summary: The Cisco Broadband Survey1, released today, finds that evolving consumer expectations will reshape the needs and economics of the internet. People in EMEA (Europe, Middle East and South Africa) are rethinking what they rely on the internet for, balancing classic demands for speed and reliability, with the intensifying needs of rising eco-consciousness, secure cloud infrastructure, and the consumerisation of technologies such as the Internet of Things (IoT) connecting our devices, from smart car, Headline: DA Davidson cybersecurity analyst to hold an analyst/industry conference call, source:Thefly.com, summary: No summary, Headline: Cisco Systems Inc. stock underperforms Friday when compared to competitors, source:MarketWatch, summary: Shares of Cisco Systems Inc. slipped 2.23% to $50.38 Friday, on what proved to be an all-around mixed trading session for the stock market, with the Dow..., Headline: Cisco: Reflections on the Significance of Juneteenth and the Power of Proclamation, source:Yahoo, summary: Cisco Systems Inc., Headline: Dow Jones Today: Index Up on Healthcare Earnings, source:Yahoo, summary: Primarily on the strength of UnitedHealth Group’s earnings, the Dow Jones gained 125 points, finishing higher every day this week",CSCO
280,2023-07-15,"Headline: Why You Should Aim For $3 Million For Retirement (Gen X'ers And Millennials), source:SeekingAlpha, summary: Saving early and regularly, investing wisely, and budgeting expenses are keys to a wealthy retirement. Read why it's a good time for younger generations to look at retirement scenarios.",CSCO
281,2023-07-16,"Headline: Got $100? Buy This Dominant Tech Stock and Hold it Until 2030, source:Yahoo, summary: While the company's market share has eroded a bit over the years, Cisco remains the undisputed leader in its core markets.  Cisco controlled 43.3% of the Ethernet switch market by revenue in the first quarter, according to IDC, along with 35.1% of the combined service provider and enterprise router market.  In both cases, Cisco's market share is at least triple that of the nearest competitor., Headline: Fed Walking Primrose Path And Cataclysmic Scenarios With David Trainer, source:SeekingAlpha, summary: David Trainer on why he believes the Fed will attempt to walk the primrose path and doesn't believe in cataclysmic scenarios.",CSCO
282,2023-07-17,"Headline: July MDA Breakout Stocks Week 29 - 2023: High-Frequency Gainers To Give You An Edge, source:SeekingAlpha, summary: Two new Breakout Stocks for Week 29 with better than 10% short-term upside and a Dow 30 Pick. Read more to see the full update., Headline: Cisco: Celebrating Nature-Based Solutions This World Environment Day, source:Yahoo, summary: Cisco Systems Inc., Headline: Extreme Networks: Adopting Caution Following Nokia's Dim Outlook, source:SeekingAlpha, summary: Nokia's and Extreme Networks' stocks have seen recent downsides possibly indicating a sector weakness in demand. Click here to read what investors need to know., Headline: Cisco Systems Inc. stock outperforms market on strong trading day, source:MarketWatch, summary: Shares of Cisco Systems Inc. inched 0.85% higher to $50.81 Monday, on what proved to be an all-around favorable trading session for the stock market, with..., Headline: QQQ: It's Time For The Nasdaq To Punish Recency Bias, source:SeekingAlpha, summary: We are at peek greed now, and peek greed often punishes uneducated speculators when they least expect it. Click for my market outlook during AI-mania., Headline: 20 High-Paying Dream Jobs You Didn’t Know Existed, source:Yahoo, summary: In this article, we will look at 20 high-paying dream jobs you didn’t know existed. We will also explore a trend in GenXers’ pursuit of dream jobs and some companies where you can fulfill your dreams. If you want to skip our detailed analysis, head straight to 5 High-Paying Dream Jobs You Didn’t Know Existed. […], Headline: Cisco Systems Inc. stock rises Tuesday, outperforms market, source:MarketWatch, summary: No summary",CSCO
283,2023-07-18,"Headline: Nvidia, Microsoft, Apple, and 4 More Stocks to Play AI. Why Alphabet Misses Out., source:MarketWatch, summary: Melius Research started coverage of Nvidia, Microsoft and Apple with Buy ratings on their AI potential but were more skeptical about Google-parent Alphabet., Headline: Peering Into Cisco Systems's Recent Short Interest, source:Benzinga, summary: No summary, Headline: My Dividend Stock Portfolio: New June Dividend Record - 99 Holdings With 28 Buys, source:SeekingAlpha, summary: The broad S&P500 edged up 1.2% in June, while the Dow Jones rose slightly by 0.8% during the month. Click here to see my complete dividend stock portfolio list., Headline: ‘I used to work at Nvidia. The stock I got is now half my portfolio. Should I sell?’, source:MarketWatch, summary: No summary, Headline: 2 Dividend-Paying Tech Stocks to Buy Right Now, source:Yahoo, summary: Tech growth and consistent dividends? This pair of often-overlooked sector titans prove it's not a tech myth -- you really can have both., Headline: Cisco Stock Outlook: JPMorgan Sees Upside To $62, source:TalkMarkets, summary: No summary, Headline: GF Score Analysis: Cisco Systems Inc (CSCO), source:GuruFocus, summary: No summary, Headline: What You Missed On Wall Street On Wednesday, source:Thefly.com, summary: No summary, Headline: Cisco Systems Inc. stock outperforms competitors on strong trading day, source:MarketWatch, summary: No summary",CSCO
