,date,information,related
171,2023-04-25,"Headline: Five Below Has Run Its Course, source:SeekingAlpha, summary: Five Below has proven itself to be an amazing business that has captured tremendous growth on its top and bottom lines. Find out why the stock is a Hold., Headline: 7 Dollar Tree Foods You Should Budget Into Your Weekly Shopping List, source:Yahoo, summary: While everything isn't just $1 at Dollar Tree, you can still find some pretty good deals. And if you haven't tapped the food aisle yet, you might be surprised at what you'll find in the way of grocery..., Headline: Sticky Inflation And Potential Implications For The Retail Sector, source:SeekingAlpha, summary: Expectations are rising for inflation to remain 'sticky' (persistent) at a higher level (4-5%) for longer than previously thought. Click here to read more., Headline: Walmart vs. Dollar Tree: Which Has the Better Prices, Selection, Quality & Return Policy?, source:Yahoo, summary: Finding low prices isn't the only factor people consider when shopping for everything from groceries to clothing to home supplies. Having a good selection, high quality products and other features..., Headline: Dollar Tree Inc. stock outperforms competitors despite losses on the day, source:MarketWatch, summary: Shares of Dollar Tree Inc. dropped 0.72% to $152.36 Tuesday, on what proved to be an all-around poor trading session for the stock market, with the S&P 500...",DLTR
172,2023-04-26,"Headline: Dollar Tree: How This Money-Saving Pro Buys All Her Groceries for $35 a Week, source:Yahoo, summary: Inflation is making it harder for Americans to afford everyday essentials, including groceries. To cut down on costs, you may need to get a little savvier with how and where you shop. And if you..., Headline: Dollar Tree Inc. stock rises Wednesday, outperforms market, source:MarketWatch, summary: Shares of Dollar Tree Inc. inched 0.57% higher to $153.23 Wednesday, on what proved to be an all-around rough trading session for the stock market, with the..., Headline: I Can't Wait Until Summer to Buy These Dollar Tree Items, source:Yahoo, summary: The Dollar Tree has many fun items, but that's especially true during summer. Here are some things I can't wait to buy.",DLTR
173,2023-04-27,"Headline: 8 Items at Dollar Tree That Cost Way More at Walmart, source:Yahoo, summary: Maybe you avoid Dollar Tree because you think the quality of the items are low, or that the store won't have what you're looking for. The truth is you can find quite a few of your everyday essentials...",DLTR
174,2023-04-28,"Headline: Bed Bath & Beyond store closures will kick off a land grab for fast-growing retailers, source:CNBC, summary: Bed Bath & Beyond, which filed for bankruptcy, is expected to soon close hundreds of store locations., Headline: Dollar Tree vs. Target: Which Wins for Quality and Prices for Household Supplies?, source:Yahoo, summary: To make the most of your money, it's smart to shop around at different stores to get the best quality items at the best prices. This is especially true when shopping for household supplies, such as..., Headline: Dollar Tree Inc. stock rises Friday, still underperforms market, source:MarketWatch, summary: Shares of Dollar Tree Inc. inched 0.22% higher to $153.71 Friday, on what proved to be an all-around great trading session for the stock market, with the S&P...",DLTR
175,2023-05-01,"Headline: Dollar Tree names Mike Kindy Chief Supply Chain Officer, source:Thefly.com, summary: No summary, Headline: Retail sector insiders are betting on no recession: 4 undervalued stocks they like now, source:MarketWatch, summary: The consumer engine driving the U.S. economy should keep humming., Headline: Dollar Tree, Inc. to Host 2023 Investor Conference, source:Yahoo, summary: CHESAPEAKE, Va., May 01, 2023--Dollar Tree, Inc. (NASDAQ: DLTR), today announced that it will host an Investor Conference in Norfolk, Virginia, on Wednesday, June 21, 2023., Headline: Dollar Tree Inc. stock outperforms competitors despite losses on the day, source:MarketWatch, summary: Shares of Dollar Tree Inc. sank 0.03% to $153.67 Monday, on what proved to be an all-around dismal trading session for the stock market, with the S&P 500..., Headline: Dollar Tree, Inc. Names Mike Kindy Chief Supply Chain Officer, source:Yahoo, summary: CHESAPEAKE, Va., May 01, 2023--Dollar Tree, Inc. (NASDAQ: DLTR) today announced a key executive leadership addition, with Mike Kindy joining the organization as Chief Supply Chain Officer. Mr. Kindy has more than 34 years of management experience in retail logistics and operating distribution centers.",DLTR
176,2023-05-02,"Headline: 3 Monthly Dividend Stocks to Buy in May for a Passive Income Stream, source:InvestorPlace, summary: No summary, Headline: Dollar Tree Inc. stock underperforms Tuesday when compared to competitors despite daily gains, source:MarketWatch, summary: Shares of Dollar Tree Inc. inched 0.66% higher to $154.69 Tuesday, on what proved to be an all-around rough trading session for the stock market, with the...",DLTR
177,2023-05-03,"Headline: Discount Stores Like Dollar Tree and Dirt Cheap Are Closing Locations: See If Your State Is Affected, source:Yahoo, summary: Investment bank UBS projected that around 50,000 or so U.S. stores will close by 2027, reported Forbes. Reasons for the closures include a lag in consumer spending, banks being less willing to lend,..., Headline: 7 Items at Dollar Tree That Cost Way More on Amazon, source:Yahoo, summary: You might think Amazon has it all, and at a stellar price, but you could be overpaying for what you get. Everything at Dollar Tree costs under $5, which is not something you can say for the online..., Headline: Dollar Tree vs. Target: Which Has Better Deals and Discounts This Spring?, source:Yahoo, summary: Spring often brings with it the urge to improve things. When you get ready to shop for these improvements, depending on your list and your budget, you may be able to find some pretty awesome spring..., Headline: Dollar Tree Inc. stock underperforms Wednesday when compared to competitors, source:MarketWatch, summary: Shares of Dollar Tree Inc. shed 1.54% to $152.31 Wednesday, on what proved to be an all-around dismal trading session for the stock market, with the S&P 500...",DLTR
178,2023-05-04,"Headline: Dollar Tree: 12 High-Quality Items To Buy in May, source:Yahoo, summary: Thanks to rising costs across a number of categories amid inflation, consumers of all types are flocking to dollar stores. We may think these discount destinations are only good for traditionally..., Headline: Which Dollar Store Has the Cheapest Groceries?, source:Yahoo, summary: An increasing number of Americans are heading to dollar stores for their grocery shopping needs. According to a 2023 study published in the American Journal of Public Health, dollar stores are the..., Headline: 10 Best Department Store and Discount Retailer Stocks to Buy, source:Yahoo, summary: In this article, we will be taking a look at the 10 best department store and discount retailer stocks to buy. To see more of these stocks, you can go directly to see the 5 Best Department Store and Discount Retailer Stocks to Buy. The current status of the economy, geopolitical tensions, supply chain disruptions, […], Headline: Dollar Tree Inc. stock falls Thursday, still outperforms market, source:MarketWatch, summary: Shares of Dollar Tree Inc. shed 0.42% to $151.68 Thursday, on what proved to be an all-around rough trading session for the stock market, with the S&P 500..., Headline: Dollar Tree Beauty Products: Are They Worth It?, source:Yahoo, summary: During 2022, beauty products brought in $49 billion in revenue in the United States. You don't get to billions of dollars without customers splurging from time to time. Next: 10 Items You Should..., Headline: Notable Friday Option Activity: DLTR, AMD, BIO, source:Stock Options Channel, summary: No summary, Headline: Dollar Tree Inc. stock outperforms market on strong trading day, source:MarketWatch, summary: No summary",DLTR
179,2023-05-05,"Headline: Dollar Tree vs. Target: Here's Where These Popular Items Are Cheaper, source:Yahoo, summary: The figure is lower than the $1.25 per-bar price you'll pay at Dollar Store, but in most store locations, you can pick up the Caress soap in lower-packet figures, which saves money if you're only looking for two, four, or even six soap bars.  Dollar Store wins out over Target on batteries, but there are some caveats.  ""If you shop at Dollar Tree, you'd best be prepared for no-name brands and a limited selection,"" Ramhold noted., Headline: Realty Income Corporation: My Dollar Store Darling, source:SeekingAlpha, summary: Realty Income Corporation's tenants are uniquely able to bear the brunt of a prolonged recession, possibly increasing their revenue. Click here for more on O stock., Headline: Dollar Tree Finds for a Cheap Last-Minute Cinco De Mayo Celebration, source:Yahoo, summary: Around 160 years ago, on the fifth of May, the Mexican army defeated France at the Battle of Puebla. Since then, Cinco de Mayo has been a small but lively holiday that is most popular among those with..., Headline: Which Dollar Store Has the Cheapest Pet Items?, source:Yahoo, summary: Shopping for your furry friend on a budget? Most dollar stores sell a wide variety of pet supplies to accommodate dogs and cats. This includes pet food and treats, toys, brushes, collars and cleaning...",DLTR
180,2023-05-08,"Headline: Bed Bath & Beyond bankruptcy: These retailers could pick up the company`s bones, source:MarketWatch, summary: No summary, Headline: Bed Bath & Beyond bankruptcy: These retailers could pick up the company’s bones, source:MarketWatch, summary: There will be opportunities for brick-and-mortar retailers in the wake of Bed Bath & Beyond’s bankruptcy, says analytics company Placer.ai., Headline: 7 Cheap Dollar Tree Summer Items To Buy Early This Year, source:Yahoo, summary: The summer season brings both rising temperatures and inflation. Dollar Tree has become a go-to for budget-conscious shoppers. To help you stay cool without spending a fortune, GOBankingRates put..., Headline: Dollar Tree Inc. stock rises Monday, still underperforms market, source:MarketWatch, summary: Shares of Dollar Tree Inc. inched 0.05% higher to $155.54 Monday, on what proved to be an all-around mixed trading session for the stock market, with the S&P...",DLTR
181,2023-05-09,"Headline: Dollar Tree price target lowered to $162 from $164 at Truist, source:Thefly.com, summary: No summary, Headline: Dollar Tree Inc. stock falls Tuesday, still outperforms market, source:MarketWatch, summary: Shares of Dollar Tree Inc. slumped 0.24% to $155.17 Tuesday, on what proved to be an all-around grim trading session for the stock market, with the S&P 500..., Headline: 10 Best Dollar Tree Items To Buy Online in Bulk, source:Yahoo, summary: Dollar stores have always been popular, but they're becoming even more so as the price of food skyrockets across the U.S. Among this category of discount destinations, Dollar Tree is one of the..., Headline: 7 Super-Safe Stocks to Buy as Fear Grips the Market, source:Yahoo, summary: Although the federal government – along with a very big bank – helped get in front of yet another bank failure (the third this year), the underlying volatility naturally incentives targeting the best safe stocks for market crash list. Worryingly, the AP reported recently that the banking crisis isn’t over yet. It’s just a matter of how much pain we may incur. If that’s the case, you don’t want to mess around with too many risk-on assets. Instead, you should consider recession-proof stocks to buy",DLTR
182,2023-05-10,"Headline: Dollar Tree Inc. stock falls Wednesday, underperforms market, source:MarketWatch, summary: Shares of Dollar Tree Inc. shed 0.68% to $154.12 Wednesday, on what proved to be an all-around mixed trading session for the stock market, with the S&P 500..., Headline: Capital World Investors Now Owns 10.20% of Dollar Tree (DLTR), source:Fintel, summary: nan",DLTR
183,2023-05-11,"Headline: DLTR June 30th Options Begin Trading, source:Stock Options Channel, summary: No summary, Headline: Could Dollar Tree Stock Help You Become a Millionaire?, source:Yahoo, summary: Discount store chain Dollar Tree (NASDAQ: DLTR) is an example of one business that has done incredibly well for shareholders.  Dollar Tree has clearly been a millionaire-maker stock in the past.  Dollar Tree owns both the Dollar Tree and Family Dollar brands., Headline: Dollar Tree, Inc. to Host First Quarter Earnings Conference Call, source:Yahoo, summary: CHESAPEAKE, Va., May 11, 2023--Dollar Tree, Inc. (NASDAQ: DLTR), will host its conference call for investors and analysts to discuss financial results for the first quarter ended April 29, 2023., Headline: Morgan Stanley Maintains Dollar Tree (DLTR) Equal-Weight Recommendation, source:Fintel, summary: nan, Headline: Catalyst watch: AI talk, ON Semiconductor event, hedge fund reports and Walmart earnings, source:Seeking Alpha, summary: No summary",DLTR
184,2023-05-12,"Headline: Dollar Tree Inc. stock outperforms market on strong trading day, source:MarketWatch, summary: Shares of Dollar Tree Inc. rallied 2.26% to $158.72 Friday, on what proved to be an all-around rough trading session for the stock market, with the S&P 500..., Headline: Dollar General: Things You Should Know Beyond The Dollar Sign, source:SeekingAlpha, summary: Dollar General Corporation's stock performance was flat in 2022 and started to decline throughout 2023. Click here to read why we rate DG stock as a hold., Headline: 9 Ways To Save Money at Dollar Tree Using ChatGPT, source:Yahoo, summary: You can't stop hearing about ChatGPT and what it means for the future. What you might not know is that the AI chatbot can simplify your shopping experience. When you're in a rush and on a budget,...",DLTR
185,2023-05-14,"Headline: Dollar Tree: Expect Higher Risk And Potentially Higher Returns, source:SeekingAlpha, summary: Dollar Tree has underperformed Dollar General and disappointed investors since it acquired Family Dollar Stores. Click here to see our take on DLTR stock.",DLTR
186,2023-05-15,"Headline: Dollar Tree Reaches Analyst Target Price, source:ETF Channel, summary: No summary, Headline: Dollar Tree, Inc.'s (NASDAQ:DLTR) Stock Been Rising: Are Strong Financials Guiding The Market?, source:Yahoo, summary: Dollar Tree's (NASDAQ:DLTR) stock up by 8.0% over the past three months. Given its impressive performance, we decided..., Headline: 15 Best Items To Buy at Dollar Tree This Summer, source:Yahoo, summary: Temperatures are rising and the sun is hanging out later and later. It can only mean one thing: summer is here! Or just about, anyway. Costco's Best Deals? Employee Reveals 10 Standout Buys for Your..., Headline: Dollar Tree Inc. stock rises Monday, still underperforms market, source:MarketWatch, summary: Shares of Dollar Tree Inc. inched 0.27% higher to $159.15 Monday, on what proved to be an all-around great trading session for the stock market, with the S&P...",DLTR
187,2023-05-16,"Headline: Dollar Tree Inc. stock falls Tuesday, still outperforms market, source:MarketWatch, summary: Shares of Dollar Tree Inc. slid 0.21% to $158.82 Tuesday, on what proved to be an all-around dismal trading session for the stock market, with the S&P 500..., Headline: Activist firms call on Dollar General, Dollar Tree to improve worker safety, wages, source:CNBC, summary: Employees of dollar stores have long been plagued by workplace safety issues and wage concerns, prompting activist firms to ask the retailers to do better., Headline: 5 Best Food Items To Buy at Dollar Tree in May, source:Yahoo, summary: You've been waiting for it since last fall, and it's finally approaching. While summer doesn't officially begin until next month, the weather outside is getting to be delightful, so it's time to start...",DLTR
188,2023-05-17,"Headline: FOCUS-As household budgets tighten, big brands double down in dollar stores, source:Yahoo, summary: Makers of brand-name household basics like Dunkin' coffee and Schick razors are bulking up sales teams and adding specialized and lower-cost products to the shelves of America's ubiquitous dollar stores in a bid to reach more budget-conscious shoppers.  Razor manufacturer Edgewell Personal Care Co and Kraft Heinz Co have overhauled or built new teams dedicated to working with the biggest U.S. dollar stores like Dollar Tree Inc and Dollar General Corp in the last year.  J M Smucker Co is looking into bringing seasonal flavors of its packaged Dunkin' coffee to the stores, while Hershey Co is in talks to launch its Dot's Pretzels to the retailers, executives said in recent interviews., Headline: As household budgets tighten, big brands double down in dollar stores, source:Yahoo, summary: Makers of brand-name household basics like Dunkin' coffee and Schick razors are bulking up sales teams and adding specialized and lower-cost products to the shelves of America's ubiquitous dollar stores in a bid to reach more budget-conscious shoppers.  Razor manufacturer Edgewell Personal Care Co and Kraft Heinz Co have overhauled or built new teams dedicated to working with the biggest U.S. dollar stores like Dollar Tree Inc and Dollar General Corp in the last year.  J M Smucker Co is looking into bringing seasonal flavors of its packaged Dunkin' coffee to the stores, while Hershey Co is in talks to launch its Dot's Pretzels to the retailers, executives said in recent interviews., Headline: Target (TGT) Q1 Earnings Beat Estimates, source:Yahoo, summary: Target (TGT) delivered earnings and revenue surprises of 17.82% and 0.06%, respectively, for the quarter ended April 2023. Do the numbers hold clues to what lies ahead for the stock?, Headline: Dollar Tree: Buy, Sell, or Hold?, source:Yahoo, summary: Dollar Tree (NASDAQ: DLTR) might seem at first glance like an excellent stock for growth-focused investors.  The retailer is expanding sales at a solid clip thanks to the combination of rising customer spending and new store openings.  Profit margins are higher than those of its peers, too, due to its scale and its merchandising focus on convenience., Headline: Dollar Tree Inc. stock rises Wednesday, still underperforms market, source:MarketWatch, summary: Shares of Dollar Tree Inc. inched 0.06% higher to $158.92 Wednesday, on what proved to be an all-around favorable trading session for the stock market, with...",DLTR
189,2023-05-18,"Headline: Ross Stores: Recovery On The Way As The Worst Is Likely Over, source:SeekingAlpha, summary: Ross Stores was hit from multiple directions by exogenous factors over the last several years. Find out why ROST stock is a Hold., Headline: Kraft, Pillsbury & More Big Brands Are Available at the Dollar Store — Here’s What to Buy, source:Yahoo, summary: Earlier this year, dollar stores became the fastest-growing segment in grocery retail, taking market share from conventional grocery stores. In rural areas, dollar store food purchases increased by..., Headline: Analysts Estimate Dollar Tree (DLTR) to Report a Decline in Earnings: What to Look Out for, source:Yahoo, summary: Dollar Tree (DLTR) doesn't possess the right combination of the two key ingredients for a likely earnings beat in its upcoming report. Get prepared with the key expectations., Headline: Dollar Tree Inc. stock rises Thursday, outperforms market, source:MarketWatch, summary: Shares of Dollar Tree Inc. rose 1.11% to $160.68 Thursday, on what proved to be an all-around positive trading session for the stock market, with the S&P 500..., Headline: Catalyst watch: Eyes on Ford event, Virgin Galactic launch, Nvidia earnings and Microsoft conference, source:Seeking Alpha, summary: No summary",DLTR
190,2023-05-19,"Headline: Citi Reaffirms Their Buy Rating on Dollar Tree (DLTR), source:TipRanks, summary: No summary, Headline: Analysts Offer Insights on Consumer Goods Companies: Wayfair (W), Dollar Tree (DLTR) and Lowe`s (LOW), source:TipRanks, summary: No summary, Headline: Earnings Week Ahead: Nvidia, Costco, Palo Alto Networks, Lowe`s and more, source:Seeking Alpha, summary: No summary, Headline: Five takeaways about the consumer from Walmart, other retailers after a big week of earnings, source:CNBC, summary: Walmart, Home Depot and Target offered up the latest clues about the health of the American consumer and previewed what could be ahead for the economy., Headline: Earnings Preview: Big Lots (BIG) Q1 Earnings Expected to Decline, source:Yahoo, summary: Big Lots (BIG) doesn't possess the right combination of the two key ingredients for a likely earnings beat in its upcoming report. Get prepared with the key expectations., Headline: Telsey Advisory Group Reiterates Dollar Tree (DLTR) Outperform Recommendation, source:Fintel, summary: nan, Headline: Dollar Tree Inc. stock falls Friday, underperforms market, source:MarketWatch, summary: Shares of Dollar Tree Inc. sank 0.37% to $160.08 Friday, on what proved to be an all-around poor trading session for the stock market, with the S&P 500 Index..., Headline: Which Is Better for Your Wallet: Dollar Tree or Family Dollar?, source:Yahoo, summary: As inflation continues to gouge prices around the country, people are feeling the pinch in their budgets and strategizing which places to shop for the best deals. Here: 8 Companies Behind Costco's..., Headline: Target Q1 2023 Earnings: A Surprising Show Of Strength, source:SeekingAlpha, summary: Target's Q1 2023 sales exceeded analysts' expectations, with revenue reaching $25.32 billion, a 0.6% YoY increase. Read more about TGT here.",DLTR
191,2023-05-20,"Headline: What Types Of Stocks Are Good To Buy During A Recession?, source:TalkMarkets, summary: No summary",DLTR
192,2023-05-21,"Headline: Bullish Dollar Tree Insiders Loaded Up On US$1.3m Of Stock \, source:Yahoo, summary: Quite a few insiders have dramatically grown their holdings in Dollar Tree, Inc. ( NASDAQ:DLTR ) over the past 12..., Headline: Parade of retailers to face inflation doubts while Nvidia and Zoom answer questions about tech, source:MarketWatch, summary: Last week, retailers Walmart and Target provided broad strokes on how rising prices for essentials have reshaped consumer habits. Now come the finer points., Headline: Costco, JPMorgan, Snowflake, Ford, Zoom, and More Stocks to Watch This Week, source:MarketWatch, summary: Earnings reports from Zoom Video, Lowe’s, Snowflake, Best Buy, Costco, and Ulta. Plus, minutes from the Federal Reserve’s May meeting and core PCE inflation..., Headline: Stocks Poised to Fall, source:MarketWatch, summary: The Federal Open Market Committee will release the minutes from its early-May monetary-policy meeting, which will be closely scrutinized for clues about when...",DLTR
193,2023-05-22,"Headline: Benzinga Pro's Top 5 Stocks To Watch For Monday, May 22, 2023: MU, RKT, DLTR, LDOS, IRWD, source:Benzinga, summary: No summary, Headline: Which Retailers Stand To Gain The Most As Consumers Trade Down Due To Inflation?, source:SeekingAlpha, summary: The first batch of major retailers to report Q1 earnings provided important clues on the current state of the consumer., Headline: There’s Rarely a Case for Pulling Out of the Market. This Might Be One., source:Yahoo, summary: Another debt-ceiling meeting, China bans some Micron sales as chip war escalates, and other news to start your day., Headline: Global company events calendar - next 7 days, source:Alliance News, summary: No summary, Headline: Retail Earnings: What earnings are saying about the state of the consumer, source:Yahoo, summary: Yahoo Finance Live previews the week in retail earnings ahead of reporting from retail giants such as BJ's, Dollar Tree, and Costco., Headline: Dollar Tree (DLTR) to Report Q1 Earnings: Things to Note?, source:Yahoo, summary: Dollar Tree's (DLTR) Q1 results are expected to reflect gains from strong consumer demand, efforts to evolve the consumables category and initiatives to improve the value proposition at Family Dollar., Headline: Dollar Tree Inc. stock falls Monday, underperforms market, source:MarketWatch, summary: Shares of Dollar Tree Inc. slid 0.05% to $160.00 Monday, on what proved to be an all-around mixed trading session for the stock market, with the S&P 500..., Headline: Notable Tuesday Option Activity: DLTR, KODK, PLCE, source:Stock Options Channel, summary: No summary, Headline: Five Below (NASDAQ:FIVE): A Sensible Retailer During Tough Times, source:TipRanks, summary: No summary",DLTR
