,date,information,related
0,2022-08-05,"Headline: Want Better Returns? Don't Ignore These 2 Basic Materials Stocks Set to Beat Earnings, source:Yahoo, summary: Finding stocks expected to beat quarterly earnings estimates becomes an easier task with our Zacks Earnings ESP.",DLTR
1,2022-09-23,"Headline: Boeing, Devon Energy fall; Guidewire, Dollar Tree rise, source:Finnhub, summary: NEW YORK — Stocks that traded heavily or had substantial price changes Friday: Boeing Co., down $7.45 to $131.26. The airplane maker will pay $200 million to... | September 23, 2022, Headline: Dollar Tree Inc. stock rises Friday, outperforms market, source:MarketWatch, summary: Shares of Dollar Tree Inc. rallied 1.41% to $141.29 Friday, on what proved to be an all-around rough trading session for the stock market, with the S&P 500...",DLTR
2,2022-09-26,"Headline: Dollar Tree names Michael Creedon, Jr. as COO, source:Thefly.com, summary: Dollar Tree (DLTR) announ... DLTR, AAP, Headline: DOLLAR TREE, INC. : Change in Directors or Principal Officers, Regulation FD Disclosure, Financial Statements and Exhibits (form 8-K), source:Finnhub, summary: Item 5.02. Departure of Directors or Certain Officers; Election of Directors;Appointment of Certain Officers; Compensatory Arrangements of Certain Officers.On September 26, 2022, Dollar Tree, Inc. ... | September 26, 2022, Headline: Dollar Tree names Advance Auto Parts exec Michael Creedon as COO , source:MarketWatch, summary: Dollar Tree Inc. undefined on Monday named Michael Creedon as its new chief operating officer, coming to the job from Advance Auto Parts Inc. undefined,..., Headline: Dollar Tree Names New COO as it Transforms Team of Executives, source:MarketWatch, summary: By Sabela Ojea Dollar Tree Inc. said Monday that it named Michael Creedon Jr. as its new chief operating officer, the latest addition to the company's..., Headline: Dollar Tree, Inc. Names Michael Creedon as Chief Operating Officer, source:Yahoo, summary: CHESAPEAKE, Va., September 26, 2022--Dollar Tree, Inc. (NASDAQ: DLTR) today announced a key executive leadership addition, as Michael Creedon, Jr. will be joining the organization as Chief Operating Officer., Headline: Dollar Tree names Advance Auto Parts exec Michael Creedon as COO, source:Yahoo, summary: Dollar Tree Inc. on Monday named Michael Creedon as its new chief operating officer, coming to the job from Advance Auto Parts Inc. , where he served in a number of roles. Creedon joined Advance Auto in 2013 and was executive vice president for U.S. stores since March of 2021. Before that, he was president of U.S. stores from 2020 to 2021, as well as division president for the company's North Division, including Autopart International, from 2017 to 2020 and president, Autopart International, a w, Headline: Dollar Tree Appoints Michael Creedon As Operations Head, source:Yahoo, summary: Dollar Tree Inc (NASDAQ: DLTR) has appointed Michael Creedon as its Chief Operating Officer. Creedon recently served as the Executive Vice President, U.S. Stores in Advance Auto Parts Inc (NYSE: AAP). He earned his bachelor's degree from Middlebury College and a Finance certificate from the Chicago Graduate School of Business. In June, Dollar Tree disclosed that four executive officers ceased employment with the company, including Thomas R. O'Boyle, Enterprise Chief Operating Officer. ""Mike will, Headline: Advance Auto Parts exec leaves for C-suite with another Fortune 500 retailer, source:Yahoo, summary: A Raleigh businessman has left his post as an executive with one Fortune 500 retailer for a C-suite spot in another.  Creedon will join Dollar Tree Inc. (Nasdaq: DLTR) as the discount retailer's chief operating officer.  Creedon joined Advance Auto in 2013 and has held positions including president of U.S stores and president of wholly owned subsidiary Autopart International.",DLTR
3,2022-09-27,"Headline: Analysts Offer Insights on Consumer Goods Companies: Dollar Tree (DLTR) and Freshpet (FRPT), source:TipRanks, summary: Companies in the  Consumer Goods sector have received a lot of coverage today as analysts  weigh in on Dollar Tree (<span class='tr-stock-ticker' style='color:blue;...",DLTR
4,2022-09-28,"Headline: Dollar Tree appoints Pedro Voyer as chief development officer, source:Thefly.com, summary: Dollar Tree announced ano... DLTR, Headline: Dollar Tree, Inc. Names Pedro Voyer as Chief Development Officer, source:Yahoo, summary: CHESAPEAKE, Va., September 28, 2022--Dollar Tree, Inc. (NASDAQ: DLTR) today announced another key executive leadership addition, as Pedro Voyer will be joining the Company as Chief Development Officer., Headline: Dollar Tree (DLTR) Gains But Lags Market: What You Should Know, source:Yahoo, summary: Dollar Tree (DLTR) closed at $137.97 in the latest trading session, marking a +1.42% move from the prior day.",DLTR
5,2022-09-29,"Headline: Brahman Capital Corp. Buys 3,  - GuruFocus.com, source:GuruFocus, summary: GuruFocus Article or News written by insider and the topic is about: , Headline: Returns On Capital At Dollar Tree (NASDAQ:DLTR) Have Hit The Brakes, source:Yahoo, summary: If we want to find a potential multi-bagger, often there are underlying trends that can provide clues. In a perfect..., Headline: Netflix, YouTube and Google top list of Gen Z's favorite brands, survey shows, source:MarketWatch, summary: YouTube has the highest favorability for Gen Z among all brands, at 86%., Headline: Netflix, YouTube and Google top list of Gen Z’s favorite brands, survey shows, source:Yahoo, summary: Meet Gen Z, lovers of video streaming and candy.  According to a survey from Morning Consul, Gen Z’s favorite brands are mostly U.S. tech giants.  YouTube has the highest favorability for Gen Z among all brands at 86%, followed by Google  (GOOG)  at 83%, Netflix  (NFLX)  at 82%, Amazon  (AMZN)  at 80% and M&M’s at 79%., Headline: Here's How Levi Strauss (LEVI) Looks Just Ahead of Q3 Earnings, source:Yahoo, summary: Levi Strauss' (LEVI) third-quarter fiscal 2022 bottom-line performance might have been hurt by deleveraged SG&A expenses and inflationary pressures., Headline: Here's How Levi Strauss Looks Just Ahead Of Q3 Earnings , source:TalkMarkets, summary: Levi Strauss & Co. is likely to register top-line growth year over year when it reports third-quarter fiscal 2022 earnings on Oct 6. ",DLTR
6,2022-09-30,"Headline: YouTube, Netflix and Google top list of Gen Z’s favorite brands, data shows, source:Yahoo, summary: Meet Gen Z, lovers of video streaming and candy.  According to a new data from Morning Consult, Gen Z’s favorite brands are mostly U.S. tech giants.  YouTube has the highest favorability for Gen Z among all brands at 86%, followed by Google  (GOOG)  at 83%, Netflix  (NFLX)  at 82%, Amazon  (AMZN)  at 80% and M&M’s at 79%.",DLTR
7,2022-10-03,"Headline: 4 Products You Should Always Get at the Dollar Store, source:Yahoo, summary: There are an almost endless array of stores to shop at for any consumer goods you are interested in buying.  In some cases, this means your first stop should be the dollar store.  Dollar stores such as Dollar Tree offer a huge array of different products for either $1 or $1.25 depending on the store and item., Headline: Dollar Tree Inc. stock outperforms competitors on strong trading day, source:MarketWatch, summary: Shares of Dollar Tree Inc. rose 4.08% to $141.65 Monday, on what proved to be an all-around favorable trading session for the stock market, with the S&P 500..., Headline: 7 Nasdaq Sleeper Stocks to Buy Before Wall Street Wakes Up, source:Yahoo, summary: The search for Nasdaq sleeper stocks to buy remains one many aggressive investors are on. However, at first glance, this search is one that seems incredibly risky. After all, compared to the other major equity indices, the technology-centric Nasdaq has suffered disproportionately. Much of this is due to an increasingly hawkish Federal reserve, with a monetary framework that doesn’t necessarily bode well for risk-taking. Recently, the Federal Reserve decided to take on an interest rate hiking cyc, Headline: DOLLAR TREE, INC. : Change in Directors or Principal Officers (form 8-K), source:Finnhub, summary: Item 5.02. Departure of Directors or Certain Officers; Election of Directors;Appointment of Certain Officers; Compensatory Arrangements of Certain Officers.On October 3, 2022, Jeffrey A. Davis... | October 3, 2022",DLTR
8,2022-10-04,"Headline: These Are My 5 Favorite Things to Buy at the Dollar Tree, source:Yahoo, summary: At my local Dollar Tree, I can get tons of fun things for just $1 (or, for some things, for $1.25).  While I buy a lot of stuff at the Dollar Tree, there are five particular items that are my absolute favorite things to purchase there.  For a long time I was spending a small fortune on picture frames, until I realized I could buy them at the Dollar Tree., Headline: Dollar Tree Inc. stock rises Tuesday, still underperforms market, source:MarketWatch, summary: Shares of Dollar Tree Inc. inched 0.35% higher to $142.15 Tuesday, on what proved to be an all-around great trading session for the stock market, with the..., Headline: Dollar Tree (DLTR) Gains But Lags Market: What You Should Know, source:Yahoo, summary: Dollar Tree (DLTR) closed the most recent trading day at $142.15, moving +0.35% from the previous trading session.",DLTR
9,2022-10-05,"Headline: 4 Dollar Tree Products My 3-Year-Old Can't Live Without, source:Yahoo, summary: Fortunately for me, one of my three-year-old's favorite places to shop is the Dollar Tree.  When we visit the Dollar Tree, though, I've noticed that he keeps gravitating to the same items again and again.  In particular, there are four Dollar Tree products he absolutely adores and couldn't live without., Headline: Dollar Tree Inc. stock rises Wednesday, outperforms market, source:MarketWatch, summary: Shares of Dollar Tree Inc. inched 0.43% higher to $142.76 Wednesday, on what proved to be an all-around dismal trading session for the stock market, with the...",DLTR
10,2022-10-06,"Headline: The 4 Best Things for Parents to Buy at the Dollar Tree, source:Yahoo, summary: For me, one of the best places to find discounts is at the Dollar Tree.  Coloring books can get filled up quickly and they can also be pretty expensive depending where you buy them.  Activity books and learning books can come at an even bigger cost, often priced at $8 or $9 per book or more., Headline: Here is What to Know Beyond Why Dollar Tree, Inc. (DLTR) is a Trending Stock, source:Yahoo, summary: No summary, Headline: Dollar Tree Inc. stock underperforms Thursday when compared to competitors, source:MarketWatch, summary: Shares of Dollar Tree Inc. slid 0.44% to $142.13 Thursday, on what proved to be an all-around rough trading session for the stock market, with the S&P 500...",DLTR
11,2022-10-07,"Headline: 4 Dollar Tree Products That Aren't Worth It, source:Yahoo, summary: The Dollar Tree is one of my favorite stores to shop at because the prices cannot be beat.  The Dollar Tree has a great selection of water bottles.  Dollar Tree aluminum foil is another product that you should absolutely leave on the shelves., Headline: Dollar Tree Inc. stock outperforms competitors despite losses on the day, source:MarketWatch, summary: Shares of Dollar Tree Inc. slid 0.13% to $141.95 Friday, on what proved to be an all-around dismal trading session for the stock market, with the S&P 500...",DLTR
12,2022-10-11,"Headline: Dollar Tree & Family Dollar to Host Nationwide Hiring Event on October 19, source:Yahoo, summary: CHESAPEAKE, Va., October 11, 2022--Dollar Tree, Inc. (NASDAQ: DLTR) plans to hire thousands of associates for full- and part-time roles during its Nationwide Hiring Event hosted at participating Dollar Tree and Family Dollar stores on Wednesday, October 19. Positions include Sales Associates, Customer Service Representatives, Stockers, Assistant Store Managers and Store Managers. To apply, text1 the word ""DOLLAR"" to 58046 or visit www.DollarTree.com/careers and www.FamilyDollar.com/careers.",DLTR
13,2022-10-12,"Headline: Dollar Tree (DLTR) Announces Hiring Plans for Holiday Season, source:Yahoo, summary: Dollar Tree (DLTR) plans to hire thousands of full and part-time associates on Oct 19 to ramp up its holiday season prep.",DLTR
14,2022-10-13,"Headline: Dollar Tree (DLTR) Gains But Lags Market: What You Should Know, source:Yahoo, summary: In the latest trading session, Dollar Tree (DLTR) closed at $140.52, marking a +1.3% move from the previous day., Headline: nan, source:TipRanks, summary: nan",DLTR
15,2022-10-14,"Headline: Want to Get Ahead? Pick the Right Company., source:Yahoo, summary: The best places to advance your career, get groomed for bigger opportunities elsewhere and find job stability, as determined by a new study.",DLTR
16,2022-10-15,"Headline: 3 Stocks to Add to Your Portfolio in the Market Downturn, source:Yahoo, summary: It could also be because they have built-in diversification that insulates them from a downturn, such as industrial supplier Carlisle Companies (NYSE: CSL).  Dollar Tree operates 16,231 bargain stores in 48 states and Canada under the names Dollar Tree, Family Dollar, and Dollar Tree Canada.  The company's stores are meant for bargain seekers, and the company has thrived in the past during economic downturns.",DLTR
17,2022-10-17,"Headline: Estimating The Intrinsic Value Of Dollar Tree, Inc. (NASDAQ:DLTR), source:Yahoo, summary: Today we will run through one way of estimating the intrinsic value of Dollar Tree, Inc. ( NASDAQ:DLTR ) by taking the...",DLTR
18,2022-10-18,"Headline: VOE: 3 Surprises In The Vanguard Mid-Cap Value ETF, source:SeekingAlpha, summary: In VOE, the impressive run of DLTR makes the stock fully valued. A shortage of new cars has made AZO a winner. Investors should keep an eye on SWK. Read more here., Headline: 10 Recession-Proof Stocks to Buy in October, source:Yahoo, summary: In this piece, we will take a look at the ten best recession-proof stocks to buy in October. For more stocks, head on over to 5 Best Recession-Proof Stocks to Buy in October. The aftershocks of the coronavirus pandemic are still being felt all over the globe. The virus saw industrial output collapse and led […]",DLTR
19,2022-10-19,"Headline: How I Organized My Entire House Using Dollar Tree Items, source:Yahoo, summary: Image source: Getty Images Despite my best efforts, I've amassed a lot of clutter in my house over more than a decade since getting a mortgage and moving in. And the amount of stuff I have only multiplied exponentially once I added kids to my family., Headline: Final Trades: CVS, Hess, Dollar Tree & more, source:CNBC, summary: The ""Halftime Report"" traders give their top picks to watch for the second half., Headline: Dollar Tree Inc. stock outperforms competitors on strong trading day, source:MarketWatch, summary: Shares of Dollar Tree Inc. inched 0.14% higher to $139.97 Wednesday, on what proved to be an all-around dismal trading session for the stock market, with the..., Headline: Dollar Tree (DLTR) Gains As Market Dips: What You Should Know, source:Yahoo, summary: Dollar Tree (DLTR) closed at $139.97 in the latest trading session, marking a +0.14% move from the prior day.",DLTR
20,2022-10-24,"Headline: Top 5 3rd Quarter Trades of US - GuruFocus.com, source:GuruFocus, summary: GuruFocus Article or News written by insider and the topic is about: ",DLTR
21,2022-10-25,"Headline: As Shoppers Feel Pinched, I'm Betting Money Will Grow on Dollar Tree, source:Yahoo, summary: With two consecutive quarters of shrinking gross domestic product already in the books, and names like Tesla's  Elon Musk and Jamie Dimon warning that a recession is imminent, consumers will be likely be looking to save a few bucks in the coming months.  Consumers are already being forced to make tough decisions because of inflation, especially for food and fuel.  According to this chart from the St. Louis Fed, U.S. personal savings, which reached $4.8 trillion at the height of the pandemic, has fallen to just $629 billion., Headline: David J Yvars Group Goes on Bu - GuruFocus.com, source:GuruFocus, summary: GuruFocus Article or News written by insider and the topic is about: ",DLTR
22,2022-10-26,"Headline: Dollar General: Solid Business For The Watchlist, source:SeekingAlpha, summary: Dollar General stock has crushed the market and continues to execute operationally. Click here to find out why DG is a Hold., Headline: Dollar Tree Inc. stock underperforms Wednesday when compared to competitors, source:MarketWatch, summary: Shares of Dollar Tree Inc. sank 0.14% to $153.69 Wednesday, on what proved to be an all-around mixed trading session for the stock market, with the Dow Jones..., Headline: Dollar Tree (DLTR) Stock Moves -0.14%: What You Should Know, source:Yahoo, summary: Dollar Tree (DLTR) closed the most recent trading day at $153.69, moving -0.14% from the previous trading session.",DLTR
23,2022-10-27,"Headline: Dollar Tree Inc. stock outperforms competitors on strong trading day, source:MarketWatch, summary: Shares of Dollar Tree Inc. rallied 1.64% to $156.21 Thursday, on what proved to be an all-around mixed trading session for the stock market, with the Dow...",DLTR
24,2022-10-28,"Headline: Dollar Tree Inc. stock rises Friday, still underperforms market, source:MarketWatch, summary: Shares of Dollar Tree Inc. rose 1.50% to $158.55 Friday, on what proved to be an all-around positive trading session for the stock market, with the S&P 500...",DLTR
25,2022-10-31,"Headline: Dollar Tree Inc. stock outperforms market despite losses on the day, source:MarketWatch, summary: Shares of Dollar Tree Inc. slumped 0.03% to $158.50 Monday, on what proved to be an all-around dismal trading session for the stock market, with the S&P 500...",DLTR
26,2022-11-01,"Headline: Dollar Tree Inc. stock falls Tuesday, still outperforms market, source:MarketWatch, summary: Shares of Dollar Tree Inc. slipped 0.24% to $158.12 Tuesday, on what proved to be an all-around rough trading session for the stock market, with the S&P 500..., Headline: Dollar Tree (DLTR) Stock Moves -0.24%: What You Should Know, source:Yahoo, summary: In the latest trading session, Dollar Tree (DLTR) closed at $158.12, marking a -0.24% move from the previous day.",DLTR
27,2022-11-02,"Headline: Why Dollar Tree (DLTR) Could Beat Earnings Estimates Again, source:Yahoo, summary: Dollar Tree (DLTR) has an impressive earnings surprise history and currently possesses the right combination of the two key ingredients for a likely beat in its next quarterly report., Headline: Dollar Tree Inc. stock falls Wednesday, underperforms market, source:MarketWatch, summary: Shares of Dollar Tree Inc. slid 3.11% to $153.20 Wednesday, on what proved to be an all-around poor trading session for the stock market, with the S&P 500...",DLTR
28,2022-11-03,"Headline: Dollar Tree Inc. stock rises Thursday, outperforms market, source:MarketWatch, summary: Shares of Dollar Tree Inc. rose 1.83% to $156.00 Thursday, on what proved to be an all-around grim trading session for the stock market, with the S&P 500...",DLTR
29,2022-11-04,"Headline: Dollar Tree Inc. stock rises Friday, still underperforms market, source:MarketWatch, summary: Shares of Dollar Tree Inc. inched 0.26% higher to $156.40 Friday, on what proved to be an all-around positive trading session for the stock market, with the...",DLTR
30,2022-11-06,"Headline: 15 Largest Retailers in the US in 2022, source:Yahoo, summary: In this article, we will discuss the 15 Largest Retailers in the US in 2022. If you want to skip our analysis of the retail market, you can skip this article and head on to the 5 Largest Retailers in the US in 2022. The US retail market has continued to grow in recent years […]",DLTR
31,2022-11-07,"Headline: Operation Homefront and Dollar Tree Team Up to Support Military Families, source:Yahoo, summary: SAN ANTONIO, November 07, 2022--For the 16th consecutive year, Dollar Tree customers are invited to purchase holiday toys for military children across the country. Operation Homefront’s Holiday Toy Drive is a program designed to ease the financial burdens that often accompany the holiday season for junior- and mid-grade (E1-E6) service members and their families. The program distributed more than $5 million worth of Dollar Tree toys to military families across the country in 2021., Headline: Dollar Tree Inc. stock rises Monday, outperforms market, source:MarketWatch, summary: Shares of Dollar Tree Inc. rose 2.32% to $160.03 Monday, on what proved to be an all-around favorable trading session for the stock market, with the S&P 500...",DLTR
32,2022-11-08,"Headline: Dollar Tree, Inc. to Host Third Quarter Earnings Conference Call, source:Yahoo, summary: CHESAPEAKE, Va., November 08, 2022--Dollar Tree, Inc. (NASDAQ: DLTR), will host its conference call for investors and analysts to discuss financial results for the third quarter ended October 29, 2022., Headline: If You Invested $1000 in Dollar Tree a Decade Ago, This is How Much It'd Be Worth Now, source:Yahoo, summary: Why investing for the long run, especially if you buy certain popular stocks, could reap huge rewards., Headline: Dollar Tree Inc. stock underperforms Tuesday when compared to competitors despite daily gains, source:MarketWatch, summary: Shares of Dollar Tree Inc. inched 0.66% higher to $161.09 Tuesday, on what proved to be an all-around positive trading session for the stock market, with the..., Headline: Dollar Tree (DLTR) Outpaces Stock Market Gains: What You Should Know, source:Yahoo, summary: In the latest trading session, Dollar Tree (DLTR) closed at $161.09, marking a +0.66% move from the previous day.",DLTR
33,2022-11-09,"Headline: Dollar Tree Inc. stock falls Wednesday, underperforms market, source:MarketWatch, summary: Shares of Dollar Tree Inc. slipped 3.85% to $154.88 Wednesday, on what proved to be an all-around rough trading session for the stock market, with the S&P...",DLTR
34,2022-11-10,"Headline: Dollar Tree Inc. stock rises Thursday, still underperforms market, source:MarketWatch, summary: Shares of Dollar Tree Inc. rose 5.32% to $163.12 Thursday, on what proved to be an all-around great trading session for the stock market, with the S&P 500...",DLTR
35,2022-11-11,"Headline: BANK OF NOVA SCOTIA Buys 1, Se - GuruFocus.com, source:GuruFocus, summary: GuruFocus Article or News written by insider and the topic is about: , Headline: Dollar Tree Inc. stock underperforms Friday when compared to competitors despite daily gains, source:MarketWatch, summary: Shares of Dollar Tree Inc. rose 1.53% to $165.61 Friday, on what proved to be an all-around favorable trading session for the stock market, with the S&P 500..., Headline: Lowe's (LOW) Lined Up for Q3 Earnings: What's in the Cards?, source:Yahoo, summary: Gains from the Total Home strategy, omni-channel offerings and strength in the Pro business might be reflected in Lowe's (LOW) third-quarter fiscal 2022 results.",DLTR
36,2022-11-13,"Headline: 7 Tried-and-True Income Stocks for Nov. 2022, source:InvestorPlace, summary: Some of the best investment opportunities going forward can still be found in these hot income stocks to buy.",DLTR
37,2022-11-14,"Headline: Dollar Tree Reaches Analyst Target Price, source:ETF Channel, summary: Staff article entitled Dollar Tree Reaches Analyst Target Price, about ETFs, from ETF Channel., Headline: Dollar Tree put volume heavy and directionally bearish, source:Thefly.com, summary: Bearish flow noted in Dol... DLTR, Headline: 4 Stocks to Watch as Inflation-Hit Consumers Turn to Discount Stores, source:Yahoo, summary: Better pricing, effective inventory management and operational initiatives should drive Retail-Discount Stores companies. Costco (COST), Target (TGT), Dollar General (DG) and Dollar Tree (DLTR) look well-placed. However, inflation and lingering supply chain issues remain concerns., Headline: Dollar Tree Inc. stock underperforms Monday when compared to competitors, source:MarketWatch, summary: Shares of Dollar Tree Inc. slid 0.67% to $164.50 Monday, on what proved to be an all-around grim trading session for the stock market, with the S&P 500 Index..., Headline: Things to Note Before The TJX Companies' (TJX) Q3 Earnings, source:Yahoo, summary: The TJX Companies' (TJX) third-quarter fiscal 2023 results will likely reflect the adverse impact of higher freight and wage costs., Headline: Foot Locker (FL) to Post Q3 Earnings: Key Factors to Note, source:Yahoo, summary: Supply-chain disruptions and inflationary pressures might have weighed on Foot Locker's (FL) performance during the third quarter of fiscal 2022., Headline: Dollar Tree (DLTR) Stock Moves -0.67%: What You Should Know, source:Yahoo, summary: In the latest trading session, Dollar Tree (DLTR) closed at $164.50, marking a -0.67% move from the previous day., Headline: Ollie's Bargain Outlet Holdings: The Picture Has Worsened, source:SeekingAlpha, summary: Ollie's Bargain Outlet Holdings' shares look pricey right now and fundamentals are worsening. Click here to see why OLLI is a soft Sell than a Hold at this time.",DLTR
