,date,information,related
82,2023-01-09,"Headline: 4 Household Items I Always Buy at the Dollar Tree, source:Yahoo, summary: While I purchase products of all kinds at Dollar Tree, there are four household items I absolutely buy there every time.  Once I discovered Dollar Tree had a great selection of baskets and other kinds of storage tools, it was a game changer.  With options of all sizes, colors, and materials at Dollar Tree, I rarely look elsewhere for containers when I go on an organizing binge., Headline: Dollar Tree (NASDAQ:DLTR) shareholder returns have been notable, earning 61% in 3 years, source:Yahoo, summary: By buying an index fund, you can roughly match the market return with ease. But if you pick the right individual..., Headline: 9 Grocery Items To Buy at Dollar Stores To Help You Cut Costs During Inflation, source:Yahoo, summary: With the cost of food continuing to rise, Americans are all but cornered into finding ways to save on groceries. One way to save is to shop for some essentials at dollar stores. Note, we said some..., Headline: Dollar Tree Inc. stock falls Monday, underperforms market, source:MarketWatch, summary: Shares of Dollar Tree Inc. slid 1.28% to $143.97 Monday, on what proved to be an all-around dismal trading session for the stock market, with the S&P 500..., Headline: Noteworthy Tuesday Option Activity: DLTR, KD, PZZA, source:Stock Options Channel, summary: No summary",DLTR
83,2023-01-10,"Headline: 7 Best Home Items To Buy at Dollar Tree in January, source:Yahoo, summary: Need a few home essentials to refresh your living space? Stop by Dollar Tree anytime in January to find everything you need! Find Out: 10 Things To Stop Buying in 2023Read: How To Get Free Gift Cards..., Headline: Dollar Tree Inc. stock rises Tuesday, outperforms market, source:MarketWatch, summary: Shares of Dollar Tree Inc. advanced 1.33% to $145.88 Tuesday, on what proved to be an all-around favorable trading session for the stock market, with the S&P...",DLTR
84,2023-01-11,"Headline: Metro East strip mall lands tenants, including one new to St. Louis, in $7M redevelopment, source:Yahoo, summary: A big-box shopping center in the Metro East has landed two large anchor tenants for a $7 million redevelopment that will fill nearly 70,000 square feet of space that’s been sitting empty for four years., Headline: 3 REITs to Sell FAST as Bed Bath & Beyond Heads for Bankruptcy, source:InvestorPlace, summary: No summary",DLTR
85,2023-01-12,"Headline: Dollar Tree Inc. stock falls Thursday, underperforms market, source:MarketWatch, summary: Shares of Dollar Tree Inc. slipped 0.89% to $146.62 Thursday, on what proved to be an all-around great trading session for the stock market, with the S&P 500..., Headline: Dollar Tree Inc. stock outperforms market on strong trading day, source:MarketWatch, summary: No summary",DLTR
86,2023-01-13,"Headline: 10 Useful Kitchen Items You Can Get at Dollar Tree, source:Yahoo, summary: The kitchen is the heart and soul of every home. It's also the most hectic and often the most expensive part to maintain. Explore: GOBankingRates' Best Credit Cards for 2023Discover: How To Get Free..., Headline: Margin Outlook of Dollar Tree (DLTR) Disappointed Investors in Q4, source:Yahoo, summary: Madison Funds, managed by Madison Investment Management, released the “Madison Investors Fund” fourth-quarter 2022 investor letter. A copy of the same can be downloaded here. In the fourth quarter, the fund returned 10.2% compared to the 7.6% return for the S&P 500 Index. For the calendar year, the fund declined 13.2% compared to a -18.1% fall for […], Headline: Does the post office deliver on MLK Day? Are schools and stores open? Here`s what you need to know, source:MarketWatch, summary: No summary, Headline: 13D Monitor founder Ken Squire offers 3 buys and a bail: DIS, FRPT, DLTR & CCK, source:CNBC, summary: Ken Squire, 13D Monitor founder, joins ‘The Exchange’ to discuss his three investment picks and a bail.",DLTR
87,2023-01-15,"Headline: Does the post office deliver on MLK Day? Are schools and stores open? Here`s what you need to know., source:MarketWatch, summary: No summary",DLTR
88,2023-01-17,"Headline: Dollar Tree Inc. stock outperforms market on strong trading day, source:MarketWatch, summary: Shares of Dollar Tree Inc. inched 0.32% higher to $147.73 Tuesday, on what proved to be an all-around grim trading session for the stock market, with the S&P...",DLTR
89,2023-01-18,"Headline: David J Yvars Group`s Top 5 Buys of the 4th Quarter, source:GuruFocus, summary: No summary, Headline: 10 Items You Should Always Buy at Dollar Tree, source:Yahoo, summary: In tough times like these when inflation is worrisomely high and a recession could be on the horizon, consumers flock to retailers that promise the best prices. Naturally, stores like Dollar Tree..., Headline: Dollar Tree Inc. stock falls Wednesday, underperforms market, source:MarketWatch, summary: Shares of Dollar Tree Inc. shed 2.29% to $144.35 Wednesday, on what proved to be an all-around rough trading session for the stock market, with the S&P 500..., Headline: Dollar Tree Inc. stock outperforms competitors despite losses on the day, source:MarketWatch, summary: No summary",DLTR
90,2023-01-19,"Headline: Dollar Tree price target lowered to $160 from $170 at JPMorgan, source:Thefly.com, summary: No summary, Headline: Dollar Tree Inc. stock rises Friday, outperforms market, source:MarketWatch, summary: No summary",DLTR
91,2023-01-20,"Headline: 7 Stocks Every Smart Investor Should Own in 2023, source:InvestorPlace, summary: No summary",DLTR
92,2023-01-23,"Headline: Interesting DLTR Put And Call Options For July 21st, source:Stock Options Channel, summary: No summary, Headline: Dollar Tree: Higher Store Traffic Levels Is One Potential Catalyst, source:SeekingAlpha, summary: Dollar Tree's Q3FY22 top line performance surpassed expectations, but store traffic levels still appeared to underwhelm. See why DLTR stock is a Buy., Headline: Kroger, grocery operators must deal with disinflation in 2023 - UBS, source:Seeking Alpha, summary: No summary, Headline: Dollar Tree Inc. stock underperforms Tuesday when compared to competitors, source:MarketWatch, summary: No summary",DLTR
93,2023-01-24,"Headline: Dollar Tree announces Witynski stepping down from the Board, leaving company, source:Thefly.com, summary: No summary, Headline: Dollar Tree chief executive officer steps down, appoints replacement, source:Alliance News, summary: No summary, Headline: Dollar Tree downgraded to Accumulate from Buy at Gordon Haskett, source:Thefly.com, summary: No summary, Headline: Dollar Tree downgraded to Accumulate at Gordon Haskett after CEO change, source:Thefly.com, summary: No summary, Headline: Dollar Tree put volume heavy and directionally bearish, source:Thefly.com, summary: No summary, Headline: Dollar Tree CEO change a ���positive move,` says analyst, source:MarketWatch, summary: No summary, Headline: Dollar Tree downgraded at Gordon Haskett on new CEO announcement, source:Seeking Alpha, summary: No summary, Headline: Rick Dreiling to Assume Role of Chairman and Chief Executive Officer of Dollar Tree, Inc., source:Yahoo, summary: CHESAPEAKE, Va., January 24, 2023--Dollar Tree, Inc. (NASDAQ: DLTR), today announced that Mike Witynski, who has been in leadership positions at Dollar Tree since 2010 and served as CEO since 2020, is stepping down from the Board and leaving the Company. Executive Chairman Rick Dreiling will expand his role to assume the position of Chief Executive Officer, effective January 29., Headline: Dollar Tree CEO Witynski to step down, source:Reuters, summary: Dollar Tree Inc said on Tuesday Chief Executive Officer Mike Witynski was stepping down from his role., Headline: UPDATE 3-Dollar Tree Executive Chairman Dreiling to replace CEO Witynski, source:Yahoo, summary: Dollar Tree Inc said on Tuesday Executive Chairman Richard Dreiling will replace Chief Executive Officer Mike Witynski, nearly a year after agreeing to revamp its board in a settlement with activist investor Mantle Ridge.  Dreiling, 69, who has previously served as chairman and CEO of rival Dollar General, was appointed to Dollar Tree's board as part of the settlement in March 2022., Headline: Dollar Tree CEO Witynski will step down, to be replaced by executive chairman, source:Yahoo, summary: Dollar Tree Inc.  (DLTR)  Chief Executive Wike Witynski plans to step down from his leadership role and his position on the board of directors, the company announced Tuesday.  Witynski served as CEO since 2020 and has been a member of Dollar Tree’s leadership team since 2010.  Executive Chairman Rick Drelling will take over as CEO starting Jan. 29., Headline: Stick with retailers like Walmart, Target and Dollar Tree, says UBS's Michael Lasser, source:CNBC, summary: Michael Lasser, UBS retail analyst, joins 'The Exchange' to discuss the 2023 grocery stock outlook and expected winners in the sector., Headline: Dollar Tree CEO Michael Witynski Is Stepping Down, source:Yahoo, summary: Dollar Tree Executive Chairman Rick Dreiling will add the CEO title. The move follows several executive shuffles under pressure from activist Mantle Ridge., Headline: Dollar Tree Executive Chairman Dreiling to replace CEO Witynski, source:Reuters, summary: Dollar Tree Inc said on Tuesday Executive Chairman Richard Dreiling will replace Chief Executive Officer Mike Witynski, nearly a year after agreeing to revamp its board in a settlement with activist investor Mantle Ridge., Headline: Dollar Tree CEO change a ‘positive move,’ says analyst, source:Yahoo, summary: Dollar Tree Executive Chair Rick Dreiling’s move into the CEO role should reap benefits for the discount retailer, according to Jefferies analyst Corey Tarlowe.  Early Tuesday, Dollar Tree Inc.  (DLTR) announced that Mike Witynski, who has been the company’s CEO since 2020, is stepping down from the board and leaving the company.  Dreiling will expand his executive chair role to assume the CEO role, effective Jan. 29, Dollar Tree said., Headline: Dollar Tree Names Former Dollar General Leader as CEO, source:Yahoo, summary: The Chesapeake, Va., company said Tuesday that  Michael Witynski,  who has been CEO since July 2020, is leaving on Jan. 28, with  Richard Dreiling,  who has been executive chairman since last March, taking on the additional role.  Mr. Dreiling, 69 years old, joined Dollar Tree as chairman last year as part of a settlement with activist investor Mantle Ridge LP., Headline: 10 Handy Office Supplies You Can Find at Dollar Tree, source:Yahoo, summary: Since the onset of the pandemic, working from home has, for many, become a normal way of life. According to the United States Census Bureau, between 2019 and 2021, the number of people primarily..., Headline: Dollar Tree Inc. stock outperforms market on strong trading day, source:MarketWatch, summary: No summary",DLTR
94,2023-01-25,"Headline: PRESS DIGEST- Wall Street Journal - Jan 25, source:Yahoo, summary: Following are the top stories in the Wall Street Journal.  - Ford Motor Co is in talks with Chinese electric-vehicle maker BYD Co over the sale of a manufacturing plant in Germany, according to people familiar with the discussions.  - Rupert Murdoch called off his effort to merge the two parts of his media empire, News Corp and Fox Corp , saying the transaction ""is not optimal"" for shareholders of the companies at this time., Headline: Microsoft and Texas Instruments Earnings Give Investors the Same Warning, source:Yahoo, summary: ASML expects a chip rebound this year despite sector gloom, the Justice Department files a new antitrust suit against Google, the Russian oligarch who became the whale of legal cannabis, and other news to start your day., Headline: Jim Cramer picks his standout stocks in 4 bull market industries, source:CNBC, summary: Companies in Cramer's list include Wells Fargo, Raytheon Technologies, Delta Air Lines, J.B. Hunt and Boeing., Headline: 8 Best Deals at the Dollar Tree, source:Yahoo, summary: Dollar Tree is a popular go-to store for frugal shoppers, but many customers might not realize just how much they can actually save by shopping there. From household items and party supplies to pantry..., Headline: Dollar Tree Inc. stock rises Thursday, still underperforms market, source:MarketWatch, summary: No summary",DLTR
95,2023-01-26,"Headline: Scott Investment Partners LLP Buys 1, Sells 4 in 4th Quarter, source:GuruFocus, summary: No summary, Headline: Dollar Tree call volume above normal and directionally bullish, source:Thefly.com, summary: No summary, Headline: Dollar General worker safety fines top $15 million since 2017, Labor Department says, source:CNBC, summary: Dollar General was hit with $387,000 in fines for worker safety violations at three Southeast stores, the Department of Labor said Thursday., Headline: Analysts Are Downgrading These 10 Stocks, source:Yahoo, summary: In this article, we will discuss the 10 stocks recently downgraded by analysts. If you want to see more such stocks on the list, you can directly visit Analysts Are Downgrading These 5 Stocks. Microsoft Corporation (NASDAQ:MSFT) is in the news after the company posted fiscal Q2 results. The company’s revenue outlook for the March […], Headline: Dollar Tree Inc. stock falls Friday, underperforms market, source:MarketWatch, summary: No summary",DLTR
96,2023-01-27,"Headline: This Is the Biggest Challenge for Dollar Tree's New CEO, source:Yahoo, summary: Rick Dreiling needs to convince the retailer's customers to buy more of the merchandise they're not currently buying., Headline: Dollar Tree Is Raising Prices: What You Need To Know, source:Yahoo, summary: Dollar Tree changed its standard price point from $1 to $1.25 in 2022, and there are more changes coming. The Fortune 500 company has also been working on Dollar Tree Plus, a new initiative for..., Headline: Deere, Dollar Tree, and 21 More Investment Ideas From Barron’s Roundtable Pros, source:Yahoo, summary: The final installment of this year's Barron's Roundtable highlights Deere, Salesforce.com, and other undervalued stocks. Plus, a bevy of bond picks for a rising-rate world.",DLTR
97,2023-01-29,"Headline: Dollar Tree Inc. stock falls Monday, still outperforms market, source:MarketWatch, summary: No summary",DLTR
98,2023-01-30,"Headline: Elliott takes massive Salesforce stake: Hedge funds and C-suites weekly, source:Yahoo, summary: By Davit Kirakosyan, Headline: Hudson Value Partners, LLC Buys 4, Sells 1 in 4th Quarter, source:GuruFocus, summary: No summary, Headline: UPDATE 3-Dollar General CFO Garratt to retire, source:Yahoo, summary: Dollar General Corp's Chief Financial Officer John Garratt would retire effective June 2, the discount store chain said on Monday, adding that it will ""evaluate options"" for its next finance chief.  Garratt's retirement comes at a time when retailers are facing a shift in consumer spending patterns, as penny-pinched Americans cut back on discretionary items and trade down to cheaper alternatives such as dollar stores for grocery needs.  While that has helped boost sales at Dollar General, the company in December trimmed its annual profit forecast, as cost pressures tied to its supply chain problems continued to squeeze its margins., Headline: Dollar Tree Inc. stock rises Tuesday, still underperforms market, source:MarketWatch, summary: No summary",DLTR
99,2023-01-31,"Headline: Dollar Tree is tagged with a sell rating at CFRA, source:Seeking Alpha, summary: No summary, Headline: 7 Common Drugstore Items To Buy at Dollar Tree Instead, source:Yahoo, summary: Although you might only think of Dollar Tree as a place to buy party and gift-wrapping supplies on the cheap, the store offers much more, including name-brand drugstore items at cheaper prices than..., Headline: Dollar Tree Inc. stock rises Wednesday, outperforms market, source:MarketWatch, summary: No summary",DLTR
100,2023-02-01,"Headline: Dollar Tree Inc. stock rises Thursday, outperforms market, source:MarketWatch, summary: No summary",DLTR
101,2023-02-02,"Headline: We Ran A Stock Scan For Earnings Growth And Dollar Tree (NASDAQ:DLTR) Passed With Ease, source:Yahoo, summary: For beginners, it can seem like a good idea (and an exciting prospect) to buy a company that tells a good story to..., Headline: 10 Ways the Dollar Store Could Actually Be Costing You More, source:Yahoo, summary: You can find some great deals at the dollar stores, even if things cost more than a dollar. Despite their names, that's the case at Dollar General, Family Dollar, Dollar Tree and even 99 Cents Only...., Headline: Dollar Tree Inc. stock outperforms competitors despite losses on the day, source:MarketWatch, summary: No summary",DLTR
102,2023-02-03,"Headline: Dollar General: Hurdles Ahead, No Meaningful Upside In Price, source:Seeking Alpha, summary: No summary, Headline: Right Tail Capital Q4 2022 Investor Letter, source:Seeking Alpha, summary: No summary, Headline: Kohl’s New CEO Is an Activist Pick. What History Says About the Chance for Success., source:MarketWatch, summary: Retail has been a prime hunting ground for activist investors recently., Headline: 3 Dollar Tree Items Any Parent Would Love, source:Yahoo, summary: Fortunately, the Dollar Tree provides me with plenty of opportunities to buy fun activities to keep my children occupied without giving my credit cards too much of a workout.  It's the Paint With Water books the Dollar Tree sells.  It's truly like magic -- both for me, and for him, as colors appear on the page perfectly within the lines to create a beautiful finished product.",DLTR
103,2023-02-05,"Headline: Amid food inflation, more shoppers turn to dollar stores for groceries, source:CNBC, summary: Rising food costs are pushing consumers to get more creative about where they go for groceries., Headline: Dollar Tree Inc. stock outperforms market on strong trading day, source:MarketWatch, summary: No summary",DLTR
104,2023-02-06,"Headline: Retail sector dips as earnings jitters for holiday quarter come into play, source:Seeking Alpha, summary: No summary, Headline: Dollar Tree Inc. stock underperforms Tuesday when compared to competitors, source:MarketWatch, summary: No summary, Headline: Dollar Tree initiated with an Equal Weight at Barclays, source:Thefly.com, summary: No summary, Headline: Barclays sees a `reset` in U.S. retail but `not a recession yet`, source:Thefly.com, summary: No summary",DLTR
105,2023-02-07,"Headline: Dollar Tree: 9 High-Quality Items To Buy in February, source:Yahoo, summary: When it comes to shopping for high-quality items, Dollar Tree might not be the first place that comes to mind -- but you may want to change that attitude. Dollar Tree does keep affordability front and..., Headline: Dollar Tree Inc. stock outperforms market on strong trading day, source:MarketWatch, summary: No summary",DLTR
106,2023-02-08,"Headline: GLOBAL BROKER RATINGS: Bernstein cuts Deutsche Post; MS raises Amex, source:Alliance News, summary: No summary, Headline: Dollar Tree: 8 Best Food Items To Buy in February, source:Yahoo, summary: Dollar Tree is a great store for seasonal items such as holiday decor, dinnerware, party supplies and kids' toys, but you might be surprised at how it's also a great place to shop for food, depending..., Headline: Barclays Initiates Coverage of Dollar Tree (DLTR) with Equal-Weight Recommendation, source:Fintel, summary: nan, Headline: Dollar Tree Inc. stock falls Thursday, underperforms market, source:MarketWatch, summary: No summary",DLTR
107,2023-02-09,"Headline: GLOBAL BROKER RATINGS: DZ Bank cuts Adyen; Kepler cuts Segro, source:Alliance News, summary: No summary, Headline: Dollar Tree Inc. stock underperforms Friday when compared to competitors, source:MarketWatch, summary: No summary",DLTR
108,2023-02-10,"Headline: Dollar Tree: 5 Last-Minute Valentine’s Day Gifts, source:Yahoo, summary: Whether you're looking for Valentine's Day gifts for your kids, friends or that special someone in your life, it's not too late to find great options -- at great prices -- at Dollar Tree. Costco's..., Headline: 25 Biggest Virginia Companies and Stocks, source:Yahoo, summary: In this article, we will be taking a look at the 25 biggest Virginia companies and stocks. To skip our detailed analysis, you can go directly to see the 5 biggest Virginia companies and stocks. If all U.S. states were countries, Virginia would be the 34th biggest country in the world with a GDP of […], Headline: Best Valentine’s Day Items at Dollar Tree, source:Yahoo, summary: Americans are eager to celebrate Valentine's Day, and the proof is in their bank accounts -- or rather what they're willing to withdraw from them. According to the National Retail Federation,..., Headline: 7 Food Items You Should Not Buy at Dollar Tree, source:Yahoo, summary: Across the nation, the cost of food is soaring. In May, the food price index rose 10.1% compared to the previous year -- the highest increase the U.S has endured since 1981. And then you've got prices...",DLTR
109,2023-02-12,"Headline: Does a New CEO Signal New Beginnings for Dollar Tree?, source:Yahoo, summary: Dollar Tree's corner office has looked a bit like a soap opera over the past year. The drama is finally over.",DLTR
110,2023-02-13,"Headline: Dollar Tree Inc. stock rises Monday, still underperforms market, source:MarketWatch, summary: Shares of Dollar Tree Inc. inched 0.96% higher to $148.45 Monday, on what proved to be an all-around positive trading session for the stock market, with the...",DLTR
111,2023-02-14,"Headline: Best Home Items To Buy at Dollar Tree in February, source:Yahoo, summary: We all know that February's big holiday is Valentine's Day. This year, it's time to find true love for your wallet and the best place to swoon over home items that won't break your heart (or bank..., Headline: Dollar Tree Inc. stock underperforms Tuesday when compared to competitors, source:MarketWatch, summary: Shares of Dollar Tree Inc. shed 1.02% to $146.94 Tuesday, on what proved to be an all-around poor trading session for the stock market, with the S&P 500..., Headline: Top 5 4th Quarter Trades of Pekin Hardy Strauss, Inc., source:GuruFocus, summary: No summary",DLTR
112,2023-02-15,"Headline: Dollar Tree (NASDAQ:DLTR) Stock Looks Mighty Attractive as Economy Worsens, source:TipRanks, summary: No summary, Headline: Dollar Tree, Inc. to Host Fourth Quarter Earnings Conference Call, source:Yahoo, summary: CHESAPEAKE, Va., February 15, 2023--Dollar Tree, Inc. (NASDAQ: DLTR), will host its conference call for investors and analysts to discuss financial results for the fourth quarter ended January 28, 2023., Headline: How Shopping Experts Would Spend $20 at the Dollar Store, source:Yahoo, summary: When looking to save a buck, why not head to the almighty retailers named after that very thing? We're talking about dollar stores. Surging in popularity in recent years, these bargain destinations..., Headline: Dollar Tree Inc. stock outperforms competitors on strong trading day, source:MarketWatch, summary: Shares of Dollar Tree Inc. advanced 1.50% to $149.14 Wednesday, on what proved to be an all-around great trading session for the stock market, with the S&P..., Headline: Q4 2022 Retail Preview: Restaurant SSS Outperform Retail SSS, source:SeekingAlpha, summary: The Refinitiv U.S. Retail and Restaurant Q4 earnings index, which tracks changes in the growth rate of earnings within the sector, is expected to show a weak 22.9% decline.",DLTR
113,2023-02-16,"Headline: Dollar Tree Inc. stock falls Thursday, underperforms market, source:MarketWatch, summary: Shares of Dollar Tree Inc. slipped 1.54% to $146.85 Thursday, on what proved to be an all-around rough trading session for the stock market, with the S&P 500..., Headline: These Are My 3-Year-Old's Favorite Dollar Tree Items, source:Yahoo, summary: The Dollar Tree has a surprising amount of great items that are budget-friendly and that can help you declutter your home, entertain your kids, or meet other household needs.  The Dollar Tree has a wide variety of different kits with small building blocks you can use to construct things like fire trucks and dinosaurs.  The Dollar Tree also has a great selection of little dinosaur figures that my son can play with.",DLTR
114,2023-02-17,"Headline: Tracking Akre Capital Management Portfolio - Q4 2022 Update, source:Seeking Alpha, summary: No summary, Headline: Do’s and Don’ts of Shopping at Dollar Tree and Other Dollar Stores, source:Yahoo, summary: Dollar stores like Dollar Tree, Family Dollar and Dollar General have become more and more popular as a places to get certain personal, household and food items at extraordinarily low prices. Dollar..., Headline: Dollar Tree Inc. stock outperforms competitors on strong trading day, source:MarketWatch, summary: Shares of Dollar Tree Inc. inched 0.81% higher to $148.04 Friday, on what proved to be an all-around mixed trading session for the stock market, with the Dow...",DLTR
115,2023-02-18,"Headline: Kohl`s: Mediocre Times Ahead, But Hidden Assets Are Key, source:Seeking Alpha, summary: No summary, Headline: Kohl's: Mediocre Times Ahead, But Hidden Assets Are Key, source:SeekingAlpha, summary: Kohl's has had a difficult decade as online retailers have aggressively gained market share. Read why we still rate KSS stock a buy now.",DLTR
116,2023-02-20,"Headline: Walmart earnings could jolt the retail sector, source:Seeking Alpha, summary: No summary, Headline: The 3 Best Monthly Dividend Stocks to Buy Now, source:InvestorPlace, summary: No summary",DLTR
