,date,information,related
224,2023-06-26,"Headline: 12 Most Undervalued Retail Stocks to Buy According to Hedge Funds, source:Yahoo, summary: On January 23rd we prepared the article below that discussed the 12 most undervalued retail stocks to buy according to hedge funds. We didn’t publish this article but decided to follow the performance of these stocks. Our research and experience indicate that hedge funds’ top stock picks generate a significant amount of alpha. This article […], Headline: Dollar Tree Inc. stock outperforms competitors despite losses on the day, source:MarketWatch, summary: Shares of Dollar Tree Inc. shed 0.18% to $143.41 Monday, on what proved to be an all-around dismal trading session for the stock market, with the S&P 500..., Headline: Dollar Tree (DLTR) Shares Cross Above 200 DMA, source:Market News Video, summary: No summary",DLTR
225,2023-06-27,"Headline: Dollar Tree (DLTR) Gets a Buy from Loop Capital Markets, source:TipRanks, summary: No summary, Headline: Dollar Tree's Rotacart rollout poses opportunity, says Loop Capital, source:Thefly.com, summary: No summary, Headline: 10.1% of VOE Holdings Seeing Recent Insider Buys, source:ETF Channel, summary: No summary, Headline: 7 Dollar Tree Items You Need for the Fourth of July, source:Yahoo, summary: The Fourth of July is right around the corner. How will you celebrate our nation's independence? Many families will spend a day at the beach or gather in the backyard for a cookout. But no matter..., Headline: Dollar Tree Inc. stock outperforms competitors on strong trading day, source:MarketWatch, summary: Shares of Dollar Tree Inc. rallied 2.28% to $146.68 Tuesday, on what proved to be an all-around favorable trading session for the stock market, with the S&P...",DLTR
226,2023-06-28,"Headline: Accenture, Salesforce And 2 Other Stocks Insiders Are Selling, source:Benzinga, summary: No summary, Headline: Dollar Tree Inc. stock underperforms Wednesday when compared to competitors, source:MarketWatch, summary: Shares of Dollar Tree Inc. sank 0.70% to $145.66 Wednesday, on what proved to be an all-around poor trading session for the stock market, with the S&P 500...",DLTR
227,2023-06-29,"Headline: Dollar Tree: After Years In The Mud, A Turning Point Appears, source:Benzinga, summary: No summary, Headline: Peering Into Dollar Tree's Recent Short Interest, source:Benzinga, summary: No summary, Headline: Dollar Tree CEO Plans To Add More Bargain $2, $3 & $5 Items, source:Yahoo, summary: After raising prices across the board from $1 to $1.25, discount retailer Dollar Tree is trying out a new pricing structure. Further deviating from its name, the store will add merchandise at $2, $3,..., Headline: Dollar Tree Inc. stock falls Thursday, underperforms market, source:MarketWatch, summary: Shares of Dollar Tree Inc. shed 1.41% to $143.61 Thursday, on what proved to be an all-around great trading session for the stock market, with the S&P 500..., Headline: September 15th Options Now Available For Dollar Tree (DLTR), source:Stock Options Channel, summary: No summary, Headline: Dollar Tree Inc. stock underperforms Friday when compared to competitors, source:MarketWatch, summary: No summary",DLTR
228,2023-06-30,"Headline: Dollar Tree tests products costing up to $5 each, BI reports, source:Thefly.com, summary: No summary, Headline: Dollar Tree vs. Aldi: Which Is Cheaper?, source:Yahoo, summary: In today's era of inflation, nobody wants to overpay for groceries and household necessities -- or have to go to 10 grocery stores to find the best deals. Instead, shoppers are looking for a one-stop..., Headline: What You Missed On Wall Street This Morning, source:Thefly.com, summary: No summary, Headline: Dollar Tree Inc. stock falls Friday, underperforms market, source:MarketWatch, summary: Shares of Dollar Tree Inc. slumped 0.08% to $143.50 Friday, on what proved to be an all-around great trading session for the stock market, with the S&P 500...",DLTR
229,2023-07-01,"Headline: Unlocking Value: Kroger - The Undervalued Dividend Stock, source:SeekingAlpha, summary: The Kroger Co. is a dividend growth stock with strong double-digit growth in the past decade, currently offering a 2.2% yield. Find out why KR stock is a Buy.",DLTR
230,2023-07-02,"Headline: Bullish Dollar Tree Insiders Loaded Up On US$1.3m Of Stock, source:Yahoo, summary: In the last year, multiple insiders have substantially increased their holdings of Dollar Tree, Inc. ( NASDAQ:DLTR..., Headline: I’m a Dietician on a Budget: These Are My Favorite Grocery Deals at Dollar Tree, source:Yahoo, summary: If you're on a tight budget or you live in an area where Dollar Tree is your only shopping option within miles, you don't have to fill your cart with chips, cookies and ramen noodles just so you'll..., Headline: 25 Big Companies That Don’t Drug Test Employees, source:Yahoo, summary: In this article, we discuss 25 big companies that don’t drug test employees. If you want to skip our detailed discussion on the topic, head directly to 5 Big Companies That Don’t Drug Test Employees. Using cannabis can affect attention, memory, and learning, same as alcohol. It is understandable that employers prefer workers to be […]",DLTR
231,2023-07-03,"Headline: The Truth About Dollar Tree’s Product Quality, source:Yahoo, summary: Dollar Tree has seen a tremendously successful year in terms of revenue. In Q1 2023, the discount destination experienced a 3.4% increase in same-store sales, and corporate also opened 107 new stores....",DLTR
232,2023-07-04,"Headline: Dollar Tree Inc. stock falls Wednesday, underperforms market, source:MarketWatch, summary: No summary",DLTR
233,2023-07-05,"Headline: Why Dollar Tree Is Rolling Many Prices Back to $1, source:Yahoo, summary: Remember when Dollar Tree raised its prices from $1 to $1.25? The discount retailer is bringing one-dollar prices back -- well, on some items. I Worked at Dollar Tree: Here Are 5 Insider Secrets You..., Headline: Dollar Tree Inc. stock underperforms Wednesday when compared to competitors, source:MarketWatch, summary: Shares of Dollar Tree Inc. shed 1.38% to $145.44 Wednesday, on what proved to be an all-around grim trading session for the stock market, with the S&P 500..., Headline: Dollar Tree Inc. stock outperforms competitors despite losses on the day, source:MarketWatch, summary: No summary",DLTR
234,2023-07-06,"Headline: Dollar Tree Rolling Prices Back to $1, source:Yahoo, summary: Dollar Tree will bring back its dollar price tag for 300 to 400 products. Find out how to get the most out of dollar stores and save money on your shopping., Headline: Dollar Tree Inc. stock falls Thursday, underperforms market, source:MarketWatch, summary: Shares of Dollar Tree Inc. slipped 0.80% to $144.27 Thursday, on what proved to be an all-around rough trading session for the stock market, with the S&P 500..., Headline: Dollar Tree Inc. stock underperforms Friday when compared to competitors, source:MarketWatch, summary: No summary",DLTR
235,2023-07-07,"Headline: Here's How Much You Would Have Made Owning Dollar Tree Stock In The Last 20 Years, source:Benzinga, summary: No summary, Headline: REG Vs. FRT: What Is The Best REIT To Buy Today?, source:SeekingAlpha, summary: Retail REITs are heavily discounted today. We think that Regency Centers and Federal Realty are both attractive. Read why I prefer FRT stock at this time., Headline: Estimating The Intrinsic Value Of Dollar Tree, Inc. (NASDAQ:DLTR), source:Yahoo, summary: Key Insights Using the 2 Stage Free Cash Flow to Equity, Dollar Tree fair value estimate is US$157 Dollar Tree's US$144..., Headline: Dollar Tree Inc. stock falls Friday, underperforms market, source:MarketWatch, summary: Shares of Dollar Tree Inc. sank 0.51% to $143.54 Friday, on what proved to be an all-around poor trading session for the stock market, with the S&P 500 Index...",DLTR
236,2023-07-09,"Headline: Costco: Too Dang Expensive, No Margin For Error, source:SeekingAlpha, summary: Costco is sitting near a record overvaluation, with slowing company growth and an economic recession on deck. See why I rate COST stock an avoid., Headline: What's Wrong With Dollar General Stock?, source:Yahoo, summary: The discount retailer's shares are severely underperforming the market this year. Does that make the stock undervalued?, Headline: Dollar Tree Inc. stock outperforms market on strong trading day, source:MarketWatch, summary: No summary",DLTR
237,2023-07-10,"Headline: Dollar General: Buy On Rare Pullback, source:SeekingAlpha, summary: The obvious growth goal of Dollar General is to build lots of stores and increase its footprint. See why DG stock is a cautious buy.",DLTR
238,2023-07-11,"Headline: Dollar Tree Inc. stock outperforms competitors on strong trading day, source:MarketWatch, summary: Shares of Dollar Tree Inc. rose 1.80% to $147.51 Tuesday, on what proved to be an all-around favorable trading session for the stock market, with the S&P 500..., Headline: S&P 500 Q2 2023 Earnings Preview: A Repeat Performance?, source:SeekingAlpha, summary: Over the last three months, Q2 EPS estimate declined from $54.24 to $52.81 per share, resulting in analysts downgrading y/y growth expectations by 2.5 ppt heading into earnings season.",DLTR
239,2023-07-12,"Headline: Dollar Tree's (NASDAQ:DLTR) investors will be pleased with their favorable 70% return over the last five years, source:Yahoo, summary: Generally speaking the aim of active stock picking is to find companies that provide returns that are superior to the..., Headline: Dollar Tree Inc. stock rises Wednesday, still underperforms market, source:MarketWatch, summary: Shares of Dollar Tree Inc. inched 0.11% higher to $147.67 Wednesday, on what proved to be an all-around great trading session for the stock market, with the..., Headline: Dollar Tree Viral Savings Hack: Make 3 Days Worth of Meals for Just $10, source:Yahoo, summary: With rising food prices leading many to tighten their budgets, Dollar Tree's grocery items often garner the attention of frugal shoppers. Known for her Dollar Tree Dinners TikTok channel with over...",DLTR
240,2023-07-13,"Headline: Don’t Blame Company’s Greed for Your High Grocery Bills, source:Yahoo, summary: Inflation may be cooling, but that’s cold comfort for anyone shopping in the frozen food aisles—or anywhere else—in the grocery store lately.  Data from the Bureau of Labor Statistics showed that food prices overall edged up just 0.1% in June, better than the 0.2% increase in the previous month., Headline: Dollar Tree Inc. stock rises Thursday, still underperforms market, source:MarketWatch, summary: Shares of Dollar Tree Inc. inched 0.22% higher to $148.00 Thursday, on what proved to be an all-around favorable trading session for the stock market, with..., Headline: If You Invested $1 in Dollar Tree and Dollar General 10 Years Ago, Which Would Have Made You More Money?, source:Yahoo, summary: The cost of a missed opportunity is often greater than we realize. Anyone who missed the chance to invest in Apple, Google, or Amazon before they skyrocketed in value could tell you as much. What..., Headline: Costco Stock’s (NASDAQ:COST) Overvaluation Hampers Its Investment Case, source:TipRanks, summary: No summary",DLTR
241,2023-07-14,"Headline: 7 Dollar Tree Grocery Items To Skip — Even If They’re on Deep Discount, source:Yahoo, summary: More Americans are shopping at Dollar Tree to save money on their grocery bills, especially since the dollar store has expanded to include fresh produce and frozen food items. But there are some foods..., Headline: Here’s Why Dollar Tree (DLTR) Declined in Q2, source:Yahoo, summary: Madison Investments, an investment advisor, released its “Madison Investors Fund” second quarter 2023 investor letter. A copy of the same can be downloaded here. In the second quarter, the fund advanced 8.5% compared to an 8.7% return for S&P 500 Index benchmark. In addition, you can check the top 5 holdings of the fund to know […], Headline: Dollar Tree Inc. stock outperforms market despite losses on the day, source:MarketWatch, summary: Shares of Dollar Tree Inc. shed 0.06% to $147.91 Friday, on what proved to be an all-around mixed trading session for the stock market, with the Dow Jones...",DLTR
242,2023-07-15,"Headline: Should Investors Buy Dollar General Stock for the Dividend?, source:Yahoo, summary: Dollar General (NYSE: DG) will likely make a critical transition in the coming years.  Consequently, Dollar General investors will have to see whether it can succeed as a dividend-paying value stock.  Admittedly, Dollar General already looks like a value stock in many respects.",DLTR
243,2023-07-16,"Headline: Dollar Tree Inc. stock rises Monday, outperforms market, source:MarketWatch, summary: No summary",DLTR
244,2023-07-17,"Headline: 3 Boring Stocks to Buy as Labor Market Faces a Pivot, source:InvestorPlace, summary: No summary, Headline: (DLTR) - Analyzing Dollar Tree's Short Interest, source:Benzinga, summary: No summary, Headline: The Returns On Capital At Dollar Tree (NASDAQ:DLTR) Don't Inspire Confidence, source:Yahoo, summary: What are the early trends we should look for to identify a stock that could multiply in value over the long term..., Headline: Do Dirt Cheap Deals Compare to Dollar Tree? 5 Items To Buy for Less This Summer, source:Yahoo, summary: With inflation still running high and consumers looking to spend less, shoppers continue to flock to dollar stores at a remarkable rate. According to Statista, there were 37,067 dollar stores in the..., Headline: Dollar Tree Inc. stock falls Tuesday, underperforms market, source:MarketWatch, summary: No summary",DLTR
245,2023-07-18,"Headline: 3 Boring Stocks to Buy as Labor Market Faces a Pivot, source:Yahoo, summary: Although the headline print of the June jobs report was encouraging in that it came in below economists’ forecast, it might not be enough for the Federal Reserve, meaning that investors should still consider boring stocks to buy based on the possible labor market impact. Basically, the central bank may start to get serious about inflation. While the disinflationary trend is positive, there’s some work to be done. First, the unemployment rate declined slightly. Second, the average length of the w, Headline: These are the bright spots in the retail sector, according to foot-traffic data, source:MarketWatch, summary: Overall retail visits were down 1.8% year-over-year in the second quarter., Headline: Dollar Tree Is Cutting Some Prices Back to $1 -- but Don't Get Too Excited Yet, source:Yahoo, summary: Dollar Tree recently announced it would be cutting back prices. Keep reading to learn how this roll back is part of a larger plan., Headline: Dollar Tree Inc. stock underperforms Wednesday when compared to competitors despite daily gains, source:MarketWatch, summary: No summary",DLTR
246,2023-07-19,"Headline: Dollar Tree Inc. stock rises Thursday, outperforms market, source:MarketWatch, summary: No summary",DLTR
247,2023-07-20,"Headline: Madison Investors Fund Q2 2023 Investment Strategy Letter, source:Seeking Alpha, summary: No summary, Headline: Move Over Dollar Tree: Here Are 5 Up-and-Coming Discount Stores You Need To Check Out Now, source:Yahoo, summary: For what feels like eons, dollar stores have ruled the world of discount destinations -- and they've been making tons of dough. Dollar Tree, for example, raked in $28.753 billion in revenue for the..., Headline: Dollar Tree Inc. stock falls Friday, underperforms market, source:MarketWatch, summary: No summary",DLTR
248,2023-07-21,"Headline: December 15th Options Now Available For Dollar Tree (DLTR), source:Stock Options Channel, summary: No summary, Headline: 5 Best Deals from Dollar Tree’s ‘Christmas in July’ Sale — Plus, This Code Gets You a Bigger Discount, source:Yahoo, summary: Christmas in July has been gaining popularity in recent years, and many retail stores are using the occasion to offer sales -- Dollar Tree among them. As an added bonus, Dollar Tree offers half off...",DLTR
249,2023-07-23,"Headline: Is Dollar Tree, Inc.'s (NASDAQ:DLTR) Recent Stock Performance Tethered To Its Strong Fundamentals?, source:Yahoo, summary: Most readers would already be aware that Dollar Tree's (NASDAQ:DLTR) stock increased significantly by 5.5% over the..., Headline: I Stopped Shopping at Dollar Tree: Here’s Why, source:Yahoo, summary: The first Dollar Tree opened in 1994, and since then, many consumers have flocked to their more than 8,000 stores to score a good deal. However, over time, some shoppers have found those deals might...",DLTR
250,2023-07-24,"Headline: Dollar Tree Inc. stock outperforms competitors despite losses on the day, source:MarketWatch, summary: No summary, Headline: Dollar Tree Inc. stock rises Tuesday, outperforms market, source:MarketWatch, summary: No summary",DLTR
251,2023-07-25,"Headline: Dollar Tree Inc. stock outperforms competitors on strong trading day, source:MarketWatch, summary: No summary, Headline: 9 Cheap Dollar Tree School Supplies You Shouldn’t Skip, source:Yahoo, summary: As the back-to-school season draws near, parents and students are prepared to tighten their belts when it comes to spending on school supplies. With the average back-to-school spending per student...",DLTR
252,2023-07-26,"Headline: Dollar Tree Inc. stock outperforms competitors despite losses on the day, source:MarketWatch, summary: No summary, Headline: Dollar Tree put volume heavy and directionally bearish, source:Thefly.com, summary: No summary, Headline: Dollar General Adds 100 New Grocery Items — How Do The Prices Compare to Dollar Tree?, source:Yahoo, summary: Dollar General announced that it's expanding its private label brand Clover Valley to include new ""on-trend"" national brand alternatives. Clover Valley has 100 new items for 2023, including sauces,..., Headline: How Dollar Tree's Higher-Priced Items Could Actually Save You Money, source:Yahoo, summary: Dollar Tree is rolling out items at $3, $4, and $5 in an attempt to widen its appeal. Find out how this price experiment could be good for your wallet., Headline: Dollar Tree Inc. stock outperforms market despite losses on the day, source:MarketWatch, summary: No summary, Headline: Check Out What Whales Are Doing With DLTR, source:Benzinga, summary: No summary",DLTR
253,2023-07-27,"Headline: Dollar Tree Inc. stock falls Thursday, still outperforms market, source:MarketWatch, summary: No summary, Headline: 5 Things Never to Buy at the Dollar Tree, source:Yahoo, summary: Although I love shopping at my local Dollar Tree, there are certain items I will not buy there including batteries, aluminum foil, and pet food. Here's why.",DLTR
254,2023-07-28,"Headline: Dollar Tree Inc. stock rises Friday, still underperforms market, source:MarketWatch, summary: No summary, Headline: Want Your Business To Boom? 6 Lessons To Learn From Amazon, Costco and Dollar Tree, source:Yahoo, summary: There are tons of small businesses in the U.S. -- some 33.2 million, according to the Small Business Administration (SBA), which defines a small business as a firm with fewer than 500 employees....",DLTR
255,2023-07-30,"Headline: I Used To Shop at Dollar Tree — Now I Save More at Aldi and Lidl: My 8 Tips for Finding the Best Deals, source:Yahoo, summary: Are you a diehard Dollar Tree shopper? I used to be, as well. I'd buy everything from paper goods and seasonal decorations to school supplies and, often, groceries and cleaning products. Depending on..., Headline: Dollar Tree Inc. stock outperforms competitors on strong trading day, source:MarketWatch, summary: No summary",DLTR
256,2023-07-31,"Headline: Dollar Tree Inc. stock rises Monday, outperforms market, source:MarketWatch, summary: No summary, Headline: YUM! Brands' (YUM) to Report Q2 Earnings: What's in Store?, source:Yahoo, summary: YUM! Brands' (YUM) second-quarter top line is likely to have benefited from robust Taco Bell performance, development efforts and menu innovation initiatives., Headline: Dollar Tree Bargains To Boost Your Retirement Fund: Saving $300 Extra a Month for Your Future, source:Yahoo, summary: If you're looking to boost your retirement savings, you have three choices: earn more money, reduce expenses or invest your money at a higher rate of return. See: 8 Essentials You'll Be Shocked You..., Headline: Dollar Tree Inc. stock outperforms competitors despite losses on the day, source:MarketWatch, summary: No summary",DLTR
257,2023-08-01,"Headline: Dollar Tree Inc. stock falls Tuesday, underperforms market, source:MarketWatch, summary: No summary, Headline: Dollar Tree Reaches Analyst Target Price, source:ETF Channel, summary: No summary, Headline: Here Are 9 Ways Dollar Tree PLUS Can Save You Even More Money, source:Yahoo, summary: This summer, Dollar Tree rolled out a new program enabling the discount retail chain to sell items costing as much as $5. Dollar Tree Plus, as it is called, follows an across-the-board price increase..., Headline: 7 Ways To Bargain Shop Without a Dollar Tree Nearby, source:Yahoo, summary: If you don't have a local discount store, it might feel like you're missing out on all the good deals. But if you're a smart shopper, you don't need a Dollar Tree to save. See: 22 Side Gigs That Can...",DLTR
258,2023-08-02,"Headline: 18 Analysts Have This to Say About Dollar Tree, source:Benzinga, summary: No summary, Headline: Dollar Tree Inc. stock falls Wednesday, still outperforms market, source:MarketWatch, summary: No summary, Headline: Dollar Tree price target raised to $170 from $156 at Truist, source:Thefly.com, summary: No summary, Headline: 7 Boring Stocks That Can Thrive When Interest Rates Rise, source:Yahoo, summary: While the Federal Reserve seeks to spark gentle disinflation, it can’t be too soft on accelerating consumer prices either, which is exactly why investors need to consider reliable stocks during rate hikes. Sure, some recent data points to an encouraging backdrop for slowing inflation. However, the central bank can’t lose focus now. It’s like a baseball game – you could be up a few runs but anything can happen if the opposing bats get hot. A mistake here and a bad pitch there could land you in a, Headline: Dollar Tree: Strong Potential But Can New Management Execute On Turnaround Plans?, source:SeekingAlpha, summary: Dollar Tree's turnaround strategy, led by activist investor Mantle Ridge, includes store upgrades and multi-price point product offerings. Click here to read.",DLTR
259,2023-08-03,"Headline: Truist Securities Maintains Dollar Tree (DLTR) Buy Recommendation, source:Fintel, summary: nan, Headline: Dollar Tree Inc. stock underperforms Thursday when compared to competitors, source:MarketWatch, summary: Shares of Dollar Tree Inc. slipped 0.52% to $150.57 Thursday, on what proved to be an all-around dismal trading session for the stock market, with the S&P...",DLTR
260,2023-08-04,"Headline: The 5 Best Dollar Tree Products to Buy for Your Kids, source:Yahoo, summary: Dollar Tree has a ton of fun items for children. Here are five of the best products you can buy there to provide endless fun for just $1., Headline: The 5 Best Dollar Tree Products to Buy for Your Home, source:Yahoo, summary: Dollar Tree has many great items for sale. Take a look at some products you may want to purchase to upgrade your home decor., Headline: Dollar Tree Inc. stock underperforms Friday when compared to competitors, source:MarketWatch, summary: Shares of Dollar Tree Inc. dropped 0.24% to $150.21 Friday, on what proved to be an all-around poor trading session for the stock market, with the S&P 500..., Headline: Starting a Family? How To Avoid 7 Budgeting Mistakes Parents Make, source:Yahoo, summary: You're about to have your first child. On top of doctor visits, nursery preparation and managing general anxiety, you're also wondering how you're going to pay for all of this. You're not alone....",DLTR
261,2023-08-07,"Headline: Dollar Tree Inc. stock falls Monday, underperforms market, source:MarketWatch, summary: Shares of Dollar Tree Inc. slid 0.27% to $149.80 Monday, on what proved to be an all-around favorable trading session for the stock market, with the S&P 500...",DLTR
262,2023-08-08,"Headline: DLTR Crosses Below Key Moving Average Level, source:Market News Video, summary: No summary, Headline: Dollar Tree Inc. stock falls Tuesday, underperforms market, source:MarketWatch, summary: Shares of Dollar Tree Inc. shed 2.00% to $146.80 Tuesday, on what proved to be an all-around rough trading session for the stock market, with the S&P 500...",DLTR
263,2023-08-09,"Headline: This ETF Holds Stocks Insiders Want to Own, source:ETF Channel, summary: No summary, Headline: Dollar Tree Inc. stock outperforms competitors on strong trading day, source:MarketWatch, summary: Shares of Dollar Tree Inc. rallied 1.10% to $148.42 Wednesday, on what proved to be an all-around poor trading session for the stock market, with the S&P 500..., Headline: Back-To-School Buzz: Navigating Key Events And Consumer Spending Trends, source:SeekingAlpha, summary: Recent Retail Sales data figures have been mixed, but corporate executives are optimistic about the state of the consumer.",DLTR
