,date,information,related
0,2022-09-23,"Headline: KLA : Statement of Changes in Beneficial Ownership - Form 4, source:Finnhub, summary: Ownership Submission FORM 4 Check this box if no longer... | September 23, 2022, Headline: KLA Corp. stock underperforms Friday when compared to competitors, source:MarketWatch, summary: Shares of KLA Corp. slipped 1.75% to $307.60 Friday, on what proved to be an all-around grim trading session for the stock market, with the S&P 500 Index...",KLAC
1,2022-09-25,"Headline: Tracking Jeremy Grantham's GMO Capital Portfolio - Q2 2022 Update, source:SeekingAlpha, summary: Jeremy Granthamâs 13F portfolio value decreased from $20.73B to $18.46B this quarter. Click to read more about GMO Capital's holdings and trades for Q2 2022.",KLAC
2,2022-09-26,"Headline: KLA Corp. stock underperforms Monday when compared to competitors, source:MarketWatch, summary: Shares of KLA Corp. slid 1.31% to $303.57 Monday, on what proved to be an all-around poor trading session for the stock market, with the S&P 500 Index...",KLAC
3,2022-09-27,"Headline: KLA Corp. stock rises Tuesday, outperforms market, source:MarketWatch, summary: Shares of KLA Corp. rallied 1.58% to $308.38 Tuesday, on what proved to be an all-around dismal trading session for the stock market, with the S&P 500 Index...",KLAC
4,2022-09-28,"Headline: KLA Corp. price target lowered to $265 from $325 at Barclays, source:Thefly.com, summary: Barclays analyst Blayne C... KLAC, Headline: 7 Semiconductor Stocks to Buy Before the Bull Market Returns, source:InvestorPlace, summary: If you are a fan of chip companies, these are the top semiconductor stocks to buy before the bull market returns., Headline: 3 Top Stocks That Just Went on Sale, source:Yahoo, summary: These dividend stocks have a cyclical component to them, but they will survive and thrive on the other side of a downturn., Headline: KLA Corp. stock outperforms market on strong trading day, source:MarketWatch, summary: Shares of KLA Corp. rose 2.37% to $315.69 Wednesday, on what proved to be an all-around favorable trading session for the stock market, with the S&P 500..., Headline: KLA Corp. to nuild new R&D and manufacturing facility in Newport, Wales, source:Thefly.com, summary: KLA Corporation plans to ... KLAC",KLAC
5,2022-09-29,"Headline: Compounders And Dividends: Building A Watchlist, source:SeekingAlpha, summary: I explain how I generate ideas and my methodology of adding companies to my watchlist. Read here to know the stocks in areas/sectors that I find interesting., Headline: KLA Plans New R&D and Manufacturing Facility in Wales, UK, source:MarketWatch, summary: By Stephen Nakrosis KLA Corp. said it is planning to build a new research-and-development and manufacturing center in Wales, United Kingdom. The facility,..., Headline: KLA Corp. stock outperforms market despite losses on the day, source:MarketWatch, summary: Shares of KLA Corp. slipped 1.58% to $310.71 Thursday, on what proved to be an all-around grim trading session for the stock market, with the S&P 500 Index..., Headline: Are Investors Undervaluing KLA Corporation (NASDAQ:KLAC) By 22%?, source:Yahoo, summary: Does the September share price for KLA Corporation ( NASDAQ:KLAC ) reflect what it's really worth? Today, we will..., Headline: KLA Announces Plans to Build a New R&D and Manufacturing Facility in Newport, Wales, source:Yahoo, summary: KLA Corporation (NASDAQ: KLAC) has announced plans to build a new research-and-development (R&D) and manufacturing center for the SPTS division, in Newport, Wales, UK. The new development designed to meet BREEAM standard of sustainability rating of excellent is expected to include a capital investment of more than $100 million and create a 200,000 square foot facility. The new state-of-the-art innovation center and manufacturing facility will include offices, cleanrooms, storage and support faci",KLAC
6,2022-09-30,"Headline: Citi removes three from North America Focus List, adds KLA Corp., source:Thefly.com, summary: Citi analysts recently re... MTB, LRCX, SYF, KLAC",KLAC
7,2022-10-03,"Headline: V&M Breakouts: Top Long-Term Growth And Dividend Stocks For October 2022, source:SeekingAlpha, summary: Releasing two top October stocks from the long-term Growth and Dividend Breakout portfolio and ten top samples from prior portfolios. Click here to read more.",KLAC
8,2022-10-04,"Headline: KLAC: A Compelling Buy In The Semiconductor Segment, source:SeekingAlpha, summary: I believe that KLA is a great semiconductor name to own for the medium and long terms. See why I rate KLAC a strong buy., Headline: Semiconductor Winners And Losers At The Start Of Q4 2022 (Technical Analysis), source:SeekingAlpha, summary: Semiconductor stocks remain in a downtrend heading into Q4, but that does not mean some did not do much better than others. Read more here., Headline: KLA Corp. stock underperforms Tuesday when compared to competitors despite daily gains, source:MarketWatch, summary: Shares of KLA Corp. rallied 3.40% to $327.29 Tuesday, on what proved to be an all-around great trading session for the stock market, with the S&P 500 Index...",KLAC
9,2022-10-05,"Headline: KLA Corp. stock underperforms Wednesday when compared to competitors despite daily gains, source:MarketWatch, summary: Shares of KLA Corp. inched 0.54% higher to $329.05 Wednesday, on what proved to be an all-around rough trading session for the stock market, with the S&P 500..., Headline: Secretive Chip Startup May Help Huawei Circumvent US Sanctions, source:Yahoo, summary: (Bloomberg) -- When the US government blacklisted Huawei Technologies Co. as a national security threat, it cut the Chinese company off from buying American semiconductors and other critical technologies. Now Huawei may have a path around those restrictions. Most Read from BloombergMusk Revives $44 Billion Twitter Bid, Aiming to Avoid TrialTrump Says US Agency Packed Top-Secret Documents. These Emails Suggest Otherwise.Loretta Lynn, Coal Miner's Daughter And Country Queen, DiesStocks Take Breath, Headline: U.S. to effectively halt some NAND, DRAM equipment export to China, Reuters says, source:Thefly.com, summary:  MU, LRCX, AMAT, KLAC, ASML",KLAC
10,2022-10-06,"Headline: KLA Corp. stock outperforms competitors despite losses on the day, source:MarketWatch, summary: Shares of KLA Corp. slid 0.47% to $327.49 Thursday, on what proved to be an all-around poor trading session for the stock market, with the S&P 500 Index...",KLAC
11,2022-10-07,"Headline: KLA Corp. price target lowered to $400 from $450 at BofA, source:Thefly.com, summary: BofA analyst Vivek Arya l... KLAC, Headline: KLA Corp. stock outperforms competitors despite losses on the day, source:MarketWatch, summary: Shares of KLA Corp. slid 4.07% to $314.16 Friday, on what proved to be an all-around poor trading session for the stock market, with the S&P 500 Index...",KLAC
12,2022-10-10,"Headline: US Semiconductor Stocks Join Global Rout as Biden Expands Curbs, source:Yahoo, summary: (Bloomberg) -- Shares of semiconductor companies fell Monday, with the industry selling off globally after fresh US curbs on China’s access to American technology added to a disappointing start to the earnings season, stoking concern that the industry’s downturn is far from over.Most Read from BloombergPutin Threatens More Strikes on Ukraine After Missile BlitzUkraine Latest: Putin Calls Security Meeting, Comments on BridgeScreening Procedure Fails to Prevent Colon Cancer Deaths in Large StudyEi, Headline: KLA Corp. stock underperforms Monday when compared to competitors, source:MarketWatch, summary: Shares of KLA Corp. shed 4.72% to $299.34 Monday, on what proved to be an all-around grim trading session for the stock market, with the S&P 500 Index..., Headline: KLA Announces First Quarter Fiscal Year 2023 Earnings Date, source:Yahoo, summary: KLA Corporation (NASDAQ: KLAC) today announced that the company will review first quarter fiscal year 2023 earnings on Wednesday, October 26, 2022 at 2 p.m. PT. The company's results will be published on the same day after the stock market closes, as well as supplemental disclosures including a shareholder letter and earnings slide presentation., Headline: Tuesday Sector Laggards: Technology & Communications, Services, source:Market News Video, summary: nan, Headline: Chipmaker Rout Spreads to TSMC, Samsung After US Curbs on China, source:Yahoo, summary: (Bloomberg) -- Chip-related stocks in Japan, South Korea and Taiwan slumped as traders returning from Monday’s holidays reacted to the Biden administration’s move to put fresh curbs on China’s access to US semiconductor technology.Most Read from BloombergHere’s How Weird Things Are Getting in the Housing MarketScreening Procedure Fails to Prevent Colon Cancer Deaths in Large StudyThis Is What 7% Mortgages Will Do to the Housing MarketCathie Wood Warns of ‘Serious Losses’ in Automobile DebtPutin, Headline: ASML: Semiconductor Industry Bouncing Back, source:SeekingAlpha, summary: ASML had weaker-than-expected H1 revenue growth of -2% and guided 0.2% growth in Q3 2022. Read more to see why we rate the company as a Buy., Headline: What You Missed On Wall Street On Tuesday, source:Thefly.com, summary: Five top five lists with the news and calls moving stocks, powered by The Fly. JOBY, DAL, OFIX, SPNE, UBER, LYFT, FORG, FXJ, HZON, META, LULU, AMGN, ZM, RBLX, KLAC, VWAGY, AMZN, LLY, DICE, HL, WBA, SPWR, ANGI, LEG, ZYXI, AAL, NEPH, AZZ",KLAC
13,2022-10-11,"Headline: Chip Stocks Extend Losses After Dragging Nasdaq to Two-Year Low, source:MarketWatch, summary: Semiconductor makers extend losses after selling off Monday as President Joe Biden announces further restrictions on exports to China., Headline: KLA Corp. to halt some sales, services to China, Reuters reports, source:Thefly.com, summary: KLA-Tencor plans to halt ... KLAC, Headline: nan, source:TipRanks, summary: nan, Headline: Stocks making the biggest moves premarket: Zscaler, BlackRock, Roblox and more, source:CNBC, summary: These are the stocks posting the largest moves before the bell., Headline: Relative Strength Alert For KLAC, source:Dividend Channel, summary: dividend channel,KLAC,, Headline: KLAC Takes Over #148 Spot From Intercontinental Exchange, source:ETF Channel, summary: Staff article entitled KLAC Takes Over #148 Spot From Intercontinental Exchange , about ETFs, from ETF Channel., Headline: Video: S&P 500 Analyst Moves: KLAC, source:Market News Video, summary: The latest tally of analyst opinions from the major brokerage houses shows that among the components of the S&P 500 index, KLAC is now the #148 analyst pick, moving up by 1 spot - This rank is formed by averaging the analyst opinions for each component from each broker, and then ranking the 500 components by those average opinion values - KLAC., Headline: What You Missed On Wall Street This Morning, source:Thefly.com, summary: Five top five lists with the news and calls moving stocks, powered by The Fly. META, LULU, JOBY, DAL, OFIX, SPNE, UBER, LYFT, FORG, FXJ, HZON, AMGN, ZM, RBLX, NSANY, TOSYY, VWAGY, KLAC, DICE, HL, WBA, SPWR, NOG, LEG, ZYXI, AAL, NEPH, AZZ, DASH, Headline: Uber, Leggett & Platt fall; Joby Aviation, Viatris rise, source:Associated Press, The, summary: No summary, Headline: NEW YORK MARKET CLOSE: Wall St sees mixed close ahead of key earnings, source:Alliance News, summary: No summary, Headline: KLA Corp. stock underperforms Tuesday when compared to competitors, source:MarketWatch, summary: Shares of KLA Corp. slid 6.15% to $280.92 Tuesday, on what proved to be an all-around mixed trading session for the stock market, with the Dow Jones...",KLAC
14,2022-10-12,"Headline: Top 5 3rd Quarter Trades of C2 - GuruFocus.com, source:GuruFocus, summary: GuruFocus Article or News written by insider and the topic is about: , Headline: U.S. Suppliers Halt Operations at Top Chinese Memory Chip Maker, source:Yahoo, summary: Chip equipment suppliers are pulling out staff based at China’s leading memory chip maker and pausing business activities there as they assess the impact of Commerce Department semiconductor export restrictions., Headline: SMH: Chip Wars Signal Caution, source:SeekingAlpha, summary: SMH ETF provides investors exposure to companies involved in semiconductor production and equipment. Read why I suggest investors stay on the sidelines., Headline: US Chip Suppliers Pull Back From China’s Yangtze Memory After Biden Ban, source:Yahoo, summary: (Bloomberg) -- American suppliers are beginning to withdraw staff from one of China’s leading chip companies in the wake of new US regulations, a blow to Communist Party efforts to build a vibrant domestic technology industry.Most Read from BloombergIntel Is Planning Thousands of Job Cuts in Face of PC SlumpHere’s How Weird Things Are Getting in the Housing MarketPutin Says All Infrastructure at Risk After Nord Stream HitAlex Jones Must Pay $965 Million for His Sandy Hook LiesUS Core Inflation S, Headline: Here are the companies and sectors that are most vulnerable to the strong dollar this earnings season, source:MarketWatch, summary: Since roughly 40% of S&P 500 companies' sales are generated abroad, equity strategists expect the strong U.S. dollar will weigh heavily on corporate earnings..., Headline: KLA Corp. stock falls Wednesday, underperforms market, source:MarketWatch, summary: Shares of KLA Corp. shed 2.17% to $274.81 Wednesday, on what proved to be an all-around poor trading session for the stock market, with the S&P 500 Index..., Headline: Chip Gear-Maker ASML Tells US Employees to Stop Working With Customers in China, source:Yahoo, summary: (Bloomberg) -- ASML Holding NV, the most advanced maker of equipment for producing semiconductors, told its employees in the US to refrain from servicing customers in China following new regulations from the Biden administration, according to an internal email sent to staff.Most Read from BloombergIntel Is Planning Thousands of Job Cuts in Face of PC SlumpHere’s How Weird Things Are Getting in the Housing MarketPutin Says All Infrastructure at Risk After Nord Stream HitAlex Jones Must Pay $965 M, Headline: U.S. suppliers halt operations at top Chinese chip maker ahead of new restrictions, source:MarketWatch, summary: Tool makers are pulling out staff and pausing work as they assess the impact of Commerce Department restrictions on semiconductor exports to China., Headline: Memory Collapse And China Sanctions: Equipment Companies Most Impacted, source:SeekingAlpha, summary: A memory slowdown and China sanctions are two headwinds facing equipment suppliers. Read as I analyze what semiconductor equipment companies will be impacted., Headline: Chip Industry Braces for ‘Heavy Blow’ From China Export Curbs, source:Yahoo, summary: (Bloomberg) -- The Biden administration’s new restrictions on doing business with China are sending shock waves through the global semiconductor industry, with chip-equipment makers girding for perhaps the most painful fallout. Most Read from BloombergIntel Is Planning Thousands of Job Cuts in Face of PC SlumpHere’s How Weird Things Are Getting in the Housing MarketPutin Says All Infrastructure at Risk After Nord Stream HitAlex Jones Must Pay $965 Million for His Sandy Hook LiesUS Core Inflation, Headline: KLA Corp (KLAC) Shares Cross 2% Yield Mark, source:Dividend Channel, summary: dividend channel,KLAC,",KLAC
15,2022-10-13,"Headline: NORRIS PERNE & FRENCH LLP/MI B - GuruFocus.com, source:GuruFocus, summary: GuruFocus Article or News written by insider and the topic is about: , Headline: KLA Corp. price target lowered to $370 from $400 at Deutsche Bank, source:Thefly.com, summary: Deutsche Bank analyst Sid... KLAC, Headline: KLA Corp. price target lowered to $260 from $265 at Barclays, source:Thefly.com, summary: Barclays analyst Blayne C... KLAC, Headline: KLA Corp. stock rises Thursday, still underperforms market, source:MarketWatch, summary: Shares of KLA Corp. advanced 1.36% to $278.54 Thursday, on what proved to be an all-around positive trading session for the stock market, with the S&P 500...",KLAC
16,2022-10-14,"Headline: BALDWIN BROTHERS LLC/MA Buys 3 - GuruFocus.com, source:GuruFocus, summary: GuruFocus Article or News written by insider and the topic is about: , Headline: KLA Corp. price target lowered to $390 from $430 at Berenberg, source:Thefly.com, summary: Berenberg analyst Tammy Q... KLAC, Headline: KLA Corp. stock falls Friday, underperforms market, source:MarketWatch, summary: Shares of KLA Corp. shed 5.33% to $263.70 Friday, on what proved to be an all-around poor trading session for the stock market, with the S&P 500 Index...",KLAC
17,2022-10-17,"Headline: KLA Stock Is a Buy in the Chip-Equipment Dip, Analysts Say, source:MarketWatch, summary: KeyBanc and JPMorgan remain bullish on beaten-down shares of chip-equipment maker KLA. The stock is deeper in the red year to date than the Nasdaq Composite., Headline: KLA Corp. stock falls Monday, underperforms market, source:MarketWatch, summary: Shares of KLA Corp. slumped 0.18% to $263.22 Monday, on what proved to be an all-around favorable trading session for the stock market, with the S&P 500...",KLAC
18,2022-10-18,"Headline: Inflation Stays Stubbornly High, So The Fed Will Likely Stay Aggressive, source:SeekingAlpha, summary: Both major inflation indexes higher than expected last week. Fed officials are concerned about high inflation persisting - expect a 0.75% key interest rate hike at the Nov. FOMC meeting., Headline: Applied Materials: China Sanctions Can Cost Significantly More Than $1.1 Billion With IP Theft, source:SeekingAlpha, summary: Applied Materials acknowledged that a fresh set of U.S. government sanctions can result in up to a $1.1 billion impact. Read more on how IP theft also could impact this company., Headline: KLA Corp. stock rises Tuesday, outperforms market, source:MarketWatch, summary: Shares of KLA Corp. rallied 2.10% to $268.76 Tuesday, on what proved to be an all-around positive trading session for the stock market, with the S&P 500...",KLAC
19,2022-10-19,"Headline: KLA Corp. stock underperforms Wednesday when compared to competitors despite daily gains, source:MarketWatch, summary: Shares of KLA Corp. advanced 1.19% to $271.96 Wednesday, on what proved to be an all-around poor trading session for the stock market, with the S&P 500 Index...",KLAC
20,2022-10-20,"Headline: ASML: Changing World Order And Supply Glut, source:SeekingAlpha, summary: ASML's monopolistic position allows it to digest industry-wide risks. Read here to see its growth catalysts, potential risks, and why I consider it a buy now., Headline: KLA Corp. stock underperforms Thursday when compared to competitors despite daily gains, source:MarketWatch, summary: Shares of KLA Corp. advanced 1.86% to $277.01 Thursday, on what proved to be an all-around poor trading session for the stock market, with the S&P 500 Index...",KLAC
21,2022-10-21,"Headline: KLA Corp. stock underperforms Friday when compared to competitors despite daily gains, source:MarketWatch, summary: Shares of KLA Corp. rose 4.92% to $290.63 Friday, on what proved to be an all-around great trading session for the stock market, with the S&P 500 Index..., Headline: The real trade war with China has begun, source:Yahoo, summary: A new embargo on advanced semiconductor sales is the most aggressive move yet by any US president against China., Headline: Early chip earnings provided a sigh of relief, but two more big tests are coming, source:MarketWatch, summary: Texas Instruments Inc. and KLA Corp. are two areas of the chip sector that will be tested early in the week ahead of Intel Corp. earnings as early...",KLAC
22,2022-10-23,"Headline: Guinness Atkinson Asset Manage - GuruFocus.com, source:GuruFocus, summary: GuruFocus Article or News written by insider and the topic is about: , Headline: Top 5 3rd Quarter Trades of OL - GuruFocus.com, source:GuruFocus, summary: GuruFocus Article or News written by insider and the topic is about: ",KLAC
23,2022-10-24,"Headline: KLA Launches New Double-Sided Direct Imaging Platform Supporting Continued Innovation for PCBs and IC Substrates, source:Yahoo, summary: Today KLA Corporation (NASDAQ: KLAC) introduced the new Orbotech Corus™ 8M direct imaging (DI) solution, the first system built on the all-in-one revolutionary Orbotech Corus platform, combining the functionality and automation of an entire direct imaging production line in a closed, clean and compact unit. Providing increased resolution with high accuracy to pattern finer lines, the extendable Orbotech Corus™ DI platform is unique in its ability to support highly efficient double-sided imaging",KLAC
24,2022-10-25,"Headline: GLOBAL BRIEFING: Sunak faces first PM questions to unite Tory party, source:Alliance News, summary: No summary, Headline: Notable companies reporting after market close, source:Thefly.com, summary: Notable companies reporti... META, NOW, F, ORLY, KLAC, WOLF, VFC, FBHS, TDOC, SAVE, ULCC, NOVA, CYH, BMRN, Headline: KLA Corp. reports Q1 adjusted EPS $7.06, consensus $6.21, source:Thefly.com, summary: Reports Q1 revenue $2.72B... KLAC, Headline: KLA Corp. sees Q2 adjusted EPS $6.30-$7.70, consensus $6.15, source:Thefly.com, summary: Sees Q2 revenue $2.65B-$2... KLAC",KLAC
25,2022-10-26,"Headline: 7 Stocks Set for a Stellar Earnings Smasher, source:InvestorPlace, summary: These stocks to watch should post incredible third quarter results despite the weaknesses in the stock market., Headline: KLA: Fiscal Q1 Earnings Snapshot, source:Associated Press, The, summary: No summary, Headline: KLA Corp. posts beat-and-raise quarter like others in the chip-equipment sector as long-term goals underscored, source:MarketWatch, summary: KLA Corp. rose in the extended session Wednesday after it became the third chipmaking-equipment manufacturer to post a beat-and-raise quarter this earnings..., Headline: IN BRIEF: KLA sees dip in first quarter income as revenue jumps, source:Alliance News, summary: No summary, Headline: KLA Corp. stock outperforms market on strong trading day, source:MarketWatch, summary: Shares of KLA Corp. inched 0.50% higher to $306.40 Wednesday, on what proved to be an all-around mixed trading session for the stock market, with the Dow..., Headline: Stocks making the biggest moves after hours: Meta Platforms, ServiceNow, Align Technology and more, source:CNBC, summary: See which stocks are posting big moves after the bell., Headline: KLA Corporation (KLAC) Q1 2023 Earnings Call Transcript, source:SeekingAlpha, summary: KLA Corporation (NASDAQ:NASDAQ:KLAC) Q1 2023 Earnings Conference Call October 26, 2022 05:00 PM ET Company Participants Kevin Kessel - Vice President, Investor Relations &amp; Market..., Headline: KLA Corporation 2023 Q1 - Results - Earnings Call Presentation, source:SeekingAlpha, summary: The following slide deck was published by KLA Corporation in conjunction with their 2023 Q1 earnings call., Headline: KLA Corporation Reports Fiscal 2023 First Quarter Results, source:Yahoo, summary: KLA Corporation (NASDAQ: KLAC) today announced financial and operating results for its first quarter of fiscal year 2023, which ended on Sept. 30, 2022, and reported GAAP net income attributable to KLA of $1.03 billion and GAAP earnings per diluted share attributable to KLA of $7.20 on revenue of $2.72 billion., Headline: GLOBAL BRIEFING: Meta quarterly revenue drops; Xi wants US cooperation, source:Alliance News, summary: No summary, Headline: KLA: Semiconductor-Equipment Makers Are Not Dead Money, source:SeekingAlpha, summary: KLA Corp.'s stock is down 10.3% this year. Read more to see why the future for KLA and other semiconductor equipment makers is bright.",KLAC
26,2022-10-27,"Headline: KLA-Tencor (KLAC) Q1 2023 Earnings Call Transcript, source:Yahoo, summary: At this time, I would like to welcome everyone to the KLA Corporation September quarter 2022 earnings conference call and webcast.  Joining me is Rick Wallace, our chief executive officer; and Bren Higgins, our chief financial officer.  Whenever references are made to full year business performance, they are calendar year references., Headline: KLA Corporation's (NASDAQ:KLAC) CEO Will Probably Have Their Compensation Approved By Shareholders, source:Yahoo, summary: We have been pretty impressed with the performance at KLA Corporation ( NASDAQ:KLAC ) recently and CEO Rick Wallace..., Headline: Susquehanna Sticks to Their Buy Rating for KLA (KLAC), source:TipRanks, summary: Susquehanna analyst Mehdi Hosseini reiterated a Buy rating on KLA (KLAC &#8211; Research Report) yesterday and set a price target of $355.00. The company&#8217;s sh..., Headline: Here Is The Price I'll Start Buying KLA Corp. (If They Pay Down Their Debt), source:SeekingAlpha, summary: KLA Corp. has historically been a deeply cyclical business. Read this article to find out the price I would be willing to buy KLAC stock., Headline: Meta, Wolfspeed fall; Caterpillar, Southwest rise, source:Associated Press, The, summary: No summary",KLAC
27,2022-10-28,"Headline: Global company events calendar - next 7 days, source:Alliance News, summary: No summary, Headline: KLA Corp. stock outperforms competitors on strong trading day, source:MarketWatch, summary: Shares of KLA Corp. rallied 4.08% to $321.50 Friday, on what proved to be an all-around favorable trading session for the stock market, with the S&P 500...",KLAC
28,2022-10-29,"Headline: Earn Double-Digit Income With Options - October 2022, source:SeekingAlpha, summary: We explain why selling cash-covered puts and covered calls are relatively safe choices for earning a high income. Read here for our top ideas.",KLAC
