,date,information,related
29,2022-10-30,"Headline: Axcelis: Bucking The Semiconductor Trend On Strong EV Adoption Of SiC, source:SeekingAlpha, summary: Axcelis' strong position in ion-implanters will benefit from SiC chips in EVs. Click here to find out why I rate ACLS stock a Buy.",KLAC
30,2022-10-31,"Headline: Top 5 3rd Quarter Trades of Wi - GuruFocus.com, source:GuruFocus, summary: GuruFocus Article or News written by insider and the topic is about: , Headline: Analysts Offer Insights on Technology Companies: KLA (KLAC), Garmin (GRMN) and Avnet (AVT), source:TipRanks, summary: Companies in the  Technology sector have received a lot of coverage today as analysts  weigh in on KLA (<span class='tr-stock-ticker' style='color:blue; font-weight...",KLAC
31,2022-11-01,"Headline: GLOBAL BRIEFING: Sunak continues to face pressure; Fox profit slips, source:Alliance News, summary: No summary",KLAC
32,2022-11-02,"Headline: Elliott Wave Technical Analysis: KLA Corp. - Wednesday, Nov. 2, source:TalkMarkets, summary: Trading strategy: waiting for further developments into wave (iv)., Headline: KLA Corp. stock outperforms competitors despite losses on the day, source:MarketWatch, summary: Shares of KLA Corp. slipped 2.73% to $312.42 Wednesday, on what proved to be an all-around rough trading session for the stock market, with the S&P 500 Index..., Headline: KLA Corporation Announces Robert Calderoni as New Chair of the Board, source:Yahoo, summary: KLA Corporation (NASDAQ: KLAC) today announced that its Board of Directors has appointed Robert Calderoni as chair effective immediately. Calderoni will succeed Edward ""Ned"" Barnholt whose term has ended, having served as Board Chair since 2006.",KLAC
33,2022-11-03,"Headline: IN BRIEF: KLA announces Robert Calderoni as new chair, source:Alliance News, summary: No summary, Headline: KLA Declares Regular Cash Dividend, source:PR Newswire, summary: No summary, Headline: KLA Corp. stock outperforms competitors on strong trading day, source:MarketWatch, summary: Shares of KLA Corp. inched 0.65% higher to $314.44 Thursday, on what proved to be an all-around rough trading session for the stock market, with the S&P 500...",KLAC
34,2022-11-04,"Headline: KLA Corp. stock outperforms market on strong trading day, source:MarketWatch, summary: Shares of KLA Corp. rose 4.32% to $328.03 Friday, on what proved to be an all-around favorable trading session for the stock market, with the S&P 500 Index..., Headline: U.S. Chip Equipment Suppliers Biggest Losers From China Sanctions But KLA Fares Best, source:SeekingAlpha, summary: Lam Research expects as much as $2.5b in lost revenue in 2023 while KLA expects as much as $900m from China sanctions. See why KLAC stock is better among peers.",KLAC
35,2022-11-07,"Headline: Elliott Wave Technical Analysis: KLA Corp., Monday, Nov. 7, source:TalkMarkets, summary: KLA Corp. is moving as predicted in the last forecast. It looks like we can have a five wave move off the lows which suggests the uptrend could have resumed., Headline: KLA Corp. stock underperforms Monday when compared to competitors despite daily gains, source:MarketWatch, summary: Shares of KLA Corp. rose 2.79% to $337.17 Monday, on what proved to be an all-around favorable trading session for the stock market, with the S&P 500 Index...",KLAC
36,2022-11-08,"Headline: KLA Corp. stock underperforms Tuesday when compared to competitors despite daily gains, source:MarketWatch, summary: Shares of KLA Corp. rallied 1.47% to $342.13 Tuesday, on what proved to be an all-around great trading session for the stock market, with the S&P 500 Index...",KLAC
37,2022-11-09,"Headline: Goldman Sachs Semiconductor Stocks: Top 10 Picks, source:Yahoo, summary: In this article, we discuss the top 10 semiconductor stock picks of Goldman Sachs. If you want to see more stocks in this selection, check out Goldman Sachs Semiconductor Stocks: Top 5 Picks. As per Washington-based Semiconductor Industry Association, global semiconductor sales dropped 3% in September compared to last year, and Korean chipmakers produced 3.5% […], Headline: KLA Corp. stock outperforms competitors despite losses on the day, source:MarketWatch, summary: Shares of KLA Corp. slipped 1.35% to $337.52 Wednesday, on what proved to be an all-around dismal trading session for the stock market, with the S&P 500..., Headline: Dow pops 1,200 points, S&P 500 jumps 5% in biggest rally in two years after light inflation report, source:CNBC, summary: October's CPI data came in lighter than expected, raising hopes of peaking inflation.",KLAC
38,2022-11-10,"Headline: KLA Corporation (NASDAQ:KLAC) Passed Our Checks, And It's About To Pay A US$1.30 Dividend, source:Yahoo, summary: It looks like KLA Corporation ( NASDAQ:KLAC ) is about to go ex-dividend in the next 3 days. The ex-dividend date..., Headline: KLA Corp. stock rises Thursday, outperforms market, source:MarketWatch, summary: Shares of KLA Corp. rose 9.10% to $368.25 Thursday, on what proved to be an all-around favorable trading session for the stock market, with the S&P 500 Index...",KLAC
39,2022-11-11,"Headline: KLA Corp. stock outperforms competitors on strong trading day, source:MarketWatch, summary: Shares of KLA Corp. advanced 3.25% to $380.21 Friday, on what proved to be an all-around great trading session for the stock market, with the S&P 500 Index...",KLAC
40,2022-11-12,"Headline: Top 10 Dividend Growth Ideas For November 2022, source:SeekingAlpha, summary: We publish a monthly series titled '5 Relatively Safe and Cheap DGI Stocks'. However, that series focuses on moderate to high current income favoring high-yield names.",KLAC
41,2022-11-15,"Headline: SMH: Buffett Takes Big Stake In ETF's No. 1 Holding Taiwan Semiconductor, source:SeekingAlpha, summary: Buffett's Berkshire Hathaway disclosed a 60.1 million share position (~$4 billion) in Taiwan Semiconductor. Read why this makes the SMH ETF a buy., Headline: KLA Corp. stock underperforms Tuesday when compared to competitors despite daily gains, source:MarketWatch, summary: Shares of KLA Corp. rallied 2.02% to $385.55 Tuesday, on what proved to be an all-around great trading session for the stock market, with the S&P 500 Index..., Headline: Applied Materials: Awaiting F4Q Earnings As Headwinds Just Won`t Go Away, source:Seeking Alpha, summary: No summary",KLAC
42,2022-11-16,"Headline: Wafer Fab Equipment names slide after Micron cuts wafer starts, source:Thefly.com, summary: No summary, Headline: Applied Materials: Awaiting F4Q Earnings As Headwinds Just Won't Go Away, source:SeekingAlpha, summary: The dour economy is forcing Applied Materials' memory customers to make significant cuts in capex spend. Read what other challenges the company faces., Headline: KLA Corp. stock underperforms Wednesday when compared to competitors, source:MarketWatch, summary: Shares of KLA Corp. shed 3.92% to $370.42 Wednesday, on what proved to be an all-around grim trading session for the stock market, with the S&P 500 Index...",KLAC
43,2022-11-17,"Headline: KLA Corp. stock outperforms market on strong trading day, source:MarketWatch, summary: Shares of KLA Corp. rallied 1.50% to $375.99 Thursday, on what proved to be an all-around dismal trading session for the stock market, with the S&P 500 Index...",KLAC
44,2022-11-18,"Headline: Compounders And Dividends: November 2022 Watch List Update, source:SeekingAlpha, summary: Since my original watch list article in September 2022, I have purchased three companies, two of which were on my September 2022 watch list. Click to read., Headline: KLA Corp. stock rises Friday, still underperforms market, source:MarketWatch, summary: Shares of KLA Corp. inched 0.09% higher to $376.34 Friday, on what proved to be an all-around favorable trading session for the stock market, with the S&P...",KLAC
45,2022-11-19,"Headline: 10 Wide Moat Stocks To Buy Now, source:TalkMarkets, summary: No summary",KLAC
46,2022-11-20,"Headline: KLA Corp. stock outperforms competitors despite losses on the day, source:MarketWatch, summary: No summary",KLAC
47,2022-11-21,"Headline: Tracking Jeremy Grantham`s GMO Capital Portfolio - Q3 2022 Update, source:Seeking Alpha, summary: No summary, Headline: Tracking Jeremy Grantham's GMO Capital Portfolio - Q3 2022 Update, source:SeekingAlpha, summary: Jeremy Granthamâs 13F portfolio value decreased from $18.46B to $17.33B this quarter. See what GMO Capital increased and decreased in holdings., Headline: KLA Announces Upcoming Investor Webcasts, source:Yahoo, summary: KLA Corporation (NASDAQ: KLAC) today announced webcasts for upcoming investor conferences:",KLAC
48,2022-11-23,"Headline: SMH, SOXQ: Since Macro Trumps Micro, Size Doesn`t Matter, source:Seeking Alpha, summary: No summary, Headline: SMH, SOXQ: Since Macro Trumps Micro, Size Doesn't Matter, source:SeekingAlpha, summary: Between SMH & SOXQ, it doesn't look like there's clear winner. We're big believers in ""Macro trumps Micro"" if you get theme/timing right - exact instrument is less important. Read more here., Headline: KLA Corp. stock outperforms market on strong trading day, source:MarketWatch, summary: Shares of KLA Corp. inched 0.90% higher to $385.63 Wednesday, on what proved to be an all-around positive trading session for the stock market, with the S&P...",KLAC
49,2022-11-24,"Headline: The 4 Factor Dividend Growth Portfolio, source:SeekingAlpha, summary: I came up with the idea for the 4-factor dividend growth portfolio as I studied SCHD ETF. Read more to see the process and my initial results.",KLAC
50,2022-11-26,"Headline: Dividend Champion, Contender, And Challenger Highlights: Week Of November 27, source:SeekingAlpha, summary: A weekly summary of dividend activity for Dividend Champions, Contenders, and Challengers. Click here to see the companies' dividends, upcoming ex-dividend dates, and upcoming pay dates.",KLAC
51,2022-11-27,"Headline: If EPS Growth Is Important To You, KLA (NASDAQ:KLAC) Presents An Opportunity, source:Yahoo, summary: It's common for many investors, especially those who are inexperienced, to buy shares in companies with a good story...",KLAC
52,2022-11-28,"Headline: KLA Corp. stock outperforms market despite losses on the day, source:MarketWatch, summary: Shares of KLA Corp. slipped 1.34% to $374.93 Monday, on what proved to be an all-around grim trading session for the stock market, with the S&P 500 Index...",KLAC
53,2022-11-29,"Headline: Options Income Series - Earn Double-Digit Income (Nov-Dec. 2022), source:SeekingAlpha, summary: We explain why selling cash-covered puts and covered calls are relatively safe choices for earning a high income. We also present two options lists with 10 stocks each., Headline: KLA Corp. stock falls Tuesday, underperforms market, source:MarketWatch, summary: Shares of KLA Corp. dropped 0.16% to $374.33 Tuesday, on what proved to be an all-around mixed trading session for the stock market, with the Dow Jones...",KLAC
54,2022-12-01,"Headline: KLA Corp. stock falls Thursday, underperforms market, source:MarketWatch, summary: Shares of KLA Corp. dropped 0.62% to $390.73 Thursday, on what proved to be an all-around grim trading session for the stock market, with the S&P 500 Index...",KLAC
55,2022-12-02,"Headline: KLA Corp. stock falls Friday, underperforms market, source:MarketWatch, summary: Shares of KLA Corp. dropped 0.30% to $389.56 Friday, on what proved to be an all-around mixed trading session for the stock market, with the Dow Jones...",KLAC
56,2022-12-05,"Headline: KLA Corp. stock outperforms market despite losses on the day, source:MarketWatch, summary: Shares of KLA Corp. slumped 0.25% to $388.57 Monday, on what proved to be an all-around grim trading session for the stock market, with the S&P 500 Index...",KLAC
57,2022-12-06,"Headline: KLA Corp. stock outperforms market despite losses on the day, source:MarketWatch, summary: Shares of KLA Corp. shed 1.37% to $383.24 Tuesday, on what proved to be an all-around poor trading session for the stock market, with the S&P 500 Index..., Headline: KLA Launches Revolutionary X-Ray Metrology System, source:Yahoo, summary: Today, KLA Corporation (NASDAQ: KLAC) announced the launch of the revolutionary Axion® T2000 X-ray metrology system for advanced memory chip manufacturers. Fabrication of 3D NAND and DRAM chips involves precise formation of extremely tall structures with deep, narrow holes and trenches, and other intricate architectural shapes – all requiring control at the nanoscale level. The Axion T2000 features patented technologies that power its ability to measure high aspect ratio device features with an",KLAC
58,2022-12-07,"Headline: KLA Corp. price target raised to $420 from $360 at Wells Fargo, source:Thefly.com, summary: No summary, Headline: LRT Capital Management November 2022 Investor Update, source:SeekingAlpha, summary: LRT Capital's Nov. results were strong and broad market indexes overall had strong
returns. But what do I find particularly troubling now? Click here to find out., Headline: KLA Corp. stock rises Wednesday, outperforms market, source:MarketWatch, summary: Shares of KLA Corp. rallied 1.27% to $388.09 Wednesday, on what proved to be an all-around grim trading session for the stock market, with the Dow Jones...",KLAC
59,2022-12-08,"Headline: KLA Corp. stock rises Thursday, outperforms market, source:MarketWatch, summary: Shares of KLA Corp. rallied 2.02% to $395.92 Thursday, on what proved to be an all-around positive trading session for the stock market, with the S&P 500...",KLAC
60,2022-12-09,"Headline: 4 Factor Dividend Growth Portfolio - November 2022 Results, source:SeekingAlpha, summary: My 4 factor dividend growth portfolio got off to a fantastic start. Click here to read my portfolio performance for Nov and my future outlook., Headline: KLA Corp. stock falls Friday, still outperforms market, source:MarketWatch, summary: Shares of KLA Corp. slipped 0.63% to $393.41 Friday, on what proved to be an all-around dismal trading session for the stock market, with the S&P 500 Index...",KLAC
61,2022-12-10,"Headline: Top 10 Dividend Growth Stocks For December 2022, source:SeekingAlpha, summary: This article will focus on DGI stocks that are likely to provide a high rate of dividend growth rather than a high current yield. See our picks here.",KLAC
62,2022-12-11,"Headline: KLA Corp. downgraded to Hold from Buy at Deutsche Bank, source:Thefly.com, summary: No summary",KLAC
63,2022-12-12,"Headline: KLA Corp. slips as Deutsche Bank downgrades, cuts estimates for 2023, 2024, source:Seeking Alpha, summary: No summary, Headline: Lam Research rises as Deutsche Bank upgrades on belief memory capex will `bottom` in 2023, source:Seeking Alpha, summary: No summary, Headline: Micron, KLA stocks downgraded at Deutsche Bank, source:MarketWatch, summary: Shares of Micron Technology Inc. undefined and KLA Corp. undefined were each off more than 1% in Monday morning trading after Deutsche Bank analyst Sidney Ho..., Headline: KLA Corp. stock rises Monday, outperforms market, source:MarketWatch, summary: Shares of KLA Corp. advanced 1.91% to $400.91 Monday, on what proved to be an all-around great trading session for the stock market, with the S&P 500 Index...",KLAC
64,2022-12-13,"Headline: KLA Corp. stock rises Tuesday, outperforms market, source:MarketWatch, summary: Shares of KLA Corp. rallied 2.03% to $409.03 Tuesday, on what proved to be an all-around positive trading session for the stock market, with the S&P 500...",KLAC
65,2022-12-14,"Headline: KLA Corp. stock falls Wednesday, underperforms market, source:MarketWatch, summary: Shares of KLA Corp. dropped 0.69% to $406.21 Wednesday, on what proved to be an all-around dismal trading session for the stock market, with the S&P 500..., Headline: AMD dips even as Morgan Stanley names it top chip pick into 2023; chip sector falls, source:Seeking Alpha, summary: No summary",KLAC
66,2022-12-15,"Headline: AMD leads semiconductors lower as Fed, weak spending weighs on market, source:Seeking Alpha, summary: No summary, Headline: When Should You Buy KLA Corporation (NASDAQ:KLAC)?, source:Yahoo, summary: Let's talk about the popular KLA Corporation ( NASDAQ:KLAC ). The company's shares saw a significant share price rise..., Headline: KLA Corp. stock falls Thursday, underperforms market, source:MarketWatch, summary: Shares of KLA Corp. slipped 5.28% to $384.75 Thursday, on what proved to be an all-around dismal trading session for the stock market, with the S&P 500 Index..., Headline: KLA Foundation Invests More Than $1 Million in Bay Area and Michigan Nonprofits to Advance Social Equity, Access, and Education, source:Yahoo, summary: KLA Corporation (NASDAQ: KLAC) today announced the KLA Foundation recently distributed more than $1 million in grants and donations to support social equity, access, and education with an emphasis in science, technology, engineering and math (STEM) in the Bay Area and Southeast Michigan this December. Through its long history of supporting community-level organizations, this is the first time the Foundation has made a single investment of this magnitude and impact. The grantees reflect a combina",KLAC
67,2022-12-16,"Headline: KLA Corp. removed from Analyst Focus List at Citi, source:Thefly.com, summary: No summary, Headline: KLA Corp. stock rises Friday, outperforms market, source:MarketWatch, summary: Shares of KLA Corp. inched 0.21% higher to $385.54 Friday, on what proved to be an all-around rough trading session for the stock market, with the S&P 500...",KLAC
68,2022-12-19,"Headline: KLA Corp. stock outperforms market despite losses on the day, source:MarketWatch, summary: Shares of KLA Corp. slumped 0.49% to $383.66 Monday, on what proved to be an all-around poor trading session for the stock market, with the S&P 500 Index...",KLAC
69,2022-12-20,"Headline: Applied Materials Ballyhooed E-Beam Inspection Sector Lost Share To KLA`s Optical, source:Seeking Alpha, summary: No summary, Headline: Applied Materials Ballyhooed E-Beam Inspection Sector Lost Share To KLA's Optical, source:SeekingAlpha, summary: Applied Materials launched its new E-beam metrology/inspection technology on December 13, 2022. Read more here., Headline: KLA Corp. stock rises Tuesday, outperforms market, source:MarketWatch, summary: Shares of KLA Corp. inched 0.59% higher to $385.91 Tuesday, on what proved to be an all-around positive trading session for the stock market, with the S&P...",KLAC
70,2022-12-21,"Headline: KLA Corp. stock rises Wednesday, outperforms market, source:MarketWatch, summary: Shares of KLA Corp. advanced 2.82% to $396.78 Wednesday, on what proved to be an all-around positive trading session for the stock market, with the S&P 500..., Headline: Stock futures are muted after Wall Street's rally on Wednesday, source:CNBC, summary: Stocks remain on track for a losing month, even after two days of gains.",KLAC
71,2022-12-22,"Headline: Nvidia, Advanced Micro Devices lead chips lower as Micron cuts spending again, source:Seeking Alpha, summary: No summary, Headline: Micron’s Cautious Comments on Chip Inventories Weigh Heavily on Tech Shares, source:MarketWatch, summary: Micron is cutting staff, spending, and salaries in response to high inventories and softening demand from PC, handset and data center customers., Headline: KLA Corp. stock falls Thursday, underperforms market, source:MarketWatch, summary: Shares of KLA Corp. shed 5.78% to $373.85 Thursday, on what proved to be an all-around dismal trading session for the stock market, with the S&P 500 Index...",KLAC
72,2022-12-23,"Headline: Final Trades: KLA Corp., Charter & more, source:CNBC, summary: The ""Halftime Report"" traders give their top picks to watch for the second half., Headline: KLA Corp. stock rises Friday, outperforms market, source:MarketWatch, summary: Shares of KLA Corp. inched 0.95% higher to $377.39 Friday, on what proved to be an all-around positive trading session for the stock market, with the S&P 500...",KLAC
73,2022-12-24,"Headline: AMD, Micron, Nvidia among UBS`s top chip stocks for 2023, source:Seeking Alpha, summary: No summary",KLAC
74,2022-12-27,"Headline: KLA Corp. stock falls Tuesday, underperforms market, source:MarketWatch, summary: Shares of KLA Corp. slipped 1.67% to $371.10 Tuesday, on what proved to be an all-around mixed trading session for the stock market, with the Dow Jones...",KLAC
75,2022-12-28,"Headline: KLA Corp. stock falls Wednesday, still outperforms market, source:MarketWatch, summary: Shares of KLA Corp. slipped 0.90% to $367.76 Wednesday, on what proved to be an all-around rough trading session for the stock market, with the S&P 500 Index...",KLAC
76,2022-12-29,"Headline: KLA Corp. stock rises Thursday, outperforms market, source:MarketWatch, summary: Shares of KLA Corp. advanced 3.29% to $379.86 Thursday, on what proved to be an all-around favorable trading session for the stock market, with the S&P 500..., Headline: One question looms about where tech stocks go now, after one of their worst years on record, source:MarketWatch, summary: Investors face a single question after one of the worst years on record for tech stocks: Is the party over, or just on hold for a while?",KLAC
77,2022-12-30,"Headline: KLA Corp. stock falls Friday, underperforms market, source:MarketWatch, summary: Shares of KLA Corp. slipped 0.75% to $377.03 Friday, on what proved to be an all-around dismal trading session for the stock market, with the S&P 500 Index...",KLAC
78,2022-12-31,"Headline: Options Income Series - Earn Double-Digit Income (January 2023), source:SeekingAlpha, summary: We explain why selling cash-covered puts and covered calls are relatively safe choices for earning a high income. Click here to learn more.",KLAC
79,2023-01-01,"Headline: KLA's (NASDAQ:KLAC) investors will be pleased with their splendid 277% return over the last five years, source:Yahoo, summary: When you buy shares in a company, it's worth keeping in mind the possibility that it could fail, and you could lose...",KLAC
80,2023-01-03,"Headline: KLA Corp. stock outperforms market despite losses on the day, source:MarketWatch, summary: Shares of KLA Corp. sank 0.13% to $376.55 Tuesday, on what proved to be an all-around grim trading session for the stock market, with the S&P 500 Index..., Headline: Tracking Chris Hohn`s TCI Fund Management 13F Portfolio - Q3 2022 Update, source:Seeking Alpha, summary: No summary, Headline: Tracking Chris Hohn's TCI Fund Management 13F Portfolio - Q3 2022 Update, source:SeekingAlpha, summary: Chris Hohn's 13F portfolio value decreased from $31.60B to $28.58B this quarter. Click here to read more about TCI Fund's holdings and trades for Q3 2022.",KLAC
81,2023-01-04,"Headline: KLA Corp. stock rises Wednesday, outperforms market, source:MarketWatch, summary: Shares of KLA Corp. inched 0.98% higher to $380.23 Wednesday, on what proved to be an all-around great trading session for the stock market, with the S&P 500..., Headline: KLA Corp. stock falls Thursday, underperforms market, source:MarketWatch, summary: No summary",KLAC
82,2023-01-05,"Headline: Semiconductors Winners And Losers At The Start Of 2023, source:SeekingAlpha, summary: The year 2022 was bad for semis even though business was mostly good. Check out which semiconductor stock gained or lost in the past year., Headline: Memory And Logic: Two Different Chips, Two Different Trajectories In 2023, source:SeekingAlpha, summary: Micron and other memory companies have substantial inventories to work through, as revenues plummet. Click to learn more about the semiconductor industry., Headline: KLA Announces Second Quarter Fiscal Year 2023 Earnings Date, source:Yahoo, summary: KLA Corporation (NASDAQ: KLAC) today announced that the company will review second quarter fiscal year 2023 earnings on Thursday, Jan. 26, 2023, at 3 p.m. PST. The company's results will be published on the same day after the stock market closes, as well as supplemental disclosures including a shareholder letter and earnings slide presentation.",KLAC
83,2023-01-06,"Headline: KLA Corporation (NASDAQ:KLAC) insiders sold US$1.2m worth of stock suggesting impending weakness., source:Yahoo, summary: Over the past year, many KLA Corporation ( NASDAQ:KLAC ) insiders sold a significant stake in the company which may...",KLAC
84,2023-01-11,"Headline: 4 Factor Dividend Growth Portfolio - December 2022 Results, source:SeekingAlpha, summary: The 4 factor dividend growth portfolio was launched on November 1st, 2022 and is thus far off to a great start. Click to see how our strategy is going so far.",KLAC
85,2023-01-17,"Headline: TDV: The Underlying Index Looks Unattractive, source:SeekingAlpha, summary: The ProShares S&P Technology Dividend Aristocrats ETF is an equal-weight dividend-growth ETF in technology. Click here to see whether TDV is a Buy at this time., Headline: KLA Corp. stock falls Tuesday, underperforms market, source:MarketWatch, summary: Shares of KLA Corp. dropped 0.97% to $415.95 Tuesday, on what proved to be an all-around dismal trading session for the stock market, with the S&P 500 Index..., Headline: KLA Corporation: Executing Well In A Tough Environment, source:SeekingAlpha, summary: KLA Corp. has been executing well despite a tough macro environment for the semiconductor industry. Read why we believe now is a good opportunity to buy KLAC.",KLAC
