,date,information,related
86,2023-01-18,"Headline: PTF: Technology Dashboard For January, source:SeekingAlpha, summary: Semiconductors are the only industry with good value and quality scores. Communication equipment is the most overvalued one. Fast facts on PTF., Headline: KLA Corp.: My Top Equipment Company With Strong Tailwinds From National Chip Incentive Programs, source:SeekingAlpha, summary: KLA maintains aÂ dominant market share in the semiconductor metrology/inspection equipment market with more than 54% share. Read why KLAC stock may be a buy., Headline: KLA Corp. stock outperforms market despite losses on the day, source:MarketWatch, summary: Shares of KLA Corp. slid 0.21% to $415.06 Wednesday, on what proved to be an all-around grim trading session for the stock market, with the S&P 500 Index...",KLAC
87,2023-01-19,"Headline: KLA Corp. stock falls Thursday, underperforms market, source:MarketWatch, summary: Shares of KLA Corp. slipped 3.12% to $402.10 Thursday, on what proved to be an all-around dismal trading session for the stock market, with the S&P 500 Index...",KLAC
88,2023-01-23,"Headline: Good News for Nvidia, AMD, and Qualcomm—Barclays Is Bullish on Chips Again, source:MarketWatch, summary: Analysts are becoming positive on semiconductors. Artificial intelligence trends could boost several companies in the sector., Headline: This is the 'biggest disconnect' in the chip sector, according to Barclays, source:MarketWatch, summary: Wall Street may be too upbeat about the potential for chip-equipment stocks, according to a Barclays analyst., Headline: KLA Corp. stock rises Monday, outperforms market, source:MarketWatch, summary: Shares of KLA Corp. advanced 2.83% to $425.58 Monday, on what proved to be an all-around positive trading session for the stock market, with the S&P 500...",KLAC
89,2023-01-24,"Headline: KLA Corp. stock falls Tuesday, underperforms market, source:MarketWatch, summary: Shares of KLA Corp. slipped 0.57% to $423.14 Tuesday, on what proved to be an all-around mixed trading session for the stock market, with the Dow Jones...",KLAC
90,2023-01-25,"Headline: KLA Corp. stock falls Wednesday, underperforms market, source:MarketWatch, summary: Shares of KLA Corp. slid 0.12% to $422.62 Wednesday, on what proved to be an all-around mixed trading session for the stock market, with the Dow Jones...",KLAC
91,2023-01-26,"Headline: KLA 2Q Revenue Jumps 27%, source:MarketWatch, summary: By Kathryn Hardison KLA Corp. reported that its fiscal second-quarter revenue climbed 27% despite supply chain challenges and marketplace volatility. The..., Headline: KLA Corp. stock sinks as outlook disappoints following drop in chip demand, source:MarketWatch, summary: KLA Corp. slid after-hours on Thursday after the semiconductor-equipment maker forecast third-quarter profit and sales that came in below expectations., Headline: KLA Issues 3Q Outlook Lower Than Street Expectations, source:MarketWatch, summary: By Kathryn Hardison KLA Corp. provided guidance for its fiscal third-quarter on Thursday as the company braces for capacity adjustments in the semiconductor..., Headline: Stocks making the biggest moves after hours: Intel, Visa, Hasbro and more, source:CNBC, summary: These are the stocks posting the largest moves in after-hours trading. , Headline: KLA Corporation 2023 Q2 - Results - Earnings Call Presentation, source:SeekingAlpha, summary: The following slide deck was published by KLA Corporation in conjunction with their 2023 Q2 earnings call., Headline: Tokyo Electron: Japan's Decision On U.S. Sanctions Can Have A Major Impact On U.S. Semiconductor Equipment Companies, source:SeekingAlpha, summary: Japan's leading semiconductor equipment company Tokyo Electron Ltd. is in the crosshairs of U.S. sanctions. Read my take on how this could impact the stock., Headline: Stocks to Watch: Hasbro, KLA, Intel, source:MarketWatch, summary: Sabela Ojea Hasbro Inc. on Thursday said it is reducing its workforce by about 15% after posting a 17% decline in revenue in its latest quarter. Shares..., Headline: KLA Corporation (KLAC) Q2 2023 Earnings Call Transcript, source:SeekingAlpha, summary: KLA Corporation (NASDAQ:NASDAQ:KLAC) Q2 2023 Earnings Conference Call January 26, 2023 6:00 PM ETCompany ParticipantsKevin Kessel - Vice President of Investor Relations & Market..., Headline: KLA Corporation Reports Fiscal 2023 Second Quarter Results, source:Yahoo, summary: KLA Corporation (NASDAQ: KLAC) today announced financial and operating results for its second quarter of fiscal year 2023, which ended on Dec. 31, 2022, and reported GAAP net income attributable to KLA of $978.8 million and GAAP earnings per diluted share attributable to KLA of $6.89 on revenue of $2.98 billion., Headline: KLA forecasts Q3 revenue below estimates, source:Reuters, summary: U.S. chip toolmaker KLA Corp on Thursday forecast third-quarter revenue below Wall Street estimates, sending its shares down about 5.3% after market., Headline: Stocks moving in after hours: Intel, KLA Corp., Visa, Hasbro, Salesforce, source:Yahoo, summary: Yahoo Finance Live anchor Seana Smith looks at several stocks trending in the after-hours trading session., Headline: Chip toolmaker KLA flags weak Q3 as customers use up inventory; shares sink, source:Reuters, summary: U.S. chip toolmaker KLA Corp on Thursday forecast its slowest growth in 16 quarters for the January-March period, saying it expects customers to whittle down existing stockpiles of chips as demand from end-users slows., Headline: What You Missed On Wall Street On Friday, source:Thefly.com, summary: No summary, Headline: KLA Corp. stock falls Friday, underperforms market, source:MarketWatch, summary: No summary, Headline: Intel’s Data Warning Hits AMD and Nvidia Stock. A Chip Sector Upheaval Is Near., source:MarketWatch, summary: Stocks fall as worrying forecast spreads contagion in the market.",KLAC
92,2023-01-27,"Headline: KLA (KLAC): New Buy Recommendation for This Technology Giant, source:TipRanks, summary: No summary, Headline: KLA Corp. price target raised to $410 from $325 at Cowen, source:Thefly.com, summary: No summary, Headline: Analysts Are Bullish on Top Technology Stocks: KLA (KLAC), Dynatrace (DT), source:TipRanks, summary: No summary, Headline: KLA Corp. price target raised to $460 from $335 at Needham, source:Thefly.com, summary: No summary, Headline: Intel, KLA, Hasbro among premarket losers` pack, source:Seeking Alpha, summary: No summary, Headline: KLA Corp. price target raised to $455 from $420 at Wells Fargo, source:Thefly.com, summary: No summary, Headline: Stocks making the biggest moves premarket: Intel, Chevron, American Express, Silvergate and more, source:CNBC, summary: These are the stocks posting the largest moves in early trading. , Headline: INTC`s Dismal Earnings Drag Down Chip Stocks, source:TipRanks, summary: No summary, Headline: Analysts Have Conflicting Sentiments on These Technology Companies: Fair Isaac (FICO), KLA (KLAC) and Northrop (NOC), source:TipRanks, summary: No summary, Headline: What You Missed On Wall Street This Morning, source:Thefly.com, summary: No summary, Headline: KLA Shares Fall 5.1% on Lower-Than-Expected 3Q Outlook, source:MarketWatch, summary: By Kathryn Hardison Shares of KLA Corp. declined 5.1% to $406.90 Friday after its fiscal third-quarter guidance, which reflects changing demand for memory..., Headline: Stocks making the biggest moves midday: American Express, Intel, Silvergate Capital and more, source:CNBC, summary: These are the stocks posting the largest moves in midday trading. , Headline: Tokyo Electron: Underfollowed EUV Niche Market Leader, source:SeekingAlpha, summary: Tokyo Electron is a semiconductor equipment manufacturer and the market leader in the EUV Coater/Developer space with a 100% market share. Read more here., Headline: Visa, L3Harris rise; Intel, Eastman Chemical fall, source:Associated Press, The, summary: No summary, Headline: NEW YORK MARKET CLOSE: Stocks climb on improved US data, source:Alliance News, summary: No summary, Headline: These 2 Stocks Chipped Away at the Nasdaq Friday, source:Yahoo, summary: The stock market was engaged in a tug of war on Friday, as major market benchmarks did their best to hold onto their hard-earned gains from earlier in the week.  As of 11 a.m. ET, the Nasdaq Composite (NASDAQINDEX: ^IXIC) was the only one of the major indexes to see a slight uptick, having posted the best year-to-date returns four weeks into 2023.  Intel (NASDAQ: INTC) and KLA (NASDAQ: KLAC) were both among the biggest decliners on the Nasdaq, and together, they painted a downbeat picture that pulled some other semiconductor stocks lower as well.",KLAC
93,2023-01-28,"Headline: KLA Second Quarter 2023 Earnings: Beats Expectations, source:Yahoo, summary: KLA ( NASDAQ:KLAC ) Second Quarter 2023 Results Key Financial Results Revenue: US$2.98b (up 27% from 2Q 2022). Net..., Headline: Tokyo Electron A Strong Buy As Sector Holds On, source:SeekingAlpha, summary: Tokyo Electron remains a top-choice for investors. Click here to read why I would rate TOELF stock as a buy.",KLAC
94,2023-01-29,"Headline: Analysts` Opinions Are Mixed on These Technology Stocks: KLA (KLAC), Rockwell Automation (ROK) and SAP AG (SAP), source:TipRanks, summary: No summary",KLAC
95,2023-01-30,"Headline: KLA Corp. Will Benefit From CHIPS Act And The Infrastructure Supercycle, source:SeekingAlpha, summary: Automotive is going to be a major push for KLAC Corporation's performance. Click here to see our take on KLAC stock, Headline: KLA Corp. stock falls Monday, underperforms market, source:MarketWatch, summary: Shares of KLA Corp. shed 2.93% to $387.68 Monday, on what proved to be an all-around grim trading session for the stock market, with the S&P 500 Index..., Headline: AMD, NXP, Nvidia lead semiconductors higher ahead of AMD`s Q4 results, source:Seeking Alpha, summary: No summary",KLAC
96,2023-01-31,"Headline: Onto Innovation Needs A Catalyst For Direction, source:SeekingAlpha, summary: Onto Innovation has recouped the losses the stock suffered towards the end of 2022. Click here to read why I remain neutral on ONTO stock., Headline: KLA Corp: Safety Amid Chaos, source:SeekingAlpha, summary: KLA Corporation is trading at a fair valuation given its superior positioning and execution. Check out these three risks before buying KLAC stock., Headline: KLA Corp. stock rises Tuesday, still underperforms market, source:MarketWatch, summary: Shares of KLA Corp. rose 1.24% to $392.48 Tuesday, on what proved to be an all-around great trading session for the stock market, with the S&P 500 Index...",KLAC
97,2023-02-01,"Headline: 2 Widely Discussed Stocks to Consider, source:GuruFocus, summary: No summary, Headline: KLA Corp. stock rises Wednesday, outperforms market, source:MarketWatch, summary: Shares of KLA Corp. rallied 4.41% to $409.77 Wednesday, on what proved to be an all-around positive trading session for the stock market, with the S&P 500...",KLAC
98,2023-02-02,"Headline: KLA declares $1.30 dividend, source:Seeking Alpha, summary: No summary, Headline: KLA Corp. stock rises Thursday, still underperforms market, source:MarketWatch, summary: Shares of KLA Corp. advanced 1.10% to $414.26 Thursday, on what proved to be an all-around mixed trading session for the stock market, with the S&P 500 Index..., Headline: KLA Declares Regular Cash Dividend, source:Yahoo, summary: The KLA Corporation (NASDAQ: KLAC) board of directors today declared a quarterly cash dividend of $1.30 per share on its common stock, payable on March 1, 2023, to KLA shareholders of record as of the close of business on Feb.13, 2023.",KLAC
99,2023-02-03,"Headline: Nova: The Competition Sends Conflicting Signals, source:SeekingAlpha, summary: The stock has been trending higher for several months now, but a bad or good earnings report could shake things up. Click here to read my most recent analysis., Headline: KLA Corp. stock falls Friday, underperforms market, source:MarketWatch, summary: Shares of KLA Corp. shed 1.45% to $408.27 Friday, on what proved to be an all-around poor trading session for the stock market, with the S&P 500 Index...",KLAC
100,2023-02-04,"Headline: Dividend Champion, Contender, And Challenger Highlights: Week Of February 5, source:SeekingAlpha, summary: Dividend Champions list is monthly compilation of companies that consistently increased annual dividend payouts. Check out the full report of the week of February 5.",KLAC
101,2023-02-05,"Headline: LOS ANGELES CAPITAL MANAGEMENT LLC Buys 2, Sells 3 in 4th Quarter, source:GuruFocus, summary: No summary",KLAC
102,2023-02-06,"Headline: KLA (KLAC): New Buy Recommendation for This Technology Giant, source:TipRanks, summary: No summary, Headline: Analysts Offer Insights on Technology Companies: KLA (KLAC) and Microchip (MCHP), source:TipRanks, summary: No summary, Headline: Semiconductor Inspection Company's Growth Soars, But How Long Will It Last?, source:Yahoo, summary: In today's video, Jose Najarro, Nick Rossolillo, and Billy Duberstein discuss KLA (NASDAQ: KLAC), its latest earnings, and how the company's equipment is crucial for the chip manufacturing process. Check out the short video to learn more, consider subscribing, and click the special offer link below., Headline: KLA Corp. stock falls Monday, underperforms market, source:MarketWatch, summary: Shares of KLA Corp. shed 0.66% to $405.59 Monday, on what proved to be an all-around rough trading session for the stock market, with the S&P 500 Index...",KLAC
103,2023-02-07,"Headline: KLA Corp. stock rises Tuesday, outperforms market, source:MarketWatch, summary: Shares of KLA Corp. rallied 2.77% to $416.83 Tuesday, on what proved to be an all-around favorable trading session for the stock market, with the S&P 500..., Headline: KLA Corp. stock falls Wednesday, underperforms market, source:MarketWatch, summary: No summary",KLAC
104,2023-02-08,"Headline: Applied Materials: Important Questions Are Still Unresolved Leading Up To Today`s Earnings Call, source:Seeking Alpha, summary: No summary, Headline: KLA Corp. stock falls Thursday, still outperforms market, source:MarketWatch, summary: No summary",KLAC
105,2023-02-09,"Headline: Applied Materials: Important Questions Are Still Unresolved Leading Up To Today's Earnings Call, source:SeekingAlpha, summary: Applied Materials was vague about guidance in the last earnings call as competitors provided dour assessments for 2023. Read more here., Headline: KLA Corp. stock falls Friday, underperforms market, source:MarketWatch, summary: No summary",KLAC
106,2023-02-10,"Headline: Compounders And Dividends: February 2023 Watch List Update, source:SeekingAlpha, summary: Three companies have been removed from my watchlist and added to the active portfolio. I added four new companies to my watchlist. Read more here.",KLAC
107,2023-02-13,"Headline: KLA Corp. stock rises Monday, outperforms market, source:MarketWatch, summary: Shares of KLA Corp. rallied 1.77% to $402.70 Monday, on what proved to be an all-around positive trading session for the stock market, with the S&P 500 Index...",KLAC
108,2023-02-14,"Headline: 4 Factor Dividend Growth Portfolio - January 2023 Update, source:Seeking Alpha, summary: No summary, Headline: Tassat ® Group Appoints Zain Saidin as Chief Operating Officer, source:Business Wire, summary: No summary, Headline: Oaktop Capital Management II, L.P. Buys 1, Sells 4 in 4th Quarter, source:GuruFocus, summary: No summary, Headline: KLA Corp. stock falls Tuesday, underperforms market, source:MarketWatch, summary: Shares of KLA Corp. slipped 0.09% to $402.33 Tuesday, on what proved to be an all-around grim trading session for the stock market, with the S&P 500 Index...",KLAC
109,2023-02-15,"Headline: KLA Corp. stock rises Wednesday, outperforms market, source:MarketWatch, summary: Shares of KLA Corp. inched 0.53% higher to $404.46 Wednesday, on what proved to be an all-around positive trading session for the stock market, with the S&P..., Headline: Applied Materials rises as guidance tops estimates, source:Seeking Alpha, summary: No summary",KLAC
110,2023-02-16,"Headline: KLA Corp. stock falls Thursday, underperforms market, source:MarketWatch, summary: Shares of KLA Corp. slid 2.88% to $392.83 Thursday, on what proved to be an all-around rough trading session for the stock market, with the S&P 500 Index...",KLAC
111,2023-02-17,"Headline: KLAC June 2024 Options Begin Trading, source:Stock Options Channel, summary: No summary, Headline: KLA Corp. stock falls Friday, underperforms market, source:MarketWatch, summary: Shares of KLA Corp. shed 1.25% to $387.92 Friday, on what proved to be an all-around mixed trading session for the stock market, with the Dow Jones...",KLAC
112,2023-02-20,"Headline: Tracking Jeremy Grantham`s GMO Capital Portfolio - Q4 2022 Update, source:Seeking Alpha, summary: No summary, Headline: Tracking Jeremy Grantham's GMO Capital Portfolio - Q4 2022 Update, source:SeekingAlpha, summary: Jeremy Granthamâs 13F portfolio value increased from $17.33B to $18.77B this quarter. Click here to read the full update of the portfolio for Q4 2022.",KLAC
113,2023-02-21,"Headline: Intel leads chips lower as Morgan Stanley cuts PC estimates again, source:Seeking Alpha, summary: No summary, Headline: KLAC Maintains Domination: An Updated Comparison With Onto Innovation, source:SeekingAlpha, summary: KLA maintains a dominant market share in the semiconductor metrology/inspection equipment market with more than 55% share. Read more here., Headline: KLA Corp. stock falls Tuesday, underperforms market, source:MarketWatch, summary: Shares of KLA Corp. shed 2.47% to $378.34 Tuesday, on what proved to be an all-around poor trading session for the stock market, with the S&P 500 Index..., Headline: KLA Announces Upcoming Investor Webcast, source:Yahoo, summary: MILPITAS, Calif., Feb. 21, 2023 /PRNewswire/—KLA Corporation (NASDAQ: KLAC) today announced the webcast for upcoming investor conference:",KLAC
114,2023-02-22,"Headline: KLA Corp. stock outperforms market despite losses on the day, source:MarketWatch, summary: Shares of KLA Corp. shed 0.16% to $377.75 Wednesday, on what proved to be an all-around poor trading session for the stock market, with the S&P 500 Index..., Headline: 5 Big Earning Beats Making These Stocks a Buy, source:InvestorPlace, summary: No summary",KLAC
115,2023-02-23,"Headline: KLA Corp. stock rises Thursday, outperforms market, source:MarketWatch, summary: Shares of KLA Corp. rose 2.81% to $388.37 Thursday, on what proved to be an all-around great trading session for the stock market, with the S&P 500 Index...",KLAC
116,2023-02-24,"Headline: KLA Corp. stock falls Friday, underperforms market, source:MarketWatch, summary: Shares of KLA Corp. slid 2.19% to $379.85 Friday, on what proved to be an all-around grim trading session for the stock market, with the S&P 500 Index...",KLAC
117,2023-02-25,"Headline: Dividend Champion, Contender, And Challenger Highlights: Week Of February 26, source:SeekingAlpha, summary: Weekly summary of dividend activity for Dividend Champions, Contenders, Challengers. Read more to see the companies with upcoming ex-dividend dates., Headline: The 10 Biggest Technology Companies With Net Margins Of Over 30%, source:TalkMarkets, summary: No summary",KLAC
118,2023-02-27,"Headline: KLA Corp. stock falls Monday, underperforms market, source:MarketWatch, summary: Shares of KLA Corp. slid 0.20% to $379.09 Monday, on what proved to be an all-around great trading session for the stock market, with the S&P 500 Index...",KLAC
119,2023-02-28,"Headline: Earn Double-Digit Income With Options (March 2023), source:SeekingAlpha, summary: We explain why selling cash-covered puts and covered calls are relatively safe choices for earning a high income. Read more here., Headline: Teradyne And Advantest: A Duopoly In The Semiconductor Value Chain, source:Seeking Alpha, summary: No summary, Headline: KLA Corp. stock rises Tuesday, outperforms market, source:MarketWatch, summary: Shares of KLA Corp. inched 0.08% higher to $379.38 Tuesday, on what proved to be an all-around grim trading session for the stock market, with the S&P 500...",KLAC
120,2023-03-01,"Headline: KLA Corp. downgraded to Neutral from Outperform at KGI Securities, source:Thefly.com, summary: No summary, Headline: KLA Corp. stock falls Wednesday, still outperforms market, source:MarketWatch, summary: Shares of KLA Corp. slumped 0.27% to $378.34 Wednesday, on what proved to be an all-around mixed trading session for the stock market, with the Dow Jones...",KLAC
121,2023-03-02,"Headline: April 14th Options Now Available For KLAC, source:Stock Options Channel, summary: No summary, Headline: KLA Corp. stock falls Thursday, underperforms market, source:MarketWatch, summary: Shares of KLA Corp. sank 0.01% to $378.31 Thursday, on what proved to be an all-around favorable trading session for the stock market, with the S&P 500 Index...",KLAC
122,2023-03-03,"Headline: KLA Corp. stock rises Friday, still underperforms market, source:MarketWatch, summary: Shares of KLA Corp. inched 0.85% higher to $381.53 Friday, on what proved to be an all-around great trading session for the stock market, with the S&P 500...",KLAC
123,2023-03-06,"Headline: KLA Corp. stock falls Monday, underperforms market, source:MarketWatch, summary: Shares of KLA Corp. shed 0.49% to $379.67 Monday, on what proved to be an all-around positive trading session for the stock market, with the S&P 500 Index...",KLAC
124,2023-03-07,"Headline: KLA Corporation: Thinking Long Term, source:SeekingAlpha, summary: KLA Corporation is well positioned to take advantage of the growth in computing. We continue to view KLAC stock as being undervalued, click here to read why., Headline: KLA Corp. stock falls Tuesday, still outperforms market, source:MarketWatch, summary: Shares of KLA Corp. slipped 1.12% to $375.40 Tuesday, on what proved to be an all-around grim trading session for the stock market, with the S&P 500 Index...",KLAC
125,2023-03-08,"Headline: KLA Corp. stock rises Wednesday, outperforms market, source:MarketWatch, summary: Shares of KLA Corp. rallied 3.20% to $387.41 Wednesday, on what proved to be an all-around mixed trading session for the stock market, with the S&P 500 Index..., Headline: Calculating The Fair Value Of KLA Corporation (NASDAQ:KLAC), source:Yahoo, summary: Key Insights Using the 2 Stage Free Cash Flow to Equity, KLA fair value estimate is US$361 With US$375 share price, KLA..., Headline: Nvidia, Qualcomm leads chips lower as sector sees increased political attention, source:Seeking Alpha, summary: No summary",KLAC
126,2023-03-09,"Headline: Intel leads semiconductors as sector sees increased political attention, source:Seeking Alpha, summary: No summary, Headline: Intel leads semiconductors higher as sector sees increased political attention, source:Seeking Alpha, summary: No summary, Headline: KLA Corp. stock falls Thursday, underperforms market, source:MarketWatch, summary: Shares of KLA Corp. slid 2.31% to $378.47 Thursday, on what proved to be an all-around dismal trading session for the stock market, with the S&P 500 Index...",KLAC
127,2023-03-10,"Headline: KLA Corp. stock falls Friday, underperforms market, source:MarketWatch, summary: Shares of KLA Corp. shed 2.90% to $367.51 Friday, on what proved to be an all-around rough trading session for the stock market, with the S&P 500 Index...",KLAC
128,2023-03-13,"Headline: Applied Materials lead chips higher as sector reacts to bank backstops, source:Seeking Alpha, summary: No summary, Headline: KLA Corp. stock falls Monday, underperforms market, source:MarketWatch, summary: Shares of KLA Corp. dropped 0.73% to $364.82 Monday, on what proved to be an all-around grim trading session for the stock market, with the S&P 500 Index..., Headline: SOXX: Semicon Industry 2023 -��Full Steam Ahead, source:Seeking Alpha, summary: No summary",KLAC
129,2023-03-14,"Headline: SOXX: Semicon Industry 2023 - Full Steam Ahead, source:SeekingAlpha, summary: We expect semiconductor chipmakers' growth to recover by 19% on average. Click here to read our take on what it could mean for SOXX ETF., Headline: Lam Research Anguish From China Sanctions, source:SeekingAlpha, summary: Mainland Chinese equipment companies that are direct competitors of Lam Research are gaining share in etch, clean, and deposition. Read more here., Headline: KLA Corp. stock rises Tuesday, outperforms market, source:MarketWatch, summary: Shares of KLA Corp. rallied 3.89% to $379.02 Tuesday, on what proved to be an all-around great trading session for the stock market, with the S&P 500 Index...",KLAC
130,2023-03-15,"Headline: KLA Corp. stock falls Wednesday, underperforms market, source:MarketWatch, summary: Shares of KLA Corp. slipped 2.30% to $370.31 Wednesday, on what proved to be an all-around dismal trading session for the stock market, with the S&P 500..., Headline: 4 Factor Dividend Growth Portfolio - First Insight, source:SeekingAlpha, summary: I started the 4-factor dividend growth portfolio on November 1st, 2022. Click here to read more about the first insights of the portfolio.",KLAC
131,2023-03-16,"Headline: KLA Corp. stock rises Thursday, outperforms market, source:MarketWatch, summary: Shares of KLA Corp. rose 5.29% to $389.90 Thursday, on what proved to be an all-around positive trading session for the stock market, with the S&P 500 Index...",KLAC
132,2023-03-17,"Headline: KLA Corp. stock falls Friday, still outperforms market, source:MarketWatch, summary: Shares of KLA Corp. slid 0.55% to $387.75 Friday, on what proved to be an all-around poor trading session for the stock market, with the S&P 500 Index...",KLAC
