,date,information,related
185,2023-05-26,"Headline: KLAC Crosses Above Average Analyst Target, source:ETF Channel, summary: No summary, Headline: KLA Corp. stock rises Friday, outperforms market, source:MarketWatch, summary: Shares of KLA Corp. rallied 6.20% to $461.19 Friday, on what proved to be an all-around favorable trading session for the stock market, with the S&P 500...",KLAC
186,2023-05-28,"Headline: Dividend Champion, Contender, And Challenger Highlights: Week Of May 28, source:SeekingAlpha, summary: A weekly summary of dividend activity for Dividend Champions, Contenders, and Challengers. Companies which changed their dividends. Click here to read more.",KLAC
187,2023-05-29,"Headline: 10 Information Technology Stocks With Whale Alerts In Today's Session, source:Benzinga, summary: No summary",KLAC
188,2023-05-30,"Headline: KLA Corp, Easterly Government Properties And A Major Airline Stock On CNBC's 'Final Trades', source:Benzinga, summary: No summary, Headline: KLA Corp. stock falls Tuesday, underperforms market, source:MarketWatch, summary: Shares of KLA Corp. slid 0.53% to $458.73 Tuesday, on what proved to be an all-around mixed trading session for the stock market, with the S&P 500 Index..., Headline: Expert Ratings for KLA, source:Benzinga, summary: No summary",KLAC
189,2023-05-31,"Headline: UBS Maintains KLA (KLAC) Neutral Recommendation, source:Fintel, summary: nan, Headline: KLA Corp. stock falls Wednesday, underperforms market, source:MarketWatch, summary: Shares of KLA Corp. shed 3.43% to $442.99 Wednesday, on what proved to be an all-around dismal trading session for the stock market, with the S&P 500 Index...",KLAC
190,2023-06-01,"Headline: This Is What Whales Are Betting On KLA, source:Benzinga, summary: No summary, Headline: KLA Corp. stock rises Thursday, outperforms market, source:MarketWatch, summary: Shares of KLA Corp. rallied 2.15% to $452.53 Thursday, on what proved to be an all-around great trading session for the stock market, with the S&P 500 Index...",KLAC
191,2023-06-02,"Headline: Bull of the Day: Nova, source:TalkMarkets, summary: No summary, Headline: KLA Corp. stock rises Friday, still underperforms market, source:MarketWatch, summary: Shares of KLA Corp. advanced 1.22% to $458.06 Friday, on what proved to be an all-around favorable trading session for the stock market, with the S&P 500...",KLAC
192,2023-06-04,"Headline: KLA Unusual Options Activity For June 05, source:Benzinga, summary: No summary",KLAC
193,2023-06-05,"Headline: KLA Corp. stock outperforms market despite losses on the day, source:MarketWatch, summary: Shares of KLA Corp. dropped 0.00% to $458.05 Monday, on what proved to be an all-around grim trading session for the stock market, with the S&P 500 Index..., Headline: Wells Fargo Maintains KLA (KLAC) Overweight Recommendation, source:Fintel, summary: nan, Headline: Check Out What Whales Are Doing With KLAC, source:Benzinga, summary: No summary",KLAC
194,2023-06-06,"Headline: $100 Invested In KLA 10 Years Ago Would Be Worth This Much Today, source:Benzinga, summary: No summary, Headline: KLA Corp. stock rises Tuesday, outperforms market, source:MarketWatch, summary: Shares of KLA Corp. inched 0.64% higher to $461.00 Tuesday, on what proved to be an all-around positive trading session for the stock market, with the S&P...",KLAC
195,2023-06-07,"Headline: 10 Information Technology Stocks Whale Activity In Today's Session, source:Benzinga, summary: No summary, Headline: KLA Corp. stock rises Wednesday, outperforms market, source:MarketWatch, summary: Shares of KLA Corp. inched 0.60% higher to $463.76 Wednesday, on what proved to be an all-around mixed trading session for the stock market, with the Dow..., Headline: KLA Corporation: Little Impact From China Sanctions On Semiconductor Equipment, source:SeekingAlpha, summary: KLA Corporation maintains a healthy balance sheet, with a strong focus on liquidity and financial stability. Find out why KLAC stock is a Buy., Headline: KLA Corp. stock rises Thursday, outperforms market, source:MarketWatch, summary: No summary",KLAC
196,2023-06-08,"Headline: KLA Corp. stock falls Friday, underperforms market, source:MarketWatch, summary: No summary",KLAC
197,2023-06-09,"Headline: 4 Factor Dividend Growth Portfolio - Passively Outpacing The Market, source:SeekingAlpha, summary: The 4-factor dividend growth portfolio is a strategy that leverages the stock selection process of SCHD, with a few minor twists. Click for my exclusive picks.",KLAC
198,2023-06-12,"Headline: KLA Corp. stock rises Monday, outperforms market, source:MarketWatch, summary: Shares of KLA Corp. advanced 2.10% to $475.43 Monday, on what proved to be an all-around favorable trading session for the stock market, with the S&P 500...",KLAC
199,2023-06-13,"Headline: KLA Corp. stock rises Tuesday, outperforms market, source:MarketWatch, summary: Shares of KLA Corp. inched 0.94% higher to $479.89 Tuesday, on what proved to be an all-around positive trading session for the stock market, with the S&P...",KLAC
200,2023-06-14,"Headline: KLA Corp. downgraded to Hold from Buy at Needham, source:Thefly.com, summary: No summary, Headline: Estee Lauder upgraded, Dine Brands downgraded: Wall Street's top analyst calls, source:Thefly.com, summary: No summary, Headline: Applied Materials, other semi-cap stocks cut to Hold at Needham on AI hype, source:Seeking Alpha, summary: No summary, Headline: Benzinga's Top Ratings Upgrades, Downgrades For June 14, 2023, source:Benzinga, summary: No summary, Headline: Applied Materials and KLA Stock Slip. ‘AI Hype’ Is Overdone, Analyst Says., source:MarketWatch, summary: Needham analyst N. Quinn Bolton downgraded both Applied Materials and KLA stock to Hold from Buy. Both have surged by double-digits this year., Headline: KLA Corp. stock rises Wednesday, outperforms market, source:MarketWatch, summary: Shares of KLA Corp. inched 0.14% higher to $480.54 Wednesday, on what proved to be an all-around mixed trading session for the stock market, with the S&P 500...",KLAC
201,2023-06-15,"Headline: AI Fever: These 6 Overbought SemiCap Stocks Raise Red Flags, Warns Top Analyst, source:TipRanks, summary: No summary, Headline: KLA's (NASDAQ:KLAC) investors will be pleased with their incredible 376% return over the last five years, source:Yahoo, summary: We think all investors should try to buy and hold high quality multi-year winners. And we've seen some truly amazing..., Headline: Final Trades: CrowdStrike, Transocean, KLA Corp. & more, source:CNBC, summary: The ""Halftime Report"" traders give their top picks to watch for the second half., Headline: KLA Corp. stock falls Thursday, underperforms market, source:MarketWatch, summary: Shares of KLA Corp. shed 1.66% to $472.58 Thursday, on what proved to be an all-around favorable trading session for the stock market, with the S&P 500 Index...",KLAC
202,2023-06-16,"Headline: CrowdStrike, Transocean, KLA Corp And This Australian Company On CNBC's 'Final Trades', source:Benzinga, summary: No summary, Headline: Micron, AMD lead semiconductor stocks lower to end strong week, source:Seeking Alpha, summary: No summary, Headline: KLA Corp. stock falls Friday, underperforms market, source:MarketWatch, summary: Shares of KLA Corp. slipped 1.63% to $464.89 Friday, on what proved to be an all-around grim trading session for the stock market, with the S&P 500 Index...",KLAC
203,2023-06-17,"Headline: KLA Corporation: Growing Market Share And Cash Flows, source:SeekingAlpha, summary: KLA Corporation is a promising investment opportunity due to its role as a supplier in the growing semiconductor and automotive industries. Read more here.",KLAC
204,2023-06-20,"Headline: KLA Corp. stock falls Tuesday, still outperforms market, source:MarketWatch, summary: Shares of KLA Corp. sank 0.09% to $464.45 Tuesday, on what proved to be an all-around rough trading session for the stock market, with the S&P 500 Index...",KLAC
205,2023-06-21,"Headline: KLA (KLAC) Receives a Rating Update from a Top Analyst, source:TipRanks, summary: No summary, Headline: KLA Corp. stock falls Wednesday, underperforms market, source:MarketWatch, summary: Shares of KLA Corp. slid 1.73% to $456.43 Wednesday, on what proved to be an all-around dismal trading session for the stock market, with the S&P 500 Index...",KLAC
206,2023-06-22,"Headline: Here's How Much $1000 Invested In KLA 5 Years Ago Would Be Worth Today, source:Benzinga, summary: No summary, Headline: KLA Corp. stock rises Thursday, outperforms market, source:MarketWatch, summary: Shares of KLA Corp. rallied 2.40% to $467.38 Thursday, on what proved to be an all-around mixed trading session for the stock market, with the S&P 500 Index...",KLAC
207,2023-06-23,"Headline: KLA Corp. stock falls Friday, underperforms market, source:MarketWatch, summary: Shares of KLA Corp. slipped 2.23% to $456.95 Friday, on what proved to be an all-around poor trading session for the stock market, with the S&P 500 Index...",KLAC
208,2023-06-25,"Headline: This Tech Sector Should Surge 60% in 3 Years: 3 Ways to Play It, source:Yahoo, summary: Are you ready to tap into the tech sector's hidden gold mine? This subsector is set to rocket by 60% in three years.",KLAC
209,2023-06-26,"Headline: This Tiny Semiconductor Stock Could Provide Monster Returns Over the Next Decade, source:Yahoo, summary: Shares of small semiconductor equipment company Onto Innovation (NYSE: ONTO) have been on a roll this year (up over 50% so far in 2023) and are near all-time highs.  A record number of chip fabs (the facilities that manufacture chips) have recently been green-lit for construction, and those facilities will need to be filled with advanced equipment like what Onto specializes in.  Here's why this could be a monster stock to own for the rest of this decade., Headline: KLA Corp. stock rises Monday, outperforms market, source:MarketWatch, summary: Shares of KLA Corp. inched 0.35% higher to $458.55 Monday, on what proved to be an all-around grim trading session for the stock market, with the S&P 500...",KLAC
210,2023-06-27,"Headline: KLA Corp. stock rises Tuesday, outperforms market, source:MarketWatch, summary: Shares of KLA Corp. rallied 4.01% to $476.93 Tuesday, on what proved to be an all-around positive trading session for the stock market, with the S&P 500...",KLAC
211,2023-06-28,"Headline: Nvidia, AMD dip as US mulls new AI chip curbs for China - report, source:Seeking Alpha, summary: No summary, Headline: KLA Announces Fourth Quarter Fiscal Year 2023 Earnings Date, source:PR Newswire, summary: No summary, Headline: KLA Corp. stock falls Wednesday, underperforms market, source:MarketWatch, summary: Shares of KLA Corp. shed 0.52% to $474.43 Wednesday, on what proved to be an all-around grim trading session for the stock market, with the S&P 500 Index...",KLAC
212,2023-06-29,"Headline: KLA Corp. stock rises Thursday, outperforms market, source:MarketWatch, summary: Shares of KLA Corp. inched 0.59% higher to $477.23 Thursday, on what proved to be an all-around favorable trading session for the stock market, with the S&P..., Headline: Notable Friday Option Activity: KLAC, CRM, ETSY, source:Stock Options Channel, summary: No summary",KLAC
213,2023-06-30,"Headline: Peering Into KLA's Recent Short Interest, source:Benzinga, summary: No summary, Headline: Nvidia leads chips higher as sector looks to end the week on solid ground, source:Seeking Alpha, summary: No summary, Headline: KLA Corp. stock rises Friday, outperforms market, source:MarketWatch, summary: Shares of KLA Corp. rose 1.63% to $485.02 Friday, on what proved to be an all-around positive trading session for the stock market, with the S&P 500 Index...",KLAC
214,2023-07-01,"Headline: Why KLA Corporation (NASDAQ:KLAC) Could Be Worth Watching, source:Yahoo, summary: Today we're going to take a look at the well-established KLA Corporation ( NASDAQ:KLAC ). The company's stock led the...",KLAC
215,2023-07-03,"Headline: Nvidia and AMD: Weapons of AI Chip War, source:TipRanks, summary: No summary",KLAC
216,2023-07-05,"Headline: Semiconductors Winners And Losers At The Start Of H2 2023, source:Seeking Alpha, summary: No summary, Headline: KLA Corp. stock falls Wednesday, underperforms market, source:MarketWatch, summary: Shares of KLA Corp. slipped 3.49% to $467.91 Wednesday, on what proved to be an all-around grim trading session for the stock market, with the S&P 500 Index..., Headline: Semiconductors Winners And Losers At The Start Of H2 2023, source:SeekingAlpha, summary: Semis look poised for continued gains in Q3 after the rally continued in Q2, but there were several changes worth noting. Read more on semi stocks here.",KLAC
217,2023-07-06,"Headline: KLA Corp. stock falls Thursday, underperforms market, source:MarketWatch, summary: Shares of KLA Corp. slipped 1.36% to $461.54 Thursday, on what proved to be an all-around rough trading session for the stock market, with the S&P 500 Index..., Headline: What You Missed On Wall Street On Friday, source:Thefly.com, summary: No summary, Headline: KLA Corp. downgraded to Sector Weight from Overweight at KeyBanc, source:Thefly.com, summary: No summary",KLAC
218,2023-07-07,"Headline: KLA Corp slips as KeyBanc Capital downgrades, citing chip recovery worries, source:Seeking Alpha, summary: No summary, Headline: 4 stocks to watch on Friday: Coty, Costco and more, source:Seeking Alpha, summary: No summary, Headline: Benzinga's Top Ratings Upgrades, Downgrades For July 7, 2023, source:Benzinga, summary: No summary, Headline: KLA Corp Shares Overpriced Amid Delayed Cyclical Upturn, Says Analyst, source:Benzinga, summary: No summary, Headline: Where KLA Stands With Analysts, source:Benzinga, summary: No summary, Headline: Keybanc Downgrades KLA (KLAC), source:Fintel, summary: nan, Headline: Chip Downgrades Pile Up as Recovery Gets Priced In, source:MarketWatch, summary: A KeyBanc analyst downgraded chip-equipment maker KLA Corp., citing concerns about valuation after a recent rally., Headline: What You Missed On Wall Street This Morning, source:Thefly.com, summary: No summary, Headline: JPMorgan upgraded, Exxon downgraded: Wall Street's top analyst calls, source:Yahoo, summary: JPMorgan upgraded, Exxon downgraded: Wall Street's top analyst calls, Headline: KLA Corp. stock falls Friday, underperforms market, source:MarketWatch, summary: Shares of KLA Corp. slipped 1.24% to $455.83 Friday, on what proved to be an all-around dismal trading session for the stock market, with the S&P 500 Index...",KLAC
219,2023-07-09,"Headline: 4 Factor Dividend Growth Portfolio - Cruising Towards A 20% Return, source:SeekingAlpha, summary: The 4-factor dividend growth portfolio is a strategy that leverages the stock selection process of SCHD, with a few minor twists. Learn more about the strategy.",KLAC
220,2023-07-10,"Headline: Institutional investors may overlook KLA Corporation's (NASDAQ:KLAC) recent US$4.0b market cap drop as long-term gains remain positive, source:Yahoo, summary: Key Insights Institutions' substantial holdings in KLA implies that they have significant influence over the company's..., Headline: KLA Corp. stock rises Monday, outperforms market, source:MarketWatch, summary: Shares of KLA Corp. rose 2.60% to $467.66 Monday, on what proved to be an all-around favorable trading session for the stock market, with the S&P 500 Index...",KLAC
221,2023-07-11,"Headline: KLA Corp. stock falls Tuesday, underperforms market, source:MarketWatch, summary: Shares of KLA Corp. slipped 1.75% to $459.48 Tuesday, on what proved to be an all-around positive trading session for the stock market, with the S&P 500...",KLAC
222,2023-07-12,"Headline: KLA Corp. stock rises Wednesday, outperforms market, source:MarketWatch, summary: Shares of KLA Corp. rose 1.43% to $466.07 Wednesday, on what proved to be an all-around great trading session for the stock market, with the S&P 500 Index...",KLAC
223,2023-07-13,"Headline: KLA Corp. stock rises Thursday, outperforms market, source:MarketWatch, summary: Shares of KLA Corp. rose 2.09% to $475.82 Thursday, on what proved to be an all-around positive trading session for the stock market, with the S&P 500 Index...",KLAC
224,2023-07-14,"Headline: Citi sees '99B reasons to stay long' chip equipment stocks, new highs expected, source:Seeking Alpha, summary: No summary, Headline: KLA Corp. stock falls Friday, underperforms market, source:MarketWatch, summary: Shares of KLA Corp. sank 0.22% to $474.79 Friday, on what proved to be an all-around mixed trading session for the stock market, with the Dow Jones...",KLAC
225,2023-07-17,"Headline: KLA Corp. stock rises Monday, outperforms market, source:MarketWatch, summary: Shares of KLA Corp. rallied 3.28% to $490.38 Monday, on what proved to be an all-around positive trading session for the stock market, with the S&P 500 Index..., Headline: KLA Corp. stock falls Tuesday, underperforms market, source:MarketWatch, summary: No summary",KLAC
226,2023-07-18,"Headline: KLA Corp. stock falls Wednesday, underperforms market, source:MarketWatch, summary: No summary",KLAC
227,2023-07-19,"Headline: (KLAC) - Analyzing KLA's Short Interest, source:Benzinga, summary: No summary, Headline: KLA (NASDAQ:KLAC) stock performs better than its underlying earnings growth over last five years, source:Yahoo, summary: Long term investing can be life changing when you buy and hold the truly great businesses. And highest quality..., Headline: KLA Corp. stock falls Thursday, underperforms market, source:MarketWatch, summary: No summary",KLAC
228,2023-07-20,"Headline: Chips sink as Taiwan Semiconductor 2023 outlook sends shivers across sector, source:Seeking Alpha, summary: No summary, Headline: This Is What Whales Are Betting On KLA, source:Benzinga, summary: No summary, Headline: KLA Corp. stock rises Friday, outperforms market, source:MarketWatch, summary: No summary",KLAC
229,2023-07-21,"Headline: My Highest Quality Dividend Contenders, source:SeekingAlpha, summary: This article presented the 19 highest-quality Dividend Contenders based on my quality scoring system. Click here to read more., Headline: 4 Factor Dividend Growth Portfolio - Deep Dive Analysis, source:SeekingAlpha, summary: My portfolio based on stock selection methodology of Dow Jones US Dividend 100 Index has returned 21.72% since its inception 8.5 months ago. Click here to find out more.",KLAC
230,2023-07-23,"Headline: Good News: New Bull Market, Bad News: Growth Stocks Earnings Disappoint, source:SeekingAlpha, summary: The stock market is revealing a new positive message, even as market participants sell on earnings reports. Click here to read more about the market outlook., Headline: Chip Stocks Mixed With Analyst Pics, Pans, source:TipRanks, summary: No summary, Headline: Chip Stocks Mixed as Analysts Weigh In, source:TipRanks, summary: No summary, Headline: KLA Corp. stock rises Monday, outperforms market, source:MarketWatch, summary: No summary",KLAC
231,2023-07-24,"Headline: Here's How Much $100 Invested In KLA 15 Years Ago Would Be Worth Today, source:Benzinga, summary: No summary, Headline: Lam Research rises as Stifel upgrades to buy, source:Seeking Alpha, summary: No summary, Headline: Ahead Of Semiconductor Earnings, Analysts Expect AI To Serve As 'Shining Pillar' To Guide Through Muted Chip Demand, source:Benzinga, summary: No summary, Headline: A Look At The Fair Value Of KLA Corporation (NASDAQ:KLAC), source:Yahoo, summary: Key Insights Using the 2 Stage Free Cash Flow to Equity, KLA fair value estimate is US$405 With US$459 share price, KLA..., Headline: Lam Research Earnings: All Eyes On Memory Chip Recovery, source:SeekingAlpha, summary: Memory equipment sales will dominate Lam Research's revenues for the foreseeable future. Click here to read about what to expect for LRCX's earnings., Headline: KLA Names Michael R. McMullen to Board of Directors, source:Yahoo, summary: KLA Corporation (NASDAQ: KLAC) announced the appointment of Michael R. McMullen to its Board of Directors and Compensation and Talent Committee.",KLAC
232,2023-07-25,"Headline: KLA Corp. stock rises Tuesday, outperforms market, source:MarketWatch, summary: Shares of KLA Corp. rose 1.11% to $466.11 Tuesday, on what proved to be an all-around great trading session for the stock market, with the S&P 500 Index...",KLAC
233,2023-07-26,"Headline: Applied Materials: Still Firing On All Cylinders, source:SeekingAlpha, summary: Applied Materials is in a strong financial position, despite challenges from Chinese export restrictions and industry cyclicality. See why I rate AMAT a hold., Headline: A Preview Of KLA's Earnings, source:Benzinga, summary: No summary, Headline: KLA Corp. stock falls Wednesday, underperforms market, source:MarketWatch, summary: Shares of KLA Corp. slipped 1.77% to $457.85 Wednesday, on what proved to be an all-around mixed trading session for the stock market, with the Dow Jones..., Headline: GLOBAL BRIEFING: Stocks rise on hopes Fed's hiking cycle is over, source:Alliance News, summary: No summary, Headline: STMicro, ASML higher, but semiconductor stocks mixed as sector awaits Intel results, source:Seeking Alpha, summary: No summary, Headline: GF Score Analysis: A Deep Dive into Applied Materials Inc (AMAT), source:GuruFocus, summary: No summary, Headline: GF Score Analysis: A Deep Dive into Lam Research Corp (LRCX), source:GuruFocus, summary: No summary, Headline: KLA-Tencor options imply 4.1% move in share price post-earnings, source:Thefly.com, summary: No summary, Headline: KLA Corp. reports Q4 adjusted EPS $5.40, consensus $4.85, source:Thefly.com, summary: No summary, Headline: KLA Corp. sees Q1 adjusted EPS $5.35 +/- 60c, consensus $4.74, source:Thefly.com, summary: No summary, Headline: KLA Non-GAAP EPS of $5.40 beats by $0.54, revenue of $2.36B beats by $100M, source:Seeking Alpha, summary: No summary",KLAC
234,2023-07-27,"Headline: Fly Intel: After-Hours Movers, source:Thefly.com, summary: No summary, Headline: US Stocks Buckle Up For Solid Open On Meta's Earnings Boost, Fed Relief — But Analyst Advises Some 'Value-Style' Rebalancing, source:Benzinga, summary: No summary, Headline: Comcast, STMicroelectronics, Lam Research, Meta Platforms And Other Big Stocks Moving Higher On Thursday, source:Benzinga, summary: No summary, Headline: Why Willis Towers Watson Shares Are Trading Lower By 9%? Here Are Other Stocks Moving In Thursday's Mid-Day Session, source:Benzinga, summary: No summary, Headline: Notable companies reporting after market close, source:Thefly.com, summary: No summary, Headline: KLA Unusual Options Activity, source:Benzinga, summary: No summary, Headline: Nasdaq Soars, Meta Rallies, Dow Flirts With Record Streak and Oil Jumps To $80: What's Driving Markets Thursday?, source:Benzinga, summary: No summary, Headline: Stocks making the biggest moves midday: Meta Platforms, Chipotle, Royal Caribbean and more, source:CNBC, summary: Here are the stocks making headlines on Wall Street on Thursday, July 27., Headline: Chip-equipment suppliers rally after Lam says AI servers will drive growth, source:MarketWatch, summary: Semiconductor-related stocks surged Thursday, and leading the pack were stocks of the companies that make the equipment used to make chips., Headline: KLA Corp (KLAC): A Fairly Valued Stock in the Semiconductor Industry, source:Yahoo, summary: GF Value stock analysis, Headline: KLA expects first-quarter revenue above estimates on AI boom, source:Finnhub, summary: Chip-making tools maker KLA Corp
forecast first-quarter revenue and profit above Wall
Street expectations on Thursday, boosted by increasing
investments in artificial intelligence, sending shares..., Headline: KLA: Fiscal Q4 Earnings Snapshot, source:Associated Press, The, summary: No summary, Headline: KLA Corp. stock adds to regular-session rally on earnings beat, outlook, source:MarketWatch, summary: KLA Corp. shares added to regular-session gains after hours Thursday as the chip-equipment maker's outlook and results topped Wall Street expectations., Headline: KLA : Fiscal Q4 Earnings Snapshot, source:Finnhub, summary: MILPITAS, Calif.  — MILPITAS, Calif.  — KLA Corporation  on Thursday reported fiscal fourth-quarter net income of $684.7 million.
  The Milpitas, California-based company said it had net..., Headline: KLA Corp. stock rises Thursday, outperforms market, source:MarketWatch, summary: Shares of KLA Corp. advanced 5.35% to $482.35 Thursday, on what proved to be an all-around poor trading session for the stock market, with the S&P 500 Index..., Headline: KLA Corporation (KLAC) Q4 2023 Earnings Call Transcript, source:SeekingAlpha, summary: KLA Corporation (NASDAQ:NASDAQ:KLAC) Q4 2023 Earnings Conference Call July 27, 2023 6:00 PM ETCompany ParticipantsKevin Kessel - Vice President, Investor Relations & Market..., Headline: KLA Corporation Reports Fiscal 2023 Fourth Quarter and Full Year Results, source:Yahoo, summary: KLA Corporation (NASDAQ: KLAC) today announced financial and operating results for its fourth quarter and fiscal year ended June 30, 2023. KLA reported GAAP net income attributable to KLA of $684.7 million and GAAP diluted earnings per share (""EPS"") attributable to KLA of $4.97 on total revenues of $2.36 billion for the fourth quarter of fiscal year 2023. For the fiscal year ended June 30, 2023, KLA reported GAAP net income attributable to KLA of $3.39 billion and GAAP diluted EPS attributable t, Headline: KLA Corporation 2023 Q4 - Results - Earnings Call Presentation, source:SeekingAlpha, summary: The following slide deck was published by KLA Corporation in conjunction with their 2023 Q4 earnings call., Headline: KLA touts portfolio strength despite weaker quarterly performance, source:Alliance News, summary: No summary, Headline: What You Missed On Wall Street On Friday, source:Thefly.com, summary: No summary",KLAC
