,date,information,related
138,2023-03-09,"Headline: United Natural (UNFI) Q2 Earnings Miss Estimates, Sales Rise, source:Yahoo, summary: United Natural's (UNFI) second-quarter fiscal 2023 results reflect lower earnings on inflationary pressure and supply chain volatility. Nevertheless, sales grew year over year., Headline: Hain Celestial (HAIN) Down 10.1% Since Last Earnings Report: Can It Rebound?, source:Yahoo, summary: Hain Celestial (HAIN) reported earnings 30 days ago. What's next for the stock? We take a look at earnings estimates for some clues., Headline: Mondelez International Inc. Cl A stock outperforms competitors despite losses on the day, source:MarketWatch, summary: Shares of Mondelez International Inc. Cl A dropped 0.51% to $64.76 Thursday, on what proved to be an all-around dismal trading session for the stock market,..., Headline: Martina Shares Advice to the Next Generation of FMCG Leaders, source:Yahoo, summary: NORTHAMPTON, MA / ACCESSWIRE / March 9, 2023 / Mondelēz International Please tell us about your career journey at MDLZ My journey at MDLZ started in August 2020, when I joined as the Managing Director for Sweden & Finland, after a few years as ...",MDLZ
139,2023-03-10,"Headline: McCormick (MKC) Down More Than 15% in 3 Months: Here's Why, source:Yahoo, summary: McCormick (MKC) is battling escalated cost inflation and supply-chain expenses, which are denting its gross margin., Headline: Mondelez International Inc. Cl A stock outperforms competitors on strong trading day, source:MarketWatch, summary: Shares of Mondelez International Inc. Cl A inched 0.22% higher to $64.90 Friday, on what proved to be an all-around poor trading session for the stock...",MDLZ
140,2023-03-13,"Headline: Chips Ahoy!® Kicks off Epic Birthday by Hosting Fans with the Ultimate Celebration, source:Yahoo, summary: The beloved Chips Ahoy! cookie is a welcome treat at any celebration, and now – to commemorate the brand's 60th birthday, Chips Ahoy! announces the Chips Ahoy! Happiest Birthday Party., Headline: Mondelez International Inc. Cl A stock underperforms Monday when compared to competitors despite daily gains, source:MarketWatch, summary: Shares of Mondelez International Inc. Cl A inched 0.99% higher to $65.54 Monday, on what proved to be an all-around rough trading session for the stock..., Headline: Mondelez International Stock Shows Rising Relative Strength Upgrade, source:Yahoo, summary: Mondelez Intl Cl A shows improving price performance, earning an upgrade to its IBD Relative Strength Rating",MDLZ
141,2023-03-14,"Headline: Tracking Nelson Peltz`s Trian Fund Management Portfolio - Q4 2022 Update, source:Seeking Alpha, summary: No summary, Headline: Tracking Nelson Peltz's Trian Fund Management Portfolio - Q4 2022 Update, source:SeekingAlpha, summary: Nelson Peltzâs 13F portfolio value increased from $3.80B to $4.87B this quarter. Click here to see an update Trian Fund Management's trades for Q4 2022., Headline: Why Procter & Gamble and Other Consumer Staple Stocks Are Suddenly Back in Style, source:MarketWatch, summary: Over the past week, shares of Procter & Gamble, Colgate-Palmolive, and Mondelez International have seen gains, despite a broader market selloff., Headline: Why Consumer Staple Stocks Are Suddenly Back in Style, source:MarketWatch, summary: Over the past week, shares of Procter & Gamble, Colgate-Palmolive, and Mondelez International have seen gains, despite a broader market selloff., Headline: Mondelez International Inc. Cl A stock rises Tuesday, still underperforms market, source:MarketWatch, summary: Shares of Mondelez International Inc. Cl A rallied 1.14% to $66.29 Tuesday, on what proved to be an all-around great trading session for the stock market,..., Headline: Mondelez (MDLZ) Gains But Lags Market: What You Should Know, source:Yahoo, summary: Mondelez (MDLZ) closed the most recent trading day at $66.29, moving +1.14% from the previous trading session.",MDLZ
142,2023-03-15,"Headline: Food stocks are called appetizing by Mizuho amid banking sector meltdown, source:Seeking Alpha, summary: No summary, Headline: Mondelez call volume above normal and directionally bullish, source:Thefly.com, summary: No summary, Headline: Mondelez International Inc. Cl A stock rises Wednesday, outperforms market, source:MarketWatch, summary: Shares of Mondelez International Inc. Cl A inched 0.17% higher to $66.40 Wednesday, on what proved to be an all-around poor trading session for the stock..., Headline: Mondelez Takes Next Step in Wheat Sustainability Program, source:Yahoo, summary: NORTHAMPTON, MA / ACCESSWIRE / March 15, 2023 / Mondelēz International Originally Published by Bake Mondelez International has launched Harmony Ambition 2030, the next stage of Harmony, its third-party verified European wheat sustainability program, ...",MDLZ
143,2023-03-16,"Headline: Mondelez International Inc. Cl A stock rises Thursday, still underperforms market, source:MarketWatch, summary: Shares of Mondelez International Inc. Cl A inched 0.81% higher to $66.94 Thursday, on what proved to be an all-around favorable trading session for the stock...",MDLZ
144,2023-03-17,"Headline: 3 Value Stocks That are ���Strong Buys,��� According to Analysts, source:TipRanks, summary: No summary, Headline: Here are 3 ���Strong Buy��� Value Stocks, According to Analysts, source:TipRanks, summary: No summary, Headline: 3 ���Strong Buy��� Value Stocks, According to Analysts, source:TipRanks, summary: No summary, Headline: Mondelez International Inc. Cl A stock underperforms Friday when compared to competitors, source:MarketWatch, summary: Shares of Mondelez International Inc. Cl A slipped 0.81% to $66.40 Friday, on what proved to be an all-around dismal trading session for the stock market,..., Headline: Stocks for Market Turmoil: Consumer Staples, source:MarketWatch, summary: These steady performers were hot last year and cold in 2023, but now rapidly warming as bank fears hit the market. It helps that they have pricing power and...",MDLZ
145,2023-03-20,"Headline: Mondelez price target lowered to $73 from $76 at Deutsche Bank, source:Thefly.com, summary: No summary, Headline: Deutsche Bank picks winners and losers in the consumer staples sector, source:Seeking Alpha, summary: No summary, Headline: Mondelez International Inc. Cl A stock outperforms competitors on strong trading day, source:MarketWatch, summary: Shares of Mondelez International Inc. Cl A rose 2.00% to $67.73 Monday, on what proved to be an all-around positive trading session for the stock market,...",MDLZ
146,2023-03-21,"Headline: MHGVY or MDLZ: Which Is the Better Value Stock Right Now?, source:Yahoo, summary: MHGVY vs. MDLZ: Which Stock Is the Better Value Option?, Headline: Mondelez International Inc. Cl A stock rises Tuesday, still underperforms market, source:MarketWatch, summary: Shares of Mondelez International Inc. Cl A inched 0.15% higher to $67.83 Tuesday, on what proved to be an all-around favorable trading session for the stock...",MDLZ
147,2023-03-22,"Headline: Mondelez International Inc. Cl A stock underperforms Wednesday when compared to competitors, source:MarketWatch, summary: Shares of Mondelez International Inc. Cl A slumped 0.69% to $67.36 Wednesday, on what proved to be an all-around grim trading session for the stock market,..., Headline: Mondelez (MDLZ) Stock Moves -0.69%: What You Should Know, source:Yahoo, summary: In the latest trading session, Mondelez (MDLZ) closed at $67.36, marking a -0.69% move from the previous day.",MDLZ
148,2023-03-23,"Headline: Mondelez International Inc. Cl A stock falls Thursday, underperforms market, source:MarketWatch, summary: No summary, Headline: MDLZ May 5th Options Begin Trading, source:Stock Options Channel, summary: No summary, Headline: What’s in an Oreo? A Food Scientist Explains., source:Yahoo, summary: Oreos are one of the most well-known cookies in the world, with around 40 billion produced each year. But some of the ingredients are not as well-known. The WSJ spoke with a food scientist to understand how the “creme”-filled cookie is made. Photo: Christopher Hart for The Wall Street Journal",MDLZ
149,2023-03-24,"Headline: Mondelez International Inc. Cl A stock rises Friday, outperforms market, source:MarketWatch, summary: No summary",MDLZ
150,2023-03-25,"Headline: Dividend Champion, Contender, And Challenger Highlights: Week Of March 26, source:SeekingAlpha, summary: A weekly summary of dividend activity for Dividend Champions, Contenders, and Challengers. Read more to see the companies with upcoming ex-dividend dates., Headline: 25 Most Valuable Food Companies in The World, source:Yahoo, summary: We will take a look at the 25 most valuable food companies in the world. To skip our analysis of the recent market trends, you can go directly to see the 5 Most Valuable Food Companies in the World. The food industry is a vast and intricate system that encompasses all the processes that food […]",MDLZ
151,2023-03-26,"Headline: Mondelez: Is It Worth The Premium?, source:SeekingAlpha, summary: We looked at the profitability and the efficiency of Mondelez and its change over time. Read why we have a neutral view on MDLZ stock.",MDLZ
152,2023-03-27,"Headline: Mondelez International Inc. Cl A stock rises Monday, outperforms market, source:MarketWatch, summary: Shares of Mondelez International Inc. Cl A inched 0.17% higher to $69.16 Monday, on what proved to be an all-around positive trading session for the stock..., Headline: This Is The Market's Sweet Spot, Literally: Defensive Stocks Of A Sugary Kind, source:Yahoo, summary: Defensive stocks in focus: chocolate and confectionary stocks are hitting new highs. Some are in bases while others are in buy zones.",MDLZ
153,2023-03-28,"Headline: Mondelez International Inc. Cl A stock outperforms market on strong trading day, source:MarketWatch, summary: Shares of Mondelez International Inc. Cl A inched 0.62% higher to $69.59 Tuesday, on what proved to be an all-around dismal trading session for the stock...",MDLZ
154,2023-03-29,"Headline: 4 Stocks to Buy on Rebound in March Consumer Confidence, source:Yahoo, summary: Consumer confidence is rebounding, but the crisis is far from over. Investing in consumer staple stocks like The Hershey Company (HSY), General Mills (GIS), Mondelez International (MDLZ) and Vital Farms (VITL) would be a wise decision., Headline: Mondelez International Inc. Cl A stock rises Wednesday, still underperforms market, source:MarketWatch, summary: Shares of Mondelez International Inc. Cl A rose 1.12% to $70.37 Wednesday, on what proved to be an all-around favorable trading session for the stock market,...",MDLZ
155,2023-03-30,"Headline: Mondelez offloads some stake in JDE Peet's at a discount - Bloomberg, source:Yahoo, summary: By Scott Kanowsky, Headline: The Zacks Analyst Blog Highlights Hershey's, General Mills, Mondelez and Vital Farms, source:Yahoo, summary: Hershey's, General Mills, Mondelez and Vital Farms are included in this Analyst Blog., Headline: Mondelez International Inc. Cl A stock falls Thursday, underperforms market, source:MarketWatch, summary: Shares of Mondelez International Inc. Cl A slipped 0.58% to $69.58 Thursday, on what proved to be an all-around favorable trading session for the stock...",MDLZ
156,2023-03-31,"Headline: Mondelez International Inc. Cl A stock rises Friday, still underperforms market, source:MarketWatch, summary: Shares of Mondelez International Inc. Cl A inched 0.20% higher to $69.72 Friday, on what proved to be an all-around favorable trading session for the stock..., Headline: Letter: Toblerone is just getting the Boddingtons treatment, source:Yahoo, summary: Globalisation and world dominance, particularly when it comes to brands, is out of step with current tastes — consumers want products and brands that are meaningful and have true credentials.  It reminds me of what happened to Boddingtons (the “Cream of Manchester”) when the beer brand was acquired by Interbrew (now AB InBev).  The original Strangeways Brewery was subsequently closed down and the beer was brewed elsewhere., Headline: Mondelez (MDLZ) Gains But Lags Market: What You Should Know, source:Yahoo, summary: Mondelez (MDLZ) closed at $69.72 in the latest trading session, marking a +0.2% move from the prior day.",MDLZ
157,2023-04-03,"Headline: Mondelēz Canada Introduces Snackable Mini Version of the Iconic RITZ® Cracker, source:Yahoo, summary: Today, RITZ – one of Canada's most loved cracker brands – is introducing a new, bite-sized format of its famous cracker. Offering the same smooth and crispy taste in a fun new size, MINI RITZ Crackers were created to suit even more snacking occasions., Headline: Mondelez International Inc. Cl A stock outperforms competitors on strong trading day, source:MarketWatch, summary: Shares of Mondelez International Inc. Cl A inched 0.72% higher to $70.22 Monday, on what proved to be an all-around positive trading session for the stock..., Headline: Winners and losers in the food sector from the latest Nielsen numbers, source:Seeking Alpha, summary: No summary",MDLZ
158,2023-04-04,"Headline: Mondelez Hits a 52-Week High and May Be Far From Finished, source:Yahoo, summary: Mondelez International Inc. has surprised me to the upside. In my Feb. 16 review of the snack food and beverage producer I was positive on the shares but wrote that Mondelez ""is not scheduled to report earnings until late April, so an upside breakout to new highs may not happen for a while., Headline: How to Boost Your Portfolio with Top Consumer Staples Stocks Set to Beat Earnings, source:Yahoo, summary: The Zacks Earnings ESP is a great way to find potential earnings surprises. Why investors should take advantage now., Headline: Mondelez International Inc. Cl A stock rises Tuesday, outperforms market, source:MarketWatch, summary: Shares of Mondelez International Inc. Cl A inched 0.43% higher to $70.52 Tuesday, on what proved to be an all-around poor trading session for the stock...",MDLZ
159,2023-04-05,"Headline: The snacking revolution is here, and BofA sees 5 food stocks that could benefit, source:Yahoo, summary: The snacking revolution looks here to stay., Headline: Mondelez International Inc. Cl A stock outperforms competitors on strong trading day, source:MarketWatch, summary: Shares of Mondelez International Inc. Cl A rallied 1.25% to $71.40 Wednesday, on what proved to be an all-around mixed trading session for the stock market,..., Headline: SOUR PATCH KIDS® Drums Up the Future for HBCU Students with Mischief for Change Scholarship Program, source:Yahoo, summary: SOUR PATCH KIDS is calling current or prospective students at Historically Black Colleges and Universities (HBCUs) seeking scholarship funds to participate in the third annual ""Mischief for Change"" scholarship program. The brand has committed $1 million in scholarships over five years for eligible students attending HBCUs. To date, the program has supported 21 students attending HBCUs across the country – future changemakers who were selected for demonstrating how they are/will change the world, Headline: Gurus Are Putting These Consumer Defensive Stocks in Their Easter Baskets, source:GuruFocus, summary: No summary",MDLZ
160,2023-04-06,"Headline: Why Mondelez (MDLZ) is Poised to Beat Earnings Estimates Again, source:Yahoo, summary: Mondelez (MDLZ) has an impressive earnings surprise history and currently possesses the right combination of the two key ingredients for a likely beat in its next quarterly report., Headline: Mondelez International Inc. Cl A stock falls Thursday, underperforms market, source:MarketWatch, summary: Shares of Mondelez International Inc. Cl A slid 0.49% to $71.05 Thursday, on what proved to be an all-around positive trading session for the stock market,...",MDLZ
161,2023-04-07,"Headline: Tracking Ray Dalio`s Bridgewater Associates 13F Portfolio - Q4 2022 Update, source:Seeking Alpha, summary: No summary, Headline: Tracking Ray Dalio's Bridgewater Associates 13F Portfolio - Q4 2022 Update, source:SeekingAlpha, summary: Bridgewater Associatesâ 13F portfolio value decreased from ~$19.75B to ~$18.32B this quarter. Click here for a complete analysis., Headline: RBC Capital Sticks to Its Hold Rating for Mondelez International (MDLZ), source:TipRanks, summary: No summary, Headline: 2 Warren Buffett Stocks to Buy Hand Over Fist in April, source:Yahoo, summary: Warren Buffett is one of the greatest investors in history.  The proof is quite simple: He took an obscure textile company in Berkshire Hathaway (NYSE: BRK.A)(NYSE: BRK.B) and transformed it into the largest investment company on the planet.  This is why investors would be wise to consider the dozens of holdings in Berkshire Hathaway's portfolio for their own portfolios.",MDLZ
162,2023-04-08,"Headline: Dividend Champion, Contender, And Challenger Highlights: Week Of April 9, source:SeekingAlpha, summary: A weekly summary of dividend activity for Dividend Champions, Contenders, and Challengers. Read more about the April 9 highlights here.",MDLZ
163,2023-04-10,"Headline: Mondelez International signs a $2B revolving credit agreement, source:Seeking Alpha, summary: No summary, Headline: CAG or MDLZ: Which Is the Better Value Stock Right Now?, source:Yahoo, summary: CAG vs. MDLZ: Which Stock Is the Better Value Option?, Headline: Mondelez International Inc. Cl A stock underperforms Monday when compared to competitors, source:MarketWatch, summary: Shares of Mondelez International Inc. Cl A slumped 0.73% to $70.53 Monday, on what proved to be an all-around great trading session for the stock market,..., Headline: Kellogg: Nicely Positioned For Financial Improvement, source:SeekingAlpha, summary: Kellogg has done well to grow its snacks business as consumers increase their demand for convenience foods. See why K stock is a Buy.",MDLZ
164,2023-04-11,"Headline: Mondelez price target raised to $77 from $75 at Morgan Stanley, source:Thefly.com, summary: No summary, Headline: Mondelēz International to Report Q1 2023 Financial Results on April 27, 2023, source:Yahoo, summary: CHICAGO, April 11, 2023 (GLOBE NEWSWIRE) -- Mondelēz International, Inc. (Nasdaq: MDLZ) will release its first quarter 2023 financial results on Thursday, April 27, 2023 at 4:05 p.m. ET and will host a conference call at 5:00 p.m. ET that day. Investors and analysts may participate via phone by calling 800-579-2543 from the United States and 203-518-9848 from other locations. To ensure timely access, participants should dial in approximately 10 minutes before the call starts. A listen-only webca, Headline: Mondelez International Inc. Cl A stock underperforms Tuesday when compared to competitors, source:MarketWatch, summary: Shares of Mondelez International Inc. Cl A dropped 0.31% to $70.31 Tuesday, on what proved to be an all-around mixed trading session for the stock market,..., Headline: Morgan Stanley Maintains Mondelez International (MDLZ) Overweight Recommendation, source:Fintel, summary: nan",MDLZ
165,2023-04-12,"Headline: Mondelez, source:Thefly.com, summary: No summary, Headline: Mondelez price target raised to $76 from $73 at Deutsche Bank, source:Thefly.com, summary: No summary, Headline: Time to pick up cooking?: Food at home prices fall for first time since 2020, source:Seeking Alpha, summary: No summary, Headline: Time to pick up cooking? Food at home prices fall for first time since 2020, source:Seeking Alpha, summary: No summary, Headline: Mondelez International Inc. Cl A stock outperforms market despite losses on the day, source:MarketWatch, summary: Shares of Mondelez International Inc. Cl A slumped 0.14% to $70.21 Wednesday, on what proved to be an all-around dismal trading session for the stock market,..., Headline: Mondelez resumed with a Buy at Stifel, source:Thefly.com, summary: No summary",MDLZ
166,2023-04-13,"Headline: Mondelez International Inc. Cl A stock rises Thursday, still underperforms market, source:MarketWatch, summary: Shares of Mondelez International Inc. Cl A inched 0.33% higher to $70.44 Thursday, on what proved to be an all-around favorable trading session for the stock..., Headline: Analysis-Twitter's advertising business seen facing slow recovery, source:Yahoo, summary: Twitter-owner Elon Musk has said advertisers are returning to the social media platform, but statements from several companies and data from research firms suggest a bounce-back is not happening so fast.  Musk, who also runs electric carmaker Tesla Inc, earlier this week told the BBC that most of Twitter's advertisers are returning to the platform and the business was ""roughly breaking even.""  Twitter had been hit by a massive decline in advertising since his acquisition in late October.",MDLZ
167,2023-04-14,"Headline: Mondelez (MDLZ) Gains From Buyouts, Hurt by Cost Inflation, source:Yahoo, summary: Mondelez (MDLZ) has been benefiting from its buyouts, which are strengthening its core chocolate and biscuit categories. However, cost inflation remains a hurdle., Headline: Mondelez International Inc. Cl A stock underperforms Friday when compared to competitors, source:MarketWatch, summary: Shares of Mondelez International Inc. Cl A shed 0.89% to $69.81 Friday, on what proved to be an all-around grim trading session for the stock market, with..., Headline: Stifel Reiterates Mondelez International (MDLZ) Buy Recommendation, source:Fintel, summary: nan",MDLZ
168,2023-04-15,"Headline: 7 Dividend Stocks to Buy That Are Trading at a Discount, source:Yahoo, summary: Buying dividend stocks trading at discount pricing is generally a smart idea. Such equities give owners the dual benefit of price appreciation potential in their forward-looking target prices. And two, they also provide nominal income through their periodic dividends. Provided the investor isn’t speculating in high-risk shares, it’s a reasonable strategy overall. Each of the stocks listed below ticks those boxes. They are discounted based on their average target stock price, and they provide sta",MDLZ
169,2023-04-17,"Headline: FSTA: Consumer Staples Dashboard For April, source:SeekingAlpha, summary: nan",MDLZ
170,2023-04-18,"Headline: 7 Defensive Stocks to Buy to Batten Down the Hatches, source:Yahoo, summary: Although a much-debated topic, investors should at least consider shifting toward defensive stocks to buy ahead of a potential downcycle. Notably, Morgan Stanley analysts warned about U.S. recession risks prior to 2023. Naturally, these fears only accelerated due to the recent bank failures. If that wasn’t enough, the Federal Reserve has a bear of a time containing historically high inflation. Unfortunately, the alliance between the Organization of the Petroleum Exporting Countries (OPEC) and no, Headline: Mondelēz International Opens Applications for CoLab Tech to Partner with Start-Up Companies Focused on Innovative, Sustainable Food Processing, source:Yahoo, summary: In its first year, CoLab Tech seeks to engage with start-ups that offer solutions to address top technical challenges in sustainability and food processingCompanies selected will participate in a 12-week growth-centric curriculum beginning in autumn 2023Applications are now open at www.applycolabtech.com. CHICAGO, April 18, 2023 (GLOBE NEWSWIRE) -- Mondelēz International, Inc. (Nasdaq: MDLZ), today opened applications for CoLab Tech. The innovative accelerator program is designed to help start-u",MDLZ
171,2023-04-19,"Headline: IN BRIEF: Mondelez International to partner with start-up companies, source:Alliance News, summary: No summary, Headline: Kraft Heinz Stock Has Stalled, And Things Look Unlikely To Change, source:SeekingAlpha, summary: nan, Headline: Mondelez International Inc. Cl A stock falls Wednesday, underperforms market, source:MarketWatch, summary: Shares of Mondelez International Inc. Cl A dropped 0.20% to $70.36 Wednesday, on what proved to be an all-around rough trading session for the stock market,..., Headline: A World-First for the World's Number One Cookie*: OREO Café opens in Qatar, source:Yahoo, summary: The world's number one cookie has landed at Doha's Hamad International Airport (HIA), with the opening of the first permanent OREO Café outside of the USA and first in an airport.",MDLZ
