,date,information,related
0,2022-09-23,"Headline: An Intrinsic Calculation For Mondelez International, Inc. (NASDAQ:MDLZ) Suggests It's 44% Undervalued, source:Yahoo, summary: Does the September share price for Mondelez International, Inc. ( NASDAQ:MDLZ ) reflect what it's really worth? Today..., Headline: Mondelez International Inc. Cl A stock outperforms market despite losses on the day, source:MarketWatch, summary: Shares of Mondelez International Inc. Cl A slid 1.42% to $58.95 Friday, on what proved to be an all-around rough trading session for the stock market, with..., Headline: 4 Consumer Staples Stocks To Watch In The Stock Market Now, source:StockMarket, summary: Do these consumer staples stocks deserve a spot on your watchlist today?",MDLZ
1,2022-09-24,"Headline: Dividend Champion, Contender, And Challenger Highlights: Week Of September 25, source:SeekingAlpha, summary: Weekly summary of dividend activity for Dividend Champions, Contenders, Challengers. Click here to see companies with upcoming ex-dividend dates and pay dates.",MDLZ
2,2022-09-26,"Headline: Mondelez International Inc. Cl A stock falls Monday, still outperforms market, source:MarketWatch, summary: Shares of Mondelez International Inc. Cl A slid 1.02% to $58.35 Monday, on what proved to be an all-around rough trading session for the stock market, with..., Headline: Mondelez International Becomes Oversold, source:Dividend Channel, summary: dividend channel,MDLZ,",MDLZ
3,2022-09-27,"Headline: Ex-Dividend Reminder: Mondelez International, Keurig Dr Pepper and Willis Towers Watson Public, source:Dividend Channel, summary: dividend channel,MDLZ,KDP,WTW,, Headline: Insiders probably made the right decision selling US$12m worth of shares earlier this year as Mondelez International, Inc.'s (NASDAQ:MDLZ)) stock dips by 3.4%., source:Yahoo, summary: Over the past year, insiders sold US$12m worth of Mondelez International, Inc. ( NASDAQ:MDLZ ) stock at an average..., Headline: Mondelez International Inc. Cl A stock underperforms Tuesday when compared to competitors, source:MarketWatch, summary: Shares of Mondelez International Inc. Cl A slipped 1.32% to $57.58 Tuesday, on what proved to be an all-around grim trading session for the stock market,..., Headline: 11 Best Consumer Stocks To Buy Now, source:Yahoo, summary: In this article, we will take a look at the 11 best consumer stocks to buy now. You can skip our detailed analysis of the consumer industry’s outlook for 2022, and go directly to the 5 Best Consumer Stocks to Buy Now. Consumer staples are the essential items that people purchase to sustain their daily […]",MDLZ
4,2022-09-28,"Headline: Catch these Stocks Before their Ex-Dividend Dates Arrive, source:TipRanks, summary: Investors looking for stocks that give dividends still have a chance to buy these eight stocks before their ex-dividend dates. An added bonus is that all of these s..., Headline: Mondelez International Inc. Cl A stock rises Wednesday, still underperforms market, source:MarketWatch, summary: Shares of Mondelez International Inc. Cl A inched 0.97% higher to $58.14 Wednesday, on what proved to be an all-around great trading session for the stock...",MDLZ
5,2022-09-29,"Headline: The Strong Dollar Could Ruin Earnings Season for These Companies, source:Yahoo, summary: The U.S. Dollar Index is up by just over 18% since the start of the year. Some companies are more at risk than others., Headline: Mondelez International Inc. Cl A stock falls Thursday, still outperforms market, source:MarketWatch, summary: Shares of Mondelez International Inc. Cl A slipped 1.88% to $56.67 Thursday, on what proved to be an all-around poor trading session for the stock market,...",MDLZ
6,2022-09-30,"Headline: A Strong Dollar Spells Trouble for Some U.S. Companies, source:Yahoo, summary: A surging U.S. dollar is a challenge for companies that rely heavily on overseas sales, such as Mondelez International and Booking Holdings.",MDLZ
7,2022-10-01,"Headline: As Mondelez International, Inc.'s (NASDAQ:MDLZ)) market cap dropped by US$5.6b, insiders who sold US$12m worth of stock were able to offset their losses, source:Yahoo, summary: Insiders at Mondelez International, Inc. ( NASDAQ:MDLZ ) sold US$12m worth of stock at an average price of US$63.66 a...",MDLZ
8,2022-10-03,"Headline: 7 Consumer Stocks to Buy for Growth and Dividends, source:Yahoo, summary: This year’s market downturn has been brutal, even for steadier, less speculative stocks. With little sign concerns like inflation, interest rates, and a possible recession aren’t going away anytime soon, this trend could carry on in the months ahead. However, there is a silver lining. The 2022 bear market has created great opportunities among consumer stocks to buy. Pushed down to attractive valuations, and now sporting higher dividend yields, these stocks could provide solid long-term returns,",MDLZ
9,2022-10-04,"Headline: Tracking Mario Gabelli's Gabelli Funds 13F Portfolio - Q2 2022 Update, source:SeekingAlpha, summary: Mario Gabelli's 13F portfolio value decreased from $15.22B to $13.02B this quarter. Click here to read more about Gabelli Funds' holdings and trades for Q2 2022.",MDLZ
10,2022-10-05,"Headline: Insiders at Mondelez International, Inc. (NASDAQ:MDLZ) sold US$12m worth of stock, possibly indicating weakness in the future, source:Yahoo, summary: Many Mondelez International, Inc. ( NASDAQ:MDLZ ) insiders ditched their stock over the past year, which may be of..., Headline: Greenfield Savings Bank Buys 1 - GuruFocus.com, source:GuruFocus, summary: GuruFocus Article or News written by insider and the topic is about: ",MDLZ
11,2022-10-06,"Headline: MDLZ November 25th Options Begin Trading, source:Stock Options Channel, summary: Staff article entitled MDLZ November 25th Options Begin Trading, about stock options, from Stock Options Channel., Headline: Food seems to be relatively unscathed by pullback in consumer spending, says Mondelēz CEO, source:CNBC, summary: Dirk Van de Put, Mondelēz International CEO, joins 'Power Lunch' to discuss the state of the consumer from his vantage point, whether consumers are trading down to private label brands and insight into the snacking company's costs next year., Headline: Mondelēz International Celebrates 10th Anniversary, Reaffirms Long-Term Growth Strategy, source:Yahoo, summary: “Vision 2030” strategy emphasizes growth acceleration and portfolio focusGlobal Purpose Day events reinforce employee commitment to “empowering people to snack right”Chairman and CEO Dirk Van de Put rings Nasdaq Closing Bell CHICAGO, Oct. 06, 2022 (GLOBE NEWSWIRE) -- Mondelēz International (Nasdaq: MDLZ) today celebrated its 10th anniversary with a global, enterprise-wide recommitment to its Purpose of empowering people to snack right. Entering its second decade, the company is well positioned t, Headline: Top 5 3rd Quarter Trades of Mu - GuruFocus.com, source:GuruFocus, summary: GuruFocus Article or News written by insider and the topic is about: ",MDLZ
12,2022-10-07,"Headline: Top 5 3rd Quarter Trades of Co - GuruFocus.com, source:GuruFocus, summary: GuruFocus Article or News written by insider and the topic is about: , Headline: Mondelēz Snacking Made Right Report: Environmental Resilience, source:Yahoo, summary: NORTHAMPTON, MA / ACCESSWIRE / October 7, 2022 / Mondelēz International Environmental Resilience By tackling deforestation, we are helping to combat climate change and promoting sustainable supply of key ingredients. Forests Progress2018201920202021Economic ...",MDLZ
13,2022-10-08,"Headline: Dividend Champion, Contender, And Challenger Highlights: Week Of October 9, source:SeekingAlpha, summary: Weekly summary of dividend activity for Dividend Champions, Contenders, Challengers. Check out the companies with upcoming ex-dividend dates and upcoming pay dates.",MDLZ
14,2022-10-09,"Headline: Mondelez International (NASDAQ:MDLZ) Shareholders Will Want The ROCE Trajectory To Continue, source:Yahoo, summary: To find a multi-bagger stock, what are the underlying trends we should look for in a business? In a perfect world, we'd...",MDLZ
15,2022-10-10,"Headline: Mondelez: Richly Valued, But Still A Solid Income Investment, source:SeekingAlpha, summary: Mondelez is a very strong business and has been effective at offsetting inflation with price increases. Read my analysis of the MDLZ stock here., Headline: Goldman Sachs Sticks to Its Buy Rating for Mondelez International (MDLZ), source:TipRanks, summary: Goldman Sachs analyst Jason English maintained a Buy rating on Mondelez International (MDLZ &#8211; Research Report) today and set a price target of $65.00. The com..., Headline: Kraft Heinz Stock Is Still a Haven as Consumer Staples Stumble, Says Goldman, source:MarketWatch, summary: Analyst Jason English upgraded packaged-foods giant Kraft Heinz to Buy from Neutral, and lifted the price target to $43 from $37., Headline: Why Investors Should Never Purchase Mortgage REITs, source:SeekingAlpha, summary: High fees, too much leverage and overpaying dividends based on faulty ânon-GAAPâ operating results are endemic to Mortgage REITs. See why you should sell them.",MDLZ
16,2022-10-11,"Headline: Home - The Fly, source:Thefly.com, summary: The Fly is a leading digital publisher of real-time financial news. The Fly team scours all sources of company news and delivers short-form stories consisting of only market moving content., Headline: Mondelēz International Celebrates 130th Anniversary of Historic Toledo Flour Mill; Milestone Honored with Recognition from Ohio Congressional and State Officials, source:Yahoo, summary: Celebration recognizes Mill employees who supply flour for consumer-favorite snacks Mondelēz International Toledo Mill Celebration Mondelēz International marked the 130th anniversary of its Biscuit Flour Mill in Toledo, Ohio with a ceremony on Saturday, October 8, 2022, that highlighted the important role the Mill plays as a part of Mondelēz International’s U.S. snacking supply chain. Pictured from right to left, Dee Lewis, Plant Lead at Mondelēz International’s Toledo Flour Mill, and Claudio Pa",MDLZ
17,2022-10-12,"Headline: Mondelez International Inc. Cl A stock outperforms market on strong trading day, source:MarketWatch, summary: Shares of Mondelez International Inc. Cl A inched 0.98% higher to $56.83 Wednesday, on what proved to be an all-around rough trading session for the stock..., Headline: Stocks To Invest In Right Now? 3 Consumer Staples Stocks To Know, source:StockMarket, summary: Are these the top consumer staples stocks to invest in right now?",MDLZ
18,2022-10-13,"Headline: Interesting MDLZ Put And Call Options For December 2nd, source:Stock Options Channel, summary: Staff article entitled Interesting MDLZ Put And Call Options For December 2nd, about stock options, from Stock Options Channel., Headline: Influencers with Andy Serwer: Dirk Van de Put, source:Yahoo, summary: In this episode of Influencers, Andy sits down with Mondelez International CEO Dirk Van de Put to discuss the state of the food & beverage industry, the part inflation has played in growth, and how he is navigating geopolitical issues., Headline: Mondelez International, Inc.'s (NASDAQ:MDLZ) Fundamentals Look Pretty Strong: Could The Market Be Wrong About The Stock?, source:Yahoo, summary: It is hard to get excited after looking at Mondelez International's (NASDAQ:MDLZ) recent performance, when its stock..., Headline: Mondelēz International to Report Q3 2022 Financial Results on November 1, 2022, source:Yahoo, summary: CHICAGO, Oct. 13, 2022 (GLOBE NEWSWIRE) -- Mondelēz International, Inc. (Nasdaq: MDLZ) will release its third quarter 2022 financial results on Tuesday, November 1, 2022 at 4:05 p.m. ET and will host a conference call at 5:00 p.m. ET that day. Investors and analysts may participate via phone by calling 800-579-2543 from the United States and 785-424-1789 from other locations. To ensure timely access, participants should dial in approximately 10 minutes before the call starts. A listen-only webca, Headline: Mondelēz Snacking Made Right Report: Waste & Water, source:Yahoo, summary: NORTHAMPTON, MA / ACCESSWIRE / October 13, 2022 / Mondelēz International Waste We continue to reduce waste where we can, to help the climate and the environment and to increase our operational efficiency. We drive out waste as we drive for excellence. ..., Headline: CAG or MDLZ: Which Is the Better Value Stock Right Now?, source:Yahoo, summary: CAG vs. MDLZ: Which Stock Is the Better Value Option?, Headline: Mondelez International Inc. Cl A stock rises Thursday, still underperforms market, source:MarketWatch, summary: Shares of Mondelez International Inc. Cl A rose 1.50% to $57.68 Thursday, on what proved to be an all-around positive trading session for the stock market,...",MDLZ
19,2022-10-14,"Headline: Analysts Offer Insights on Consumer Goods Companies: Simply Good Foods (SMPL), Walgreens Boots Alliance (WBA) and Mondelez International (MDLZ), source:TipRanks, summary: Analysts have been eager to weigh in on the Consumer Goods sector with new ratings on Simply Good Foods (<span class='tr-stock-ticker' style='color:blue; font-weigh..., Headline: Mondelez price target lowered to $63 from $70 at Morgan Stanley, source:Thefly.com, summary: Morgan Stanley analyst Pa... MDLZ, Headline: Analysts Offer Insights on Consumer Goods Companies: The Estée Lauder Companies (EL) and Mondelez International (MDLZ), source:TipRanks, summary: There&#8217;s a lot to be optimistic about in the Consumer Goods sector as 2 analysts just weighed in on The Estée Lauder Companies (<span class='tr-stock-ticker' s..., Headline: Mondelez International Inc. Cl A stock underperforms Friday when compared to competitors, source:MarketWatch, summary: Shares of Mondelez International Inc. Cl A slipped 1.28% to $56.94 Friday, on what proved to be an all-around poor trading session for the stock market, with...",MDLZ
20,2022-10-17,"Headline: The Epic 2021 Bubble Collapse - We Entered The Last Phase, Be Prepared, source:SeekingAlpha, summary: I will discuss which stocks you should absolutely avoid and provide 5 fantastic buying opportunities for the remainder of this bear market., Headline: Mondelez International (MDLZ) Receives a Buy from RBC Capital, source:TipRanks, summary: In a report released on October 14, Nik Modi from RBC Capital maintained a Buy rating on Mondelez International (MDLZ &#8211; Research Report), with a price target ..., Headline: We Like These Underlying Return On Capital Trends At Mondelez International (NASDAQ:MDLZ), source:Yahoo, summary: There are a few key trends to look for if we want to identify the next multi-bagger. Typically, we'll want to notice a..., Headline: Mondelez International Inc. Cl A stock rises Monday, still underperforms market, source:MarketWatch, summary: Shares of Mondelez International Inc. Cl A inched 0.88% higher to $57.44 Monday, on what proved to be an all-around positive trading session for the stock..., Headline: 11 Best Dividend Stocks to Buy According to Warren Buffett, source:Yahoo, summary: In this article, we discuss 11 best dividend stocks to buy according to Warren Buffett. You can skip our detailed analysis of Buffett’s investment strategies and his fund’s recent developments, and go directly to read 5 Best Dividend Stocks to Buy According to Warren Buffett. As expected, Warren Buffett is using the current market selloff […]",MDLZ
21,2022-10-18,"Headline: Mondelez (MDLZ) Snacking Category Aids Amid Cost Pressure, source:Yahoo, summary: Mondelez (MDLZ) is seeing input cost inflation, especially for energy and transportation, among others. However, strong pricing efforts and a focus on the snacking category bode well., Headline: 10 Best Food Stocks to Buy Now, source:Yahoo, summary: In this article we present the list of 10 Best Food Stocks to Buy Now. Click to skip ahead and see the 5 Best Food Stocks to Buy Now. The Hershey Company (NYSE:HSY), Mondelez International, Inc. (NASDAQ:MDLZ), and PepsiCo, Inc. (NASDAQ:PEP) are a few of the food stocks that hedge funds are investing billions of dollars […], Headline: Mondelez International Inc. Cl A stock outperforms competitors on strong trading day, source:MarketWatch, summary: Shares of Mondelez International Inc. Cl A rose 1.58% to $58.35 Tuesday, on what proved to be an all-around positive trading session for the stock market,..., Headline: Credit Suisse Believes FX, Economic Uncertainty In Europe Pose Risk For Mondelez, source:Yahoo, summary: Credit Suisse analyst Robert Moskow reiterated an Outperform rating on the shares of Mondelez International Inc (NASDAQ: MDLZ) and lowered the price target to $67 from $70. The analyst finds it difficult to reconcile company management's positive tone with the challenging economic developments unfolding in Europe. Meanwhile, the analyst raised topline growth to 9% because management indicates that elasticities have held up better than the conservative assumptions they provided in their 2H guidan",MDLZ
22,2022-10-19,"Headline: VDC: Consumer Staples Dashboard For October, source:SeekingAlpha, summary: VDC has slightly outperformed XLP since inception, but the difference in annualized total return is insignificant. Click here to see why I have a hold rating on this ETF., Headline: K, MDLZ: Are These 2 Household-Name Dividend Stocks Worth Buying?, source:TipRanks, summary: Lately, I have shared various investment ideas among the consumer staples sector, as these stocks are generally less risky and easier to predict. For instance, I re...",MDLZ
23,2022-10-20,"Headline: Have $1,000? Here's a Warren Buffett-Owned Dividend Stock to Buy Hand Over Fist, source:Yahoo, summary: Berkshire Hathaway's chief executive officer and chairman, Warren Buffett, knows quality companies when he sees them.  Along with his insistence on paying a reasonable valuation for his investments, this has helped Berkshire Hathaway grow its investment portfolio's value to a whopping $325.9 billion.  The company's $33.7 million position in the consumer staple Mondelez International (NASDAQ: MDLZ) is one of its smaller stakes., Headline: It’s a Rare Time for Food Stocks. Why That Could Be Good News., source:Yahoo, summary: Shares of packaged-food companies often outperform in tumultuous times, but as Evercore ISI analyst David Palmer notes, the current situation is special.",MDLZ
24,2022-10-21,"Headline: Mondelez International's (NASDAQ:MDLZ) investors will be pleased with their notable 55% return over the last five years, source:Yahoo, summary: If you want to compound wealth in the stock market, you can do so by buying an index fund. But in our experience...",MDLZ
25,2022-10-23,"Headline: Guinness Atkinson Asset Manage - GuruFocus.com, source:GuruFocus, summary: GuruFocus Article or News written by insider and the topic is about: ",MDLZ
26,2022-10-24,"Headline: How Snack-Food Company Mondelez Is Coping With Supply-Chain Volatility, source:Yahoo, summary: Its chief supply-chain officer talks about coping with Covid, and digesting the acquisition of Clif Bar, Headline: Top 5 3rd Quarter Trades of Ve - GuruFocus.com, source:GuruFocus, summary: GuruFocus Article or News written by insider and the topic is about: ",MDLZ
27,2022-10-25,"Headline: Mondelez International, Inc. (NASDAQ:MDLZ) insiders sold US$12m worth of stock, possibly signalling a downtrend, source:Yahoo, summary: Many Mondelez International, Inc. ( NASDAQ:MDLZ ) insiders ditched their stock over the past year, which may be of..., Headline: Cadbury-maker Mondelez to invest $600 mln on sustainable cocoa sourcing, source:Yahoo, summary: Cadbury chocolate-maker Mondelez International doubled down on sustainable cocoa sourcing on Wednesday, pledging to spend an additional $600 million by 2030 on efforts to combat child labour, farmer poverty and deforestation in cocoa.  The move will bring its total spend on cocoa sustainability since 2012 to $1 billion and comes as multinationals face increased reputational and legal pressures to clean up their global supply chains.  The European Commission has proposed several laws aimed at preventing and, in the case of forced labour, banning the import and use of products linked to environmental and human rights abuses., Headline: Cadbury-maker Mondelez to invest $600 million on sustainable cocoa sourcing, source:Reuters, summary: Cadbury chocolate-maker Mondelez International doubled down on sustainable cocoa sourcing on Wednesday, pledging to spend an additional $600 million by 2030 on efforts to combat child labour, farmer poverty and deforestation in cocoa., Headline: RPT-Cadbury-maker Mondelez to invest $600 mln on sustainable cocoa sourcing, source:Yahoo, summary: Cadbury chocolate-maker Mondelez International doubled down on sustainable cocoa sourcing on Wednesday, pledging to spend an additional $600 million by 2030 on efforts to combat child labour, farmer poverty and deforestation in cocoa.  The move will bring its total spend on cocoa sustainability since 2012 to $1 billion and comes as multinationals face increased reputational and legal pressures to clean up their global supply chains.  The European Commission has proposed several laws aimed at preventing and, in the case of forced labour, banning the import and use of products linked to environmental and human rights abuses., Headline: Analysts Estimate Mondelez (MDLZ) to Report a Decline in Earnings: What to Look Out for, source:Yahoo, summary: Mondelez (MDLZ) doesn't possess the right combination of the two key ingredients for a likely earnings beat in its upcoming report. Get prepared with the key expectations., Headline: RITZ ""Friendsgiving Chef Service"" with Marcus Samuelsson Delivers Globally-Inspired Gourmet Friendsgiving Feast as Part of Its Welcoming Holiday Campaign, source:Yahoo, summary: Friendsgiving this year just got a lot less stressful. This season, RITZ and chef Marcus Samuelsson are enabling fans to spend less time in the kitchen and more time welcoming others and relaxing with their chosen family. The brand is launching a RITZ ""Friendsgiving Chef Service"" Sweepstakes, allowing one lucky winner to host the ultimate Friendsgiving for 10, with a full spread expertly prepared by Chef Marcus Samuelsson. The chef will welcome the winners to his newest New York City restaurant,, Headline: Mondelez International Inc. Cl A stock rises Tuesday, still underperforms market, source:MarketWatch, summary: Shares of Mondelez International Inc. Cl A inched 0.97% higher to $59.31 Tuesday, on what proved to be an all-around favorable trading session for the stock..., Headline: Mondelez Increases Investment in Cocoa Life Program -- Commodity Comment, source:MarketWatch, summary: By Stephen Nakrosis Mondelez International Inc. said it would increase investment in the Cocoa Life Program, which is designed to, among other things, secure..., Headline: Mondelēz International Doubles Down on Cocoa Life Program with Total Investment of $1 Billion by 2030; Calls for More Sector-Wide Action, source:Yahoo, summary: Sustainability now a pillar of Company’s long-term growth and acceleration strategyNext phase of Cocoa Life backed by additional $600 million by 2030Goal to increase scale and work with ~300,000 farmers by 2030Calling for more sector-wide collaboration and public-private partnership to help address systemic challenges and improve farmer livelihoods CHICAGO, Oct. 25, 2022 (GLOBE NEWSWIRE) -- Mondelēz International (Nasdaq: MDLZ) today announces the next phase of its Cocoa Life program, backed by, Headline: Coke and Pepsi Had Good News for Oreo Maker Mondelez. Buy the Stock Ahead of Earnings., source:MarketWatch, summary: A strong dollar will hurt the snack-maker’s profits, but its strong brands should give it the pricing power to overcome the headwind.",MDLZ
28,2022-10-26,"Headline: Cadbury maker Mondelez to invest $600mn on sustainable cocoa sourcing, source:Yahoo, summary: Mondelez has become the latest food company to step up its efforts to raise pay and reduce child labour in cocoa farming, as tensions flare between the African nations that produce much of the global crop and the chocolate industry.  The owner of brands from Cadbury to Toblerone said on Wednesday that it would commit an additional $600mn in sustainability funding until 2030, on top of $400mn invested over the past decade.  The move comes on the eve of an annual meeting of the World Cocoa Federation in Brussels that has been boycotted by officials from Ivory Coast and Ghana, by far the biggest cocoa-producing countries, over prices paid by the industry for the bean., Headline: Coke and Pepsi Had Good News for Oreo Maker Mondelez. Buy the Stock Ahead of Earnings, source:Yahoo, summary: A strong dollar will hurt the snack-maker’s profits, but its strong brands should give it the pricing power to overcome the headwind., Headline: Mondelez International Inc. Cl A stock rises Wednesday, outperforms market, source:MarketWatch, summary: Shares of Mondelez International Inc. Cl A inched 0.99% higher to $59.90 Wednesday, on what proved to be an all-around mixed trading session for the stock...",MDLZ
