,date,information,related
189,2023-05-10,"Headline: Food prices are still high - will these stocks benefit?, source:Seeking Alpha, summary: No summary, Headline: Mondelez International Inc. Cl A stock remains steady Wednesday, underperforms market, source:MarketWatch, summary: Shares of Mondelez International Inc. Cl A were unchanged Wednesday, on what proved to be an all-around mixed trading session for the stock market, with the..., Headline: Dividend Portfolio Update: April 2023, source:SeekingAlpha, summary: We all know that when stock prices tumble, all things being equal, gives us much higher initial yields from our dividend stocks.",MDLZ
190,2023-05-11,"Headline: Should Dividend Growth Investors Buy This Blue-Chip Stock?, source:Yahoo, summary: Dividend growth investing is gaining a real following over the past year as a viable strategy for boosting a retirement portfolio.  It's a big part of why dividend growth stocks, as an investment class, often outperform the broader market when it comes to total return.  The consumer staple Mondelez International (NASDAQ: MDLZ) is a great example of this trend., Headline: Colruyt blames price dispute for lack of Mondelez products, source:Reuters, summary: Belgian supermarket chain Colruyt said its supplies of Mondelez products such as Lu, Milka and Oreos have been halted during a dispute over price increases by the food producer., Headline: UPDATE 1-Colruyt blames price dispute for lack of Mondelez products, source:Yahoo, summary: Belgian supermarket chain Colruyt said its supplies of Mondelez products such as Lu, Milka and Oreos have been halted during a dispute over price increases by the food producer.  Colruyt said Mondelez had asked for an additional price increase after an agreement for 2023 had already been finalised.  It declined to say when Mondelez made the request., Headline: UPDATE 2-Colruyt blames price dispute for lack of Mondelez products, source:Reuters, summary: Belgian supermarket chain Colruyt said its supplies of Mondelez products, such as Milka chocolate and Lu and Oreo biscuits, have been halted during a dispute over price increases by the food producer., Headline: Mondelez International Inc. Cl A stock rises Thursday, outperforms market, source:MarketWatch, summary: Shares of Mondelez International Inc. Cl A inched 0.60% higher to $78.36 Thursday, on what proved to be an all-around poor trading session for the stock..., Headline: With debt crisis looming, look to these names and sectors, Jim Cramer says, source:CNBC, summary: ""Be careful and use the parameters I've laid out,"" CNBC's Jim Cramer said.",MDLZ
191,2023-05-12,"Headline: CAG or MDLZ: Which Is the Better Value Stock Right Now?, source:Yahoo, summary: CAG vs. MDLZ: Which Stock Is the Better Value Option?, Headline: Mondelez International Inc. Cl A stock falls Friday, underperforms market, source:MarketWatch, summary: Shares of Mondelez International Inc. Cl A dropped 0.61% to $77.88 Friday, on what proved to be an all-around grim trading session for the stock market, with...",MDLZ
192,2023-05-14,"Headline: ‘We didn’t ruin Cadbury – we made it better’, source:Yahoo, summary: Cadbury needed to be taken over to improve its flagging business, the chief executive of its US owner has claimed., Headline: Trian Fund buys GE Healthcare, exits Sysco in Q1, source:Thefly.com, summary: No summary",MDLZ
193,2023-05-15,"Headline: Mondelez International Inc. Cl A stock outperforms competitors despite losses on the day, source:MarketWatch, summary: No summary, Headline: Peltz`s Trian Fund slashes stakes in Invesco, Disney; exits Sysco, source:Seeking Alpha, summary: No summary, Headline: Millennials and Gen Z’s rebellion against their parents’ rules is spawning a $181 billion industry that makes everything into a snack, source:Yahoo, summary: Forget pasta, rice, and salad for meals. Chips, granola bars, and cookies are becoming breakfast, lunch and dinner for some age groups.",MDLZ
194,2023-05-16,"Headline: 2 Unstoppable Warren Buffett Stocks That Can Turn Sitting Cash Into Growing Wealth, source:Yahoo, summary: With an investment portfolio worth some $335 billion, Berkshire Hathaway is indisputably one of the largest and most admired investment holding companies on the planet.  Headed up by legendary investor Warren Buffett, the company has a track record of investing in many of the greatest businesses around.  With brands like Cadbury chocolate, Honey Maid graham crackers, and Philadelphia Cream Cheese, the company offers something for everyone's taste., Headline: Mondelēz International Advances Its “Snacking Made Right” ESG Goals, source:Yahoo, summary: Confirms progress in mission to lead the future of more sustainable snackingReaffirms accelerated focus to provide transparent and measurable information for stakeholders on goals, policies, initiatives and programs through credible reportingContinues to create long-term value for business through ongoing investments in sustainability priorities CHICAGO, May 16, 2023 (GLOBE NEWSWIRE) -- Mondelēz International, Inc. (Nasdaq: MDLZ) today published its Fiscal Year 2022 Snacking Made Right Report, a, Headline: Mondelez Int'l Is a Stock Worth Snacking On, source:Yahoo, summary: Food and snack giant Mondelez Int'l  keeps customers happy with chocolate, cookies, biscuits, gum and other products, and now they can keep investors happy too.  In this daily bar chart of MDLZ, below, I can see that prices have climbed higher from an October nadir.  Trading volume has been more active since early March and the On-Balance-Volume (OBV) line has climbed the past 12 months telling me that buyers of MDLZ have been more aggressive than sellers., Headline: Mondelez International Inc. Cl A stock outperforms competitors on strong trading day, source:MarketWatch, summary: Shares of Mondelez International Inc. Cl A inched 0.09% higher to $77.80 Tuesday, on what proved to be an all-around grim trading session for the stock..., Headline: Mondel��z declares $0.385 dividend, source:Seeking Alpha, summary: No summary",MDLZ
195,2023-05-17,"Headline: Tracking Ray Dalio`s Bridgewater Associates 13F Portfolio - Q1 2023 Update, source:Seeking Alpha, summary: No summary, Headline: Billionaire Ray Dalio’s Top 12 Dividend Stock Picks, source:Yahoo, summary: In this article, we will take a look at billionaire Ray Dalio’s top 12 stock picks. You can skip our detailed analysis of Ray Dalio’s hedge fund and recent developments, and go directly to read Billionaire Ray Dalio’s Top 5 Dividend Stock Picks. Ray Dalio founded Bridgewater Associates in 1975. Today, it is one of […], Headline: Mondelez International Inc. Cl A stock falls Wednesday, underperforms market, source:MarketWatch, summary: Shares of Mondelez International Inc. Cl A slumped 0.73% to $77.23 Wednesday, on what proved to be an all-around favorable trading session for the stock..., Headline: Mondelēz International Declares Regular Quarterly Dividend of $0.385 per share, source:Yahoo, summary: CHICAGO, May 17, 2023 (GLOBE NEWSWIRE) -- The Board of Directors of Mondelēz International, Inc. (Nasdaq: MDLZ) today declared a regular quarterly dividend of $0.385 per share of Class A common stock. This dividend is payable on July 14, 2023, to shareholders of record as of the close of business on June 30, 2023. About Mondelēz International Mondelēz International, Inc. (Nasdaq: MDLZ) empowers people to snack right in over 150 countries around the world. With 2022 net revenues of approximately, Headline: Tracking Ray Dalio's Bridgewater Associates 13F Portfolio - Q1 2023 Update, source:SeekingAlpha, summary: Bridgewater Associatesâ 13F portfolio value decreased from ~$18.32B to ~$16.39B this quarter. Click here to read more about its holdings and trades for Q1 2023.",MDLZ
196,2023-05-18,"Headline: 'This is barely even real food': This TikToker compared Subway's old $5 footlong promo to what a combo costs today — a shocking $22. Here are 3 food stocks to fight the cost-of-living crisis, source:Yahoo, summary: Subs are out, snacks are in., Headline: RHS: Consumer Staples Dashboard For May, source:SeekingAlpha, summary: Invesco S&P 500Â® Equal Weight Consumer Staples ETF is an equal-weight alternative to XLP. Click here to read more., Headline: Mondelez International Inc. Cl A stock rises Thursday, still underperforms market, source:MarketWatch, summary: Shares of Mondelez International Inc. Cl A inched 0.05% higher to $77.27 Thursday, on what proved to be an all-around great trading session for the stock..., Headline: Hu Products Issues Voluntary Allergy Alert on Undeclared Tree Nuts (Hazelnut, Cashew, and/or Almond) in Vanilla Crunch Dark Chocolate Bar Product in the U.S., source:Yahoo, summary: Vanilla Crunch Dark Chocolate Bar Vanilla Crunch Dark Chocolate Bar AUSTIN, Texas, May 18, 2023 (GLOBE NEWSWIRE) -- Hu Products announced today a voluntary recall in the United States of a single production lot of Vanilla Crunch Dark Chocolate Bar product (2.1 oz bar) because some packages may potentially contain undeclared hazelnut, cashew, and/or almond that were inadvertently added to the product during manufacturing. People who are sensitive or have allergies to hazelnut, cashew, and/or almo",MDLZ
197,2023-05-19,"Headline: Dividend Roundup: Johnson & Johnson, Northrop Grumman, JPMorgan and more, source:Seeking Alpha, summary: No summary, Headline: Mondelez International Inc. - (MDLZ) Declares $0.38 Dividend, source:Fintel, summary: nan, Headline: Sour, Sweet and So Refreshing: SOUR PATCH KIDS® Launches Lemonade-Inspired Flavors Just in Time for Summer, source:Yahoo, summary: SOUR PATCH KIDS is celebrating summer with the launch of Lemonade Fest, a mouth-puckering, lemonade-inspired candy. Now available in stores nationwide, Lemonade Fest is SOUR PATCH KIDS' delicious mix of everyone's favorite sour-then-sweet candy in four unique lemonade-themed flavors: Lemonade, Strawberry Lemonade, Blue Raspberry Lemonade and Cherry Lime Lemonade. From the first sour bite to the sweet finish, SOUR PATCH KIDS Lemonade Fest is sure to make tastebuds tingle., Headline: Mondelez International Inc. Cl A stock falls Friday, underperforms market, source:MarketWatch, summary: Shares of Mondelez International Inc. Cl A dropped 0.27% to $77.06 Friday, on what proved to be an all-around rough trading session for the stock market,..., Headline: Lawsuit over Trident 'Original Flavor' gum is dismissed, source:Reuters, summary: A federal judge in Illinois has dismissed a lawsuit accusing Mondelez International Inc of deceiving consumers into believing its Trident ""Original Flavor"" gum contained real mint.",MDLZ
198,2023-05-22,"Headline: Dividend Growth Investing Like Warren Buffett, source:SeekingAlpha, summary: 3 of Buffett's core investing principles are just as applicable to dividend growth investing as they are to any kind of investing. Read more to see my thoughts., Headline: Mondelez International Inc. Cl A stock outperforms competitors despite losses on the day, source:MarketWatch, summary: Shares of Mondelez International Inc. Cl A shed 1.54% to $75.87 Monday, on what proved to be an all-around mixed trading session for the stock market, with...",MDLZ
199,2023-05-23,"Headline: Why Mondelez International is a Top 25 Dividend Giant (MDLZ), source:ETF Channel, summary: No summary, Headline: Tootsie Roll Industries: Still Expensive Despite Great Performance, source:SeekingAlpha, summary: Tootsie Roll Industries has seen significant upside in recent months due to favorable financial results. Click here for my view of TR stock's valuation issues., Headline: Mondelez International Inc. Cl A stock underperforms Tuesday when compared to competitors, source:MarketWatch, summary: Shares of Mondelez International Inc. Cl A slid 0.29% to $75.65 Tuesday, on what proved to be an all-around grim trading session for the stock market, with..., Headline: Mondelēz International Advances Its “Snacking Made Right” ESG Goals, source:Yahoo, summary: CHICAGO, IL / ACCESSWIRE / May 23, 2023 / Mondelēz International Confirms progress in mission to lead the future of more sustainable snackingReaffirms accelerated focus to provide transparent and measurable information for stakeholders on goals, ...",MDLZ
200,2023-05-24,"Headline: Mondelez International Inc. Cl A stock outperforms market despite losses on the day, source:MarketWatch, summary: No summary",MDLZ
201,2023-05-25,"Headline: Mondelez International Inc. Cl A stock falls Thursday, underperforms market, source:MarketWatch, summary: No summary",MDLZ
202,2023-05-26,"Headline: Mondelez International Inc. Cl A stock outperforms competitors despite losses on the day, source:MarketWatch, summary: Shares of Mondelez International Inc. Cl A shed 0.07% to $75.13 Friday, on what proved to be an all-around great trading session for the stock market, with...",MDLZ
203,2023-05-27,"Headline: Gen Z and millennials aren’t just rebelling by swapping meals for snacks—they want something ‘experiential’ for TikTok, Oreo’s analytics chief says, source:Yahoo, summary: These generations aren't only ""big snackers,"" says Mondelez's Nick Graham. “Their needs from snacking are much more diverse.”",MDLZ
204,2023-05-29,"Headline: Buy 8 May Buffett Dividend Dogs And Watch 7, source:SeekingAlpha, summary: Any collection of stocks is more clearly understood when subjected to yield-based analysis. Read why this Buffett/Berkshire batch is perfect for the dogcatcher process.",MDLZ
205,2023-05-30,"Headline: Nvidia, C3.ai, Ford stocks climb while Anheuser-Busch shares fall, and other stocks on the move, source:MarketWatch, summary: Here are some of the biggest movers on Tuesday as investors returned from a three-day break., Headline: P&G stock leads the Dow’s losers as debt-ceiling optimism turns investors away from safety of consumer staples, source:MarketWatch, summary: Shares of Procter & Gamble Co. slumped 1.6% toward a 2 1/2-month low in midday trading, enough to pace the Dow Jones Industrial Average’s decliners, as..., Headline: Mondelez: When Strong Brands Are Properly Managed, Results Follow, source:SeekingAlpha, summary: After delivering strong returns for a very low risk, Mondelez is still trading at fair value. Click here to see our take on MDLZ stock., Headline: Mondelez International Inc. Cl A stock underperforms Tuesday when compared to competitors, source:MarketWatch, summary: Shares of Mondelez International Inc. Cl A slid 3.67% to $72.37 Tuesday, on what proved to be an all-around mixed trading session for the stock market, with...",MDLZ
206,2023-05-31,"Headline: Mondelez International Inc. Cl A stock outperforms competitors on strong trading day, source:MarketWatch, summary: Shares of Mondelez International Inc. Cl A advanced 1.44% to $73.41 Wednesday, on what proved to be an all-around grim trading session for the stock market,..., Headline: Mondelez (MDLZ) Gains As Market Dips: What You Should Know, source:Yahoo, summary: In the latest trading session, Mondelez (MDLZ) closed at $73.41, marking a +1.44% move from the previous day.",MDLZ
207,2023-06-01,"Headline: MamaMancini's appoints Lauren Sella as CMO, source:Thefly.com, summary: No summary, Headline: MDLZ July 14th Options Begin Trading, source:Stock Options Channel, summary: No summary, Headline: 10 Stocks Jim Cramer Thinks Can Weather a Debt Default, source:Yahoo, summary: In this article, we will be taking a look at 10 stocks Cramer thinks can weather a debt default. To explore similar stocks, you can go see 5 Stocks Cramer Thinks Can Weather a Debt Default. “When The Market Throws a Sale, I Tell You To Do Some Buying” On May 12, Jim Cramer noted […], Headline: Mondelez International Inc. Cl A stock rises Thursday, still underperforms market, source:MarketWatch, summary: Shares of Mondelez International Inc. Cl A inched 0.27% higher to $73.61 Thursday, on what proved to be an all-around positive trading session for the stock...",MDLZ
208,2023-06-02,"Headline: 3 Millionaire-Making Sleeper Stocks to Buy Before Investors Wake Up, source:Yahoo, summary: Identifying undervalued sleeper stocks will always be a great way to find strong returns in the market. As with all investments, you can only get out what you put in; reaching a million will take time. That said, the three names below can help you in your journey toward millionaire status. The market is again in flux. Lots of investors have realized strong returns in tech in 2023. Those who invested heavily in Nvidia (NASDAQ:NVDA) and other AI-linked shares are surely happy after Nvidia’s strong, Headline: Mondelez International Inc. Cl A stock rises Friday, still underperforms market, source:MarketWatch, summary: Shares of Mondelez International Inc. Cl A inched 0.90% higher to $74.27 Friday, on what proved to be an all-around great trading session for the stock...",MDLZ
209,2023-06-05,"Headline: Big Companies Keep Raising Prices: 7 ‘Strong Buy’ Dividend Stocks Offer Inflation Protection, source:247WallSt, summary: No summary, Headline: Mondelez International Inc. Cl A stock outperforms competitors on strong trading day, source:MarketWatch, summary: Shares of Mondelez International Inc. Cl A inched 0.03% higher to $74.29 Monday, on what proved to be an all-around grim trading session for the stock...",MDLZ
210,2023-06-06,"Headline: Premium Gifting Perfection: Cadbury's Limited Edition Dairy Milk Laser-Engraved Bars Sell Out within Two Weeks, source:PR Newswire, summary: No summary, Headline: Mondelez International Inc. Cl A stock falls Tuesday, underperforms market, source:MarketWatch, summary: Shares of Mondelez International Inc. Cl A slid 1.36% to $73.28 Tuesday, on what proved to be an all-around great trading session for the stock market, with..., Headline: Mondelez (MDLZ) Stock Sinks As Market Gains: What You Should Know, source:Yahoo, summary: Mondelez (MDLZ) closed at $73.28 in the latest trading session, marking a -1.36% move from the prior day.",MDLZ
211,2023-06-07,"Headline: Mondelez International Inc. Cl A stock falls Wednesday, underperforms market, source:MarketWatch, summary: Shares of Mondelez International Inc. Cl A slid 1.49% to $72.19 Wednesday, on what proved to be an all-around mixed trading session for the stock market,...",MDLZ
212,2023-06-08,"Headline: Fed Putting Brakes On Rate Hikes Could Be Godsend For These Dividend-Paying Stocks — What You Need To Know, source:Benzinga, summary: No summary, Headline: July 28th Options Now Available For Mondelez International (MDLZ), source:Stock Options Channel, summary: No summary, Headline: Mondelez (MDLZ) Gains From Core Categories Amid Cost Woes, source:Yahoo, summary: Mondelez (MDLZ) benefits from its core chocolate and biscuit categories amid global cost inflation., Headline: Mondelez International Inc. Cl A stock rises Thursday, outperforms market, source:MarketWatch, summary: Shares of Mondelez International Inc. Cl A rallied 1.25% to $73.09 Thursday, on what proved to be an all-around favorable trading session for the stock...",MDLZ
213,2023-06-09,"Headline: Mondelez: One Of My Top Picks In The Consumer Staples Sector, source:SeekingAlpha, summary: While the shares are not cheap, I believe Mondelez deserves to trade at a premium and calculate a target price of $83. See why we believe MDLZ stock is a buy., Headline: Mondelez International Inc. Cl A stock falls Friday, underperforms market, source:MarketWatch, summary: Shares of Mondelez International Inc. Cl A slipped 0.16% to $72.97 Friday, on what proved to be an all-around great trading session for the stock market,...",MDLZ
214,2023-06-12,"Headline: Oreo-maker Mondelez faces Nordic backlash over Russia business, source:Yahoo, summary: OSLO (Reuters) -Mondelez International, facing a widening corporate boycott in the Nordic region over its presence in Russia will meet with Norwegian government representatives this week in the hope of protecting the group's local business.  Airlines SAS and Norwegian Air, railway group SJ, hotel chain Strawberry, retailer Elkjop, shipping group Fjord Line and the Norwegian Football Association were among those announcing in recent days that they would stop selling Mondelez products., Headline: Mondelez International Inc. Cl A stock outperforms competitors despite losses on the day, source:MarketWatch, summary: Shares of Mondelez International Inc. Cl A slipped 0.22% to $72.81 Monday, on what proved to be an all-around positive trading session for the stock market,..., Headline: UPDATE 1-Oreo-maker Mondelez faces Nordic backlash over Russia business, source:Yahoo, summary: Mondelez International , facing a widening corporate boycott in the Nordic region over its presence in Russia will meet with Norwegian government representatives this week in the hope of protecting the group's local business.  Airlines SAS and Norwegian Air, railway group SJ, hotel chain Strawberry, retailer Elkjop, shipping group Fjord Line and the Norwegian Football Association were among those announcing in recent days that they would stop selling Mondelez products., Headline: Top Scandinavian companies are boycotting the maker of Oreo and Toblerone for its business in Russia, source:Yahoo, summary: Mondelez International—the global manufacturer of a range of snacks including Oreo and Toblerone—is facing a growing boycott across northern Europe for its decision to remain in Russia.",MDLZ
215,2023-06-13,"Headline: UPDATE 1-Belgian supermarket Colruyt annual profit drops on cost hikes, source:Yahoo, summary: Belgian discount supermarket chain Colruyt on Tuesday reported lower annual earnings, citing inflation and substantial cost increases that it has been unable to fully pass on to customers.  Under its ""lower price"" model, Colruyt said it can only pass on higher costs if all its competitors had raised prices, as the grocery sector struggles with elevated inflation.  Gross profit margin decreased to 27.1% of revenue in the fiscal year ended March 31 from 27.4% a year ago, the company said in a statement., Headline: Mondelez International Inc. Cl A stock falls Tuesday, underperforms market, source:MarketWatch, summary: Shares of Mondelez International Inc. Cl A slumped 0.12% to $72.72 Tuesday, on what proved to be an all-around great trading session for the stock market,...",MDLZ
216,2023-06-14,"Headline: Analysts Offer Insights on Consumer Goods Companies: Celsius Holdings (CELH) and Mondelez International (MDLZ), source:TipRanks, summary: No summary, Headline: Packaged food stocks will face tricky sales growth comparisons after a year of inflation, source:Seeking Alpha, summary: No summary, Headline: Mondelez International Inc. Cl A stock outperforms market on strong trading day, source:MarketWatch, summary: Shares of Mondelez International Inc. Cl A inched 0.56% higher to $73.13 Wednesday, on what proved to be an all-around mixed trading session for the stock...",MDLZ
217,2023-06-15,"Headline: Mondelez to separate Russia business by year-end, source:Seeking Alpha, summary: No summary, Headline: UPDATE 1-Mondelez plans to separate Russia operations by year-end, source:Yahoo, summary: Oreo-maker Mondelez International said on Thursday it has scaled down operations in Russia and plans to make it a stand-alone business with a self-sufficient supply chain before the end of the year.  The Chicago-based snack maker, which has faced a widening corporate boycott in the Nordic region over its presence in Russia, said it has discontinued new capital investments, product launches and advertising media spending in the country.  ""As a result of these actions...overall volumes have declined double digits and both our import volumes and market share have significantly decreased,"" the company said in a statement., Headline: Mondelez International Inc. Cl A stock rises Thursday, still underperforms market, source:MarketWatch, summary: Shares of Mondelez International Inc. Cl A inched 0.45% higher to $73.46 Thursday, on what proved to be an all-around favorable trading session for the stock...",MDLZ
