,date,information,related
79,2022-12-22,"Headline: February 2023 Options Now Available For Mondelez International (MDLZ), source:Stock Options Channel, summary: No summary, Headline: Mondelez Stock: Gum Business Sale is Bullish, source:TipRanks, summary: No summary, Headline: Mondelez International, Inc. (NASDAQ:MDLZ) insiders sold US$4.9m worth of stock, possibly signalling a downtrend, source:Yahoo, summary: Over the past year, many Mondelez International, Inc. ( NASDAQ:MDLZ ) insiders sold a significant stake in the company..., Headline: MHGVY or MDLZ: Which Is the Better Value Stock Right Now?, source:Yahoo, summary: MHGVY vs. MDLZ: Which Stock Is the Better Value Option?, Headline: Mondelez International Inc. Cl A stock outperforms market despite losses on the day, source:MarketWatch, summary: Shares of Mondelez International Inc. Cl A dropped 0.24% to $66.73 Thursday, on what proved to be an all-around grim trading session for the stock market,...",MDLZ
80,2022-12-23,"Headline: Mondelez International Inc. Cl A stock rises Friday, still underperforms market, source:MarketWatch, summary: Shares of Mondelez International Inc. Cl A inched 0.55% higher to $67.10 Friday, on what proved to be an all-around favorable trading session for the stock...",MDLZ
81,2022-12-24,"Headline: Consumer staples outperformed this year - watch these stocks in 2023, source:Seeking Alpha, summary: No summary",MDLZ
82,2022-12-25,"Headline: Dividend Champion, Contender, And Challenger Highlights: Week Of December 25, source:Seeking Alpha, summary: No summary",MDLZ
83,2022-12-26,"Headline: Is There An Opportunity With Mondelez International, Inc.'s (NASDAQ:MDLZ) 20% Undervaluation?, source:Yahoo, summary: How far off is Mondelez International, Inc. ( NASDAQ:MDLZ ) from its intrinsic value? Using the most recent financial...",MDLZ
84,2022-12-27,"Headline: Ex-Dividend Reminder: Mondelez International, B&G Foods and Thor Industries, source:Dividend Channel, summary: No summary, Headline: Mondelez (MDLZ) Looks Appetizing: Stock Up 15% in 3 Months, source:Yahoo, summary: Mondelez (MDLZ) benefits from a focus on its chocolate and biscuit business. Also, strength in emerging markets and pricing has been working well., Headline: Michael Farr: These are 2023's top stock picks for what could be a rocky year, source:CNBC, summary: Lower lows could be ahead for investors. Here are Michael Farr's picks for the new year., Headline: Want Better Returns? Don't Ignore These 2 Consumer Staples Stocks Set to Beat Earnings, source:Yahoo, summary: The Zacks Earnings ESP is a great way to find potential earnings surprises. Why investors should take advantage now., Headline: Are Consumer Staples Stocks Lagging  Mondelez International (MDLZ) This Year?, source:Yahoo, summary: Here is how Mondelez (MDLZ) and PepsiCo (PEP) have performed compared to their sector so far this year., Headline: Mondelez International Inc. Cl A stock rises Tuesday, outperforms market, source:MarketWatch, summary: Shares of Mondelez International Inc. Cl A inched 0.58% higher to $67.49 Tuesday, on what proved to be an all-around mixed trading session for the stock...",MDLZ
85,2022-12-28,"Headline: Mondelez: Stay Off The Cookies, source:SeekingAlpha, summary: Mondelez has been aggressively expanding the business with some targeted M&A actions. Click here to read our analysis of MDLZ stock., Headline: Analysts Are Downgrading These 10 Stocks, source:Yahoo, summary: In this article, we will look at the 10 stocks recently downgraded by analysts. If you want to see more such downgrades on the list, you can directly visit Analysts Are Downgrading These 5 Stocks. U.S. stocks mostly traded in red this month amid investors’ concerns over future rate hikes. Moreover, the producer price index […], Headline: Mondelez International Inc. Cl A stock falls Wednesday, still outperforms market, source:MarketWatch, summary: Shares of Mondelez International Inc. Cl A dropped 0.98% to $66.83 Wednesday, on what proved to be an all-around dismal trading session for the stock market,...",MDLZ
86,2022-12-29,"Headline: Pilgrim's Pride (PPC) Poised on Solid Performance & Expansions, source:Yahoo, summary: Pilgrim's Pride (PPC) benefits from long-term investments like capacity expansion and automation. The company's customer-centric approach bodes well., Headline: The J. M. Smucker (SJM) Up on Core Strategies & Pricing Efforts, source:Yahoo, summary: The J. M. Smucker (SJM) is on track with core priorities like driving commercial excellence, reshaping its portfolio, streamlining cost structure and unleashing its organization to win., Headline: Mondelez International Inc. Cl A stock rises Thursday, still underperforms market, source:MarketWatch, summary: Shares of Mondelez International Inc. Cl A inched 0.79% higher to $66.97 Thursday, on what proved to be an all-around favorable trading session for the stock...",MDLZ
87,2022-12-30,"Headline: Returns On Capital At Mondelez International (NASDAQ:MDLZ) Have Stalled, source:Yahoo, summary: If you're not sure where to start when looking for the next multi-bagger, there are a few key trends you should keep an..., Headline: Inter Parfums (IPAR) Gains on Solid Brands & Partnerships, source:Yahoo, summary: Inter Parfums (IPAR) benefits from the strength of its partnerships. The company's focus on product launches to boost assortment strength is impressive., Headline: B&G Foods (BGS) Down More Than 50% in 6 Months: Here's Why, source:Yahoo, summary: B&G Foods (BGS) has been battling major cost hurdles. Management anticipates significant cost inflation for inputs, such as ingredients, packaging, labor and transportation., Headline: I'm Buying These 3 Resilient Stocks During a Bear Market, source:Yahoo, summary: In a bull market, it's common for investors to chase growth stocks for attractive capital gains.  In a sharp U turn, investors are now refocusing their attention on resilience and stability as the bear market drags on.  Possessing these attributes means the company can navigate through tough economic times while doling out a steady stream of passive income., Headline: Mondelez International Inc. Cl A stock outperforms competitors despite losses on the day, source:MarketWatch, summary: Shares of Mondelez International Inc. Cl A slid 0.48% to $66.65 Friday, on what proved to be an all-around grim trading session for the stock market, with...",MDLZ
88,2023-01-02,"Headline: Why These 7 Consumer Stocks Could Soar in 2023, source:Yahoo, summary: This article will highlight seven consumer stocks to buy in 2023, and here’s why. While energy and bank stocks are strong choices, the investor should not count out the consumer. Inflation and rising interest rates were supposed to crush consumers in 2022, but that didn’t happen, at least not to the extent investors expected. However, that may be changing. In the last quarter there’s been a definite shift in way several companies are viewing their earnings outlooks. It’s possible that companies, Headline: Mondelez downgraded to Sector Perform from Outperform at RBC Capital, source:Thefly.com, summary: No summary, Headline: Mondelez initiated with an Overweight at Wells Fargo, source:Thefly.com, summary: No summary",MDLZ
89,2023-01-03,"Headline: Mondelez International attracts bull rating from Wells Fargo, source:Seeking Alpha, summary: No summary, Headline: Street Wrap: Today`s Top 15 Upgrades, Downgrades, Initiations, source:Thefly.com, summary: No summary, Headline: A Look At The Fair Value Of Mondelez International, Inc. (NASDAQ:MDLZ), source:Yahoo, summary: Today we will run through one way of estimating the intrinsic value of Mondelez International, Inc. ( NASDAQ:MDLZ ) by..., Headline: Conagra Brands (CAG) Readies for Q2 Earnings: Things to Note, source:Yahoo, summary: Conagra Brands' (CAG) second-quarter performance is likely to have witnessed gains from pricing and the strength of the snacks category amid rising cost inflation., Headline: Mondelez International Inc. Cl A stock falls Tuesday, underperforms market, source:MarketWatch, summary: Shares of Mondelez International Inc. Cl A sank 0.60% to $66.25 Tuesday, on what proved to be an all-around dismal trading session for the stock market, with...",MDLZ
90,2023-01-04,"Headline: Lamb Weston (LW) Gears Up for Q2 Earnings: Things to Note, source:Yahoo, summary: Lamb Weston's (LW) second-quarter performance is likely to have witnessed gains from pricing and capacity expansion endeavors amid escalated cost concerns., Headline: Mondelez International Inc. Cl A stock rises Wednesday, still underperforms market, source:MarketWatch, summary: Shares of Mondelez International Inc. Cl A inched 0.72% higher to $66.73 Wednesday, on what proved to be an all-around positive trading session for the stock..., Headline: Why Mondelez (MDLZ) Could Beat Earnings Estimates Again, source:Yahoo, summary: Mondelez (MDLZ) has an impressive earnings surprise history and currently possesses the right combination of the two key ingredients for a likely beat in its next quarterly report., Headline: Mondelez International Inc. Cl A stock falls Thursday, still outperforms market, source:MarketWatch, summary: No summary",MDLZ
91,2023-01-05,"Headline: Mondelez International Inc. Cl A stock outperforms competitors on strong trading day, source:MarketWatch, summary: No summary",MDLZ
92,2023-01-06,"Headline: Mondelez price target raised to $78 from $75 at Mizuho, source:Thefly.com, summary: No summary",MDLZ
93,2023-01-07,"Headline: Mondelez International, Inc.'s (NASDAQ:MDLZ) Stock Is Going Strong: Is the Market Following Fundamentals?, source:Yahoo, summary: Mondelez International's (NASDAQ:MDLZ) stock is up by a considerable 23% over the past three months. Since the market...",MDLZ
94,2023-01-09,"Headline: The Estee Lauder Companies' (EL) Online Business Aids Growth, source:Yahoo, summary: The Estee Lauder Companies (EL) is implementing new technology and digital experiences to drive online growth. However, inflation and supply-chain bottlenecks are concerns., Headline: Kimberly-Clark (KMB) Benefits From Growth Pillars & Cost Cutting, source:Yahoo, summary: Kimberly-Clark (KMB) is committed to its three key strategic growth pillars. The company has been progressing well with expanding global business.",MDLZ
95,2023-01-10,"Headline: Campbell Soup (CPB) Looks Appetizing on Snacks Unit & Savings, source:Yahoo, summary: Campbell Soup (CPB) has been benefiting from brand strength and inflation-driven pricing actions. Growing Snacks business is a key driver., Headline: Mondelez (MDLZ) Gains But Lags Market: What You Should Know, source:Yahoo, summary: Mondelez (MDLZ) closed the most recent trading day at $67.31, moving +0.1% from the previous trading session.",MDLZ
96,2023-01-12,"Headline: How to Find Strong Consumer Staples Stocks Slated for Positive Earnings Surprises, source:Yahoo, summary: Investors looking for ways to find stocks that are set to beat quarterly earnings estimates should check out the Zacks Earnings ESP., Headline: Oreo Owner Plans Massive Revamp for Iconic Candy Brands, source:Yahoo, summary: International food brand giant Mondelez  may not be a household name in its own right, but plenty of foods in its portfolio certainly are.  The parent of Oreo, Ritz, Cadbury, and Sour Patch Kids is known for its indulgent confections and lunch box staples around the globe.  As it stands currently, Mondelez holds the #1 market share position for cookies, biscuits and crackers., Headline: Mondelēz International to Report Q4 and Full Year 2022 Financial Results on January 31, 2023, source:Yahoo, summary: CHICAGO, Jan. 12, 2023 (GLOBE NEWSWIRE) -- Mondelēz International, Inc. (Nasdaq: MDLZ) will release its fourth quarter 2022 financial results on Tuesday, January 31, 2023 at 4:05 p.m. ET and will host a conference call at 5:00 p.m. ET that day. Investors and analysts may participate via phone by calling 800-225-9448 from the United States and 203-518-9814 from other locations. To ensure timely access, participants should dial in approximately 10 minutes before the call starts. A listen-only webc",MDLZ
97,2023-01-15,"Headline: 25 Biggest Illinois Companies and Stocks, source:Yahoo, summary: In this article, we will be taking a look at the 25 biggest Illinois companies and stocks. To skip our detailed analysis, you can go directly to see the 5 Biggest Illinois Companies and Stocks. If all U.S. states were countries, Illinois would be the 21st largest economy in the world. It is the fifth […]",MDLZ
98,2023-01-16,"Headline: The J.M. Smucker (SJM) Up More Than 15% in 6 Months: Here's Why, source:Yahoo, summary: The J.M. Smucker (SJM) is benefiting from strategic pricing actions amid the inflationary environment. The company is progressing well with core priorities., Headline: Are Consumer Staples Stocks Lagging  Lamb Weston (LW) This Year?, source:Yahoo, summary: Here is how Lamb Weston (LW) and Mondelez (MDLZ) have performed compared to their sector so far this year.",MDLZ
99,2023-01-17,"Headline: Buy 5 High-Yielding U.S. Bigwigs to Enhance Your Portfolio, source:Yahoo, summary: We have narrowed our search to five U.S. corporate bigwigs. These are: MCD, KO, IBM, MDLZ and PEP., Headline: Mondelez International Inc. Cl A stock falls Tuesday, still outperforms market, source:MarketWatch, summary: Shares of Mondelez International Inc. Cl A dropped 0.06% to $67.02 Tuesday, on what proved to be an all-around poor trading session for the stock market,...",MDLZ
100,2023-01-18,"Headline: Top 5 Consumer Staple Stocks Set to Beat This Earnings Season, source:Yahoo, summary: Five consumer staples companies' earnings are set to beat estimates. These are MDLZ, PG, CTVA, ELF and THS., Headline: Kraft Heinz (KHC) Gains on Solid Pricing & Transformation, source:Yahoo, summary: Solid pricing initiatives have been aiding Kraft Heinz (KHC) for a while now. The company's top line is supported by three pillars of growth., Headline: Mondelez International Inc. Cl A stock falls Wednesday, underperforms market, source:MarketWatch, summary: Shares of Mondelez International Inc. Cl A shed 3.66% to $64.57 Wednesday, on what proved to be an all-around poor trading session for the stock market, with...",MDLZ
101,2023-01-19,"Headline: The Zacks Analyst Blog Highlights The Procter & Gamble, Corteva, e.l.f. Beauty, Mondelez  International and TreeHouse Foods, source:Yahoo, summary: The Procter & Gamble, Corteva, e.l.f. Beauty, Mondelez International and TreeHouse Foods are part of the Zacks top Analyst Blog., Headline: Mondelēz International Releases Fourth Annual State of Snacking™ Report Highlighting Expanded Role of Snacking in Consumer Eating Habits, source:Yahoo, summary: Snacking preferred over traditional mealtime for fourth consecutive yearSnacks remain regularly included in consumers' budgets, despite rising pricesConsumers are being more mindful and present when enjoying snacksConsumers are willing to pay a premium for sustainable snacks CHICAGO, Jan. 19, 2023 (GLOBE NEWSWIRE) -- Mondelēz International today announced the launch of the fourth annual State of Snacking™ report, a global consumer trends study examining annual insights on how consumers make snac, Headline: Kimberly-Clark (KMB) Gears Up for Q4 Earnings: Things to Note, source:Yahoo, summary: Kimberly-Clark's (KMB) fourth-quarter performance is likely to have witnessed gains from pricing, saving and key strategic efforts amid cost concerns and currency headwinds., Headline: Campbell Soup's (CPB) Latest Consolidation Move to Fuel Growth, source:Yahoo, summary: Campbell Soup (CPB) plans to consolidate its Charlotte, N.C. and Norwalk, Conn. Snacks offices into its headquarters located in Camden., Headline: The last flicker of the candle as Peltz melts, source:Yahoo, summary: Disney shareholders shouldn't listen to activist investor Nelson Peltz's criticism of Bob Iger, according to Yale's Jeffrey Sonnenfeld and Steven Tian., Headline: CAG vs. MDLZ: Which Stock Is the Better Value Option?, source:Yahoo, summary: CAG vs. MDLZ: Which Stock Is the Better Value Option?, Headline: FSTA: Consumer Staples Dashboard For January, source:SeekingAlpha, summary: This monthly article series shows a dashboard with aggregate industry metrics in consumer staples. Read more as I discuss Fidelity MSCI Consumer Staples Index ETF.",MDLZ
102,2023-01-20,"Headline: Here's How Diageo (DEO) is Placed Ahead of 1H23 Earnings, source:Yahoo, summary: Diageo's (DEO) first half of fiscal 2023 results are likely to reflect gains from market share improvements, continued recovery across markets and premiumization efforts, offset by inflationary costs., Headline: Mondelez (MDLZ) Looks Tempting on Snacking Category Strength, source:Yahoo, summary: Mondelez (MDLZ) highlights that consumers continue to put snacking as a priority, even amid inflated costs and economic headwinds. The company remains well-placed for growth., Headline: McCormick (MKC) Gears Up for Q4 Earnings: Things to Consider, source:Yahoo, summary: McCormick (MKC) fourth-quarter fiscal 2022 performance is likely to reflect gains from strategic pricing and impressive brand portfolio. Also, prudent buyouts are upsides., Headline: Mondelez (MDLZ) Gains But Lags Market: What You Should Know, source:Yahoo, summary: Mondelez (MDLZ) closed at $64.04 in the latest trading session, marking a +0.31% move from the prior day.",MDLZ
103,2023-01-23,"Headline: Enthusiast Gaming Announces Partnership with SOUR PATCH KIDS, source:Yahoo, summary: SOUR PATCH KIDS to sponsor tournament offering gamers a chance to play with NFL players and win a gaming prize packLOS ANGELES, Jan. 23, 2023 (GLOBE NEWSWIRE) -- Enthusiast Gaming Holdings Inc. (“Enthusiast Gaming”) (NASDAQ:EGLX; TSX:EGLX), today announced a partnership with Mondelēz International's SOUR PATCH KIDS® (NASDAQ: MDLZ) to launch the SOUR PATCH KIDS Fruit Fight Tournament, which will be hosted on NFL Tuesday Night Gaming’s channels beginning in February 2023. The tournament is a colla, Headline: Consumer Reports urges dark chocolate makers to reduce lead, cadmium levels, source:Reuters, summary: Consumer Reports on Monday urged four chocolate producers to commit by Valentine's Day to reduce the amounts of lead and cadmium in their dark chocolate products, after testing revealed harmful levels of the heavy metals.",MDLZ
104,2023-01-24,"Headline: INCREDIBLE STUF AWAITS! THE OREO BRAND'S MOST PLAYFUL COOKIE EVER TWISTS OPEN THE MOST PLAYFUL WORLD EVER, source:Yahoo, summary: OREO is kicking off the year with some out-of-this-world news. Today, the brand introduces a new limited-edition cookie, The Most OREO OREO, unveils the OREOVERSE - an interactive, digital world where OREO fans can play and explore — and invites none other than Martha Stewart to navigate the virtual world., Headline: Mondelez (MDLZ) Q4 Earnings Preview: What's in the Cards?, source:Yahoo, summary: Mondelez (MDLZ) doesn't possess the right combination of the two key ingredients for a likely earnings beat in its upcoming report. Get prepared with the key expectations.",MDLZ
105,2023-01-25,"Headline: 3 January Buffett Dividend Dog Buys Plus 5 To Watch, source:SeekingAlpha, summary: $5k invested in the lowest-priced 5 top-yield Buffett-held January dividend dogs showed 31.41% LESS net-gain than from $5k invested in all 10. Read more here.",MDLZ
106,2023-01-26,"Headline: Buy These 2 Buffett-Owned Stocks in 2023 to Boost Your Passive Income, source:Yahoo, summary: Few investors exemplify this better than Berkshire Hathaway's (NYSE: BRK.A)(NYSE: BRK.B) chief executive officer and chairman, Warren Buffett.  This approach transformed Berkshire Hathaway into the largest holding company in the world over that stretch of time.  Here are two consumer staple dividend payers trading at reasonable valuations that income investors may want to buy this year and hold for many more years., Headline: Mondelez's (MDLZ) Q4 Earnings Upcoming: Factors to Consider, source:Yahoo, summary: Mondelez's (MDLZ) fourth-quarter 2022 earnings might reflect the impacts of cost inflation and currency headwinds., Headline: Mondelez International: Can The Stellar Performance Continue?, source:SeekingAlpha, summary: Mondelez is a rare consumer staples company that has increased volumes in the face of double-digit price increases. Click here to read my analysis of MDLZ., Headline: Mondelez (MDLZ) Stock Sinks As Market Gains: What You Should Know, source:Yahoo, summary: In the latest trading session, Mondelez (MDLZ) closed at $64.52, marking a -0.74% move from the previous day., Headline: 2 Stocks to Consider Buying Before Earnings Next Week, source:Yahoo, summary: Both Mondelez International and RenassanceRe Holdings stock look intriguing going into their Q4 reports next week as rising earnings estimate revisions for FY23 are a good sign that these companies could offer positive guidance.",MDLZ
107,2023-01-31,"Headline: Fly Intel: After-Hours Movers, source:Thefly.com, summary: No summary, Headline: Notable companies reporting after market close, source:Thefly.com, summary: No summary, Headline: Mondelez International Sets $6B Share Buyback Program, source:MarketWatch, summary: By Kathryn Hardison Mondelez International Inc.'s board of directors has approved a new share repurchase program of up to $6 billion of company stock. The..., Headline: Mondelez: Q4 Earnings Snapshot, source:Associated Press, The, summary: No summary, Headline: Mondelez International, Inc. 2022 Q4 - Results - Earnings Call Presentation, source:SeekingAlpha, summary: The following slide deck was published by Mondelez International, Inc., Headline: Mondelez International sees annual revenue rise with good pricing, source:Alliance News, summary: No summary, Headline: Mondelez International, Inc. (MDLZ) Q4 2022 Earnings Call Transcript, source:SeekingAlpha, summary: Mondelez International, Inc. (NASDAQ:NASDAQ:MDLZ) Q4 2022 Earnings Conference Call January 31, 2023 5:00 PM ETCompany ParticipantsShep Dunlap - Vice President of Investor RelationsDirk Van..., Headline: Mondelēz International Reports Q4 and FY 2022 Results, source:Yahoo, summary: Full Year Highlights Net revenues for the full year increased +9.7% driven by Organic Net Revenue1 growth of +12.3% with underlying Volume/Mix of +2.7%. For the fourth quarter, Net revenues increased +13.5% driven by Organic Net Revenue1 growth of +15.4% with underlying Volume/Mix of +1.6%Diluted EPS was $1.96, down 35.5%; Adjusted EPS1 was $2.95, up +11.9% on a constant currency basisCash provided by operating activities was $3.9 billion, a decrease of $0.2 billion versus prior year; Free Cash, Headline: UPDATE 3-Oreo maker Mondelez tops quarterly estimates as snack demand holds up, source:Yahoo, summary: Mondelez International Inc topped market expectations for quarterly results on Tuesday, boosted by resilient demand for chocolates and snacks, but warned its European business could take a hit in the current quarter from price hikes.  While that helped Mondelez record a surge in quarterly revenue from North America and Latin America, its European business took a hit from soaring energy costs in the region.  The Cadbury chocolate maker said it had announced another round of price hikes in Europe, which could hurt its first-quarter margins as retailers push back against the move and the disruption ""might also continue"" into the second quarter., Headline: Mondelez stock boosted following Q4 earnings beat, source:Yahoo, summary: Yahoo Finance food reporter Brooke DiPalma breaks down Mondelez International's earnings report., Headline: Mondelez beats expectations on strong growth across its food brands, source:Yahoo, summary: Mondelez International Inc. on Tuesday reported growth across the board for the fourth quarter and full year, beating Wall Street expectations., Headline: Mondelez Stock Edges Higher on Strong Earnings, source:Yahoo, summary: The maker of Oreo cookies and Cadbury chocolate delivered a better-than-expected quarter, giving a modest boost to the stock,, Headline: Mondelez (MDLZ) Tops Q4 Earnings and Revenue Estimates, source:Yahoo, summary: Mondelez (MDLZ) delivered earnings and revenue surprises of 2.82% and 3.84%, respectively, for the quarter ended December 2022. Do the numbers hold clues to what lies ahead for the stock?, Headline: The 7 Best Climate Change Stocks to Buy for 2023, source:Yahoo, summary: The concept of best climate change stocks to buy for 2023 presents a critically ethical tone. According to multiple scientists and investigative reports, human-caused environmental impact imposed many negative developments on our planet. To mitigate and hopefully reverse the consequences of prior activities, we must start taking action now. Unfortunately, a perception exists that even the best climate change stocks to buy will not be profitable. After all, in perhaps most circumstances, doing go, Headline: Oreo maker Mondelez tops quarterly estimates as snack demand holds up, source:Reuters, summary: Mondelez International Inc topped market expectations for quarterly results on Tuesday, boosted by resilient demand for chocolates and snacks, but warned its European business could take a hit in the current quarter from price hikes., Headline: Mondelez Expects Fewer Price Increases This Year, source:Yahoo, summary: The maker of Oreo cookies and Sour Patch Kids candy said it doesn’t plan to raise prices further in the U.S. if costs remain steady.",MDLZ
