,date,information,related
0,2022-09-29,"Headline: 10 companies at risk from an Apple iPhone slowdown, source:Yahoo, summary: These Apple suppliers are at risk if the tech giant pulls back on iPhone production, warns Bank of America.",NXPI
1,2022-09-30,"Headline: NXP Semiconductors: Betting On The Automotive Industry's Digital Revolution, source:SeekingAlpha, summary: NXP Semiconductor is a European chip maker with 50% revenue exposure to automotive industry. See why current weakness in NXPI stock is a buying opportunity.",NXPI
2,2022-10-01,"Headline: Dividend Champion, Contender, And Challenger Highlights: Week Of October 2, source:SeekingAlpha, summary: Weekly summary of dividend activity for Dividend Champions, Contenders, Challengers. Click here to see companies with upcoming ex-dividend dates and upcoming pay dates.",NXPI
3,2022-10-03,"Headline: Infineon Vs. NXPI: Assessing Growth Prospects Amid Energy And Slowdown Concerns, source:SeekingAlpha, summary: Infineon and NXPI have seen their share price plummet due to high energy prices affecting Europe and concerns about demand slumping. Click here to read more.",NXPI
4,2022-10-04,"Headline: Semiconductor Winners And Losers At The Start Of Q4 2022 (Technical Analysis), source:SeekingAlpha, summary: Semiconductor stocks remain in a downtrend heading into Q4, but that does not mean some did not do much better than others. Read more here.",NXPI
5,2022-10-05,"Headline: 7 Cheap Tech Stocks to Buy for Smart Contrarians, source:InvestorPlace, summary: At some point, innovation will rise again, making these discounted ideas incredibly enticing.",NXPI
6,2022-10-06,"Headline: 1 Monster Opportunity in the Global Chip Shortage, source:Yahoo, summary: The semiconductor industry is facing a challenging time in 2022, as a slump in demand for smartphones and personal computers led to a sharp decline in the sales of some major chipmakers.  Several automakers have pointed out of late that the chip crunch in the industry is here to stay.  Volkswagen, for instance, estimates that the auto industry could continue witnessing a chip crunch into 2023 and beyond., Headline: 7 Tech Stocks That Are Too Cheap to Ignore, source:Yahoo, summary: With the ugliness in the equities sector, astute investors may want to shift their focus to cheap tech stocks. Granted, among the major indices, the technology-centric Nasdaq Composite suffered the most thus far. On a year-to-date basis, it’s down nearly 30%. However, it also opens the door to significant discounts for patient market participants. That’s one angle. The other is that tech-driven companies offer some of the most groundbreaking innovations. Again, it’s not to take away from the pai",NXPI
7,2022-10-07,"Headline: Future of Smart Homes: Here's What You Need to Know, source:Nasdaq, summary: The future of smart homes is changing from geopolitical, social, and economic challenges disrupting the market. But, new technology is pushing back. Learn more.",NXPI
8,2022-10-11,"Headline: NXP Semiconductors price target lowered to $150 from $190 at Citi, source:Thefly.com, summary: Citi analyst Christopher ... NXPI, Headline: US Semiconductor Analyst Sees Analog Party Over, Cuts Estimates, source:Yahoo, summary: Citigroup analyst Christopher Danely maintained NXP Semiconductors N.V. (NASDAQ: NXPI) with a Neutral rating and reduced the price target from $190 to $150. Danely maintained Microchip Technology Inc (NASDAQ: MCHP) with a Neutral and slashed the price target from $72 to $62. His checks indicate the pushouts and cancellations that hit Analog Devices, Inc (NASDAQ: ADI) in July are impacting the rest of analog as lead times are declining. He believes weakening demand, especially in Europe, and high",NXPI
9,2022-10-12,"Headline: Here are the companies and sectors that are most vulnerable to the strong dollar this earnings season, source:MarketWatch, summary: Since roughly 40% of S&P 500 companies' sales are generated abroad, equity strategists expect the strong U.S. dollar will weigh heavily on corporate earnings...",NXPI
10,2022-10-13,"Headline: Analog Devices: A Strong Long-Term Growth Play, source:SeekingAlpha, summary: ADIâs long-term revenue will grow driven by increasing demand for analog semiconductor products. Read why long-term investors can buy ADI around current price., Headline: 10 Most Anticipated Tech Earnings to Watch, source:Yahoo, summary: In this article, we will take a look at the 10 most anticipated tech earnings to watch. If you want to see some more earnings on the list, go directly to 5 Most Anticipated Tech Earnings to Watch. Analysts have mixed expectations for the third-quarter earnings season. On average, they expect S&P 500 stocks to […]",NXPI
11,2022-10-18,"Headline: NXP Semiconductors downgraded to Neutral from Outperform at KGI Securities, source:Thefly.com, summary: KGI Securities analyst Ch... NXPI, Headline: NXP Semiconductors price target lowered to $175 from $195 at Deutsche Bank, source:Thefly.com, summary: Deutsche Bank analyst Ros... NXPI, Headline: NXP Semiconductors announces OrangeBox development platform, source:Thefly.com, summary: NXP Semiconductors announ... NXPI, Headline: NXP OrangeBox Unifies Automotive Wireless Connectivity into a Single Domain Controller to Simplify Development and Security, source:Yahoo, summary: NXP OrangeBox Unifies Automotive Wireless Connectivity into a Single Domain Controller to Simplify Development and Security NXP Semiconductors' OrangeBox automotive-grade development platform integrates a wide variety of NXP wireless technologies, from broadcast radio, Wi-Fi 6 and Bluetooth, to secure car access with Ultra-Wideband (UWB) and Bluetooth Low Energy (BLE), and 802.11p-based V2X. The OrangeBox is a single, security-enhanced, modular development platform that provides a unified interf, Headline: Boasting A 34% Return On Equity, Is NXP Semiconductors N.V. (NASDAQ:NXPI) A Top Quality Stock?, source:Yahoo, summary: Many investors are still learning about the various metrics that can be useful when analysing a stock. This article is..., Headline: NXP Semiconductors Announces Conference Call to Review Third Quarter 2022 Financial Results, source:Yahoo, summary: EINDHOVEN, The Netherlands, Oct. 18, 2022 (GLOBE NEWSWIRE) -- NXP Semiconductors N.V. (NASDAQ: NXPI) today announced it will release financial results for the third quarter 2022 after the close of normal trading on the NASDAQ Global Select Market on Monday, October 31, 2022. The company will host a conference call with the financial community on Tuesday, November 1, 2022 at 8:00 a.m. U.S. Eastern Daylight Time (EDT). Earnings Conference Call DetailsInterested parties may pre-register to obtain a",NXPI
12,2022-10-19,"Headline: Infineon Stock Is Dodging the Semiconductor Collapse. Chips for Cars Are Key., source:MarketWatch, summary: What sets the semiconductor maker apart is its exposure to autos, which has high demand for chips.",NXPI
13,2022-10-21,"Headline: Texas Instruments Should Be Well-Placed To Navigate 'Interesting Times' For The Semiconductor Sector, source:SeekingAlpha, summary: Demand for semiconductors will slow in 2023. Yet, see why I think Texas Instruments (TXN) is a name to consider in a market of weak sentiment toward chip names.",NXPI
14,2022-10-24,"Headline: NXP Semiconductors downgraded to Equal Weight from Overweight at Barclays, source:Thefly.com, summary: Barclays analyst Blayne C... NXPI, Headline: 3 Chip Stocks That Could Face a Reckoning, Says Analyst, source:MarketWatch, summary: Barclays analyst Blayne Curtis downgraded Analog Devices, NXP, and Silicon Laboratories. It's ""too early to pull the trigger across the board,"" he wrote., Headline: Taiwan Semi slumps after reported diss of U.S. chip efforts, analog-chip downgrades also drag on semiconductor sector, source:MarketWatch, summary: Chip stocks lagged the broader market Monday following a report that Taiwan's fabrication industry is pessimistic about U.S. efforts to lessen its reliance...",NXPI
15,2022-10-26,"Headline: NXP Matter™ Development Platforms Simplify and Accelerate Use of New Matter Standard, source:Yahoo, summary: NXP Matter Development Platforms Simplify and Accelerate Use of New Matter Standard NXP Semiconductors announced new Matter-enabled development platforms to simplify and accelerate the creation of Matter devices for smart homes and buildings. These new Matter development platforms enable designers to easily leverage the breadth of NXP’s portfolio across processing, connectivity and security solutions to create a wide variety of IoT devices ranging from battery-operated devices like sensors and a, Headline: What's in Store for NXP Semiconductors' (NXPI) Q3 Earnings?, source:Yahoo, summary: NXP Semiconductors' (NXPI) Q3 results are likely to reflect gains from robust products, strong customer demand and growing design wins. However, supply-chain disturbances might have been a bane.",NXPI
16,2022-10-27,"Headline: NXP Semiconductors, GDLR collaborate on quantum computing technologies, source:Thefly.com, summary: NXP Semiconductors announ... NXPI, Headline: NXP and German Aerospace Center DLR Collaborate on Quantum Computing Technologies in Germany, source:Yahoo, summary: NXP and German Aerospace Center DLR Collaborate on Quantum Computing Technologies in Germany QUDORA Technologies_This picture shows a 3-inch wafer with microfabricated quantum processors based on trapped ion technology. Photo credits: QUDORA Technologies GmbH NXP will leverage its semiconductor expertise to help build ion trap-based quantum computers in collaboration with DLR and partnersNXP’s contributions include the hardware components required for integrating quantum computers in classical c",NXPI
17,2022-10-28,"Headline: Global company events calendar - next 7 days, source:Alliance News, summary: No summary, Headline: NEW YORK MARKET CLOSE: Stocks green as attention turns to Fed decision, source:Alliance News, summary: No summary",NXPI
18,2022-10-30,"Headline: Fed Meeting, Jobs Data, Uber and PayPal Earnings, and More to Watch this Week, source:MarketWatch, summary: The Federal Reserve is expected to raise interest rates by 0.75 points on Wednesday. Plus, jobs Friday and earnings from AMD, Pfizer, PayPal, Uber,..., Headline: Stocks Poised to Fall Monday, source:MarketWatch, summary: The Federal Open Market Committee on Wednesday is widely expected to lift its target rate by three-quarters of a percentage point for a fourth straight time...., Headline: GLOBAL BRIEFING: Russia halts grain deal after Black Sea attack, source:Alliance News, summary: No summary, Headline: NXP Semiconductors reports Q3 EPS $2.79, consensus $3.63, source:Thefly.com, summary: Reports Q3 revenue $3.45B... NXPI",NXPI
19,2022-10-31,"Headline: Earnings Exchange: NXPI, UBER & PFE, source:CNBC, summary: Jeff Kilburg, KKM Financial CEO, joins ‘The Exchange’ to discuss three stocks ahead of earnings: NXP Semiconductors, Uber and Pfizer., Headline: NXPI beats on revenue, auto and industrial sectors continue to be resilient, source:CNBC, summary: CNBC's Kristina Partsinevelos joins 'Closing Bell: Overtime' to report on NXP Semi's earnings report., Headline: NXP: Q3 Earnings Snapshot, source:Associated Press, The, summary: No summary, Headline: NXP Semiconductors earnings climb but ""cautious"" amid uncertainty, source:Alliance News, summary: No summary, Headline: Cerity's Jim Lebenthal weighs in on NXP earnings, source:CNBC, summary: Jim Lebenthal, Cerity Partners, joins 'Closing Bell: Overtime' to discuss NXP Semi's earnings report., Headline: NXP Semiconductors Reports Third Quarter 2022 Results, source:Yahoo, summary: EINDHOVEN, The Netherlands, Oct. 31, 2022 (GLOBE NEWSWIRE) -- NXP Semiconductors N.V. (NASDAQ: NXPI) today reported financial results for the third quarter, ended October 2, 2022. “NXP delivered quarterly revenue of $3.45 billion, an increase of 20 percent year-on-year and above the mid-point of our guidance range. Overall in the third quarter, we performed very well; however, we were impacted by the weakening macro-environment in our consumer-exposed IoT business. At the same time, demand in bo, Headline: NXP Semiconductors (NXPI) Q3 Earnings and Revenues Beat Estimates, source:Yahoo, summary: NXP (NXPI) delivered earnings and revenue surprises of 36.07% and 0.55%, respectively, for the quarter ended September 2022. Do the numbers hold clues to what lies ahead for the stock?, Headline: GLOBAL BRIEFING: China manufacturing continues to contract in October, source:Alliance News, summary: No summary, Headline: NXP Semiconductors (NXPI) Gets a Buy from Needham, source:TipRanks, summary: Needham analyst Rajvindra Gill reiterated a Buy rating on NXP Semiconductors (NXPI &#8211; Research Report) today and set a price target of $200.00. The company&#82...",NXPI
20,2022-11-01,"Headline: Analysts Are Bullish on These Technology Stocks: NXP Semiconductors (NXPI), Wix (WIX), source:TipRanks, summary: There&#8217;s a lot to be optimistic about in the Technology sector as 2 analysts just weighed in on NXP Semiconductors (<span class='tr-stock-ticker' style='color:..., Headline: NXP Semiconductors N.V. (NXPI) Q3 2022 Earnings Call Transcript, source:SeekingAlpha, summary: NXP Semiconductors N.V. (NASDAQ:NASDAQ:NXPI) Q3 2022 Earnings Conference Call November 01, 2022 08:00 AM ET Company Participants Jeff Palmer - Senior Vice President, Investor Relations Kurt..., Headline: NXP Semiconductors N.V. 2022 Q3 - Results - Earnings Call Presentation, source:SeekingAlpha, summary: The following slide deck was published by NXP Semiconductors N.V., Headline: NXP Semiconductors (NXPI) Q3 2022 Earnings Call Transcript, source:Yahoo, summary: Image source: The Motley Fool.  NXP Semiconductors (NASDAQ: NXPI)Q3 2022 Earnings CallNov 01, 2022, 8:00 a.m. ETContents:  Prepared Remarks Questions and Answers Call Participants  Prepared Remarks:  OperatorHello., Headline: NXP Semiconductors (NXPI) Q3 Earnings Beat, Revenues Rise Y/Y, source:Yahoo, summary: NXP Semiconductors' (NXPI) third-quarter 2022 results reflect strong performance across all end markets., Headline: NXP Semiconductors N.V.'s (NASDAQ:NXPI) Intrinsic Value Is Potentially 99% Above Its Share Price, source:Yahoo, summary: Today we'll do a simple run through of a valuation method used to estimate the attractiveness of NXP Semiconductors..., Headline: NXP Semiconductors: Riding Automotive Higher, source:SeekingAlpha, summary: NXP Semi reported another impressive quarter with revenue up 21%. See why we think NXPI stock isn't accurately priced for the opportunity ahead in Automotive.",NXPI
21,2022-11-02,"Headline: NXP Semiconductors price target lowered to $175 from $200 at Susquehanna, source:Thefly.com, summary: Susquehanna analyst Chris... NXPI, Headline: Analysts Offer Insights on Technology Companies: NXP Semiconductors (NXPI) and SPI Energy Co (SPI), source:TipRanks, summary: Analysts have been eager to weigh in on the Technology sector with new ratings on NXP Semiconductors (<span class='tr-stock-ticker' style='color:blue; font-weight:b..., Headline: Analysts’ Top Technology Picks: Gartner (IT), NXP Semiconductors (NXPI), source:TipRanks, summary: Analysts fell to the sidelines weighing in on Gartner (<a href='https://www.tipranks.com/stocks/i..., Headline: Analysts` Top Technology Picks: Gartner (IT), NXP Semiconductors (NXPI), source:TipRanks, summary: No summary",NXPI
22,2022-11-03,"Headline: NXP Semiconductors (NXPI): New Buy Recommendation for This Technology Giant, source:TipRanks, summary: No summary, Headline: NXP Semiconductors Offers A Nice House In A Sketchier Neighborhood, source:SeekingAlpha, summary: NXP Semiconductors broke its beat-and-raise streak, as weaker demand for consumer-driven product categories drives a lower outlook. Click here to read more., Headline: Global semiconductors sales drop 3% in Q3 2022, source:Seeking Alpha, summary: No summary, Headline: Advanced Micro Devices, Intel, Nvidia lead chips higher to end brutal week for tech, source:Seeking Alpha, summary: No summary",NXPI
23,2022-11-04,"Headline: Microchip Technology Standing Out As The Cycle Turns, source:SeekingAlpha, summary: Microchip Technology's fiscal Q2 results were similar to many peers with strong YOY revenue growth and margins, but guidance for sequential growth stood out. Read more here.",NXPI
24,2022-11-06,"Headline: indie Semiconductor: Small AutoTech Player With Multiple Growth Tailwinds, source:SeekingAlpha, summary: indie Semiconductor has a long runway for growth and will likely turn profitable in the later half of 2023. See why I'm bullish on INDI stock., Headline: How To Balance The Current Slowdown With The Certainty Of Future Growth, source:SeekingAlpha, summary: The Fed is slowing the economy, and perhaps the economy can have a soft landing. Read why I have been diversifying my portfolio to include energy, healthcare, and financials.",NXPI
25,2022-11-08,"Headline: NXP Semiconductors (NXPI) Crossed Above the 50-Day Moving Average: What That Means for Investors, source:Yahoo, summary: Should investors be excited or worried when a stock crosses above the 50-Day simple moving average?, Headline: Semiconductor stocks fall with Nvidia, AMD leading decline as Intel unveils new Xeon chips, source:Seeking Alpha, summary: No summary",NXPI
26,2022-11-09,"Headline: Tracking Ken Fisher`s Fisher Asset Management Portfolio - Q3 2022 Update, source:Seeking Alpha, summary: No summary, Headline: Tracking Ken Fisher's Fisher Asset Management Portfolio - Q3 2022 Update, source:SeekingAlpha, summary: Fisherâs 13F portfolio value decreased from ~$141B to ~$133B in Q3 2022. Read more to see Fisher Asset Management's holdings and trades for Q3 2022.",NXPI
27,2022-11-10,"Headline: Taiwan Semiconductor surges as foundry giant says October sales rise 56%; chip stocks rise, source:Seeking Alpha, summary: No summary",NXPI
28,2022-11-11,"Headline: Austin ISD to vote on NXP Semiconductor's $100M tax break, source:Yahoo, summary: The Netherlands-based semiconductor manufacturer is seeking millions in property tax abatements as it plans to make more than $2 billion investment into its local operations.",NXPI
29,2022-11-13,"Headline: NXP Semiconductors (NXPI) Shares Cross 2% Yield Mark, source:Dividend Channel, summary: No summary",NXPI
30,2022-11-14,"Headline: New NXP Analog Front-End Enables the Software-Defined Factory, source:Yahoo, summary: New NXP Analog Front-End Enables the Software-Defined Factory NXP Semiconductors announced its new NXP analog front-end (N-AFE) family for high-precision data acquisition and condition monitoring systems for factory automation. Designed as software-configurable universal analog input devices, the new N-AFE family helps enable the software-defined factory, making it easier for operators to configure a smart factory and adjust settings based on shifting market needs. Industry’s most flexible analo, Headline: Top 15 IoT Companies in the World, source:Yahoo, summary: In this piece, we will take a look at the top 15 IoT companies in the world. For more companies, take a look at Top 5 IoT Companies in the World. Advances in semiconductor and industrial engineering have enabled firms to squeeze vast amounts of computing power into a small form factor. Initially, it was the […], Headline: Top European chip companies seek stability amid US-China dispute, source:Yahoo, summary: Top European chipmakers say they are seeking stability for their businesses in China as Washington’s export controls further complicate global supply chains operations.  Chief executives of STMicroelectronics, Infineon, and NXP Semiconductors on Monday said that while they are in compliance with Washington’s export restrictions against China’s semiconductor sector, they have no plans to halt their operations in the Asian country, the world’s second-largest economy., Headline: NXP Semiconductors initiated with a Neutral at Credit Suisse, source:Thefly.com, summary: No summary",NXPI
31,2022-11-15,"Headline: NXP Introduces High-Performance S32K39 Series MCUs for Modern Electrification Applications, source:Yahoo, summary: NXP Introduces High-Performance S32K39 Series MCUs for Modern Electrification Applications NXP Semiconductors today announced a new S32K39 series of automotive microcontrollers (MCUs) optimized for electric vehicle (EV) control applications. Addresses new electric vehicle (EV) traction inverter control needs with compelling combination of performance, integration, networking, security and functional safetySupports remote smart actuation applications using Time-Sensitive Networking (TSN) Ethernet",NXPI
32,2022-11-16,"Headline: NXP Semiconductors to Present at Upcoming Investor Conferences, source:Yahoo, summary: EINDHOVEN, The Netherlands, Nov. 16, 2022 (GLOBE NEWSWIRE) -- NXP Semiconductors N.V. (NASDAQ: NXPI) today announced participation at the following investor events: Credit Suisse Technology Conference, on November 29, 2022 in Scottsdale, AZWells Fargo Technology, Media and Telecom Summit, on November 30, 2022 in Las Vegas, NVNASDAQ Investor Conference, on December 6, 2022 in London, UK Interested parties from the financial community can listen to the live audio webcasts of the events from the NX, Headline: NXP Semiconductors (NXPI) Just Reclaimed the 200-Day Moving Average, source:Yahoo, summary: Good things could be on the horizon when a stock surpasses the 200-day simple moving average. How should investors react?, Headline: NXP Semiconductors Announces Quarterly Dividend, source:Yahoo, summary: EINDHOVEN, The Netherlands, Nov. 16, 2022 (GLOBE NEWSWIRE) -- As part of its ongoing capital return program, NXP Semiconductors N.V. (NASDAQ: NXPI) today announced that its board of directors has approved the payment of an interim dividend. The actions are based on the continued and significant strength of the NXP capital structure, and the board’s confidence in the company’s ability to drive long-term growth and strong cash flow. The board of directors has approved the payment of an interim div",NXPI
33,2022-11-17,"Headline: NXP Semiconductors declares $0.845 dividend, source:Seeking Alpha, summary: No summary, Headline: If You Invested $1000 in NXP Semiconductors a Decade Ago, This is How Much It'd Be Worth Now, source:Yahoo, summary: Holding on to popular or trending stocks for the long-term can make your portfolio a winner., Headline: Ambarella: Interesting On Dips, source:SeekingAlpha, summary: Ambarella has fallen 70%, but the valuation multiple isn't crazy cheap yet.",NXPI
34,2022-11-18,"Headline: Decision on NXP's Chapter 313 incentives in Austin coming down to the wire, source:Yahoo, summary: NXP Semiconductors NV continues to wait for a decision on tax abatements for a possible multibillion-dollar expansion in Austin. The controversial Chapter 313 program ends this year, so companies have just a little time remaining to secure the tax breaks.",NXPI
35,2022-11-22,"Headline: Analog Devices leads semis higher ahead of key economic reports, source:Seeking Alpha, summary: No summary",NXPI
36,2022-11-23,"Headline: SMH, SOXQ: Since Macro Trumps Micro, Size Doesn`t Matter, source:Seeking Alpha, summary: No summary, Headline: SMH, SOXQ: Since Macro Trumps Micro, Size Doesn't Matter, source:SeekingAlpha, summary: Between SMH & SOXQ, it doesn't look like there's clear winner. We're big believers in ""Macro trumps Micro"" if you get theme/timing right - exact instrument is less important. Read more here., Headline: NXPI January 2023 Options Begin Trading, source:Stock Options Channel, summary: No summary",NXPI
37,2022-11-25,"Headline: 15 Best Self Driving Car Stocks To Buy Now, source:Yahoo, summary: In this article, we will discuss the 15 Best Self Driving Car Stocks To Buy Now. You can skip our detailed analysis of the autonomous car industry and go directly to the 5 Best Self Driving Car Stocks To Buy Now. While automation was a niche technology almost exclusive to the manufacturing side in the previous […]",NXPI
38,2022-11-28,"Headline: Semiconductor revenue growth expected to dip in 2023, source:Seeking Alpha, summary: No summary",NXPI
39,2022-11-29,"Headline: Semiconductor market expected to grow 4.4% in 2022; and drop 4.1% in 2023, source:Seeking Alpha, summary: No summary, Headline: NXP Semiconductors N.V. (NXPI) Credit Suisse 26th Annual Technology Conference (Transcript), source:SeekingAlpha, summary: NXP Semiconductors N.V. (NASDAQ:NASDAQ:NXPI) Credit Suisse 26th Annual Technology Conference Call November 29, 2022 10:15 ET Company Participants Kurt Sievers - Chief Executive Officer Bill..., Headline: NXP Foundation Commits $250,000 to Advance Engineering Education at  Austin Community College District, source:Yahoo, summary: AUSTIN, Texas, Nov. 29, 2022 (GLOBE NEWSWIRE) -- The NXP Foundation, the nonprofit organization associated with NXP Semiconductors (NASDAQ:NXPI), today announced a $250,000 donation to the Austin Community College District (ACC) Foundation in support of the school’s Engineering Technology and Advanced Manufacturing Program. Representatives from the NXP Foundation presented a check to the ACC Board of Trustees at a reception on Tuesday, November 29, 2022. The donation, which includes scholarship, Headline: IN BRIEF: NXP Foundation makes donation to Austin Community College, source:Alliance News, summary: No summary",NXPI
