,date,information,related
72,2023-02-01,"Headline: NXP Semiconductors price target raised to $180 from $150 at Citi, source:Thefly.com, summary: No summary, Headline: NXP Semiconductors price target raised to $205 from $195 at Credit Suisse, source:Thefly.com, summary: No summary, Headline: NXP Semiconductors price target raised to $168 from $160 at Stifel, source:Thefly.com, summary: No summary, Headline: NXP Semiconductors price target raised to $210 from $200 at Cowen, source:Thefly.com, summary: No summary, Headline: NXP Semiconductors price target lowered to $170 from $175 at Susquehanna, source:Thefly.com, summary: No summary, Headline: NXP Semiconductors Reaches Analyst Target Price, source:ETF Channel, summary: No summary, Headline: NXP Semiconductors price target raised to $235 from $200 at Needham, source:Thefly.com, summary: No summary, Headline: NXP Semiconductors price target raised to $180 from $160 at BMO Capital, source:Thefly.com, summary: No summary, Headline: Stifel Nicolaus Keeps Their Hold Rating on NXP Semiconductors (NXPI), source:TipRanks, summary: No summary, Headline: Analysts Offer Insights on Technology Companies: L3Harris Technologies (LHX), NXP Semiconductors (NXPI) and Western Digital (WDC), source:TipRanks, summary: No summary, Headline: BMO Capital Issues a Hold Rating on NXP Semiconductors (NXPI), source:TipRanks, summary: No summary, Headline: Bank of America Securities Sticks to Its Buy Rating for NXP Semiconductors (NXPI), source:TipRanks, summary: No summary, Headline: Analysts` Top Technology Picks: Corning (GLW), Kratos Defense (KTOS), source:TipRanks, summary: No summary, Headline: NXP Semiconductors price target raised to $200 from $185 at Deutsche Bank, source:Thefly.com, summary: No summary, Headline: 7 Sorry Semiconductor Stocks to Sell in February Before It’s Too Late, source:Yahoo, summary: Semiconductor stocks were among the most battered names in 2022. A supply glut coupled with slowing sales of personal computers, smartphones and other devices conspired to drag the stocks of nearly all semiconductor and microchip companies lower. Even leading semiconductor companies such as Nvidia (NASDAQ:NVDA) were not spared from the carnage. The PHLX Semiconductor Sector index (NASDAQ:SOX), which is comprised of 30 top semiconductor companies, is down 19% from a year ago. And that’s after pos, Headline: 7 Sorry Semiconductor Stocks to Sell in February Before It`s Too Late, source:InvestorPlace, summary: No summary, Headline: Analysts Offer Insights on Technology Companies: CommVault Systems (CVLT), Mercury Systems (MRCY) and NXP Semiconductors (NXPI), source:TipRanks, summary: No summary",NXPI
73,2023-02-02,"Headline: NXP Semiconductors Full Year 2022 Earnings: In Line With Expectations, source:Yahoo, summary: NXP Semiconductors ( NASDAQ:NXPI ) Full Year 2022 Results Key Financial Results Revenue: US$13.2b (up 19% from FY..., Headline: FOCUS-As Tesla ignites an EV price war, suppliers brace for Musk seeking givebacks, source:Yahoo, summary: Tesla Inc suppliers are bracing for pressure from Chief Executive Elon Musk and his team to cut their prices further after the electric car leader aggressively slashed vehicle prices in a slowing economy, industry officials who work with the automaker and its suppliers said.  The suppliers saw as ominous last month's comments by Tesla Chief Financial Officer Zach Kirkhorn that the carmaker was ""attacking every other area of cost"" including the supply chain, and would work closely with suppliers.  During Tesla's earnings conference call last week, Musk said a recession could lead to ""meaningful decreases"" in almost all its input costs., Headline: NXP Semiconductors N.V. (NASDAQ:NXPI) Q4 2022 Earnings Call Transcript, source:Yahoo, summary: NXP Semiconductors N.V. (NASDAQ:NXPI) Q4 2022 Earnings Call Transcript January 31, 2023 Operator: Hello. Thank you for standing by, and welcome to the NXP Fourth Quarter 2022 Earnings Conference Call. At this time, all participants are in a listen-only mode. After the prepared remarks’, we will conduct the question-and-answer session and instructions will be given […]",NXPI
74,2023-02-03,"Headline: NXP Semiconductors' (NASDAQ:NXPI) Shareholders Will Receive A Bigger Dividend Than Last Year, source:Yahoo, summary: NXP Semiconductors N.V.'s ( NASDAQ:NXPI ) periodic dividend will be increasing on the 5th of April to $1.01, with..., Headline: NXP Semiconductor Stock Falls, but the 2023 Outlook for EVs and Auto Tech Remains Strong, source:Yahoo, summary: It's becoming increasingly clear that the automotive industry will be the target of massive amounts of investment in the coming decade, and well-positioned investors could profit.  Given this assumption, NXP Semiconductors (NASDAQ: NXPI) is a top stock to watch right now.  The company issued some subdued guidance for 2023, but shares could be a timely purchase this year for investors eyeing the long-term potential of auto technology., Headline: Watch These 5 Stocks That Recently Hiked Their Dividends, source:Yahoo, summary: Dividend-paying stocks should be in demand as investors will try to safeguard their portfolios. Five such stocks are: HCA, BAH, GATX, NXPI and MSCI.",NXPI
75,2023-02-04,"Headline: Dividend Champion, Contender, And Challenger Highlights: Week Of February 5, source:SeekingAlpha, summary: Dividend Champions list is monthly compilation of companies that consistently increased annual dividend payouts. Check out the full report of the week of February 5.",NXPI
76,2023-02-06,"Headline: The Zacks Analyst Blog Highlights HCA Healthcare, Booz Allen Hamilton, GATX, NXP Semiconductors and MSCI, source:Yahoo, summary: HCA Healthcare, Booz Allen Hamilton, GATX, NXP Semiconductors and MSCI are included in this Analyst Blog., Headline: Smarter Cars Drive Demand for This Chip Company, source:Yahoo, summary: In today's video, Motley Fool contributors Jose Najarro, Nick Rossolillo, and Billy Duberstein discuss NXP Semiconductors (NASDAQ: NXPI), its latest earnings report, and why investors who want exposure to the automotive industry should keep an eye on this company.",NXPI
77,2023-02-07,"Headline: Skyworks surge leads mixed chip sector ahead of Microsoft AI event, source:Seeking Alpha, summary: No summary",NXPI
78,2023-02-08,"Headline: Differentiated Exposures Still Serving Microchip Technology Well, source:SeekingAlpha, summary: Microchip is well-leveraged to markets like auto, aero, industrial MCUs and FPGAs where there's comparatively less competition. Read my analysis of MCHP stock.",NXPI
79,2023-02-11,"Headline: Silicon Labs Impresses With Better Results And Guidance Despite Weakness In Consumer IoT, source:SeekingAlpha, summary: Despite weakness in consumer smart home demand, Silicon Labs managed a beat-and-raise quarter with sequential declines limited to mid single digits. Read more here on SLAB., Headline: Top 5 4th Quarter Trades of SKBA CAPITAL MANAGEMENT LLC, source:GuruFocus, summary: No summary",NXPI
80,2023-02-14,"Headline: Interesting NXPI Put And Call Options For June 2024, source:Stock Options Channel, summary: No summary",NXPI
81,2023-02-15,"Headline: Analog Devices strong Q1 results, guidance lead analog chips higher, source:Seeking Alpha, summary: No summary, Headline: RYT: Technology Dashboard For February, source:SeekingAlpha, summary: All technology industries are overvalued relative to 11-year averages. Read more to see fast facts on RYT, an equal-weight technology ETF., Headline: Semiconductor stocks struggle despite Analog Devices strength, source:Seeking Alpha, summary: No summary",NXPI
82,2023-02-16,"Headline: NXP Semiconductors Already Looking Past A Brief Slowdown In The Business, source:SeekingAlpha, summary: NXP exceeded expectations for Q4, but did guide lower on pressures in consumer-facing businesses. See why I'm bullish on NXPI stock., Headline: Synaptics Shares Have Snapped Back In Anticipation That The Worst Is In Sight, source:Seeking Alpha, summary: No summary",NXPI
83,2023-02-19,"Headline: NXP Semiconductors: Strong Q4 Supports Bullish Thesis, source:SeekingAlpha, summary: On the backdrop of a strong Q4 report, I am confident to reiterate my bullish thesis on NXP Semiconductors. Click here to see our take on NXPI stock.",NXPI
84,2023-02-21,"Headline: 12 High Growth Semiconductor Stocks that are Profitable, source:Yahoo, summary: In this piece, we will take a look at the 12 high growth semiconductor stocks that are profitable. For more semiconductor stocks, head on over to 5 High Growth Semiconductor Stocks that are Profitable. The semiconductor industry is the backbone of the technological world. This is simply due to the principles of computer science, as […], Headline: Intel leads chips lower as Morgan Stanley cuts PC estimates again, source:Seeking Alpha, summary: No summary, Headline: There's Been No Shortage Of Growth Recently For NXP Semiconductors' (NASDAQ:NXPI) Returns On Capital, source:Yahoo, summary: To find a multi-bagger stock, what are the underlying trends we should look for in a business? One common approach is...",NXPI
85,2023-02-22,"Headline: Chips edge higher as Nvidia`s strong Q4, guidance buoys sentiment, source:Seeking Alpha, summary: No summary",NXPI
86,2023-02-28,"Headline: NXP Semiconductors will offer Qnovo`s battery management solution for EVs, source:Thefly.com, summary: No summary, Headline: Qnovo and NXP join hands for better battery performance, source:Seeking Alpha, summary: No summary, Headline: Qnovo and NXP Collaborate to Accelerate Electric Vehicle Battery Performance, Range, and Safety, source:Yahoo, summary: Qnovo, the market leader in e-mobility battery management software, today announced a collaboration with NXP® Semiconductors (NASDAQ: NXPI), a world leader in secure connectivity solutions for embedded applications. NXP will offer Qnovo's new innovation for electrified mobility, SpectralX©, in its e-mobility enablement solutions for electric vehicles (EV) in 2023. SpectralX is intelligent battery management system (BMS) software that uses predictive analytics to improve battery performance, rang, Headline: Monolithic Power Systems: The Stock Is Going In Circles, source:SeekingAlpha, summary: In many ways, FY2022 was an outstanding year for Monolithic Power Systems with many new records set. See why staying on hold MPWR stock is the way to go.",NXPI
87,2023-03-01,"Headline: NXP (NXPI) Down 3.2% Since Last Earnings Report: Can It Rebound?, source:Yahoo, summary: NXP (NXPI) reported earnings 30 days ago. What's next for the stock? We take a look at earnings estimates for some clues., Headline: NXP Stock May Be Setting Up For Breakout; Profits Sizzle, source:Yahoo, summary: NXP Semiconductors shows improving price performance, earning an upgrade to its IBD Relative Strength Rating",NXPI
88,2023-03-02,"Headline: NXP believed to have won NFC chip for Apple headset, says OTR Global, source:Thefly.com, summary: No summary, Headline: Interesting NXPI Put And Call Options For April 14th, source:Stock Options Channel, summary: No summary, Headline: Stocks that thrive and struggle the most as rates rise - BofA, source:Seeking Alpha, summary: No summary, Headline: March`s 17 Ideal 2023 Barrons/Bloomberg Dividend Dogs, source:Seeking Alpha, summary: No summary, Headline: March's 17 Ideal 2023 Barrons/Bloomberg Dividend Dogs, source:SeekingAlpha, summary: Ten top 2023 Bar/BI-projected dividend yields ranged from 4.78% to 7.94%. Click here for a detailed analysis.",NXPI
89,2023-03-05,"Headline: Could Auto Demand be a Game Changer for These 3 Chip Stocks?, source:TipRanks, summary: No summary",NXPI
90,2023-03-06,"Headline: AMD buck trends as chips slump after Powell testimony, source:Seeking Alpha, summary: No summary",NXPI
91,2023-03-07,"Headline: Infineon Looks Like A Classic `Short Term Vs. Long Term` Story, source:Seeking Alpha, summary: No summary, Headline: AMD, Nvidia buck trend as chips mixed after Powell testimony, source:Seeking Alpha, summary: No summary, Headline: NXP Semiconductors N.V. (NXPI) Morgan Stanley Technology, Media & Telecom Conference (Transcript), source:SeekingAlpha, summary: NXP Semiconductors N.V. (NASDAQ:NASDAQ:NXPI) Morgan Stanley Technology, Media & Telecom Conference March 7, 2023 11:00 AM ETCompany ParticipantsJeff Palmer - SVP, IRConference Call..., Headline: Infineon Looks Like A Classic 'Short Term Vs. Long Term' Story, source:SeekingAlpha, summary: Infineon is looking at elevated near-term risks as key end-markets correct. Read why long-term outlook for advanced power, MCUs, and sensors is very attractive.",NXPI
92,2023-03-08,"Headline: Early notable gainers among liquid option names on March 8th, source:Thefly.com, summary: No summary, Headline: AMD leads chip stocks as sector firms up after Powell testimony, source:Seeking Alpha, summary: No summary, Headline: Nvidia, Qualcomm leads chips lower as sector sees increased political attention, source:Seeking Alpha, summary: No summary",NXPI
93,2023-03-09,"Headline: NXP Semiconductors N.V. (NASDAQ:NXPI) Looks Interesting, And It's About To Pay A Dividend, source:Yahoo, summary: Readers hoping to buy NXP Semiconductors N.V. ( NASDAQ:NXPI ) for its dividend will need to make their move shortly, as..., Headline: Intel leads semiconductors as sector sees increased political attention, source:Seeking Alpha, summary: No summary, Headline: Intel leads semiconductors higher as sector sees increased political attention, source:Seeking Alpha, summary: No summary, Headline: 37 Upcoming Dividend Increases, Including 2 Dividend Kings, source:SeekingAlpha, summary: All these stocks have at least 5 fiscal years of dividend growth history and come from the U.S. Dividend Champions List. Click here to see our exclusive list.",NXPI
94,2023-03-10,"Headline: Semiconductor sales dip 18.5% Y/Y in January, source:Seeking Alpha, summary: No summary, Headline: Option Trade On This Semiconductor Stock Can Make Money As It Goes Sideways, source:Yahoo, summary: As the semiconductor industry boosts the technology sectors, NXP Semiconductors, holds steady in the midst of volatile markets.  This gives us the opportunity to position a short iron condor that gives us upside and downside room that allows for the potential to deliver returns without full exposure to the market.  The IBD Stock Checkup shows the stock sitting with an IBD Composite Rating of 90., Headline: Renesas Electronics Finally Getting A Fairer Shake, But Not Yet Overvalued, source:SeekingAlpha, summary: Renesas exceeded sell-side expectations for Q4'22 earnings and Q1'23 guidance, sparking a major run in the share price. Read more here.",NXPI
95,2023-03-11,"Headline: Dividend Champion, Contender, And Challenger Highlights: Week Of March 12, source:SeekingAlpha, summary: A weekly summary of dividend activity for Dividend Champions, Contenders, and Challengers. Companies which changed their dividends. Companies with upcoming ex-dividend dates.",NXPI
96,2023-03-13,"Headline: Nvidia, Microchip, AMD `most popular` chip stocks to own: Citi, source:Seeking Alpha, summary: No summary, Headline: 20 Most Valuable European Tech Companies In The World, source:Yahoo, summary: In this article, we will discuss the 20 Most Valuable European Tech Companies In The World. You can skip our industry overview and go directly to the 5 Most Valuable European Tech Companies In The World. According to a Deloitte Report published in 2022, the technology industry in Europe recorded sales of €1.5 trillion, accounting for more than […], Headline: SOXX: Semicon Industry 2023 -��Full Steam Ahead, source:Seeking Alpha, summary: No summary",NXPI
97,2023-03-14,"Headline: SOXX: Semicon Industry 2023 - Full Steam Ahead, source:SeekingAlpha, summary: We expect semiconductor chipmakers' growth to recover by 19% on average. Click here to read our take on what it could mean for SOXX ETF.",NXPI
98,2023-03-17,"Headline: XNTK: Technology Dashboard For March, source:SeekingAlpha, summary: Semiconductors are the only technology industry with attractive value and quality scores. Find out why XNTK is a Hold.",NXPI
99,2023-03-21,"Headline: Nvidia, AMD stocks lead semiconductors higher as sector sinks after Fed decision, source:Seeking Alpha, summary: No summary",NXPI
100,2023-03-22,"Headline: Nvidia, AMD stocks lead semiconductors higher as sector awaits Fed decision, source:Seeking Alpha, summary: No summary",NXPI
101,2023-03-23,"Headline: Interesting NXPI Put And Call Options For May 5th, source:Stock Options Channel, summary: No summary",NXPI
102,2023-03-26,"Headline: ON Semiconductor slips on heavy volume as chips await Micron results, source:Seeking Alpha, summary: No summary",NXPI
103,2023-03-27,"Headline: ON Semiconductor leads chips lower as sector awaits Micron results, source:Seeking Alpha, summary: No summary, Headline: Is NXP Semiconductors N.V.'s (NASDAQ:NXPI) ROE Of 37% Impressive?, source:Yahoo, summary: One of the best investments we can make is in our own knowledge and skill set. With that in mind, this article will...",NXPI
104,2023-03-28,"Headline: Wells Fargo sees Infineon`s increased expectations as positive for NXP, others, source:Thefly.com, summary: No summary",NXPI
105,2023-03-30,"Headline: Interesting NXPI Put And Call Options For May 12th, source:Stock Options Channel, summary: No summary",NXPI
106,2023-03-31,"Headline: 7 Stocks Gearing Up for a Major Breakout, source:Yahoo, summary: The entire stock market is gearing up for a major breakout as investors are becoming convinced that the banking sector has stabilized and that the Federal Reserve is, at the very least, almost done hiking interest rates. Meanwhile, two critical sectors –housing and computer chips — are showing signs of recovery. Many investors are starting to focus on the economy’s strong fundamentals instead of quaking in fear about interest rate hikes. In this environment, there are many potential breakout sto",NXPI
107,2023-04-01,"Headline: Dividend Champion, Contender, And Challenger Highlights: Week Of April 2, source:SeekingAlpha, summary: Weekly summary of dividend activity for Dividend Champions, Contenders, Challengers. Read more to see the companies with upcoming ex-dividend dates.",NXPI
108,2023-04-03,"Headline: Micron leads semiconductors lower as China launches new cybersecurity review, source:Seeking Alpha, summary: No summary",NXPI
109,2023-04-04,"Headline: Semiconductors Winners And Losers Heading Into Q2 2023, source:SeekingAlpha, summary: Semiconductor stocks have outperformed thus far in 2023, probably a lot more than many had expected. Click here for a complete analysis.",NXPI
110,2023-04-05,"Headline: AMD, Nvidia lead chip declines as economic data spurs recession talk, source:Seeking Alpha, summary: No summary, Headline: NXP Reinforces Commitment to Environmental, Social and Governance Goals in Annual Corporate Sustainability Report, source:Yahoo, summary: EINDHOVEN, The Netherlands, April 05, 2023 (GLOBE NEWSWIRE) -- NXP Semiconductors N.V. (NASDAQ: NXPI) has published its annual Corporate Sustainability Report (CSR), highlighting its progress, accountability and ongoing commitment to further sustainable business practices. The report outlines the company’s year-over-year progress in reaching its short and long-term Environmental, Social, and Governance (ESG) goals. “Technology innovation is a key element in NXP’s DNA, driving positive change, su",NXPI
111,2023-04-06,"Headline: Micron leads chips higher as selling eases in holiday-shortened week, source:Seeking Alpha, summary: No summary",NXPI
112,2023-04-11,"Headline: Calculating The Fair Value Of NXP Semiconductors N.V. (NASDAQ:NXPI), source:Yahoo, summary: Key Insights The projected fair value for NXP Semiconductors is US$188 based on 2 Stage Free Cash Flow to Equity NXP..., Headline: Intel leads chips higher as CEO Gelsinger meets with China to discuss industry, source:Seeking Alpha, summary: No summary, Headline: Evercore's C.J. Muse names this semi as one investors will chase, source:CNBC, summary: C.J. Muse, Evercore ISI analyst, joins 'Closing Bell: Overtime' to discuss semis being a stocks picker’s paradise., Headline: 7 Blue-Chip Stocks That Are on Fire Sale Right Now, source:Yahoo, summary: Talking heads warn a recession is imminent in America. The majority of these people appear to either have academic backgrounds or be economists who advise large banks without actually making trading decisions themselves. But many of the country’s most successful investors — including multi-billionaires George Soros, Ken Griffin, Steve Cohen, and Warren Buffett — have been buying a high number of stocks in the last year. I’ve bet my money on the actions of the latter group, rather than the statem",NXPI
113,2023-04-13,"Headline: Selected Information Technology Stocks Ranked By Value, source:SeekingAlpha, summary: 24 highly rated Information Technology stocks were evaluated by means of a multi-factor value matrix. Click here for a detailed analysis.",NXPI
114,2023-04-16,"Headline: NXP Semiconductors, Wolfspeed top chip stocks heading into earnings, source:Seeking Alpha, summary: No summary",NXPI
115,2023-04-17,"Headline: NXP Semiconductors Announces Conference Call to Review First Quarter 2023 Financial Results, source:Yahoo, summary: EINDHOVEN, The Netherlands, April 17, 2023 (GLOBE NEWSWIRE) -- NXP Semiconductors N.V. (NASDAQ: NXPI) today announced it will release financial results for the first quarter 2023 after the close of normal trading on the NASDAQ Global Select Market on Monday, May 1, 2023. The company will host a conference call with the financial community on Tuesday, May 2, 2023 at 8:00 a.m. U.S. Eastern Daylight Time (EDT). Earnings Conference Call DetailsInterested parties may pre-register to obtain a user-spe",NXPI
116,2023-04-18,"Headline: PTF: Technology Dashboard For April, source:SeekingAlpha, summary: nan",NXPI
117,2023-04-19,"Headline: NXP CEO Sievers applauds EU Chips Act, hopes governments coordinate, source:Reuters, summary: The Chief Executive of Dutch-headquartered computer chip maker NXP Semiconductors on Wednesday applauded the passage of the EU Chips Act this week and said he hopes the U.S. and Europe will cooperate on how they distribute subsidies., Headline: NXP CEO applauds EU Chips Act, seeks clarity on China restrictions, source:Yahoo, summary: ENNISKERRY, Ireland (Reuters) -The chief executive of Dutch-headquartered computer chip maker NXP Semiconductors on Wednesday applauded the passage of the EU Chips Act this week, but said the industry could use more clarity on export restrictions to China.  Kurt Sievers said his company, which makes chips for the automotive industry as well for 5G telephone base stations, had been hit by successive rounds of U.S. export restrictions on China's Huawei., Headline: UPDATE 1-NXP CEO applauds EU Chips Act, seeks clarity on China restrictions, source:Yahoo, summary: The chief executive of Dutch-headquartered computer chip maker NXP Semiconductors on Wednesday applauded the passage of the EU Chips Act this week, but said the industry could use more clarity on export restrictions to China.  Kurt Sievers said his company, which makes chips for the automotive industry as well for 5G telephone base stations, had been hit by successive rounds of U.S. export restrictions on China's Huawei., Headline: 10 Growth Stocks Jim Cramer is Talking About, source:Yahoo, summary: In this article, we will take a look at the 10 growth stocks to Jim Cramer is talking about. If you want to explore similar stocks, you can also take a look at 5 Growth Stocks Jim Cramer is Talking About. “You Reach For Tech In A Slowdown” On March 30, Jim Cramer talked about […], Headline: ASML sinks after Q1 results as chips slip ahead of earnings season, source:Seeking Alpha, summary: No summary",NXPI
118,2023-04-20,"Headline: NXP Semiconductors Names New Senior Fellows, source:Yahoo, summary: Industry experts recognized for exceptional achievements in innovationEINDHOVEN, The Netherlands, April 20, 2023 (GLOBE NEWSWIRE) -- NXP Semiconductors N.V. (NASDAQ: NXPI) today announced the appointment of its newest NXP Senior Fellows. The appointment to NXP Senior Fellow is a distinction reserved for esteemed leaders who have significantly contributed to driving innovation across the company and the semiconductor industry. The new NXP Senior Fellows are: Dr. Ulrich Neffe, Austria: Recognized, Headline: NXP Semiconductors: Waiting For A Slight Correction, Then I`m In, source:Seeking Alpha, summary: No summary",NXPI
119,2023-04-21,"Headline: NXP Semiconductors: Waiting For A Slight Correction, Then I'm In, source:SeekingAlpha, summary: nan, Headline: Unusual Call Option Trade in NXP Semiconductors (NXPI)  Worth $141.37K, source:Fintel, summary: nan",NXPI
120,2023-04-24,"Headline: AMD, Intel lead chips lower as Q1 earnings gets set to move into high-gear, source:Seeking Alpha, summary: No summary",NXPI
121,2023-04-25,"Headline: Texas Instruments, AMD lead chip sell-off as investors await Q1 results, new products, source:Seeking Alpha, summary: No summary, Headline: NXP Semiconductors: Automotive Focus On ADAS And EV, source:SeekingAlpha, summary: NXP Semiconductors' product development for its largest segment, automotive (51% of revenue), are focused on ADAS and EV. Read why NXPI stock is a strong buy.",NXPI
122,2023-04-26,"Headline: AMD, Nvidia, Intel lead semis higher in wake of tepid results from TI, source:Seeking Alpha, summary: No summary, Headline: NXP Semiconductors (NXPI) Receives a Rating Update from a Top Analyst, source:TipRanks, summary: No summary",NXPI
