,date,information,related
113,2023-04-27,"Headline: Seagen reports Q1 EPS (93c), consensus (82c), source:Thefly.com, summary: No summary, Headline: Seattle Genetics: Q1 Earnings Snapshot, source:Associated Press, The, summary: No summary, Headline: Seagen Reports First Quarter 2023 Financial Results, source:Yahoo, summary: BOTHELL, Wash., April 27, 2023--Seagen Inc. (Nasdaq:SGEN) (Seagen or the Company) reported financial results today for the first quarter ended March 31, 2023. The Company also highlighted performance across its approved product portfolio, development accomplishments, and progress across its differentiated oncology pipeline of innovative ADCs and targeted therapies., Headline: Seattle Genetics (SGEN) Reports Q1 Loss, Lags Revenue Estimates, source:Yahoo, summary: Seattle Genetics (SGEN) delivered earnings and revenue surprises of -13.41% and 0.23%, respectively, for the quarter ended March 2023. Do the numbers hold clues to what lies ahead for the stock?, Headline: Seattle Genetics (SGEN) Q1 Earnings: How Key Metrics Compare to Wall Street Estimates, source:Yahoo, summary: While the top- and bottom-line numbers for Seattle Genetics (SGEN) give a sense of how the business performed in the quarter ended March 2023, it could be worth looking at how some of its key metrics compare to Wall Street estimates and year-ago values., Headline: Noteworthy Friday Option Activity: SGEN, CTLT, PTON, source:Stock Options Channel, summary: No summary",SGEN
114,2023-04-28,"Headline: Seagen price target raised to $229 from $157 at Stifel, source:Thefly.com, summary: No summary",SGEN
115,2023-04-29,"Headline: 16% of this Seagen Inc. (NASDAQ:SGEN) insider's holdings were sold in the last year, source:Yahoo, summary: Looking at Seagen Inc.'s ( NASDAQ:SGEN ) insider transactions over the last year, we can see that insiders were net..., Headline: 7 High-Yield Dividend Stocks to Buy and Hold Forever, source:InvestorPlace, summary: No summary",SGEN
116,2023-05-01,"Headline: RBC Capital Sticks to Its Buy Rating for Seagen (SGEN), source:TipRanks, summary: No summary, Headline: Seagen (SGEN) Gets a Hold from SVB Securities, source:TipRanks, summary: No summary",SGEN
117,2023-05-02,"Headline: Pfizer tops Q1 2023 forecasts as COVID franchise outperforms, source:Seeking Alpha, summary: No summary, Headline: Pfizer tops Q1 forecasts; vaccine sales slide as expected, source:Associated Press, The, summary: No summary, Headline: MindMed Sends Letter to Shareholders Highlighting Company’s Positive Momentum and Value-Enhancing Strategy, source:Business Wire, summary: No summary, Headline: Stifel Nicolaus Sticks to Their Hold Rating for Seagen (SGEN), source:TipRanks, summary: No summary, Headline: Pfizer Will Shift Focus to Dividends and Share Buybacks, Execs Say, source:MarketWatch, summary: The drugmaker has been on an M&A hot streak over the past couple of years.",SGEN
118,2023-05-03,"Headline: PRESS: Pfizer to begin selling Haleon interest within months - FT, source:Alliance News, summary: No summary, Headline: LONDON MARKET CLOSE: FTSE 100 in the green ahead of Fed rate decision, source:Alliance News, summary: No summary",SGEN
119,2023-05-07,"Headline: Noteworthy Monday Option Activity: SGEN, IRBT, ABNB, source:Stock Options Channel, summary: No summary",SGEN
120,2023-05-08,"Headline: Estimating The Intrinsic Value Of Seagen Inc. (NASDAQ:SGEN), source:Yahoo, summary: Key Insights Using the 2 Stage Free Cash Flow to Equity, Seagen fair value estimate is US$193 With US$200 share price...",SGEN
121,2023-05-10,"Headline: Oppenheimer upgrades Corbus Pharmaceuticals to Outperform with $22 target, source:Thefly.com, summary: No summary",SGEN
122,2023-05-11,"Headline: TOP NEWS: GSK intends to sell up to 240 million shares in Haleon, source:Alliance News, summary: No summary, Headline: Pfizer`s COVID-19 profits supporting development of cancer therapies - Reuters, source:Seeking Alpha, summary: No summary",SGEN
123,2023-05-12,"Headline: Seagen Inc. (NASDAQ:SGEN) is largely controlled by institutional shareholders who own 65% of the company, source:Yahoo, summary: Key Insights Significantly high institutional ownership implies Seagen's stock price is sensitive to their trading...",SGEN
124,2023-05-15,"Headline: Pfizer, Seagen filed with FTC, DOJ on Friday in regards to $43B deal, source:Seeking Alpha, summary: No summary, Headline: Pfizer launches debt offering for Seagen acquisition, source:Seeking Alpha, summary: No summary, Headline: FTC suit against Horizon deal may have chilling effect on biotech M&A, source:Seeking Alpha, summary: No summary, Headline: Video: Nasdaq 100 Movers: SGEN, AMD, source:Market News Video, summary: No summary, Headline: Noteworthy Tuesday Option Activity: SGEN, SBGI, MSTR, source:Stock Options Channel, summary: No summary, Headline: Horizon Therapeutics plunges as FTC lawsuit increases risk to Amgen deal (update), source:Seeking Alpha, summary: No summary",SGEN
125,2023-05-16,"Headline: Seagen, impacted by FTC Amgen/Horizon suit, closes down 6%, source:Seeking Alpha, summary: No summary, Headline: Seagen (SGEN) Receives a Hold from Berenberg Bank, source:TipRanks, summary: No summary, Headline: Horizon Therapeutics plunges as potential FTC lawsuit increases risk to Amgen deal, source:Seeking Alpha, summary: No summary, Headline: TIGR, APLS and LMFA among pre-market losers, source:Seeking Alpha, summary: No summary, Headline: What You Missed On Wall Street On Tuesday, source:Thefly.com, summary: No summary, Headline: Seagen, Prometheus Biosciences fall amid news of FTC planned block of Horizon/Amgen deal, source:Seeking Alpha, summary: No summary, Headline: Stocks making the biggest moves premarket: Home Depot, Capital One, Dish Network & more, source:CNBC, summary: These are the stocks posting the largest moves in premarket trading. , Headline: Horizon Therapeutics plunges as potential FTC lawsuit increases risk to Amgen deal (update), source:Seeking Alpha, summary: No summary, Headline: Seagen (SGEN) Stock Falls 6% After Director Sells Shares, source:InvestorPlace, summary: No summary, Headline: GILD Stock Price Predictions: Is Gilead Sciences Really Worth $100?, source:InvestorPlace, summary: No summary, Headline: Why Is Guardforce AI (GFAI) Stock Up Today?, source:InvestorPlace, summary: No summary, Headline: GDC Stock Alert: Why Is GD Culture Group Up 106% Today?, source:InvestorPlace, summary: No summary, Headline: Prometheus, Seagen slip after FTC sues to block Horizon acquisition, source:Thefly.com, summary: No summary, Headline: Seagen likely to stay `distanced` from deal price after FTC action, says Stifel, source:Thefly.com, summary: No summary, Headline: Stocks making the biggest moves midday: Horizon Therapeutics, Capital One, RH, Home Depot and more , source:CNBC, summary: These are the stocks posting the largest moves midday., Headline: Seagen (NASDAQ:SGEN) shareholders have earned a 29% CAGR over the last five years, source:Yahoo, summary: The most you can lose on any stock (assuming you don't use leverage) is 100% of your money. But when you pick a company..., Headline: FTC sues to block Amgen's $28B acquisition of Horizon Therapeutics, source:Yahoo, summary: The regulator said its decision ""sends a clear signal to the market"" about consolidation in the pharmaceutical market, though analysts expect the deal will still go through despite delays., Headline: Pfizer plans to raise $31 bln from debt offering to finance Seagen takeover, source:Reuters, summary: Pfizer Inc said on Tuesday it plans to raise $31 billion from a debt offering to finance its proposed acquisition of Seagen Inc. (Reporting by Kanjyik Ghosh in Bengaluru), Headline: Unusual Put Option Trade in Seagen (SGEN)  Worth $5,030.00K, source:Fintel, summary: nan, Headline: Pfizer plans $31 billion debt offering to fund Seagen takeover, source:Reuters, summary: Pfizer Inc said on Tuesday it plans to raise $31 billion from a debt offering to finance its proposed acquisition of Seagen Inc.",SGEN
126,2023-05-17,"Headline: Debt Ceiling Negotiations Turn a Corner. Why The Risk Isn’t Over Yet., source:MarketWatch, summary: Still no debt-ceiling deal as Biden shortens G-7 trip, UBS takes $35 billion gain from Credit Suisse takeover, Musk hints at two new vehicles and starts..., Headline: Pfizer Prices $31 Billion Debt Offering to Fund Seagen Acquisition, source:MarketWatch, summary: Pfizer's acquisition of cancer-focused biotech Seagen, announced in March, would be its biggest since 2009. The deal faces risks., Headline: Interesting SGEN Put And Call Options For August 18th, source:Stock Options Channel, summary: No summary, Headline: Pfizer to raise $31 billion in debt offering to fund Seagen acquisition, SEC filing shows, source:CNBC, summary: The debt offering by Pfizer to buy cancer drug maker Seagen comes as Apple, Merck and T-Mobile tap the U.S. bond market ahead of the debt ceiling standoff. , Headline: Pfizer to raise $31 billion for Seagen takeover in largest debt offering, source:Reuters, summary: Pfizer Inc is planning to raise $31 billion through its largest debt offering to finance its proposed acquisition of Seagen Inc, the drugmaker said late on Tuesday., Headline: Top 5 1st Quarter Trades of INTERNATIONAL BIOTECHNOLOGY TRUST PLC, source:GuruFocus, summary: No summary",SGEN
127,2023-05-18,"Headline: Pfizer: Ridiculous Selloff To A 2-Year Low, source:SeekingAlpha, summary: Pfizer hits a two-year low on COVID vaccines revenue pessimism, but valuation is attractive as sellers rushed out. Click here to read more on PFE stock., Headline: This Insider Just Sold Shares of Seagen Inc, source:GuruFocus, summary: No summary",SGEN
128,2023-05-19,"Headline: Should Investors Worry About Seagen Inc`s Insider Sells?, source:GuruFocus, summary: No summary",SGEN
129,2023-05-20,"Headline: Should Investors Worry About Seagen Inc's Insider Sells?, source:GuruFocus, summary: No summary",SGEN
130,2023-05-21,"Headline: Seagen Larger Than S&P 500 Component GE HealthCare Technologies, source:The Online Investor, summary: No summary",SGEN
131,2023-05-23,"Headline: SGEN, ACAD & BMEA Drove Baker Brothers Advisors' Q1 Returns as ASND and HZNP Were Culled, source:Fintel, summary: nan, Headline: 10 Health Care Stocks Whale Activity In Today's Session, source:Benzinga, summary: No summary, Headline: Notable Wednesday Option Activity: SGEN, RL, CRWD, source:Stock Options Channel, summary: No summary",SGEN
132,2023-05-25,"Headline: We're Not Worried About Seagen's (NASDAQ:SGEN) Cash Burn, source:Yahoo, summary: We can readily understand why investors are attracted to unprofitable companies. For example, biotech and mining..., Headline: Catalyst watch: C3.ai and Salesforce earnings, Knife River debut, Kenvue ratings & Faraday Future event, source:Seeking Alpha, summary: No summary",SGEN
133,2023-05-26,"Headline: Global company events calendar - next 7 days, source:Alliance News, summary: No summary",SGEN
134,2023-05-29,"Headline: Pfizer: Not Quite Dead Money Walking, source:SeekingAlpha, summary: Pfizer's success in the COVID-19 pandemic has unfortunately become a double-edged sword. Read more to see my analysis of PFE stock and why it is a Buy., Headline: Seagen shareholders approve acquisition by Pfizer, source:Thefly.com, summary: No summary, Headline: Seagen shareholders OK acquisition by Pfizer, source:Seeking Alpha, summary: No summary",SGEN
135,2023-05-30,"Headline: Top Merger Stocks Held By Fund Managers, Mid-Q2 2023, source:SeekingAlpha, summary: Merger arbitrage in mid-2023 faces regulatory hurdles, with agencies attempting to block deals across industries. Read more here., Headline: Seagen Shareholders Approve Pfizer's Acquisition Deal, source:MarketWatch, summary: By Sabela Ojea Seagen said Tuesday its shareholders voted in favor of Pfizer buying the company for $43 billion. The biotechnology cancer specialist..., Headline: Seagen Stockholders Approve Acquisition by Pfizer, source:Yahoo, summary: BOTHELL, Wash., May 30, 2023--Following a special meeting of its stockholders, Seagen Inc. (Nasdaq: SGEN) today announced that its stockholders voted to approve a proposal to adopt the previously announced merger agreement under which Pfizer will acquire Seagen for $229 per share in cash. More than 99% of the shares voted at the meeting, representing approximately 88% of the shares of Seagen common stock issued and outstanding as of the record date for the special meeting, were voted in favor of, Headline: GLOBAL BRIEFING: US debt bill clears first hurdle before vote, source:Alliance News, summary: No summary",SGEN
136,2023-06-01,"Headline: Tracking Baker Brothers Portfolio - Q1 2023 Update, source:SeekingAlpha, summary: Baker Brothers' 13F portfolio value increased from $16.65B to $18.38B. Click here to read the portfolio's full Q1 2023 update., Headline: Pfizer (NYSE:PFE) Secures FDA Approval for RSA Vaccine, source:TipRanks, summary: No summary, Headline: Pfizer Stock (NYSE:PFE) – New FDA Approval Could Stop Its Drop, source:TipRanks, summary: No summary",SGEN
137,2023-06-02,"Headline: 3 Undervalued Biotech Stocks to Buy Before They Blast Off, source:InvestorPlace, summary: No summary",SGEN
138,2023-06-04,"Headline: Wall Street Breakfast: The Week Ahead, source:SeekingAlpha, summary: Investors head into next week with the debt ceiling crisis resolved for the near term.",SGEN
139,2023-06-06,"Headline: Analysts’ Opinions Are Mixed on These Healthcare Stocks: Ultragenyx Pharmaceutical (RARE), Seagen (SGEN) and Moderna (MRNA), source:TipRanks, summary: No summary, Headline: Profit From The Pfizer Takeover Of Seagen, source:SeekingAlpha, summary: Pfizer is set to acquire Seagen for $43 billion, with the deal expected to close later this year or in early 2024, subject to regulatory approvals. Click here for a detailed analysis.",SGEN
140,2023-06-07,"Headline: Analysts Have Conflicting Sentiments on These Healthcare Companies: Seagen (SGEN), Keros Therapeutics (KROS) and Adaptimmune Therapeutics (ADAP), source:TipRanks, summary: No summary, Headline: If You Invested $1000 In This Stock 10 Years Ago, You Would Have $5,800 Today, source:Benzinga, summary: No summary",SGEN
141,2023-06-08,"Headline: Seagen gains as antitrust deadline for Pfizer purchase nears on Monday, source:Seeking Alpha, summary: No summary, Headline: Catalyst watch: AI talk from Salesforce and AMD, Shell event and Oracle earnings, source:Seeking Alpha, summary: No summary",SGEN
142,2023-06-10,"Headline: 5 Relatively Safe And Cheap Dividend Stocks To Invest In - June 2023, source:SeekingAlpha, summary: We go over our filtering process to select just five conservative DGI stocks from more than 7,500 companies that are traded on U.S. exchanges. Read more here.",SGEN
143,2023-06-12,"Headline: Interesting SGEN Put And Call Options For September 2024, source:Stock Options Channel, summary: No summary",SGEN
144,2023-06-13,"Headline: Seagen announces updated efficacy, safety results from Part C of Adcetris study, source:Thefly.com, summary: No summary, Headline: Seagen posts 93% complete remission for lymphoma therapy in Phase 2 trial, source:Seeking Alpha, summary: No summary, Headline: Seagen Announces ADCETRIS® (brentuximab vedotin) Plus Novel Immunotherapy Combination Delivers 98% Overall Response Rate and 93% Complete Response Rate in Patients with Early-Stage Classical Hodgkin Lymphoma (cHL), source:Yahoo, summary: BOTHELL, Wash., June 13, 2023--Seagen Inc. (NASDAQ: SGEN) today announced updated efficacy and safety results from Part C of a phase 2 single-arm trial (SGN35-027) evaluating the antibody-drug conjugate ADCETRIS® (brentuximab vedotin) in combination with the PD-1 inhibitor nivolumab and standard chemotherapy agents doxorubicin and dacarbazine (AN+AD) for the frontline treatment of patients with early-stage classical Hodgkin lymphoma (cHL). Data results will be presented at the 17th International, Headline: Seagen Posts Impressive Phase 2 Data in Hodgkin Lymphoma, source:TipRanks, summary: No summary, Headline: Seagen's Adcetris/Immunotherapy Combo Achieves 98% Overall Response Rate in Early-Stage Lymphoma Setting, source:Benzinga, summary: No summary, Headline: Pfizer: Deeper Value Found Amidst Diversified Pipelines, source:SeekingAlpha, summary: Pfizer presents a buying opportunity as value has deepened following weak price action due to post-pandemic revenue concerns. Read why PFE stock is a Buy., Headline: Investor Opportunities Ahead of Clinical Updates, Says Analyst Initiating Coverage on Ambrx Biopharma with 'Buy' Rating, source:Benzinga, summary: No summary",SGEN
145,2023-06-14,"Headline: Pfizer pulls, refiles merger notification with FTC over Seagen deal, source:Seeking Alpha, summary: No summary, Headline: Six-Year Overall Survival Results Added to U.S. Prescribing Information for ADCETRIS® (brentuximab vedotin) as First-Line Treatment for Advanced Hodgkin Lymphoma, source:Yahoo, summary: BOTHELL, Wash., June 15, 2023--Seagen Inc. (NASDAQ: SGEN) today announced an update to the U.S. Prescribing Information (PI) for ADCETRIS® (brentuximab vedotin) to include six-year overall survival results from the phase 3 ECHELON-1 clinical trial of ADCETRIS plus combination chemotherapy in patients with previously untreated Stage III or IV classical Hodgkin lymphoma compared to chemotherapy alone. The statistically significant data were presented last year at the annual meetings of the America",SGEN
146,2023-06-15,"Headline: Notable Friday Option Activity: SGEN, GS, SQ, source:Stock Options Channel, summary: No summary",SGEN
147,2023-06-16,"Headline: Seagen (SGEN) Receives a Hold from SVB Securities, source:TipRanks, summary: No summary, Headline: How Biotech Stocks Are Revolutionizing Healthcare Investment Opportunities, source:TalkMarkets, summary: No summary",SGEN
148,2023-06-18,"Headline: Unlock the Potential of These 7 Cash-Flow Machines, source:InvestorPlace, summary: No summary",SGEN
149,2023-06-20,"Headline: 5 Biotech Stocks That Could Soar Thanks To These Disruptive Healthcare Technologies, source:Benzinga, summary: No summary, Headline: 3 Millionaire-Maker Biotech Stocks to Buy and Hold Forever, source:InvestorPlace, summary: No summary, Headline: Seagen reports progression free survival data from Adcetris combination study, source:Thefly.com, summary: No summary, Headline: Phase 3 Trial of ADCETRIS® (brentuximab vedotin) with Modified Chemo Regimen Shows Non-Inferiority with Unprecedented 3-Year Progression Free Survival of 94.9% vs Less Tolerable International Standard of Care in Advanced Classical Hodgkin Lymphoma, source:Yahoo, summary: BOTHELL, Wash., June 20, 2023--Seagen Inc. (NASDAQ: SGEN) today announced that the clinical research cooperative German Hodgkin Study Group (GHSG) presented results showing that a phase 3 trial of ADCETRIS® in combination with chemotherapy – a regimen called BrECADD (brentuximab vedotin [ADCETRIS], etoposide, cyclophosphamide, doxorubicin [Adriamycin], dacarbazine, and dexamethasone) – met its co-primary endpoints of non-inferior efficacy and superior tolerability versus a highly efficacious yet",SGEN
150,2023-06-22,"Headline: Seagen (SGEN) Gets a Hold from SVB Securities, source:TipRanks, summary: No summary, Headline: Analysts’ Opinions Are Mixed on These Healthcare Stocks: Seagen (SGEN), Verve Therapeutics (VERV) and Cytokinetics (CYTK), source:TipRanks, summary: No summary",SGEN
151,2023-06-23,"Headline: Here's How Much You Would Have Made Owning Seagen Stock In The Last 20 Years, source:Benzinga, summary: No summary",SGEN
152,2023-06-25,"Headline: What is behind big pharma's underperformance?, source:Seeking Alpha, summary: No summary",SGEN
153,2023-06-26,"Headline: Mergers Are Down, but These 2 Sectors Are Booming, source:MarketWatch, summary: Total deal value worldwide is about $1.22 trillion year to date, according to data from London Stock Exchange Group.",SGEN
154,2023-06-29,"Headline: Seattle Genetics put volume heavy and directionally bearish, source:Thefly.com, summary: No summary",SGEN
155,2023-07-01,"Headline: The 7 Most Undervalued S&P 500 Stocks to Buy Now, source:InvestorPlace, summary: No summary",SGEN
156,2023-07-04,"Headline: Best Under-the-Radar Stocks: 3 That AI Predicts Will Soar in July, source:Yahoo, summary: Under-the-radar stocks have provided compelling returns in 2023. Indeed, the rally this year has been mostly concentrated in a few key sectors, such as technology and artificial intelligence. However, snapping up oversold stocks typically sets up portfolios for substantial long-term gains. That’s no different right now than at any other time in history. Of course, finding these hidden gems is not easy, especially when the market is flooded with hype and noise. I’ll be using Google’s Bard AI toda",SGEN
157,2023-07-06,"Headline: Investors focus on how Pfizer will spend COVID-19 windfall: GS, source:Yahoo, summary: Pharmaceutical company Pfizer is carefully calculating its next move following the windfall it experienced during the COVID-19 pandemic. Yahoo Finance Healthcare Reporter Anjalee Khemlani highlights Pfizer CEO Albert Bourla's comments on Pfizer's stock outlook and plans to return capital to investors.",SGEN
158,2023-07-07,"Headline: From AI to Obesity Drugs - Global Pharma Has $700B For M&A and Investments: Goldman Sachs, source:Benzinga, summary: No summary",SGEN
159,2023-07-09,"Headline: $100 Invested In Seagen 10 Years Ago Would Be Worth This Much Today, source:Benzinga, summary: No summary",SGEN
160,2023-07-10,"Headline: Pfizer: A Worthwhile Dividend Play At A Cheap Valuation, source:SeekingAlpha, summary: Pfizer is looking at the impact of a Covid/Flu combo vaccination to help drive sales. Read why PFE stock offers long-term investors an opportunity to invest., Headline: RBC Capital Keeps Their Buy Rating on Seagen (SGEN), source:TipRanks, summary: No summary, Headline: Unusual Put Option Trade in Seagen (SGEN)  Worth $1,100.00K, source:Fintel, summary: nan",SGEN
161,2023-07-11,"Headline: Microsoft’s Win in the Activision Case Could Spur a Merger Revival, source:MarketWatch, summary: Activision Blizzard, VMware, and other stocks are rallying Tuesday after a federal judge ruled that Microsoft can close on its Activision deal, Headline: Drugmakers’ deal making will plow ahead despite antitrust scrutiny, analysts say, source:MarketWatch, summary: No summary",SGEN
162,2023-07-12,"Headline: Seagen to Report Second Quarter 2023 Financial Results on August 2, 2023, source:Yahoo, summary: BOTHELL, Wash., July 12, 2023--Seagen Inc. (Nasdaq: SGEN) today announced that it will report its second quarter 2023 financial results on Wednesday, August 2, 2023.",SGEN
163,2023-07-13,"Headline: 3 Pharma Stocks That AI is Loving in July, source:InvestorPlace, summary: No summary, Headline: Amedisys-UnitedHealth And 16 Other Opportunities In The Merger Arbitrage Space, source:SeekingAlpha, summary: In this article, you'll find a review of the most interesting setups in the merger arbitrage space. Read more here., Headline: What You Missed On Wall Street On Friday, source:Thefly.com, summary: No summary",SGEN
164,2023-07-14,"Headline: Seagen, Pfizer receive Second Request from FTC regarding merger, source:Thefly.com, summary: No summary, Headline: Seagen, Pfizer get second info request from FTC on $43B merger deal, source:Seeking Alpha, summary: No summary, Headline: Seagen, Pfizer to receive FTC second request, Dealreporter says, source:Thefly.com, summary: No summary, Headline: Seagen drops on report it will get 2nd request from FTC in Pfizer deal, source:Seeking Alpha, summary: No summary, Headline: Seagen dips on report it will get 2nd request from FTC in Pfizer deal, source:Seeking Alpha, summary: No summary, Headline: US FTC seeks additional info on Pfizer's proposed takeover of Seagen, source:Finnhub, summary: The US Federal Trade Commission
 has sought additional information and documentary material
related to Pfizer's proposed acquisition of Seagen Inc
, Seagen said on Friday.
(Reporting by Khushi...",SGEN
165,2023-07-16,"Headline: HSBC bullish on Roche, Lonza; bearish on Bristol-Myers, GSK, Moderna, source:Seeking Alpha, summary: No summary, Headline: TD Cowen analysts to hold an analyst/industry conference call, source:Thefly.com, summary: No summary",SGEN
166,2023-07-18,"Headline: SVB Securities Keeps Their Hold Rating on Seagen (SGEN), source:TipRanks, summary: No summary, Headline: How Is The Market Feeling About Seagen?, source:Benzinga, summary: No summary",SGEN
167,2023-07-19,"Headline: BAKER BROS. ADVISORS LP Acquires Significant Stake in Neoleukin Therapeutics Inc, source:GuruFocus, summary: No summary",SGEN
168,2023-07-21,"Headline: Growth Posted An Impressive First Half But Is Still Playing Catch-Up, source:SeekingAlpha, summary: The Nasdaq has provided tremendous performance so far in the first half of 2023. Click here to read more.",SGEN
169,2023-07-23,"Headline: Notable Monday Option Activity: SGEN, CALM, JKHY, source:Stock Options Channel, summary: No summary",SGEN
170,2023-07-24,"Headline: Seattle Genetics put volume heavy and directionally bearish, source:Thefly.com, summary: No summary",SGEN
171,2023-07-26,"Headline: Seattle Genetics (SGEN) Expected to Beat Earnings Estimates: Can the Stock Move Higher?, source:Yahoo, summary: Seattle Genetics (SGEN) possesses the right combination of the two key ingredients for a likely earnings beat in its upcoming report. Get prepared with the key expectations.",SGEN
172,2023-07-27,"Headline: Seattle Genetics put volume heavy and directionally bearish, source:Thefly.com, summary: No summary",SGEN
173,2023-07-28,"Headline: Unusual Put Option Trade in Seagen (SGEN)  Worth $2,100.00K, source:Fintel, summary: nan",SGEN
174,2023-07-30,"Headline: Pfizer seen reporting sharply lower Q2 sales as COVID-19 vaccine demand wanes, source:Seeking Alpha, summary: No summary",SGEN
