,date,information,related
81,2023-03-09,"Headline: Seagen, Astellas says China`s NMPA accepts BLA for enfortumab vedtoin, source:Thefly.com, summary: No summary, Headline: Analysts Conflicted on These Healthcare Names: Seagen (SGEN) and Bright Health Group (BHG), source:TipRanks, summary: No summary, Headline: Astellas and Seagen Announce China’s National Medical Products Administration Accepts Biologics License Application for Enfortumab Vedotin in Certain Patients with Locally Advanced or Metastatic Urothelial Cancer, source:Business Wire, summary: No summary, Headline: Astellas and Seagen Announce China's National Medical Products Administration Accepts Biologics License Application for Enfortumab Vedotin in Certain Patients with Locally Advanced or Metastatic Urothelial Cancer, source:Yahoo, summary: Astellas Pharma Inc. (TSE:4503, President and CEO: Kenji Yasukawa, Ph.D., ""Astellas"") and Seagen Inc. (Nasdaq: SGEN) today announced that the Center for Drug Evaluation (CDE) of the China National Medical Products Administration (NMPA) has accepted the Biologics License Application (BLA) for enfortumab vedotin for the treatment of patients with locally advanced or metastatic urothelial cancer (la/mUC) who received prior treatment with a PD-1/L1 inhibitor and platinum-based chemotherapy.",SGEN
82,2023-03-10,"Headline: Astellas, Seagen`s bladder cancer therapy gets review in China, source:Seeking Alpha, summary: No summary, Headline: Astellas and Seagen tout approval of bladder cancer treatment in China, source:Alliance News, summary: No summary",SGEN
83,2023-03-11,"Headline: The stock market is telling you loud and clear: Now is not the time to fight the Fed or stand up to the bears., source:MarketWatch, summary: No summary",SGEN
84,2023-03-12,"Headline: Seagen downgraded to Hold from Buy at Needham, source:Thefly.com, summary: No summary, Headline: Seagen downgraded to Market Perform from Strong Buy at Raymond James, source:Thefly.com, summary: No summary, Headline: Needham downgrades Seagen, says competing bid unlikely, source:Thefly.com, summary: No summary, Headline: Pfizer`s $43 billion bid for Seagen aims to broaden  company`s cancer portfolio, source:MarketWatch, summary: No summary, Headline: Pfizer CEO doesn`t see antitrust as stumbling block for Seagen acquisition, source:Seeking Alpha, summary: No summary, Headline: What You Missed On Wall Street On Monday, source:Thefly.com, summary: No summary",SGEN
85,2023-03-13,"Headline: These Stocks Are Moving the Most Today: First Republic, Provention Bio, Roku, Illumina, Boeing, and More Market Movers, source:MarketWatch, summary: First Republic shares are sinking Monday even as it received funding from JPMorgan Chase and the Federal Reserve, Provention Bio soars after agreeing to be..., Headline: Pfizer to acquire Seagen for $229 per share in cash, source:Thefly.com, summary: No summary, Headline: Pfizer to purchase Seagen in $43 billion all-cash deal, cancer biotech`s stock pops 20%, source:MarketWatch, summary: No summary, Headline: Today`s Biggest Pre-Market Stock Movers: 10 Top Gainers and Losers on Monday, source:InvestorPlace, summary: No summary, Headline: Pfizer to purchase Seagen in $43 billion all-cash deal, cancer biotech’s stock pops 20%, source:MarketWatch, summary: Pfizer Inc. plans to acquire cancer biotechnology company Seagen Inc. in a deal with a $43 billion enterprise value, the companies announced Monday morning...., Headline: Pfizer buys Seagen for $43B, boosts access to cancer drugs, source:Associated Press, The, summary: No summary, Headline: Pfizer Rolls the Dice on Seagen in $43 Billion Deal. The Risks It Faces., source:MarketWatch, summary: The pharmaceutical company will pay $229 a share in cash. The offer is based on the biotech firm hitting $10 billion in revenue in 2030., Headline: S&P 500 Futures Climb in Premarket Trading; First Republic Bank, Western Alliance Bancorp Lag, source:MarketWatch, summary: With U.S. stock markets set to open in two hours, (SGEN) was up 19.3% in pre-market trading, and (ILMN) was up 7.2%. (XM), (PODD), and (BILL) were all..., Headline: Pfizer Snaps Up Seagen for $43B, source:TipRanks, summary: No summary, Headline: Seagen downgraded to In Line from Outperform at Evercore ISI, source:Thefly.com, summary: No summary, Headline: MSTR, HIVE and FSM among pre market gainers, source:Seeking Alpha, summary: No summary, Headline: Fly Intel: Pre-market Movers, source:Thefly.com, summary: No summary, Headline: Stocks making the biggest moves premarket: Illumina, First Republic, Seagen and more, source:CNBC, summary: Bank lenders saw major losses in early morning trading, stinging from the closure of Silicon Valley Bank and Signature Bank. , Headline: Merck downgraded at Wells Fargo on valuation, source:Seeking Alpha, summary: No summary, Headline: Seagen downgraded to Market Perform from Outperform at BMO Capital, source:Thefly.com, summary: No summary, Headline: BMO Capital downgrades Seagen (SGEN) to a Hold, source:TipRanks, summary: No summary, Headline: TOP NEWS: Pfizer buys biotechnology firm Seagen for USD43 billion, source:Alliance News, summary: No summary, Headline: Provention, Caleminder top healthcare gainers; Cingulate, iCAD among losers, source:Seeking Alpha, summary: No summary, Headline: SGEN Stock Alert: Pfizer Buys Seagen in GIANT $43 Billion Deal, source:InvestorPlace, summary: No summary, Headline: Pfizer Invests $43 Billion to Battle Cancer, source:Yahoo, summary: NEW YORK & BOTHELL, Wash., March 13, 2023--Pfizer Inc. (NYSE: PFE) and Seagen Inc. (Nasdaq: SGEN) today announced that they have entered into a definitive merger agreement under which Pfizer will acquire Seagen, a global biotechnology company that discovers, develops and commercializes transformative cancer medicines, for $229 in cash per Seagen share for a total enterprise value of $43 billion. The Boards of Directors of both companies have unanimously approved the transaction., Headline: Pfizer to buy Seagen in deal valued at $43 billion , source:Reuters, summary: Pfizer Inc said on Monday it would buy Seagen Inc in a deal valued at $43 billion including debt to expand its portfolio of cancer treatments. (Reporting by Manas Mishra in Bengaluru; Editing by Saumyadeb Chakrabarty), Headline: Why did Moderna stock go up today? Street upgrade, source:Seeking Alpha, summary: No summary, Headline: What You Missed On Wall Street This Morning, source:Thefly.com, summary: No summary, Headline: JMP Securities downgrades Seagen (SGEN) to a Hold, source:TipRanks, summary: No summary, Headline: Seagen has one of the greatest technologies to battle cancer: Pfizer CEO on acquisition, source:CNBC, summary: Albert Bourla, Pfizer CEO, joins 'Squawk on the Street' to discuss his thoughts on the company buying Seagen., Headline: Stocks making the biggest moves midday: First Republic Bank, Moderna, Newmont, Illumina and more, source:CNBC, summary: These are the stocks posting the largest moves midday., Headline: Pfizer Buys Seagen - Why This Deal May Not Please Shareholders, source:SeekingAlpha, summary: Pfizer (PFE) to acquire Seagen (SGEN) for ~$43 billion. Read this article to know why I think that this deal may not please the shareholders., Headline: Pfizer CEO says it will be able to deliver Seagen's cancer therapy at a scale not seen before with $43 billion deal , source:CNBC, summary: Pfizer CEO Albert Bourla said it will deliver Seagen's cancer therapy to the world at a scale that hasn't been seen before with its $43 billion acquisition. , Headline: Pfizer Agrees to Buy Seagen for $43 Billion, source:Yahoo, summary: The drugmaker would pay $229 a share in cash for the biotech company and its pioneering cancer treatments., Headline: Pfizer aiming to acquire Seagen in $43 billion deal, source:Yahoo, summary: Yahoo Finance Live’s Julie Hyman discusses reports that Pfizer is aiming to acquire Seagen in a $43 billion deal., Headline: Pfizer ‘to battle cancer’ with Seagen merger, CEO  Albert Bourla says, source:Yahoo, summary: Pfizer CEO Albert Bourla joins Yahoo Finance Live’s Julie Hyman to discuss the acquisition of biotechnology company Seagen, the next generation of cancer breakthrough treatments, and the outlook for profit growth., Headline: NEW YORK MARKET CLOSE: Biden's reassurance fails to stop banks falling, source:Alliance News, summary: No summary, Headline: KeyCorp, Philips 66 fall; Seagen, Insulet rise, source:Associated Press, The, summary: No summary, Headline: Pfizer looks past COVID with $43 billion deal for cancer drug maker Seagen, source:Reuters, summary: Pfizer Inc on Monday struck a $43 billion deal to acquire Seagen Inc and its targeted cancer therapies as it braces for a steep fall in COVID-19 sales and generic competition for some top-selling drugs., Headline: Pfizer Overpays for Seagen, but Who’s Counting, source:Yahoo, summary: Acquiring top biotech assets as other big pharmaceutical companies face a patent cliff was bound to be expensive., Headline: CNBC Daily Open: The bank rout continues. The Fed might still raise rates anyway, source:CNBC, summary: Bank stocks had a very rough Monday in the aftermath of Silicon Valley Bank’s implosion. The 2-year Treasury yield plummeted. , Headline: Evercore ISI Group Downgrades Seattle Genetics (SGEN), source:Fintel, summary: nan, Headline: What Pfizer Is Getting From The Seagen Acquisition, source:SeekingAlpha, summary: Pfizer will acquire Seagen for $43 billion or $229 per share. Click here to read what PFE stock will get from acquiring SGEN stock., Headline: Barclays Sticks to Its Hold Rating for Seagen (SGEN), source:TipRanks, summary: No summary, Headline: CNBC Daily Open: Banks got hammered by SVB's collapse. But the Fed might still raise rates , source:CNBC, summary: Bank stocks had a very rough Monday in the aftermath of Silicon Valley Bank’s implosion. The 2-year Treasury yield plummeted. , Headline: Seagen downgraded to Market Perform from Outperform at JMP Securities, source:Thefly.com, summary: No summary",SGEN
86,2023-03-14,"Headline: Corrections & Amplifications, source:Yahoo, summary: CORRECTIONS The Nord Stream and Nord Stream 2 pipelines run between the western shores of Russia and the northern coast of Germany. A World News article on Saturday about September’s sabotage of the natural-gas pipelines incorrectly said they run from Russia’s eastern shores., Headline: Seagen price target raised to $228 from $145 at Barclays, source:Thefly.com, summary: No summary, Headline: Seagen (NASDAQ:SGEN) Stock Gained 54% YTD. Can Its Momentum Continue?, source:TipRanks, summary: No summary, Headline: Morgan Stanley Sticks to Its Buy Rating for Seagen (SGEN), source:TipRanks, summary: No summary, Headline: Seagen price target raised to $229 from $210 at Oppenheimer, source:Thefly.com, summary: No summary, Headline: RBC Capital Remains a Buy on Seagen (SGEN), source:TipRanks, summary: No summary, Headline: Analysts Have Conflicting Sentiments on These Healthcare Companies: Seagen (SGEN), Sanofi (OtherSNYNF) and Amylyx Pharmaceuticals Inc (AMLX), source:TipRanks, summary: No summary, Headline: Seagen price target raised to $229 from $141 at SVB Securities, source:Thefly.com, summary: No summary, Headline: GLOBAL BROKER RATINGS: Numis cuts Seagen; SocGen cuts Saint-Gobain, source:Alliance News, summary: No summary, Headline: Seagen price target raised to $229 from $155 at RBC Capital, source:Thefly.com, summary: No summary, Headline: Street Wrap: Today`s Top 15 Upgrades, Downgrades, Initiations, source:Thefly.com, summary: No summary, Headline: Strength Seen in Seattle Genetics (SGEN): Can Its 14.5% Jump Turn into More Strength?, source:Yahoo, summary: Seattle Genetics (SGEN) saw its shares surge in the last session with trading volume being higher than average. The latest trend in earnings estimate revisions could translate into further price increase in the near term., Headline: JPMorgan biotech/pharma analysts to hold analyst/industry conference call, source:Thefly.com, summary: No summary, Headline: Seagen to Present New Clinical and Preclinical Data From Broad Portfolio of Targeted Cancer Therapeutics at the 2023 AACR Annual Meeting, source:Yahoo, summary: BOTHELL, Wash., March 14, 2023--Seagen Inc. (Nasdaq: SGEN) today announced the presentation of 17 abstracts featuring new clinical and preclinical data at the upcoming American Association for Cancer Research (AACR) Annual Meeting taking place in Orlando from April 14-19, 2023. The broad range of data being presented at this year’s meeting includes research from Seagen’s approved medicines, as well as data from early-stage clinical, preclinical, and discovery research programs., Headline: BMO Capital Downgrades Seattle Genetics (SGEN), source:Fintel, summary: nan, Headline: JMP Securities Downgrades Seattle Genetics (SGEN), source:Fintel, summary: nan, Headline: Raymond James Downgrades Seattle Genetics (SGEN), source:Fintel, summary: nan, Headline: Needham Downgrades Seattle Genetics (SGEN), source:Fintel, summary: nan, Headline: Seagen downgraded to Equal Weight from Overweight at Morgan Stanley, source:Thefly.com, summary: No summary",SGEN
87,2023-03-15,"Headline: GLOBAL BROKER RATINGS: HSBC says 'hold' Terna and Snam, 'buy' Enel, source:Alliance News, summary: No summary, Headline: AbbVie, Gilead, Seagen among firms fined for raising prices faster than inflation, source:Seeking Alpha, summary: No summary, Headline: Medicare identifies drug makers that will owe penalties for raising prices on 27 drugs faster than rate of inflation, source:Yahoo, summary: The Biden administration is making good on promises to help lower drug costs, though the impact is largely for Medicare patients., Headline: Lightning Round: We're not gonna recommend an stocks that are oozing big money, source:CNBC, summary: Mad Money host Jim Cramer weighs in on all manner of stocks, including Vir Biotechnology, Pfizer, Seagen and Origin Materials., Headline: Morgan Stanley Downgrades Seattle Genetics (SGEN), source:Fintel, summary: nan",SGEN
88,2023-03-16,"Headline: Today`s Biggest Pre-Market Stock Movers: 10 Top Gainers and Losers on Thursday, source:InvestorPlace, summary: No summary, Headline: Stock market volatility this week has triggered a new sell signal, source:MarketWatch, summary: No summary, Headline: JPMorgan biotech/pharma analysts to hold KOL analyst/industry conference call, source:Thefly.com, summary: No summary",SGEN
89,2023-03-17,"Headline: Why Is Seattle Genetics (SGEN) Up 24.6% Since Last Earnings Report?, source:Yahoo, summary: Seattle Genetics (SGEN) reported earnings 30 days ago. What's next for the stock? We take a look at earnings estimates for some clues., Headline: Seagen and Newell Brands Stock See Action From Activist Investors, source:MarketWatch, summary: Activists file with the SEC on Seagan, ODP, Newell Brands, and Chinook Therapeutics, Headline: First Republic Bank, T-Mobile, Credit Suisse: Stocks That Defined the Week, source:Yahoo, summary: Wall Street’s biggest banks swooped in to rescue First Republic after a week of turmoil.  First Republic was among the banks swept up in the contagion following the recent failure of Silicon Valley Bank parent SVB Financial Corp. Banks including  JPMorgan Chase & Co. Citigroup  and  Wells Fargo  & Co., deposited a total of $30 billion in an effort to stop the spreading panic.  First Republic shares dropped 33% Friday., Headline: Week In Review: Livzon In-Licenses GERD Therapy In $127 Million Agreement, source:TalkMarkets, summary: No summary",SGEN
90,2023-03-20,"Headline: Seagen price target raised to $229 from $152 at Truist, source:Thefly.com, summary: No summary, Headline: Week In Review: Livzon In-Licenses GERD Therapy In $127 Million Agreement, source:Seeking Alpha, summary: No summary",SGEN
91,2023-03-22,"Headline: Moderna: Now`s Your Chance (Rating Upgrade), source:Seeking Alpha, summary: No summary, Headline: Moderna: Now's Your Chance (Rating Upgrade), source:SeekingAlpha, summary: Moderna stock potential is overshadowed by downcast analysts' projections of three years of operating losses until 2025. Click here for our take on MRNA., Headline: Seagen (SGEN) Gets a Hold from Cowen & Co., source:TipRanks, summary: No summary",SGEN
92,2023-03-23,"Headline: We're Not Worried About Seagen's (NASDAQ:SGEN) Cash Burn, source:Yahoo, summary: Just because a business does not make any money, does not mean that the stock will go down. For example, although..., Headline: CRISPR Therapeutics AG (CRSP) Down 13.6% Since Last Earnings Report: Can It Rebound?, source:Yahoo, summary: CRISPR Therapeutics AG (CRSP) reported earnings 30 days ago. What's next for the stock? We take a look at earnings estimates for some clues.",SGEN
93,2023-03-24,"Headline: Analysts Have Conflicting Sentiments on These Healthcare Companies: Seagen (SGEN), Aptose Biosciences (APTO) and GeoVax Labs (GOVX), source:TipRanks, summary: No summary, Headline: Seagen downgraded to Hold from Buy at Berenberg, source:Thefly.com, summary: No summary, Headline: Why Is Repligen (RGEN) Down 11.4% Since Last Earnings Report?, source:Yahoo, summary: Repligen (RGEN) reported earnings 30 days ago. What's next for the stock? We take a look at earnings estimates for some clues.",SGEN
94,2023-03-27,"Headline: 3 Low P/E Stocks That Are Bound to Rebound This Year, source:InvestorPlace, summary: No summary, Headline: A Seagen Inc. (NASDAQ:SGEN) insider lowered their holding by 16% earlier this year, source:Yahoo, summary: Viewing insider transactions for Seagen Inc.'s ( NASDAQ:SGEN ) over the last year, we see that insiders were net..., Headline: Notable Tuesday Option Activity: SGEN, HUM, GOOGL, source:Stock Options Channel, summary: No summary",SGEN
95,2023-03-29,"Headline: Axsome (AXSM) Down 9.8% Since Last Earnings Report: Can It Rebound?, source:Yahoo, summary: Axsome (AXSM) reported earnings 30 days ago. What's next for the stock? We take a look at earnings estimates for some clues.",SGEN
96,2023-03-30,"Headline: Pfizer-backed Pyxis hits 52-week high to cross $200M market cap, source:Seeking Alpha, summary: No summary, Headline: Why Is Iovance Biotherapeutics (IOVA) Down 9.2% Since Last Earnings Report?, source:Yahoo, summary: Iovance Biotherapeutics (IOVA) reported earnings 30 days ago. What's next for the stock? We take a look at earnings estimates for some clues.",SGEN
97,2023-03-31,"Headline: Amicus Therapeutics (FOLD) Down 14% Since Last Earnings Report: Can It Rebound?, source:Yahoo, summary: Amicus Therapeutics (FOLD) reported earnings 30 days ago. What's next for the stock? We take a look at earnings estimates for some clues.",SGEN
98,2023-04-02,"Headline: Seagen/Pfizer deal spread becoming increasingly attractive, analyst says, source:Seeking Alpha, summary: No summary",SGEN
99,2023-04-03,"Headline: Seagen, Astellas announce FDA grants Padcev with Keytruda accelerated approval, source:Thefly.com, summary: No summary, Headline: Amazon-iRobot And 16 Other Opportunities In Merger Arbitrage Space, source:SeekingAlpha, summary: Merger arbitrage spreads are wide. There are plenty of opportunities with spreads of up to 118%., Headline: FDA Grants Accelerated Approval for PADCEV® (enfortumab vedotin-ejfv) with KEYTRUDA® (pembrolizumab) for First-Line Treatment of Locally Advanced or Metastatic Urothelial Cancer, source:Yahoo, summary: BOTHELL, Wash. & TOKYO, April 03, 2023--Seagen Inc. (Nasdaq: SGEN) and Astellas Pharma Inc. (TSE:4503) today announced the U.S. Food and Drug Administration (FDA) has granted PADCEV® (enfortumab vedotin-ejfv) with KEYTRUDA® (pembrolizumab) accelerated approval in the U.S. as a combination therapy for the treatment of adult patients with locally advanced or metastatic urothelial cancer (la/mUC) who are not eligible to receive cisplatin-containing chemotherapy. This indication is approved under ac, Headline: US FDA grants accelerated approval for Padcev with Keytruda for cancer, source:Alliance News, summary: No summary",SGEN
100,2023-04-04,"Headline: Seagen (SGEN) Gets a Hold from Morgan Stanley, source:TipRanks, summary: No summary, Headline: Padcev combo approval should alleviate concerns on Seagen deal, says BofA, source:Thefly.com, summary: No summary, Headline: Tracking Baker Brothers Portfolio - Q4 2022 Update, source:SeekingAlpha, summary: Baker Brothersâ 13F portfolio value increased from $15.27B to $16.65B this quarter. Click here to see the Q4 2022 update on the portfolio.",SGEN
101,2023-04-06,"Headline: Is Pfizer Stock a Buy, Sell or Hold? Here`s My Call., source:InvestorPlace, summary: No summary, Headline: Estimating The Intrinsic Value Of Seagen Inc. (NASDAQ:SGEN), source:Yahoo, summary: Key Insights Seagen's estimated fair value is US$194 based on 2 Stage Free Cash Flow to Equity Seagen's US$205 share...",SGEN
102,2023-04-07,"Headline: RBC Capital Sticks to Their Buy Rating for Seagen (SGEN), source:TipRanks, summary: No summary, Headline: Seagen to Report First Quarter 2023 Financial Results on April 27, 2023, source:Yahoo, summary: BOTHELL, Wash., April 07, 2023--Seagen Inc. (Nasdaq: SGEN) today announced that it will report its first quarter 2023 financial results on Thursday, April 27, 2023.",SGEN
103,2023-04-09,"Headline: Pfizer: Trying To Acquire Growth, source:SeekingAlpha, summary: Pfizer has used the vaccine boom and related profits from the pandemic to pursue a flurry of deals. Click here to see our take on PFE stock.",SGEN
104,2023-04-11,"Headline: Investors in Seagen (NASDAQ:SGEN) have made a incredible return of 307% over the past five years, source:Yahoo, summary: Long term investing can be life changing when you buy and hold the truly great businesses. While not every stock...",SGEN
105,2023-04-17,"Headline: Seagen Inc.'s (NASDAQ:SGEN) Business Is Trailing The Industry But Its Shares Aren't, source:Yahoo, summary: You may think that with a price-to-sales (or ""P/S"") ratio of 19.6x Seagen Inc. ( NASDAQ:SGEN ) is a stock to avoid..., Headline: Pfizer Vs. AstraZeneca: Which Is Better For Long-Term Investors?, source:SeekingAlpha, summary: nan",SGEN
106,2023-04-18,"Headline: Pfizer: A Deep Value Play for the Long Term, source:GuruFocus, summary: No summary, Headline: Buy Seagen Now For An Attractive M&A Arbitrage Opportunity, source:SeekingAlpha, summary: nan, Headline: MindMed Files Preliminary Proxy Statement for 2023 Annual Meeting, source:Business Wire, summary: No summary",SGEN
107,2023-04-19,"Headline: TD Cowen merger specialist to hold an analyst/industry conference call, source:Thefly.com, summary: No summary, Headline: Unusual Put Option Trade in Seattle Genetics (SGEN)  Worth $260.00K, source:Fintel, summary: nan",SGEN
108,2023-04-20,"Headline: Biopharma Deals Are Hot. There’s More to Come—and These Stocks Can Benefit., source:MarketWatch, summary: In the first quarter of this year, total healthcare and life sciences M&A in the U.S. was about $71 billion, according to KPMG.",SGEN
109,2023-04-23,"Headline: What is behind biotech M&A resurgence?, source:Seeking Alpha, summary: No summary",SGEN
110,2023-04-24,"Headline: 3 Low P/E Stocks That Will Double in One Year, source:InvestorPlace, summary: No summary, Headline: Second Quarter Outlook For Biotech Stocks, source:SeekingAlpha, summary: nan, Headline: We're Interested To See How Seagen (NASDAQ:SGEN) Uses Its Cash Hoard To Grow, source:Yahoo, summary: Just because a business does not make any money, does not mean that the stock will go down. For example, biotech and...",SGEN
111,2023-04-25,"Headline: Second Quarter Outlook For Biotech Stocks, source:TalkMarkets, summary: No summary, Headline: Repligen (RGEN) Expected to Beat Earnings Estimates: What to Know Ahead of Q1 Release, source:Yahoo, summary: Repligen (RGEN) possesses the right combination of the two key ingredients for a likely earnings beat in its upcoming report. Get prepared with the key expectations.",SGEN
112,2023-04-26,"Headline: Seagen says bladder cancer, Padcev data to highlight ASCO presentations, source:Thefly.com, summary: No summary, Headline: Seagen to Highlight Data From Oncology Portfolio and Pipeline at the 2023 American Society of Clinical Oncology Annual Meeting, source:Yahoo, summary: BOTHELL, Wash., April 26, 2023--Seagen Inc. (Nasdaq: SGEN) today announced the presentation of 17 abstracts at the upcoming 2023 American Society of Clinical Oncology (ASCO) Annual Meeting taking place June 2-6, 2023, in Chicago. Data will be presented across Seagen's portfolio of approved medicines and pipeline agents in a range of cancer types and in earlier lines of therapy., Headline: GLOBAL BRIEFING: Samsung posts weakest profit in 14 years in Q1, source:Alliance News, summary: No summary, Headline: Seagen (SGEN) Receives a Hold from Berenberg Bank, source:TipRanks, summary: No summary, Headline: JMP Securities Sticks to Their Hold Rating for Seagen (SGEN), source:TipRanks, summary: No summary",SGEN
