,date,information,related
49,2023-01-05,"Headline: Tracking Baker Brothers Portfolio - Q3 2022 Update, source:SeekingAlpha, summary: Baker Brothers' 13F portfolio value decreased from $17.63B to $15.27B this quarter. Find out the ongoing analysis of the changes made to the portfolio on a quarterly basis.",SGEN
50,2023-01-06,"Headline: AstraZeneca And Daiichi Sankyo`s Zauberkugel (Magic Bullet), source:Seeking Alpha, summary: No summary, Headline: AstraZeneca And Daiichi Sankyo's Zauberkugel (Magic Bullet), source:SeekingAlpha, summary: AstraZeneca, Daiichi Sankyo to market HER-2 cancer domain targeting therapy Enhertu. See why I consider accumulating DSKYF stock for Enhertu momentum play.",SGEN
51,2023-01-14,"Headline: Stocks To Watch: Economic Reports, Earnings Blockbusters And Political Minefields Lie Ahead Next Week, source:SeekingAlpha, summary: Get ahead of the market by subscribing to Seeking Alpha's Stocks to Watch, a preview of key events scheduled for the coming week",SGEN
52,2023-01-19,"Headline: Seagen (SGEN) Presents At 41st Annual Healthcare Conference - Slideshow, source:SeekingAlpha, summary: The following slide deck was published by Seagen Inc., Headline: Seagen to Host Conference Call and Webcast Discussion of Fourth Quarter and Full Year 2022 Financial Results on February 15, 2023, source:Yahoo, summary: BOTHELL, Wash., January 19, 2023--Seagen Inc. (Nasdaq: SGEN) today announced that it will report its fourth quarter and full year 2022 financial results on Wednesday, February 15, 2023 after the close of U.S. financial markets. Following the announcement, Company management will host a conference call and webcast at 4:30 p.m. Eastern Time to discuss the results and provide a business update., Headline: Seagen Gets FDA Accelerated Approval for Tukysa, source:MarketWatch, summary: By Kathryn Hardison Seagen Inc. said Thursday that the Food and Drug Administration has granted accelerated approval to Tukysa(R)tucatinib in combination..., Headline: Seagen Announces FDA Accelerated Approval of TUKYSA® (tucatinib) in Combination with Trastuzumab for People with Previously Treated RAS Wild-Type, HER2-Positive Metastatic Colorectal Cancer, source:Yahoo, summary: BOTHELL, Wash., January 19, 2023--Seagen Inc. (Nasdaq: SGEN) today announced that the U.S. Food and Drug Administration (FDA) has granted accelerated approval to TUKYSA® (tucatinib) in combination with trastuzumab for adult patients with RAS wild-type, HER2-positive unresectable or metastatic colorectal cancer that has progressed following treatment with fluoropyrimidine-, oxaliplatin- and irinotecan-based chemotherapy. TUKYSA is approved under the FDA’s Accelerated Approval Program based on tum",SGEN
53,2023-01-20,"Headline: Biotech Alert: Searches spiking for these stocks today, source:Thefly.com, summary: No summary",SGEN
54,2023-01-22,"Headline: Global drug spending to reach $1.9T by 2027 ��� IQVIA, source:Seeking Alpha, summary: No summary",SGEN
55,2023-01-24,"Headline: Seagen (SGEN) Receives a Buy from Berenberg Bank, source:TipRanks, summary: No summary, Headline: Morgan Stanley Sticks to Its Buy Rating for Seagen (SGEN), source:TipRanks, summary: No summary",SGEN
56,2023-01-25,"Headline: Seagen price target lowered to $170 from $183 at Berenberg, source:Thefly.com, summary: No summary",SGEN
57,2023-01-30,"Headline: Truist sees potential pressure on Seagen`s Padcev in Q4, source:Thefly.com, summary: No summary, Headline: Seagen: Back On Track, Priced About Right, source:SeekingAlpha, summary: Seagen has a platform that can create new product candidates and can get some through the clinical process and into commercial sales. Find out why SGEN stock is a Hold.",SGEN
58,2023-01-31,"Headline: Genmab: High-Quality Biotech Darling, But Lacks Meaningful Catalysts In The Near Term, source:Seeking Alpha, summary: No summary",SGEN
59,2023-02-06,"Headline: Seagen downgraded to Market Perform from Outperform at SVB Securities, source:Thefly.com, summary: No summary, Headline: SVB Securities downgrades Seagen to Market Perform, lowers price target to $141, source:Thefly.com, summary: No summary, Headline: Street Wrap: Today`s Top 15 Upgrades, Downgrades, Initiations, source:Thefly.com, summary: No summary, Headline: Analysts Offer Insights on Healthcare Companies: Eli Lilly & Co (LLY), Regeneron (REGN) and Seagen (SGEN), source:TipRanks, summary: No summary",SGEN
60,2023-02-08,"Headline: Analysts Estimate Seattle Genetics (SGEN) to Report a Decline in Earnings: What to Look Out for, source:Yahoo, summary: Seattle Genetics (SGEN) doesn't possess the right combination of the two key ingredients for a likely earnings beat in its upcoming report. Get prepared with the key expectations., Headline: SVB Leerink Downgrades Seattle Genetics (SGEN), source:Fintel, summary: nan",SGEN
61,2023-02-09,"Headline: Top 5 4th Quarter Trades of Lattice Capital Management, LLC, source:GuruFocus, summary: No summary, Headline: Insmed (INSM) Expected to Beat Earnings Estimates: Should You Buy?, source:Yahoo, summary: Insmed (INSM) possesses the right combination of the two key ingredients for a likely earnings beat in its upcoming report. Get prepared with the key expectations.",SGEN
62,2023-02-10,"Headline: Jefferies biotechnology analyst to hold an analyst/industry conference call, source:Thefly.com, summary: No summary",SGEN
63,2023-02-12,"Headline: Seagen treatment of esophageal cancer granted orphan designation, source:Thefly.com, summary: No summary",SGEN
64,2023-02-13,"Headline: 3 Stocks to Buy Today, 2/13/2023, According to Top Analysts, source:TipRanks, summary: No summary, Headline: Analysts` Opinions Are Mixed on These Healthcare Stocks: Mettler-Toledo (MTD), Seagen (SGEN) and Nurix Therapeutics (NRIX), source:TipRanks, summary: No summary, Headline: Seagen to Highlight Research in Urothelial Cancer at the 2023 American Society of Clinical Oncology Genitourinary Cancers Symposium, source:Yahoo, summary: BOTHELL, Wash., February 13, 2023--Seagen Inc. (Nasdaq: SGEN) today announced the presentation of new data featuring PADCEV® (enfortumab vedotin-ejfv) at the upcoming American Society of Clinical Oncology Genitourinary Cancers Symposium (ASCO-GU) taking place from February 16-18, 2023. A podium presentation will feature noteworthy patient-reported outcomes from the registrational Phase 1b/2 EV‐103 Cohort K study., Headline: Seattle Genetics Q4 2022 Earnings Preview, source:Seeking Alpha, summary: No summary, Headline: Notable earnings after Wednesday`s close, source:Seeking Alpha, summary: No summary",SGEN
65,2023-02-14,"Headline: Seagen (SGEN) Receives a Buy from BMO Capital, source:TipRanks, summary: No summary, Headline: GLOBAL BRIEFING: Stocks called lower ahead of UK inflation figures, source:Alliance News, summary: No summary, Headline: Seagen reports Q4 EPS (80c), consensus ($1.04), source:Thefly.com, summary: No summary, Headline: Seagen sees FY23 revenue $2.14B-$2.24B, consensus $2.3B, source:Thefly.com, summary: No summary, Headline: Seattle Genetics GAAP EPS of -$0.80 beats by $0.25, revenue of $528M beats by $48.19M, source:Seeking Alpha, summary: No summary",SGEN
66,2023-02-15,"Headline: Seagen up 6% on quarterly beats, though 2023 revenue outlook comes in below consensus, source:Seeking Alpha, summary: No summary, Headline: Fly Intel: After-Hours Movers, source:Thefly.com, summary: No summary, Headline: Cellectar Biosciences hires Shustov as new Senior Vice President, Medical, source:Thefly.com, summary: No summary, Headline: Seattle Genetics: Q4 Earnings Snapshot, source:Associated Press, The, summary: No summary, Headline: Seagen Reports Fourth Quarter and Full Year 2022 Financial Results, source:Yahoo, summary: BOTHELL, Wash., February 15, 2023--Seagen Inc. (Nasdaq:SGEN) today reported financial results for the fourth quarter and year ended December 31, 2022. The Company also highlighted PADCEV® (enfortumab vedotin-ejfv), TUKYSA® (tucatinib), ADCETRIS® (brentuximab vedotin) and TIVDAK® (tisotumab vedotin-tftv) commercial and development accomplishments, as well as progress across its potentially transformative oncology pipeline., Headline: Seagen Inc. (SGEN) Q4 2022 Earnings Call Transcript, source:SeekingAlpha, summary: Seagen Inc. (NASDAQ:NASDAQ:SGEN) Q4 2022 Results Conference Call February 15, 2023 4:30 PM ETCompany ParticipantsDoug Maffei - VP, IRDavid Epstein - CEOChip Romp - EVP, Commercial U.S.Todd..., Headline: Seattle Genetics (SGEN) Reports Q4 Loss, Tops Revenue Estimates, source:Yahoo, summary: Seattle Genetics (SGEN) delivered earnings and revenue surprises of 21.57% and 9.35%, respectively, for the quarter ended December 2022. Do the numbers hold clues to what lies ahead for the stock?, Headline: Positive Report for Seagen (SGEN) from Raymond James, source:TipRanks, summary: No summary, Headline: Seagen nears six-month high as Wall Street cheers Q4 results, source:Seeking Alpha, summary: No summary, Headline: Seagen upgraded to Strong Buy from Outperform at Raymond James, source:Thefly.com, summary: No summary, Headline: Analysts Conflicted on These Healthcare Names: Amedisys (AMED), Seagen (SGEN) and Waters (WAT), source:TipRanks, summary: No summary",SGEN
67,2023-02-16,"Headline: Analysts Are Bullish on Top Healthcare Stocks: Prophase Labs (PRPH), Seagen (SGEN), source:TipRanks, summary: No summary, Headline: Berenberg Bank Remains a Buy on Seagen (SGEN), source:TipRanks, summary: No summary, Headline: Analysts Offer Insights on Healthcare Companies: Amedisys (AMED) and Seagen (SGEN), source:TipRanks, summary: No summary, Headline: Seagen upgraded to Outperform from In Line at Evercore ISI, source:Thefly.com, summary: No summary, Headline: Seattle Genetics: Q4 Earnings Snapshot, source:Associated Press, The, summary: No summary, Headline: Analysts Offer Insights on Healthcare Companies: Seagen (SGEN) and Waters (WAT), source:TipRanks, summary: No summary, Headline: S&P 500 Futures Decline in Premarket Trading; Twilio, Roku Lead, source:MarketWatch, summary: With U.S. stock markets set to open in two hours, (TWLO) was up 14.9% in pre-market trading, and (ROKU) was up 11.6%. (CROX), (SGEN), and (TECK) were all..., Headline: Seagen price target raised to $155 from $145 at RBC Capital, source:Thefly.com, summary: No summary, Headline: Seagen (SGEN) Shares Cross Above 200 DMA, source:Market News Video, summary: No summary, Headline: Evercore ISI Group Upgrades Seattle Genetics (SGEN), source:Fintel, summary: nan, Headline: Raymond James Upgrades Seattle Genetics (SGEN), source:Fintel, summary: nan, Headline: Why Seattle Genetics, Alkermes Are Currently Outperforming Their Peers, source:Yahoo, summary: Seattle Genetics and Alkermes beat fourth-quarter estimates Thursday, pushing Alkermes stock into a brief breakout as SGEN stock soared., Headline: Seagen price target raised to $168 from $142 at JMP Securities, source:Thefly.com, summary: No summary",SGEN
68,2023-02-17,"Headline: SGEN Crosses Above Average Analyst Target, source:ETF Channel, summary: No summary, Headline: Seagen price target raised to $152 from $135 at Truist, source:Thefly.com, summary: No summary, Headline: SVB Securities Remains a Hold on Seagen (SGEN), source:TipRanks, summary: No summary, Headline: Seagen Full Year 2022 Earnings: Beats Expectations, source:Yahoo, summary: Seagen ( NASDAQ:SGEN ) Full Year 2022 Results Key Financial Results Revenue: US$1.96b (up 25% from FY 2021). Net loss..., Headline: Ghost Tree Capital, LLC Buys 3, Sells 2 in 4th Quarter, source:GuruFocus, summary: No summary, Headline: JMP Securities Sticks to Its Buy Rating for Seagen (SGEN), source:TipRanks, summary: No summary",SGEN
69,2023-02-21,"Headline: Analysts Offer Insights on Healthcare Companies: Ligand Pharma (LGND) and Seagen (SGEN), source:TipRanks, summary: No summary, Headline: We're Not Worried About Seagen's (NASDAQ:SGEN) Cash Burn, source:Yahoo, summary: Even when a business is losing money, it's possible for shareholders to make money if they buy a good business at the...",SGEN
70,2023-02-22,"Headline: Merck & Co.: Running A Bit Hot, source:SeekingAlpha, summary: Merck has seen a significant valuation re-rating take place over the past years. This comes amidst the success of Keytruda which creates some dependency risks as well. Read more here.",SGEN
71,2023-02-23,"Headline: Analysts Offer Insights on Healthcare Companies: Repligen (RGEN), Seagen (SGEN) and Denali Therapeutics (DNLI), source:TipRanks, summary: No summary, Headline: Seagen price target raised to $178 from $160 at Needham, source:Thefly.com, summary: No summary",SGEN
72,2023-02-25,"Headline: A Seagen Inc. (NASDAQ:SGEN) insider lowered their holding by 16% earlier this year, source:Yahoo, summary: Insiders were net sellers of Seagen Inc.'s ( NASDAQ:SGEN ) stock during the past year. That is, insiders sold more...",SGEN
73,2023-02-26,"Headline: Pfizer said in early-stake talks to acquire Seagen - WSJ, source:Seeking Alpha, summary: No summary, Headline: Pfizer said in early stage talks to acquire Seagen - WSJ, source:Seeking Alpha, summary: No summary, Headline: Pfizer eyes takeover of biotech Seagen, at value of more than $30 billion, source:MarketWatch, summary: Pfizer Inc. is in talks to acquire biotech Seagen Inc., according to people familiar with the matter, the latest potential deal for a big drug company aimed..., Headline: Pfizer Is Eyeing a Deal With Seagen After Merck`s Failure, source:GuruFocus, summary: No summary, Headline: Nasdaq, S&P, Dow headed for positive finish after their worst weekly loss in 2023, source:Seeking Alpha, summary: No summary, Headline: Pfizer in Talks to Acquire Seagen in Deal Likely Valued at More Than $30 Billion, source:Yahoo, summary: The potential deal, likely valued at more than $30 billion, would help Pfizer add to its lineup of cancer treatments., Headline: BRIEF-Pfizer In Early-Stage Talks To Acquire Seagen - WSJ, source:Reuters, summary: * PFIZER IN EARLY-STAGE TALKS TO ACQUIRE SEAGEN - WSJ Source text: [ https://on.wsj.com/41vkCnW ], Headline: What You Missed On Wall Street On Monday, source:Thefly.com, summary: No summary, Headline: Pfizer in talks to buy Seagen for likely for more than $30 bln - WSJ, source:Reuters, summary: Pfizer Inc is in early talks to acquire drugmaker Seagen Inc, the Wall Street Journal reported late on Sunday, citing people familiar with the matter., Headline: Pfizer in talks to buy Seagen for likely for more than $30 billion - WSJ, source:Reuters, summary: Pfizer Inc is in early talks to acquire drugmaker Seagen Inc, the Wall Street Journal reported late on Sunday, citing people familiar with the matter., Headline: Pfizer (NYSE:PFE) Could Buy Seagen; Bolster its Product Portfolio, source:TipRanks, summary: No summary, Headline: Pfizer in Talks to Buy Seagen for $30 Billion or More, source:MarketWatch, summary: The deal would strengthen Pfizer's lineup of cancer treatments, The Wall Street Journal reports., Headline: Pfizer (NYSE:PFE) Could Buy Seagen; Bolster its Oncology Portfolio, source:TipRanks, summary: No summary, Headline: Pfizer in talks to buy Seagen in deal that may be valued at over $30B, WSJ says, source:Thefly.com, summary: No summary, Headline: Hot Stocks: SGEN climbs on takeover interest; PFE sets 52-week low; TGNA drops; KOS hits 52-week high, source:Seeking Alpha, summary: No summary",SGEN
74,2023-02-27,"Headline: Pfizer (NYSE:PFE) Could Buy Seagen to Bolster Oncology Portfolio, source:TipRanks, summary: No summary, Headline: These Stocks Are Moving the Most Today: Fisker, Seagen, Tesla, FuboTV, Enphase, and More, source:MarketWatch, summary: Fisker says it still expects to build and ship around 42,000 units in 2023. A report says Pfizer is in discussions to acquire biotechnology company Seagen., Headline: Nasdaq, S&P, Dow futures rise with durable goods orders in view, source:Seeking Alpha, summary: No summary, Headline: Today`s Biggest Pre-Market Stock Movers: 10 Top Gainers and Losers on Monday, source:InvestorPlace, summary: No summary, Headline: Seagen`s stock soars on reported Pfizer buyout interest; Union Pacific shares rally after CEO ouster, source:MarketWatch, summary: No summary, Headline: S&P 500 Futures Up in Premarket Trading; Seagen, Union Pacific Lead, source:MarketWatch, summary: With U.S. stock markets set to open in two hours, (SGEN) was up 14.4% in pre-market trading, and (UNP) was up 10.0%. (AES), (TREX), and (AVTR) were all..., Headline: Nasdaq, S&P, Dow futures add to gains after durable goods orders plunge, source:Seeking Alpha, summary: No summary, Headline: Tesla, Seagen, Fisker and Union Pacific shares pop — and more stock-market movers, source:MarketWatch, summary: Here are some of the most active stocks in morning trading Monday, as the S&P 500 was headed higher., Headline: Stocks making the biggest moves premarket: Best Buy, Seagen, Union Pacific and more, source:CNBC, summary: Shares of Union Pacific rose 9.5% after the company said CEO Lance Fritz would have a successor named this year. , Headline: Pfizer acquisition of Seagen could add $7B in sales, says JPMorgan, source:Thefly.com, summary: No summary, Headline: Fly Intel: Pre-market Movers, source:Thefly.com, summary: No summary, Headline: Seagen, Union Pacific and Tesla rise premarket; Pfizer falls, source:Yahoo, summary: By Peter Nurse, Headline: Nasdaq, S&P, Dow rally after durable goods orders plunge, source:Seeking Alpha, summary: No summary, Headline: The $30 Billion Reason Seagen (SGEN) Stock Is Up 11% Today, source:InvestorPlace, summary: No summary, Headline: UNP Stock Alert: What to Know as Union Pacific`s CEO Steps Down, source:InvestorPlace, summary: No summary, Headline: Pfizer in talks to buy cancer drugmaker Seagen - WSJ, source:Reuters, summary: Pfizer Inc is in early-stage talks to acquire cancer drugmaker Seagen Inc in what could be a multi-billion dollar deal, the Wall Street Journal reported on Sunday, citing people familiar with the matter., Headline: Pfizer-Seagen: Dividend Risk Evaluation, source:SeekingAlpha, summary: Pfizer Inc. is reportedly in early negotiations to acquire cancer-focused biotech Seagen Inc. Click here to read for my take on PFE's deal for SGEN., Headline: What You Missed On Wall Street This Morning, source:Thefly.com, summary: No summary, Headline: Stocks making the biggest moves midday: Union Pacific, Fisker, Tesla, Zillow and more, source:CNBC, summary: Union Pacific soared on news of a leadership change., Headline: Nasdaq, S&P, Dow rebound after suffering their worst weekly loss in 2023, source:Seeking Alpha, summary: No summary, Headline: Seagen to Present at the Cowen 43rd Annual Health Care Conference, source:Yahoo, summary: BOTHELL, Wash., February 27, 2023--Seagen Inc. (Nasdaq:SGEN) today announced that management will participate in a fireside chat at the Cowen 43rd Annual Health Care Conference on Monday, March 6, 2023 at 1:30 p.m. Eastern Time. The presentation will be webcast live and available for replay from the investor section of Seagen’s website at investor.seagen.com., Headline: Pfizer in talks to acquire biotech firm Seagen for $30 billion: Report, source:Yahoo, summary: Yahoo Finance Live’s Julie Hyman reports that Pfizer is looking to acquire biotech firm Seagen in a $30 billion takeover deal., Headline: Pfizer Needs The Seagen Deal, source:SeekingAlpha, summary: Pfizer has been reported as bidding for Seagen, competing with Merck & Co. Check out is this a good deal for PFE and SGEN shareholders., Headline: Tesla’s Investor Day, Warren Buffett’s letter to shareholders, Pfizer-Seagen deal: 3 things to know, source:Yahoo, summary: Yahoo Finance Live’s Brad Smith summarizes three key topics in markets to pay attention to on Monday morning., Headline: Seagen Stock Jumps After Pfizer Deal Report, source:Yahoo, summary: Shares of Seagen rose Monday morning after the Journal reported that drug giant [Pfizer was in talks](https://www.wsj.com/articles/pfizer-in-early-stage-talks-to-acquire-seagen-3f53309e) to acquire the biotechnology company. Seagen shares were recently ahead about 11%, while Pfizer's were off 1%. The talks are at an early stage and there is no guarantee there will be a deal, the Journal reported. Read today's [full markets roundup here](https://asset.wsj.net/dynamic-insets/charts/cdc_e9eaa35f6d4, Headline: Seagen, Union Pacific rise; Range Resources, Tegna fall, source:Associated Press, The, summary: No summary, Headline: NEW YORK CLOSE: US stocks end higher rising after worst week of 2023, source:Alliance News, summary: No summary, Headline: Health Care Down on Deal Doubts -- Health Care Roundup, source:MarketWatch, summary: Health-care companies ticked down amid doubts about the outlook for deal activity. Drug giant Pfizer is in talks to acquire oncology-oriented biotech company..., Headline: Fisker, Zillow, Seagen, Union Pacific stocks rise after back-to-back losses for S&P 500, source:Yahoo, summary: Yahoo Finance Live’s Brad Smith discusses Monday's trending tickers, including Fisker, Zillow, Seagen, and Union Pacific., Headline: Start Putting Together Your Shopping List For Beaten-Down Tech Stocks, source:SeekingAlpha, summary: Put together a stock shopping list. You have time to understand the stocks you are investing in., Headline: The 20 worst U.S. stocks in February: the biggest loser dropped 35%, source:MarketWatch, summary: No summary",SGEN
75,2023-02-28,"Headline: Morgan Stanley Reaffirms Their Buy Rating on Seagen (SGEN), source:TipRanks, summary: No summary, Headline: Seagen price target raised to $210 from $180 at Oppenheimer, source:Thefly.com, summary: No summary, Headline: Seagen CFO sells $3.65M in common stock, source:Thefly.com, summary: No summary, Headline: Guggenheim Sticks to Its Buy Rating for Seagen (SGEN), source:TipRanks, summary: No summary, Headline: Pfizer favored over Merck for Seagen acquisition: SVB analyst, source:Yahoo, summary: Seagen is once again an acquisition target this year, pursued by yet another partner, Pfizer. Last year, a deal with Merck fell through over price disagreements., Headline: Lightning Round: Pfizer's got a weaker pipeline than we thought, source:CNBC, summary: Mad Money host Jim Cramer weighs in on all manner of stocks, including Eli Lilly, Abbott Labs, Analog Devices, Pfizer, ADMA Biologics, Freyr Battery SA and Barrick Gold., Headline: This ETF Has 67% Upside Potential, According to Analysts, source:TipRanks, summary: No summary",SGEN
76,2023-03-01,"Headline: Pfizer/BioNTech seek U.S. emergency nod for updated COVID booster in kids, source:Seeking Alpha, summary: No summary, Headline: Estimating The Fair Value Of Seagen Inc. (NASDAQ:SGEN), source:Yahoo, summary: Key Insights Using the 2 Stage Free Cash Flow to Equity, Seagen fair value estimate is US$178 Current share price of..., Headline: Bears control the stock market for now, but these takeover plays can keep the bulls satisfied, source:MarketWatch, summary: No summary, Headline: Analysts` Opinions Are Mixed on These Healthcare Stocks: Jazz Pharmaceuticals (JAZZ), Seagen (SGEN) and IVERIC bio (ISEE), source:TipRanks, summary: No summary",SGEN
77,2023-03-02,"Headline: SVB says Pfizer could create value for holders with Seagen bid up to $253, source:Thefly.com, summary: No summary",SGEN
78,2023-03-05,"Headline: Pfizer: Crucial Moment For Buyers At Its 52-Week Low, source:SeekingAlpha, summary: Investors stampeded out of Pfizer stock this week, driving it to a 52-week low. Read more to see why we rate PFE stock a strong buy., Headline: The five-year returns have been impressive for Seagen (NASDAQ:SGEN) shareholders despite underlying losses increasing, source:Yahoo, summary: The worst result, after buying shares in a company (assuming no leverage), would be if you lose all the money you put..., Headline: Why Seagen is a top acquisition target?, source:Seeking Alpha, summary: No summary, Headline: Seagen seesaws amid report that Pfizer only bidder for the cancer-focused biotech, source:Seeking Alpha, summary: No summary, Headline: What To Expect From Pfizer In The Post-COVID-19 Era, source:SeekingAlpha, summary: In Q4 2022, the company's revenue was $24.29 billion, up 1.9% from the last three months of 2021, despite a significant decrease in people's desire to vaccinate against COVID-19.",SGEN
79,2023-03-06,"Headline: Seagen price target raised to $185 from $178 at Needham, source:Thefly.com, summary: No summary, Headline: Analysts Offer Insights on Healthcare Companies: Cytokinetics (CYTK), Seagen (SGEN) and BioVie (BIVI), source:TipRanks, summary: No summary, Headline: Health Care Down on Mixed Views For Deal Activity -- Health Care Roundup, source:MarketWatch, summary: Health-care companies ticked down as traders hedged their bets on the outlook for deal activity. Seagen's novel antibody drug conjugate cancer drugs have..., Headline: Seagen’s Cancer Therapy Is Making It a Takeover Target, source:Yahoo, summary: The unprofitable biotech that pioneered novel cancer agents has caught the attention of the world’s largest drugmakers.",SGEN
80,2023-03-07,"Headline: Wall Street Breakfast: Bigger Hikes Ahead?, source:SeekingAlpha, summary: Listen on the go! A daily podcast of Wall Street Breakfast will be available by 8:00 a.m. on Seeking Alpha, iTunes, Stitcher and Spotify.",SGEN
